Section,Section Appearance Order,Paragraph
ABSTRACT,0.0,"Abstract—This study delves into advanced optimization strate-
gies for planning and scheduling cross-regional energy systems,
with a focus on Hydrogen Energy Storage Systems (HESS).
Addressing the variability and unpredictability of renewable
energy sources, notably wind and solar power, it employs dynamic
programming (DP) and linear programming to enhance the op-
erational efficiency, reliability, and adaptability of interconnected
energy networks. The research develops robust optimization
models that facilitate seamless integration of renewable energy
into the grid, promoting a sustainable and resilient energy future.
It offers theoretical insights and practical guidance for the energy
sector, showcasing the application of DP and linear programming
in overcoming the challenges of renewable energy integration.
Index Terms—Dynamic programming, Linear programming,
Renewable energy integration, Hydrogen Energy Storage, Energy
system optimization"
INTRODUCTION,0.011494252873563218,I. INTRODUCTION
INTRODUCTION,0.022988505747126436,"As the global energy landscape undergoes a significant
transformation, the development and utilization of renewable
energy sources, particularly wind and solar energy, have gar-
nered extensive attention. However, the large-scale application
of these renewable sources in power systems is confronted
with numerous technical and economic challenges, primarily
due to their inherent intermittency and uncertainty [1]. The
optimization planning and scheduling of cross-regional en-
ergy systems and Hydrogen Energy Storage Systems (HESS)
emerge as crucial technological pathways to enhance energy
utilization efficiency, ensure energy security, and achieve car-
bon neutrality goals [2].
This study aims to tackle the issues of uneven distribution of
renewable energy and the necessity for cross-regional energy
complementarity. By optimizing the planning and scheduling
of HESS, we strive to improve the economic, reliable, and
flexible operation of energy systems. The outcomes of this
research not only facilitate the widespread application of
renewable energy, reducing carbon emissions, but also provide
theoretical support and technical guidance for the formulation
of electricity markets and energy policies, offering significant
theoretical and practical value [3].
The significance of optimizing cross-regional energy sys-
tems and HESS in achieving energy efficiency, security, and"
INTRODUCTION,0.034482758620689655,"factors [4]. Through the method of multi-objective particle
swarm optimization, optimal planning for hybrid electric-
hydrogen energy storage systems has been conducted, taking
into account economy, network losses, and voltage fluctuations
to reduce grid losses and improve voltage stability [5].
In the optimization problems of modern energy systems,
high dimensionality and complexity pose significant chal-
lenges. Traditional optimization methods often prove ineffi-
cient or incapable of finding global optima when addressing
such issues. Therefore, the adoption of efficient optimiza-
tion algorithms becomes key to research and application.
The application of differential evolution strategies, particle
swarm optimization techniques, genetic algorithms, simulated
annealing algorithms, and other evolutionary algorithms in
energy system optimization problems has demonstrated their
significant advantages in dealing with complex issues [6]."
CONCLUSION/DISCUSSION,0.04597701149425287,II. RESEARCH FINDINGS AND DISCUSSION
CONCLUSION/DISCUSSION,0.05747126436781609,"Our research findings shed light on the optimization plan-
ning and scheduling of cross-regional energy systems and
HESS. By employing advanced optimization algorithms, we
have successfully addressed the challenges posed by the inter-
mittent and uncertain nature of renewable energy sources. The
optimization models developed in this study not only promote
the efficient utilization of renewable energy across different
regions but also enhance the stability and reliability of the
energy system.
One of the key outcomes of this research is the development
of a robust optimization framework that incorporates the
uncertainties associated with renewable energy generation, es-
pecially wind and solar power. This framework enables energy
systems to maintain operational efficiency and reliability even
under fluctuating energy availability, thereby facilitating the
integration of a higher proportion of renewable energy into
the grid.
Furthermore, our study has explored the economic benefits
of optimizing HESS in cross-regional energy systems. By
strategically planning and scheduling HESS, we have demon-
strated the potential for significant cost savings in energy
production, storage, and distribution. This not only supports
the economic feasibility of renewable energy projects but also
contributes to reducing the overall carbon footprint of the
energy sector.
The research also highlights the importance of policy sup-
port and technological innovation in overcoming the barriers
to renewable energy integration. Our findings suggest that with
appropriate regulatory frameworks and continued advancement
in storage technologies, renewable energy can play a pivotal
role in achieving global energy sustainability and carbon
neutrality goals.
In conclusion, this study provides valuable insights into
the optimization of cross-regional energy systems and HESS.
The proposed optimization strategies and models contribute
to enhancing the efficiency, reliability, and sustainability of
energy systems, paving the way for a cleaner and more
sustainable energy future."
IMPLEMENTATION/METHODS,0.06896551724137931,III. MODEL DESCRIPTION
IMPLEMENTATION/METHODS,0.08045977011494253,"This model focuses on optimizing an urban power system
through the strategic planning and scheduling of a Hydrogen
Energy Storage System (HESS) within a single city, aiming
at balancing electricity demand and supply, minimizing costs,
and considering the transmission of stored electricity. It is
critical to note that the transmission cost applies solely to the
electricity stored by HESS, as the cost for basic electricity
demand is already included in the electricity price."
IMPLEMENTATION/METHODS,0.09195402298850575,A. Key Points
IMPLEMENTATION/METHODS,0.10344827586206896,"• Decision Variables: Include the storage and release
decisions of HESS, electricity purchase plans, and the
inter-city transmission of additional electricity scheduled
through HESS."
IMPLEMENTATION/METHODS,0.11494252873563218,"• Objective: To minimize the total operational costs of the
system, which comprises the cost of electricity purchases,
the operational cost of HESS, and the transmission cost
of electricity stored by HESS."
IMPLEMENTATION/METHODS,0.12643678160919541,• Constraints:
IMPLEMENTATION/METHODS,0.13793103448275862,"– Electricity balance must be maintained, ensuring
each city’s electricity demand is met every hour.
– Transmission is limited to the electricity stored by
HESS, within its capacity constraints.
– HESS operation must consider the charging and
discharging processes and capacity limits."
IMPLEMENTATION/METHODS,0.14942528735632185,B. Mathematical Representation
IMPLEMENTATION/METHODS,0.16091954022988506,"The model can be represented by the following mathemat-
ical expressions:"
IMPLEMENTATION/METHODS,0.1724137931034483,"Minimize
Z = n
X i=1"
IMPLEMENTATION/METHODS,0.1839080459770115,"23
X"
IMPLEMENTATION/METHODS,0.19540229885057472,"j=0
(Cpurchase,i,j+CHESS,i,j+Ctransmission,i,j)"
IMPLEMENTATION/METHODS,0.20689655172413793,"(1)
where:"
IMPLEMENTATION/METHODS,0.21839080459770116,• Z is the total cost.
IMPLEMENTATION/METHODS,0.22988505747126436,"• Cpurchase,i,j is the cost of purchasing electricity for city i
at hour j."
IMPLEMENTATION/METHODS,0.2413793103448276,"• CHESS,i,j is the operational cost of HESS for city i at
hour j."
IMPLEMENTATION/METHODS,0.25287356321839083,"• Ctransmission,i,j is the cost of transmitting electricity stored
by HESS for city i at hour j."
IMPLEMENTATION/METHODS,0.26436781609195403,"• n is the number of cities.
Subject to:"
IMPLEMENTATION/METHODS,0.27586206896551724,"23
X"
IMPLEMENTATION/METHODS,0.28735632183908044,"j=0
Di,j ="
IMPLEMENTATION/METHODS,0.2988505747126437,"23
X"
IMPLEMENTATION/METHODS,0.3103448275862069,"j=0
Si,j + Ri,j,
∀i
(2)"
IMPLEMENTATION/METHODS,0.3218390804597701,"where Di,j is the demand in city i at hour j, Si,j is the
supply purchased directly from the grid for city i at hour j,
and Ri,j is the electricity released from HESS for city i at
hour j."
IMPLEMENTATION/METHODS,0.3333333333333333,"where CapacityHESS,i is the capacity of HESS in city i.
These constraints ensure that the electricity demand is
met, the HESS operations are within capacity limits, and the
transmission costs are applied only to the electricity stored and
transmitted through HESS."
IMPLEMENTATION/METHODS,0.3448275862068966,"IV. DYNAMIC PROGRAMMING SOLUTION FOR
OPTIMIZING ELECTRICITY COSTS"
IMPLEMENTATION/METHODS,0.3563218390804598,"In light of the challenges posed by the inherent variability
and unpredictability of renewable energy sources, particularly
wind energy, this study introduces a dynamic programming
(DP) approach aimed at optimizing electricity costs within
urban power systems. This method specifically addresses the
utilization of Hydrogen Energy Storage Systems (HESS) to
achieve an optimal balance between energy demand and
supply, thereby minimizing operational costs and enhancing
system efficiency."
IMPLEMENTATION/METHODS,0.367816091954023,A. Problem Definition
IMPLEMENTATION/METHODS,0.3793103448275862,"The objective centers around the minimization of total
electricity costs over a 24-hour period, taking into account
varying electricity prices, demand patterns, and the operational
costs associated with utilizing stored energy. The system is
presented with the option to either purchase electricity at
fluctuating hourly rates or utilize energy previously stored in
the HESS. Additionally, the framework allows for the selling
of excess energy back to the grid, adding a layer of complexity
and opportunity for cost optimization."
IMPLEMENTATION/METHODS,0.39080459770114945,B. Algorithm Description
IMPLEMENTATION/METHODS,0.40229885057471265,"Our dynamic programming solution delineates a step-by-
step approach to compute the minimal cost associated with
electricity consumption, incorporating decisions on the quan-
tity of electricity to be purchased, stored, or sold at each hourly
interval. The DP algorithm employs a state representation
dp[i][j], where i signifies the hour, and j represents the
units of energy stored in HESS."
IMPLEMENTATION/METHODS,0.41379310344827586,"1) Initialization: The DP table is initialized with high
values to simulate infinity, except for the base case
dp[0][0], which is set based on the direct grid
purchase cost for the initial demand.
2) Iteratively, for each hour i from 1 to 23, the algorithm:"
IMPLEMENTATION/METHODS,0.42528735632183906,"• Computes
the
net
price
difference
delta_price[j]
for
buying
or
selling
energy, taking transmission costs into account,
and prioritizes transactions based on potential cost
savings or revenue generation."
IMPLEMENTATION/METHODS,0.4367816091954023,"• Evaluates each potential energy storage level j, up-
dating the DP table with the minimal cost scenario
that meets demand and adheres to HESS operational
constraints.
3) The optimal cost for the entire 24-hour cycle is identified
at dp[23][0], symbolizing the conclusion of the
day with no remaining stored energy, thus ensuring all
demands have been met efficiently."
IMPLEMENTATION/METHODS,0.4482758620689655,C. Mathematical Formulation
IMPLEMENTATION/METHODS,0.45977011494252873,The optimization process is governed by the equation:
IMPLEMENTATION/METHODS,0.47126436781609193,"dp[i][j] = min(dp[i][j], dp[i −1][k] + transaction cost), (4)"
IMPLEMENTATION/METHODS,0.4827586206896552,"with transaction cost encompassing the expenses of
purchasing, selling, and utilizing stored energy. This formula
iteratively updates the DP table to reflect the minimum achiev-
able costs, considering the operational parameters of HESS
and the dynamic nature of electricity pricing.
By employing this dynamic programming model, the study
advances a robust framework for enhancing the economic
efficiency of urban power systems equipped with HESS. This
approach not only aids in cost reduction but also contributes
to the stability and reliability of energy supply in the face of
fluctuating renewable energy outputs."
IMPLEMENTATION/METHODS,0.4942528735632184,D. Complexity Analysis
IMPLEMENTATION/METHODS,0.5057471264367817,"The algorithm iterates over 24 hours for each of the n cities,
evaluating different levels of energy storage up to the capacity,
adjusted by the gap. The computational complexity of this
approach is approximately given by:"
IMPLEMENTATION/METHODS,0.5172413793103449,O(24 × n × capacity
IMPLEMENTATION/METHODS,0.5287356321839081,"gap
× n),
(5)"
IMPLEMENTATION/METHODS,0.5402298850574713,"where the term
capacity"
IMPLEMENTATION/METHODS,0.5517241379310345,"gap
represents the number of discrete
energy levels considered for storage in the HESS. A smaller
gap increases the number of such levels, thereby expanding
the solution space and increasing computational requirements."
IMPLEMENTATION/METHODS,0.5632183908045977,E. Impact of Gap on Precision and Efficiency
IMPLEMENTATION/METHODS,0.5747126436781609,"The gap parameter plays a pivotal role in balancing the
trade-off between the algorithm’s computational efficiency and
the precision of its output:"
IMPLEMENTATION/METHODS,0.5862068965517241,"• Smaller Gap: Opting for a smaller gap enhances the
solution’s precision by examining a finer granularity
of storage levels. This thorough exploration increases
the likelihood of identifying an optimal or near-optimal
solution but at the expense of higher computational
complexity."
IMPLEMENTATION/METHODS,0.5977011494252874,"• Larger Gap: Conversely, a larger gap simplifies the
solution space, leading to reduced computational time.
However, this efficiency gain comes at the potential cost
of precision, as the coarser granularity might overlook
more refined and possibly better solutions."
IMPLEMENTATION/METHODS,0.6091954022988506,"V. OPTIMIZING ELECTRICITY DISTRIBUTION WITH HESS
THROUGH LINEAR PROGRAMMING AND FLOW NETWORKS"
IMPLEMENTATION/METHODS,0.6206896551724138,A. Linear Programming Formulation
IMPLEMENTATION/METHODS,0.632183908045977,"The initial step involves formulating the problem as a linear
programming model to minimize the total operational costs
of electricity distribution, including the costs associated with
purchasing electricity, transmission, and utilizing HESS for
energy storage and release.
1) Objective Function: The objective is to minimize the
total cost, defined as:"
IMPLEMENTATION/METHODS,0.6436781609195402,"min Z = N
X i=1 T
X"
IMPLEMENTATION/METHODS,0.6551724137931034,"t=1
(Cpurchase,i,t +Ctransmission,i,t +CHESS,i,t) (6)"
IMPLEMENTATION/METHODS,0.6666666666666666,"where N is the number of cities, T is the number of time
periods (hours in this case), Cpurchase,i,t is the cost of purchas-
ing electricity for city i at time t, Ctransmission,i,t is the cost of
transmitting electricity, and CHESS,i,t represents the operational
costs of HESS.
2) Constraints: The model includes constraints for electric-
ity demand satisfaction, HESS operational limits, and trans-
mission capacity, among others, ensuring that the solution
adheres to practical limitations and requirements."
IMPLEMENTATION/METHODS,0.6781609195402298,B. Transition to Flow Network Model
IMPLEMENTATION/METHODS,0.6896551724137931,"While the LP formulation provides a solid foundation
for understanding the problem’s structure and constraints,
the specific nature of electricity distribution—characterized
by directed flows of electricity between nodes (cities) over
time—lends itself well to representation as a flow network.
Thus, we transition from the abstract LP model to a more
concrete flow network model to leverage algorithmic efficien-
cies and gain additional insights."
IMPLEMENTATION/METHODS,0.7011494252873564,C. Flow Network Model Construction
IMPLEMENTATION/METHODS,0.7126436781609196,"In the flow network model, cities are represented as nodes,
and edges denote potential electricity flows, encapsulating
buying, selling, and storing operations with associated costs
and capacities.
1) Graph Configuration:"
IMPLEMENTATION/METHODS,0.7241379310344828,"• Nodes: Each city at each hour is represented as a node in
the graph, alongside special nodes for HESS operations."
IMPLEMENTATION/METHODS,0.735632183908046,"• Edges: Edges between nodes represent possible transac-
tions, with costs reflecting prices, transmission fees, and
HESS operational costs.
2) Flow Network Optimization: The optimization now aims
to find the minimum-cost flow through this network that satis-
fies all demand and operational constraints, effectively solving
the original LP problem within a flow network framework."
IMPLEMENTATION/METHODS,0.7471264367816092,D. Mathematical Formulation of Flow Network
IMPLEMENTATION/METHODS,0.7586206896551724,"The flow network problem is formulated as: min
X"
IMPLEMENTATION/METHODS,0.7701149425287356,"(u,v)∈E
costuv × flowuv
(7)"
IMPLEMENTATION/METHODS,0.7816091954022989,"where costuv is the cost associated with the flow on edge
(u, v), and flowuv is the quantity of electricity transmitted
through edge (u, v)."
IMPLEMENTATION/METHODS,0.7931034482758621,E. Computational Complexity and Extensions
IMPLEMENTATION/METHODS,0.8045977011494253,"The computational complexity of the network flow ap-
proach, specifically the Minimum Cost Maximum Flow
(MCMF) algorithm, primarily depends on the graph’s struc-
ture, including the number of nodes (N) and edges (E). For
algorithms like the Successive Shortest Path (SSP), which is
commonly employed for MCMF problems, the computational
complexity is generally represented as O(N 2·E+N·E log N).
This estimation accounts for the worst-case scenario where up
to O(E) augmenting paths might be necessary, with each path
finding operation, assuming the use of Dijkstra’s algorithm
with a Fibonacci heap, taking up to O(N log N), in addition
to O(N · E) for capacity adjustments across the graph.
1) Dynamic Electricity Pricing: Integrating dynamic elec-
tricity pricing into the network flow model adds another layer
of complexity but also enhances its realism and applicability.
By dynamically adjusting the costs associated with edges
in the graph to reflect real-time or market-based electricity
pricing, the model can more accurately simulate operational
decisions and optimize for cost efficiency.
2) Renewable Energy Integration: The variability and un-
predictability of renewable energy sources pose both a chal-
lenge and an opportunity for the flow network model. By
representing renewable energy sources as nodes with vari-
able edge capacities—reflecting the fluctuating availability of
generated power—the model can be extended to optimize the
distribution and storage of renewable energy within the urban
grid. This integration not only addresses the challenge of re-
newable energy intermittency but also leverages its potential to
reduce dependence on traditional energy sources and decrease
overall carbon emissions.
3) Conclusion on Extensions: These extensions—dynamic
pricing and renewable energy integration—underscore the
adaptability and potential of the flow network model in
addressing contemporary challenges in urban electricity dis-
tribution. By accounting for the complexities of real-world
operations, the model stands as a robust tool for planning and
optimization in the evolving landscape of energy management."
IMPLEMENTATION/METHODS,0.8160919540229885,F. Implementation and Solution
IMPLEMENTATION/METHODS,0.8275862068965517,"The formulated flow network problem can be efficiently
solved using algorithms designed for min-cost flow problems,
providing an optimal strategy for electricity procurement,
HESS operation, and distribution."
IMPLEMENTATION/METHODS,0.8390804597701149,G. Conclusion
CONCLUSION/DISCUSSION,0.8505747126436781,VI. CONCLUSION
CONCLUSION/DISCUSSION,0.8620689655172413,"This research has significantly contributed to the field of
renewable energy optimization, particularly focusing on cross-
regional energy systems and Hydrogen Energy Storage Sys-
tems (HESS). The findings underscore the importance of ad-
vanced optimization techniques and algorithms in addressing
the intermittency and uncertainty inherent in renewable energy
sources like wind and solar power. By leveraging these tech-
niques, we have demonstrated potential pathways to enhance
the efficiency, reliability, and flexibility of energy systems,
which are crucial for transitioning towards sustainable energy
practices."
CONCLUSION/DISCUSSION,0.8735632183908046,A. Implications for Practice and Policy
CONCLUSION/DISCUSSION,0.8850574712643678,"The practical applications of this study are manifold. For
energy system operators, the optimization models developed
herein offer a blueprint for integrating renewable energy
sources more effectively, potentially reducing reliance on fossil
fuels and lowering carbon emissions. This, in turn, supports
the broader goal of achieving carbon neutrality in energy
production and consumption. For policymakers, the research
highlights the need for supportive regulatory frameworks that
facilitate the adoption of advanced energy storage solutions
and cross-regional energy cooperation. Policies that incen-
tivize the development of renewable energy technologies and
infrastructure can accelerate the transition towards a more
sustainable and secure energy future."
CONCLUSION/DISCUSSION,0.896551724137931,B. Future Research Directions
CONCLUSION/DISCUSSION,0.9080459770114943,"While this study has made substantial advancements, several
avenues for future research remain open. Firstly, the integra-
tion of more diverse renewable energy sources and storage
technologies could be explored to further bolster system re-
silience and sustainability. Secondly, the development of real-
time optimization algorithms that can dynamically respond
to changes in energy demand and supply conditions would
significantly enhance operational efficiency. Additionally, fu-
ture studies could investigate the socio-economic impacts of
widespread renewable energy adoption, including job creation,
energy prices, and community well-being."
CONCLUSION/DISCUSSION,0.9195402298850575,C. Recommendations for Future Work
CONCLUSION/DISCUSSION,0.9310344827586207,"To build on the findings of this study, future work should
aim to:"
CONCLUSION/DISCUSSION,0.9425287356321839,"• Explore the application of the proposed optimization
models in different geographic and climatic conditions
to validate their universality and adaptability."
CONCLUSION/DISCUSSION,0.9540229885057471,"• Develop more sophisticated models that incorporate
emerging technologies such as artificial intelligence and
blockchain for energy trading and management."
CONCLUSION/DISCUSSION,0.9655172413793104,"• Conduct comprehensive cost-benefit analyses of imple-
menting HESS and other storage solutions at scale,
including considerations of environmental impact and
return on investment."
CONCLUSION/DISCUSSION,0.9770114942528736,"• Engage with stakeholders across the energy sector to
identify barriers to implementation and strategies for
overcoming these challenges.
In conclusion, this research represents a significant step
forward in the quest for sustainable energy solutions. By
addressing key challenges associated with renewable energy
integration, the study not only contributes to academic knowl-
edge but also provides practical insights for enhancing energy
system performance. As we continue to advance in this field,
it is imperative that research, policy, and practice evolve in
tandem to fully realize the potential of renewable energy in
achieving global sustainability goals."
REFERENCES,0.9885057471264368,REFERENCES
