Section,Section Appearance Order,Paragraph
ESTIMATION ERROR BY AMOUNT OF TRAINING DATA,0.2742616033755274,"Our previous experiment trained languages models on a set of 1M sequences. A plausible expla-
nation for the model’s underestimation behaviour on unseen test sequences is therefore that the
language model has not seen enough samples from the target distribution. Here we explore how"
ESTIMATION ERROR BY AMOUNT OF TRAINING DATA,0.27848101265822783,Published as a conference paper at ICLR 2022
ESTIMATION ERROR BY AMOUNT OF TRAINING DATA,0.28270042194092826,"Figure 5: GPT2-medium estimation behaviour for 15M sequences in Σ∗across two dimensions:
sequence rarity (x-axis) and degree of perturbation (y-axis). The heat map is shaded based on
estimation error severity; blue areas indicate overestimation, whereas brown areas indicate underes-
timation. We also include example sequences from two zones in this sequence space."
ESTIMATION ERROR BY AMOUNT OF TRAINING DATA,0.2869198312236287,"estimation error varies as a function of the amount of training data. We train GPT2-medium, GPT2-
large and an LSTM model in the online “Ideal World” setting (Nakkiran et al., 2020) by sampling,
at the beginning of each training iteration, a fresh set of 500,000 sequences from pL, and training
M on this sample. Doing so for 60 iterations, we obtain LMs which have been trained on 30 million
sequences. We compute model estimation error on Dtest at the end of each iteration i. Figure 4 vi-
sualizes underestimation error throughout training for these LMs. We again split test sequences by
their true probability, with darker lines denoting estimation trends for less probable target sequences."
ESTIMATION ERROR BY AMOUNT OF TRAINING DATA,0.2911392405063291,"The estimation curves in Figure 4 suggest that while increasing the amount of data in training ini-
tially leads to lower estimation error, this reduction eventually asymptotes. In the insets of Figure 4,
we visualize the relative change in mean estimation between epochs i −1 and i. Relative change in
estimation error eventually ﬂuctuates around 0 (minimal change) for the majority of the distribution.
Comparing architectures, we ﬁnd that the Transformer is signiﬁcantly more efﬁcient at reducing
mean estimation error throughout the distribution."
ESTIMATION ERROR BY AMOUNT OF TRAINING DATA,0.29535864978902954,"4.4
WHERE DID THE PROBABILITY MASS GO?"
ESTIMATION ERROR BY AMOUNT OF TRAINING DATA,0.29957805907172996,"In the previous section, we saw that even when increasing the amount of training data, pM consis-
tently underestimates the probabilities of sequences sampled from the tail of pL. At the same time,
we did not ﬁnd that pM overestimated sequences in the head of pL. Under the assumption that pM is
a proper probability distribution,5 that is, P"
ESTIMATION ERROR BY AMOUNT OF TRAINING DATA,0.3037974683544304,"x∈Σ∗pM(x) = 1, these ﬁndings suggest that there ex-
ists sequences in Σ∗whose probability is overestimated by the model. In this section, we investigate
where this probability mass went."
ESTIMATION ERROR BY AMOUNT OF TRAINING DATA,0.3080168776371308,"Swap two tokens in x.
Delete a token from x.
Insert a token from Σ
at a position in x.
Substitute a token in x
with a token from Σ."
ESTIMATION ERROR BY AMOUNT OF TRAINING DATA,0.31223628691983124,"Table 3: PERTURB(x) randomly ap-
plies one of these perturbations to x."
ESTIMATION ERROR BY AMOUNT OF TRAINING DATA,0.31645569620253167,"To do so, we compute model estimation error on perturbed
sequences from pL—sequences in Σ∗which are increasingly
far away from the high-probability zones in pL.
We build
a corpus of perturbed sequences by recursively applying 30
random perturbations to each sequence x ∈Dtest. Formally,
the set of sequences at perturbation step i can be expressed
as: D(i)
perturbed = {PERTURB(x) | x ∈D(i−1)
perturbed} where"
ESTIMATION ERROR BY AMOUNT OF TRAINING DATA,0.3206751054852321,"PERTURB(x) is a function which returns a novel perturbed
version of x, and D(0)
perturbed = Dtest. Sequence perturbation
operations are shown in Table 3. While it is possible that these
operations produce other well-formed strings, we expect this to be a relatively rare outcome. We
score each of these 15M sequences under both the target generative model pL and the LM pM. Note
that we use as LM the GPT2-medium model from the previous section (trained on 30M sequences)."
ESTIMATION ERROR BY AMOUNT OF TRAINING DATA,0.32489451476793246,5See Welleck et al. (2020a) for discussion on consistency in the context of neural language model decoding.
ESTIMATION ERROR BY AMOUNT OF TRAINING DATA,0.3291139240506329,Published as a conference paper at ICLR 2022
ESTIMATION ERROR BY AMOUNT OF TRAINING DATA,0.3333333333333333,"Figure 6: Model estimation error on test sequences as a function of target sequence probability for
three different artiﬁcial languages. Each line visualizes estimation error for a GPT2-medium model
trained to model a language with a speciﬁc softmax temperature parameter T."
ESTIMATION ERROR BY AMOUNT OF TRAINING DATA,0.33755274261603374,"Figure 5 visualizes GPT2-medium’s mean estimation error for these 15M sequences across two
dimensions. On the x-axis, we plot the target probability of the sequence under pL, and on the y-
axis, the number of perturbations performed on the sequence. For example, the bottom-left corner
(1) of Figure 5 visualizes estimation behaviour for rare sequences sampled directly from pL, whereas
the top-left corner (2) visualizes estimation error sequences which are equally rare, but which have
been perturbed up to 30 times."
ESTIMATION ERROR BY AMOUNT OF TRAINING DATA,0.34177215189873417,"Figure 5 offers a nuanced characterization of underestimation behaviour. The brown area on the
bottom of the ﬁgure re-states the underestimation ﬁndings of the previous section. When increasing
the number of perturbations performed, however, we begin entering into a space of sequences which
are at ﬁrst well-estimated by pM (the white areas) but then are quickly overestimated by pM (the
dark blue areas), conﬁrming that there are indeed sequences in Σ∗which are overestimated by the
language model. Furthermore, these ﬁndings suggest that the tail of rare events deﬁned by the
language model does not match the tail of the artiﬁcial language—the rare events typical in pL are
under-represented in pM in favour of other sequences in Σ∗. See Section A.1.4 for experiments
ﬁnding that random sequences from Σ∗are also overestimated by pM."
MODULATING THE SHAPE OF THE TARGET DISTRIBUTION,0.3459915611814346,"4.5
MODULATING THE SHAPE OF THE TARGET DISTRIBUTION"
MODULATING THE SHAPE OF THE TARGET DISTRIBUTION,0.350210970464135,"Up to this point, the target artiﬁcial language pL was given as the distribution induced by an ancestral
sampling scheme with softmax T = 0.85 from the generative model L. In the previous section, we
saw that pM placed excess probability mass on areas in Σ∗with low-probability under pL. Here we
modulate the shape of the sequence space deﬁned by pL to investigate how estimation error varies
with respect to systematic interventions in the target distribution. To adjust the way that pL allocates
probability mass over Σ∗, we control the entropy of the conditional distributions at each generation
step t by dividing the pre-softmax logits by a temperature value T.6"
MODULATING THE SHAPE OF THE TARGET DISTRIBUTION,0.35443037974683544,"We visualize the effects of T on the shape of the distribution in the left of Figure 6. By increasing
the value of T, we increase the entropy of the distributions over next tokens, which in turn, spreads
probability mass across a larger number of sequences in Σ∗. We deﬁne four artiﬁcial languages
with varying T and train GPT2-medium on an ancestral sample of 1M sequences from each of these
artiﬁcial languages. Figure 6 visualizes model estimation error by true sequence probability for
each model. We ﬁnd that models trained on languages with increased entropy perform compara-
tively better than models trained on low entropy languages. Estimation error for models trained on
languages with greater T is less severe, and this holds throughout nearly all target sequence prob-
abilities. These results indicate that neural LMs provide a more accurate approximation of target
distributions which spread mass more uniformly across Σ∗."
RELATED WORK,0.35864978902953587,"5
RELATED WORK"
RELATED WORK,0.3628691983122363,"This paper contributes to recent work investigating the properties of the distributions deﬁned by
LMs. Prior studies have focused on exploring (Takahashi & Tanaka-Ishii, 2019; 2017) and develop-"
RELATED WORK,0.3670886075949367,"6Formally, for the ith component of the length K pre-softmax logits x, this operation is given as:"
RELATED WORK,0.37130801687763715,"SOFTMAX(x)i =
exp( xi"
RELATED WORK,0.3755274261603376,"T )
PK
j=1 exp (
xj T )"
RELATED WORK,0.379746835443038,Published as a conference paper at ICLR 2022
RELATED WORK,0.38396624472573837,"ing frameworks (Meister & Cotterell, 2021) to better understand whether the large-scale statistical
tendencies of natural language, such as Zipf’s law (Zipf, 1949), are captured by LMs. We take a
more ﬁne-grained approach, proposing a methodology which draws off of instance-level evaluation
schemes (Zhong et al., 2021) and the experimental control afforded by artiﬁcial corpora (White &
Cotterell, 2021; Papadimitriou & Jurafsky, 2020). Indeed, closely related to our work is Kulikov
et al. (2021)’s, in which artiﬁcial corpora produced by generative models were used to explore mode
recovery in neural language modeling. Our analysis exploring the overestimation of ill-formed
sequences extends previous ﬁndings on locally normalized conditional models assigning arbitrary
probability mass to unlikely sequences (Andor et al., 2016; Goyal et al., 2019; Lafferty et al., 2001),
neural LMs assigning high likelihood to sequences with repetitions (Welleck et al., 2020b), the con-
sistency of decoding algorithms (Welleck et al., 2020a), and on machine translation models placing
signiﬁcant probability mass on the empty sequence (Stahlberg & Byrne, 2019)."
RELATED WORK,0.3881856540084388,"We additionally contribute to the body work seeking to characterize and adapt neural model per-
formance on rare or novel examples and classes (Horn & Perona, 2017; Bengio, 2015). In the
context of language modeling, Lent et al. (2021) explored performance on under-resourced lan-
guages, whereas Oren et al. (2019) did so on under-represented domains in training corpora. Mc-
Coy et al. (2021) introduced analyses to assess sequential and syntactic novelty in LMs. Focusing
on the word frequency distribution, Dudy & Bedrick (2020) found that LMs under-perform when
less frequent examples are encountered at test time. In the classiﬁcation setting, various approaches
have been proposed to help alleviate class imbalance in the data distribution, such as data aug-
mentation (Sagawa et al., 2020) or the transfer of knowledge from high-frequency classes to infre-
quent ones (Ouyang et al., 2016; Zhu et al., 2014; Chen et al., 2021). Prior to the current neural
paradigm (Bengio et al., 2003), multiple approaches have been proposed to deal with the heavy-tail,
such as smoothing and back-off approaches in statistical n-grams (Chen & Goodman, 1999) and
two-stage Bayesian approaches (Goldwater et al., 2006)."
CONCLUSION,0.3924050632911392,"6
CONCLUSION"
CONCLUSION,0.39662447257383965,"Emerging as a result of a language user’s ability to produce and comprehend novel expressions, the
heavy-tail of rare events is one of the fundamental features of distributions in natural language. In
this work, we introduce a controlled methodology to evaluate instance-level LM performance on
this set of individually rare but collectively frequent events. We use generative models trained on
natural language corpora to deﬁne a set of artiﬁcial languages for which we can exactly compute the
probability of sequences. Training LSTM and Transformer LMs on sequences sampled from these
artiﬁcial languages, our analysis compares the probability estimates given to sequences by the LMs
to the target probabilities of sequences under the artiﬁcial language."
CONCLUSION,0.4008438818565401,"Our results indicate that neural LMs systematically under-represent sequences in the tail of the target
distribution, even when increasing the amount of the training data. Investigating where this proba-
bility mass went, our perturbation experiments reveal that neural LMs do not tend to overestimate
the head of the distribution, but rather overestimate the probability of sequences outside those typ-
ical in the target distribution. Comparing model performance on target distributions with varying
properties, we ﬁnd that neural LMs tend to provide more accurate approximations of distributions
with greater entropy. Interpreted together, these results indicate that autoregressive neural language
models have a tendency to spread probability mass too uniformly across the space of possible se-
quences."
CONCLUSION,0.4050632911392405,"Finally, we would like to acknowledge that we do not know the degree of structural difference
between our Transformer-generated ground-truth distributions and the distributions of actual natural
languages. It is likely that the distribution deﬁned by our ground truth models is less structured
than the distribution of a natural language. Therefore, it is possible that some systematic difference
between natural language distributions and our ground-truth distributions may affect our results to
a certain degree. That being said, our experiments in Section 4.5 suggest that it may actually be
easier for neural LMs to learn less structured distributions, and we expect the task of recovering
a ground-truth distribution to be made easier when the target distribution and LM are in the same
model class. Nevertheless, future work should seek to conduct similar experiments using ground-
truth distributions with more explicit structure."
CONCLUSION,0.4092827004219409,Published as a conference paper at ICLR 2022
REFERENCES,0.41350210970464135,REFERENCES
REFERENCES,0.4177215189873418,"Daniel Andor, Chris Alberti, David Weiss, Aliaksei Severyn, Alessandro Presta, Kuzman Ganchev,
Slav Petrov, and Michael Collins. Globally normalized transition-based neural networks, 2016."
REFERENCES,0.4219409282700422,R. Baayen. Word frequency distributions. 2001.
REFERENCES,0.42616033755274263,"R. Harald Baayen. Productivity in language production. Language and Cognitive Processes, 9(3):
447–469, 1994. doi: 10.1080/01690969408402127. URL https://doi.org/10.1080/
01690969408402127."
REFERENCES,0.43037974683544306,"R Harald Baayen. 41. corpus linguistics in morphology: Morphological productivity. In Corpus
linguistics, pp. 899–919. De Gruyter Mouton, 2009."
REFERENCES,0.4345991561181435,"Samy Bengio. The battle against the long tail. In Talk on Workshop on Big Data and Statistical
Machine Learning, volume 1, 2015."
REFERENCES,0.4388185654008439,"Yoshua Bengio, R´ejean Ducharme, Pascal Vincent, and Christian Janvin. A neural probabilistic
language model. The journal of machine learning research, 3:1137–1155, 2003."
REFERENCES,0.4430379746835443,"Terra Blevins and Luke Zettlemoyer. Moving down the long tail of word sense disambiguation with
gloss-informed biencoders. CoRR, abs/2005.02590, 2020. URL https://arxiv.org/abs/
2005.02590."
REFERENCES,0.4472573839662447,"Howard Chen, Mengzhou Xia, and Danqi Chen. Non-parametric few-shot learning for word sense
disambiguation. arXiv preprint arXiv:2104.12677, 2021."
REFERENCES,0.45147679324894513,"Stanley F Chen and Joshua Goodman. An empirical study of smoothing techniques for language
modeling. Computer Speech & Language, 13(4):359–394, 1999."
REFERENCES,0.45569620253164556,"N. Chomsky.
The Logical Structure of Linguistic Theory.
Springer US, 1975, 1955.
ISBN
9780306307607. URL https://books.google.ca/books?id=1D66ktXOITAC."
REFERENCES,0.459915611814346,"Paula Czarnowska, Sebastian Ruder, Edouard Grave, Ryan Cotterell, and Ann Copestake. Don’t for-
get the long tail! a comprehensive analysis of morphological generalization in bilingual lexicon
induction. In Proceedings of the 2019 Conference on Empirical Methods in Natural Language
Processing and the 9th International Joint Conference on Natural Language Processing (EMNLP-
IJCNLP), pp. 974–983, Hong Kong, China, November 2019. Association for Computational Lin-
guistics. doi: 10.18653/v1/D19-1090. URL https://aclanthology.org/D19-1090."
REFERENCES,0.4641350210970464,"Daniel D’souza, Zach Nussbaum, Chirag Agarwal, and Sara Hooker. A tale of two long tails. arXiv
preprint arXiv:2107.13098, 2021."
REFERENCES,0.46835443037974683,"Shiran Dudy and Steven Bedrick. Are some words worth more than others?, 2020."
REFERENCES,0.47257383966244726,"Jerry A Fodor. The language of thought, volume 5. Harvard university press, 1975."
REFERENCES,0.4767932489451477,"Jerry A Fodor and Zenon W Pylyshyn. Connectionism and cognitive architecture: A critical analy-
sis. Cognition, 28(1-2):3–71, 1988."
REFERENCES,0.4810126582278481,"Aaron Gokaslan and Vanya Cohen. Openwebtext corpus. http://Skylion007.github.io/
OpenWebTextCorpus, 2019."
REFERENCES,0.48523206751054854,"Sharon Goldwater,
Mark Johnson,
and Thomas Grifﬁths.
Interpolating between types
and tokens by estimating power-law generators.
In Y. Weiss,
B. Sch¨olkopf,
and
J. Platt (eds.), Advances in Neural Information Processing Systems, volume 18. MIT
Press,
2006.
URL
https://proceedings.neurips.cc/paper/2005/file/
4b21cf96d4cf612f239a6c322b10c8fe-Paper.pdf."
REFERENCES,0.48945147679324896,"Sharon Goldwater, Thomas L. Grifﬁths, and Mark Johnson.
Producing power-law distribu-
tions and damping word frequencies with two-stage language models.
Journal of Machine
Learning Research, 12(68):2335–2382, 2011.
URL http://jmlr.org/papers/v12/
goldwater11a.html."
REFERENCES,0.4936708860759494,Published as a conference paper at ICLR 2022
REFERENCES,0.4978902953586498,"I. J. Good. The population frequencies of species and the estimation of population parameters.
Biometrika, 40(3/4):237–264, 1953.
ISSN 00063444.
URL http://www.jstor.org/
stable/2333344."
REFERENCES,0.5021097046413502,"Kartik Goyal, Chris Dyer, and Taylor Berg-Kirkpatrick. An empirical investigation of global and
local normalization for recurrent neural sequence models using a continuous relaxation to beam
search, 2019."
REFERENCES,0.5063291139240507,"Sepp Hochreiter and J¨urgen Schmidhuber. Long short-term memory. Neural computation, 9(8):
1735–1780, 1997."
REFERENCES,0.510548523206751,"Grant Van Horn and Pietro Perona. The devil is in the tails: Fine-grained classiﬁcation in the wild.
CoRR, abs/1709.01450, 2017. URL http://arxiv.org/abs/1709.01450."
REFERENCES,0.5147679324894515,F. Jelinek. Interpolated estimation of markov source parameters from sparse data. 1980.
REFERENCES,0.5189873417721519,"S. Katz. Estimation of probabilities from sparse data for the language model component of a speech
recognizer. IEEE Transactions on Acoustics, Speech, and Signal Processing, 35(3):400–401,
1987. doi: 10.1109/TASSP.1987.1165125."
REFERENCES,0.5232067510548524,E. Khmaladze. The statistical analysis of a large number of rare events. 1988.
REFERENCES,0.5274261603375527,"R. Kneser and H. Ney. Improved backing-off for m-gram language modeling. In 1995 International
Conference on Acoustics, Speech, and Signal Processing, volume 1, pp. 181–184 vol.1, 1995.
doi: 10.1109/ICASSP.1995.479394."
REFERENCES,0.5316455696202531,"Ilia Kulikov, Sean Welleck, and Kyunghyun Cho. Mode recovery in neural autoregressive sequence
modeling. CoRR, abs/2106.05459, 2021. URL https://arxiv.org/abs/2106.05459."
REFERENCES,0.5358649789029536,"John D. Lafferty, Andrew McCallum, and Fernando C. N. Pereira.
Conditional random ﬁelds:
Probabilistic models for segmenting and labeling sequence data. In Proceedings of the Eighteenth
International Conference on Machine Learning, ICML ’01, pp. 282–289, San Francisco, CA,
USA, 2001. Morgan Kaufmann Publishers Inc. ISBN 1558607781."
REFERENCES,0.540084388185654,"Heather Lent, Emanuele Bugliarello, Miryam de Lhoneux, Chen Qiu, and Anders Søgaard. On
language models for creoles, 2021."
REFERENCES,0.5443037974683544,"R Thomas McCoy, Paul Smolensky, Tal Linzen, Jianfeng Gao, and Asli Celikyilmaz. How much
do language models copy from their training data? evaluating linguistic novelty in text generation
using raven. arXiv preprint arXiv:2111.09509, 2021."
REFERENCES,0.5485232067510548,"Clara Meister and Ryan Cotterell. Language model evaluation beyond perplexity, 2021."
REFERENCES,0.5527426160337553,"G´abor Melis, Tom´aˇs Koˇcisk´y, and Phil Blunsom.
Mogriﬁer lstm.
In International Confer-
ence on Learning Representations, 2020. URL https://openreview.net/forum?id=
SJe5P6EYvS."
REFERENCES,0.5569620253164557,"Tom´aˇs Mikolov, Wen-tau Yih, and Geoffrey Zweig. Linguistic regularities in continuous space
word representations. In Proceedings of the 2013 conference of the north american chapter of the
association for computational linguistics: Human language technologies, pp. 746–751, 2013."
REFERENCES,0.5611814345991561,"Preetum Nakkiran, Behnam Neyshabur, and Hanie Sedghi. The deep bootstrap: Good online learn-
ers are good ofﬂine generalizers. CoRR, abs/2010.08127, 2020. URL https://arxiv.org/
abs/2010.08127."
REFERENCES,0.5654008438818565,"Yonatan Oren, Shiori Sagawa, Tatsunori B. Hashimoto, and Percy Liang. Distributionally robust
language modeling. In Proceedings of the 2019 Conference on Empirical Methods in Natural
Language Processing and the 9th International Joint Conference on Natural Language Process-
ing (EMNLP-IJCNLP), pp. 4227–4237, Hong Kong, China, November 2019. Association for
Computational Linguistics. doi: 10.18653/v1/D19-1432. URL https://aclanthology.
org/D19-1432."
REFERENCES,0.569620253164557,"Wanli Ouyang, Xiaogang Wang, Cong Zhang, and Xiaokang Yang.
Factors in ﬁnetuning deep
model for object detection with long-tail distribution. In Proceedings of the IEEE Conference on
Computer Vision and Pattern Recognition (CVPR), June 2016."
REFERENCES,0.5738396624472574,Published as a conference paper at ICLR 2022
REFERENCES,0.5780590717299579,"Isabel Papadimitriou and Dan Jurafsky. Pretraining on non-linguistic structure as a tool for analyzing
learning bias in language models. CoRR, abs/2004.14601, 2020. URL https://arxiv.org/
abs/2004.14601."
REFERENCES,0.5822784810126582,"Alec Radford, Jeff Wu, R. Child, David Luan, Dario Amodei, and Ilya Sutskever. Language models
are unsupervised multitask learners. 2019."
REFERENCES,0.5864978902953587,"Shiori Sagawa, Aditi Raghunathan, Pang Wei Koh, and Percy Liang.
An investigation of why
overparameterization exacerbates spurious correlations, 2020."
REFERENCES,0.5907172995780591,"Felix Stahlberg and Bill Byrne. On NMT search errors and model errors: Cat got your tongue?
In Proceedings of the 2019 Conference on Empirical Methods in Natural Language Processing
and the 9th International Joint Conference on Natural Language Processing (EMNLP-IJCNLP),
pp. 3356–3362, Hong Kong, China, November 2019. Association for Computational Linguistics.
doi: 10.18653/v1/D19-1331. URL https://aclanthology.org/D19-1331."
REFERENCES,0.5949367088607594,"Shuntaro Takahashi and Kumiko Tanaka-Ishii. Do neural nets learn statistical laws behind natural
language? PloS one, 12(12):e0189326, 2017."
REFERENCES,0.5991561181434599,"Shuntaro Takahashi and Kumiko Tanaka-Ishii. Evaluating Computational Language Models with
Scaling Properties of Natural Language. Computational Linguistics, 45(3):481–513, 09 2019.
ISSN 0891-2017. doi: 10.1162/coli a 00355. URL https://doi.org/10.1162/coli_
a_00355."
REFERENCES,0.6033755274261603,"Ashish Vaswani, Noam Shazeer, Niki Parmar, Jakob Uszkoreit, Llion Jones, Aidan N Gomez,
Łukasz Kaiser, and Illia Polosukhin. Attention is all you need. In Advances in neural information
processing systems, pp. 5998–6008, 2017."
REFERENCES,0.6075949367088608,"Sean Welleck, Ilia Kulikov, Jaedeok Kim, Richard Yuanzhe Pang, and Kyunghyun Cho. Consistency
of a recurrent language model with respect to incomplete decoding, 2020a."
REFERENCES,0.6118143459915611,"Sean Welleck, Ilia Kulikov, Stephen Roller, Emily Dinan, Kyunghyun Cho, and Jason Weston.
Neural text generation with unlikelihood training. In International Conference on Learning Rep-
resentations, 2020b. URL https://openreview.net/forum?id=SJeYe0NtvH."
REFERENCES,0.6160337552742616,"Jennifer C. White and Ryan Cotterell. Examining the inductive bias of neural language models with
artiﬁcial languages. CoRR, abs/2106.01044, 2021. URL https://arxiv.org/abs/2106.
01044."
REFERENCES,0.620253164556962,"Thomas Wolf, Lysandre Debut, Victor Sanh, Julien Chaumond, Clement Delangue, Anthony Moi,
Pierric Cistac, Tim Rault, Remi Louf, Morgan Funtowicz, Joe Davison, Sam Shleifer, Patrick
von Platen, Clara Ma, Yacine Jernite, Julien Plu, Canwen Xu, Teven Le Scao, Sylvain Gugger,
Mariama Drame, Quentin Lhoest, and Alexander Rush. Transformers: State-of-the-art natural
language processing. In Proceedings of the 2020 Conference on Empirical Methods in Natu-
ral Language Processing: System Demonstrations, pp. 38–45, Online, October 2020. Associ-
ation for Computational Linguistics.
doi: 10.18653/v1/2020.emnlp-demos.6.
URL https:
//aclanthology.org/2020.emnlp-demos.6."
REFERENCES,0.6244725738396625,"Frank Wood, Jan Gasthaus, C´edric Archambeau, Lancelot James, and Yee Whye Teh. The sequence
memoizer. Communications of the ACM, 54(2):91–98, 2011."
