Section,Section Appearance Order,Paragraph
MCGILL UNIVERSITY,0.0,"1McGill University
2Mila – Quebec Artiﬁcial Intelligence Institute 3Microsoft Research
4Canada CIFAR AI Chair, Mila"
ABSTRACT,0.004219409282700422,ABSTRACT
ABSTRACT,0.008438818565400843,"A fundamental characteristic of natural language is the high rate at which speak-
ers produce novel expressions. Because of this novelty, a heavy-tail of rare events
accounts for a signiﬁcant amount of the total probability mass of distributions
in language (Baayen, 2001). Standard language modeling metrics such as per-
plexity quantify the performance of language models (LM) in aggregate. As a
result, we have relatively little understanding of whether neural LMs accurately
estimate the probability of sequences in this heavy-tail of rare events. To address
this gap, we develop a controlled evaluation scheme which uses generative models
trained on natural data as artiﬁcial languages from which we can exactly compute
sequence probabilities. Training LMs on generations from these artiﬁcial lan-
guages, we compare the sequence-level probability estimates given by LMs to the
true probabilities in the target language. Our experiments reveal that LSTM and
Transformer language models (i) systematically underestimate the probability of
sequences drawn from the target language, and (ii) do so more severely for less-
probable sequences. Investigating where this probability mass went, (iii) we ﬁnd
that LMs tend to overestimate the probability of ill-formed (perturbed) sequences.
In addition, we ﬁnd that this underestimation behaviour (iv) is weakened, but not
eliminated by greater amounts of training data, and (v) is exacerbated for target
distributions with lower entropy."
INTRODUCTION,0.012658227848101266,"1
INTRODUCTION"
INTRODUCTION,0.016877637130801686,"Figure 1: GPT2 sequence probability es-
timates plotted against the true sequence
probabilities. Neural LMs underestimate the
probability of sequences drawn from the lan-
guage they are trained to model."
INTRODUCTION,0.02109704641350211,"Natural language is fundamentally creative—speakers
and listeners frequently produce and comprehend sen-
tences which have never been produced before (Fodor,
1975; Fodor & Pylyshyn, 1988; Chomsky, 1975, 1955).
As a side-effect of this property, distributions in natural
language are characterized by a heavy-tail of individu-
ally improbable events which collectively account for a
signiﬁcant amount of the total probability mass of the
distribution (Khmaladze, 1988; Baayen, 2001). Precisely
approximating this large number of rare events is one
of the foundational challenges for models of natural lan-
guage (Good, 1953; Jelinek, 1980; Katz, 1987; Kneser &
Ney, 1995; Wood et al., 2011; Goldwater et al., 2011).
Autoregressive neural language models (Bengio et al.,
2003; Mikolov et al., 2013; Radford et al., 2019) attempt
to do so by decomposing the probability of an event (a
sequence) into a series of conditional distributions, each
parameterized by a shared neural network."
INTRODUCTION,0.02531645569620253,"Recently, a growing body work has sought to understand
how these language models (LM) ﬁt the distribution of a language beyond standard measures such"
INTRODUCTION,0.029535864978902954,"†Corresponding author: benjamin.lebrun@mail.mcgill.ca
*Co-senior autorship"
INTRODUCTION,0.03375527426160337,Published as a conference paper at ICLR 2022
INTRODUCTION,0.0379746835443038,"as perplexity. Meister & Cotterell (2021), for example, investigated the statistical tendencies of the
distribution deﬁned by neural LMs, whereas Kulikov et al. (2021) explored whether they adequately
capture the modes of the distribution they attempt to model. At the same time, increased focus has
been given to performance on rare or novel events in the data distribution, both for models of natural
language (McCoy et al., 2021; Lent et al., 2021; Dudy & Bedrick, 2020; Oren et al., 2019) and neural
models more generally (see, for example Sagawa et al., 2020; D’souza et al., 2021; Chen et al., 2021;
Blevins & Zettlemoyer, 2020; Czarnowska et al., 2019; Horn & Perona, 2017; Ouyang et al., 2016;
Bengio, 2015; Zhu et al., 2014). Neither of these branches of work, however, has explored instance-
level LM performance on rare sequences in the distribution. As a result, we have relatively little
understanding of how neural LMs approximate sequences in the heavy-tail characteristic of natural
language."
INTRODUCTION,0.04219409282700422,"In this work, we introduce a controlled methodology to explore how LMs estimate the probability
of sequences in the heavy-tail of the distribution. Our instance-level evaluation scheme explicitly
compares the target probability distribution of the language to the distribution deﬁned by the LM.
Since the true distribution of any natural language is in practice unknown, we use a Transformer
LM trained on natural data as a generative model to deﬁne target artiﬁcial languages for which we
can exactly compute sequence probabilities. Training LSTM and Transformer LMs on sequences
sampled from these target artiﬁcial languages, we compare the sequence-level probability estimates
given by neural LMs to the target probabilities in the language. By controlling the entropy of the
generative model’s conditional distributions, we create a set of artiﬁcial languages with varying
distributional properties, and analyze how LM estimation behaviour is modulated by the properties
of the target distribution."
INTRODUCTION,0.046413502109704644,"Our experiments uncover the extent to which neural LMs provide a distorted ﬁt of the language
they are trained to model. We ﬁnd that LSTM and Transformer LMs (i) systematically underesti-
mate the probability of sequences drawn from the target language and (ii) do so more when such
sequences are rare. Where did this underestimated probability mass go? We do not ﬁnd that the
underestimation is accompanied by overestimation in the head of distribution. Rather, we ﬁnd that
LMs tend to (iii) overestimate the probability of rare perturbed (ill-formed) sequences. Interpreted
together, these ﬁndings indicate that on the one hand, neural LMs under-represent well-formed se-
quences in the tail of the language they attempt to model, and on the other hand, over-represent
ill-formed sequences far away from high probability zones in sequence-space. In addition, we ﬁnd
that (iv) greater amounts of training data lessen underestimation but do not eliminate it and that (v)
underestimation is exacerbated for target distributions with lower entropy."
BACKGROUND,0.05063291139240506,"2
BACKGROUND"
BACKGROUND,0.05485232067510549,"We begin by brieﬂy characterizing why distributions with a large number of rare events (LNRE)
emerge in natural language, and why these events pose challenges for LMs. Furthermore, we moti-
vate the need for instance-level evaluation when dealing with a large number of rare events."
BACKGROUND,0.05907172995780591,"Productivity
In the context of language production, a language user has the ability to produce,
at any given point in their linguistic lifespan, an utterance which they have never produced before.
This creativity is the result of the generative property of productivity, which states that on the basis
of ﬁnite linguistic experience, a language user can produce and comprehend an unbounded number
of grammatically acceptable utterances (Chomsky, 1975, 1955). Productive processes induce a dis-
tribution which places non-zero probability on unseen events at all practical sample sizes. Because
of this property, many of the distributions in natural language—particularly the distribution over the
sequences of a language—are characterized by a heavy-tail of rare events."
BACKGROUND,0.06329113924050633,"LNRE Zone
To make explicit the connection between productivity and a heavy-tail of rare events,
let PN denote the probability of sampling a novel (previously unseen) event from some distribution
after having sampled N events. Then productivity as described above states that PN > 0 for all
sample sizes N that occur in practice. The range of sample sizes N for which it is the case that
PN > 0 is known as the LNRE zone (Khmaladze, 1988; Baayen, 2001). The LNRE zone for
natural language appears to be very large, and it seems likely that PN will remain greater than 0 for
samples of natural language many orders of magnitude larger than all the data currently available"
BACKGROUND,0.06751054852320675,Published as a conference paper at ICLR 2022
BACKGROUND,0.07172995780590717,"for training LMs.1 In the LNRE zone, it is difﬁcult to obtain accurate estimates of the probability of
events using straightforward maximum likelihood estimation (MLE). Accounting for this enormous
amount of novelty is thus a central challenge in language modeling."
BACKGROUND,0.0759493670886076,"Language modeling
A model M of the language L attempts to deﬁne a distribution pM which
closely resembles the true distribution of the language pL. In a locally-normalized autoregressive
model, this distribution is deﬁned by assigning probabilities to variable length sequences x via a
chain-rule decomposition:"
BACKGROUND,0.08016877637130802,"p(x) = |x|
Y"
BACKGROUND,0.08438818565400844,"i=1
p(xi | x1:i−1) = |x|
Y i=1"
BACKGROUND,0.08860759493670886,"exp ρ(x1:i−1, xi)
P"
BACKGROUND,0.09282700421940929,"x∈Σ exp ρ(x1:i−1, x)
(1)"
BACKGROUND,0.0970464135021097,"where Σ is the vocabulary, and ρ(x1:i−1, xi; θ) is the non-negative score of token xi given the
sequence preﬁx x1:i−1, which is computed by a neural network with parameters θ."
BACKGROUND,0.10126582278481013,"For pM to perfectly approximate pL, we expect pM(x) = pL(x) for all x ∈Σ∗, where Σ∗is the
set of all strings of ﬁnite length (the Kleene closure of Σ). In the LNRE zone, pM is deﬁned over a
support containing a very large set of sequences which have never occurred in a training corpus (or
equivalently, have all occurred with frequency 0), and which take on a very wide array of differing
probabilities. For example, while the sequences x1, x2 ∈Σ∗have likely never occurred in any
sample of English, most would agree that x1 is far more probable than x2:"
BACKGROUND,0.10548523206751055,x1: The East pond in Parc Lafontaine was ﬁlled to the brim with Diet Coke.
BACKGROUND,0.10970464135021098,x2: Certain nak indicate liberationing among theorter codity voters vandalized.
BACKGROUND,0.11392405063291139,"LM Evaluation
For a perfect LM of English, we would expect the estimated probabilities of
the sequences x1 and x2 to match their probabilities under the true distribution pEnglish. However,
since pEnglish and it’s underlying generative process are unknown, it is not possible to explicitly
evaluate how closely instance-level probability estimates align. As a proxy, the mean perplexity of
the model on a holdout set of sequences D is typically used, which measures whether the model,
on average, assigns high likelihood to unseen instances. This measure does not, however, tell us
whether instance-level estimates align with their true counterparts, nor is it necessarily indicative of
performance on rare, idiosyncratic events in D. In this way, the lack of access to the ground-truth
distribution severely complicates LM evaluation on the heavy-tail of rare sequences in language.
The following section introduces a methodology to overcome these limitations."
LANGUAGE MODEL EVALUATION IN THE LNRE ZONE,0.11814345991561181,"3
LANGUAGE MODEL EVALUATION IN THE LNRE ZONE"
LANGUAGE MODEL EVALUATION IN THE LNRE ZONE,0.12236286919831224,"Component
Notation
Description"
LANGUAGE MODEL EVALUATION IN THE LNRE ZONE,0.12658227848101267,"Generative model
L
A LM trained on natural instance-level data.
Artiﬁcial language
pL
The distribution over sequences induced by a sampling scheme from L.
Language model
pM
The distribution of a LM trained on sequences sampled from pL.
Target probabilities
pL(x)
The probability assigned by pL to the sequence x.
Model probabilities
pM(x)
The probability assigned by pM to the sequence x."
LANGUAGE MODEL EVALUATION IN THE LNRE ZONE,0.1308016877637131,"Table 1: Components of our instance-level evaluation scheme. Training pM on samples from pL,
we compare pM(x) to pL(x) for x ∈Σ∗."
LANGUAGE MODEL EVALUATION IN THE LNRE ZONE,0.1350210970464135,"We propose evaluating language model performance on the heavy-tail of rare events via a known
probability distribution over sequences. Speciﬁcally, we train a Transformer LM on sequences sam-
pled from a corpus of natural language to deﬁne a generative model L. The distribution over se-
quences induced by a sampling scheme from L, denoted pL, is then our artiﬁcial language. We ex-
pect a model M of this artiﬁcial language to assign probabilities pM(x) to sequences x which match"
LANGUAGE MODEL EVALUATION IN THE LNRE ZONE,0.13924050632911392,"1For an empirical validation of this claim on a sample of practical size from the OpenWebText corpus, see
the Appendix."
LANGUAGE MODEL EVALUATION IN THE LNRE ZONE,0.14345991561181434,Published as a conference paper at ICLR 2022
LANGUAGE MODEL EVALUATION IN THE LNRE ZONE,0.14767932489451477,"the target probabilities pL(x) of x under pL. To characterize neural LM behaviour on rare events,
we train Transformer and LSTM LMs on data sampled from pL, and compare the instance-level
probability estimates given by pM to target probabilities under pL. We summarize the components
of this methodology in Table 1, and overview it in greater detail in the following section."
ARTIFICAL LANGUAGES AS TARGET DISTRIBUTIONS,0.1518987341772152,"3.1
ARTIFICAL LANGUAGES AS TARGET DISTRIBUTIONS"
ARTIFICAL LANGUAGES AS TARGET DISTRIBUTIONS,0.15611814345991562,"x
log pL(x)"
ARTIFICAL LANGUAGES AS TARGET DISTRIBUTIONS,0.16033755274261605,"“we’re very excited to have the opportunity to help them,” he says.
−29.3811
so what’s going to happen?
−17.4128
to me, the ﬁsheries are in the midst of a global ﬁnancial crisis.
−41.4835"
ARTIFICAL LANGUAGES AS TARGET DISTRIBUTIONS,0.16455696202531644,Table 2: Sample of sequences drawn from our artiﬁcial language.
ARTIFICAL LANGUAGES AS TARGET DISTRIBUTIONS,0.16877637130801687,"To deﬁne a generative model L, we train a randomly-initialized GPT2-medium on 1.5M sentences
sampled from the OpenWebText corpus (Gokaslan & Cohen, 2019).2 We set the maximum sequence
length to be 128 tokens. We additionally train a byte-pair-encoding (BPE) tokenizer on this data set
with a standard GPT2 vocabulary size of 57,256 tokens. For simplicity, this tokenizer is used for all
models."
ARTIFICAL LANGUAGES AS TARGET DISTRIBUTIONS,0.1729957805907173,"Using this generative model L, we deﬁne the target distribution over sequences—the artiﬁcial
language—as the distribution induced by an ancestral sampling scheme from L. Thus, we draw
instances x = (x1, . . . , x|x|) from our language pL by recursively sampling from the conditional
distribution over tokens at each time step: xt ∼pL(· | x<t) where x1 = BOS and xt = EOS. All
experiments up until Section 4.5 are conducted on the distribution induced by ancestrally sampling
from L with softmax temperature T = 0.85.3 In Section 4.5, we explore the effects of different
values of T when sampling from pL. Table 2 shows three sequences sampled from this distribution."
SEQUENCE PROBABILITY ESTIMATION IN THE LNRE ZONE,0.17721518987341772,"3.2
SEQUENCE PROBABILITY ESTIMATION IN THE LNRE ZONE"
SEQUENCE PROBABILITY ESTIMATION IN THE LNRE ZONE,0.18143459915611815,"Given an artiﬁcial language pL, the task of M—the language model—is to deﬁne a distribution
pM whose sequence-level probability estimates closely align with the sequence-level probabilities
given by pL. We refer to any deviation from this desiderata as model estimation error. To quantify
the model estimation error for a sequence x, we take the difference between the sequence’s log
probability under M and its true log probability under L:"
SEQUENCE PROBABILITY ESTIMATION IN THE LNRE ZONE,0.18565400843881857,"error(x) = log pM(x) −log pL(x)
(2)"
SEQUENCE PROBABILITY ESTIMATION IN THE LNRE ZONE,0.189873417721519,"This quantity is the log probability ratio, which measures, in log-space, the number of times more
or less likely the sequence x is under the language model M. Note that error(x) < 0 indicates that
M underestimates the probability of x, whereas error(x) > 0 indicates that M overestimates the
probability of x. In practice, we train M on a set of sequences Dtrain sampled from pL, and compute
model estimation error on a separate set of sequences Dtest sampled from pL. In all cases, we
compute the probability of a sequence x as its chain rule decomposition: p(x) = Q|x|
i=1 p(xi | x<i)
where x0 = BOS and x|x| = EOS. When computing the ground-truth sequence probabilities for
pL, we take into account any softmax tempering."
NEURAL LANGUAGE MODELS,0.1940928270042194,"3.3
NEURAL LANGUAGE MODELS"
NEURAL LANGUAGE MODELS,0.19831223628691982,"We study the estimation performance of two neural LM architectures: the Transformer (Vaswani
et al., 2017) and the LSTM (Melis et al., 2020). When training either architecture, we halve the
learning rate if validation loss increases at the end of an epoch. For all model sizes, we use a batch
size of 128 sequences. Models with the lowest cross-entropy loss on a withheld validation set are
used in experiments unless otherwise mentioned."
NEURAL LANGUAGE MODELS,0.20253164556962025,"2All Transformer implementations were obtained from Huggingface, and training was done on two or four
RTX-8000 GPUs (depending on model size) with mixed ﬂoating point precision.
3We temper in an effort to deﬁne a ground-truth distribution whose entropy more closely resembles that of
a natural language. Note that our ﬁndings hold for untempered (T = 1.00) ground-truth distributions as well
(see A.1.1 and A.1.2)."
NEURAL LANGUAGE MODELS,0.20675105485232068,Published as a conference paper at ICLR 2022
NEURAL LANGUAGE MODELS,0.2109704641350211,"Figure 2: Test sequence probability estimates given by neural LMs. Three left-most ﬁgures: The
joint histograms of sequence probability estimates. The dotted line denotes the cases in which the
model’s estimates perfectly align with the target probability; shading to the right of this line denotes
underestimation. Right-most ﬁgure: Mean sequence estimation error by target sequence probability."
NEURAL LANGUAGE MODELS,0.21518987341772153,"We use the Huggingface (Wolf et al., 2020) implementations of GPT2-small, GPT2-medium and
GPT2-large (Radford et al., 2019) as representative Transformer LMs. We use Adam Optimization
with ϵ = 1e−8 and learning rates α = 5e−5, α = 4e−5 and α = 3e−5 for GPT2-small, -medium and
-large respectively. Since these models are in the same model class as our artiﬁcial target language
pL, we expect the task of recovering the ground-truth distribution to be relatively easy compared to
the true problem faced in modeling natural language, where both the distribution and the underlying
generative process are unknown. For the LSTM (Hochreiter & Schmidhuber, 1997), we follow the
implementation of the baseline LM described in (Melis et al., 2020). We use 2 layers and adjust
the hidden state and embedding dimension (2048 and 1024, respectively) to be such that the total
number of parameters is approximately equal to GPT2-small (110M)."
RESULTS,0.21940928270042195,"4
RESULTS"
ESTIMATION ERROR WITH FIXED DATA,0.22362869198312235,"4.1
ESTIMATION ERROR WITH FIXED DATA"
ESTIMATION ERROR WITH FIXED DATA,0.22784810126582278,"We begin by exploring model estimation error on a ﬁxed training set Dtrain of 1M sequences sampled
from pL. We ﬁrst train LSTM and GPT models on Dtrain, early-stopping as described above. Fol-
lowing training, we sample a test set Dtest of 500,000 sequences from pL, and score each sequence
under both the model distribution pM and the true language distribution pL. From this, we obtain
a set of probability estimates: Stest = {⟨pL(x), pM(x)⟩| x ∈Dtest}. If the model M perfectly
models the language L, then for each ⟨pL(x), pM(x)⟩∈Stest we would expect pL(x) = pM(x).
Figures 2(A) and 2(B) visualize this relationship with the x- and y-axes denoting the true and model
estimated sequence probabilities respectively, and a dashed line representing equality. To compare
probability estimates, we represent the set Stest in the form of a joint histogram over this coordinate
space. Histogram bins are shaded based on the number of tuples which lie in the coordinate range
they deﬁne. Importantly, any deviation of this histogram from the identity line indicates that the
model distorts the shape of the distribution of the language."
ESTIMATION ERROR WITH FIXED DATA,0.2320675105485232,"Figures 2(A) and 2(B) provide evidence for distributional distortion in the form of underestimation.
The majority of probability tuples in Stest lie to the right of the identity line, indicating that LSTM
and GPT2 models consistently underestimate the probability of sequences sampled from pL. Fur-
thermore, the distance between the identity line and the probability tuples grows non-linearly as
function of the true sequence probability, indicating that underestimation error is more severe for
rarer sequences in the language. We validate these observations in the right-most plot of Figure
2, which shows mean estimation error decreasing non-linearly as a function of the target sequences
probability.4 In addition, comparing underestimation behaviour across model size, we ﬁnd that while
GPT2-medium performs slightly better than GPT2-small, these improvements are typically within
the range deﬁned by the bootstrapped 95% conﬁdence intervals. See A.1.3 for evidence indicating
that this underestimation behaviour also occurs in pre-trained models ﬁne-tuned on Dtrain."
ESTIMATION ERROR WITH FIXED DATA,0.23628691983122363,"4To compute this curve, we split the target sequence probability pL(x) range into N equally sized bins (by
probability range). We report the mean estimation error for each bin with > 10 sequences. We additionally
compute 95% conﬁdence intervals with 10, 000 bootstraps for each mean, resampling n equal to the number of
sequences in the given bin."
ESTIMATION ERROR WITH FIXED DATA,0.24050632911392406,Published as a conference paper at ICLR 2022
ESTIMATION ERROR WITH FIXED DATA,0.24472573839662448,"Figure 3: Mean model estimation error by training epoch (GPT2-medium). Each line denotes the
mean estimation error for a 50th of the sequences; darker lines represent less probable sequences.
The shaded area denotes the area in which validation cross-entropy reaches a minimum."
ESTIMATION ERROR ACROSS TRAINING TIME,0.2489451476793249,"4.2
ESTIMATION ERROR ACROSS TRAINING TIME"
ESTIMATION ERROR ACROSS TRAINING TIME,0.25316455696202533,"To understand the training dynamics underlying the previously reported underestimation, we com-
pute model probability estimates on subsets of Dtrain and Dtest at the end of each training iteration i.
Once computed, we sort each set of probability tuples S(i)
train and S(i)
test by their target sequence proba-
bilities pL(x), and split the probability tuples into 50 equally-sized bins. We plot estimation curves
in Figure 3: Each curve represents a 50th of the sequences, with darker curves denoting estimation
error for sequences with lower target probabilities (rarer sequences). At any given point, then, the
distance between estimation curves represents the degree to which estimation error is dependent on
the target probability of the sequence."
ESTIMATION ERROR ACROSS TRAINING TIME,0.25738396624472576,"Figure 3 left visualizes underestimation error for sequences seen in training. Around the ﬁfth epoch,
estimation error for train sentences converges to zero, that is (pL(x) ≈pM(x)), indicating that
GPT2-medium is able to almost perfectly recover the target probabilities of training sequences no
matter their target probability. At the same time, this convergence happens almost simultaneously
for all sequences, indicating that a complete reduction in error during training occurs throughout the
entire range of target sequence probabilities."
ESTIMATION ERROR ACROSS TRAINING TIME,0.2616033755274262,"Figure 3 right visualizes GPT2-medium model’s performance on a separate set of test sequences.
First, unlike for Dtrain, estimation error for Dtest does not converge to zero, meaning that even when
the model has perfectly recovered the target probability of train sequences, the target probabilities
for test sequences remain underestimated. Second, in the case of Dtrain, the difference between esti-
mation curves of different shades converges to zero, indicating that estimation performance becomes
uniform across the distribution of train sequences. We do not see such behaviour in Dtest. Instead,
the error curves remain at a relatively consistent distance from one another, indicating that the dis-
crepancy in estimation error at different parts of the distribution is unchanging for sequences not
seen during training."
ESTIMATION ERROR BY AMOUNT OF TRAINING DATA,0.26582278481012656,"4.3
ESTIMATION ERROR BY AMOUNT OF TRAINING DATA"
ESTIMATION ERROR BY AMOUNT OF TRAINING DATA,0.270042194092827,"Figure 4: GPT2-medium, GPT2-large and LSTM trained on 30M sequences sampled from pL.
Main plots: Mean estimation error on test sequences as a function of the number of sequences seen
in training. Inset plots: Relative change in mean estimation error of test sequences as a function of
the number of sequences seen in training. In both cases, each line denotes estimation behaviour for
a 50th of the test sequences; darker lines represent less probable sequences."
