Section,Section Appearance Order,Paragraph
ABSTRACT,0.0,ABSTRACT
ABSTRACT,0.0012626262626262627,"We consider a context-dependent Reinforcement Learning (RL) setting, which is
characterized by: a) an unknown ﬁnite number of not directly observable contexts;
b) abrupt (discontinuous) context changes occurring during an episode; and c)
Markovian context evolution. We argue that this challenging case is often met in
applications and we tackle it using a Bayesian model-based approach and varia-
tional inference. We adapt a sticky Hierarchical Dirichlet Process (HDP) prior for
model learning, which is arguably best-suited for inﬁnite Markov chain modeling.
We then derive a context distillation procedure, which identiﬁes and removes spuri-
ous contexts in an unsupervised fashion. We argue that the combination of these
two components allows inferring the number of contexts from data thus dealing
with the context cardinality assumption. We then ﬁnd the representation of the
optimal policy enabling efﬁcient policy learning using off-the-shelf RL algorithms.
Finally, we demonstrate empirically (using gym environments cart-pole swing-up,
drone, intersection) that our approach succeeds where state-of-the-art methods of
other frameworks fail and elaborate on the reasons for such failures."
INTRODUCTION,0.0025252525252525255,"1
INTRODUCTION"
INTRODUCTION,0.003787878787878788,"Our world becomes more automated every day with the development of self-driving cars, robotics,
and unmanned factories. Many of these automation processes rely on solutions to sequential decision-
making problems. Reinforcement Learning (RL) has recently been shown to be an effective tool
for solving such problems achieving notable successes, e.g., solving Atari games (Mnih et al.,
2013), defeating the (arguably all-time) best human players in the game of GO (Silver et al., 2016),
accelerating robot skill acquisition (Kober et al., 2013). Most of the successful RL algorithms rely
on abstracting the sequential nature of the decision-making as Markov Decision Processes (MDPs),
which typically assume both stationary transition dynamics and reward functions."
INTRODUCTION,0.005050505050505051,"As classic RL departs a well-behaved laboratory setting, stationarity assumptions can quickly be-
come prohibitive, sometimes leading to catastrophic consequences. As an illustration, imagine an
autonomous agent driving a vehicle with changing weather conditions impacting visibility and tyre
grip. The agent must identify and quickly adapt to these weather conditions changes in order to
avoid losing control of the vehicle. Similarly, an unmanned aerial vehicle hovering around a ﬁxed
set of coordinates needs to deal with sudden atmospheric condition changes (e.g., wind, humidity
etc). Another similar and realistic example is an actuator failure, which changes how the action
affects the MDP. Following Menke & Maybeck (1995) we distinguish “soft” (a percentage drop in
action efﬁciency) and “hard” (action is not affecting the MDP) failures. The failures can also be
dynamic as a “soft” failure in one actuator can overload other actuators introducing a chain of failures.
An environment with a ﬁxed weather condition or an actuator failure can be modeled as an MDP,
however, with the changing weather or arising failures the environment becomes non-stationary."
INTRODUCTION,0.006313131313131313,∗equal contribution
INTRODUCTION,0.007575757575757576,Published as a conference paper at ICLR 2022
INTRODUCTION,0.008838383838383838,"We can model this type of environments by making MDP state transitions dependant on the context
variable, which encapsulates the non-stationary and/or other dependencies. This kind of contextual
Markov Decision Processes (C-MDPs) incorporate a number of different RL settings and RL frame-
works (Khetarpal et al., 2020): non-stationary RL, where the context changes over time and the agent
needs to adapt to the context (e.g., the weather conditions are slowly changing over time); continual
and/or meta RL, where the context is sampled from a distribution before the start of the episode (e.g,
the weather changes abruptly between the instances the vehicle has been deployed)."
INTRODUCTION,0.010101010101010102,"Although a signiﬁcant progress in solving speciﬁc instances of C-MDPs has been made, the setting
with a countable number of contexts with Markovian transitions between the contexts has not received
sufﬁcient attention in the literature — a gap we are aiming to ﬁll. The closest related works consider
only special cases of our setting assuming: no context transitions (Xu et al., 2020); Markovian
context transitions with a priori known context transition times (Xie et al., 2020); ﬁnite state-action
spaces (Choi et al., 2000). To enable sample efﬁcient context adaptation Xu et al. (2020) and Xie
et al. (2020) developed model-based reinforcement learning algorithms. Speciﬁcally, Xie et al.
(2020) learned a latent space variational auto-encoder model with Markovian evolution in continuous
context-space, while Xu et al. (2020) adopted a Gaussian Process model for MDPs and a Dirichlet
process (DP) prior to detect context changes without modeling the context evolution. Note the DP
prior, which is a conjugate prior for a categorical distribution, is not sufﬁcient to model context
transitions. We also propose a model-based RL algorithm, however, we model the context and state
transitions using the Hierarchical Dirichlet Process (HDP) (Teh et al., 2006; Fox et al., 2008a) prior
and a neural network with outputs parametrizing a Guassian distribution (i.e., its mean and variance),
respectively, and refer to the model as HDP-C-MDP. We chose the HDP prior since it only requires
the knowledge of an upper bound on context cardinality for tractable inference, and it is better suited
for Markov chain modeling than other priors (Teh et al., 2006). Inspired by Blei et al. (2006) we
derive a model learning algorithm using variational inference, which is amenable to RL applications
using off-the-shelf algorithms."
INTRODUCTION,0.011363636363636364,"Our algorithm relies on two theoretical results: a) we propose a context distillation procedure (i.e.,
removing spurious contexts); b) we show that the optimal policy depends on the context belief
(context posterior probability given past observations). We derive another theoretical result, which
shows performance improvement bounds for the fully observable context case. Equipped with these
results, we experimentally demonstrate that we can infer the true context cardinality from data.
Further, the context distillation procedure can be used during training as a regularizer. Interestingly, it
can also be used to merge similar contexts, where the measure of similarity is only implicitly deﬁned
through the learning loss. Thus context merging is completely unsupervised. We then show that our
model learning algorithm appears to provide an optimization proﬁle with fewer local optima than the
maximum likelihood approach, which we attribute to the Bayesian nature of our algorithm. Finally,
we illustrate RL applications on an autonomous car left turn and an autonomous drone take-off tasks.
We also demonstrate that state-of-the-art algorithms of different frameworks (such as continual RL
and Partially-Observable Markov Decision Processes (POMDPs)) fail to solve C-MDPs in our setting,
and we elaborate on potential reasons why this is the case."
PROBLEM FORMULATION AND RELATED WORK,0.012626262626262626,"2
PROBLEM FORMULATION AND RELATED WORK"
PROBLEM FORMULATION AND RELATED WORK,0.013888888888888888,"We deﬁne a contextual Markov Decision Process (C-MDP) as a tuple Mc = ⟨C, S, A, PC, PS, R, γd⟩,
where S is the continuous state space; A is the action space; γd ∈[0, 1] is the discount factor; and C
denotes the context set with cardinality |C|. In our setting, the state transition and reward function
depend on the context, i.e., PS : C × S × A × S →[0, 1], R : C × S × A →R. Finally, the
context distribution probability PC : Tt × C →[0, 1] is conditioned on Tt - the past states, actions and
contexts {s0, a0, c0, . . . , at−1, ct−1, st}. Our deﬁnition is a generalization of the C-MDP deﬁnition
by Hallak et al. (2015), where the contexts are stationary, i.e., PC : C →[0, 1]. We adapt our
deﬁnition in order to encompass all the settings presented by Khetarpal et al. (2020), where such
C-MDPs were used but not formally deﬁned."
PROBLEM FORMULATION AND RELATED WORK,0.015151515151515152,"Throughout the paper, we will restrict the class of C-MDPs by making the following assumptions:
(a) Contexts are unknown and not directly observed (b) Context set cardinality is ﬁnite and
we know its upper bound K; (c) Contexts switches can occur during an episode and they are
Markovian. In particular, we consider the contexts ck representing the parameters of the state"
PROBLEM FORMULATION AND RELATED WORK,0.016414141414141416,Published as a conference paper at ICLR 2022
PROBLEM FORMULATION AND RELATED WORK,0.017676767676767676,"transition function θk, and the context set C to be a subset of the parameter space Θ. To deal with
uncertainty, we consider a set eC such that: a) | eC| = K > |C|; b) all its elements θk ∈eC are sampled
from a distribution H(λ), where λ is a hyper-parameter. Let zt ∈[1, . . . , K) be the index variable
pointing toward a particular parameter vector θzt, which leads to:"
PROBLEM FORMULATION AND RELATED WORK,0.01893939393939394,"z1 | ρ0 ∼Cat(ρ0),
zt | zt−1, {ρj}| e
C|
j=1 ∼Cat(ρzt−1),"
PROBLEM FORMULATION AND RELATED WORK,0.020202020202020204,"st | st−1, at−1, zt, {θk}| e
C|
k=1 ∼p(st|st−1, at−1, θzt),
θk | λ ∼H(λ), t ≥1,
(1)"
PROBLEM FORMULATION AND RELATED WORK,0.021464646464646464,"where ρ0 is the initial context distribution, while R = [ρ1, ..., ρ| e
C|] represents the context transition
operator."
PROBLEM FORMULATION AND RELATED WORK,0.022727272727272728,"As the reader may notice our model is tailored to the case, where the model parameters change
abruptly due to external factors such as weather conditions, cascading actuator failures etc. The
change is formalized by a Markov variable zt, which changes the MDP parameters θzt. Our approach
can also be related to switching systems modeling (cf. Fox et al. (2008a); Becker-Ehmck et al. (2019);
Dong et al. (2020)) and in this case the context is representing the system’s mode. While we can
draw parallels with these works, we improve the model by using nonlinear dynamics (in comparison
to Becker-Ehmck et al. (2019); Fox et al. (2008a)), by using the HDP prior (Becker-Ehmck et al.
(2019); Dong et al. (2020) use maximum likelihood estimators), and ﬁnally, by proposing the
distillation procedure and using deep learning (in comparison to Fox et al. (2008a)). Also note that
typically a switching system aims to represent a complex nonlinear (Markov) model using a collection
of simpler (e.g., linear) models, which is different from our case. Other restrictions on the space of
C-MDPs lead to different problems and solutions (Khetarpal et al., 2020). We brieﬂy mention a few
notable cases, while relegating a detailed discussion to Appendix A. Assuming that the context is
deterministic with zt = t puts us in the non-stationary RL setting (cf. Chandak et al. (2020)), where
it is common to assume a slowly or smoothly changing non-stationarity as opposed to our case of
possibly abrupt changes. Restricting the context to a stationary distribution sampled in speciﬁc time
points (e.g., at the start of the episode) can be tackled from the continual RL (cf. Nagabandi et al.
(2018)) and meta-RL perspectives (cf. Finn et al. (2017)), but both are not designed to handle the
Markovian context case. Finally, our C-MDP can be seen as a POMDP. Recall that a POMDP is
deﬁned by a tuple Mpo = {X, A, O, PX , PO, R, γd, p(x0)}, where X, A, O are the state, action,
observation spaces, respectively; PX : X × A × X →[0, 1] is the state transition probability;
PO : X × A × O →[0, 1] is the conditional observation probability; and p(x0) is the initial state
distribution. In our case, x = (s, z) and o = s."
"REINFORCEMENT LEARNING FOR MARKOV PROCESSES WITH MARKOVIAN
CONTEXT EVOLUTION",0.023989898989898988,"3
REINFORCEMENT LEARNING FOR MARKOV PROCESSES WITH MARKOVIAN
CONTEXT EVOLUTION"
"REINFORCEMENT LEARNING FOR MARKOV PROCESSES WITH MARKOVIAN
CONTEXT EVOLUTION",0.025252525252525252,"There are three main components in our algorithm: the HDP-C-MDP derivation, the model learning
algorithm using probabilistic inference and the control algorithms. We ﬁrstly brieﬂy comment on
each on these components to give an overview of the results and then explain our main contributions
to each. The detailed description of all parts of our approach can be found in Appendix."
"REINFORCEMENT LEARNING FOR MARKOV PROCESSES WITH MARKOVIAN
CONTEXT EVOLUTION",0.026515151515151516,"In order to learn the model of the context transitions, we choose the Bayesian approach and we
employ Hierarchical Dirichlet Processes (HDP) as priors for context transitions, inspired by time-
series modeling and analysis tools reported by Fox et al. (2008a;b) (see also Appendix C.1). We
improve the model by proposing a context spuriosity measure allowing for reconstruction of ground
truth contexts. We then derive a model learning algorithm using probabilistic inference. Having a
model, we can take off-the-shelf algorithms such as a Model Predictive Control (MPC) approach
using Cross-Entropy Minimization (CEM) (cf. Chua et al. (2018) and Appendix C.5), or a policy-
gradient approach Soft-actor critic (SAC) (cf. Haarnoja et al. (2018) and Appendix C.6), which are
both well-suited for model-based reinforcement learning. While MPC can be directly applied to our
model, for policy-based control we ﬁrst derive the representation of the optimal policy."
"REINFORCEMENT LEARNING FOR MARKOV PROCESSES WITH MARKOVIAN
CONTEXT EVOLUTION",0.027777777777777776,"Generative model: HDP-C-MDP. Before presenting our probabilistic model, let us develop some
necessary tools. A Dirichlet process (DP), denoted as DP(γ, H), is characterized by a concentration
parameter γ and a base distribution H(λ) deﬁned over the parameter space Θ. A sample G from
DP(γ, H) is a probability distribution satisfying (G(A1), ..., G(Ar)) ∼Dir(γH(A1), ..., γH(Ar))
for every ﬁnite measurable partition A1, ..., Ar of Θ, where Dir denotes the Dirichlet distribution."
"REINFORCEMENT LEARNING FOR MARKOV PROCESSES WITH MARKOVIAN
CONTEXT EVOLUTION",0.02904040404040404,Published as a conference paper at ICLR 2022
"REINFORCEMENT LEARNING FOR MARKOV PROCESSES WITH MARKOVIAN
CONTEXT EVOLUTION",0.030303030303030304,"Sampling G is often performed using the stick-breaking process (Sethuraman, 1994) and constructed
by randomly mixing atoms independently and identically distributed samples θk from H:"
"REINFORCEMENT LEARNING FOR MARKOV PROCESSES WITH MARKOVIAN
CONTEXT EVOLUTION",0.03156565656565657,"νk ∼Beta(1, γ),
βk = νk k−1
Y"
"REINFORCEMENT LEARNING FOR MARKOV PROCESSES WITH MARKOVIAN
CONTEXT EVOLUTION",0.03282828282828283,"i=1
(1 −νi),
G = ∞
X"
"REINFORCEMENT LEARNING FOR MARKOV PROCESSES WITH MARKOVIAN
CONTEXT EVOLUTION",0.03409090909090909,"k=1
βkδθk,
(2)"
"REINFORCEMENT LEARNING FOR MARKOV PROCESSES WITH MARKOVIAN
CONTEXT EVOLUTION",0.03535353535353535,"where δθk is the Dirac distribution at θk. We note that the stick-breaking procedure assigns progres-
sively smaller values to βk for large k, thus encouraging a smaller number of meaningful atoms. The
Hierarchical Dirichlet Process (HDP) is a group of DPs sharing a base distribution, which itself is a
sample from a DP: G ∼DP(γ, H), Gj ∼DP(α, G) for all j = 0, 1, 2, . . . (Teh et al., 2006). The
distribution G guarantees that all Gj inherit the same set of atoms, i.e., atoms of G, while keeping the
beneﬁts of DPs in the distributions Gj. It can be shown that Gj = P∞
k=0 ρjkδθk for some ρjk whose
sampling can be performed using another stick-breaking process (Teh et al., 2006). We consider its
modiﬁed version introduced by Fox et al. (2011):"
"REINFORCEMENT LEARNING FOR MARKOV PROCESSES WITH MARKOVIAN
CONTEXT EVOLUTION",0.036616161616161616,"µjk | α, κ, β ∼Beta "
"REINFORCEMENT LEARNING FOR MARKOV PROCESSES WITH MARKOVIAN
CONTEXT EVOLUTION",0.03787878787878788,"αβk + κ˜δjk, α + κ − k
X"
"REINFORCEMENT LEARNING FOR MARKOV PROCESSES WITH MARKOVIAN
CONTEXT EVOLUTION",0.039141414141414144,"i=1
αβi + κ˜δji !!"
"REINFORCEMENT LEARNING FOR MARKOV PROCESSES WITH MARKOVIAN
CONTEXT EVOLUTION",0.04040404040404041,", ρjk = µjk k−1
Y"
"REINFORCEMENT LEARNING FOR MARKOV PROCESSES WITH MARKOVIAN
CONTEXT EVOLUTION",0.041666666666666664,"i=1
(1 −µji),"
"REINFORCEMENT LEARNING FOR MARKOV PROCESSES WITH MARKOVIAN
CONTEXT EVOLUTION",0.04292929292929293,"(3)
where k
≥
1, j
≥
0, ˜δjk is the Kronecker delta, the parameter κ
≥
0, called the
sticky factor, modiﬁes the transition matrix priors encouraging self-transitions. The sticky fac-
tor serves as another measure of regularization reducing the average number of transitions."
"REINFORCEMENT LEARNING FOR MARKOV PROCESSES WITH MARKOVIAN
CONTEXT EVOLUTION",0.04419191919191919,Figure 1: HDP-C-MDP
"REINFORCEMENT LEARNING FOR MARKOV PROCESSES WITH MARKOVIAN
CONTEXT EVOLUTION",0.045454545454545456,"In our case, the atoms {θk} forming the context
set eC are sampled from H(λ), while ρjk are the
parameters of the Hidden Markov Model: ρ0
is the initial context distribution and ρj are the
rows in the transition matrix R. Our probabilis-
tic model is constructed in Equations 1,2,3 and
illustrated in Figure 1 as a graphical model. We
stress that the HDP in its stick-breaking con-
struction assumes that | eC| is inﬁnite and count-
able. In practice, however, we incorporate the
upper cardinality bound K by using a truncated
variational distribution, as explained later."
"REINFORCEMENT LEARNING FOR MARKOV PROCESSES WITH MARKOVIAN
CONTEXT EVOLUTION",0.04671717171717172,"Context Distillation. HDP-C-MDP promotes a small number of meaningful contexts and some
contexts will almost surely be spurious, i.e., we will transition to these contexts with a very small
probability. While this probability is small we may still need to explicitly remove these spurious
contexts. Here we propose a measure of context spuriosity and derive a distillation procedure
removing these spurious contexts. As a spuriosity measure we will use the stationary distribution
of the chain p∞, which is computed by solving p∞= p∞R. The distillation is then performed
as follows: if in stationarity the probability mass of a context is smaller than a threshold εdistil
then transitioning to this context is unlikely and it can be removed. We develop the corresponding
distilled Markov chain in the following result, which we prove in Appendix B.1, while the distillation
algorithm can be found in Appendix C.4."
"REINFORCEMENT LEARNING FOR MARKOV PROCESSES WITH MARKOVIAN
CONTEXT EVOLUTION",0.047979797979797977,"Theorem 1 Consider a Markov chain pt = pt−1R with a stationary distribution p∞and distilled
I1 = {i|p∞
i
≥εdistil} and spurious I2 = {i|p∞
i
< εdistil} state indexes, respectively. Then a) the
matrix b
R = RI1,I1 + RI1,I2(I −RI2,I2)−1RI2,I1 is a valid probability transition matrix; b) the
Markov chain bpt = bpt−1 b
R is such that its stationary distribution bp∞∝p∞
I1."
"REINFORCEMENT LEARNING FOR MARKOV PROCESSES WITH MARKOVIAN
CONTEXT EVOLUTION",0.04924242424242424,"Model Learning using Probabilistic Inference. We aim to ﬁnd a variational distribution q(ν, µ, θ)
to approximate the true posterior p(ν, µ, θ|D), for a dataset D = {(si, ai)}N
i=1, where si =
{si
t}T
t=−1 and ai = {ai
t}T
t=−1 are the state and action sequences in the i-th trajectory. We minimize
KL (q(ν, µ, θ) || p(ν, µ, θ|D)), or equivalently, maximize the evidence lower bound (ELBO):"
"REINFORCEMENT LEARNING FOR MARKOV PROCESSES WITH MARKOVIAN
CONTEXT EVOLUTION",0.050505050505050504,"ELBO = Eq(µ,θ) "" N
X"
"REINFORCEMENT LEARNING FOR MARKOV PROCESSES WITH MARKOVIAN
CONTEXT EVOLUTION",0.05176767676767677,"i=1
log p(si|ai, µ, θ) #"
"REINFORCEMENT LEARNING FOR MARKOV PROCESSES WITH MARKOVIAN
CONTEXT EVOLUTION",0.05303030303030303,"−KL (q(ν, µ, θ) || p(ν, µ, θ)) .
(4)"
"REINFORCEMENT LEARNING FOR MARKOV PROCESSES WITH MARKOVIAN
CONTEXT EVOLUTION",0.054292929292929296,Published as a conference paper at ICLR 2022
"REINFORCEMENT LEARNING FOR MARKOV PROCESSES WITH MARKOVIAN
CONTEXT EVOLUTION",0.05555555555555555,"The variational distribution above involves inﬁnite-dimensional random variables ν, µ, θ. To reach a
tractable solution, we assume | eC| = K and exploit the standard mean-ﬁeld assumption (Blei et al.,
2017) and the K-truncated variational distribution similarly to Blei et al. (2006); Hughes et al. (2015);
Bryant & Sudderth (2012) as follows:"
"REINFORCEMENT LEARNING FOR MARKOV PROCESSES WITH MARKOVIAN
CONTEXT EVOLUTION",0.056818181818181816,"q(ν, µ, θ) = q(ν)q(µ)q(θ), q(θ|ˆθ) = K
Y"
"REINFORCEMENT LEARNING FOR MARKOV PROCESSES WITH MARKOVIAN
CONTEXT EVOLUTION",0.05808080808080808,"k=1
δ(θk|ˆθk), q(ν|ˆν) = K−1
Y"
"REINFORCEMENT LEARNING FOR MARKOV PROCESSES WITH MARKOVIAN
CONTEXT EVOLUTION",0.059343434343434344,"k=1
δ(νk|ˆνk), q(νK = 1) = 1,"
"REINFORCEMENT LEARNING FOR MARKOV PROCESSES WITH MARKOVIAN
CONTEXT EVOLUTION",0.06060606060606061,"q(µ|ˆµ) = K
Y j=0 K−1
Y"
"REINFORCEMENT LEARNING FOR MARKOV PROCESSES WITH MARKOVIAN
CONTEXT EVOLUTION",0.06186868686868687,"k=1
Beta  µjk"
"REINFORCEMENT LEARNING FOR MARKOV PROCESSES WITH MARKOVIAN
CONTEXT EVOLUTION",0.06313131313131314,"ˆµjk, ˆµj − k
X"
"REINFORCEMENT LEARNING FOR MARKOV PROCESSES WITH MARKOVIAN
CONTEXT EVOLUTION",0.06439393939393939,"i=1
ˆµji !"
"REINFORCEMENT LEARNING FOR MARKOV PROCESSES WITH MARKOVIAN
CONTEXT EVOLUTION",0.06565656565656566,",
q(µjK = 1) = 1,
(5)"
"REINFORCEMENT LEARNING FOR MARKOV PROCESSES WITH MARKOVIAN
CONTEXT EVOLUTION",0.06691919191919192,"where hatted symbols represent free parameters. For θ and ν, we seek a MAP point estimate instead
of a full posterior (see Appendix C.3 for a discussion on our design choices). Random variables not
shown in the truncated variational distribution are conditionally independent of data, and thus can be
discarded from the problem. We maximize ELBO using stochastic gradient ascent, while the gradient
computations are performed using the following two techniques: (a) we compute the exact context
posterior using a forward-backward message passing algorithm, (b) we use implicit reparametrized
gradients to differentiate with respect to parameters of variational distributions (Figurnov et al., 2018).
We present the detailed derivations in Appendix C.2. We also can perform context distillation during
training as discussed in Appendix C.4. While adding some computational complexity, this procedure
acts as a regularization for model learning as we show in our experiments."
"REINFORCEMENT LEARNING FOR MARKOV PROCESSES WITH MARKOVIAN
CONTEXT EVOLUTION",0.06818181818181818,"Representation of the optimal policy. First, we notice that the model in Equation 1 is a POMDP,
which we get by setting xt := (zt, st) and ot := st. In the POMDP case, we cannot claim that ot+1
depends only on ot and at. Therefore the Bellman dynamic programming principle does not hold for
these variables and solving the problem is more involved. In practice, one constructs the belief state
bt = p(xt|IC
t ) (Astrom, 1965), where IC
t = {b0, o≤t, a<t} is called the information state and is
used to compute the optimal policy. Since the belief state is a distribution, it is generally costly to
estimate in continuous observation or state spaces. In our case, estimating the belief is tractable, since
the belief of the state st is the state itself (as the state st is observable) and the belief of zt, which we
denote as bz
t , is a vector of a ﬁxed length at every time step (as zt is discrete and bz
t is its ﬁltering
distribution). We have the following result with the proof in Appendix B.2."
"REINFORCEMENT LEARNING FOR MARKOV PROCESSES WITH MARKOVIAN
CONTEXT EVOLUTION",0.06944444444444445,"Theorem 2 a) The belief of z can be computed as p(zt+1|IC
t ) = bz
t+1, where (bz
t+1)i ∝Ni =
P"
"REINFORCEMENT LEARNING FOR MARKOV PROCESSES WITH MARKOVIAN
CONTEXT EVOLUTION",0.0707070707070707,"j p(st+1|st, θi, at)ρji(bz
t )j, where (bz
t )i are the entries of bz
t ; b) the optimal policy can be com-
puted as π(s, bz) = argmaxa Q(s, bz, a), where the value function satisﬁes the dynamic program-
ming principle Q(st, bz
t , at) = r(st, bz
t , at) + γ
R P"
"REINFORCEMENT LEARNING FOR MARKOV PROCESSES WITH MARKOVIAN
CONTEXT EVOLUTION",0.07196969696969698,"i Ni maxat+1 Q(st+1, bz
t+1, at+1) dst+1."
"REINFORCEMENT LEARNING FOR MARKOV PROCESSES WITH MARKOVIAN
CONTEXT EVOLUTION",0.07323232323232323,"Computational framework. Algorithm 1 summarizes our approach and is based on the standard
model-based RL frameworks (e.g., Pineda et al. (2021)). Effectively, we alternate between model
updates and policy updates. For the policy updates we relabel (recompute) the beliefs for the historical
transition data. As MPC methods compute the sequence of actions based solely on the model such
relabeling is not required."
