Section,Section Appearance Order,Paragraph
ABSTRACT,0.0,ABSTRACT
ABSTRACT,0.0014184397163120568,"The interventional nature of recommendation has attracted increasing attention
in recent years. It particularly motivates researchers to formulate learning and
evaluating recommendation as causal inference and data missing-not-at-random
problems. However, few take seriously the consequence of violating the critical
assumption of overlapping, which we prove can significantly threaten the validity
and interpretation of the outcome. We find a critical piece missing in the current
understanding of information retrieval (IR) systems: as interventions, recommen-
dation not only affects the already observed data, but it also interferes with the
target domain (distribution) of interest. We then rephrase optimizing recommen-
dation as finding an intervention that best transports the patterns it learns from
the observed domain to its intervention domain. Towards this end, we use do-
main transportation to characterize the learning-intervention mechanism of rec-
ommendation. We design a principled transportation-constraint risk minimization
objective and convert it to a two-player minimax game. We prove the consistency,
generalization, and excessive risk bounds for the proposed objective, and elaborate
how they compare to the current results. Finally, we carry out extensive real-data
and semi-synthetic experiments to demonstrate the advantage of our approach,
and launch online testing with a real-world IR system."
INTRODUCTION,0.0028368794326241137,"1
INTRODUCTION"
INTRODUCTION,0.00425531914893617,"For information retrieval (IR) systems, the users’ willingness to interact is often intervened by the
content we show. Recommendations not only impact the potential response of the users, but also
change the nature of the data collected for training machine learning models (Bottou et al., 2013).
The interventional nature of recommendation, as well as the fact that many questions in IR are
counterfactual, e.g., ”what the response would have been if we recommended something else”,
makes it natural to rephrase recommendation in the context of causal inference or missing data
problems (Rubin, 2005; Little et al., 2002). Among the two disciplines, technical tools of impor-
tance weighting (IW) and domain adaptation (DA) have been commonly applied. Recently, there
has been widespread interest in adapting those tools for learning the best recommendation (Schn-"
INTRODUCTION,0.005673758865248227,Published as a conference paper at ICLR 2022
INTRODUCTION,0.0070921985815602835,"abel et al., 2016; Bonner and Vasile, 2018), but we find a critical discussion missing from most
existing literature in this direction. In many scientific disciplines, the effectiveness of IW and DA
relies heavily on overlapping between source and target domain (Austin and Stuart, 2015; David
et al., 2010). The underlying reason also happens to be the motivation of exploration-exploitation
techniques including bandits and reinforcement learning (Auer et al., 2002; Sutton and Barto, 1998):
in the less-explored regions where few observations are collected, the confidence of selecting any
hypothesis is discounted."
INTRODUCTION,0.00851063829787234,"Unfortunately, modern IR systems are often cautious about exposing users to less relevant content
for the sake of immediate satisfaction and revenue, even with the help of bandits or RL (Bonner and
Vasile, 2018). In particular, many real-world recommenders are deterministic, e.g., an item is shown
with probability either zero or one, which further limits the exploration and thus the coverage of
collected data. In Section 3, we rigorously prove for both IW- and DA-based learning the hardness
or impossibility results caused by insufficient overlap. Intuitively, when a less-explored instance
is passed to a candidate hypothesis, even if DA or IW can improve the accuracy of the prediction,
they inevitably increase the uncertainty of that prediction as a consequence of the bias-variance
tradeoff. To a certain point, the increased uncertainty from having too many instances in the weakly
overlapped regions will fundamentally limit what any learning procedure can achieve. Further, if the
instance lies in the non-overlapped region, we can barely exceed regular extrapolation1 (Xu et al.,
2021b)."
INTRODUCTION,0.009929078014184398,Figure 1: A realistic working mechanism of IR systems that emphasize domain transportation.
INTRODUCTION,0.011347517730496455,"We resolve the fundamental limitation of insufficient overlapping in IR with the key insight that the
interventional impact of recommendation is not exclusive to observed data, but also interferes with
the target domain of interest — the instances that will be affected by the recommendations we are
about to make. For instance, the placement of a recommendation on the webpage proposed to the
user directly influences the occurrence of clicks. Therefore, we alternatively consider optimizing
recommendation as searching for an intervention that best transports the patterns it learns from the
source domain to its intervention domain. The procedure is best described by transport instead of
transfer because it will interfere with how the learnt patterns are carried to the target domain. This
change of view describes a complex but realistic working mechanism that involves learning, inter-
vention, and transportation, as depicted in Figure 1. On the one hand, we wish to learn patterns that
can be transported to the target domain of interest. On the other hand, the patterns we identify lead
to the intervention (in the form of recommendation) that generates the target domain. Following this
working mechanism, we impose constraints on the domain transportation between the (reweighted)
source domain and the future intervention domain. We point out that reweighting is essential for
learning from interventional feedback data (Rosenbaum and Rubin, 1983), especially for the work-
ing mechanism we identify here because the relationship between the source and target domain is
more involved. Towards this end, we propose a novel solution via transportation-constraint risk
minimization. We rigorously investigate for our objective:"
INTRODUCTION,0.01276595744680851,"• the consistency, generalization, and excessive risk bounds that provide theoretical insights and
guarantees;"
INTRODUCTION,0.014184397163120567,"• the equivalence to a two-player minimax game that can be efficiently solved by gradient descent-
ascent algorithm;"
INTRODUCTION,0.015602836879432624,• convergence to the standard IW-based solution for the ideal fully-overlapped bandit feedback;
INTRODUCTION,0.01702127659574468,"We demonstrate the empirical performance of our method via comprehensive experiments via sim-
ulation, real-data analysis, as well as online experimentation and testing in a real-world IR system."
INTRODUCTION,0.018439716312056736,"1The presumption for this argument is that the underlying causal mechanism is unknown, which applies to
the settings we discuss in the paper."
INTRODUCTION,0.019858156028368795,Published as a conference paper at ICLR 2022
RELATED WORK,0.02127659574468085,"2
RELATED WORK"
RELATED WORK,0.02269503546099291,"Bottou et al. (2013) first reveals the importance of characterizing the working mechanism of IR
systems. However, they study specifically the advertising systems where the underlying causal
structures are assumed given. Our work significantly extends their discussion by moving beyond
causal mechanisms. Issues caused by ignoring the interventional nature of recommendation have
been pointed out for numerous scenarios (Chen et al., 2020). Steck (2010) and Liang et al. (2016)
address optimizing recommendation in the context of missing data and causal inference, and the
majority of recent follow-up work investigate particularly inverse propensity weighting (IPW) and
learning domain invariant representation methods (Chen et al., 2020; Saito, 2020; Yang et al., 2018;
Joachims et al., 2017; Bonner and Vasile, 2018; Agarwal et al., 2019; Xu et al., 2020). As mentioned
in Section 1, they largely ignore the overlapping issue even when the recommendation is determin-
istic. Our theoretical results on the interplay between overlapping and learning performance are
novel and add to the current venue of revealing the tradeoff for IW- and DA-based learning (Byrd
and Lipton, 2019; Johansson et al., 2019; Ben-David and Urner, 2012). See Appendix D for further
discussions on related work."
RELATED WORK,0.024113475177304965,"Existing solutions for insufficient overlapping focus primarily on reducing or calibrating the vari-
ance, e.g., as discussed in Swaminathan and Joachims (2015b); Wang et al. (2020); Johansson et al.
(2020). They do not account for the unique working mechanism of IR where the domain discrepancy
can be actively controlled. We devise the domain-transportation constraint using the Wasserstein dis-
tance originated from the optimal transport theory (Courty et al., 2016; Redko et al., 2017). The idea
of converting a Wasserstein-constraint objective to two-player minimax game is similar to that of
the generative adversarial network (Gulrajani et al., 2017), however, we do not make any generative
assumption on the observed data. Finally, learning from bandit feedback and the associated coun-
terfactual risk minimization can be viewed as a special case of our framework (Swaminathan and
Joachims, 2015a). We will use it as a test bed to examine the guarantees of the proposed approach."
PRELIMINARIES,0.02553191489361702,"3
PRELIMINARIES"
PRELIMINARIES,0.02695035460992908,"We use upper-case letters to denote random variables and measures, bold-font letters for vectors and
matrices. We denote by ∥·∥2, ∥·∥∞, ∥·∥L the ℓ2, ℓ∞norm and the Lipschitz constant of a function."
PRELIMINARIES,0.028368794326241134,"For clarity, we borrow the item recommendation setting to illustrate the IR system we discuss next.
The set of all users and items are given by U and I. To be concise, we denote the features (or
pre-trained embeddings) for users and items by xu for u ∈U and xi for i ∈I. We study primarily
the practical implicit-feedback setting with Yui ∈{0, 1}, e.g., users express preferences implicitly
via clicks. Let D be the population of all possible (xu, xi) or (u, i) depending on the context. The
embeddings can also be free parameters under the representation mapping f from X or U ∪I to Rd.
We let P be any base probability measure supported on the subsets of D, and let Pn be the empirical
versions according to the collected feedback of Dn where n is the sample size. We assume the
weight of a user-item is positive and bounded by a constant M. Equipped with either individual
weights wui ∈[0, M] or weighting function w : U × I (or X × X) →[0, M], the reweighted
measures are given by such as: Pw(u, i) ∝w(u, i) · P(u, i)."
PRELIMINARIES,0.029787234042553193,"The candidate recommendation algorithm f ∈F outputs a score or probability for each user-item
pair. Top-k recommender often ranks the output and then renders the top-k items to the user.
We denote this procedure by the function: reco(u, i; f) ∈{0, 1}. Define the new measure on
D induced by deploying f on D as: Pf(u, i) ∝reco(u, i; f) · P(u, i). If we choose the base
measure P as uniform, it is clear that Pf is a uniform measure on the (u, i) pairs that will be
exposed: {(u, i) ∈D : reco(u, i; f) = 1}. Finally, given a loss function ℓfor f, we define
the corresponding risk under P: EP R(f) = E(u,i)∼P ℓ
 
f(u, i), yui

, the weighted risk under Pw:
EPwR(f) = E(u,i)∼P ℓ
 
f(u, i), yui

· w(u, i)."
PRELIMINARIES,0.031205673758865248,"Our setting covers a wide range of recommendation problems from classical collaborative filtering
to sequential recommendation (when user embedding is a function of the item sequence), including
those using bandits for exploration where f(u, i) becomes the exploration probability, and the base
measure is given by the inverse propensities. We defer the detail of that setting to Appendix A.1."
PRELIMINARIES,0.032624113475177303,Consequence of Insufficient Overlapping.
PRELIMINARIES,0.03404255319148936,Published as a conference paper at ICLR 2022
PRELIMINARIES,0.03546099290780142,"We now rigorously justify our previous intuition that insufficient overlapping causes uncertainty that
fundamentally limits what IW- and DA-based learning can achieve. While the results we show for
IW are universal, i.e., it applies to any hypothesis class, we discuss particularly for DA the skip-
gram negative sampling (SGNS) algorithm (Mikolov et al., 2013). The reason is that SGNS is a
widespread technique for learning user or item embedding in IR systems (Xu et al., 2021a), and its
more straightforward formulation will allow us to present concise theoretical results to the readers."
PRELIMINARIES,0.03687943262411347,"As a gentle introduction, IW-based learning uses the ratio Q(u, i)/P(u, i) – where P and Q rep-
resent the source and target domain – to reweigh the loss of each instance in order to correct the
distribution shift. On the other hand, DA-based learning assumes there exists some hypothesis that
makes the optimal joint risk of inff∈F[EQR(f) + EP R(f)] small. For IW, we show the hardness
of learning, i.e., the best target risk inff EQR(f) can be uncontrolled for any F due to insufficient
overlapping. For DA, we show the impossibility of learning, i.e., there does not exist a solution of
SGNS that can make the optimal joint risk small when P and Q are not aligned.
Proposition 1. Let P and Q be the training and target distribution supported on SP , SQ ⊆D, and
w(u, i) = Q(u,i)"
PRELIMINARIES,0.03829787234042553,"P (u,i), for (u, i) ∈SP ∩SQ. Dn consists of training instances sampled i.i.d from P."
PRELIMINARIES,0.03971631205673759,"Hardness of learning with IW: if SP = SQ, for any f ∈F, with probability at least 1 −δ, it holds:"
PRELIMINARIES,0.04113475177304964,"EQR(f) ≲EPn,wR(f) + M
 
log 1"
PRELIMINARIES,0.0425531914893617,δ + log N∞( 1
PRELIMINARIES,0.04397163120567376,"n, F
 n
+ s"
PRELIMINARIES,0.04539007092198582,"Md1(P∥Q)
 
log 1"
PRELIMINARIES,0.04680851063829787,δ + log N∞( 1
PRELIMINARIES,0.04822695035460993,"n, F
 n
,"
PRELIMINARIES,0.04964539007092199,"and P
EQR(f) −EPn,wR(f)
 ≳
p"
PRELIMINARIES,0.05106382978723404,"(d1(P∥Q) −1)/n

> 0 under mild condition, where M :="
PRELIMINARIES,0.0524822695035461,"max{w(u, i)}, N∞( 1"
PRELIMINARIES,0.05390070921985816,"n, F

:= N( 1"
PRELIMINARIES,0.05531914893617021,"n, F, ℓ2n
∞) is the 1"
PRELIMINARIES,0.05673758865248227,"n-covering number for F in ∥· ∥∞based on
2n i.i.d samples from P, and d1(P∥Q) =
R"
PRELIMINARIES,0.05815602836879433,"SQ(dP/dQ)dP is a divergence measure. Further, if
SP ̸= SQ, for any prior and posterior distributions π and τ on F, for risks associated with the 0-1
loss, it holds with probability at least 1 −δ:"
PRELIMINARIES,0.059574468085106386,"Ef∼τ,QR(f) ≲Ef∼τ,Pn,wR(f) + dKL(π∥τ) + log d1(P ∥Q)"
PRELIMINARIES,0.06099290780141844,"δ
n
+ Ef∼τ,SQ\SP R(f) + O(Dn(τ)),"
PRELIMINARIES,0.062411347517730496,"where dKL is the Kullback-Leibler divergence, d1(P∥Q) is the same as above but defined only on
the overlapped part, and Dn(τ) consists of disagreement terms detailed in Appendix A.2."
PRELIMINARIES,0.06382978723404255,"Impossibility of learning for DA with SGNS: let R(f) be the associated risk for the SGNS algo-
rithm, and Cu,i(P), Cu,i(Q) be the co-occurrence statistics under P, Q, as mentioned in Xu et al.
(2021a). Even if SP = SQ, it holds that:"
PRELIMINARIES,0.06524822695035461,"inf
f [EP R(f) + EQR(f)] ≥
1
|SP | X"
PRELIMINARIES,0.06666666666666667,"(u,i)∈SP
dKL
 
Cu,i(P)∥Cu,i(Q)

+ c,"
PRELIMINARIES,0.06808510638297872,where c takes some positive value and equals to inff EP R(f) + inff EQR(f) when P = Q a.s.
PRELIMINARIES,0.06950354609929078,"We defer all the proofs to Appendix A.2. For IW, we reveal the generalization bounds for both the
frequentist setting (the first set of bounds) and the PAC-Bayesian setting (the second bound). While
they emphasize conceptually on different learning guarantees (Germain et al., 2009), and while the
latter can handle the existence of non-overlap (SP ̸= SQ), we find them both showing insufficient
overlapping (characterized by the discrepancy terms d1 and dKL) can cause arbitrarily large gaps
leading to poor generalizations to the target domain. For DA with SGNS, our lower bound reveals
the impact of insufficient overlapping indirectly via a notion of co-occurrence statistics defined in
Xu et al. (2021a). In particular, if the source and target domains are well-aligned in terms of the
co-occurrence statistics, the increased divergence term can make it impossible to find a hypothesis
that simultaneously performs well in both domains. Although this result holds only for SGNS, it
nevertheless suggests the limitations of DA caused by insufficient overlapping in IR."
MODEL AND THEORY,0.07092198581560284,"4
MODEL AND THEORY"
MODEL AND THEORY,0.07234042553191489,"As much as we would like to continue investigating the consequence of insufficient overlapping,
for the purpose of this paper, we have shown the drawbacks of directly applying such as IW and"
MODEL AND THEORY,0.07375886524822695,Published as a conference paper at ICLR 2022
MODEL AND THEORY,0.075177304964539,"DA to optimizing recommendation without accounting for the working mechanism of IR systems.
In what follows, we describe a principled solution motivated by our domain transportation view,
which requires actively identifying the suitable training domain via reweighting. Notably, we no
longer perceive reweighting as a change-of-measure tool commonly implied in the causal inference
and missing data solutions. Instead, we use reweighing as a mechanism to help identify a particular
training domain to ensure certain transportation properties (which we explain next) to the deploy-
ment domain2, which may concern only a subpopulation of all the potential user-item instances."
TRANSPORTATION-CONSTRAINED RISK MINIMIZATION,0.07659574468085106,"4.1
TRANSPORTATION-CONSTRAINED RISK MINIMIZATION"
TRANSPORTATION-CONSTRAINED RISK MINIMIZATION,0.07801418439716312,"Throughout our discussion, we emphasize the transportability of patterns across domains, which can
be difficult to define precisely. However, if we make a a mild assumption that all patterns can be
recovered by Lipschitz-bound functions, it immediately becomes clear that the Wasserstein distance
can characterize our notion of transportability. To show this point, we first describe an imbalanced
binary classification problem with two domains P and Q. Let ℓ1(u) =
u
p1 and ℓ−1(u) =
u
1−p1
be the positive and negative loss under prediction score u, where p1 is the prior probability that a
sample comes from P. Interestingly, the L-Wasserstein distance between P and Q admits3:"
TRANSPORTATION-CONSTRAINED RISK MINIMIZATION,0.07943262411347518,"−dW (P, Q) =
inf
g:{∥g∥L≤L} p1 Z"
TRANSPORTATION-CONSTRAINED RISK MINIMIZATION,0.08085106382978724,"D
ℓ1(g)dP + (1 −p1)
Z"
TRANSPORTATION-CONSTRAINED RISK MINIMIZATION,0.08226950354609928,"D
ℓ−1(g)dQ,
(1)"
TRANSPORTATION-CONSTRAINED RISK MINIMIZATION,0.08368794326241134,"which is exactly the optimal risk of the binary classification problem described in the first place!
Therefore, Wasserstein distance can be perceived as how well the classification patterns on P trans-
ports to Q by any means necessary, as long as they are Lipschitz-bounded. Since the constant of L
is simply a scaling factor, we simply continue with the 1-Wasserstein distance. Using dW to device
the domain transportation contraint between Pf and the particular training domain Pw we seek to
construct with our weighting mechanism, the learning objective is directly given by:"
TRANSPORTATION-CONSTRAINED RISK MINIMIZATION,0.0851063829787234,"minimize
f∈F,w∈H EPwR(f) s.t. D(w, f) ≤ρ,
(2)"
TRANSPORTATION-CONSTRAINED RISK MINIMIZATION,0.08652482269503546,"where D(w, f) is a shorthand for dW (Pw, Pf), and ρ can be treated as a hyper-parameter. As a san-
ity check, when ρ = 0, the feasible set is given by: f(u, i) = w(u, i) for all (u, i), so we are directly
optimizing the associated risk of the deployment domain. However, this is a suboptimal practice for
deterministic recommenders because in that case, only a small proportion of the feedback data will
be considered and the result can be heavily biased toward the historical recommendation. Therefore,
a suitable ρ will give us the opportunity to better explore the whole feedback data. Nevertheless, if
ρ becomes too large, we are likely to overfit the feedback data due to the high capacity of f and w
combined while the transportation constraint is too loose."
TRANSPORTATION-CONSTRAINED RISK MINIMIZATION,0.08794326241134752,"The proposed objective is tailored specifically to the working mechanism of IR systems, and it is
natural to question the validity and effectiveness. In what follows, we rigorously prove a series of
guarantees associated with our novel learning objective, and discuss how it connect and compare to
the existing results."
TRANSPORTATION-CONSTRAINED RISK MINIMIZATION,0.08936170212765958,"To begin with, we show that jointly optimizing w leads to the sample-consistency guarantee. For
clarity, we start with the feature-based learning where f(u, i) := f(xu, xi), and defer the extension
with the representation mapping to the next section. Let Z := D × {0, 1}, and we denote by
ℓf : Z →R+ the composition with the loss function such that for zui = (xu, xi, yui), we have
ℓf(u, i) := ℓ
 
f(u, i), yui

. We use wui as a shorthand for the individual weight."
TRANSPORTATION-CONSTRAINED RISK MINIMIZATION,0.09078014184397164,"Theorem 1. Denote by Dn(w, f) = dW (Pn,w, Pn,f). Suppose that ℓf is L-Lipschitz w.r.t ∥· ∥2.
Define SG = supg:∥g∥L≤1
P"
TRANSPORTATION-CONSTRAINED RISK MINIMIZATION,0.09219858156028368,"(u,i)∈Dn g(u, i) and MG = sup∥g∥L≤1, (u,i)∈D g(u, i). Assume Z ∈
RdZ and w ∈H. Given any f ∈F and ρ > 0, it holds with probability at least 1 −δ that:

min
w: D(w,f)≤ρ EPwR(f) −
min
w: Dn(w,f)≤ρ EPn,wR(f)
 ≤9M(log 1"
TRANSPORTATION-CONSTRAINED RISK MINIMIZATION,0.09361702127659574,"2δ)
n
+ Bn(H, δ)L + Cn( ¯w, ˜w, f, δ)."
TRANSPORTATION-CONSTRAINED RISK MINIMIZATION,0.0950354609929078,"2Suppose a candidate recommender f is deployed to D. According to Section 3, the domain of users and
items who are affected by the recommendation is given by Pf defined on {(u, i) ∈D : reco(u, i; f) = 1}. We
refer to it as the deployment domain to differentiate from the notion of target domain which is conventionally
intervention-free.
3In Appendix A.3, we provide a more thorough introduction to Wasserstein distance for interested readers."
TRANSPORTATION-CONSTRAINED RISK MINIMIZATION,0.09645390070921986,Published as a conference paper at ICLR 2022
TRANSPORTATION-CONSTRAINED RISK MINIMIZATION,0.09787234042553192,"Here, ˜w = arg minDn(w,f)≤δ−Bn(H,δ) EPwR(f), ¯w = arg minDn(w,f)≤δ+Bn(H,δ) EPwR(f),"
TRANSPORTATION-CONSTRAINED RISK MINIMIZATION,0.09929078014184398,"Cn( ¯w, ˜w, f, δ)
=
n−1"
Q,0.10070921985815603,"2
q"
Q,0.10212765957446808,"18M max{R ¯
w(f)2, R ˜
w(f)2} log 1"
Q,0.10354609929078014,"2δ
and
Rw(f)2
="
"N
P",0.1049645390070922,"1
n
P"
"N
P",0.10638297872340426,"Dn w2
uiℓf(u, i)2.
Also,
Bn(H, δ)
is
given
by
O
 
SGn1/(dZ+1)−1
+"
"N
P",0.10780141843971631,MGn−1/2q log 1
"N
P",0.10921985815602837,2δ + N∞( 1
"N
P",0.11063829787234042,"n, H)

."
"N
P",0.11205673758865248,"We relegate the proof of this theorem to Appendix A.4. Crucially, other than showing that the
sample-consistency result can still be achieved with the jointly-optimized weights, we point out that
this bound is completely independent of distribution discrepancy terms that troubled IW and DA.
Notice that the bound depends on the weights only through R ¯
w(f)2 and R ˜
w(f)2 presented by the
Cn term. Given any f ∈F, our result shows that both ¯w and ˜w are the minimizers of a weighted
risk term, i.e. EPwR(f) ∝P
D wuiℓf(u, i), under some constraint involving ρ. Therefore, thanks
to the constraint of D(w, f) ≤ρ and the joint optimization of w, R ¯
w(f)2 and R ˜
w(f)2 will have
more controlled behaviors compared with the domain discrepancy terms in Proposition 1."
"N
P",0.11347517730496454,"We now investigate the learning-theoretical guarantees of the proposed objective, particularly the
generalization and excessive risk bounds. Suppose the underlying labeling function of yui with
respect to (xu, xi) is deterministic. With a little abuse of notation, we use z ∼Pn,f to denote
sampling (xu, xi, yui) via (xu, xi) ∼Pn,f and the deterministic labelling function.
Theorem 2. Suppose inf˜z∈Z{ℓf(˜z) + λ∥z −˜z∥2} ≤MF for all z ∈Z and λ ≥0, f ∈F. Let
Rn(F) be the empirical Rademacher complexity: Rn(F) = Eσ supf∈F
 1"
"N
P",0.1148936170212766,"n
P
(u,i)∈Dn σu,if(u, i)
,
and σ takes {−1, 1} with equal probability. We consider individual weights wui ∈(0, 1) for brevity."
"N
P",0.11631205673758865,"Generalization Error: for any f ∈F, it holds with probability at least 1 −δ that:"
"N
P",0.11773049645390071,"min
w: D(w,f)≤ρ EPwR(f) ≤min
λ≥0"
"N
P",0.11914893617021277,"n
−λρ + Ez∼Pn,f
h
inf
˜z∈Z ℓf(˜z) + λ∥z −˜z∥2
i
+ MF r"
"N
P",0.12056737588652482,log 1/(2δ) n + r
"N
P",0.12198581560283688,log(λ + 1)
"N
P",0.12340425531914893,"n
+ C
R ∞
0
p"
"N
P",0.12482269503546099,"log N∞(ϵ, F)dϵ n1/2 
."
