Section,Section Appearance Order,Paragraph
ABSTRACT,0.0,ABSTRACT
ABSTRACT,0.002617801047120419,"Existing domain adaptation methods tend to treat every domain equally and align
them all perfectly. Such uniform alignment ignores topological structures among
different domains; therefore it may be beneﬁcial for nearby domains, but not
necessarily for distant domains. In this work, we relax such uniform alignment by
using a domain graph to encode domain adjacency, e.g., a graph of states in the US
with each state as a domain and each edge indicating adjacency, thereby allowing
domains to align ﬂexibly based on the graph structure. We generalize the existing
adversarial learning framework with a novel graph discriminator using encoding-
conditioned graph embeddings. Theoretical analysis shows that at equilibrium,
our method recovers classic domain adaptation when the graph is a clique, and
achieves non-trivial alignment for other types of graphs. Empirical results show that
our approach successfully generalizes uniform alignment, naturally incorporates
domain information represented by graphs, and improves upon existing domain
adaptation methods on both synthetic and real-world datasets1."
INTRODUCTION,0.005235602094240838,"1
INTRODUCTION"
INTRODUCTION,0.007853403141361256,"Generalization of machine learning methods hinges on the assumption that training and test data
follows the same distribution. Such an assumption no longer holds when one trains a model in some
domains (source domains), and tests it in other domains (target domains) where data follows different
distributions. Domain adaptation (DA) aims at improving performance in this setting by aligning data
from the source and target domains so that a model trained in source domains can generalize better in
target domains (Ben-David et al., 2010; Ganin et al., 2016; Tzeng et al., 2017; Zhang et al., 2019)."
INTRODUCTION,0.010471204188481676,"VT
ME
NH IN NY
MA PA KY NJ WV CT
RI MD
DE OH"
INTRODUCTION,0.013089005235602094,"VT
ME
NH IN NY
MA PA KY NJ WV CT
RI MD
DE OH"
INTRODUCTION,0.015706806282722512,"Figure 1: 15 states in the east of the US as 15 do-
mains. Left: Traditional DA treats each domain
equally and enforces uniform alignment for all
domains, which is equivalent to enforcing a fully
connected domain graph. Right: Our method
generalizes traditional DA to align domains ac-
cording to any speciﬁc domain graph, e.g., a do-
main graph describing adjacency among these 15
states."
INTRODUCTION,0.01832460732984293,"Existing DA methods tend to enforce uniform
alignment, i.e., to treat every domain equally and
align them all perfectly. However, in practice the
domains are often heterogeneous; one can expect
DA to work well when the source domains are
close to the target domains, but not when they
are too far from each other (Zhao et al., 2019;
Wang et al., 2020). Such heterogeneity can of-
ten be captured by a graph, where the domains
realize the nodes, and the adjacency between two
domains can be captured by an edge (see Fig. 1).
For example, to capture the similarity of weather
in the US, we can construct a graph where each
state is treated as a node and the physical proxim-
ity between two states results in an edge. There
are also many other scenarios where the relation among domains can be naturally captured by a graph,
such as the taxonomies of products in retail or connections among research ﬁelds of academic papers.
Given a domain graph, we can tailor the adaptation of domains to the graph, rather than dictating the
data from all the domains to align perfectly regardless of the graph structure."
INTRODUCTION,0.020942408376963352,"∗Work conducted during internship at AWS AI Labs.
1Code will soon be available at https://github.com/Wang-ML-Lab/GRDA"
INTRODUCTION,0.02356020942408377,Published as a conference paper at ICLR 2022
INTRODUCTION,0.02617801047120419,"One naïve DA method for such graph-relational domains is to perform DA for each pair of neighboring
domains separately. Unfortunately, due to the strict alignment between each domain pair, this method
will still lead to uniform alignment so long as the graph is connected. To generalize DA to the graph-
relational domains, we argue that an ideal method should (1) only enforce uniform alignment when
the domain graph is a clique (i.e., every two domains are adjacent), and (2) more importantly, relax
uniform alignment to adapt more ﬂexibly across domains according to any non-clique domain graph,
thereby naturally incorporating information on the domain adjacency. In this paper, we generalize
adversarial DA methods and replace the traditional binary (or multi-class) discriminator with a novel
graph discriminator: instead of distinguishing among different domains, our graph discriminator
takes as input the encodings of data to reconstruct the domain graph. We show that our method enjoys
the following theoretical guarantees: it recovers classic DA when the the domain graph is a clique,
and realizes intuitive alignments for other types of graphs such as chains and stars (see Fig. 4). We
summarize our contributions as follows:"
INTRODUCTION,0.028795811518324606,"• We propose to use a graph to characterize domain relations and develop graph-relational
domain adaptation (GRDA) as the ﬁrst general adversarial DA method to adapt across
domains living on a graph.
• We provide theoretical analysis showing that at equilibrium, our method can retain the
capability of uniform alignment when the domain graph is a clique, and achieve non-trivial
alignment for other types of graphs.
• Empirical results on both synthetic and real-world datasets demonstrate the superiority of
our method over the state-of-the-art DA methods."
RELATED WORK,0.031413612565445025,"2
RELATED WORK"
RELATED WORK,0.034031413612565446,"Adversarial Domain Adaptation. There have been extensive prior works on domain adaptation (Pan
& Yang, 2009; Pan et al., 2010; Long et al., 2018; Saito et al., 2018; Sankaranarayanan et al., 2018;
Zhang et al., 2019; Peng et al., 2019; Chen et al., 2019; Dai et al., 2019; Nguyen-Meidine et al.,
2021). Typically they aim to align the distributions of the source and target domains with the hope
that the predictor trained on labeled source data can generalize well on target data. Such alignment
can be achieved by either directly matching their distributions’ statistics (Pan et al., 2010; Tzeng
et al., 2014; Sun & Saenko, 2016; Peng et al., 2019; Nguyen-Meidine et al., 2021) or training deep
learning models with an additional adversarial loss (Ganin et al., 2016; Zhao et al., 2017; Tzeng
et al., 2017; Zhang et al., 2019; Kuroki et al., 2019; Chen et al., 2019; Dai et al., 2019). The
latter, i.e., adversarial domain adaptation, has received increasing attention and popularity because
of its theoretical guarantees (Goodfellow et al., 2014; Zhao et al., 2018; Zhang et al., 2019; Zhao
et al., 2019), its ability to train end-to-end with neural networks, and consequently its promising
empirical performance. Also loosely related to our work is continuously indexed domain adaptation
(CIDA) Wang et al. (2020), which considers domains indexed by continuous values. These methods
typically treat every domain equally and enforce uniform alignment between source-domain data and
target-domain data; this is done by generating domain-invariant encodings, where domain invariance
is achieved by training the encoder to fool the discriminator that classiﬁes the domain index. In
contrast, we naturally relax such uniform alignment using a graph discriminator to reconstruct a
domain graph that describes domain adjacency."
RELATED WORK,0.03664921465968586,"Domain Adaptation Related to Graphs. There are also works related to both DA and graphs.
Usually they focus on adaptation between two domains where data points themselves are graphs. For
example, (Pilancı & Vural, 2019; Pilanci & Vural, 2020) use frequency analysis to align the data
graphs between the source domain and the target domains, and (Alam et al., 2018; Ding et al., 2018)
perform label propagation on the data graph."
RELATED WORK,0.03926701570680628,"In contrast, GRDA considers a setting completely different from the above references. Instead
of focusing on adapting between two domains with data points in the form of graphs (e.g., each
data point itself is a node), GRDA adapts across multiple domains (e.g., with each state in the US
as a domain) according to a domain graph (i.e., each domain is a node). Therefore the methods
above are not applicable to our setting. Note that (Mancini et al., 2019) uses metadata-weighted
batch normalization to propagate information among domains with similar metadata, but it is not an
adversarial domain adaptation method. It is orthogonal to GRDA and can be used as a backbone
network to further improve GRDA’s performance (see the Appendix for empirical results). It is also"
RELATED WORK,0.041884816753926704,Published as a conference paper at ICLR 2022
RELATED WORK,0.04450261780104712,"Classifying the Domain Index
Reconstructing the Domain Graph …"
RELATED WORK,0.04712041884816754,"Encoding
D"
RELATED WORK,0.049738219895287955,Encoding
RELATED WORK,0.05235602094240838,"Encoding
D
Encoding"
RELATED WORK,0.0549738219895288,"Figure 2: Difference between discriminators in traditional DA methods and the graph discriminator
in GRDA. Left: In traditional DA methods, the discriminator classiﬁes the domain index given an
encoding. Right: In GRDA, the graph discriminator reconstructs the domain graph given encodings
of data from different domains."
RELATED WORK,0.05759162303664921,"worth noting that, in this paper, we assume the domain graph is given. It would be interesting future
work to combine GRDA with domain relation inference methods (e.g., domain embeddings (Peng
et al., 2020)) when there is a natural but unobserved graph relation among domains."
METHOD,0.060209424083769635,"3
METHOD"
METHOD,0.06282722513089005,"In this section, we will ﬁrst brieﬂy introduce the problem setting and then elaborate our domain
adaptation method."
PROBLEM SETTING AND NOTATION,0.06544502617801047,"3.1
PROBLEM SETTING AND NOTATION"
PROBLEM SETTING AND NOTATION,0.06806282722513089,"We focus on the unsupervised domain adaptation setting with N domains in total. Each domain has a
discrete domain index u ∈U = [N] ≜{1, . . . , N}, belonging to either the source domain index set
Us or the target domain index set Ut. The relationship between domains is described by a domain
graph with the adjacency matrix A = [Aij], where i and j index nodes (domains) in the graph.
Given labeled data {(xs
l , ys
l , us
l )}n
l=1 from source domains (us
l ∈Us), unlabeled data {xt
l, ut
l}m
l=1
from target domains (ut
l ∈Ut), and the domain graph described by A, we want to predict the label
{yt
l}m
l=1 for data from target domains. Note that the domain graph is deﬁned on domains with each
domain (node) containing multiple data points."
PROBLEM SETTING AND NOTATION,0.07068062827225131,"3.2
GRAPH-RELATIONAL DOMAIN ADAPTATION (GRDA)"
PROBLEM SETTING AND NOTATION,0.07329842931937172,"Overview. We use an adversarial learning framework to perform adaptation across graph-relational
domains. The adversarial game consists of three players: (1) an encoder E, which takes as input
a datum xl, the associated domain index ul, and the adjacency matrix A to generate an encoding
el = E(xl, ul, A), (2) a predictor F, which makes predictions based on the encoding el, and
(3) a graph discriminator D, which guides the encoding to adapt across graph-relational domains.
Speciﬁcally, the discriminator D takes in a mini-batch of B encodings el (l ∈[B]), and tries to
reconstruct the domain graph A. By letting the encoder E play adversarially against the discriminator
D, the graph-relational information of domains will be removed from the encoding el in order to
make the discriminator D incapable of reconstructing the graph. Note that the graph discriminator
in our adversarial game is different from classic discriminators which classify the domain index, as
shown in Fig. 2."
PROBLEM SETTING AND NOTATION,0.07591623036649214,"Formally, GRDA performs a minimax optimization with the following loss function:"
PROBLEM SETTING AND NOTATION,0.07853403141361257,"min
E,F max
D
Lf(E, F) −λdLd(D, E),
(1)"
PROBLEM SETTING AND NOTATION,0.08115183246073299,"where Lf(E, F) is the predictor loss and Ld(D, E) is the discriminator loss, and λd is a hyperpa-
rameter balancing them two. Below we discussed these two terms in detail."
PROBLEM SETTING AND NOTATION,0.08376963350785341,"Predictor. In Eqn. 1, the predictor loss Lf(E, F) is deﬁned as"
PROBLEM SETTING AND NOTATION,0.08638743455497382,"Lf(E, F) ≜Es[hp(F(E(xl, ul, A)), y)],"
PROBLEM SETTING AND NOTATION,0.08900523560209424,"where the expectation Es is taken over the source-domain data distribution ps(x, y, u). hp(·, ·) is a
predictor loss function for the task (e.g., L2 loss for regression)."
PROBLEM SETTING AND NOTATION,0.09162303664921466,Published as a conference paper at ICLR 2022
PROBLEM SETTING AND NOTATION,0.09424083769633508,"Encoder and Node Embeddings. Given an input tuple (xl, ul, A), the encoder E ﬁrst computes a
graph-informed domain embedding zul based on the domain index ul and the domain graph A. Then
we feed zul along with xl into a neural network to obtain the ﬁnal encoding el. Formally we have
el = E(xl, ul, A) = f(xl, zul),
(2)
where f(·, ·) is a trainable neural network."
PROBLEM SETTING AND NOTATION,0.0968586387434555,"In theory, any embeddings for node (domain) indices should work equally well so long as they are
distinct from one another (thus forming a bijection to the set of domains [N]). Here we pre-train
the embeddings by a reconstruction loss for simplicity, and our intuition is that good embeddings of
nodes should inform us of (thus reconstruct) the graph structure. Suppose the nodes indices i and
j are sampled independently and identically from the marginal domain index distribution p(u); the
reconstruction loss is written as
Lg = Ei,j∼p(u)[−Aij log σ(z⊤
i zj) −(1 −Aij) log(1 −σ(z⊤
i zj))],"
PROBLEM SETTING AND NOTATION,0.09947643979057591,"where σ(x) =
1
1+e−x is the sigmoid function. Note that in general we could use any node embedding
methods (Grover & Leskovec, 2016; Tang et al., 2015; Kipf & Welling, 2016b), but this is not the
focus of this paper. For fair comparison, we use exactly the same encoder, i.e., E(x, u, A), for all the
methods in the experiments of Sec. 5."
PROBLEM SETTING AND NOTATION,0.10209424083769633,"Graph Discriminator. The discriminator loss Ld(D, E) in Eqn. 1 is deﬁned as"
PROBLEM SETTING AND NOTATION,0.10471204188481675,"Ld(D, E) ≜E(x1,u1),(x2,u2)[h(x1, u1, x2, u2)],
(3)"
PROBLEM SETTING AND NOTATION,0.10732984293193717,"h(x1, u1, x2, u2) = −Au1,u2 log σ(bz⊤
1 bz2) −(1 −Au1,u2) log(1 −σ(bz⊤
1 bz2),"
PROBLEM SETTING AND NOTATION,0.1099476439790576,"where bz1 = D(E(x1, u1, A)), bz2 = D(E(x2, u2, A)) are the discriminator’s reconstructions of
node embeddings. The expectation E is taken over a pair of i.i.d. samples (x1, u1),(x2, u2) from
the joint data distribution p(x, u). The discriminator loss Ld(D, E) essentially quantiﬁes how well
the reconstructed node embedding bz1,bz2 preserve the information of the original connections, or,
equivalently, A. We refer readers to the Appendix for detailed model architectures."
PROBLEM SETTING AND NOTATION,0.112565445026178,"Due to the adversarial nature of how the discriminator D and the encoder E engage with the loss,
the discriminator D would aim to recover the domain graph via the adjacency structure (A), while
the encoder E would prevent the discriminator D from doing so. Intuitively, if the discriminator D
is powerful enough to uncover any information regarding the domain graph in the encoding el, the
optimal encoder E will have to remove all the information regarding graph-relational domains in the
encoding el, thus successfully adapting across graph-relational domains. We will formally elaborate
the above arguments further in the next section."
THEORY,0.11518324607329843,"4
THEORY"
THEORY,0.11780104712041885,"In this section, we ﬁrst provide theoretical guarantees that at equilibrium GRDA aligns domains
according to any given domain graph. Speciﬁcally, we analyze a game where the graph discriminator
D tries to reconstruct the domain graph while the (joint) encoder E tries to prevent such reconstruction.
To gain more insight on the encoding alignment, we then further discuss the implication of these
general theoretical results on GRDA’s global optimum using simple example graphs such as cliques,
stars, and chains. All proofs of lemma, theorem and corollary can be found in Appendix A."
ANALYSIS FOR GRDA,0.12041884816753927,"4.1
ANALYSIS FOR GRDA"
ANALYSIS FOR GRDA,0.12303664921465969,"For simplicity, we ﬁrst consider a game which only involves the joint encoder E and the graph
discriminator D with extension to the full game later. Speciﬁcally, we focus on following loss
function:
max
E
min
D Ld(D, E),
(4)"
ANALYSIS FOR GRDA,0.1256544502617801,"where Ld(D, E) is deﬁned in Eqn. 3."
ANALYSIS FOR GRDA,0.12827225130890052,"Lemma 4.1 below analyzes the optimal graph discriminator D given a ﬁxed joint encoder E. In-
tuitively, it states that given two encodings e and e′, the optimal D will output the conditional
expectation of Aij over all possible combinations of domain pairs (i, j) sampled from p(u|e) and
p(u|e′)."
ANALYSIS FOR GRDA,0.13089005235602094,Published as a conference paper at ICLR 2022
ANALYSIS FOR GRDA,0.13350785340314136,"Lemma 4.1 (Optimal Discriminator for GRDA). For E ﬁxed, the optimal D satisﬁes following
equation,"
ANALYSIS FOR GRDA,0.13612565445026178,"σ(D(e)⊤D(e′)) = Ei∼p(u|e),j∼p(u|e′)[Aij],"
ANALYSIS FOR GRDA,0.1387434554973822,"where e and e′ are from the encoding space.
Theorem 4.1 (Global Optimum for GRDA with General Domain Graphs). Given an adjacency
matrix A, the total loss in Eqn. 4 has a tight upper bound:"
ANALYSIS FOR GRDA,0.14136125654450263,"Ld(D, E) ≤H(Ee,e′α(e, e′)) = H(Ei,j[Aij]),"
ANALYSIS FOR GRDA,0.14397905759162305,"where H denotes the entropy function, H(p) = −p log(p) −(1 −p) log(1 −p), and α(e, e′) =
Ei∼p(u|e),j∼p(u|e′)[Aij]. Furthermore, the equality, i.e., the optimum, is achieved when"
ANALYSIS FOR GRDA,0.14659685863874344,"α(e, e′) = Ei,j[Aij], for any e, e′,"
ANALYSIS FOR GRDA,0.14921465968586387,"or equivalently, Ei,j[Aij|e, e′] = Ei,j[Aij], where (e, e′) is from the encoding space."
ANALYSIS FOR GRDA,0.1518324607329843,"Essentially, Theorem 4.1 shows that if trained to the global optimum, GRDA aligns the domain
distribution p(u|e) for all locations in the embedding space such that α(ei, ej) is identical to the
constant, Eij[Aij], for any pair (ei, ej)."
ANALYSIS FOR GRDA,0.1544502617801047,"We can directly apply Theorem 4.1 to evaluate the training process. During training, if the discrimi-
nator loss ﬁnally converges to the theoretical optimum H(Ei,j[Aij]) (Figure 3), we would know that
our training succeeds."
ANALYSIS FOR GRDA,0.15706806282722513,"An interesting property of GRDA is that uniform alignment is a solution for any domain graph, as
shown in Corollary 4.1 below.
Corollary 4.1. For GRDA, the global optimum of total loss Ld(D, E) is achieved if the encoding of
all domains (indexed by u) are perfectly (uniformly) aligned, i.e., e ⊥u."
ANALYSIS FOR GRDA,0.15968586387434555,"50
100
150
200
250
Epochs 0.64 0.65 0.66 0.67 0.68 0.69 0.70 Loss"
ANALYSIS FOR GRDA,0.16230366492146597,"Global Optimum of GRDA v.s Ld(D, E)"
ANALYSIS FOR GRDA,0.1649214659685864,"H(
i, j[Aij])"
ANALYSIS FOR GRDA,0.16753926701570682,Discriminator Loss
ANALYSIS FOR GRDA,0.17015706806282724,"Figure 3:
Global Optimum of GRDA v.s.
Ld(D, E) during training process. The loss of
the discriminator ﬁnally converges to the theoret-
ical optimum H(Ei,j[Aij])."
ANALYSIS FOR GRDA,0.17277486910994763,"Note that replacing the inner product inside σ(·)
with other functions (e.g., L2 distance) does not
change Lemma 4.1 and Theorem 4.1, as long as
cross-entropy loss is used to consider both positive
and negative edges in the graph."
ANALYSIS FOR GRDA,0.17539267015706805,"We can also analyze the full game as deﬁned in
Eqn. 1 (see the Appendix for details).
Theorem 4.2. If the encoder E, the predictor F
and the discriminator D have enough capacity
and are trained to reach optimum, any global op-
timal encoder E∗has the following properties:"
ANALYSIS FOR GRDA,0.17801047120418848,"H(y|E∗(x, u, A)) = H(y|x, u, A),
(5)"
ANALYSIS FOR GRDA,0.1806282722513089,where H(·|·) denotes the conditional entropy.
ANALYSIS FOR GRDA,0.18324607329842932,"Theorem 4.2 implies that, at equilibrium, the op-
timal joint encoder E produces encodings that
preserve all the information about the label y con-
tained in the data x and the domain index u. There-
fore, the global optimum of the two-player game between E and D matches the global optimum of
the three-play game between E, D, and F."
ANALYSIS FOR GRDA,0.18586387434554974,"4.2
IMPLICATION OF GRDA’S GLOBAL OPTIMUM"
ANALYSIS FOR GRDA,0.18848167539267016,"Sec. 4.1 analyzes the global optimum of GRDA in its general form. In this section, we further discuss
the implication of these general theoretical results using simple example graphs such as cliques, stars,
and chains; we show that GRDA’s global optimum actually translates to domain-graph-informed
constraints on the embedding distributions of every domain."
ANALYSIS FOR GRDA,0.19109947643979058,"With N domains in total, we assume each domain contains the same amount of data, i.e. p(u =
1) = · · · = p(u = N) = N −1. We further use pi(e) as a shorthand for p(e|u = i), the embedding"
ANALYSIS FOR GRDA,0.193717277486911,Published as a conference paper at ICLR 2022
ANALYSIS FOR GRDA,0.19633507853403143,"Figure 4: Example domain graphs as discussed
in Sec. 4.2. Left: Cliques. Middle: Star graphs.
Right: Chain graphs."
ANALYSIS FOR GRDA,0.19895287958115182,"p1(𝒆)
p2(𝒆)
p3(𝒆)"
ANALYSIS FOR GRDA,0.20157068062827224,"𝒆1
𝒆1
𝒆1"
ANALYSIS FOR GRDA,0.20418848167539266,Domain Graph:
ANALYSIS FOR GRDA,0.20680628272251309,"Encoding
Distributions:"
ANALYSIS FOR GRDA,0.2094240837696335,"Figure 5: Possible encoding distributions of three
domains forming a chain graph of three nodes at
equilibrium. We can see that for any encoding,
e.g., e1, we have p2(e1) = 1"
ANALYSIS FOR GRDA,0.21204188481675393,2(p1(e1) + p3(e1)).
ANALYSIS FOR GRDA,0.21465968586387435,"distribution in domain i. With our assumption, the marginal embedding distribution is the average em-
bedding distribution over all domains, i.e., p(e) = N −1 PN
i=1 pi(e). We deﬁne βi(e) = pi(e)/p(e),
as the ratio between domain-speciﬁc embedding distribution and the marginal embedding distribution."
ANALYSIS FOR GRDA,0.21727748691099477,"Cliques (Fully Connected Graphs). In this example, the N domains in our domain graph are fully
connected, i.e. there is an edge between any pair of domains, as shown in Fig. 4 (left).
Corollary 4.2 (Cliques). In a clique, the GRDA optimum is achieved if and only if the embedding
distributions of all the domains are the same, i.e. p1(e) = · · · = pN(e) = p(e), ∀e."
ANALYSIS FOR GRDA,0.2198952879581152,"Interestingly, Corollary 4.2 shows that at equilibrium, GRDA recovers the uniform alignment of
classic domain adaptation methods when the domain graph is a clique. Among all connected graphs
with N nodes (domains), a clique has the largest number of edges, and therefore GRDA enforces the
least ﬂexible alignment, i.e., uniform alignment, when the domain graph is a clique."
ANALYSIS FOR GRDA,0.22251308900523561,"Star Graphs. In this example, we have N domains forming a star graph (as shown in Fig. 4 (middle)),
where domain 1 is the center of the star while all other domains are connected to domain 1.
Corollary 4.3 (Star Graphs). In a star graph, the GRDA optimum is achieved if and only if
the embedding distribution of the center domain is the average of all peripheral domains, i.e.
p1(e) =
1
N−1
PN
i=2 pi(e), ∀e."
ANALYSIS FOR GRDA,0.225130890052356,"Corollary 4.3 shows that compared to cliques, GRDA enforces a much more ﬂexible alignment when
the domain graph is a star graph. It only requires the embedding distribution of the center domain to
be the average of all peripheral domains. In this case, peripheral domains can have very different
embedding distributions."
ANALYSIS FOR GRDA,0.22774869109947643,"Chain Graphs. In this example, we consider the case where N domains form a chain, i.e., domain i
is only connected to domain i −1 (unless i = 1) and domain i + 1 (unless i = N), as shown in Fig. 4
(right).
Corollary 4.4 (Chain Graphs). Let pi(e) = p(e|u = i) and the average encoding distribution
p(e) = N −1 PN
i=1 p(e|u = i). In a chain graph, the GRDA optimum is achieved if and only if ∀e, e′ N−1
X i=1"
ANALYSIS FOR GRDA,0.23036649214659685,pi(e)pi+1(e′) + pi(e′)pi+1(e)
ANALYSIS FOR GRDA,0.23298429319371727,"p(e)p(e′)
= 2(N −1)."
ANALYSIS FOR GRDA,0.2356020942408377,"Corollary 4.4 shows that in a chain graph of N domains, direct interactions only exist in domain
pairs(i, i −1) (i.e., consecutive domains in the chain)."
