Section,Section Appearance Order,Paragraph
ABSTRACT,0.0,ABSTRACT
ABSTRACT,0.0014367816091954023,"Similarity-based clustering methods separate data into clusters according to the
pairwise similarity between the data, and the pairwise similarity is crucial for their
performance. In this paper, we propose Clustering by Discriminative Similarity
(CDS), a novel method which learns discriminative similarity for data clustering.
CDS learns an unsupervised similarity-based classifier from each data partition,
and searches for the optimal partition of the data by minimizing the generalization
error of the learnt classifiers associated with the data partitions. By generaliza-
tion analysis via Rademacher complexity, the generalization error bound for the
unsupervised similarity-based classifier is expressed as the sum of discriminative
similarity between the data from different classes. It is proved that the derived dis-
criminative similarity can also be induced by the integrated squared error bound
for kernel density classification. In order to evaluate the performance of the pro-
posed discriminative similarity, we propose a new clustering method using a ker-
nel as the similarity function, CDS via unsupervised kernel classification (CDSK),
with its effectiveness demonstrated by experimental results."
INTRODUCTION,0.0028735632183908046,"1
INTRODUCTION"
INTRODUCTION,0.004310344827586207,"Similarity-based clustering methods segment the data based on the similarity measure between the
data points, such as spectral clustering (Ng et al., 2001), pairwise clustering method (Shental et al.,
2003), K-means (Hartigan & Wong, 1979), and kernel K-means (Sch¨olkopf et al., 1998). The suc-
cess of similarity-based clustering highly depends on the underlying pairwise similarity over the
data, which in most cases are constructed empirically, e.g., by Gaussian kernel or the K-Nearest-
Neighbor (KNN) graph. In this paper, we model data clustering as a multiclass classification prob-
lem and seek for the data partition where the associated classifier, trained on cluster labels, can have
low generalization error. Therefore, it is natural to formulate data clustering problem as a problem
of training unsupervised classifiers: a classifier can be trained upon each candidate partition of the
data, and the quality of the data partition can be evaluated by the performance of the trained classi-
fier. Such classifier trained on a hypothetical labeling associated with a data partition is termed an
unsupervised classifier."
INTRODUCTION,0.005747126436781609,"We present Clustering by Discriminative Similarity (CDS), wherein discriminative similarity is de-
rived by the generalization error bound for an unsupervised similarity-based classifier. CDS is based
on a novel framework of discriminative clustering by unsupervised classification wherein an un-
supervised classifier is learnt from unlabeled data and the preferred hypothetical labeling should
minimize the generalization error bound for the learnt classifier. When the popular Support Vector
Machines (SVMs) is used in this framework, unsupervised SVM (Xu et al., 2004) can be deduced. In
this paper, a similarity-based classifier motivated by similarity learning (Balcan et al., 2008; Cortes
et al., 2013), is used as the unsupervised classifier. By generalization analysis via Rademacher com-
plexity, the generalization error bound for the unsupervised similarity-based classifier is expressed as
sum of pairwise similarity between the data from different classes. Such pairwise similarity, param-
eterized by the weights of the unsupervised similarity-based classifier, serves as the discriminative
similarity. The term “discriminative similarity” emphasizes the fact that the similarity is learnt so as"
INTRODUCTION,0.007183908045977011,"Yingzhen Yang’s work was conducted as a consulting researcher at Baidu Research - Bellevue, WA, USA."
INTRODUCTION,0.008620689655172414,Published as a conference paper at ICLR 2022
INTRODUCTION,0.010057471264367816,"to improve the discriminative capability of a certain classifier such as the aforementioned unsuper-
vised similarity-based classifier."
CONTRIBUTIONS AND MAIN RESULTS,0.011494252873563218,"1.1
CONTRIBUTIONS AND MAIN RESULTS"
CONTRIBUTIONS AND MAIN RESULTS,0.01293103448275862,"Firstly, we present Clustering by Discriminative Similarity (CDS) where discriminative similarity
is induced by the generalization error bound for unsupervised similarity-based classifier on unla-
beled data. The generalization bound for such similarity-based classifier is of independent interest,
which is among the few results of generalization bounds for classification using general similar-
ity functions (Section B.1 of Appendix). When the general similarity function is set to a Positive
Semi-Definite (PSD) kernel, the derived discriminative similarity between two data points xi,xj is
SK
ij = 2(αi+αj −λαiαj)K(xi −xj), where K can be an arbitrary PSD kernel and αi is the kernel
weight associated with xi. With theoretical and empirical study, we argue that SK
ij should be used
for data clustering instead of the conventional kernel similarity corresponding to uniform kernel
weights. In the case of binary classification, we prove that the derived discriminative similarity SK
ij
has the same form as the similarity induced by the integrated squared error bound for kernel density
classification (Section A of the appendix). Such connection suggests that there exists information-
theoretic measure which is implicitly equivalent to our CDS framework for unsupervised learning,
and our CDS framework is well grounded for learning similarity from unlabeled data."
CONTRIBUTIONS AND MAIN RESULTS,0.014367816091954023,"Secondly, based on our CDS model, we develop a clustering algorithm termed Clustering by Dis-
criminative Similarity via unsupervised Kernel classification (CDSK) in Section 5. CDSK uses a
PSD kernel as the similarity function, and outperforms competing clustering algorithms, including
nonparametric discriminative similarity based clustering methods and similarity graph based cluster-
ing methods, demonstrating the effectiveness of CDSK. When the kernel weights {αi} are uniform,
CDSK is equivalent to kernel K-Means (Sch¨olkopf et al., 1998). CDSK is more flexible by learning
adaptive kernel weights associated with different data points."
CONNECTION TO RELATED WORKS,0.015804597701149427,"1.2
CONNECTION TO RELATED WORKS"
CONNECTION TO RELATED WORKS,0.017241379310344827,"Our CDS model is related to a class of discriminative clustering methods which classify unlabeled
data by various measures on discriminative unsupervised classifiers, and the measures include gen-
eralization error (Xu et al., 2004) or the entropy of the posterior distribution of the label (Gomes
et al., 2010). Discriminative clustering methods (Xu et al., 2004) predict the labels of unlabeled
data by minimizing the generalization error bound for the unsupervised classifier with respect to
the hypothetical labeling. Unsupervised SVM is proposed in Xu et al. (2004) which learns a binary
classifier to partition unlabeled data with the maximum margin between different clusters. The the-
oretical properties of unsupervised SVM are further analyzed in Karnin et al. (2012). Kernel logistic
regression classifier is employed in Gomes et al. (2010), and it uses the entropy of the posterior dis-
tribution of the class label by the classifier to measure the quality of the hypothetical labeling. CDS
model performs discriminative clustering based on a novel unsupervised classification framework by
considering similarity-based or kernel classifiers which are important classification methods in the
supervised learning literature. In contrasts with kernel similarity with uniform weights, the induced
discriminative similarity with learnable weights enhances its capability to represent complex inter-
connection between data. The generalization analysis for CDS is primarily based on distribution free
Rademacher complexity. While Yang et al. (2014a) propose nonparametric discriminative similarity
for clustering, the nonparametric similarity requires probability density estimation which is difficult
for high-dimensional data, and the fixed nonparametric similarity is not adaptive to complicated data
distribution."
CONNECTION TO RELATED WORKS,0.01867816091954023,"The paper is organized as follows. We introduce the problem setup of Clustering by Discrimina-
tive Similarity in Section 3. We then derive the generalization error bound for the unsupervised
similarity-based classifier for CDS in Section 4 where the proposed discriminative similarity is in-
duced by the error bound. The application of CDS to data clustering is shown in Section 5. Through-
out this paper, the term kernel stands for the PSD kernel if no special notes are made."
CONNECTION TO RELATED WORKS,0.020114942528735632,Published as a conference paper at ICLR 2022
"SIGNIFICANCE OF CDSK OVER EXISTING DISCRIMINATIVE AND
SIMILARITY-BASED CLUSTERING METHODS",0.021551724137931036,"2
SIGNIFICANCE OF CDSK OVER EXISTING DISCRIMINATIVE AND
SIMILARITY-BASED CLUSTERING METHODS"
"SIGNIFICANCE OF CDSK OVER EXISTING DISCRIMINATIVE AND
SIMILARITY-BASED CLUSTERING METHODS",0.022988505747126436,"Effective data similarity highly depends on the underlying probabilistic distribution and geometric
structure of the data, and these two characteristics leads to “data-driven” similarity, such as Zhu
et al. (2014); Bicego et al. (2021); Ng et al. (2001); Shental et al. (2003); Hartigan & Wong (1979);
Sch¨olkopf et al. (1998) and similarity based on geometric structure of the data, such as the subspace
structure (Sparse Subspace Clustering, or SSC in Elhamifar & Vidal (2013)). Note that the sparse
graph method, ℓ1-Graph (Yan & Wang, 2009), has the same formulation as SSC. Most existing clus-
tering methods based on data-driven or geometric structure-driven similarity suffer from a common
deficiency, that is, the similarity is not explicitly optimized for the purpose of separating underlying
clusters. In particular, the Random Forest-based similarity (Zhu et al., 2014; Bicego et al., 2021) is
extracted from features in decision trees. Previous works about subspace-based similarity (Yan &
Wang, 2009; Elhamifar & Vidal, 2013) try to make sure that only data points lying on or close to
the same subspace have nonzero similarity, so that data points from the same subspace can form a
cluster. However, it is not guaranteed that features in the decision trees are discriminative enough to
separate clusters, because the candidate data partition (or candidate cluster labels) do not participate
in the feature or similarity extraction process. Note that synthetically generated negative class are
suggested in Zhu et al. (2014); Bicego et al. (2021) to train unsupervised random forest, however, the
synthetic labels are not for the original data. Moreover, it is well known that the existing subspace
learning methods only obtain reliable subspace-based similarity with restrictive geometric assump-
tions on the data and the underlying subspaces, such as large principal angle between intersecting
subspaces (Soltanolkotabi & Candes, 2012; Elhamifar & Vidal, 2013)."
"SIGNIFICANCE OF CDSK OVER EXISTING DISCRIMINATIVE AND
SIMILARITY-BASED CLUSTERING METHODS",0.02442528735632184,"Therefore, it is particularly important to derive similarity for clustering which meets two require-
ments: (1) discriminative measure with information such as cluster partition is used to derive such
similarity so as to achieve compelling clustering performance; (2) it requires less restrictive assump-
tions on the geometric structure of the data than current geometric structure-based similarity learning
methods, such as subspace clustering (Yan & Wang, 2009; Elhamifar & Vidal, 2013)."
"SIGNIFICANCE OF CDSK OVER EXISTING DISCRIMINATIVE AND
SIMILARITY-BASED CLUSTERING METHODS",0.02586206896551724,"Significance.
The proposed discriminative similarity of this paper meets these two requirements.
First, the discriminative similarity is derived by the generalization error bound associated with candi-
date cluster labeling, and minimizing the objective function of our optimization problem for cluster-
ing renders a joint optimization of discriminative similarity and candidate cluster labeling in a way
such that the similarity-based classifier has small generalization error bound. Second, our framework
only assumes a mild classification model in Definition 3.1, which only requires an unknown joint
distribution over data and its labels. In this way, the restrictive geometric assumptions are avoided in
our method. Compared to the existing discriminative clustering methods, such as MMC (Xu et al.,
2004), BMMC (Chen et al., 2014), RIM (Gomes et al., 2010), and the other discriminative clustering
methods such as (Huang et al., 2015; Nguyen et al., 2017), the optimization problem of CDSK with
discriminative similarity-based formulation is much easier to solve and it enjoys convexity and effi-
ciency in each iteration of coordinate descent described in Algorithm 1. In particular, as mentioned
in Section D of the appendix, the first step (11) of each iteration can be solved by efficient SVD or
other randomized large-scale SVD methods, and the second step (12) of each iteration can be solved
by efficient SMO (Platt, 1998). Moreover, the optimization problems in these two steps are either
convex or having closed-form solution. In contrast, MMC requires expensive semidefinite program-
ming. RIM has to solve a nonconvex optimization problem and its formulation does not guarantee
that the trained multi-class kernelized logistic regression has low classification error on candidate
labeling, which explains why it has inferior performance compared to our method. The discrimina-
tive Extreme Learning Machine (Huang et al., 2015) trains ELM using labels produced by a simple
clustering method such as K-means, and the potentially poor cluster labels by the simple clustering
method can easily result in unsatisfactory performance of this method. The discriminative Bayesian
nonparametric clustering (Nguyen et al., 2017) and BMMC (Chen et al., 2014) require extra efforts
of sampling hidden variables and tuning hyperparameters to generate the desirable number of clus-
ters (or model selection), which could reduce the effect of discriminative measures used in these
Bayesian nonparametric methods."
"SIGNIFICANCE OF CDSK OVER EXISTING DISCRIMINATIVE AND
SIMILARITY-BASED CLUSTERING METHODS",0.027298850574712645,Published as a conference paper at ICLR 2022
PROBLEM SETUP,0.028735632183908046,"3
PROBLEM SETUP"
PROBLEM SETUP,0.03017241379310345,"We introduce the problem setup of the formulation of clustering by unsupervised classification.
Given unlabeled data {xl}n
l=1 ⊂Rd, clustering is equivalent to searching for the hypothetical la-
beling which is optimal in some sense. Each hypothetical labeling corresponds to a candidate data
partition. Figure 1 illustrates four binary hypothetical labelings which correspond to four partitions
of the data, and the data is divided into two clusters by each hypothetical labeling. +
−
+ +
+ +
− −
−
− − +
− + +
+ + − − −
− − + − +
+ + + − − −
− − + − +
+ +
+
− − −
−
−"
PROBLEM SETUP,0.031609195402298854,Figure 1: Illustration of binary hypothetical labelings
PROBLEM SETUP,0.033045977011494254,"The discriminative clustering literature (Xu et al., 2004; Gomes et al., 2010) has demonstrated the
potential of multi-class classification for clustering problem. Inspired by the natural connection
between clustering and classification, we proposes the framework of Clustering by Unsupervised
Classification which models clustering problem as a multi-class classification problem. A classifier
is learnt from unlabeled data with a hypothetical labeling, which is associated with a candidate
partition of the unlabeled data. The optimal hypothetical labeling is supposed to be the one such that
its associated classifier has the minimum generalization error bound. To study the generalization
bound for the classifier learnt from hypothetical labeling, the concept of classification model is
needed. Given unlabeled data {xl}n
l=1, a classification model MY is constructed for any hypothetical
labeling Y = {yl}n
l=1 as follows.
Definition 3.1. The classification model corresponding to the hypothetical labeling Y = {yl}n
l=1 is
defined as MY = (S, F). S = {xl, yl}n
l=1 are the labeled data by the hypothetical labeling Y, and
S are assumed to be i.i.d. samples drawn from the some unknown joint distribution PXY , where
(X, Y ) is a random couple, X ∈X ⊆Rd represents the data in some compact domain X, and
Y ∈{1, 2, ..., c} is the class label of X, c is the number of classes. F is a classifier trained on S.
The generalization error of the classification model MY is defined as the generalization error of the
classifier F in MY."
PROBLEM SETUP,0.034482758620689655,"The basic assumption of CDS is that the optimal hypothetical labeling minimizes the gener-
alization error bound for the classification model. With f being different classifiers, different
discriminative clustering models can be derived. When SVMs is used as the classifier F in the
above discriminative model, unsupervised SVM (Xu et al., 2004) is obtained."
PROBLEM SETUP,0.035919540229885055,"In Balcan et al. (2008), the authors proposes a classification method using general similarity func-
tions. The classification rule measures the similarity of the test data to each class, and then assigns
the test data to the class such that the weighed average of the similarity between the test data and the
training data belonging to that class is maximized over all the classes. Inspired by this classification
method, we now consider using a general symmetric and continuous function S : X × X →[0, 1]
as the similarity function in our CDS model. We propose the following hypothesis,"
PROBLEM SETUP,0.03735632183908046,"hS(x, y) =
X"
PROBLEM SETUP,0.03879310344827586,"i: yi=y
αiS(x, xi).
(1)"
PROBLEM SETUP,0.040229885057471264,"In the next section, we derive generalization bound for the unsupervised similarity-based classifier
based on the above hypothesis, and such generalization bound leads to discriminative similarities
for data clustering. When S is a PSD kernel, minimizing the generalization error bound amounts to
minimization of a new form of kernel similarity between data from different clusters, which lays the
foundation of a new clustering algorithm presented in Section 5."
GENERALIZATION BOUND FOR SIMILARITY-BASED CLASSIFIER,0.041666666666666664,"4
GENERALIZATION BOUND FOR SIMILARITY-BASED CLASSIFIER"
GENERALIZATION BOUND FOR SIMILARITY-BASED CLASSIFIER,0.04310344827586207,"In this section, the generalization error bound for the classification model in Definition 3.1 with the
unsupervised similarity-based classifier is derived as a sum of discriminative similarity between the
data from different classes."
GENERALIZATION BOUND FOR SIMILARITY-BASED CLASSIFIER,0.04454022988505747,Published as a conference paper at ICLR 2022
GENERALIZATION BOUND,0.04597701149425287,"4.1
GENERALIZATION BOUND"
GENERALIZATION BOUND,0.04741379310344827,"The following notations are introduced before our analysis. Let α = [α1, . . . , αn]⊤be the nonzero
weights that sum up to 1, α(y) be a n × 1 column vector representing the weights belonging to
class y such that α(y)
i
is αi if y = yi, and 0 otherwise. The margin of the labeled sample (x, y) is
defined as mhS(x, y) = hS(x, y) −argmaxy′̸=yhS(x, y′), the sample (x, y) is classified correctly
if mhS(x, y) ≥0."
GENERALIZATION BOUND,0.04885057471264368,"The general similarity-based classifier fS predicts the label of the input x by fS(x)
=
argmaxy∈{1,...,c}hS(x, y). We then begin to derive the generalization error bound for fS using the
Rademacher complexity of the function class comprised of all the possible margin functions mhS.
The Rademacher complexity (Bartlett & Mendelson, 2003; Koltchinskii, 2001) of a function class
is defined below:"
GENERALIZATION BOUND,0.05028735632183908,"Definition 4.1. Let {σi}n
i=1 be n i.i.d. random variables such that Pr[σi = 1] = Pr[σi = −1] = 1"
THE RADEMACHER COMPLEXITY OF A FUNCTION CLASS A IS DEFINED AS,0.05172413793103448,"2.
The Rademacher complexity of a function class A is defined as"
THE RADEMACHER COMPLEXITY OF A FUNCTION CLASS A IS DEFINED AS,0.05316091954022988,"R(A) = E{σi},{xi} """
THE RADEMACHER COMPLEXITY OF A FUNCTION CLASS A IS DEFINED AS,0.05459770114942529,"sup
h∈A"
N,0.05603448275862069,"1
n n
X"
N,0.05747126436781609,"i=1
σih(xi)  # .
(2)"
N,0.05890804597701149,"In order to analyze the generalization property of the classification rule using the general similarity
function, we first investigate the properties of general similarity function and its relationship to PSD
kernels in terms of eigenvalues and eigenfunctions of the associated integral operator. The integral
operator (LSf)(x) =
R
S(x, t)f(t)dt is well defined. It can be verified that LS is a compact
operator since S is continuous. According to the spectral theorem in operator theory, there exists
an orthonormal basis {ϕ1, ϕ2, . . .} of L2 which is comprised of the eigenfunctions of LS, where
L2 is the space of measurable functions which are defined over X and square Lebesgue integrable.
ϕk is the eigenfunction of LS with eigenvalue λk if LSϕk = λkϕk. The following lemma shows
that under certain assumption on the eigenvalues and eigenfunctions of LS, a general symmetric and
continuous similarity can be decomposed into two PSD kernels."
N,0.0603448275862069,"Lemma 4.1. Suppose S : X × X →[0, 1] is a symmetric continuous function, and {λk} and {ϕk}
are the eigenvalues and eigenfunctions of LS respectively. Suppose P"
N,0.0617816091954023,"k≥1
λk|ϕk(x)|2 < C for some"
N,0.06321839080459771,"constant C > 0. Then S(x, t) = P"
N,0.06465517241379311,"k≥1
λkϕk(x)ϕk(t) for any x, t ∈X, and it can be decomposed as"
N,0.06609195402298851,"the difference between two positive semi-definite kernels: S(x, t) = S+(x, t) −S−(x, t), with"
N,0.06752873563218391,"S+(x, t) =
X"
N,0.06896551724137931,"k : λk≥0
λkϕk(x)ϕk(t),
S−(x, t) =
X"
N,0.07040229885057471,"k:λk<0
|λk|ϕk(x)ϕk(t).
(3)"
N,0.07183908045977011,We now use a regularization term to bound the Rademacher complexity for the classification
N,0.07327586206896551,"rule using the general similarity function.
Let Ω+(α) =
cP"
N,0.07471264367816093,"y=1
α(y)⊤S+α(y) and Ω−(α) = cP"
N,0.07614942528735633,"y=1
α(y)⊤S−α(y) with [S+]ij = S+(xi, xj) and [S−]ij = S−(xi, xj). The space Hy of all the"
N,0.07758620689655173,"hypothesis hS(·, y) associated with label y is defined as"
N,0.07902298850574713,"HS,y = {(x, y) →
X"
N,0.08045977011494253,"i: yi=y
αiS(x, xi): α ≥0, 1⊤α = 1, Ω+(α) ≤B+2, Ω−(α) ≤B−2}"
N,0.08189655172413793,"for 1
≤
y
≤
c, with positive number B+ and B−which bound Ω+ and Ω−respec-
tively. Let the hypothesis space comprising all possible margin functions be HS = {(x, y) →
mhS(x, y): hS(x, y) ∈HS,y}. We then present the main result in this section about the generaliza-
tion error of unsupervised similarity-based classifier fS."
N,0.08333333333333333,"Theorem 4.2. Given the discriminative model MY = (S, fS), suppose Ω+(α) ≤B+2, Ω−(α) ≤
B−2, supx∈X |S+(x, x)| ≤R2, supx∈X |S−(x, x)| ≤R2 for positive constants B+, B−and R.
Then with probability 1 −δ over the labeled data S with respect to any distribution in PXY , under"
N,0.08477011494252873,Published as a conference paper at ICLR 2022
N,0.08620689655172414,"the assumptions of Lemma 4.1, the generalization error of the general classifier fS satisfies"
N,0.08764367816091954,R(fS) =Pr [Y ̸= fS(X)]
N,0.08908045977011494,≤bRn(fS) + 8R(2c −1)c(B+ + B−)
N,0.09051724137931035,"γ√n
+
16c(2c −1)(B+ + B−)R2"
N,0.09195402298850575,"γ
+ 1
 s log 4"
N,0.09339080459770115,"δ
2n , (4)"
N,0.09482758620689655,where bRn(fS) = 1 n nP
N,0.09626436781609195,"i=1
Φ
 hS(xi,yi)−argmaxy′̸=yhS(xi,y′)"
N,0.09770114942528736,"γ

is the empirical loss of fS on the labeled"
N,0.09913793103448276,"data, γ > 0 is a constant and Φ is defined as Φ(x) = min {1, max{0, 1 −x}}. Moreover, if γ ≥1,
the empirical loss bRn(fS) satisfies"
N,0.10057471264367816,"bRn(fS) ≤1 −1 nγ n
X i,j=1"
N,0.10201149425287356,αi + αj
N,0.10344827586206896,"2
S(xi, xj) + 1 nγ n
X"
N,0.10488505747126436,"1≤i<j≤n
2(αi + αj)S(xi, xj)1Iyi̸=yj.
(5)"
