Section,Section Appearance Order,Paragraph
THEORETICAL ANALYSIS,0.2126984126984127,"so we obtain a convergence rate for EIπ of Ln(EIπ,n, Dn, Hℓ(X), R) = O(n−(ν∧1)/d(log n)γ)."
THEORETICAL ANALYSIS,0.21587301587301588,"Thus, we determine that the weighting introduced by EIπ does not negatively impact the worst-case
convergence rate. The short-term performance is controlled by the user in their choice of π(x) and
β. This result is coherent with intuition, as a weaker prior or quicker decay will yield a short-term
performance closer to that of EI. In contrast, a stronger prior or slower decay does not guarantee the
same short-term performance, but can produce better empirical results, as shown in Section 4."
THEORETICAL ANALYSIS,0.21904761904761905,Published as a conference paper at ICLR 2022
RESULTS,0.2222222222222222,"4
RESULTS"
RESULTS,0.2253968253968254,"We empirically demonstrate the efﬁciency of πBO in three different settings. As πBO is a general
method to augment acquisition functions, it can be implemented in different parent BO packages,
and the implementation in any given package inherits the pros and cons of that package. To minimize
confounding factors concerning this choice of parent package, we keep comparisons within the
methods in one package where possible and provide results in the other packages in Appendix C. In
Sec. 4.2, using Spearmint as a parent package, we evaluate πBO against three intuitive baselines to
assess its performance and robustness on priors with different qualities, ranging from very accurate
to purposefully detrimental. To this end, we use toy functions and cheap surrogates, where priors
of known quality can be obtained. Next, in Sec. 4.3, we compare πBO against two competitive
approaches (BOPrO and BOWS) that integrate priors over the optimum similarly to πBO, using
HyperMapper (Nardi et al., 2019) as a parent framework, in which the most competitive baseline
BOPrO is implemented. For these experiments we adopt a Multilayer Perceptron (MLP) benchmark
on various datasets, using the interface provided by HPOBench (Eggensperger et al., 2021), with
priors constructed around the defaults provided by the library. Lastly, in Sec. 4.4, we apply πBO
and other approaches to two deep learning tasks, also using priors derived from publicly available
defaults. Further, we demonstrate the ﬂexibility of πBO in Appendix B, where we evaluate πBO in
SMAC (Hutter et al., 2011; Lindauer et al., 2021) with random forests, as another framework with
another surrogate model, and adapt it to use the UCB, TS and PI acquisition functions instead of EI."
EXPERIMENTAL SETUP,0.22857142857142856,"4.1
EXPERIMENTAL SETUP"
EXPERIMENTAL SETUP,0.23174603174603176,"Priors
For our surrogate and toy function tasks, we follow the prior construction methodology
in BOPrO (Souza et al., 2021) and create three main types of prior qualities, all Gaussian: strong,
weak and wrong. The strong and weak priors are located to have a high and moderate density on
the optimum, respectively. The wrong prior is a narrow distribution located in the worst region
of the search space. For the OpenML MLP tuning benchmark, we utilize the defaults and search
spaces provided in HPOBench (Eggensperger et al., 2021), and construct Gaussian priors for each
hyperparameter with their mean on the default value, and a standard deviation of 25% of the
hyperparameter’s domain. For the DL case studies, we utilize defaults from each task’s repository and,
for numerical hyperparameters, once again set the standard deviation to 25% of the hyperparameter’s
domain. For categorical hyperparameters, we place a higher probability on the default. As such,
the quality of the prior is ultimately unknown, but serves as a proxy for what a practitioner may
choose and has shown to be a reasonable choice (Anastacio & Hoos, 2020). For all experiments,
we run πBO with β = N/10, where N is the total number of iterations, in order to make the prior
inﬂuence approximately equal in all experiments, regardless of the number of allowed BO iterations.
We investigate the sensitivity to β in Appendix A, and the sensitivity to prior quality in Appendix G."
EXPERIMENTAL SETUP,0.23492063492063492,"Baselines
We empirically evaluate πBO against the most competitive approaches for priors over
the optimum described in Section 2.3: BOPrO (Souza et al., 2021) and BO in Warped Space
(BOWS) (Ramachandran et al., 2020). To contextualize the performance of πBO, we provide
additional, simpler baselines: random sampling, sampling from the prior and BO with prior-based
initial design. The latter is initialized with the mode of the prior in addition to its regular initial design.
In our main results, we choose Spearmint (with EI) (Snoek et al., 2012) for this mode-initialized
baseline, simply referring to it as Spearmint. See Appendix F for complete details on the experiments."
EXPERIMENTAL SETUP,0.23809523809523808,"4.2
ROBUSTNESS OF πBO"
EXPERIMENTAL SETUP,0.24126984126984127,"First, we study the robustness of πBO. To this end, we show that πBO beneﬁts from informative
priors and can recover from wrong priors, being consistent with our theoretical results in Section 3.3.
To this end, we consider a well-known black-box optimization function, Branin (2D), as well as two
surrogate HPO tasks from the Profet suite (Klein et al., 2019): FC-Net (6D) and XGBoost (8D). For
these tasks, we exemplarily show results for πBO implemented in the Spearmint framework. As
Figure 2 shows, πBO is able to quickly improve over sampling from the prior. Moreover, it improves
substantially over Spearmint (with mode initialization) for all informative priors, staying up to an
order of magnitude ahead throughout the optimization for both strong and weak priors. For wrong
priors, πBO displays desired robustness by recovering to approximately equal regret as Spearmint. In
contrast, Spearmint frequently fails to substantially improve from its initial design on the strong and"
EXPERIMENTAL SETUP,0.24444444444444444,Published as a conference paper at ICLR 2022
EXPERIMENTAL SETUP,0.24761904761904763,"weak prior, which demonstrates the importance of considering the prior throughout the optimization
procedure. This effect is even more pronounced on the higher-dimensional tasks FCNet and XGBoost,
where BO typically spends many iterations at the boundary (Swersky, 2017). Here, πBO rapidly
improves multiple orders of magnitude over the initial design, displaying its ability to efﬁciently
exploit the information provided by the prior."
EXPERIMENTAL SETUP,0.2507936507936508,"Figure 2: Comparison of πBO, Spearmint, and two sampling approaches on Branin, FCNet and
XGBoost for various prior strengths. Mean and standard error of log simple regret is displayed over
100 iterations, averaged over 20 runs. The vertical line represents the end of the initial design phase."
EXPERIMENTAL SETUP,0.25396825396825395,"4.3
COMPARISON OF πBO AGAINST OTHER PRIOR-GUIDED APPROACHES"
EXPERIMENTAL SETUP,0.2571428571428571,"Next, we study the performance of πBO against other state-of-the-art prior-guided approaches. To
this end, we consider optimizing 5 hyperparameters of an MLP for classiﬁcation (Eggensperger et al.,
2021) on 6 different OpenML datasets (Vanschoren et al., 2014) and compare against BOPrO (Souza
et al., 2021) and BOWS (Ramachandran et al., 2020). For minimizing confounding factors, we
implement πBO and BOWS in HyperMapper (Nardi et al., 2019), the same framework that BOPrO
runs on. Moreover, we let all approaches share πBO’s initialization procedure. We consider a budget
of 50 iterations as it is common with ML practitioners (Bouthillier & Varoquaux, 2020). In Figure 3,
we see that πBO offers the best performance on four out of six tasks, and displays the most consistent
performance across tasks. In contrast to them BOWS and BOPrO, πBO also comes with theoretical
guarantees and is ﬂexible in the choice of framework and acquisition function."
EXPERIMENTAL SETUP,0.26031746031746034,"Figure 3: Comparison of πBO, BOPrO, BOWS, and prior sampling for 5D MLP tuning on various
OpenML datasets for a prior centered on default values. We show mean and standard error of the
accuracy across 20 runs. The vertical line represents the end of the initial design phase."
EXPERIMENTAL SETUP,0.2634920634920635,Published as a conference paper at ICLR 2022
CASE STUDIES ON DEEP LEARNING PIPELINES,0.26666666666666666,"4.4
CASE STUDIES ON DEEP LEARNING PIPELINES"
CASE STUDIES ON DEEP LEARNING PIPELINES,0.2698412698412698,"Last, we study the impact of πBO on deep learning applications, which are often fairly expensive,
making efﬁciency even more important than in HPO for traditional machine learning. To this end, we
consider two deep learning case studies: segmentation of neuronal processes in electron microscopy
images with a U-Net(6D) (Ronneberger et al., 2015), with code provided from the NVIDIA deep
learning examples repository (Przemek et al.), and image classiﬁcation on ImageNette-128 (6D)
(Howard, 2019), a light-weight adaptation of ImageNet (Deng et al., 2009), with code from the
repository of the popular FastAI library (Howard et al., 2018). We mimic the setup from Section
4.3 by using the HyperMapper framework and identical initialization procedures across approaches.
Gaussian priors are set on publicly available default values, which are results of previous tuning
efforts of the original authors. We again optimize for a practical budget of 50 iterations (Bouthillier &
Varoquaux, 2020). As test splits for both tasks were not available to us, we report validation scores."
CASE STUDIES ON DEEP LEARNING PIPELINES,0.273015873015873,"As shown in Figure 4, πBO achieves a 2.5× time-to-accuracy speedup over Vanilla BO. For Ima-
geNette, the performance of πBO at iteration 4 already surpasses the performance of Vanilla BO at
Iteration 50, demonstrating a 12.5× time-to-accuracy speedup. Ultimately, πBO’s ﬁnal performance
establishes a new state-of-the-art validation performance on ImageNette with the provided pipeline,
with a ﬁnal accuracy of 94.14% (vs. the previous state of the art with 93.55%1)."
CASE STUDIES ON DEEP LEARNING PIPELINES,0.2761904761904762,"Figure 4: Comparison of approaches for U-Net Medical and ImageNette-128 for a prior centered on
default values. We show mean and standard error of the accuracy across 20 runs for U-Net Medical
and 10 runs for ImageNette-128. The vertical line represents the end of the initial design phase."
CONCLUSION AND FUTURE WORK,0.27936507936507937,"5
CONCLUSION AND FUTURE WORK"
CONCLUSION AND FUTURE WORK,0.28253968253968254,"We presented πBO, a conceptually very simple Bayesian optimization approach for leveraging user
beliefs about the location of an optimum, which relies on a generalization of myopic acquisition
functions. πBO modiﬁes the selection of design points through a decaying weighting scheme,
promoting high-probability regions under the prior. Contrary to previous approaches, πBO imposes
only minor restrictions on the type of priors, surrogates or frameworks that can be used. πBO provably
converges at regular rates, displays state-of-the art performance across tasks, and effectively recovers
from poorly speciﬁed priors. Moreover, we have demonstrated that πBO can yield substantial
performance gains for practical low-budget settings, improving on the state-of-the-art for a real-world
CNN tuning tasks even with trivial choices for the prior. For practitioners who have historically relied
on manual or grid search for HPO, we hope that πBO will serve as an intuitive and effective tool for
bridging the gap between traditional tuning methods and BO."
CONCLUSION AND FUTURE WORK,0.2857142857142857,"πBO sets the stage for several follow-up studies. Amongst others, we will examine the extension of
πBO to non-myopic acquisition functions, such as entropy-based methods. Non-myopic acquisition
functions do not ﬁt well in the current πBO framework, as they do not necessarily beneﬁt from evalu-
ating inputs expected to perform well. We will also combine πBO with multi-ﬁdelity optimization
methods to yield even higher speedups, and with multi-objective optimization to jointly optimize
performance and secondary objective functions, such as interpretability or fairness of models."
CONCLUSION AND FUTURE WORK,0.28888888888888886,"1https://github.com/fastai/imagenette#imagenette-leaderboard, 80 Epochs, 128
Resolution"
CONCLUSION AND FUTURE WORK,0.2920634920634921,Published as a conference paper at ICLR 2022
ETHICS STATEMENT,0.29523809523809524,"6
ETHICS STATEMENT"
ETHICS STATEMENT,0.2984126984126984,"Our work proposes an acquisition function generalization which incorporates prior beliefs about the
location of the optimum into optimization. The approach is foundational and thus will not bring
direct societal or ethical consequences. However, πBO will likely be used in the development of
applications for a wide range of areas and thus indirectly contribute to their impacts on society. In
particular, we envision that πBO will impact a multitude of ﬁelds by allowing ML experts to inject
their knowledge about the location of the optimum into Bayesian Optimization."
ETHICS STATEMENT,0.30158730158730157,"We also note that we intend for πBO to be a tool that allows users to assist Bayesian Optimization
by providing reasonable prior knowledge and beliefs. This process induces user bias into the
optimization, as πBO will inevitably start by optimizing around this prior. As some users may only
be interested in optimizing in the direct neighborhood of their prior, πBO could allow them to do so
if provided with a high β value in relation to the number of iterations. Thus, if improperly speciﬁed,
πBO could serve to reinforce user’s beliefs by providing improved solutions only for the user’s region
of interest. However, if used properly, πBO will reduce the computational resources required to ﬁnd
strong hyperparameter settings, contributing to the sustainability of machine learning."
REPRODUCIBILITY,0.3047619047619048,"7
REPRODUCIBILITY"
REPRODUCIBILITY,0.30793650793650795,"In order to make the experiments run in πBO as reproducible as possible, we have included links
to repositories of our implementations in both Spearmint and HyperMapper, with instructions on
how to run our experiments. Moreover, we have included in said repositories all of the exact
priors that we have used for our runs, which run out of the box. The priors we used were, in
our opinion, well motivated as to avoid subjectivity, which we hope serves as a good frame of
reference for similar works in the future. Speciﬁcally, Appendix 4.4 describes how we ran our DL
experiments, Appendix F.1 goes into the implementation in further detail, and Appendix D displays
the exact priors for all our experiments and prior strengths. Our Spearmint implementation of both
πBO and BOWS is available at https://github.com/piboauthors/PiBO-Spearmint,
and our HyperMapper implementation is available at https://github.com/piboauthors/
PiBO-Hypermapper. For our results on the convergence of πBO, we have provided a complete
proof in Appendix E."
ACKNOWLEDGEMENTS,0.3111111111111111,"8
ACKNOWLEDGEMENTS"
ACKNOWLEDGEMENTS,0.3142857142857143,"Luigi Nardi was supported in part by afﬁliate members and other supporters of the Stanford DAWN
project — Ant Financial, Facebook, Google, Intel, Microsoft, NEC, SAP, Teradata, and VMware.
Carl Hvarfner and Luigi Nardi were partially supported by the Wallenberg AI, Autonomous Systems
and Software Program (WASP) funded by the Knut and Alice Wallenberg Foundation. Artur Souza
was supported by CAPES, CNPq, and FAPEMIG. Frank Hutter acknowledges support by the
European Research Council (ERC) under the European Union Horizon 2020 research and innovation
programme through grant no. 716721, through TAILOR, a project funded by the EU Horizon 2020
research and innovation programme under GA No 952215, by the Deutsche Forschungsgemeinschaft
(DFG, German Research Foundation) under grant number 417962828 and by the state of Baden-
Württemberg through bwHPC and the German Research Foundation (DFG) through grant no INST
39/963-1 FUGG. Marius Lindauer acknowledges support by the European Research Council (ERC)
under the Europe Horizon programme. The computations were also enabled by resources provided
by the Swedish National Infrastructure for Computing (SNIC) at LUNARC partially funded by the
Swedish Research Council through grant agreement no. 2018-05973."
REFERENCES,0.31746031746031744,REFERENCES
REFERENCES,0.32063492063492066,"K. Anand, Z. Wang, M. Loog, and J. van Gemert. Black magic in deep learning: How human skill
impacts network training. In 31st British Machine Vision Conference 2020, BMVC 2020, Virtual
Event, UK, September 7-10, 2020. BMVA Press, 2020."
REFERENCES,0.3238095238095238,Published as a conference paper at ICLR 2022
REFERENCES,0.326984126984127,"M. Anastacio and H. Hoos. Combining sequential model-based algorithm conﬁguration with default-
guided probabilistic sampling. In GECCO ’20: Genetic and Evolutionary Computation Conference,
Companion Volume, Cancún, Mexico, July 8-12, 2020, pp. 301–302. ACM, 2020."
REFERENCES,0.33015873015873015,"I. Arganda-Carreras, S.C. Turaga, D.R. Berger, D. Cire¸san, A. Giusti, L.M. Gambardella, J. Schmid-
huber, D. Laptev, S. Dwivedi, J.M. Buhmann, T. Liu, M. Seyedhosseini, T. Tasdizen, L. Kamentsky,
R. Burget, V. Uher, X. Tan, C. Sun, T.D. Pham, E. Bas, M.G. Uzunbas, A. Cardona, J. Schindelin,
and H.S. Seung. Crowdsourcing the creation of image segmentation algorithms for connectomics.
Frontiers in Neuroanatomy, 9:142, 2015."
REFERENCES,0.3333333333333333,"M. Balandat, B. Karrer, D. R. Jiang, S. Daulton, B. Letham, A. G. Wilson, and E. Bakshy. Botorch:
A framework for efﬁcient monte-carlo bayesian optimization. In Advances in Neural Information
Processing Systems, 2020."
REFERENCES,0.33650793650793653,"J. Bergstra and Y. Bengio. Random search for hyper-parameter optimization. Journal of Machine
Learning Research, 13(10):281–305, 2012."
REFERENCES,0.3396825396825397,"J. Bergstra, R. Bardenet, Y. Bengio, and B. Kégl. Algorithms for hyper-parameter optimization. In
J. Shawe-Taylor, R. Zemel, P. Bartlett, F. Pereira, and K. Weinberger (eds.), Proceedings of the 25th
International Conference on Advances in Neural Information Processing Systems (NeurIPS’11),
pp. 2546–2554, 2011."
REFERENCES,0.34285714285714286,"X. Bouthillier and G. Varoquaux. Survey of machine-learning experimental methods at NeurIPS2019
and ICLR2020. Research report, Inria Saclay Ile de France, 2020."
REFERENCES,0.346031746031746,"E. Brochu, V. Cora, and N. de Freitas. A tutorial on Bayesian optimization of expensive cost
functions, with application to active user modeling and hierarchical reinforcement learning.
arXiv:1012.2599v1 [cs.LG], 2010."
REFERENCES,0.3492063492063492,"A. D. Bull. Convergence rates of efﬁcient global optimization algorithms. Journal of Machine
Learning Research, 12(88):2879–2904, 2011."
REFERENCES,0.3523809523809524,"R. Calandra, N. Gopalan, A. Seyfarth, J. Peters, and M. Deisenroth. Bayesian gait optimization for
bipedal locomotion. In P. Pardalos and M. Resende (eds.), Proceedings of the Eighth International
Conference on Learning and Intelligent Optimization (LION’14), 2014."
REFERENCES,0.35555555555555557,"A. Cardona, S. Saalfeld, S. Preibisch, B. Schmid, A. Cheng, J. Pulokas, P. Tomancak, and V. Harten-
stein. An integrated micro-and macroarchitectural analysis of the drosophila brain by computer-
assisted serial section electron microscopy. PLoS Biol, 8(10):e1000502, 2010."
REFERENCES,0.35873015873015873,"Y. Chen, A. Huang, Z. Wang, I. Antonoglou, J. Schrittwieser, D. Silver, and N. D. Freitas. Bayesian
optimization in alphago. ArXiv, abs/1812.06855, 2018."
REFERENCES,0.3619047619047619,"J. Deng, W. Dong, R. Socher, L.-J. Li, K. Li, and L. Fei-Fei. Imagenet: A large-scale hierarchical
image database. In 2009 IEEE Conference on Computer Vision and Pattern Recognition, pp.
248–255, 2009."
REFERENCES,0.36507936507936506,"K. Eggensperger, P. Müller, N. Mallik, M. Feurer, R. Sass, A. Klein, N. Awad, M. Lindauer, and
F. Hutter. HPOBench: a collection of reproducible multi-ﬁdelity benchmark problems for HPO,
2021."
REFERENCES,0.3682539682539683,"M. Feurer, Jost Tobias Springenberg, and F. Hutter. Initializing bayesian hyperparameter optimization
via meta-learning. In Proceedings of the Twenty-Ninth AAAI Conference on Artiﬁcial Intelligence,
pp. 1128–1135, 2015."
REFERENCES,0.37142857142857144,"M. Feurer, B. Letham, F. Hutter, and E. Bakshy. Practical transfer learning for bayesian optimization.
ArXiv abs/1802.02219, 2018."
REFERENCES,0.3746031746031746,"P. Frazier, W. Powell, and S. Dayanik. A knowledge-gradient policy for sequential information
collection. SIAM J. Control and Optimization, 47:2410–2439, 01 2008."
REFERENCES,0.37777777777777777,"P. Hennig and C. J. Schuler. Entropy search for information-efﬁcient global optimization. Journal of
Machine Learning Research, 13(1):1809–1837, 2012."
REFERENCES,0.38095238095238093,Published as a conference paper at ICLR 2022
REFERENCES,0.38412698412698415,"J. M. Hernández-Lobato, M. W. Hoffman, and Z. Ghahramani. Predictive entropy search for efﬁcient
global optimization of black-box functions. In Advances in Neural Information Processing Systems,
2014."
REFERENCES,0.3873015873015873,"J. Howard. Imagenette. https://github.com/fastai/imagenette/, 2019."
REFERENCES,0.3904761904761905,"J. Howard et al. fastai. https://github.com/fastai/fastai, 2018."
REFERENCES,0.39365079365079364,"F. Hutter, H. Hoos, and K. Leyton-Brown. Sequential model-based optimization for general algorithm
conﬁguration. In Learning and Intelligent Optimization, pp. 507–523, 2011."
REFERENCES,0.3968253968253968,"D. Jones, M. Schonlau, and W. Welch. Efﬁcient global optimization of expensive black-box functions.
Journal of Global Optimization, 13:455–492, 12 1998."
REFERENCES,0.4,"D. R. Jones. A taxonomy of global optimization methods based on response surfaces. Journal of
global optimization, 21(4):345–383, 2001."
REFERENCES,0.4031746031746032,"K. Kandasamy, K. R. Vysyaraju, W. Neiswanger, B. Paria, C. R. Collins, J. Schneider, B. Poczos,
and E. P. Xing. Tuning hyperparameters without grad students: Scalable and robust bayesian
optimisation with dragonﬂy. Journal of Machine Learning Research, 21(81):1–27, 2020."
REFERENCES,0.40634920634920635,"D. Kingma and J. Ba. Adam: A method for stochastic optimization. In Yoshua Bengio and Yann
LeCun (eds.), 3rd International Conference on Learning Representations, ICLR, 2015."
REFERENCES,0.4095238095238095,"A. Klein, Z. Dai, F. Hutter, N. Lawrence, and J. Gonzalez. Meta-surrogate benchmarking for
hyperparameter optimization. In Advances in Neural Information Processing Systems, volume 32,
2019."
REFERENCES,0.4126984126984127,"H. J. Kushner. A New Method of Locating the Maximum Point of an Arbitrary Multipeak Curve in
the Presence of Noise. Journal of Basic Engineering, 86(1):97–106, 03 1964."
REFERENCES,0.4158730158730159,"A. Lacoste, A. Luccioni, V. Schmidt, and T. Dandres. Quantifying the carbon emissions of machine
learning. arXiv preprint arXiv:1910.09700, 2019."
REFERENCES,0.41904761904761906,"Eric Hans Lee, Valerio Perrone, Cedric Archambeau, and Matthias Seeger. Cost-aware bayesian
optimization, 2020."
REFERENCES,0.4222222222222222,"C. Li, S. Rana, S. Gupta, V. Nguyen, S. Venkatesh, A. Sutti, D. R. de Celis, T. Slezak, M. Height,
M. Mohammed, and I. Gibson. Accelerating experimental design by incorporating experimenter
hunches. In IEEE International Conference on Data Mining, ICDM, pp. 257–266. IEEE Computer
Society, 2018."
REFERENCES,0.4253968253968254,"C. Li, S. Gupta, S. Rana, V. Nguyen, A. Robles-Kelly, and S. Venkatesh. Incorporating expert prior
knowledge into experimental design via posterior sampling. ArXiv, abs/2002.11256, 2020."
REFERENCES,0.42857142857142855,"M. Lindauer, K. Eggensperger, M. Feurer, A. Biedenkapp, D. Deng, C. Benjamins, R. Sass, and
F. Hutter. SMAC3: A versatile bayesian optimization package for hyperparameter optimization.
CoRR, abs/2109.09831, 2021."
REFERENCES,0.43174603174603177,"M. López-Ibáñez, J. Dubois-Lacoste, L. P. Cáceres, T. Stützle, and M. Birattari. The iRace package:
Iterated racing for automatic algorithm conﬁguration. Operations Research Perspectives, 3:43–58,
2016."
REFERENCES,0.43492063492063493,"B. Matérn. Spatial variation. Meddelanden fran Statens Skogsforskningsinstitut, 1960."
REFERENCES,0.4380952380952381,"J. Mockus, V. Tiesis, and A. Zilinskas. The application of Bayesian methods for seeking the extremum.
Towards Global Optimization, 2(117-129):2, 1978."
REFERENCES,0.44126984126984126,"L. Nardi, D. Koeplinger, and K. Olukotun. Practical design space exploration. In 2019 IEEE 27th
International Symposium on Modeling, Analysis, and Simulation of Computer and Telecommunica-
tion Systems (MASCOTS), pp. 347–358. IEEE, 2019."
REFERENCES,0.4444444444444444,"C. Oh, E. Gavves, and M. Welling. BOCK : Bayesian optimization with cylindrical kernels. In
International Conference on Machine Learning, pp. 3865–3874, 2018."
REFERENCES,0.44761904761904764,Published as a conference paper at ICLR 2022
REFERENCES,0.4507936507936508,"Andrei Paleyes, Mark Pullin, Maren Mahsereci, Neil Lawrence, and Javier González. Emulation
of physical processes with emukit. In Second Workshop on Machine Learning and the Physical
Sciences, NeurIPS, 2019."
