Section,Section Appearance Order,Paragraph
REFERENCES,0.45396825396825397,"V. Perrone, H. Shen, M. Seeger, C. Archambeau, and R. Jenatton. Learning search spaces for
bayesian optimization: Another view of hyperparameter transfer learning. In Advances in Neural
Information Processing Systems, 2019."
REFERENCES,0.45714285714285713,"S. Przemek et al.
Nvidia deep learning examples.
https://github.com/NVIDIA/
DeepLearningExamples."
REFERENCES,0.4603174603174603,"A. Ramachandran, S. Gupta, S. Rana, C. Li, and S. Venkatesh. Incorporating expert prior in bayesian
optimisation via space warping. Knowledge-Based Systems, 195:105663, 2020."
REFERENCES,0.4634920634920635,"C. Rasmussen and C. Williams. Gaussian Processes for Machine Learning. The MIT Press, 2006."
REFERENCES,0.4666666666666667,"O. Ronneberger, P. Fischer, and T. Brox. U-net: Convolutional networks for biomedical image
segmentation. In Medical Image Computing and Computer-Assisted Intervention - MICCAI,
volume 9351 of Lecture Notes in Computer Science, pp. 234–241. Springer, 2015."
REFERENCES,0.46984126984126984,"B. Ru, X. Wan, X. Dong, and M. Osborne. Interpretable neural architecture search via bayesian opti-
misation with weisfeiler-lehman kernels. In International Conference on Learning Representations,
2021."
REFERENCES,0.473015873015873,"B. Shahriari, A. Bouchard-Côté, and N. Freitas. Unbounded bayesian optimization via regularization.
In Artiﬁcial intelligence and statistics, pp. 1168–1176, 2016a."
REFERENCES,0.47619047619047616,"B. Shahriari, K. Swersky, Z. Wang, R. Adams, and N. de Freitas. Taking the human out of the loop:
A review of Bayesian optimization. Proceedings of the IEEE, 104(1):148–175, 2016b."
REFERENCES,0.4793650793650794,"E. Siivola, A. Vehtari, J. Vanhatalo, J. González, and M. R. Andersen. Correcting boundary over-
exploration deﬁciencies in bayesian optimization with virtual derivative sign observations. In
International Workshop on Machine Learning for Signal Processing, 2018."
REFERENCES,0.48253968253968255,"L. Smith. A disciplined approach to neural network hyper-parameters: Part 1–learning rate, batch
size, momentum, and weight decay. arXiv preprint arXiv:1803.09820, 2018."
REFERENCES,0.4857142857142857,"J. Snoek, H. Larochelle, and R. Adams. Practical Bayesian optimization of machine learning
algorithms. In P. Bartlett, F. Pereira, C. Burges, L. Bottou, and K. Weinberger (eds.), Proceedings
of the 26th International Conference on Advances in Neural Information Processing Systems
(NeurIPS’12), pp. 2960–2968, 2012."
REFERENCES,0.4888888888888889,"J. Snoek, K. Swersky, R. Zemel, and R. Adams. Input warping for bayesian optimization of non-
stationary functions. In Eric P. Xing and Tony Jebara (eds.), Proceedings of the 31st International
Conference on Machine Learning, volume 32 of Proceedings of Machine Learning Research, pp.
1674–1682. PMLR, 22–24 Jun 2014."
REFERENCES,0.49206349206349204,"A. Souza, L. Nardi, L. Oliveira, K. Olukotun, M. Lindauer, and F. Hutter. Bayesian optimization
with a prior for the optimum. In Machine Learning and Knowledge Discovery in Databases.
Research Track - European Conference, ECML PKDD 2021, Bilbao, Spain, September 13-17,
2021, Proceedings, Part III, volume 12977 of Lecture Notes in Computer Science, pp. 265–296.
Springer, 2021."
REFERENCES,0.49523809523809526,"J. Springenberg, A. Klein, S. Falkner, and F. Hutter. Bayesian optimization with robust Bayesian
neural networks. In D. Lee, M. Sugiyama, U. von Luxburg, I. Guyon, and R. Garnett (eds.),
Proceedings of the 30th International Conference on Advances in Neural Information Processing
Systems (NeurIPS’16), 2016."
REFERENCES,0.4984126984126984,"N. Srinivas, A. Krause, S. M. Kakade, and M. W. Seeger. Information-theoretic regret bounds for
gaussian process optimization in the bandit setting. IEEE Transactions on Information Theory, 58
(5):3250–3265, 2012."
REFERENCES,0.5015873015873016,"D. Stoll, J. KH Franke, D. Wagner, S. Selg, and F. Hutter. Hyperparameter transfer across developer
adjustments. In NeurIPS 2020 Workshop on Meta-Learning, 2020."
REFERENCES,0.5047619047619047,Published as a conference paper at ICLR 2022
REFERENCES,0.5079365079365079,"K. Swersky, J. Snoek, and R. Adams. Multi-task Bayesian optimization. In C. Burges, L. Bottou,
M. Welling, Z. Ghahramani, and K. Weinberger (eds.), Proceedings of the 27th International
Conference on Advances in Neural Information Processing Systems (NeurIPS’13), pp. 2004–2012,
2013."
REFERENCES,0.5111111111111111,"K. J. Swersky. Improving Bayesian Optimization for Machine Learning using Expert Priors. PhD
thesis, 2017."
REFERENCES,0.5142857142857142,"The GPyOpt authors. GPyOpt: A bayesian optimization framework in python. http://github.
com/SheffieldML/GPyOpt, 2016."
REFERENCES,0.5174603174603175,"W. Thompson. On the likelihood that one unknown probability exceeds another in view of the
evidence of two samples. Biometrika, 25(3/4):285–294, 1933."
REFERENCES,0.5206349206349207,"R. Turner, D. Eriksson, M. McCourt, J. Kiili, E. Laaksonen, Z. Xu, and I. Guyon. Bayesian
optimization is superior to random search for machine learning hyperparameter tuning: Analysis
of the black-box optimization challenge 2020.
In Hugo Jair Escalante and Katja Hofmann
(eds.), Proceedings of the NeurIPS 2020 Competition and Demonstration Track, volume 133 of
Proceedings of Machine Learning Research, pp. 3–26. PMLR, 06–12 Dec 2021."
REFERENCES,0.5238095238095238,"Jan N. van Rijn and Frank Hutter. Hyperparameter importance across datasets. In Proceedings
of the 24th ACM SIGKDD International Conference on Knowledge Discovery Data Mining,
KDD ’18, pp. 2367–2376, New York, NY, USA, 2018. Association for Computing Machinery.
ISBN 9781450355520. doi: 10.1145/3219819.3220058. URL https://doi.org/10.1145/
3219819.3220058."
REFERENCES,0.526984126984127,"J. Vanschoren. Meta-learning: A survey, 2018."
REFERENCES,0.5301587301587302,"J. Vanschoren, J. van Rijn, B. Bischl, and L. Torgo. OpenML: Networked science in machine learning.
SIGKDD Explor. Newsl., 15(2):49–60, 2014."
REFERENCES,0.5333333333333333,"Q. Wang, Y. Ming, Z. Jin, Q. Shen, D. Liu, M. J. Smith, K. Veeramachaneni, and H. Qu. Atmseer:
Increasing transparency and controllability in automated machine learning. In Proceedings of the
2019 CHI Conference on Human Factors in Computing Systems, CHI ’19, pp. 1–12. Association
for Computing Machinery, 2019."
REFERENCES,0.5365079365079365,"Z. Wang and S. Jegelka. Max-value entropy search for efﬁcient bayesian optimization. In Proceedings
of the 34th International Conference on Machine Learning, ICML, volume 70 of Proceedings of
Machine Learning Research, pp. 3627–3635. PMLR, 2017."
REFERENCES,0.5396825396825397,"M. Wistuba, N. Schilling, and L. Schmidt-Thieme. Hyperparameter search space pruning - A new
component for sequential model-based hyperparameter optimization. In A. Appice, P. Rodrigues,
V. Costa, J. Gama, A. Jorge, and C. Soares (eds.), Machine Learning and Knowledge Discovery in
Databases (ECML/PKDD’15), volume 9285, pp. 104–119, 2015."
REFERENCES,0.5428571428571428,"L. Zimmer, M. Lindauer, and F. Hutter. Auto-pytorch tabular: Multi-ﬁdelity metalearning for efﬁcient
and robust autodl. IEEE Transactions on Pattern Analysis and Machine Intelligence, 43(9):3079 –
3090, 2021."
REFERENCES,0.546031746031746,Published as a conference paper at ICLR 2022
REFERENCES,0.5492063492063493,"A
BETA ABLATION STUDY"
REFERENCES,0.5523809523809524,"We consider the effect of the β hyperparameter of πBO introduced in Section 3.2, controlling the
speed of the prior decay. To show the effect of this hyperparameter, we display the performance
of πBO for the toy and surrogate-based benchmarks across all prior qualities. We emphasize the
trade-off between high-end performance on good priors and robustness to bad priors. In general, a
higher value of β yields better performance for good priors, but makes πBO slower to recover from
bad priors. This behaviour follows intuition and the results provided in Section 3.3."
REFERENCES,0.5555555555555556,"In Figure 5, we display how πBO performs for different choices of β, and once again provide sampling
from the prior and Spearmint as baselines. Following the prior decay parameter baseline by (Souza
et al., 2021), we show that the choice of β = 10 onsistently gives one of the best performances for
strong priors, while retaining good overall robustness. Nearly all choices of β give a ﬁnal performance
better than that of Spearmint for good priors. Additionally, there is a clear relationship between ﬁnal
performance and β on all good priors. This is best visualized in the weak XGBoost experiment, where
the ﬁnal performances are distinctly sorted by increasing β. Similar patterns are not as apparent in
the ﬁnal performance on wrong priors. This behaviour highlights the beneﬁts of slowly decaying the
prior. Overall, πBO is competitive for a wide range of β, but suffers slightly worse ﬁnal performance
on good priors for low values of β. [h]"
REFERENCES,0.5587301587301587,"Figure 5: Comparison of πBO and Spearmint with varying values of β for Branin and Profet
benchmarks for the strong, weak and wrong prior qualities. The mean and standard error of log
simple regret is displayed over 100 iterations, averaged over 10 repetitions. Iteration 1 is removed for
visibility purposes. The vertical line represents the end of the initial design phase."
REFERENCES,0.5619047619047619,Published as a conference paper at ICLR 2022
REFERENCES,0.5650793650793651,"Figure 6: πBO on SMAC using a GP surrogate for the EI, UCB, PI and TS acquisition functions,
β = 10 for Branin and Profet benchmarks for varying prior qualities. The mean and standard error of
log simple regret is displayed over 100 iterations, averaged over 10 repetitions. Iteration 1 is removed
for visibility purposes. The vertical line represents the end of the initial design phase."
REFERENCES,0.5682539682539682,"B
πBO VERSATILITY"
REFERENCES,0.5714285714285714,"We show the versatility of πBO by implementing it in numerous variants of SMAC Hutter et al.
(2011), a well-established HPO framework which supports both GP and RF surrogates, and a majority
of the myopic acquisition functions mentioned in Section 2. We showcase the performance of
πBO-EI, πBO-PI, πBO-UCB and πBO-TS on the general formulation of πBO with a GP surrogate,
as well as πBO-EI with an RF surrogate, which requires a minor adaptation."
REFERENCES,0.5746031746031746,"B.1
GENERAL FORMULATION OF πBO"
REFERENCES,0.5777777777777777,"To allow for the universality of πBO across several acquisition function, we must consider the various
magnitudes of acquisition functions. As UCB and TS typically output values in the same order of
magnitude and sign as the objective function, we do not want the behaviour of πBO to be affected by
such variations."
REFERENCES,0.580952380952381,"The solution to the problem referenced above is to add a simple afﬁne transformation to the observa-
tions, {yi}n
i=1, by subtracting by the incumbent, y∗
n. As such, we consider at each time step not the
original dataset, Dn = {(xi, yi)}n
i=1, but the augmented dataset ˆDn = {(xi, yi −y∗
n)}n
i=1. With this
formulation, we get the desired scale- and sign-invariance in the UCB and TS acquisition functions,
without changing the original strategy of any of the acquisition function. Notably, this change leaves
prior-weighted EI and PI unaffected."
REFERENCES,0.5841269841269842,Published as a conference paper at ICLR 2022
REFERENCES,0.5873015873015873,"Figure 7: Point selection strategy evolution for πBO on SMAC with a GP surrogate for the EI, PI,
UCB and TS acquisition functions on the Log-1D-Branin function. The plots show rescaled values of
the prior-weighted acquisition function (purple), the regular acquisition function (blue) and πn (red)
on a 1D-Branin (grey) with global optimum in the center of the search space and the current selection
as a vertical violet line. The rows represent iterations 4, 6 and 8 for a run with β = 2."
REFERENCES,0.5904761904761905,"B.2
RANDOM FOREST SURROGATE"
REFERENCES,0.5936507936507937,"We now demonstrate πBO with a RF surrogate model. In the SMAC implementation of the RF
surrogate, the model forms piece-wise constant mean and covariance functions. Naturally, this leads
to the EI, PI or UCB acquisition function surface being piece-wise constant as well. Consequently, an
acquisition function with a RF surrogate will typically have a region of global optima. The choice of
the next design point is then selected uniformly at random among the candidate optima. We wish to
retain this randomness when applying πBO. As such, we require the prior to be piece-wise constant,
too. To do so, we employ a binning approach, that linearly rounds prior values after applying the decay
term. The granularity of the binning decreases at the same rate as the prior, allowing the piece-wise
constant regions of the prior grow in size as optimization progresses. In Figure 9, we demonstrate
the importance of the piece-wise constant acquisition function by showing the point selection when
applying a πBO with a continuous prior to an RF surrogate (left) and when applying the binning
approach (right). Notably, the smooth prior on the left repeatedly proposes design points very close
to previous points, as the prior forces the selection of points near the boundary of a promising region.
Thus, the surrogate model rarely improves, and the optimization gets stuck at said boundary for
multiple iterations at a time. This is best visualized at iteration 5 and 10, where similar points have
been selected for all iterations in the time span. With the binned prior on the right, the selection of
design points occurs randomly within a region, avoiding the static point selection and updating of
non-modiﬁed approach. In Figure 8, we report the performance of πBO with a RF surrogate and the
binning approach. This approach is competitive, as it provides substantial improvement over SMAC,
improves over sampling from the prior, and quickly recovers from misleading priors. Notably, the
binning is not required for discrete parameters, as the piece-wise constant property holds by default.
Thus, this adaptation is only necessary for continuous parameters."
REFERENCES,0.5968253968253968,"C
OTHER PRIOR-BASED APPROACHES"
REFERENCES,0.6,"We now demonstrate the performance of πBO for ﬁve different functions and HPO Surrogates: Branin,
Hartmann-6, as well as three tasks from the Profet suite - SVM, FCNet and XGBoost. We compare all
frameworks for priors over the optimum - namely BOPrO Souza et al. (2021), BOWS Ramachandran
et al. (2020), TPE Bergstra et al. (2011), PS-G Li et al. (2020). The performance of πBO is
shown on two different frameworks - Spearmint and Hypermapper - to allow for fair comparison
and display cross-framework consistency. As BOWS is implemented in Spearmint and BOPrO in
Hypermapper, they appear in the plots retaining to their framework. We display each approach with
vanilla Spearmint/Hypermapper, with normal initialization, as an additional baseline. Moreover, we
display the performance of πBO implemented in Spearmint, as well as Mode + Spearmint, on the
MLP tuning tasks."
REFERENCES,0.6031746031746031,Published as a conference paper at ICLR 2022
REFERENCES,0.6063492063492063,"Figure 8: πBO with binning and SMAC using and RF surrogate and EI acquisition function, β = 10,
and the supporting frameworks for Branin and Profet benchmarks for varying prior qualities. The
mean and standard error of log simple regret is displayed over 100 iterations, averaged over 10
repetitions. Iteration 1 is removed for visibility purposes. The vertical line represents the end of the
initial design phase."
REFERENCES,0.6095238095238096,"D
PRIOR CONSTRUCTION"
REFERENCES,0.6126984126984127,"We now present the method by which we construct our priors. For the synthetic benchmarks, we
mimic (Souza et al., 2021) by offsetting a Gaussian distribution from the optima. For our case studies,
we choose a Gaussian prior with zero correlation between dimensions. This was required in order to
have a simple, streamlined approach that was compatible with all frameworks. We constructed the
priors once before conducting the experiments, and kept them ﬁxed throughout."
REFERENCES,0.6158730158730159,"Synthetic and Surrogate-based HPO Benchmarks
For these benchmarks, the approximate op-
tima of all included functions could be obtained in advance, either analytically or empirically through
extensive sampling. Thus, the correctness of the prior is ultimately known in advance. For a function
of dimensionality d with optimum at x∗, the strong and weak prior qualities were constructed by
using a quality-speciﬁc noise term ϵ = {ϵi}d
i=1 and quality-speciﬁc standard deviation as a fraction
of the search space. For the strong prior πs(x), we use a small standard deviation σs = 1% and
construct the prior as"
REFERENCES,0.6190476190476191,"πs(x) ∼N(x∗+ ϵ, σs),
ϵi ∼N(0, σs).
(10)
We construct the weak priors analogously by using a larger standard deviation σw = 10%. For our
20 runs of the strong and weak prior, this procedure yielded us 20 unique priors per quality type,
with varying offsets from the true optimum. Additionally, the density on the optimum is substantially"
REFERENCES,0.6222222222222222,Published as a conference paper at ICLR 2022
REFERENCES,0.6253968253968254,"Figure 9: Point selection strategy evolution for πBO on SMAC with a RF surrogate, when employing
a smooth prior (left) and binned prior (right) for the 1D-Branin function. The plots show rescaled
values of prior-weighted EI (purple), EI (blue) and πn (red) on a 1D-Branin (grey) with global
optimum in the center of the search space and the current selection as a vertical violet line. The rows
represent iterations 5, 10, 15 and 20, for a run with β = 5."
REFERENCES,0.6285714285714286,"Figure 10: Comparison of πBO, Spearmint and other approaches for priors over the optimum for
Branin, Hartmann and Profet benchmarks. πBO is implemented in Spearmint. The mean and standard
error of log simple regret is displayed over 100 iterations, averaged over 20 repetitions. Iteration 1 is
removed for visibility purposes. The vertical line represents the end of the initial design phase."
REFERENCES,0.6317460317460317,"larger for the strong prior than the weak prior. No priors with a mean outside the search space were
allowed, such priors were simply replaced. For Branin, we only considered one of the three Branin
optima for this procedure, since not all included frameworks support multi-modal distributions. For
the wrong prior, we construct it similarly to the strong prior, but around the empirical maximum, x¯∗,
of the objective function in the search space. Since this point was far away from the optimum for all
benchmarks, we did not add additional noise. So, the wrong prior πm is constructed as"
REFERENCES,0.6349206349206349,"πm(x) ∼N(x¯∗, σs),
(11)"
REFERENCES,0.638095238095238,which means that the wrong prior is identical across runs for a given benchmark.
REFERENCES,0.6412698412698413,Published as a conference paper at ICLR 2022
REFERENCES,0.6444444444444445,"Figure 11: Comparison of πBO, Hypermapper and other approaches for priors over the optimum
for Branin, Hartmann and Profet benchmarks. πBO is implemented in Spearmint. The mean and
standard error of log simple regret is displayed over 100 iterations, averaged over 20 repetitions.
Iteration 1 is removed for visibility purposes. The vertical line represents the end of the initial design
phase."
REFERENCES,0.6476190476190476,"Figure 12: Comparison of πBO, BOPrO, BOWS, and prior sampling for 5D MLP tuning on various
OpenML datasets for a prior centered around default values. We show mean and standard error of
the accuracy across 20 repetitions. Iteration 1 is removed for visibility purposes. The vertical line
represents the end of the initial design phase."
REFERENCES,0.6507936507936508,"E
PROOFS"
REFERENCES,0.653968253968254,"Here, we provide the complete proofs for the Theorem and Corollary introduced in 3.3. In addition,
we provide insight into the interplay between β, the prior π, and the value of the derived bound Cπ,n."
REFERENCES,0.6571428571428571,Published as a conference paper at ICLR 2022
REFERENCES,0.6603174603174603,"Theorem 1. Given Dn, Kℓ, π, σ, ℓ, R and the compact set X ⊂Rd as deﬁned above, the loss Ln
incurred at iteration n by EIπ,n can be bounded from above as"
REFERENCES,0.6634920634920635,"Ln(EIπ,n, Dn, Hℓ(X), R) ≤Cπ,nLn(EIn, Dn, Hℓ(X), R),
Cπ,n =
maxx∈X π(x)"
REFERENCES,0.6666666666666666,minx∈X π(x)
REFERENCES,0.6698412698412698,"β/n
. (12)"
REFERENCES,0.6730158730158731,"Proof. To bound the performance of EIπ to that of EI, we primarily need to consider Lemma 7 and
Lemma 8 by Bull Bull (2011). In Lemma 7, it is stated that for any sequence of points {xi}n
i=1,
dimensionality d, kernel length scales ℓ, and p ∈N, the posterior variance s2
n on xn+1 will, for a
large value C, satisfy the following inequality at most p times,"
REFERENCES,0.6761904761904762,"sn(xn+1; ℓ) ≥Cp−(ν∧1)/d(log p)γ,
γ =
α,
ν ≤1
0,
ν > 1 .
(13)"
REFERENCES,0.6793650793650794,"Thus, we can bound the posterior variance by assuming a point in time np where Eq. 13 has held p
times. We now consider Lemma 8 where, through a number of inequalities, EI is bounded by the
actual improvement In"
REFERENCES,0.6825396825396826,"max

In −Rs, τ(−R/σ)"
REFERENCES,0.6857142857142857,τ(R/σ) In
REFERENCES,0.6888888888888889,"
≤EIn(x) ≤In + (R + σ)s,
(14)"
REFERENCES,0.692063492063492,"where In = (f(x∗
n)−f(x))+, τ(z) = zΦ(z)+φ(z) and s = sn(xn; ℓ). Since πBO re-weights EIn
by πn, these bounds need adjustment to hold for EIπ,n. For the upper bound provided in Lemma 8,
we make use of maxx∈X πn(x) to bound EIπ,n(x) for any point x ∈X:"
REFERENCES,0.6952380952380952,"EIπ,n(x)
maxx∈X πn(x) =
EIn(x)πn(x)
maxx∈X πn(x) ≤EIn(x) ≤In + (R + σ)s.
(15)"
REFERENCES,0.6984126984126984,"For the lower bounds, we instead rely on minx∈X πn(x) in a similar manner:"
REFERENCES,0.7015873015873015,"max

In −Rs, τ(−R/σ)"
REFERENCES,0.7047619047619048,τ(R/σ) In
REFERENCES,0.707936507936508,"
≤EIn(x) ≤EIn(x)πn(x)"
REFERENCES,0.7111111111111111,"minx∈X πn(x) =
EIπ,n(x)
minx∈X πn(x).
(16)"
REFERENCES,0.7142857142857143,"Consequently, EIπ can be bounded by the actual improvement as"
REFERENCES,0.7174603174603175,"min
x∈X πn(x) max

In −Rs, τ(−R/σ)"
REFERENCES,0.7206349206349206,τ(R/σ) In
REFERENCES,0.7238095238095238,"
≤EIπ,n(x) ≤max
x∈X πn(x)(In + (R + σ)s).
(17)"
REFERENCES,0.726984126984127,"With these bounds in place, we consider the setting as in the proof for Theorem 2 in Bull Bull (2011),
which proves an upper bound for the EI strategy in the ﬁxed kernel parameters setting. At an iteration
np, p ≤np ≤3p, the posterior variance will be bounded by Cp−(ν∧1)/d(log p)γ. Furthermore, since
In ≥0 and ||f||Hℓ(X)) ≤R, we can bound the total improvement as
X"
REFERENCES,0.7301587301587301,"i
Ii ≤
X"
REFERENCES,0.7333333333333333,"i
f(x∗
i ) −f(x∗
i+1) ≤f(x∗
1) −min f ≤2||f||∞≤2R,
(18)"
REFERENCES,0.7365079365079366,"leaving us a maximum of p times that In ≥2Rp−1. Consequently, both the posterior variance s2
np
and the improvement Inp are bounded at np. For a future iteration n, 3p ≤n ≤3(p + 1), we use
the bounds on EIπ, snp and Inp to obtain the bounds on the EIπ loss:"
REFERENCES,0.7396825396825397,"Ln(EIπ, Dn, Hℓ(X), R)
= f(x∗
n) −min f
≤f(x∗
np) −min f"
REFERENCES,0.7428571428571429,"≤
EIπ,np(x∗)
minx∈X πn(x)
τ(R/σ)
τ(−R/σ)"
REFERENCES,0.746031746031746,"≤EIπ,np(xn+1)"
REFERENCES,0.7492063492063492,"minx∈X πn(x)
τ(R/σ)
τ(−R/σ)"
REFERENCES,0.7523809523809524,≤maxx∈X πn(x)
REFERENCES,0.7555555555555555,"minx∈X πn(x)
τ(R/σ)
τ(−R/σ)
 
Inp + (R + σ)snp
"
REFERENCES,0.7587301587301587,"≤
maxx∈X π(x)"
REFERENCES,0.7619047619047619,minx∈X π(x)
REFERENCES,0.765079365079365,β/n τ(R/σ)
REFERENCES,0.7682539682539683,"τ(−R/σ)(2Rp−1 + (R + σ)Cp−(ν∧1)/d(log p)γ),"
REFERENCES,0.7714285714285715,Published as a conference paper at ICLR 2022
REFERENCES,0.7746031746031746,"where the last inequality is a factor Cπ,n
=

maxx∈X π(x)"
REFERENCES,0.7777777777777778,"minx∈X π(x)
β/n
larger than the bound on"
REFERENCES,0.780952380952381,"Ln(EI, Dn, Hℓ(X), R)."
REFERENCES,0.7841269841269841,"Corollary 1. The loss of a decaying prior-weighted Expected Improvement strategy, EIπ, is asymp-
totically equal to the loss of an Expected Improvement strategy, EI:"
REFERENCES,0.7873015873015873,"Ln(EIπ,n, Dn, Hℓ(X), R) ∼Ln(EIn, Dn, Hℓ(X), R),
(19)"
REFERENCES,0.7904761904761904,"so we obtain a convergence rate for EIπ of Ln(EIπ,n, Dn, Hℓ(X), R) = O(n−(ν∧1)/d(log n)γ)."
REFERENCES,0.7936507936507936,"Proof. We simply compute the fraction of the losses in the limit,"
REFERENCES,0.7968253968253968,"lim
n→∞
Ln(EIπ, Dn, Hℓ(X), R)"
REFERENCES,0.8,"Ln(EI, Dn, Hℓ(X), R) ≤lim
n→∞"
REFERENCES,0.8031746031746032,maxx∈X π(x)
REFERENCES,0.8063492063492064,minx∈X π(x)
REFERENCES,0.8095238095238095,"β/n
= 1.
(20)"
REFERENCES,0.8126984126984127,"E.1
SENSITIVITY ANALYSIS ON Cπ,n"
