Section,Section Appearance Order,Paragraph
REFERENCES,0.18311403508771928,"Luc Devroye. The equivalence of weak, strong and complete convergence in L1 for kernel density
estimates. The Annals of Statistics, 11(3):896–904, 1983."
REFERENCES,0.18421052631578946,"Luc Devroye. Automatic pattern recognition: A study of the probability of error. IEEE Transactions
on pattern analysis and machine intelligence, 10(4):530–543, 1988."
REFERENCES,0.18530701754385964,"Tilmann Gneiting, Fadoua Balabdaoui, and Adrian E Raftery. Probabilistic forecasts, calibration
and sharpness. Journal of the Royal Statistical Society: Series B (Statistical Methodology), 69(2):
243–268, 2007."
REFERENCES,0.18640350877192982,"Louis Gordon and Richard A Olshen.
Almost surely consistent nonparametric regression from
recursive partitioning schemes. Journal of Multivariate Analysis, 15(2):147–163, 1984."
REFERENCES,0.1875,"Chuan Guo, Geoff Pleiss, Yu Sun, and Kilian Q. Weinberger. On calibration of modern neural
networks. In International Conference on Machine Learning, 2017."
REFERENCES,0.18859649122807018,Published as a conference paper at ICLR 2022
REFERENCES,0.18969298245614036,"Chirag Gupta and Aaditya Ramdas. Distribution-free calibration guarantees for histogram binning
without sample splitting. In International Conference on Machine Learning, 2021."
REFERENCES,0.19078947368421054,"Chirag Gupta, Aleksandr Podkopaev, and Aaditya Ramdas. Distribution-free binary classiﬁcation:
prediction sets, conﬁdence intervals and calibration. In Advances in Neural Information Process-
ing Systems, 2020."
REFERENCES,0.19188596491228072,"Kartik Gupta, Amir Rahimi, Thalaiyasingam Ajanthan, Thomas Mensink, Cristian Sminchisescu,
and Richard Hartley. Calibration of neural networks using splines. In International Conference
on Learning Representations, 2021."
REFERENCES,0.19298245614035087,"Kaiming He, Xiangyu Zhang, Shaoqing Ren, and Jian Sun. Deep residual learning for image recog-
nition. In Proceedings of the IEEE Conference on Computer Vision and Pattern Recognition,
2016."
REFERENCES,0.19407894736842105,"Gao Huang, Zhuang Liu, Laurens Van Der Maaten, and Kilian Q Weinberger. Densely connected
convolutional networks. In Proceedings of the IEEE Conference on Computer Vision and Pattern
Recognition, 2017."
REFERENCES,0.19517543859649122,"Jon Kleinberg, Sendhil Mullainathan, and Manish Raghavan. Inherent trade-offs in the fair determi-
nation of risk scores. In Innovations in Theoretical Computer Science, 2017."
REFERENCES,0.1962719298245614,"Alex Krizhevsky. Learning multiple layers of features from tiny images. Technical Report, Univer-
sity of Toronto, 2009."
REFERENCES,0.19736842105263158,"Volodymyr Kuleshov, Nathan Fenner, and Stefano Ermon. Accurate uncertainties for deep learning
using calibrated regression. In International Conference on Machine Learning, 2018."
REFERENCES,0.19846491228070176,"Meelis Kull, Telmo M. Silva Filho, and Peter Flach.
Beyond sigmoids: How to obtain well-
calibrated probabilities from binary classiﬁers with beta calibration. Electronic Journal of Statis-
tics, 11(2):5052–5080, 2017."
REFERENCES,0.19956140350877194,"Meelis Kull, Miquel Perello-Nieto, Markus K¨angsepp, Hao Song, and Peter Flach. Beyond tem-
perature scaling: Obtaining well-calibrated multiclass probabilities with Dirichlet calibration. In
Advances in Neural Information Processing Systems, 2019."
REFERENCES,0.20065789473684212,"Ananya Kumar, Percy S Liang, and Tengyu Ma. Veriﬁed uncertainty calibration. In Advances in
Neural Information Processing Systems, 2019."
REFERENCES,0.20175438596491227,"Aviral Kumar, Sunita Sarawagi, and Ujjwal Jain. Trainable calibration measures for neural networks
from kernel mean embeddings. In International Conference on Machine Learning, 2018."
REFERENCES,0.20285087719298245,"G´abor Lugosi and Andrew Nobel. Consistency of data-driven histogram methods for density esti-
mation and classiﬁcation. Annals of Statistics, 24(2):687–706, 1996."
REFERENCES,0.20394736842105263,"Jishnu Mukhoti, Viveka Kulharia, Amartya Sanyal, Stuart Golodetz, Philip HS Torr, and Puneet K
Dokania. Calibrating deep neural networks using focal loss. In Advances in Neural Information
Processing Systems, 2020."
REFERENCES,0.2050438596491228,"Alexandru Niculescu-Mizil and Rich Caruana. Predicting good probabilities with supervised learn-
ing. In International Conference on Machine Learning, 2005."
REFERENCES,0.20614035087719298,"Jeremy Nixon, Michael W Dusenberry, Linchuan Zhang, Ghassen Jerfel, and Dustin Tran. Measur-
ing calibration in deep learning. arXiv preprint arXiv:1904.01685, 2020."
REFERENCES,0.20723684210526316,"Andrew Nobel. Histogram regression estimation using data-dependent partitions. The Annals of
Statistics, 24(3):1084–1105, 1996."
REFERENCES,0.20833333333333334,"Kanil Patel, William Beluch, Bin Yang, Michael Pfeiffer, and Dan Zhang. Multi-class uncertainty
calibration via mutual information maximization-based binning. In International Conference on
Learning Representations, 2021."
REFERENCES,0.20942982456140352,"John C. Platt. Probabilistic outputs for support vector machines and comparisons to regularized
likelihood methods. In Advances in Large Margin Classiﬁers, pages 61–74. MIT Press, 1999."
REFERENCES,0.21052631578947367,Published as a conference paper at ICLR 2022
REFERENCES,0.21162280701754385,"Aleksandr Podkopaev and Aaditya Ramdas. Distribution-free uncertainty quantiﬁcation for classi-
ﬁcation under label shift. In Uncertainty in Artiﬁcial Intelligence, 2021."
REFERENCES,0.21271929824561403,"Jian Qian, Ronan Fruit, Matteo Pirotta, and Alessandro Lazaric. Concentration inequalities for
multinoulli random variables. arXiv preprint arXiv:2001.11595, 2020."
REFERENCES,0.2138157894736842,"Amir Rahimi, Amirreza Shaban, Ching-An Cheng, Richard Hartley, and Byron Boots. Intra order-
preserving functions for calibration of multi-class neural networks. In Advances in Neural Infor-
mation Processing Systems, 2020."
REFERENCES,0.2149122807017544,"Rebecca Roelofs, Nicholas Cain, Jonathon Shlens, and Michael C Mozer. Mitigating bias in cali-
bration error estimation. arXiv preprint arXiv:2012.08668, 2020."
REFERENCES,0.21600877192982457,"J. Towns, T. Cockerill, M. Dahan, I. Foster, K. Gaither, A. Grimshaw, V. Hazlewood, S. Lathrop,
D. Lifka, G. D. Peterson, R. Roskies, J. Scott, and N. Wilkins-Diehr. XSEDE: Accelerating
Scientiﬁc Discovery. Computing in Science & Engineering, 16(5):62–74, 2014."
REFERENCES,0.21710526315789475,"Juozas Vaicenavicius, David Widmann, Carl Andersson, Fredrik Lindsten, Jacob Roll, and
Thomas B Sch¨on. Evaluating model calibration in classiﬁcation. In International Conference
on Artiﬁcial Intelligence and Statistics, 2019."
REFERENCES,0.21820175438596492,"Tsachy Weissman, Erik Ordentlich, Gadiel Seroussi, Sergio Verdu, and Marcelo J Weinberger. In-
equalities for the L1 deviation of the empirical distribution. Hewlett-Packard Labs, Tech. Rep,
2003."
REFERENCES,0.21929824561403508,"David Widmann, Fredrik Lindsten, and Dave Zachariah. Calibration tests in multi-class classiﬁca-
tion: a unifying framework. In Advances in Neural Information Processing Systems, 2019."
REFERENCES,0.22039473684210525,"Bianca Zadrozny and Charles Elkan. Obtaining calibrated probability estimates from decision trees
and naive Bayesian classiﬁers. In International Conference on Machine Learning, 2001."
REFERENCES,0.22149122807017543,"Bianca Zadrozny and Charles Elkan. Transforming classiﬁer scores into accurate multiclass proba-
bility estimates. In International Conference on Knowledge Discovery and Data Mining, 2002."
REFERENCES,0.2225877192982456,"Sergey Zagoruyko and Nikos Komodakis.
Wide residual networks.
In British Machine Vision
Conference, 2016."
REFERENCES,0.2236842105263158,"Jize Zhang, Bhavya Kailkhura, and T Han. Mix-n-match: Ensemble and compositional methods for
uncertainty calibration in deep learning. In International Conference on Machine Learning, 2020."
REFERENCES,0.22478070175438597,Published as a conference paper at ICLR 2022
REFERENCES,0.22587719298245615,"Algorithm 5: Post-hoc calibrator for a given M2B calibration notion C
Input: Base (uncalibrated) multiclass predictor g, calibration data
D “ pX1, Y1q, . . . , pXn, Ynq, binary calibrator
At0,1u : r0, 1sX ˆ pX ˆ t0, 1uq‹ Ñ r0, 1sX"
REFERENCES,0.22697368421052633,1 K Ð number of distinct calibration claims that C veriﬁes;
FOR EACH CLAIM K P RKS DO,0.22807017543859648,2 for each claim k P rKs do
FOR EACH CLAIM K P RKS DO,0.22916666666666666,"3
From g, infer prc, rgq Ð plabel-predictor, probability-predictorq corresponding to claim k;"
FOR EACH CLAIM K P RKS DO,0.23026315789473684,"4
Dk Ð tpXi, Ziqu, where Zi Ð 1 tYi “ rcpXiqu;"
IF CONDITIONING DOES NOT INCLUDE CLASS PREDICTION RC THEN,0.23135964912280702,"5
if conditioning does not include class prediction rc then"
IF CONDITIONING DOES NOT INCLUDE CLASS PREDICTION RC THEN,0.2324561403508772,"6
— (conﬁdence, top-K-conﬁdence, and class-wise calibration) —"
IF CONDITIONING DOES NOT INCLUDE CLASS PREDICTION RC THEN,0.23355263157894737,"7
hk Ð At0,1uprg, Dkq;"
END,0.23464912280701755,"8
end"
ELSE,0.23574561403508773,"9
else"
ELSE,0.23684210526315788,"10
— (top-label and top-K-label calibration) —"
FOR L P RLS DO,0.23793859649122806,"11
for l P rLs do"
FOR L P RLS DO,0.23903508771929824,"12
Dk,l Ð tpXi, Ziq P Dk : rcpXiq “ lqu;"
FOR L P RLS DO,0.24013157894736842,"13
hk,l Ð At0,1uprg, Dk,lq;"
END,0.2412280701754386,"14
end"
END,0.24232456140350878,"15
hkp¨q Ð hk,rcp¨qp¨q (hk predicts hk,lpxq if rcpxq “ l);"
END,0.24342105263157895,"16
end"
END,0.24451754385964913,17 end
END,0.24561403508771928,18 — (the new predictor replaces each rg with the corresponding hk) —
END,0.24671052631578946,"19 return plabel-predictor, hkq corresponding to each claim k P rKs;"
END,0.24780701754385964,"Input for Algorithms 6 and 7: base multiclass predictor g : X Ñ ∆L´1, calibration data D “
pX1, Y1q, . . . , pXn, Ynq, binary calibrator At0,1u : r0, 1sX ˆ pX ˆ t0, 1uq‹ Ñ r0, 1sX ."
END,0.24890350877192982,Algorithm 6: Top-K-label calibrator
END,0.25,"1 For every k P rKs, infer from g the k-th
largest class predictor cpkq and the
associated probability gpkq;"
END,0.25109649122807015,2 for k Ð 1 to K do
END,0.25219298245614036,"3
for l Ð 1 to L do"
END,0.2532894736842105,"4
Dk,l Ð tpXi, 1 tYi “ luq :
cpkqpXiq “ lu;"
END,0.2543859649122807,"5
hpk,lq Ð At0,1upgpkq, Dk,lq;"
END,0.25548245614035087,"6
end"
END,0.2565789473684211,"7
hpkq Ð hpk,cpkqp¨qqp¨q;"
END,0.2576754385964912,8 end
END,0.25877192982456143,"9 return php1q, hp2q, . . . , hpKqq;"
END,0.2598684210526316,Algorithm 7: Top-K-conﬁdence calibrator
END,0.26096491228070173,"1 For every k P rKs, infer from g the k-th
largest class predictor cpkq and the
associated probability gpkq;"
END,0.26206140350877194,2 for k Ð 1 to K do
END,0.2631578947368421,"3
Dk Ð tpXi, 1 tYi “ luq : i P rnsu;"
END,0.2642543859649123,"4
hpkq Ð At0,1upgpkq, Dkq;"
END,0.26535087719298245,5 end
END,0.26644736842105265,"6 return php1q, hp2q, . . . , hpKqq;"
END,0.2675438596491228,"A
ADDENDUM TO SECTION 3 “CALIBRATION ALGORITHMS FROM
CALIBRATION METRICS”"
END,0.26864035087719296,"In Section 3, we introduced the concept of M2B calibration, and showed that popular calibration
notions are in fact M2B notions (Table 1). We showed how the calibration notions of top-label,
class-wise, and conﬁdence calibration can be achieved using a corresponding M2B calibrator. In
the following subsection, we present the general-purpose wrapper Algorithm 5 that can be used to
derive an M2B calibrator from any given M2B calibration notion that follows the rubric speciﬁed by
Table 1. In Appendix A.2, we illustrate the philosophy of M2B calibration using a simple example
with a dataset that contains 6 points. This example also illustrates the top-label-calibrator, the class-
wise-calibrator, and the conﬁdence-calibrator."
END,0.26973684210526316,Published as a conference paper at ICLR 2022
END,0.2708333333333333,"(a) Predictions of a ﬁxed base model
g : X Ñ ∆3 on calibration/test data
D “ tpa, 3q, pb, 4q, . . . , pf, 1qu."
END,0.2719298245614035,(b) Conﬁdence calibration
END,0.2730263157894737,(c) Top-label calibration
END,0.2741228070175439,(d) Class-wise calibration
END,0.27521929824561403,(e) Canonical calibration
END,0.27631578947368424,"Figure 3: Illustrative example for Section A.2. The numbers in plot (a) correspond to the predictions
made by g on a dataset D. If D were a test set, plots (b–e) show how it should be used to verify if g
satisﬁes the corresponding notion of calibration. Consequently, we argue that if D were a calibration
set, and we want to achieve one of the notions (b–e), then the data shown in the corresponding plots
should be the data used to calibrate g as well."
END,0.2774122807017544,"A.1
GENERAL-PURPOSE M2B CALIBRATOR"
END,0.27850877192982454,"Denote some M2B notion of calibration as C. Suppose C corresponds to K binary calibration claims.
The outer for-loop in Algorithm 5, runs over each such claim in C. For example, for class-wise
calibration, K “ L and for conﬁdence and top-label calibration, K “ 1. Corresponding to each
claim, there is a probability-predictor that the conditioning is to be done on, such as g or gl or gpkq.
Additionally, there may be conditioning on the label predictor such as c or cpkq. These are denoted
as prc, rgq in Algorithm 5. For conﬁdence and top-label calibration, rc “ c, the top-label-conﬁdence.
For class-wise calibration, when rg “ gl, we have rcp¨q “ l."
END,0.27960526315789475,"If there is no label conditioning in the calibration notion, such as in conﬁdence, top-K-conﬁdence,
and class-wise calibration, then we enter the if-condition inside the for-loop. Here hk is learnt using
a single calibration dataset and a single call to At0,1u. Otherwise, if there is label conditioning, such
as in top-label and top-K-label calibration, we enter the else-condition, where we learn a separate
hk,l for every l P rLs, using a different part of the dataset Dl in each case. Then hkpxq equals
hk,lpxq if rcpxq “ l."
END,0.2807017543859649,"Finally, since C is verifying a sequence of claims, the output of Algorithm 5 is a sequence of pre-
dictors. Each original prediction prc, rgq corresponding to the C is replaced with prc, hkq. This is the
output of the M2B calibrator. Note that the rc values are not changed. This output appears abstract,
but normally, it can be represented in an interpretable way. For example, for class-wise calibration,
the output is just a sequence of predictors, one for each class: ph1, h2, . . . , hLq."
END,0.2817982456140351,"This general-purpose M2B calibrators can be used to achieve any M2B calibration notion: top-
label calibration (Algorithm 2), class-wise calibration (Algorithm 3), conﬁdence calibration (Algo-
rithm 1), top-K-label calibration (Algorithm 6), and top-K-conﬁdence calibration (Algorithm 7)."
END,0.28289473684210525,"A.2
AN EXAMPLE TO ILLUSTRATE THE PHILOSOPHY OF M2B CALIBRATION"
END,0.28399122807017546,"Figure 3a shows the predictions of a given base model g on a given dataset D. Suppose D is a
test set, and we are testing conﬁdence calibration. Then the only predictions that matter are the
top-predictions corresponding to the shaded values. These are stripped out and shown in Figure 3b,
in the gp¨q row. Note that the indicator 1 tY “ cp¨qu is sufﬁcient to test conﬁdence calibration and
given this, the cpXq are not needed. Thus the second row in Figure 3b only shows these indicators."
END,0.2850877192982456,Published as a conference paper at ICLR 2022
END,0.28618421052631576,"Algorithm 8: Top-label histogram binning
Input: Base multiclass predictor g, calibration data D “ pX1, Y1q, . . . , pXn, Ynq
Hyperparameter: # points per bin k P N (say 50), tie-breaking parameter δ ą 0 (say 10´10)
Output: Top-label calibrated predictor pc, hq"
END,0.28728070175438597,1 c Ð classiﬁer or top-class based on g;
END,0.2883771929824561,2 g Ð top-class-probability based on g;
END,0.2894736842105263,3 for l Ð 1 to L do
END,0.2905701754385965,"4
Dl Ð tpXi, 1 tYi “ luq : cpXiq “ lqu and nl Ð |Dl|;"
END,0.2916666666666667,"5
hl Ð Binary-histogram-binningpg, Dl, tnl{ku , δq;"
END,0.29276315789473684,6 end
END,0.29385964912280704,7 hp¨q Ð hcp¨qp¨q;
END,0.2949561403508772,"8 return pc, hq;"
END,0.29605263157894735,"Verifying top-label calibration is similar (Figure 3c), but in addition to the predictions gp¨q, we also
retain the values of cp¨q. Thus the gp¨q and 1 tY “ cp¨qu are shown, but split across the 4 classes.
Class-wise calibration requires access to all the predictions, however, each class is considered sep-
arately as indicated by Figure 3d. Canonical calibration looks at the full prediction vector in each
case. However, in doing so, it becomes unlikely that gpxq “ gpyq for any x, y since the number of
values that g can take is now exponential."
END,0.29714912280701755,"Let us turn this around and suppose that D were a calibration set instead of a test set. We argue that D
should be used in the same way, whether testing or calibrating. Thus, if conﬁdence calibration is to
be achieved, we should focus on the pg, 1 tY “ cp¨quq corresponding to g. If top-label calibration is
to be achieved, we should use the pc, gq values. If class-wise calibration is to be achieved, we should
look at each gl separately and solve L different problems. Finally, for canonical calibration, we must
look at the entire g vector as a single unit. This is the core philosophy behind M2B calibrators: if
binary claims are being veriﬁed, solve binary calibration problems."
END,0.2982456140350877,"B
DISTRIBUTION-FREE TOP-LABEL CALIBRATION USING HISTOGRAM
BINNING"
END,0.2993421052631579,"In this section, we formally describe histogram binning (HB) with the top-label-calibrator (Algo-
rithm 2) and provide methodological insights through theory and experiments."
END,0.30043859649122806,"B.1
FORMAL ALGORITHM AND THEORETICAL GUARANTEES"
END,0.30153508771929827,"Algorithm 8 describes the top-label calibrator formally using HB as the binary calibration algorithm.
The function called in line 5 is Algorithm 2 of Gupta and Ramdas (2021). The ﬁrst argument in the
call is the top-label conﬁdence predictor, the second argument is the dataset to be used, the third
argument is the number of bins to be used, and the fourth argument is a tie-breaking parameter
(described shortly). While previous empirical works on HB ﬁxed the number of bins per class, the
analysis of Gupta and Ramdas (2021) suggests that a more principled way of choosing the number
of bins is to ﬁx the number of points per bin. This is parameter k of Algorithm 8. Given k, the
number of bins is decided separately for every class as tnl{ku where nl is the number of points
predicted as class l. This choice is particularly relevant for top-label calibration since nl can be
highly non-uniform (we illustrate this empirically in Section B.2). The tie-breaking parameter δ
can be arbitrarily small (like 10´10), and its signiﬁcance is mostly theoretical—it is used to ensure
that outputs of different bins are not exactly identical by chance, so that conditioning on a calibrated
probability output is equivalent to conditioning on a bin; this leads to a cleaner theoretical guarantee."
END,0.3026315789473684,"HB recalibrates g to a piecewise constant function h that takes one value per bin. Consider a speciﬁc
bin b; the h value for this bin is computed as the average of the indicators t1 tYi “ cpXiqu : Xi P
Bin bu. This is an estimate of the bias of the bin PpY “ cpXq | X P Bin bq. A concentration
inequality can then be used to bound the deviation between the estimate and the true bias to prove
distribution-free calibration guarantees. In the forthcoming Theorem 1, we show high-probability
and in-expectation bounds on the the TL-ECE of HB. Additionally, we show marginal and condi-"
END,0.30372807017543857,Published as a conference paper at ICLR 2022
END,0.3048245614035088,"tional top-label calibration bounds, deﬁned next. These notions were proposed in the binary cal-
ibration setting by Gupta et al. (2020) and Gupta and Ramdas (2021). In the deﬁnition below, A
refers to any algorithm that takes as input calibration data D and an initial classiﬁer g to produce a
top-label predictor c and an associated probability map h. Algorithm 8 is an example of A."
END,0.3059210526315789,"Deﬁnition 1 (Marginal and conditional top-label calibration). Let ε, α P p0, 1q be some given levels
of approximation and failure respectively. An algorithm A : pg, Dq ÞÑ pc, hq is"
END,0.30701754385964913,"(a) pε, αq-marginally top-label calibrated if for every distribution P over X ˆ rLs,"
END,0.3081140350877193,"P
´
|PpY “ cpXq | cpXq, hpXqq ´ hpXq| ď ε
¯
ě 1 ´ α.
(8)"
END,0.3092105263157895,"(b) pε, αq-conditionally top-label calibrated if for every distribution P over X ˆ rLs,"
END,0.31030701754385964,"P
´
@ l P rLs, r P Rangephq, |PpY “ cpXq | cpXq “ l, hpXq “ rq ´ r| ď ε
¯
ě 1 ´ α.
(9)"
END,0.31140350877192985,"To clarify, all probabilities are taken over the test point pX, Y q „ P, the calibration data D „ P n,
and any other inherent algorithmic randomness in A; these are all implicit in pc, hq “ ApD, gq.
Marginal calibration asserts that with high probability, on average over the distribution of D, X,
PpY “ cpXq | cpXq, hpXqq is at most ε away from hpXq. In comparison, TL-ECE is the average of
these deviations over X. Marginal calibration may be a more appropriate metric for calibration than
TL-ECE if we are somewhat agnostic to probabilistic errors less than some ﬁxed threshold ε (like
0.05). Conditional calibration is a strictly stronger deﬁnition that requires the deviation to be at most
ε for every possible prediction pl, rq, including rare ones, not just on average over predictions. This
may be relevant in medical settings where we want the prediction on every patient to be reasonably
calibrated. Algorithm 8 satisﬁes the following calibration guarantees."
END,0.3125,"Theorem 1. Fix hyperparameters δ ą 0 (arbitrarily small) and points per bin k ě 2, and assume
nl ě k for every l P rLs. Then, for any α P p0, 1q, Algorithm 8 is pε1, αq-marginally and pε2, αq-
conditionally top-label calibrated for ε1 “ d"
END,0.31359649122807015,"logp2{αq
2pk ´ 1q ` δ,
and
ε2 “ d"
END,0.31469298245614036,logp2n{kαq
END,0.3157894736842105,"2pk ´ 1q
` δ.
(10)"
END,0.3168859649122807,"Further, for any distribution P over X ˆ rLs, we have PpTL-ECEpc, hq ď ε2q ě 1 ´ α, and
E rTL-ECEpc, hqs ď
a"
END,0.31798245614035087,1{2k ` δ.
END,0.3190789473684211,"The proof in Appendix H is a multiclass top-label adaption of the guarantee in the binary setting by
Gupta and Ramdas (2021). The rOp1{
?"
END,0.3201754385964912,"kq dependence of the bound relies on Algorithm 8 delegating
at least k points to every bin. Since δ can be chosen to be arbitrarily small, setting k “ 50 gives
roughly ED rTL-ECEphqs ď 0.1. Base on this, we suggest setting k P r50, 150s in practice."
END,0.32127192982456143,"B.2
TOP-LABEL HISTOGRAM BINNING ADAPTS TO CLASS IMBALANCED DATASETS"
END,0.3223684210526316,"The principled methodology of ﬁxing the number of points per bin reaps practical beneﬁts. Fig-
ure 4 illustrates this through the performance of HB for the class imbalanced COVTYPE-7 dataset
(Blackard and Dean, 1999) with class ratio approximately 36% for class 1 and 49% for class 2. The
entire dataset has 581012 points which is divided into train-test in the ratio 70:30. Then, 10% of the
training points are held out for calibration (n “ |D| “ 40671). The base classiﬁer is a random forest
(RF) trained on the remaining training points (it achieves around 95% test accuracy). The RF is then
recalibrated using HB. The top-label reliability diagrams in Figure 4a illustrate that the original RF
(in orange) is underconﬁdent on both the most likely and least likely classes. Additional ﬁgures in
Appendix F show that the RF is always underconﬁdent no matter which class is predicted as the
top-label. HB (in green) recalibrates the RF effectively across all classes. Validity plots (Gupta and
Ramdas, 2021) estimate how the LHS of condition (8), denoted as V pεq, varies with ε. We observe
that for all ε, V pεq is higher for HB. The rightmost barplot compares the estimated TL-ECE for all
classes, and also shows the class proportions. While the original RF is signiﬁcantly miscalibrated for"
END,0.32346491228070173,Published as a conference paper at ICLR 2022
END,0.32456140350877194,"Random forest
Histogram binning
Class ratio"
END,0.3256578947368421,"0.00
0.25
0.50
0.75
1.00
Predicted probability 0.0 0.2 0.4 0.6 0.8 1.0"
END,0.3267543859649123,True probability
END,0.32785087719298245,Class 2 reliability diagram
END,0.32894736842105265,"0.00
0.05
0.10
0.15 0.0 0.2 0.4 0.6 0.8 1.0 V( )"
END,0.3300438596491228,Class 2 validity plot
END,0.33114035087719296,"0.00
0.25
0.50
0.75
1.00
Predicted probability 0.0 0.2 0.4 0.6 0.8 1.0"
END,0.33223684210526316,True probability
END,0.3333333333333333,Class 4 reliability diagram
END,0.3344298245614035,"0.00
0.05
0.10
0.15 0.0 0.2 0.4 0.6 0.8 1.0 V( )"
END,0.3355263157894737,Class 4 validity plot 1 2 3 4 5 6 7 Class 0.000 0.025 0.050 0.075 0.100 0.125 0.150 0.175 0.200
END,0.3366228070175439,Top-label ECE 0.0 0.1 0.2 0.3 0.4 0.5
END,0.33771929824561403,Class ratio
