Section,Section Appearance Order,Paragraph
ABSTRACT,0.0,ABSTRACT
ABSTRACT,0.0012468827930174563,"We advocate for a practical Maximum Likelihood Estimation (MLE) approach
towards designing loss functions for regression and forecasting, as an alternative
to the typical approach of direct empirical risk minimization on a speciﬁc target
metric. The MLE approach is better suited to capture inductive biases such as prior
domain knowledge in datasets, and can output post-hoc estimators at inference time
that can optimize different types of target metrics. We present theoretical results
to demonstrate that our approach is competitive with any estimator for the target
metric under some general conditions. In two example practical settings, Poisson
and Pareto regression, we show that our competitive results can be used to prove
that the MLE approach has better excess risk bounds than directly minimizing
the target metric. We also demonstrate empirically that our method instantiated
with a well-designed general purpose mixture likelihood family can obtain superior
performance for a variety of tasks across time-series forecasting and regression
datasets with different data distributions."
INTRODUCTION,0.0024937655860349127,"1
INTRODUCTION"
INTRODUCTION,0.003740648379052369,"The task of ﬁtting a regression model for a response variable y against a covariate vector x ∈Rd
is ubiquitous in supervised learning in both linear and non-linear settings (Lathuilière et al., 2020;
Mohri et al., 2018) as well as non-i.i.d settings like multi-variate forecasting (Salinas et al., 2020;
Wang et al., 2019). The end goal in regression and forecasting problems is often to use the resulting
model to obtain good performance in terms of some target metric of interest on the population level
(usually measured on a previously unseen test set). The mean-squared error or the mean absolute
deviation are examples of common target metrics."
INTRODUCTION,0.004987531172069825,"In this paper, our focus is on the choice of loss function that is used to train such models, which is an
important question that is often overlooked, especially in the deep neural networks context where the
emphasis is more on the choice of network architecture (Lathuilière et al., 2020)."
INTRODUCTION,0.006234413965087282,"Perhaps the most common method used by practitioners for choosing the loss function for a particular
regression model is to directly use the target metric of interest as the loss function for empirical risk
minimization (ERM) over a function class on the training set. We denote this approach for choosing a
loss function as Target Metric Optimization (TMO). This is especially more common with the advent
of powerful general purpose function optimizers like deep networks and has also been rigorously
analyzed for simpler function classes (Mohri et al., 2018)."
INTRODUCTION,0.007481296758104738,"Target Metric Optimization seems like a reasonable approach - if the practitioner knows about the
target metric of interest for prediction using the model, it seems intuitive to optimize for the same
objective on the training data. Prior work (both theoretical and applied) has both advocated for and
argued against TMO for regression problems. Many prominent works on regression (Goldberger
et al., 1964; Lecue & Mendelson, 2016) use the TMO approach, though most of them assume that
the data is well behaved (e.g. sub-Gaussian noise). In terms of applications, many recent works on
time-series forecasting (Wu et al., 2020; Oreshkin et al., 2019; Sen et al., 2019) also use the TMO
approach directly on the target metric. On the other hand, the robust regression literature has long
advocated for not using the target metric directly for ERM in the case of contamination or heavy
tailed response/covariate behaviour (Huber, 1992; Hsu & Sabato, 2016; Zhu & Zhou, 2021; Lugosi
& Mendelson, 2019a; Audibert et al., 2011; Brownlees et al., 2015) on account of its suboptimal"
INTRODUCTION,0.008728179551122194,Published as a conference paper at ICLR 2022
INTRODUCTION,0.00997506234413965,"high-probability risk bounds. However, as noted in (Prasad et al., 2020), many of these methods
are either not practical (Lugosi & Mendelson, 2019a; Brownlees et al., 2015) or have sub-optimal
empirical performance (Hsu & Sabato, 2016). Even more practical methods such as (Prasad et al.,
2020) would lead to sufﬁciently more computational overhead over standard TMO."
INTRODUCTION,0.011221945137157107,"Another well known approach for designing a loss function is Maximum Likelihood Estimation (MLE).
Here one assumes that the conditional distribution of y given x belongs to a family of distributions
p(y|x; θ) parameterized by θ ∈Θ (McCullagh & Nelder, 2019). Then one can choose the negative
log likelihood as the loss function to optimize using the training set, to obtain an estimate ˆθθθmle. This
approach is sometimes used in the forecasting literature (Salinas et al., 2020; Davis & Wu, 2009)
where the choice of a likelihood can encode prior knowledge about the data. For instance a negative
binomial distribution can be used to model count data. During inference, given a new instance x′,
one can output the statistic from p(y|x′; ˆθθθmle) that optimizes the target metric, as the prediction
value (Gneiting, 2011). MLE also seems like a reasonable approach for loss function design - it is
folklore that the MLE is asymptotically optimal for parameter estimation, in terms of having the
smallest asymptotic variance among all estimators (Heyde, 1978; Rao, 1963), when the likelihood is
well-speciﬁed. However, much less is known about ﬁnite-sample, ﬁxed-dimension analysis of MLE,
which is the typical regime of interest for the regression problems we consider in this paper. An
important practical advantage for MLE is that model training is agnostic to the choice of the target
metric - the same trained model can output estimators for different target metrics at inference time.
Perhaps the biggest argument against the MLE approach is the requirement of knowing the likelihood
distribution family. We address both these topics in Section 5."
INTRODUCTION,0.012468827930174564,"Both TMO and MLE can be viewed as offering different approaches to selecting the loss function
for a given regression model. In this paper, we argue that in several settings, both from a practical
and theoretical perspective, MLE might be a better approach than TMO. This result might not be
immediately obvious apriori - while MLE does beneﬁt from prior knowledge of the distribution,
TMO also beneﬁts from prior knowledge of the target metric at training time."
INTRODUCTION,0.01371571072319202,Our main contributions are as follows:
INTRODUCTION,0.014962593516209476,"Competitiveness of MLE: In Section 3, we prove that under some general conditions on the family
of distributions and a property of interest, the MLE approach is competitive with any estimator for
the property. We show that this result can be applied to ﬁxed design regression problems in order to
prove that MLE can be competitive (up to logarithmic terms) with any estimator in terms of excess
square loss risk, under some assumptions."
INTRODUCTION,0.016209476309226933,"Example Applications: In Section 4.1, we apply our general theorem to prove an excess square loss
bound for the the MLE estimator for Poisson regression with the identity link (Nelder & Wedderburn,
1972; Lawless, 1987). We show that these bounds can be better than those of the TMO estimator,
which in this case is least-squares regression. Then in Section 4.2, we show a similar application
in the context of Pareto regression i.e y|x follows a Pareto distribution. We show that MLE can be
competitive with robust estimators like the one in (Hsu & Sabato, 2016) and therefore can be better
than TMO (least-squares)."
INTRODUCTION,0.017456359102244388,"Empirical Results:
We propose the use of a general purpose mixture likelihood family (see
Section 5) that can capture a wide variety of prior knowledge across datasets, including zero-inﬂated
or bursty data, count data, sub-Gaussian continuous data as well as heavy tailed data, through different
choices of (learnt) mixture weights. Then we empirically show that the MLE approach with this
likelihood can outperform ERM for many different commonly used target metrics like WAPE, MAPE
and RMSE (Hyndman & Koehler, 2006) for two popular forecasting and two regression datasets.
Moreover the MLE approach is also shown to have better probabilistic forecasts (measured by
quantile losses (Wen et al., 2017)) than quantile regression (Koenker & Bassett Jr, 1978; Gasthaus
et al., 2019; Wen et al., 2017) which is the TMO approach in this case."
PRIOR WORK ON MLE,0.018703241895261846,"2
PRIOR WORK ON MLE"
PRIOR WORK ON MLE,0.0199501246882793,"Maximum likelihood estimators (MLE) have been studied extensively in statistics starting with
the work of Wald (1949); Redner (1981), who showed the maximum likelihood estimates are
asymptotically consistent for parametric families. Fahrmeir & Kaufmann (1985) showed asymptotic"
PRIOR WORK ON MLE,0.02119700748129676,Published as a conference paper at ICLR 2022
PRIOR WORK ON MLE,0.022443890274314215,"normality for MLE for generalized linear models. It is also known that under some regularity
assumptions, MLE achieves the Cramer-Rao lower bound asymptotically (Lehmann & Casella, 2006).
However, we note that none of these asymptotic results directly yield ﬁnite sample guarantees."
PRIOR WORK ON MLE,0.02369077306733167,"Finite sample guarantees have been shown for certain problem scenarios. Geer & van de Geer (2000);
Zhang (2006) provided uniform convergence bounds in Hellinger distance for maximum likelihood
estimation. These ideas were recently used by Foster & Krishnamurthy (2021) to provide algorithms
for contextual bandits. There are other works which study MLE for non-parametric distributions e.g.,
Dümbgen & Ruﬁbach (2009) showed convergence rates for log-concave distributions. There has
been some works (Sur & Candès, 2019; Bean et al., 2013; Donoho & Montanari, 2016; El Karoui,
2018) that show that MLE can be sub-optimal for high dimensional regression i.e when the dimension
grows with the number of samples. In this work we focus on the setting where the dimension does
not scale with the number of samples."
PRIOR WORK ON MLE,0.02493765586034913,"Our MLE results differ from the above work as we provide ﬁnite sample competitiveness guarantees.
Instead of showing that the maximum likelihood estimator converges in some distance metric, we
show that under some mild assumptions it can work as well as other estimators. Hence, our methods
are orthogonal to known well established results in statistics."
PRIOR WORK ON MLE,0.026184538653366583,"Perhaps the closest to our work is the competitiveness result of Acharya et al. (2017), who showed
that MLE is competitive when the size of the output alphabet is bounded and applied to proﬁle
maximum likelihood estimation. In contrast, our work applies for unbounded output alphabets and
can provide stronger guarantees in many scenarios."
COMPETITIVENESS OF MLE,0.02743142144638404,"3
COMPETITIVENESS OF MLE"
COMPETITIVENESS OF MLE,0.028678304239401497,"In this section, we will show that under some reasonable assumptions on the likelihood family, the
MLE is competitive with any estimator in terms of estimating any property of a distribution from the
family. We will then show that this result can be applied to derive bounds on the MLE in some ﬁxed
design regression settings that can be better than that of TMO. We will ﬁrst setup some notation."
COMPETITIVENESS OF MLE,0.029925187032418952,"Notation: Given a positive semi-deﬁnite symmetric matrix M, ∥x∥M := xT Mx is the matrix
norm of the vector x. λ(M) denotes an eigenvalue of a symmetric square matrix M; speciﬁcally
λmax(M) and λmin(M) denote the maximum and minimum eigenvalues respectively. The letter f
is used to denote general probability densities. We use p to denote the conditional probability density
of the response given the covariate. ∥·∥1 will be overloaded to denote the ℓ1 norm between two
probability distributions i.e ∥p −p′∥1 :=
R
|p(z) −p′(z)|dz. DKL(p1; p2) will be used to denote the
KL-divergence between the two distributions. If Z is a set equipped with a norm ∥·∥, then N(ϵ, Z)
will denote an ϵ-net i.e any point z ∈Z has a corresponding point z′ ∈N(ϵ, Z) s.t ∥z −z′∥≤ϵ.
Bd
r denotes the ball centered at the origin with radius r and Sd−1
r
denotes its surface. We deﬁne
[n] := {1, 2, · · · , n}. | · | denotes the size of the enclosed set."
COMPETITIVENESS OF MLE,0.03117206982543641,"General Competitiveness:
We ﬁrst consider a general family of distributions F over the space
Z. For a sample z ∼f (for z ∈Z and f ∈F), the MLE distribution is deﬁned as fz =
argmaxf∈F f(z). We are interested in estimating a property π : F →W of these distributions from
an observed sample. The following deﬁnition will be required to impose some joint conditions on the
distribution family and the property being estimated, that are needed for our result.
Deﬁnition 1. The tuple (F, π), where F is a set of distributions and π : F →W a property
of those distributions, is said to be (T, ϵ, δ1, δ2)-approximable, if there exists a set of distribu-
tions ˜F ⊆F s.t | ˜F| ≤T and for every f ∈F, there exists a ˜f such that ∥f −˜f∥1 ≤δ1 and"
COMPETITIVENESS OF MLE,0.032418952618453865,"Prz∼f
π(fz) −π( ˜fz)
 ≥ϵ

≤δ2, where ˜fz = argmax ˜
f∈˜
F ˜f(z) and W has a norm ∥·∥."
COMPETITIVENESS OF MLE,0.03366583541147132,"The above deﬁnition states that the set of distributions F has a ﬁnite δ-cover, ˜F in terms of the ℓ1
distance. Moreover the cover is such that solving MLE on the cover and applying the property π on
the result of the MLE is not too far from π applied on the MLE over the whole set F. This property
is satisﬁed trivially if F is ﬁnite. We note that it is also satisﬁed by some commonly used set of
distributions and corresponding properties. Now we state our main result.
Theorem 1. Let ˆπ be an estimator such that for any f ∈F and z ∼f, Pr(∥π(f) −ˆπ(z)∥≥ϵ) ≤δ.
Let Ff be a subset of F that contains f such that with probability at least 1−δ, fz ∈Ff and (Ff, π)"
COMPETITIVENESS OF MLE,0.034912718204488775,Published as a conference paper at ICLR 2022
COMPETITIVENESS OF MLE,0.03615960099750624,"is (T, ϵ, δ1, δ2)-approximable. Then the MLE satisﬁes the following bound,"
COMPETITIVENESS OF MLE,0.03740648379052369,Pr(∥π(f) −π(fz)∥≥3ϵ) ≤(T + 3)δ + δ1 + δ2.
COMPETITIVENESS OF MLE,0.03865336658354115,"We provide the proof of Theorem 1 in Appendix A. We also provide a simpler version of this result
for ﬁnite distribution families as Theorem 3 in Appendix A for the beneﬁt of the reader."
COMPETITIVENESS OF MLE,0.0399002493765586,"Competitiveness in Fixed Design Regression:
Theorem 1 can be used to show that MLE is
competitive with respect to any estimator for square loss minimization in ﬁxed design regression. We
will ﬁrst formally introduce the setting. Consider a ﬁxed design matrix X ∈Rn×d where n is the
number of samples and d the feature dimension. We will work in a setting where n ≫d. The target
vector is a random vector given by yn ∈Rn. Let yi be the i-th coordinate of yn and xi denote the
i-th row of the design matrix. We assume that the target is generated from the conditional distribution
given xi such that,"
COMPETITIVENESS OF MLE,0.04114713216957606,"yi ∼p(·|xi;θθθ∗), θθθ∗∈Θ."
COMPETITIVENESS OF MLE,0.04239401496259352,"We are interested in optimizing a target metric ℓ(·, ·) given an instance of the random vector yn. The
ﬁnal objective is to optimize,"
COMPETITIVENESS OF MLE,0.043640897755610975,"min
h∈H Eyi∼p(·|xi;θθθ∗) ""
1
n n
X"
COMPETITIVENESS OF MLE,0.04488778054862843,"i=1
ℓ(yi, h(xi)) # ,"
COMPETITIVENESS OF MLE,0.046134663341645885,"where H is a class of functions. In this context, we are interested in comparing two approaches."
COMPETITIVENESS OF MLE,0.04738154613466334,"TMO (see (Mohri et al., 2018)).
This is standard empirical risk minimization on the tar-
get metric where given an instance of the random vector yn one outputs the estimator ˆh =
minh∈H 1"
COMPETITIVENESS OF MLE,0.048628428927680795,"n
Pn
i=1 ℓ(yi, h(xi))."
COMPETITIVENESS OF MLE,0.04987531172069826,"MLE and post-hoc inference (see (Gneiting, 2011)). In this method one ﬁrst solves for the parameter
in the distribution family that best explains the empirical data by MLE i.e.,"
COMPETITIVENESS OF MLE,0.05112219451371571,"ˆθθθmle := argmin
θ∈Θ
L(yn; θ), where L(yn; θ) := n
X"
COMPETITIVENESS OF MLE,0.05236907730673317,"i=1
−log p(yi|xi; θ)"
COMPETITIVENESS OF MLE,0.05361596009975062,"Then
during
inference
given
a
sample
xi
the
predictor
is
deﬁned
as,
˜h(xi)
:=
argminˆy Ey∈p(·|xi;ˆθθθmle)[ℓ(y, ˆy)] or in other words we output the statistic from the MLE distribu-"
COMPETITIVENESS OF MLE,0.05486284289276808,"tion that optimizes the loss function of interest. For instance if ℓis the square loss, then ˜h(xi) will be
the mean of the conditional distribution p(y|xi; ˆθθθmle)."
COMPETITIVENESS OF MLE,0.05610972568578554,"We will prove a general result using Theorem 1 when the target metric ℓis the square loss and H is a
linear function class. Moreover, the true distribution p(·|xi;θθθ∗) is such that E[yi] = ⟨θθθ∗, xi⟩for all
i ∈[n] i.e we are in the linear realizable setting."
COMPETITIVENESS OF MLE,0.057356608478802994,"In this case the quantity of interest is the excess square loss risk given by,"
COMPETITIVENESS OF MLE,0.05860349127182045,"E(θ) := 1 n n
X"
COMPETITIVENESS OF MLE,0.059850374064837904,"i=1
Eyn∥yn −Xθ∥2
2 −1 n n
X"
COMPETITIVENESS OF MLE,0.06109725685785536,"i=1
Eyn∥yn −Xθθθ∗∥2
2 = ∥θ −θθθ∗∥2
Σ,
(1)"
COMPETITIVENESS OF MLE,0.06234413965087282,where Σ := (P
COMPETITIVENESS OF MLE,0.06359102244389027,"i xixT
i )/n is the normalized covariance matrix, and θθθ∗is the population minimizer
of the target metric over the linear function class. Now we are ready to state the main result."
COMPETITIVENESS OF MLE,0.06483790523690773,"Theorem 2. Consider a ﬁxed design regression setting where the likelihood family is parameterized
by θ ∈Θ ⊆Bd
w and |N(ϵ, Θ ∩Bd
w)| ≤|N(ϵ, Bd
w)| for a small enough ϵ. Further the following
conditions hold,"
COMPETITIVENESS OF MLE,0.06608478802992519,"1. DKL(p(yi; θ); p(yi; θ′)) ≤L∥θ −θ′∥2.
2. The negative log-likelihood L(yn; θ) as a function of θ is α-strongly convex and β-smooth, w.p.
at least 1 −δ."
COMPETITIVENESS OF MLE,0.06733167082294264,"Further suppose there exists an estimator θest such that E(θest) ≤(c1 + c2 log(1/δ))η/n, where
c1, c2 are problem dependent quantities and η > 0. Then the MLE estimator also satisﬁes,"
COMPETITIVENESS OF MLE,0.0685785536159601,Published as a conference paper at ICLR 2022
COMPETITIVENESS OF MLE,0.06982543640897755,E(ˆθθθmle) = O
COMPETITIVENESS OF MLE,0.07107231920199501," 
c1 + c2d
 
log n + log(wLλmax(Σ)) + log(β/α) + log 1 δ
η n !"
COMPETITIVENESS OF MLE,0.07231920199501247,w.p at least 1 −δ.
COMPETITIVENESS OF MLE,0.07356608478802992,"We provide the proof in Appendix C. The proof involves proving the conditions in Theorem 1 and
bounding the size of the cover T."
COMPETITIVENESS OF MLE,0.07481296758104738,"In order to better understand Theorem 2, let us consider a typical case where there exists a possibly
complicated estimator such that E(θest) = O((d + log(1/δ))/n). In this case the above theorem
implies that MLE will be competitive with this estimator up to a log n factor. In many cases the MLE
might be much simpler to implement than the original estimator but would essentially match the
same error bound. We now provide speciﬁc examples in subsequent sections."
APPLICATIONS OF COMPETITIVENESS RESULT,0.07605985037406483,"4
APPLICATIONS OF COMPETITIVENESS RESULT"
APPLICATIONS OF COMPETITIVENESS RESULT,0.0773067331670823,"In this section we will specialize to two examples, Poisson regression and Pareto regression, where
we show that MLE can be better than TMO through the use of our competitive result in Theorem 2."
POISSON REGRESSION,0.07855361596009976,"4.1
POISSON REGRESSION"
POISSON REGRESSION,0.0798004987531172,"We work in the ﬁxed design setting in Section 3 and assume that the conditional distribution of y|x is
Poisson i.e,"
POISSON REGRESSION,0.08104738154613467,"p(yi = k|xi;θθθ∗) = µk
i e−µi"
POISSON REGRESSION,0.08229426433915212,"k!
where, µi = ⟨θθθ∗, xi⟩> 0,
(2)"
POISSON REGRESSION,0.08354114713216958,"for all i ∈[n]. Poisson regression is a popular model for studying count data regression which
naturally appears in many applications like demand forecasting (Lawless, 1987). Note that here we
study the version of Poisson regression with the identity link function (Nelder & Wedderburn, 1972),
while another popular variant is the one with exponential link function (McCullagh & Nelder, 2019).
We choose the identity link function for a fair comparison of the two approaches as it is realizable
for both the approaches under the linear function class i.e the globally optimal estimator in terms
of population can be obtained by both approaches. The exponential link function would make the
problem non-realizable under a linear function class for the TMO approach."
POISSON REGRESSION,0.08478802992518704,"We make the following natural assumptions. Let Σ = (Pn
i=1 xixT
i )/n be the design covariance
matrix as before and M = (Pn
i=1 µiuiuT
i )/n, where ui = xi/∥xi∥2. Let χ and ζ be the condition
numbers of the matrices M and Σ respectively.
Assumption 1. The parameter space Θ and the design matrix X satisfy the following,"
POISSON REGRESSION,0.08603491271820449,"• (A1) The parameter space Θ = {θ ∈Rd : ∥θ∥2 ≤w, min(∥θ∥2
2, ⟨θ, xi⟩) ≥γ > 0, ∀i ∈[n]}.
• (A2) The design matrix is such that λmin(Σ) > 0 and ∥xi∥2 ≤R for all i ∈[n]."
POISSON REGRESSION,0.08728179551122195,"• (A3) Let λmin(M) ≥
R2
4nγ2 (d log(24χ) + log(1/δ)) and
p"
POISSON REGRESSION,0.0885286783042394,"λmax(M)(d log(24χ) + log(1/δ)) ≤
√nλmin(M)/16, for a small δ ∈(0, 1) 1."
POISSON REGRESSION,0.08977556109725686,"The above assumptions are fairly mild. For instance λmin is ˜Ω(1/d) for random Gaussian covariance
matrices (Bai & Yin, 2008). The other part merely requires that λmin(M) = ˜Ω(
p"
POISSON REGRESSION,0.09102244389027432,dλmax(M)/n).
POISSON REGRESSION,0.09226932668329177,"We are interested in comparing MLE with TMO for the square loss which is just the least-squares
estimator i.e ˆθθθls := argminθ∈Θ
1
n∥yn −Xθ∥2
2. Note that it is apriori unclear as to which approach
would be better in terms of the target metric because on one hand the MLE method knows the
distribution family but on the other hand TMO is explicitly geared towards minimizing the square
loss during training."
POISSON REGRESSION,0.09351620947630923,"Least squares analysis is typically provided for regression under sub-Gaussian noise. By adapting
existing techniques (Hsu et al., 2012), we show the following guarantee for Poisson regression with
least square loss. We provide a proof in Appendix D for completeness."
POISSON REGRESSION,0.09476309226932668,1Note that the constants can be further tightened in our analysis.
POISSON REGRESSION,0.09600997506234414,Published as a conference paper at ICLR 2022
POISSON REGRESSION,0.09725685785536159,"Lemma 1. Let µmax = maxi µi. The least squares estimator ˆθθθls satisﬁes the following loss bounds
w.p. at least 1 −δ,"
POISSON REGRESSION,0.09850374064837905,E(ˆθθθls) =
POISSON REGRESSION,0.09975062344139651,"(
O
  µmax"
POISSON REGRESSION,0.10099750623441396,"n
 
log 1"
POISSON REGRESSION,0.10224438902743142,"δ + d

if µmax ≥(log(1/δ) + d log 6)/2"
POISSON REGRESSION,0.10349127182044887,"O

1
n
 
log 1"
POISSON REGRESSION,0.10473815461346633,"δ + d
2
otherwise"
POISSON REGRESSION,0.1059850374064838,"Now we present our main result in this section which uses the competitiveness bound in Theorem 2
coupled with the existence of a superior estimator compared to TMO, to show that the MLE estimator
can have a better bound than TMO."
POISSON REGRESSION,0.10723192019950124,"In Theorem 4 (in Appendix F), under some mild assumptions on the covariates, we construct an
estimator θest with the following bound for the Poisson regression setting,"
POISSON REGRESSION,0.1084788029925187,"E(θest) ≤c · ∥θθθ∗∥2 · λmax(Σ)
d + log( 1 δ )
n"
POISSON REGRESSION,0.10972568578553615,"
.
(3)"
POISSON REGRESSION,0.11097256857855362,"The construction of the estimator is median-of-means tournament based along the lines of (Lugosi &
Mendelson, 2019a) and therefore the estimator might not be practical. However, this immediately
gives the following bound on the MLE as a corollary of Theorem 2.
Corollary 1. Under assumption 1 and the conditions of Theorem 4, the MLE estimator for the
Poisson regression setting satisﬁes w.p. at least 1 −δ,"
POISSON REGRESSION,0.11221945137157108,"E(ˆθθθmle) = O

∥θθθ∗∥2 · λmax(Σ)d(log n + log(wRλmax(Σ)) + log χ + log 1 δ )
n 
."
