Section,Section Appearance Order,Paragraph
ABSTRACT,0.0,Abstract
ABSTRACT,0.0038314176245210726,"Graph neural networks (GNNs) have achieved great success for a variety of tasks
such as node classification, graph classification, and link prediction. However,
the use of GNNs (and machine learning more generally) to solve combinatorial
optimization (CO) problems is much less explored. Here, we introduce GCON,
a novel GNN architecture that leverages a complex filter bank and localized
attention mechanisms to solve CO problems on graphs. We show how our
method differentiates itself from prior GNN-based CO solvers and how it can be
effectively applied to the maximum cut, minimum dominating set, and maximum
clique problems in a unsupervised learning setting. GCON is competitive across
all tasks and consistently outperforms other specialized GNN-based approaches,
and is on par with the powerful Gurobi solver on the max-cut problem. We
provide an open-source implementation of our work1."
INTRODUCTION,0.007662835249042145,"1
Introduction"
INTRODUCTION,0.011494252873563218,"Recent years have seen the rapid development of neural networks for graph-structured data [37, 1].
Indeed, graph neural networks (GNNs) achieve state-of-the-art performance for tasks such as node
classification and are incorporated in industrial applications such as helping power Google Maps [10]
and Amazon’s recommender system [35]. Popular message-passing neural networks (MPNNs)
typically consider a graph together with a collection of features associated with each node [22, 39, 34].
In each layer, they first perform a local aggregation which effectively smooths the features over
neighboring nodes of the graph, and then perform a transformation which learns combinations of the
smoothed node features."
INTRODUCTION,0.01532567049808429,"Here, we consider leveraging GNNs to solve combinatorial optimization (CO) problems, a somewhat
less explored yet emerging application area of graph learning. In particular, we focus on finding (i)
the maximum clique, i.e., the largest fully connected subgraph, (ii) the minimum dominating set,
i.e., the smallest subset of the vertices which “dominates"" the graph in the sense that every vertex
is within at most one hop of the dominating set, and (iii) the maximum cut, i.e., a partition of the
vertices into two clusters with as many cross-cluster edges as possible."
INTRODUCTION,0.019157088122605363,"Notably, these tasks differ significantly from, e.g., node classification in several important ways. The
aggregations used in common message passing neural networks are localized averaging operations"
INTRODUCTION,0.022988505747126436,"∗Equal contribution.
†Equal senior author contributions.
1https://github.com/WenkelF/copt"
INTRODUCTION,0.02681992337164751,Towards a General Recipe for Combinatorial Optimization with Multi-Filter GNNs
INTRODUCTION,0.03065134099616858,"that can be interpreted, from the perspective of graph signal processing (GSP) [26, 29], as low-pass
filtering. In this manner, they effectively treat smoothness as an inductive bias. While this is a
useful heuristic on homophilic social networks such as the ubiquitous Cora, CiteSeer, and PubMed
datasets [7], we find that this assumption is not quite appropriate for CO problems. Moreover, in
CO problems, it is not reasonable to assume the presence of informative node features. Instead,
algorithms are expected to learn directly from the network geometry (taking initial inputs to be
constant or features derived from the graph structure, e.g., vertex degree). We also note that the CO
problems we are interested in are typically NP-hard. Therefore, it is computationally intractable to
obtain sufficient labeled data for supervised learning. As we shall see below, our approach tackles
various CO problems with a fully unsupervised framework, using task-specific loss functions."
INTRODUCTION,0.034482758620689655,"To address these challenges, we propose the Graph Combinatorial Optimization Network (GCON),
a novel GNN that uses a hybrid filter bank consisting of both (i) aggregation operations such as
those used in common MPNNs, as well as (ii) comparison operations, which will take the form of
band-pass, wavelet filters and aim to capture more intricate aspects of the network geometry. In order
to balance the importance of these different filters, we use a localized attention mechanism which
may choose to lend more importance to different filters on a node-by-node basis. We compare GCON
to various competing methods, such as heuristics, commercial solvers, other specialized GNN-based
approaches [18, 25], and recent advances that apply GFlowNets (GFNs) to the above mentioned
problems [41]. Our main contributions are:"
INTRODUCTION,0.038314176245210725,"1. We develop GCON, a novel GNN architecture with a sophisticated filter bank and a localized
attention mechanism that is particularly suited for solving CO problems."
INTRODUCTION,0.0421455938697318,"2. We evaluate GCON on a variety of graph-CO problems on synthetic graph benchmarks, and
demonstrate that our architecture is highly performant."
INTRODUCTION,0.04597701149425287,3. We prove a theorem that helps us interpret the improved performance of our method.
LIT REVIEW,0.04980842911877394,"2
Background and Related Work"
LIT REVIEW,0.05363984674329502,"Many well-known graph-CO problems are either NP-hard or even NP-complete [19], rendering it
impossible to efficiently generate exact solutions for large graphs. Instead, one may hope to efficiently
generate approximate solutions. Almost forty years after Hopfield and Tank [17] first proposed
applying deep neural networks to CO problems, there has been a recent revival in achieving this goal
via GNNs. Indeed, GNNs are a natural candidate due to their success on a wide variety of tasks such
as node classification, graph classification, and link prediction [1, 37]; a comprehensive overview can
be found in Cappart et al. [8]. Researchers have explored ways to solve graph-CO problems using
both supervised and unsupervised (in particular self-supervised) methods as well as reinforcement
learning (RL). Unfortunately, supervised methods are often computationally infeasible due to the
cost of labeling for NP-hard problems. RL-based solutions, on the other hand, may run into problems
arising from the large size of the state space. We thus view self-supervised learning as the most
promising family of approaches."
LIT REVIEW,0.05747126436781609,"Notably, Tönshoff et al. [32], Karalias and Loukas [18], Min et al. [25] have all used GNNs to solve
CO problems in a unsupervised manner through self-supervision. Tönshoff et al. [32] solves binary
constraint satisfaction problems using message-passing with recurrent states. Subsequently, Karalias
and Loukas [18] proposed a seminal self-supervised learning framework in which a GNN outputs a
Bernoulli distribution over the vertex set of the input graph, and a surrogate loss function designed
to encourage certain properties in the distribution (e.g., vertices that are assigned high probabilities
form a clique) and softly enforce constraints in a differentiable manner. They then propose specific
loss instantiations to tackle maximum clique and graph partitioning problems. A similar loss is
derived in Min et al. [25], who use an architecture based on the graph scattering transform [14] to
obtain promising results for the maximum clique problem. A notable difficulty associated with these
methods is that the proposed self-supervised loss functions are highly non-convex. This motivated a
separate line of work by Sun et al. [30] which designed an annealed optimization framework that
aims to optimize GNNs effectively for such loss functions. We also note the recent work by Zhang
et al. [41], which effectively applied generative flow networks [3] to solve CO problems in an iterative
manner. Our work is most closely related to Karalias and Loukas [18] and Min et al. [25], relying on
the same or closely related self-supervised loss functions, while improving on the learned part of the
pipeline, leveraging a more powerful hybrid GNN architecture."
LIT REVIEW,0.06130268199233716,Towards a General Recipe for Combinatorial Optimization with Multi-Filter GNNs
LIT REVIEW,0.06513409961685823,"Finally, GCON is related to several lines of work on building neural solvers that can perform well
across graph-CO problems. Tönshoff et al. [33] and Boisvert et al. [6] propose building unified
representations for constraint satisfaction problems (CSP), Berto et al. [4] and Zhou et al. [42]
similarly propose unified methods for vehicle routing problem (VRP) variants, while Drakulic et al.
[11] proposes a modular architecture for multi-task learning over a variety of CO problems."
IMPLEMENTATION/METHODS,0.06896551724137931,"3
Problem Setup"
IMPLEMENTATION/METHODS,0.07279693486590039,"The purpose of this paper is to develop methods for (approximately) solving combinatorial optimiza-
tion problems on graphs in a scalable and computationally efficient manner."
IMPLEMENTATION/METHODS,0.07662835249042145,"We let G = (V, E) denote a simple, connected, undirected graph. We assume an arbitrary (but
fixed) ordering on the vertices V = {v1, . . . , vn}. In a slight abuse of notation, if x is a function
defined on the vertices V , we do not distinguish between x and the vector defined by xi = x[vi].
We let A ∈Rn×n be the adjacency matrix of G, let D be the corresponding diagonal degree matrix,
D = diag(A 1), and let P = 1"
IMPLEMENTATION/METHODS,0.08045977011494253,"2(I + A D−1) denote the transition matrix of a lazy random walk (a
Markov chain in which, at each step, the walker either stays put or moves to a neighboring vertex,
each with probability one half). Finally, we let X ∈Rn×d denote a matrix of input node features."
IMPLEMENTATION/METHODS,0.0842911877394636,"We consider the following CO problems in this work, but also note that our framework could be
extended to a large variety of graph-CO problems such as vertex cover, maximal independent set or
graph coloring by constructing appropriate supervised or self-supervised loss functions:"
IMPLEMENTATION/METHODS,0.08812260536398467,"1. Maximum Cut: Find a partition of the vertex set V = S ⊔T that maximizes the number of
edges between S and T, i.e., |{{vi, vj} ∈E : vi ∈S, vj ∈T}|.
2. Maximum Clique: Find a fully connected subgraph (a clique) with as many vertices as possible.
3. Minimum Dominating Set: A subset of the vertices S ⊆V is called a dominating set if for
every vertex vi is either an element of S or a neighbor of S, in the sense that {vi, vj} ∈E for
some vj ∈S. Find a dominating set with as few vertices as possible."
IMPLEMENTATION/METHODS,0.09195402298850575,"4
Methodology"
IMPLEMENTATION/METHODS,0.09578544061302682,"We treat each of the CO problems as an unsupervised learning problem. We first compute basic node
statistics to serve as input features to the graph. We then use our GNN, described in detail in Section 5,
to generate a function/vector p whose i-th entry pi = p[vi] is interpreted as the probability that vi
is in the set of interest. We apply a sigmoid in its final layer ensuring that all entries are between 0
and 1. Finally, we use a rule-based decoder to construct a candidate solution by subsequently adding
nodes ordered by decreasing probability, based on p. Our methodology is illustrated in Fig. 1. In the
following subsections, we will explain how to develop suitable loss functions and decoders for each
problem of interest."
IMPLEMENTATION/METHODS,0.09961685823754789,"4.1
Maximum Cut"
IMPLEMENTATION/METHODS,0.10344827586206896,"In this problem, we aim to find the maximum cut V = S ⊔T, and without loss of generality, we
choose pi to be the probability that vi ∈S. We then define y := 2 p −1n (where 1n ∈Rn is the
vector of all 1’s) so that the entries of y lie in [−1, 1] (rather than [0, 1]) and use the loss function
L(y) := 1"
IMPLEMENTATION/METHODS,0.10727969348659004,2 y⊤A y = P
IMPLEMENTATION/METHODS,0.1111111111111111,"{vi,vj}∈E yiyj."
IMPLEMENTATION/METHODS,0.11494252873563218,"After learning y, we then set S to be the set of vertices where y is greater than or equal to zero and T
to be the set of vertices where y is negative. Intuitively, we note that every edge that connects two
nodes in different parts of the cut, i.e., sgn(yi) = −sgn(yj), decreases the loss, while the opposite
case yields an additive term that increases the loss. For example, if p = 1S (where 1S is the indicator
function on S ⊂V , i.e, 1S[v] = 1 if v ∈S, and zero otherwise), we have y = 1S −1T , and our
loss function is equal to the number of cuts minus the number of intra-cluster edges. Thus, the loss
function encourages a node labeling that cuts as many edges as possible."
IMPLEMENTATION/METHODS,0.11877394636015326,"4.2
Maximum Clique"
IMPLEMENTATION/METHODS,0.12260536398467432,"For the maximum clique, we let A denote the adjacency matrix of the complement graph G = (V, Ec),
where Ec is the set of all {{vi, vj} /∈E, i ̸= j} and use the two-part loss function considered in"
IMPLEMENTATION/METHODS,0.12643678160919541,Towards a General Recipe for Combinatorial Optimization with Multi-Filter GNNs
IMPLEMENTATION/METHODS,0.13026819923371646,Min et al. [25] (see also Karalias and Loukas [18]):
IMPLEMENTATION/METHODS,0.13409961685823754,L(p) := L1(p) + βL2(p) = −p⊤A p +β p⊤A p .
IMPLEMENTATION/METHODS,0.13793103448275862,"To understand this loss function, consider the idealized case where p = 1S is the indicator function
of some set S. In that case, one may verify that"
IMPLEMENTATION/METHODS,0.1417624521072797,"−L1(1S) = 1⊤
S A 1S =
X"
IMPLEMENTATION/METHODS,0.14559386973180077,"i,j
A[i, j]1S[vi]1S[vj]"
IMPLEMENTATION/METHODS,0.14942528735632185,"is the number of edges between elements of S. Similarly, we see have that"
IMPLEMENTATION/METHODS,0.1532567049808429,"L2(1S) = 1⊤
S A1S =
X i,j"
IMPLEMENTATION/METHODS,0.15708812260536398,"A[i, j]1S[vi]1S[vj]"
IMPLEMENTATION/METHODS,0.16091954022988506,"is the number of “missing edges” within S, i.e., the number of {vi, vj} ∈Ec, vi, vj ∈S. Therefore, in
minimizing L(p), we aim to find a subset with as many connections, and as few missing connections,
as possible. The hyper-parameter β is used to balance the contributions of L1 and L2."
IMPLEMENTATION/METHODS,0.16475095785440613,"After computing p, we then reorder the vertices {vi}n
i=1 →{v′
i}n
i=1 so in the new ordering p(v′
i) ≥
p(v′
i+1). We then build an initial clique by initializing C(1) = {v′
1} and iterating over i. At each
step, if C(1) ∪{v′
i} forms a clique, we add v′
i to C(1), otherwise we do nothing. Note that C(1) is
guaranteed to be a clique by construction."
IMPLEMENTATION/METHODS,0.1685823754789272,"We then repeat this process multiple times to construct additional cliques C(2), . . . , C(K). However,
on the k-th iteration, we initialize with C(k) = {v′
k} and automatically exclude v′
1, . . . , v′
k−1 from
C(k). We then choose the maximal clique C∗to be the C(k) with the largest cardinality. We note
that increasing K does increase the computational cost of our decoder; however, running the decoder
with different initializations {v′
k} can be parallelized in a straightforward manner."
IMPLEMENTATION/METHODS,0.1724137931034483,"4.3
Minimum Dominating Set"
IMPLEMENTATION/METHODS,0.17624521072796934,"For the minimum dominating set problem, we use the loss function:"
IMPLEMENTATION/METHODS,0.18007662835249041,"L(p) := L1(p) + βL2(p) := ∥p ∥1 + β
X"
IMPLEMENTATION/METHODS,0.1839080459770115,"vi∈V
exp  X"
IMPLEMENTATION/METHODS,0.18773946360153257,vj∈Nvi
IMPLEMENTATION/METHODS,0.19157088122605365,"log(1 −p[vj])  ,"
IMPLEMENTATION/METHODS,0.19540229885057472,"where Nv denotes the set of nodes within distance one of v (including v itself). The first loss term
promotes the sparsity of the dominating set. To understand the second term, observe as soon as
there is at least one vj ∈Nvi with p[vj] ≈1 we will have exp
P
vj∈Nvi log(1 −p[vj])

≈0.
Indeed, we note that, if p = 1S is the indicator function of a dominating set S, we have that
exp
P
vj∈Nvi log(1 −p[vj])

= exp(−∞) = 0, for all vi. Therefore, L(1S) = ∥1S∥1 would be
exactly the cardinality of S."
IMPLEMENTATION/METHODS,0.19923371647509577,"After learning p, we construct our proposed minimum dominating set in a manner analogous to
the max-clique case. We again begin by reordering the vertices so that p(v′
i) ≥p(v′
i+1). We then
initialize our first dominating set S(1) = {v′
1} and iterate over i. At each step, we check if S is a
dominating set. If so, we stop. Otherwise, we add v′
i+1 to S(1) and repeat the process. Similarly
to the maximum clique, we repeat this process several times, where we initialize S(k) = {v′
k}
(automatically excluding v′
1, . . . , vk−1′ from the set S(k) considered on the k-th iteration) and take
S∗to be the smallest dominating set S(k) found in any iteration."
IMPLEMENTATION/METHODS,0.20306513409961685,"5
The GCON Architecture"
IMPLEMENTATION/METHODS,0.20689655172413793,"In this section, we introduce the Graph Combinatorial Optimization Network (GCON). A notable
feature of our architecture is that it utilizes several different types of filtering operations in each layer.
It includes localized aggregation operations similar to those used in common message-passing neural
networks (which may be interpreted as low-pass filters from a GSP perspective). We also include
comparison operations that extract multi-scale geometric information and consider changes across"
IMPLEMENTATION/METHODS,0.210727969348659,Towards a General Recipe for Combinatorial Optimization with Multi-Filter GNNs GCON
IMPLEMENTATION/METHODS,0.21455938697318008,Filtering
IMPLEMENTATION/METHODS,0.21839080459770116,Norm + Dropout
IMPLEMENTATION/METHODS,0.2222222222222222,Activation
IMPLEMENTATION/METHODS,0.2260536398467433,Rule-based
IMPLEMENTATION/METHODS,0.22988505747126436,Decoder
IMPLEMENTATION/METHODS,0.23371647509578544,FC Layer(s)
IMPLEMENTATION/METHODS,0.23754789272030652,MinMax / Softmax
IMPLEMENTATION/METHODS,0.2413793103448276,Graph statistics
IMPLEMENTATION/METHODS,0.24521072796934865,FC Layer(s)
IMPLEMENTATION/METHODS,0.24904214559386972,"Figure 1: Illustration of our general framework. Graphs are first equipped with node features derived
from graph statistics and then passed through a GNN composed of GCON hybrid layer blocks (detail
in Fig. 2(a)) with a min-max or softmax output layer. A rule-based decoder then processes the
node-level outputs to determine the set of interest."
IMPLEMENTATION/METHODS,0.25287356321839083,"(a)
(b)"
IMPLEMENTATION/METHODS,0.2567049808429119,"Figure 2: Illustration of the layer-wise update for (a) the new decoupled GCON filter bank and (b)
the ScatteringClique filter bank from Min et al. [25]."
IMPLEMENTATION/METHODS,0.26053639846743293,"the different scales. These comparison operations will take the form of wavelets, based on those
utilized in the geometric scattering transform [14, 13, 43], and can be interpreted as band-pass filters
again from a GSP perspective. The different filters of each type will be combined using a localized
attention mechanism that allows the network to focus on different filters at each node, which makes
our architecture fundamentally different from many traditional GNN methods that apply the same
aggregation at each node of the graph."
IMPLEMENTATION/METHODS,0.26436781609195403,"5.1
The GCON filter bank: Aggregation and Comparison operations"
IMPLEMENTATION/METHODS,0.2681992337164751,"The most basic component of our filter bank is a traditional one-step aggregation somewhat similar to
popular message passing neural networks (e.g., Kipf and Welling [22], Hamilton et al. [16]). It has the
form F1(X) := m (P X), where P = 1"
IMPLEMENTATION/METHODS,0.2720306513409962,"2(I + A D−1) is the lazy random walk matrix.2 The function
m := mσ,θ can be either a linear layer or multi-layer perceptron (MLP) with activation function σ
and learned weights θ. At each node, this process averages information from all direct neighbors of
the node, followed by a transformation step that learns new cross-feature combinations. Networks
utilizing this setup are commonly referred to as aggregate-transform GNNs [39] due to the alternation
of aggregations X →AGG(X) and transformations of node features AGG(X) →m(AGG(X)).
Additionally, we also consider higher-order aggregations of the form"
IMPLEMENTATION/METHODS,0.27586206896551724,"Fk(X) := m

Pk X

,
k ≥1.
(1)"
IMPLEMENTATION/METHODS,0.2796934865900383,We will refer to the filters Fk as aggregation operations.
IMPLEMENTATION/METHODS,0.2835249042145594,"Next, we add filters inspired by diffusion wavelets [9] that calculate the difference of two different
aggregations Fk1, Fk2, where k1 ̸= k2, by setting"
IMPLEMENTATION/METHODS,0.28735632183908044,"Fk1,k2(X) := m

(Pk1 −Pk2) X

.
(2)"
IMPLEMENTATION/METHODS,0.29118773946360155,"2One could readily replace P with generic graph shift operators S ∈Rn×n, i.e., a matrix where S[i, j] = 0
unless {vi, vj} ∈E or i = j. Likewise with the more complex filters Fk(X) and Fk1,k2(X) defined below."
IMPLEMENTATION/METHODS,0.2950191570881226,Towards a General Recipe for Combinatorial Optimization with Multi-Filter GNNs
IMPLEMENTATION/METHODS,0.2988505747126437,"Filters of this form are fundamentally different from Fk(X) discussed above. From the GSP
perspective, Fk1,k2(X) constitute band-pass filters, whereas Fk(X) constitute low-pass filters. Since
the operation X →(Pk1 −Pk2) X compares aggregations at two different scales, we will refer to
them as comparison operations. We denote the set of all our filtering operations as F = FA ⊔FC,
where FA consists of aggregation operations and FC consists of comparison operations. As our filter
bank consists of two different types of filters, we will also refer to it as a hybrid filter bank."
IMPLEMENTATION/METHODS,0.30268199233716475,"The use of the Fk1,k2 is inspired by the geometric scattering transform [43, 14, 27], a handcrafted
multi-layer network, which iteratively filters the input node features via dyadic diffusion wavelets
of the form X →(P2j−1 −P2j) X and takes vertex-wise absolute values in between wavelet
filterings. Notably, the original versions of the geometric scattering transform were handcrafted
feature extractors. However, subsequently, Wenkel et al. [36], Tong et al. [31] used the geometric
scattering transform as a basis for a fully learned graph neural network. In particular, Tong et al.
[31] aimed to learn the optimal diffusion scales (i.e., the powers ki to which P is raised) and Wenkel
et al. [36] introduced a hybrid-scattering network that utilized both aggregation operations (low-pass
filters) and comparison operations (band-pass, wavelet filters)."
IMPLEMENTATION/METHODS,0.3065134099616858,"5.2
Attention over filters"
IMPLEMENTATION/METHODS,0.3103448275862069,"We let Xℓ−1 denote the input to the ℓ-th layer and use an attention mechanism to determine the
importance of information from different filters for each node. For each filter response Hf :=
F(Xℓ−1) ∈Rn×d, we concatenate it with a matrix of transformed input features H := m(Xℓ−1),
and apply an attention mechanism to their horizontal concatenation [H ∥Hf]. This takes the form"
IMPLEMENTATION/METHODS,0.31417624521072796,"sA
f := σ ([H ∥Hf] aA) , f ∈FA,
and
sC
f := σ ([H ∥Hf] aC) , f ∈FC"
IMPLEMENTATION/METHODS,0.31800766283524906,"where aA, aC ∈R2d are learned attention vectors for aggregation and comparison filters, respectively.
We then use softmax to normalize the importance scores across filters within FA and FC at each
vertex, resulting in a normalized score ¯sA
f ∈Rn and ¯sC
f ∈Rn given by"
IMPLEMENTATION/METHODS,0.3218390804597701,"¯sA
f (v) = softmax ({sf[v] : f ∈FA}) ,
¯sC
f(v) = softmax ({sf[v] : f ∈FC}) .
(3)"
IMPLEMENTATION/METHODS,0.32567049808429116,"Importantly, sA
f and sC
f (and thus each ¯sA
f and ¯sC
f) will take different values for each node. Therefore,
they act as localized attention mechanisms, which can up-weight different filters at different vertices."
IMPLEMENTATION/METHODS,0.32950191570881227,"Next, the filter responses are reweighted according to the attention scores, yielding aggregation and
comparison representations HFA, HFC ∈Rn×d:"
IMPLEMENTATION/METHODS,0.3333333333333333,"HFA = P
f∈FA"
IMPLEMENTATION/METHODS,0.3371647509578544,"
¯sA
f ◦1d

⊙Hf,
and
HFC = P
f∈FC"
IMPLEMENTATION/METHODS,0.34099616858237547,"
¯sC
f ◦1d

⊙Hf,"
IMPLEMENTATION/METHODS,0.3448275862068966,"where, ◦and ⊙denote the outer and Hadamard product, respectively. Finally, Xℓis then given by"
IMPLEMENTATION/METHODS,0.3486590038314176,"Xℓ= MLP

Xℓ−1 + HFA + HFC

.
(4)"
IMPLEMENTATION/METHODS,0.3524904214559387,"Our layer-wise update rule is inspired by the one utilized in Min et al. [25], which also used a
localized attention mechanism to balance the contributions of aggregation and comparison operations
(i.e., low-pass and band-pass filters). However, our network improves upon Min et al. [25] in several
ways. Most importantly, it computes separate normalized attention scores ¯sA
f (v) and ¯sC
f(v) for the
aggregation and the comparison operators, whereas Min et al. [25] uses a single softmax for the entire
filter bank F. Additionally, Min et al. [25] omits the learnable function m in Equations 1 and 2, and
uses a different layer-wise update in place of Equation 4. For further details, see Appendix A.1."
IMPLEMENTATION/METHODS,0.3563218390804598,"5.3
Theoretical Analysis"
