Section,Section Appearance Order,Paragraph
ABSTRACT,0.0,Abstract
ABSTRACT,0.004524886877828055,"We consider the stochastic gradient descent (SGD) algorithm driven by a general
stochastic sequence, including i.i.d noise and random walk on an arbitrary graph,
among others; and analyze it in the asymptotic sense. Specifically, we employ the
notion of ‘efficiency ordering’, a well-analyzed tool for comparing the performance
of Markov Chain Monte Carlo (MCMC) samplers, for SGD algorithms in the
form of Loewner ordering of covariance matrices associated with the scaled iterate
errors in the long term. Using this ordering, we show that input sequences that are
more efficient for MCMC sampling also lead to smaller covariance of the errors
for SGD algorithms in the limit. This also suggests that an arbitrarily weighted
MSE of SGD iterates in the limit becomes smaller when driven by more efficient
chains. Our finding is of particular interest in applications such as decentralized
optimization and swarm learning, where SGD is implemented in a random walk
fashion on the underlying communication graph for cost issues and/or data privacy.
We demonstrate how certain non-Markovian processes, for which typical mixing-
time based non-asymptotic bounds are intractable, can outperform their Markovian
counterparts in the sense of efficiency ordering for SGD. We show the utility
of our method by applying it to gradient descent with shuffling and mini-batch
gradient descent, reaffirming key results from existing literature under a unified
framework. Empirically, we also observe efficiency ordering for variants of SGD
such as accelerated SGD and Adam, open up the possibility of extending our notion
of efficiency ordering to a broader family of stochastic optimization algorithms."
INTRODUCTION,0.00904977375565611,"1
Introduction"
INTRODUCTION,0.013574660633484163,"Stochastic gradient descent (SGD) is widely used in machine learning, signal processing and other
engineering fields to solve the optimization problem"
INTRODUCTION,0.01809954751131222,"θ∗= arg min
θ∈Θ ("
INTRODUCTION,0.02262443438914027,"f(θ) ≜1 n n
X"
INTRODUCTION,0.027149321266968326,"i=1
F(θ, i) ) ,
(1)"
INTRODUCTION,0.03167420814479638,"where Θ ⊂Rd is some closed and convex set, and F(·, i) : Rd →R for i ∈[n] ≜{1, · · · , n} are
smooth functions on Θ, not necessarily convex, such that their summation f : Rd →R exhibits a
minimizer θ∗∈Θ satisfying ∇f(θ∗)=0. The update rule of the iterative SGD scheme is of the form"
INTRODUCTION,0.03619909502262444,"θt+1 = ProjΘ (θt −γt+1∇θF (θt, Xt+1)) ,
(2)"
INTRODUCTION,0.04072398190045249,"where γt is the step size that can be constant or diminishing as t→∞, ProjΘ is a projection operator
onto the constraint set Θ, and {Xt}t≥0 is some sequence taking values in [n]. This sequence is
often generated in a stochastic manner, and samples can be drawn from temporally independent
and identically distributed (i.i.d) random variables that are either uniformly distributed over [n]
[60, 54, 14], or leverage importance sampling techniques for variance reduction [52, 12, 27]. {Xt}t≥0"
INTRODUCTION,0.04524886877828054,∗Equal contributors.
INTRODUCTION,0.049773755656108594,"can also be constructed by repeatedly shuffling over all possible states without repetition,2 leading to
faster convergence than stochastic counterparts drawing i.i.d samples from [n] [64, 3, 32, 72]."
INTRODUCTION,0.05429864253393665,"Random Walk Stochastic Gradient Descent (RWSGD): Some applications observe restricted
access to the state space, such as decentralized optimization [65, 71, 46], where communication
occurs between nodes in a network to collaboratively solve the optimization problem (1). For instance,
disease classification in confidential clinical swarm learning [69] considers peer-to-peer networks
due to the highly private nature of medical data. In such a setting, the random sequence {Xt}t≥0
is usually realized as a Markov chain on a general graph G(V, E) that only samples local gradients
of the nodes in V ≜[n] and traverses the network via edges connecting them without divulging
the update history or its own gradient. The randomness of the communication path ensures that the
compromised node can not easily leak the data of its neighbors [46]."
INTRODUCTION,0.058823529411764705,"Apart from the privacy concern, such dynamics are also employed in swarm learning/optimization
in robotics [17] and wireless sensor networks [43] due to their low communication cost and asyn-
chronous nature. The need for data privacy and demand for communication-efficient algorithms for
decentralized optimization has spurred the study of RWSGD algorithms in recent years [57, 34, 67],
with the underlying Markov chain in the form of Metropolis-Hasting random walk (MHRW) [48]."
INTRODUCTION,0.06334841628959276,"Common analytical approach - Finite time bounds based on mixing time: Most of the existing
works analyzing iteration (2) provide so-called finite-time upper bounds on expected error in either
the objective function E[f(˜θt) −f(θ∗)], where ˜θt is some weighted average of the iterates, or its
gradient E[||∇f(θt)||2
2]; and are used to infer the convergence rate of the iterate sequence [57, 25, 67].
For diminishing step sizes γt = t−α with α ∈(0.5, 1),3 the upper bound on E[∥∇f(θt)∥2
2] reads as"
INTRODUCTION,0.06787330316742081,"E[∥∇f(θt)∥2
2] ≤O
max {M, 1/ log(1/β)} t1−α"
INTRODUCTION,0.07239819004524888,"
,
(3)"
INTRODUCTION,0.07692307692307693,"and a similar form for E[f(˜θt) −f(θ∗)] as well [67, 24, 7]. Here, β ∈(0, 1) is the second largest
eigenvalue modulus (SLEM) of the underlying Markov chain’s transition matrix and is related to
its mixing time property, since smaller SLEM leads to faster mixing of the Markov chain [18, 44].
On the other hand, M > 0 is usually a quantity proportional to the local gradients evaluated at the
minimizer, or their upper bound. Both the gradient information and the mixing time play a key role
in quantifying the convergence rate derived from this upper bound, and the mixing time is especially
important since it hints that convergence rate of the SGD algorithm can potentially be accelerated
using faster mixing Markov chains for the input driving sequence. It has also been noted that the
inherent correlation of the underlying random walk has to be addressed in any analysis concerning
Markov-chain-driven gradient descent [67]. The mixing time technique, by capturing the rate at
which the chain converges to its stationary distribution [18, 44], is one way of doing so."
INTRODUCTION,0.08144796380090498,"Alternative approach - Asymptotic analysis and efficiency ordering: In addition to the afore-
mentioned mixing time, another widely used metric for characterizing the second order properties
of Markov chains is the asymptotic variance (AV). For any scalar valued function g : [n] →R,
the estimator ˆµt(g) ≜1"
INTRODUCTION,0.08597285067873303,"t
Pt
i=1 g(Xi), associated with an irreducible Markov chain {Xt}t≥0 with
stationary distribution π, is the average of the samples of g(·) obtained along the chain’s sample path
up to time t > 0. The AV of the Markov chain, denoted by σ2
X(g), is then defined as the the limiting
variance of the estimator; that is,
σ2
X(g) ≜lim
t→∞t · Var(ˆµt(g)).
(4)"
INTRODUCTION,0.09049773755656108,"For all functions g(·) satisfying Eπ(g2) < ∞, the AV is associated with the Central Limit Theorem
(CLT) for any Markovian kernel on a finite state space, as the variance of the normally distributed
estimates in the limit [61, 35, 18]. More formally, we have
√"
INTRODUCTION,0.09502262443438914,"t · [ˆµt(g) −Eπ(g)]
dist
−−−→
t→∞N(0, σ2
X(g)).
(5)"
INTRODUCTION,0.09954751131221719,"A smaller AV means that fewer samples are required post mixing of the chain4 in order to obtain a
desired accuracy - in some sense quantifying the chain’s efficiency."
INTRODUCTION,0.10407239819004525,"2One complete pass over the entire set [n] is typically called an epoch. Shuffling can refer to passing over [n]
in the same order for every epoch (single shuffling), or in a random order (random shuffling).
3We only need the step size to be O(t−α), but we omit the O(·) notation for simplicity. We also consider a
slightly more general case, allowing for α = 1 as well.
4Achieved by employing a burn-in period to get rid of the correlation with the initial state [29]."
INTRODUCTION,0.1085972850678733,"Both the AV and the mixing time of a Markov chain are very strongly related concepts5. In fact, the
AV has an upper bound in terms of the SLEM, which decreases as the SLEM gets smaller (chain
mixes faster) [50]. However, an ordering of the SLEM between two Markov chains does not imply
an ordering of their AV, as we shall demonstrate later in Section 4 for a special case. Both of these
second-order properties therefore lead to different notions of optimality; and the comparison of two
chains based on their AV leads to the concept of efficiency ordering [50], where we say that a chain is
more efficient than the other if it has a smaller AV, uniformly over all functions g : [n] →R."
INTRODUCTION,0.11312217194570136,"Figure 1:
Comparison of MHRW (P1),
Modified-MHRW (P2) and FMMC (P3) as
stochastic inputs for RWSGD on two differ-
ent graphs G1 and G2."
INTRODUCTION,0.11764705882352941,"As mentioned earlier, the common intuition asserted
by finite time bounds such as (3) is that Markov
chains with smaller SLEM lead to faster conver-
gence of the SGD iteration (2) to the minimizer
[67, 7]. We put this logic to test by simulating the
RWSGD algorithm with three different reversible
Markov chains (w.r.t. uniform stationary distribu-
tion) as the stochastic inputs - the MHRW, a modifi-
cation of MHRW, which is also shown in Appendix
I [1] to be more efficient than MHRW, and the so-
called ’fastest mixing Markov chain’ (FMMC) as
defined in [16] as the Markov chain obtained by
minimizing the SLEM over the entire class of re-
versible chains for a given graph topology.
We
employ RWSGD to minimize a quadratic objective
function for two underlying graphs. The exact de-
tails of the setup are deferred to Appendix I [1], and
our numerical results in Figure 1 show that even
though the FMMC is theoretically guaranteed to
have the smallest SLEM (βi for i∈{1, 2, 3}) of the
three reversible chains simulated, it is the worst per-
forming one with largest mean square error (MSE).
Although MHRW and Modified-MHRW share the
same SLEM in the lower plot of Figure 1, they still have performance differences. This is contradic-
tory to the intuition derived from (3), and could be attributed to the finite time results providing upper
bounds for all times t > 0, which may therefore not necessarily be tight. On the other hand, the
performance of the chains seem to be ordered according to their AV (σ2
i for i∈{1, 2, 3}) evaluated
for a test function. This lends credence to developing techniques based on AV, for judging the
performance of different stochastic inputs for SGD, as possible alternatives to using SLEM as the
sole performance metric."
INTRODUCTION,0.12217194570135746,"The asymptotic variance also appears in the CLT for stochastic approximation (SA) algorithms
[11, 21], though this time not directly as the variance in the limit, but as a component of the limiting
covariance matrix of the scaled iterate errors. Recent works [21, 51] point out that the covariance
matrix itself is of special interest, and typically contains more information than the non-asymptotic
MSE bounds [51]. In the sense of SGD algorithms, we will show in Section 3 that it embeds explicit
information of the exact vector-valued gradient evaluated at the optimizer as well as the entire
spectrum of the transition matrix; as opposed to the upper bound M of the gradients and only the
second largest eigenvalue modulus commonly found in mixing time based non-asymptotic bounds. It
has been suggested [20, 23], and also proved for the special case of linear SA [21], that the covariance
matrix emerging out of the CLT dominates as a leading term of the finite-time MSE bounds. This
also holds true for finite-time bounds on weighted MSE for any preferred weight; the weighted MSE
being utilized in fields such as wireless MIMO [68] and process optimization [30]. Overall, while
finite-time bounds have enjoyed great success in the literature, the potential for performance gains
out of the asymptotic analysis of SGD algorithms have remained largely unexplored."
INTRODUCTION,0.12669683257918551,"Contributions: We employ asymptotic analysis to propose a general framework that offers seamless
connection between AV in the MCMC literature with efficiency ordering and covariance matrix in the
SGD algorithms. Our framework can be used to design different random walk variants and also to
systematically compare the existing sampling methods in the SGD iteration (2) with diminishing step"
INTRODUCTION,0.13122171945701358,"5For reversible Markov chains, the AV can be written explicitly as an increasing function of every eigenvalue
of the transition matrix [18], while the mixing time is related to the SLEM as mentioned earlier."
INTRODUCTION,0.13574660633484162,"size, not just limited to random walks. In particular, we show that any two random walks following
an efficiency ordering have their covariance matrices Loewner ordered, including non-Markovian
stochastic processes versus its Markovian counterpart, which defies any mixing-time (SLEM) based
analysis. Such ordering can be harnessed into improving the accuracy of SGD iterates, which implies
a reduction in the weighted MSE with arbitrary weights. Moreover, via a specific augmentation
of the state space, we are able to analyze SGD for both single and random shuffling and show
the efficiency of shuffling over i.i.d sampling for a set of objective functions that may not satisfy
‘Polyak-Łojasiewicz inequality’. We further extend such comparison to mini-batch SGD algorithms.
Lastly, we present numerical results where the efficiency ordering via asymptotic analysis tends to
hold over all time periods and input sequences with higher efficiency have smaller errors in SGD."
IMPLEMENTATION/METHODS,0.14027149321266968,"2
Modeling setup"
IMPLEMENTATION/METHODS,0.14479638009049775,"Basic notations: We use lower case, bold-faced letters to denote vectors (v ∈Rd), and use upper
case, bold-faced letters to denote matrices (M ∈Rd×d). ∥· ∥2 denotes the l2 norm for vectors or
2-norm for matrices. We use ∇f(·) as Jacobian matrix of vector-valued function f(·), and ∇2g(·) as
Hessian matrix of scalar-valued function g(·). We let ∇θg(θ, X) be the gradient of the scalar-valued
function g(θ, X) with respect to θ and omit the subscript θ for simplicity. Loewner ordering of
matrices is denote by ‘≤L’ such that A ≤L B ⇐⇒xT (A −B)x ≤0 for any x ∈Rd. The term
Tr(A) denotes the trace of matrix A, and let 1{·} be the indicator function. We write N(0, V)
to represent a multivariate Gaussian distribution with zero mean and covariance matrix V. For a
connected and undirected graph G(V, E) with node set V and edge set E, we use N(i) for the set of
neighbors of node i ∈V and d ≜[d1, d2, · · · , dn]T for the degree vector where di = |N(i)|."
IMPLEMENTATION/METHODS,0.1493212669683258,"SGD algorithm with arbitrary input sequence: We consider random walks {Xt}t≥0 for which
the limit πi ≜limt→∞1"
IMPLEMENTATION/METHODS,0.15384615384615385,"t
Pt
k=1 1{Xk=i} exists almost surely and is positive for all i ∈[n], with
π = [πi]i∈[n] denoting the limiting or stationary distribution. This is trivially satisfied via strong law
of large numbers [26] when Xt for each t > 0 are i.i.d random variables with distribution π over [n],
and via the ergodic theorem [18] when {Xt}t≥0 is an irreducible, aperiodic and positive recurrent
(ergodic) Markov chain. Note however that this way of defining the stationary distribution π allows
for the input sequence {Xt}t≥0 to be more general, possibly being non-Markov on [n]. Then, we can
use π to rewrite the objective in (1) as"
IMPLEMENTATION/METHODS,0.1583710407239819,"f(θ) = 1 n n
X"
IMPLEMENTATION/METHODS,0.16289592760180996,"i=1
F(θ, i) = EX∼π [G(θ, X)] ,
(6)"
IMPLEMENTATION/METHODS,0.167420814479638,"where function G(θ, i) ≜
1
nπi F(θ, i) for any θ∈Θ, i∈[n]. The generalized update rule then becomes"
IMPLEMENTATION/METHODS,0.17194570135746606,"θt+1 = ProjΘ (θt −γt+1∇G (θt, Xt+1)) .
(7)
This change of notation allows us to consider input sequences having possibly non-uniform stationary
distributions, and is a version of importance sampling for RWSGD schemes, as in [7]. For example,
the iteration (7) with the input sequence generated from a MHRW with uniform target distribution
π = 1/n will reduce down to (2) with G(θ, i) = F(θ, i) for all θ ∈Θ, i ∈[n]. If the input sequence
is instead a simple random walk on a connected graph G(V, E) with V = [n], we have π ∝d, and
G(θ, i) = 1T d"
IMPLEMENTATION/METHODS,0.17647058823529413,"ndi F(θ, i) for all θ ∈Θ, i ∈V.6"
IMPLEMENTATION/METHODS,0.18099547511312217,"Asymptotic covariance matrix. We now quickly review the multivariate CLT for Markov chains,
since it is a natural way to introduce the asymptotic covariance matrix, used heavily throughout
the paper. For any finite, irreducible Markov chain {Xt}t≥0 with stationary distribution π, its
estimator is defined as ˆµt(g) ≜
1
t
Pt
k=1 g(Xk) for any vector-valued function g : [n] →Rd.
Then, the ergodic theorem [18, 19] states that for any initial distribution and any g(·) such that
Eπ(g) = P"
IMPLEMENTATION/METHODS,0.18552036199095023,"i∈[n] g(i)πi < ∞, we have ˆµt(g)
a.s.
−−−→
t→∞Eπ(g). Similarly to the asymptotic variance"
IMPLEMENTATION/METHODS,0.19004524886877827,"σ2
X(g) for a scalar-valued function g(·), we can also define the asymptotic covariance matrix ΣX(g)
for vector-valued function g(·),"
IMPLEMENTATION/METHODS,0.19457013574660634,"ΣX(g) ≜lim
t→∞t · Var(ˆµt(g)) = lim
t→∞
1"
IMPLEMENTATION/METHODS,0.19909502262443438,"t · E

∆t∆T
t
	
,
(8)"
IMPLEMENTATION/METHODS,0.20361990950226244,"6In practice, knowing πi up to a multiplicative constant is enough to converge to the optimal point."
IMPLEMENTATION/METHODS,0.2081447963800905,"where ∆t ≜Pt
s=1(g(Xs) −Eπ(g)). The associated multivariate CLT is then given as follows."
IMPLEMENTATION/METHODS,0.21266968325791855,"Theorem 2.1 (Chapter 1 [19]). For any function g : [n] →Rd that satisfies Eπ(g2) < ∞, we have
√"
IMPLEMENTATION/METHODS,0.2171945701357466,"t · [ˆµt(g) −Eπ(g)]
dist
−−−→
t→∞N(0, ΣX(g))."
IMPLEMENTATION/METHODS,0.22171945701357465,"In the next section, we will show how the the asymptotic covariance matrix ΣX(·) also appears as
part of the CLT result for SGD algorithms."
IMPLEMENTATION/METHODS,0.22624434389140272,"3
Efficiency Ordering of SGD Algorithms"
IMPLEMENTATION/METHODS,0.23076923076923078,"In this section, we present our main result concerning the performance comparison of different SGD
algorithms to solve (1). We first begin by stating our assumptions on the objective function and the
stochastic input sequence, providing a CLT result for SGD algorithms, and analyzing the covariance
matrix arising therein. We then introduce the notion of efficiency ordering of Markov chains in the
context of MCMC sampling, and form the connection with covariance matrices as our main result in
Theorem 3.6."
IMPLEMENTATION/METHODS,0.23529411764705882,"For the rest of this section we assume that the functions F(·, i) (possibly non-convex), the summands
of the objective function in (1), and the input process {Xt}t≥0 for the SGD iteration (7) satisfy:"
IMPLEMENTATION/METHODS,0.2398190045248869,"(A1) The step size is given by γt = t−α for α ∈(1/2, 1];
(A2) There exists a unique minimizer θ∗in the interior of the compact set Θ with ∇f(θ∗) = 0,
and matrix ∇2f(θ∗) (resp.∇2f(θ∗) −I/2) is positive definite for α∈(1/2, 1) (resp.α=1);
(A3) Gradients are bounded in the compact set Θ, that is, supθ∈Θ supi∈[n] ∥∇F(θ, i)∥2 < ∞;"
IMPLEMENTATION/METHODS,0.24434389140271492,"(A4) For every z ∈[n], θ ∈Rd, the solution ˜F(θ, z) ∈Rd of the Poisson equation ˜F(θ, z)−
E[ ˜F(θ, Xt+1) | Xt = z] = ∇F(θ, z)−∇f(θ) exists, and supθ∈Θ,z∈[n] ∥˜F(θ, z)∥2 < ∞;"
IMPLEMENTATION/METHODS,0.248868778280543,"(A5) The functions F(θ, i) are L-smooth for all i ∈[n], that is, ∀θ1, θ2 ∈Θ, ∀i ∈[n], we have
∥∇F(θ1, i) −∇F(θ2, i)∥2 ≤L∥θ1 −θ2∥2."
IMPLEMENTATION/METHODS,0.25339366515837103,"We then have the following CLT result for SGD algorithms.
Lemma 3.1. For iterates {θt}t≥0 of the SGD algorithm (7) satisfying (A1)–(A5), we have"
IMPLEMENTATION/METHODS,0.2579185520361991,"θt
a.s.
−−−→
t→∞θ∗,
and
(θt −θ∗) /√γt
Dist
−−−→
t→∞N(0, VX),
(9)"
IMPLEMENTATION/METHODS,0.26244343891402716,"where covariance matrix VX is the unique solution to the Lyapunov equation ΣX+KVX+VXKT =
0 when α ∈(0.5, 1) (resp. ΣX +

K+ I"
IMPLEMENTATION/METHODS,0.2669683257918552,"2

VX +VX

K+ I"
IMPLEMENTATION/METHODS,0.27149321266968324,"2
T = 0) when α = 1). Here, ΣX ≜
ΣX(∇G(θ∗, ·)) is the asymptotic covariance matrix7 as in (8), and K ≜∇2f(θ∗)."
IMPLEMENTATION/METHODS,0.27601809954751133,"Additionally, for the averaged iterates {¯θt}t≥0 where ¯θt ≜1"
IMPLEMENTATION/METHODS,0.28054298642533937,"t
Pt−1
i=0 θt, we have"
IMPLEMENTATION/METHODS,0.2850678733031674,"¯θt
a.s.
−−−→
t→∞θ∗,
and
√"
IMPLEMENTATION/METHODS,0.2895927601809955,"t(¯θt −θ∗)
Dist
−−−→
t→∞N(0, V′
X),
(10)"
IMPLEMENTATION/METHODS,0.29411764705882354,"where V′
X = K−1ΣX(K−1)T with the same matrices K and ΣX as in the non-averaged case.
Remark 3.2. Lemma 3.1 is itself a special case of the more general CLT result for SA algorithms
provided in Appendix A [1], and as proved in Appendix B [1].
Remark 3.3. While (A2) may appear to be too strict at first, it can be relaxed to the setting of
the objective function f(·) having multiple minimizers, by leveraging more general CLT results
from SA literature, such as Theorem 2.1 in [28]. However, this comes at a cost of cumbersome
notation, requiring conditioning of iterates converging to one of the minimizers, potentially making
the mathematical parts harder to follow. We also show in Appendix C [1] that (A2) is no stricter than
the Polyak-Łojasiewicz inequality – a popularly adopted weak assumption in recent SGD literature
studying non-convex objective functions [36, 47, 70, 72]."
IMPLEMENTATION/METHODS,0.2986425339366516,"7We slightly abuse the notation and shorten ΣX(∇G(θ∗, ·)), that is, the asymptotic covariance matrix
evaluated at ∇G(θ∗, ·)), to ΣX for better readability. In this paper, ΣX(∇G(θ∗, ·)) and ΣX are equivalent."
IMPLEMENTATION/METHODS,0.3031674208144796,"Remark 3.4. Assumptions (A3) and (A5) are widely seen in the RWSGD literature [57, 34, 67],
while (A4) is automatically satisfied for any ergodic Markov chain (see [49, 21] for details), a
common assumption for the stochastic noise sequence [34, 25, 7]. The compactness in (A3) can also
be relaxed, given assumptions on the objective function in [37], such that the estimator θt generated
by Markov-driven sequences can still be ‘locked in’ a compact set after a sufficiently long time."
IMPLEMENTATION/METHODS,0.3076923076923077,Lemma 3.1 implicitly indicates that the asymptotic convergence rate (in distribution) for θt −θ∗
IMPLEMENTATION/METHODS,0.31221719457013575,"(resp. ¯θt −θ∗) is O(√γt) (resp. O(1/
√"
IMPLEMENTATION/METHODS,0.3167420814479638,"t)). While this does not necessarily translate to O(√γt)
convergence rate for E[∥θt −θ∗∥2] (O(1/
√"
IMPLEMENTATION/METHODS,0.3212669683257919,"t) for E[∥¯θt −θ∗∥2]), it has been suggested [20, 23], and
is in fact true for cases such as quadratic objective functions since they satisfy the linear stochastic
approximation in [21], which is of the form"
IMPLEMENTATION/METHODS,0.3257918552036199,"θt+1 = θt −γt+1(Aθt −b(Xt+1)),
(11)"
IMPLEMENTATION/METHODS,0.33031674208144796,"for which the connection between finite-time MSE and covariance matrix VX has been established
[21]. This is also true for arbitrarily weighted MSE, which can be obtained as a weighted sum of
diagonal entries of the covariance matrices VX and V′
X."
IMPLEMENTATION/METHODS,0.334841628959276,"In addition to the apparent connection to MSE, the covariance matrix plays a wider role in SGD
performance. Given any vector of weights w ∈Rd, from Lemma 3.1 we also have that the weighted
sum of errors wT (θt −θ∗) converges to zero almost surely, and that wT (θt −θ∗)/√γt
Dist
−−−→
t→∞
N(0, wT VXw). This means that, for sufficiently large t, we can estimate P"
IMPLEMENTATION/METHODS,0.3393665158371041,"wT (θt −θ∗)
p"
IMPLEMENTATION/METHODS,0.3438914027149321,"γtwT VXw
> α ! ≈1 2π Z ∞"
IMPLEMENTATION/METHODS,0.34841628959276016,"α
e−x2/2dx,"
IMPLEMENTATION/METHODS,0.35294117647058826,"such that, for instance, the 95% confidence interval for wT θt is approximately wT θ∗±2
p"
IMPLEMENTATION/METHODS,0.3574660633484163,"γtwT VXw.
In other words, smaller wT VXw leads to narrower confidence interval and higher accuracy. The
form wT VXw for any vector w ∈Rd naturally implies that Loewner ordering should come into play
when concerning the performance of SGD algorithms."
