Section,Section Appearance Order,Paragraph
REFERENCES,0.27918781725888325,"[GL24] Rhys E Gilbert and Davide Lasagna. On the application of optimal control techniques
to the shadowing approach for time averaged sensitivity analysis of chaotic systems.
SIAM Journal on Applied Dynamical Systems, 23(1):505–552, 2024."
REFERENCES,0.2817258883248731,"[HKUT20] Philipp Holl, Vladlen Koltun, Kiwon Um, and Nils Thuerey. phiflow: A differen-
tiable pde solving framework for deep learning via physical simulations. In NeurIPS
workshop, volume 2, 2020."
REFERENCES,0.28426395939086296,"[HMBD23] Florian Hess, Zahra Monfared, Manuel Brenner, and Daniel Durstewitz. Generalized
teacher forcing for learning chaotic dynamics. arXiv preprint arXiv:2306.04406, 2023."
REFERENCES,0.2868020304568528,"[HR17] Eldad Haber and Lars Ruthotto. Stable architectures for deep neural networks. Inverse
problems, 34(1):014004, 2017."
REFERENCES,0.2893401015228426,"[HVT23] Benjamin Holzschuh, Simona Vegetti, and Nils Thuerey. Solving inverse physics
problems with score matching. Advances in Neural Information Processing Systems,
36, 2023."
REFERENCES,0.2918781725888325,"[HYG87] Stephen M Hammel, James A Yorke, and Celso Grebogi. Do numerical orbits of
chaotic dynamical processes represent true orbits? Journal of Complexity, 3(2):136–
145, 1987."
REFERENCES,0.29441624365482233,"[HZB+21] Changnian Han, Peng Zhang, Danny Bluestein, Guojing Cong, and Yuefan Deng.
Artificial intelligence for accelerating time integrations in multiscale modeling. Journal
of Computational Physics, 427:110053, 2021."
REFERENCES,0.2969543147208122,"[HZRS16] Kaiming He, Xiangyu Zhang, Shaoqing Ren, and Jian Sun. Deep residual learning for
image recognition. In Proceedings of the IEEE conference on computer vision and
pattern recognition, pages 770–778, 2016."
REFERENCES,0.29949238578680204,"[JD21] Elnaz Jamili and Vivek Dua. Parameter estimation of partial differential equations
using artificial neural network. Computers & Chemical Engineering, 147:107221,
2021."
REFERENCES,0.3020304568527919,"[JLOW24] Ruoxi Jiang, Peter Y Lu, Elena Orlova, and Rebecca Willett. Training neural operators
to preserve invariant measures of chaotic attractors. Advances in Neural Information
Processing Systems, 36, 2024."
REFERENCES,0.30456852791878175,"[Kid22] Patrick Kidger. On neural differential equations. arXiv preprint arXiv:2202.02435,
2022."
REFERENCES,0.30710659898477155,"[KJD+21] Suyong Kim, Weiqi Ji, Sili Deng, Yingbo Ma, and Christopher Rackauckas. Stiff neural
ordinary differential equations. Chaos: An Interdisciplinary Journal of Nonlinear
Science, 31(9), 2021."
REFERENCES,0.3096446700507614,"[KKH95] Anatole Katok, AB Katok, and Boris Hasselblatt. Introduction to the modern theory of
dynamical systems. Number 54. Cambridge university press, 1995."
REFERENCES,0.31218274111675126,"[KKL+21] George Em Karniadakis, Ioannis G Kevrekidis, Lu Lu, Paris Perdikaris, Sifan Wang,
and Liu Yang. Physics-informed machine learning. Nature Reviews Physics, 3(6):422–
440, 2021."
REFERENCES,0.3147208121827411,"[KKLL21] Sung Wook Kim, Iljeok Kim, Jonghwan Lee, and Seungchul Lee. Knowledge integra-
tion into deep learning in dynamical systems: an overview and taxonomy. Journal of
Mechanical Science and Technology, 35:1331–1342, 2021."
REFERENCES,0.31725888324873097,"[KMA+21] Karthik Kashinath, M Mustafa, Adrian Albert, JL Wu, C Jiang, Soheil Esmaeilzadeh,
Kamyar Azizzadenesheli, R Wang, Ashesh Chattopadhyay, A Singh, et al. Physics-
informed machine learning: case studies for weather and climate modelling. Philo-
sophical Transactions of the Royal Society A, 379(2194):20200093, 2021."
REFERENCES,0.3197969543147208,"[KMFL20] Patrick Kidger, James Morrill, James Foster, and Terry Lyons. Neural controlled differ-
ential equations for irregular time series. Advances in Neural Information Processing
Systems, 33:6696–6707, 2020."
REFERENCES,0.3223350253807107,"[LG22] Alec J. Linot and Michael D. Graham. Data-driven reduced-order modeling of spa-
tiotemporal chaos with neural ordinary differential equations. Chaos: An Interdisci-
plinary Journal of Nonlinear Science, 32(7):073110, 07 2022."
REFERENCES,0.3248730964467005,"[LH17] Ilya Loshchilov and Frank Hutter. Decoupled weight decay regularization. arXiv
preprint arXiv:1711.05101, 2017."
REFERENCES,0.32741116751269034,"[Lia17] Shi-jun Liao. On the clean numerical simulation (cns) of chaotic dynamic systems.
Journal of Hydrodynamics, Ser. B, 29(5):729–747, 2017."
REFERENCES,0.3299492385786802,"[LK22] Yi Heng Lim and Muhammad Firmansyah Kasim. Unifying physical systems’ induc-
tive biases in neural ode using dynamics constraints. arXiv preprint arXiv:2208.02632,
2022."
REFERENCES,0.33248730964467005,"[LKA+20] Zongyi Li, Nikola Kovachki, Kamyar Azizzadenesheli, Burigede Liu, Kaushik Bhat-
tacharya, Andrew Stuart, and Anima Anandkumar. Fourier neural operator for para-
metric partial differential equations. arXiv preprint arXiv:2010.08895, 2020."
REFERENCES,0.3350253807106599,"[LKB22] Yuying Liu, J. Nathan Kutz, and Steven L. Brunton. Hierarchical deep learning of
multiscale differential equation time-steppers. Philosophical Transactions of the Royal
Society A: Mathematical, Physical and Engineering Sciences, 380(2229):20210200,
2022."
REFERENCES,0.33756345177664976,"[LLSK+22] Zongyi Li, Miguel Liu-Schiaffini, Nikola Kovachki, Kamyar Azizzadenesheli,
Burigede Liu, Kaushik Bhattacharya, Andrew Stuart, and Anima Anandkumar. Learn-
ing chaotic dynamics in dissipative systems. Advances in Neural Information Process-
ing Systems, 35:16768–16781, 2022."
REFERENCES,0.3401015228426396,"[Lor63] Edward N Lorenz. Deterministic nonperiodic flow. Journal of atmospheric sciences,
20(2):130–141, 1963."
REFERENCES,0.3426395939086294,"[LP21] Kookjin Lee and Eric J Parish. Parameterized neural ordinary differential equations:
Applications to computational physics problems. Proceedings of the Royal Society A,
477(2253):20210162, 2021."
REFERENCES,0.34517766497461927,"[LSGW+23] Remi Lam, Alvaro Sanchez-Gonzalez, Matthew Willson, Peter Wirnsberger, Meire
Fortunato, Ferran Alet, Suman Ravuri, Timo Ewalds, Zach Eaton-Rosen, Weihua
Hu, Alexander Merose, Stephan Hoyer, George Holland, Oriol Vinyals, Jacklynn
Stott, Alexander Pritzel, Shakir Mohamed, and Peter Battaglia. Learning skillful
medium-range global weather forecasting. Science, 382(6677):1416–1421, 2023."
REFERENCES,0.3477157360406091,"[LWCD20] Xuechen Li, Ting-Kam Leonard Wong, Ricky TQ Chen, and David Duvenaud. Scalable
gradients for stochastic differential equations. In International Conference on Artificial
Intelligence and Statistics, pages 3870–3882. PMLR, 2020."
REFERENCES,0.350253807106599,"[MMD22] Jonas Mikhaeil, Zahra Monfared, and Daniel Durstewitz. On the difficulty of learning
chaotic dynamics with rnns. Advances in Neural Information Processing Systems,
35:11297–11312, 2022."
REFERENCES,0.35279187817258884,"[MSKF21] James Morrill, Cristopher Salvi, Patrick Kidger, and James Foster. Neural rough
differential equations for long time series. In International Conference on Machine
Learning, pages 7829–7838. PMLR, 2021."
REFERENCES,0.3553299492385787,"[Ni21] Angxiu Ni. Approximating linear response by nonintrusive shadowing algorithms.
SIAM Journal on Numerical Analysis, 59(6):2843–2865, 2021."
REFERENCES,0.35786802030456855,"[PABT+21] Grace CY Peng, Mark Alber, Adrian Buganza Tepole, William R Cannon, Suvranu
De, Savador Dura-Bernal, Krishna Garikipati, George Karniadakis, William W Lytton,
Paris Perdikaris, et al. Multiscale modeling meets machine learning: What can we
learn? Archives of Computational Methods in Engineering, 28:1017–1037, 2021."
REFERENCES,0.3604060913705584,"[PER23a] Avik Pal, Alan Edelman, and Chris Rackauckas. Continuous deep equilibrium mod-
els: Training neural odes faster by integrating them to infinity. In 2023 IEEE High
Performance Extreme Computing Conference (HPEC), pages 1–9. IEEE, 2023."
REFERENCES,0.3629441624365482,"[PER23b] Avik Pal, Alan Edelman, and Christopher Vincent Rackauckas. Locally regularized
neural differential equations: some black boxes were meant to remain closed! In
International Conference on Machine Learning, pages 26809–26819. PMLR, 2023."
REFERENCES,0.36548223350253806,"[Pid22] Jakiw Pidstrigach. Score-based generative models detect manifolds. In S. Koyejo,
S. Mohamed, A. Agarwal, D. Belgrave, K. Cho, and A. Oh, editors, Advances in Neural
Information Processing Systems, volume 35, pages 35852–35865. Curran Associates,
Inc., 2022."
REFERENCES,0.3680203045685279,"[Pil06] Sergei Yu Pilyugin. Shadowing near an invariant set. Shadowing in dynamical systems,
pages 1–101, 2006."
REFERENCES,0.37055837563451777,"[PLH+17] Jaideep Pathak, Zhixin Lu, Brian R. Hunt, Michelle Girvan, and Edward Ott. Using
machine learning to replicate chaotic attractors and calculate lyapunov exponents from
data. Chaos, 27(12), 2017. Cited by: 364; All Open Access, Hybrid Gold Open
Access."
REFERENCES,0.3730964467005076,"[PMSR21] Avik Pal, Yingbo Ma, Viral Shah, and Christopher V Rackauckas. Opening the
blackbox: Accelerating neural differential equations by regularizing internal solver
heuristics. In International Conference on Machine Learning, pages 8325–8335.
PMLR, 2021."
REFERENCES,0.3756345177664975,"[PNR+21] George Papamakarios, Eric Nalisnick, Danilo Jimenez Rezende, Shakir Mohamed, and
Balaji Lakshminarayanan. Normalizing flows for probabilistic modeling and inference.
Journal of Machine Learning Research, 22(57):1–64, 2021."
REFERENCES,0.37817258883248733,"[PSH+22] Jaideep Pathak, Shashank Subramanian, Peter Harrington, Sanjeev Raja, Ashesh
Chattopadhyay, Morteza Mardani, Thorsten Kurth, David Hall, Zongyi Li, Kamyar
Azizzadenesheli, et al. Fourcastnet: A global data-driven high-resolution weather
model using adaptive fourier neural operators. arXiv preprint arXiv:2202.11214, 2022."
REFERENCES,0.38071065989847713,"[PWF+18] Jaideep Pathak, Alexander Wikner, Rebeckah Fussell, Sarthak Chandra, Brian R. Hunt,
Michelle Girvan, and Edward Ott. Hybrid forecasting of chaotic processes: Using
machine learning in conjunction with a knowledge-based model. Chaos, 28(4), 2018.
Cited by: 206; All Open Access, Green Open Access."
REFERENCES,0.383248730964467,"[RBL22] Johann Rudi, Julie Bessac, and Amanda Lenzi. Parameter estimation with dense and
convolutional neural networks applied to the fitzhugh–nagumo ode. In Mathematical
and Scientific Machine Learning, pages 781–808. PMLR, 2022."
REFERENCES,0.38578680203045684,"[RCD19] Yulia Rubanova, Ricky TQ Chen, and David K Duvenaud. Latent ordinary differen-
tial equations for irregularly-sampled time series. Advances in neural information
processing systems, 32, 2019."
REFERENCES,0.3883248730964467,"[RCVS+19] Markus Reichstein, Gustau Camps-Valls, Bjorn Stevens, Martin Jung, Joachim Denzler,
Nuno Carvalhais, and fnm Prabhat. Deep learning and process understanding for data-
driven earth system science. Nature, 566(7743):195–204, 2019."
REFERENCES,0.39086294416243655,"[RM15] Danilo Rezende and Shakir Mohamed. Variational inference with normalizing flows.
In International conference on machine learning, pages 1530–1538. PMLR, 2015."
REFERENCES,0.3934010152284264,"[RM21] Alberto Racca and Luca Magri. Robust optimization and validation of echo state
networks for learning chaotic dynamics. Neural Networks, 142:252–268, 2021."
REFERENCES,0.39593908629441626,"[RMM+20] Christopher Rackauckas, Yingbo Ma, Julius Martensen, Collin Warner, Kirill Zubov,
Rohit Supekar, Dominic Skinner, Ali Ramadhan, and Alan Edelman. Universal
differential equations for scientific machine learning. arXiv preprint arXiv:2001.04385,
2020."
REFERENCES,0.39847715736040606,"[Rös76] Otto E Rössler. An equation for continuous chaos. Physics Letters A, 57(5):397–398,
1976."
REFERENCES,0.4010152284263959,"[RPK19] Maziar Raissi, Paris Perdikaris, and George E Karniadakis. Physics-informed neural
networks: A deep learning framework for solving forward and inverse problems
involving nonlinear partial differential equations. Journal of Computational physics,
378:686–707, 2019."
REFERENCES,0.4035532994923858,"[Rue09] David Ruelle. A review of linear response theory for general differentiable dynamical
systems. Nonlinearity, 22(4):855, 2009."
REFERENCES,0.40609137055837563,"[Sau05] Tim Sauer. Computer arithmetic and sensitivity of natural measure. Journal of
Difference Equations and Applications, 11(7):669–676, 2005."
REFERENCES,0.4086294416243655,"[SE19] Yang Song and Stefano Ermon. Generative modeling by estimating gradients of the
data distribution. Advances in neural information processing systems, 32, 2019."
REFERENCES,0.41116751269035534,"[SLST17] Tapio Schneider, Shiwei Lan, Andrew Stuart, and João Teixeira. Earth system modeling
2.0: A blueprint for models that learn from observations and targeted high-resolution
simulations. Geophysical Research Letters, 44(24):12–396, 2017."
REFERENCES,0.4137055837563452,"[SSDK+20] Yang Song, Jascha Sohl-Dickstein, Diederik P Kingma, Abhishek Kumar, Stefano
Ermon, and Ben Poole. Score-based generative modeling through stochastic differential
equations. arXiv preprint arXiv:2011.13456, 2020."
REFERENCES,0.41624365482233505,"[SWP+24] Yair Schiff, Zhong Yi Wan, Jeffrey B Parker, Stephan Hoyer, Volodymyr Kuleshov,
Fei Sha, and Leonardo Zepeda-Núñez. Dyslim: Dynamics stable learning by invariant
measure for chaotic systems. arXiv preprint arXiv:2402.04467, 2024."
REFERENCES,0.41878172588832485,"[VAUK22] Pantelis R Vlachas, Georgios Arampatzis, Caroline Uhler, and Petros Koumoutsakos.
Multiscale simulations of complex systems by learning their effective dynamics. Nature
Machine Intelligence, 4(4):359–366, 2022."
REFERENCES,0.4213197969543147,"[vdGSB+20] Erik van der Giessen, Peter A Schultz, Nicolas Bertin, Vasily V Bulatov, Wei Cai,
Gábor Csányi, Stephen M Foiles, M G D Geers, Carlos González, Markus Hütter,
Woo Kyun Kim, Dennis M Kochmann, Javier LLorca, Ann E Mattsson, Jörg Rottler,
Alexander Shluger, Ryan B Sills, Ingo Steinbach, Alejandro Strachan, and Ellad B
Tadmor. Roadmap on multiscale materials modeling. Modelling and Simulation in
Materials Science and Engineering, 28(4):043001, mar 2020."
REFERENCES,0.42385786802030456,"[Wan13] Qiqi Wang. Forward and adjoint sensitivity computation of chaotic dynamical systems.
Journal of Computational Physics, 235:1–13, 2013."
REFERENCES,0.4263959390862944,"[Wei17] Ee Weinan. A proposal on machine learning via dynamical systems. Communications
in Mathematics and Statistics, 1(5):1–11, 2017."
REFERENCES,0.4289340101522843,"[WG18] Caroline L Wormell and Georg A Gottwald. On the validity of linear response theory
in high-dimensional deterministic dynamical systems. Journal of Statistical Physics,
172:1479–1498, 2018."
REFERENCES,0.43147208121827413,"[WY21] Rui Wang and Rose Yu. Physics-guided deep learning for dynamical systems: A
survey. arXiv preprint arXiv:2107.01272, 2021."
REFERENCES,0.434010152284264,"[YHP+23] Sungduk Yu, Walter Hannah, Liran Peng, Jerry Lin, Mohamed Aziz Bhouri, Ritwik
Gupta, Björn Lütjens, Justus C. Will, Gunnar Behrens, Julius Busecke, Nora Loose,
Charles Stern, Tom Beucler, Bryce Harrop, Benjamin Hillman, Andrea Jenney, Sa-
vannah L. Ferretti, Nana Liu, Animashree Anandkumar, Noah Brenowitz, Veronika
Eyring, Nicholas Geneva, Pierre Gentine, Stephan Mandt, Jaideep Pathak, Akshay
Subramaniam, Carl Vondrick, Rose Yu, Laure Zanna, Tian Zheng, Ryan Abernathey,
Fiaz Ahmed, David Bader, Pierre Baldi, Elizabeth Barnes, Christopher Bretherton,
Peter Caldwell, Wayne Chuang, Yilun Han, YU HUANG, Fernando Iglesias-Suarez,
Sanket Jantre, Karthik Kashinath, Marat Khairoutdinov, Thorsten Kurth, Nicholas
Lutsko, Po-Lun Ma, Griffin Mooers, J. David Neelin, David Randall, Sara Shamekh,
Mark Taylor, Nathan Urban, Janni Yuval, Guang Zhang, and Mike Pritchard. Climsim:
A large multi-scale dataset for hybrid physics-ml climate emulation. In A. Oh, T. Nau-
mann, A. Globerson, K. Saenko, M. Hardt, and S. Levine, editors, Advances in Neural
Information Processing Systems, volume 36, pages 22070–22084. Curran Associates,
Inc., 2023."
REFERENCES,0.4365482233502538,"[You02] Lai-Sang Young. What are srb measures, and which dynamical systems have them?
Journal of statistical physics, 108:733–754, 2002."
REFERENCES,0.43908629441624364,"[You17] Lai-Sang Young. Generalizations of srb measures to nonautonomous, random, and
infinite dimensional systems. Journal of Statistical Physics, 166:494–515, 2017."
REFERENCES,0.4416243654822335,"[ZGUA20] Han Zhang, Xi Gao, Jacob Unterman, and Tom Arodz. Approximation capabilities of
neural odes and invertible residual networks. In International Conference on Machine
Learning, pages 11086–11095. PMLR, 2020."
REFERENCES,0.44416243654822335,"[Zha17] Lingmei Zhang. A novel 4-d butterfly hyperchaotic system. Optik, 131:215–220, 2017."
REFERENCES,0.4467005076142132,"A
Proofs and assumptions"
REFERENCES,0.44923857868020306,"Our results in section 3 make the assumption that the map F is uniformly hyperbolic. Roughly
speaking, this means the uniform (on the attractor Λ ⊆M) expansion and contraction of infinitesimal
perturbations under the differential dF. More precisely, in a uniformly hyperbolic system, there exists
a decomposition of the tangent bundle, TM = Eu ⊕Es, into an unstable (Eu) and stable (Es)
subbundle such that these subbundles are dF-invariant, and moreover, for any vector field v ∈Es,
∥dF tv∥≤C λt ∥v∥, t ∈Z+. Similarly, an infinitesimal perturbation along vector field v ∈Eu"
REFERENCES,0.4517766497461929,"shows a uniform exponential decay in norm backward in time, ∥dF tv∥≤C λ|t| ∥v∥, t ∈Z−.
Here the constants C, λ are uniform over Λ. There are several relaxations of the uniformity in the
splitting to obtain nonuniform and partial hyperbolicity; there are also several known examples of
non-hyperbolic chaotic systems. Assumptions of hyperbolicity are common in dynamical systems
analyses due to well-understood ergodic theoretic results, including existence of physical measures
of the SRB-type [You02, You17]. Such assumptions are also widespread in computational dynamics,
wherein algorithms derived rigorously for uniformly hyperbolic systems are found to be applicable
[WG18] to turbulent fluids and chaotic systems in practice [GC95, EHL04, CW22], where a rigorous
verification [BJS24] of these assumptions is not feasible."
REFERENCES,0.4543147208121827,"We remark that we only require high-probability finite-time shadowing, and thus, our results can
possibly be extended under relaxations of uniform hyperbolicity. Despite being mathematically
convenient, the class of uniformly hyperbolic systems do contain examples of the pathological
behaviors we address: atypicality of shadowing and large linear responses. Moreover, our numerical
examples, including our primary one – the Lorenz ’63 system, which is only singular hyperbolic
– are chosen to not all be uniformly hyperbolic systems, in order for our inferences to have wider
applicability."
REFERENCES,0.45685279187817257,"A.1
Proof of Proposition 1"
REFERENCES,0.4593908629441624,"Here, we complete a proof sketch that we begin in section 3. An element v ∈Tn,nnM with
v = ⊕t≤nvt can be identified as t →vt ∈Txnn
t M. We define a function Fnn : Tn,nnM →Tn,nnM
as Fnn(v)t+1 = xnn
t+1 −F(xnn
t
+ vt). If v is a fixed point of Fnn, that is, Fnn(v) = v, then,
{xnn
t
+ vt}t≤n is an orbit of F. Writing Fnn(v) = Fnn(0) + dFnn(0)v + Nnn(v), where N is the
nonlinear part of Fnn, a fixed point v satisfies, (Id −dFnn(0))v = Fnn(0) + Nnn(v). To show that v
exists, we follow Theorem 18.1.3 of [KKH95] and prove that Tnn(w) = (Id−dFnn(0))−1(Nnn(w)+
Fnn(0)) is a contraction on a compact subset of Tn,nnM. We have ∥Tnn(v) −Tnn(w)∥≤∥(Id −
dFnn(0))−1∥∥Nnn(v) −Nnn(w)∥≤C(ϵ0, ϵ1)∥Nnn(v) −Nnn(w)∥with probability > 1 −δ. To
see this, note that dFnn(0)(v) = dF v, and F is a hyperbolic map, by assumption, and hence Lemma
18.1.4 of [KKH95] applies. Next, assuming that supx∈M ∥d2F(x)∥is bounded (i.e., dF is Lipschitz),
we obtain that dNnn is Lipschitz, and hence, ∥Tnn(v) −Tnn(w)∥≤∥(Id −dFnn(0))−1∥∥Nnn(v) −
Nnn(w)∥≤C(ϵ0, ϵ1)Kδ0∥v −w∥with probability > 1 −δ. Here, maxt{∥vt∥, ∥wt∥} ≤δ0,
which is chosen independent of n, ϵ0, ϵ1 and δ, and K is the Lipschitz constant of dNnn. Thus,
Tnn is a contraction on a δ0 ball around 0 ∈Tn,nnM when C(ϵ)Kδ0 < 1 −ϵ2, for some ϵ2 > 0.
Since ∥Tnn(0)∥≤C(ϵ0, ϵ1)ϵ0, and for any v in a δ0 ball around in 0 in Tn,nnM, ∥Tnn(v)∥≤
C(ϵ0, ϵ1)ϵ0 + (1 −ϵ2)δ0, when ϵ0, ϵ1 and δ0 are such that C(ϵ0, ϵ1)ϵ0 + (1 −ϵ2)δ0 < δ0, we have
that Tnn maps a δ0 ball around in 0 in Tn,nnM to itself. Thus, the unique fixed point (from contraction
mapping theorem on the δ0 ball) lies within the ball."
REFERENCES,0.4619289340101523,"B
Experimental Details"
REFERENCES,0.46446700507614214,"B.1
Data"
REFERENCES,0.467005076142132,"In this paper, the time series data from different chaotic systems are generated by simulating the ODEs
and iterated function systems below. The ODEs were numerically integrated using the fourth-order
Runge-Kutta solver from the torchdiffeq3 library [CRBD18], with an absolute and relative error
tolerance of 10−8."
REFERENCES,0.46954314720812185,3https://github.com/rtqichen/torchdiffeq
REFERENCES,0.4720812182741117,"We split the simulated trajectories into training and test datasets. The first 10,000 data points are used
as the training data and the last 8,000 points are the test data. The time step size of the simulation is
included in Table 2."
REFERENCES,0.4746192893401015,"1D: Tent maps As our first examples, we choose three types of tent maps defined in [CW21], that
are shown to be examples exhibiting atypical shadowing orbits: the tilted map (5), the pinched map
(6), and the plucked map (7). We use n = 3 and s = 0.2 and s = 0.8 in the plucked map following
[CW21]."
REFERENCES,0.47715736040609136,F(x; s) =
REFERENCES,0.4796954314720812,"(
2
1+sx,
x < 1 + s,
2
1−s(2 −x),
x ≥1 + s;
(5)"
REFERENCES,0.48223350253807107,"F(x; s) = 
 "
X,0.4847715736040609,"4x
1+s+√"
X,0.4873096446700508,"(1+s)2−4sx,
x < 1,"
X,0.48984771573604063,4(2−x) 1+s+√
X,0.49238578680203043,"(1+s)2−4s(2−x),
2 ≤x ≤1;
(6)"
X,0.4949238578680203,"Fs,n(x) = min(λs,n(x), λs,n(2 −x)),
0 < x < 2,
(7) where"
X,0.49746192893401014,fs(x) = min( 2x
X,0.5,"1 −s, 2 −2(1 −x)"
X,0.5025380710659898,"1 + s
),
x < 1,"
X,0.5050761421319797,os(x) =
X,0.5076142131979695,"(
fs(2x)"
X,0.5101522842639594,"2
,
x < 0.5,
2 −fs(2−2x)"
X,0.5126903553299492,"2
,
x ≥0.5,"
X,0.5152284263959391,"λs,n(x) = os(2nx −⌊2nx⌋)"
N,0.5177664974619289,"2n
+ 2⌊2nx⌋"
N,0.5203045685279187,"2n
."
N,0.5228426395939086,2D: Baker’s map We use the following perturbation of the classical Baker’s map from [CW22].
N,0.5253807106598984,"F([x, y]T ; s) = "
N,0.5279187817258884,"
2x −⌊y/π⌋2π
y + s sin x sin(2y) + ⌊x/π⌋2π 2 "
N,0.5304568527918782,mod 2π.
N,0.5329949238578681,"3D: Lorenz ’63 We conduct extensive numerical experiments in this paper with the Lorenz ’63
system [Lor63], with σ = 10, β = 8/3, and ρ = 28, which we describe in section 2."
N,0.5355329949238579,"3D: Rössler We use the parameter setting a = 0.2, b = 0.2, and c = 5.7 in the Rössler system
[Rös76] below, which is in the chaotic regime. dφt"
N,0.5380710659898477,"dt ([x, y, z]⊤) ="
N,0.5406091370558376,"""
−y−z
x+ay
b+z(x−c). #"
N,0.5431472081218274,"4D: Hyperchaos Another test case we consider is the hyperchaotic system below in 4 dimensions
from [Zha17], where the parameter values are set as a = 16, b = 40, c = 20, d = 8 for the system to
show chaotic behavior. dφt"
N,0.5456852791878173,"dt ([x, y, z, w]⊤) =  "
N,0.5482233502538071,"ax + dz −yz
xz −by
c(x −z) + xy
c(y −w) + xz.  "
N,0.550761421319797,"127D: Kuramoto-Sivashinsky To test Neural ODE’s performance in learning high dimensional
chaotic system, we generate the modified Kuramoto-Sivashinsky (KS) system’s solution defined
below with a second order finite difference scheme used in [BW14]. ∂u"
N,0.5532994923857868,∂t = −(u + c)∂u
N,0.5558375634517766,∂x −∂2u
N,0.5583756345177665,∂x2 −∂4u
N,0.5609137055837563,"∂x4
x ∈[0, L],
t ∈[0, ∞)
u(0, t) = u(L, t) = 0 ∂u
∂x"
N,0.5634517766497462,"x=0
= ∂u ∂x"
N,0.565989847715736,"x=L
= 0"
N,0.5685279187817259,"u(x, 0) = u0(x)"
N,0.5710659898477157,"B.2
Architecture"
N,0.5736040609137056,"We try two neural network architectures for learning the vector field of the systems: a simple Multi-
Layer Perceptron (MLP) model and a ResNet [HZRS16]. For the MLP model, we use GELU4 as the
activation function, and ReLU for ResNet model. In addition, we experiment with adding Fourier
layers [LKA+20] to represent the solution operator. We use the Latent SDE code from [LWCD20]
for results in section 4."
N,0.5761421319796954,Table 2: Hyperparameter choices
N,0.5786802030456852,"Chaotic
Systems
Epochs
Time step
Hidden
layer width
Layers
Train,
Test size
Neural
Network
λ
in (3)"
N,0.5812182741116751,"Tent map
10000
N.A.
[256]
2
[10000,
8000]
ResNet
500"
N,0.583756345177665,"Baker map
10000
N.A.
[512]
3
[5000,
5000]
ResNet
100"
N,0.5862944162436549,"Lorenz ’63
8000
0.01
[512]
7
[10000,
8000]
ResNet
500"
N,0.5888324873096447,"Rössler
10000
0.01
[512]
3
[10000,
8000]
ResNet
500"
N,0.5913705583756346,"Hyperchaos
20000
0.001
[512]
3
[10000,
8000]
ResNet
500"
N,0.5939086294416244,"Kuramoto-
Sivashinsky
3000
0.25
[512, 256]
3
[3000,
3000]
MLP
1"
N,0.5964467005076142,"B.3
Hyperparameter Search"
