Section,Section Appearance Order,Paragraph
ABSTRACT,0.0,Abstract
ABSTRACT,0.0025380710659898475,"Conventional notions of generalization often fail to describe the ability of learned
models to capture meaningful information from dynamical data. A neural network
that learns complex dynamics with a small test error may still fail to reproduce
its physical behavior, including associated statistical moments and Lyapunov ex-
ponents. To address this gap, we propose an ergodic theoretic approach to gener-
alization of complex dynamical models learned from time series data. Our main
contribution is to define and analyze generalization of a broad suite of neural repre-
sentations of classes of ergodic systems, including chaotic systems, in a way that
captures emulating underlying invariant, physical measures. Our results provide
theoretical justification for why regression methods for generators of dynamical
systems (Neural ODEs) fail to generalize, and why their statistical accuracy im-
proves upon adding Jacobian information during training. We verify our results
on a number of ergodic chaotic systems and neural network parameterizations,
including MLPs, ResNets, Fourier Neural layers, and RNNs."
INTRODUCTION,0.005076142131979695,"1
Introduction"
INTRODUCTION,0.007614213197969543,"Learning a dynamical system from time series data is a pervasive challenge across scientific domains.
Such data come from expensive experiments and high-fidelity numerical models that simulate the
underlying nonlinear, often chaotic, processes. The learning challenge is to train on available
data to produce output models that i) provably preserve known symmetries and invariances (e.g.,
conservation principles); and ii) are inexpensive surrogates for use in downstream computations
such as optimization and uncertainty quantification. The field of physics-guided machine learning
[vdGSB+20, FO22, LK22, KKLL21, RPK19, KKL+21] has emerged in response, rapidly integrating
neural networks into data-driven modeling and prediction workflows for a wide variety of complex
dynamics, from geophysical fluid flows to phase transitions in materials (see [KMA+21, CCC+19]
for surveys). Yet rigorous generalization analyses of neural parameterizations in these applications,
wherein the underlying dynamics can exhibit chaotic behavior, have been underexplored."
INTRODUCTION,0.01015228426395939,∗Corresponding author
INTRODUCTION,0.012690355329949238,"Figure 1: A random orbit on the x-z plane obtained from RK4 integration of the Lorenz vector field
([Lor63] (first column), Neural ODE, ‘MSE_MLP’, trained with mean-squared loss (second column)
and Neural ODE, ‘JAC_MLP’, trained with Jacobian loss (third column). The last column shows the
empirical PDF of the orbit generated by the true (gray), ‘MSE_MLP’ (red) and ‘JAC_MLP’ (blue)
models. Experimental settings and additional results are in Appendices B and C respectively. Gist: A
model trained well with MSE can produce atypical orbits but when Jacobian information is added to
the training, it reproduces the long-term/statistical behavior accurately."
INTRODUCTION,0.015228426395939087,"Here we investigate data-driven neural parameterizations of chaotic ODEs/PDEs and maps (discrete-
time dynamical systems) motivated by the following observation: a neural representation that is
learned well, i.e., with a small generalization error, can still produce unphysical long-term or ensemble
behavior. Figure 1 (left) shows the classical Lorenz ’63 chaotic attractor [Lor63] plotted using a long
random trajectory/orbit (time integration of the Lorenz equation vector field starting from a random
initial condition, which is indicated by a ‘+’ sign). The second column shows an orbit from a neural
network model, ‘MSE_MLP’, which minimizes the mean-squared error in the represented vector
field at 10,000 training points and shows high accuracy (< 5% average relative error) over 8000 test
points on the attractor. Surprisingly, Figure 1(column 2) shows that the learned ‘MSE_MLP’ Neural
ODE [CRBD18] model produces an atypical orbit – an orbit different from almost every orbit of
the true system – for the same randomly chosen initial condition. As a result, the learned empirical
distribution is not close to the physical distribution – that of almost every true orbit, as shown in
Figure 1 (column 4). On the other hand, the ‘JAC_MLP’ model, which is obtained by minimizing the
mean-squared error in the vector field and its first derivative (Jacobian matrix), reproduces the Lorenz
’63 attractor and the physical distribution on the attractor (Figure 1, column 4). The ‘JAC_MLP’ also
captures all the Lyapunov exponents (LEs) – measures of asymptotic stability to perturbations, which
are invariants in ergodic systems – accurately, while the ‘MSE_MLP’ only obtains the leading LE
accurately."
INTRODUCTION,0.017766497461928935,"Naturally, we ask about the wider applicability of these observations. For any ground truth dynamical
system, how can we quantify the probability of success, including obtaining sample complexity results,
of learning its physical or typical behavior? That is, how do we redefine and extend generalization
analyses to neural representations of complex dynamical systems? To answer these questions, we
start with a deceivingly simple supervised learning setup: given m samples from a time series,
{(xt, xt+1)}t, 0 ≤t ≤(m −1), how can we learn a model, Fnn, such that, i) xt+1 ≈Fnn(xt), for
all time t, and ii) the underlying distribution of the states xt and other dynamical invariants such
as Lyapunov exponents are reproduced by orbits of Fnn? It is widely accepted that learning such
an Fnn involves matching orbits of Fnn with xt over large t during training. However, small errors
propagate over orbits, by definition, in a chaotic system, leading to training instabilities. In response,
a vast literature has been dedicated to developing sophisticated training models based on RNNs
[PLH+17, PWF+18, RM21], operator learning [LLSK+22] and regularizations [LG22, FJNO20]."
INTRODUCTION,0.02030456852791878,"We focus instead on the empirical risk minimization (ERM) for Fnn that does not explicitly use the
temporal correlations/dynamical structure in the data, avoiding training instabilities. Thus, we attempt
to characterize when an elementary regression problem Fnn can still lead to learning a physical
representation, leading to a practical theory of learning chaotic systems from data. Our specific
contributions are as follows:"
INTRODUCTION,0.02284263959390863,"• Motivated by extensive empirical results, we develop useful notions of generalization that
characterize a model’s ability to reproduce dynamical invariants."
INTRODUCTION,0.025380710659898477,"• We develop new dynamics-aware generalization bounds for minimization of errors in the
Cr, r = 0, 1, topology."
INTRODUCTION,0.027918781725888325,"• We leverage shadowing theory from dynamical systems to rigorously characterize failure
modes in learning statistically accurate models."
GENERALIZATION OF PARAMETERIZED ERGODIC DYNAMICS,0.030456852791878174,"2
Generalization of parameterized ergodic dynamics"
GENERALIZATION OF PARAMETERIZED ERGODIC DYNAMICS,0.03299492385786802,"In this section, we motivate, through illustrative examples, the need for a dynamics-aware definition
of generalization in the context of learning from time series data. We introduce concepts from
dynamical systems as needed for a self-contained presentation."
GENERALIZATION OF PARAMETERIZED ERGODIC DYNAMICS,0.03553299492385787,"Dynamics.: A map, or a discrete-time dynamical system, F, is a function on a closed and bounded
(compact) set, M ⊂Rd, which is called the state/phase space of the dynamics. We exclude scenarios
where the dynamics can be unbounded, and focus on settings where F ∈C1(M) is a differentiable
function on M. We denote by F t, t ∈Z+, the iterates of the dynamics, or the compositions of F
with itself t times, i.e., F t = F ◦F t−1. An orbit or trajectory of F t starting at an initial state x ∈M
is the sequence {F t(x)}t∈Z+. In practice, F may be a numerical ODE solver that approximates
the continuous-time solutions, φt, t ∈R+, of the ODE (written in dynamical systems notation2
): dφt(x)/dt = v(φt(x)), where v : M →TM is the true vector field describing the governing
equations. Fixing some τ ∈R+, F := φτ. We say a map F is chaotic if there exists a subbundle
of TM, called the unstable subbundle, where infinitesimal perturbations grow exponentially under
the linearization (Jacobian map), dF t, of the dynamics. The true map F generates a deterministic,
autonomous system (see Appendix A)."
GENERALIZATION OF PARAMETERIZED ERGODIC DYNAMICS,0.03807106598984772,"Physical measures. A probability measure µ : M →R+ is a physical measure [You02] for
the dynamics F if it is a) F-invariant, b) ergodic and c) observable through F. A measure µ is
observable if time-averages along any orbit starting from a randomly chosen initial point converge to
constants that are expectations (phase space average) with respect to µ. That is, for any f ∈C(M),
(1/T) P"
GENERALIZATION OF PARAMETERIZED ERGODIC DYNAMICS,0.04060913705583756,"t≤T f(F t(x))
T →∞
−−−−→Ef(x), for any initial point x chosen Lebesgue a.e. on a set U ⊆M.
The orbits starting almost everywhere on the basin of attraction, U, asymptotically enter a set, Λ,
called the attractor. In dissipative chaotic systems, the attractor, Λ, which is the compact support
of the physical measure µ, has Lebesgue measure 0. Consequently, µ may not have a probability
density, that is, µ is not absolutely continuous, or is singular, with respect to Lebesgue measure."
GENERALIZATION OF PARAMETERIZED ERGODIC DYNAMICS,0.04314720812182741,"Neural ODE. Introduced in [CRBD18], a Neural ODE, denoted here by, vθ : M →Rd, with
parameters, θ, is a vector field represented by a neural network. The vector field can be time
integrated to obtain solutions φt
θ : Rd →Rd, t ∈R+ to the ODE, dφt
θ(x)/dt = vθ(φt
θ(x)). As
noted in the introduction, suppose we have n distinct pairs S = {(xi, F(xi))}i∈[n], which could
come from a single orbit of F, as our training data. We train the Neural ODE by solving an ERM for
the loss, ℓ, that can be chosen to be a square loss, e.g., ℓ(x, φτ
θ) = ∥φτ
θ(x) −F(x)∥2. That is, we
solve for θ that minimizes the training loss, (1/n) P"
GENERALIZATION OF PARAMETERIZED ERGODIC DYNAMICS,0.04568527918781726,"x∈S ℓ(x, θ). Note that the true ODE or vector
field is not explicitly used in training, only the solution map at some time intervals, F. We refer to the
map, x →φτ(x), as Fnn, or neural representation of the target map, F."
GENERALIZATION OF PARAMETERIZED ERGODIC DYNAMICS,0.048223350253807105,"Data and optimization. Suppose we use an m-length orbit as our training data, i.e., xi+1 = F(xi),
then, the data are not, strictly speaking, independent. However, a feature of chaotic systems is an
exponential decay of correlations, and so training data of the form, {(xi, F ω(xi))} starting from an
initial condition x0 ∼µ, can be thought of as iid, for a large enough ω ∈N. In that case, the learned
map Fnn represents the function F ω. During optimization, infinitesimal linear perturbations, will
have to be evolved for time ω. Since adjoint solutions blow up exponentially, a longer ω will lead
to training instabilities. To avoid numerical difficulties in training and focus on issues surrounding
generalization, we choose τ := δt, a small time step, to define the target map F and learn a neural
network representation of this function. When viewed this way, the generalization of Neural ODEs
can be analyzed through the conventional lens of supervised learning with the loss,"
GENERALIZATION OF PARAMETERIZED ERGODIC DYNAMICS,0.050761421319796954,"ℓ(x, Fnn) = ∥Fnn(x) −F(x)∥2,
(1)"
GENERALIZATION OF PARAMETERIZED ERGODIC DYNAMICS,0.0532994923857868,"where Fnn := φδt is a neural network representing the map. For a map h : M →M, we define the
training and generalization errors in the usual way:"
GENERALIZATION OF PARAMETERIZED ERGODIC DYNAMICS,0.05583756345177665,"ˆRS(h) = (1/m) m
X"
GENERALIZATION OF PARAMETERIZED ERGODIC DYNAMICS,0.0583756345177665,"i=1
ℓ(xi, h),
R(h) = Eℓ(x, h),
(2)"
GENERALIZATION OF PARAMETERIZED ERGODIC DYNAMICS,0.06091370558375635,"2We use this notation rather than the customary dx(t)/dt = v(x(t)), x(0) = x0, since in dynamical systems,
we are interested in all possible orbits, as opposed to a particular orbit/path, for which defining the flow, φt, is
necessary."
GENERALIZATION OF PARAMETERIZED ERGODIC DYNAMICS,0.06345177664974619,"Figure 2: Learned and true LEs computed over 30,000 time steps using the QR algorithm of Ginelli
et al [GCLP13] starting from 10,000 random initial states. The “MSE” and “JAC” labels indicate
computations using the Neural ODE models trained with the loss functions in (1) and (3) respectively."
GENERALIZATION OF PARAMETERIZED ERGODIC DYNAMICS,0.06598984771573604,"where the expectation is over the data distribution, which may be µ or any initial probability distribu-
tion of the states."
GENERALIZATION OF PARAMETERIZED ERGODIC DYNAMICS,0.06852791878172589,"Example. To illustrate our conceptual findings surrounding generalization, we use the canonical
Lorenz ’63 system, which is a 3-variable reduced order model of atmospheric convection [Lor63].
The ODE can be written as dφt(x)/dt = v(φt(x)), where the vector field v is given by v(x) =
[σ(y −x), x(ρ −z) −y, xy −βz]⊤, and x = [x, y, z]⊤are the coordinate functions of the state x.
We use the standard values of the parameters σ = 10, ρ = 28, β = 8/3, at which the solutions are
chaotic. We use the Runge-Kutta 4-stage time integrator with a time step size of 0.01 to define the
map F. That is, F(x) is the solution φ0.01(x) approximated by an RK4 time-integrator. Our Neural
ODE map, Fnn, is learned to approximate F by solving the above optimization with n = 10, 000
training points along an orbit. We illustrate our numerical results on various Neural ODE models and
architectures that have fully connected layers, ResNet blocks with convolutional layers, and Fourier
neural operators [LKA+20]. Many such models learn accurate representations of the true vector field
v, as evidenced by small training and test errors (sample average approximation of the generalization
error in (2) over 8,000 points from the data distribution). These are shown in Figure 3 (Appendix C),
while other hyperparameter and optimization settings are in Appendix B."
GENERALIZATION OF PARAMETERIZED ERGODIC DYNAMICS,0.07106598984771574,"Statistical measures and Lyapunov exponents. Our numerical results test the accuracy of models
beyond generalization error as defined in (2). In particular, we compute time-averages using the
Neural ODE models and compare against expectations with respect to µ obtained from the true
equations. For the Lorenz system, we note that time averages obtained from the models with small
generalization errors can be inaccurate. That is, even if the errors in the vector field are small (see
also Figure 4 in Appendix C), the time-averages can match poorly. This is described for the best
performing Neural ODE model in Table 3. The discrepancy in the learned distribution is shown
in terms of Wasserstein distance computed using empirical distributions on long orbits (of length
50,000). We find that the Neural ODE model does not learn the ground truth statistics even if the
training data include transient dynamics off the attractor."
GENERALIZATION OF PARAMETERIZED ERGODIC DYNAMICS,0.07360406091370558,"Lyapunov exponents, roughly speaking, measure the asymptotic exponential growth/decay of in-
finitesimal perturbations under the Jacobian map dF. In an ergodic system, they are independent
of the initial state and can be written as an expectation with respect to µ. In this work, Lyapunov
exponents are yet another dynamical invariant (statistical quantity) in ergodic systems that we use to
evaluate the statistical fidelity of learned models. In a chaotic system, there is at least one positive
Lyapunov exponent, and the number of positive Lyapunov exponents is the dimension of the unstable
manifold. The Lorenz system has one positive Lyapunov exponent (LE), one zero LE (corresponding
to a center direction, or the vector field v itself) and one negative LE. The ground truth map F, which
is a time δt approximation of the flow φt has a two-dimensional center-unstable manifold and a
one-dimensional stable manifold."
GENERALIZATION OF PARAMETERIZED ERGODIC DYNAMICS,0.07614213197969544,"In Figure 2, we plot the Lyapunov exponents obtained using a classical QR iteration-based algorithm
[GCLP13]. The Neural ODE model, marked ‘MSE’, produces a reasonably close approximation
of the ground truth value (≈0.9) for the positive LE but obtains an incorrect approximation of the
stable LE (true value ≈−14.5). We note also that standard deviations in the LE values computed
over different orbits is quite large, indicating some orbits with atypical behaviors. We show the ℓ2
error in the computed LEs by the Neural ODE model in Table 3, and full details in Table 5."
GENERALIZATION OF PARAMETERIZED ERGODIC DYNAMICS,0.07868020304568528,"Table 1: True vs. learned Lorenz system: comparison of statistics. (W 1: Wasserstein-1 Distance, Λ:
set of LEs, ˆµT : empirical distribution of an orbit T. The subscript NN indicates quantities computed
using NN models trained with different loss functions (MSE (1), JAC (3))."
GENERALIZATION OF PARAMETERIZED ERGODIC DYNAMICS,0.08121827411167512,Norm Difference
GENERALIZATION OF PARAMETERIZED ERGODIC DYNAMICS,0.08375634517766498,"Model
Loss
W 1(ˆµ500, µNN,500)
∥Λ −ΛNN∥
∥⟨x⟩500 −⟨x⟩500,NN∥"
GENERALIZATION OF PARAMETERIZED ERGODIC DYNAMICS,0.08629441624365482,"MLP
MSE
18.9711
9.6950
15.2220
MLP
JAC
0.6800
0.0118
0.6524
ResNet
MSE
1.3567
10.8516
0.7760
ResNet
JAC
0.1433
0.0106
0.0559
FNO
MSE
10.5409
22.1600
9.4270
FNO
JAC
1.3076
0.0505
0.9748"
GENERALIZATION OF PARAMETERIZED ERGODIC DYNAMICS,0.08883248730964467,Jacobian-matching. We now consider Neural ODE models trained with the following loss function.
GENERALIZATION OF PARAMETERIZED ERGODIC DYNAMICS,0.09137055837563451,"ℓλ(x, Fnn) = ∥Fnn(x) −F(x)∥2 + λ∥dFnn(x) −dF(x)∥2,
(3)"
GENERALIZATION OF PARAMETERIZED ERGODIC DYNAMICS,0.09390862944162437,"where Fnn : M →M is a Neural ODE map, dFnn(x) : TxM →TxM its (d × d) Jacobian matrix at
x, and λ > 0 is a hyperparameter that scales the relative importance of the two terms. We train in
the usual way, by solving an ERM problem to minimize the training error, ˆRS,λ, which is defined as
before, but with the new Jacobian-matching loss:"
GENERALIZATION OF PARAMETERIZED ERGODIC DYNAMICS,0.09644670050761421,"ˆRS,λ(h) = (1/m) m
X"
GENERALIZATION OF PARAMETERIZED ERGODIC DYNAMICS,0.09898477157360407,"i=1
ℓλ(xi, h),
Rλ(h) = Eℓλ(x, h).
(4)"
GENERALIZATION OF PARAMETERIZED ERGODIC DYNAMICS,0.10152284263959391,"We train Neural ODE models with similar architectures as above, and find best performing models in
terms of the test error (approximation of the generalization error) in (4). As in the training with the
loss function ℓ, we find several accurate neural representations of the Lorenz map (see training and
test loss plots in Appendix C). Their performance on statistical measures and Lyapunov exponent
predictions is remarkably different, however. In Figure 1, a Neural ODE trained with the Jacobian-
matching loss produces an attractor (column 3) that is visually similar to the Lorenz attractor. The
empirical distributions match closely with the ground truth, as shown in column 5 of Figure 1 and
in Table 3, where the model is marked with a ‘JAC’, while one trained with the loss ℓin (1) is
indicated with an ‘MSE’. The LEs and statistical averages of the state are all accurately represented,
although the model is not explicitly designed to learn temporal patterns in the data. The MSE models
learn vector fields with comparable accuracy with the Jacobian-matching models. That is, they learn
accurate representations of F with high probability (over the data distribution), but failing to learn
dF accurately leads to statistical inaccuracy. Due to the presence of atypical orbits, the attractor and
the physical measure are not reproduced. Even though our formulation of Neural ODEs is simply
stated as an ERM for regression, the generalization errors R(Fnn) and Rλ(Fnn) cannot determine
whether Fnn is a physical representation of the dynamics."
WHEN GENERALIZATION IMPLIES STATISTICAL ACCURACY,0.10406091370558376,"3
When generalization implies statistical accuracy"
WHEN GENERALIZATION IMPLIES STATISTICAL ACCURACY,0.1065989847715736,"In the previous section, we observed that adding information about the Jacobian in the training
process led to statistically-accurate learning. Does this observation apply more broadly to other
ergodic systems? How can one further improve generalization? In this section, we provide answers
to these questions by proving dynamics-aware generalization bounds for Neural ODEs."
WHEN GENERALIZATION IMPLIES STATISTICAL ACCURACY,0.10913705583756345,"Our ultimate goal is to minimize a statistical loss function rather than (1) or (3) since this mea-
sures how accurately a model h can reproduce ergodic averages associated with F. For instance,
ℓstat(x, h) = supf∈Lip1 |E[f(x)] −limT →∞(1/T) P"
WHEN GENERALIZATION IMPLIES STATISTICAL ACCURACY,0.1116751269035533,"t≤T f(ht(x))|. This is the Wasserstein (W 1)
distance (expressed in its dual form) between the ergodic measure µ and the ergodic measure associ-
ated with the orbit of h, a learned model, starting at x, limT →∞Unif{x, h(x), h2(x), · · · , hT (x)}.
As noted, ERMs for this loss function do not have a straightforward implementation when the map
h sought is chaotic. Hence, we seek conditions under which solving ERMs defined with losses (1)
and (3) can still minimize ℓstat. To understand when solving regression problems for Fnn lead to
statistically accurate physical representations, we first assume that a notion of “shadowing” applies to
F."
WHEN GENERALIZATION IMPLIES STATISTICAL ACCURACY,0.11421319796954314,"Definition 1. We say that the shadowing property applies to a map F if for any δ > 0, there exists an
ϵ = O(δ) so that for any map G with ∥G−F∥1 := supx∈M(∥G(x)−F(x)∥+∥dG(x)−dF(x)∥) ≤
ϵ, there exists a map τ : M →M close to the identity such that ∥Gt(τ(x)) −F t(x)∥≤δ for all t."
WHEN GENERALIZATION IMPLIES STATISTICAL ACCURACY,0.116751269035533,"Intuitively, the shadowing property means that an orbit of a nearby dynamical system can closely
follow a true orbit – called a shadowing orbit – of F for all time. This kind of uniform-in-time
shadowing is a classical result for a mathematically ideal class of chaotic systems, called uniformly
hyperbolic systems (see Katok and Hasselblatt [KKH95] Ch 18; Appendix A). For a textbook
presentation and extension of shadowing for dynamical systems with some hyperbolicity, see [Pil06].
For a uniformly hyperbolic F (see Appendix A), we now assume that a neural representation Fnn of
F trained with n samples generalizes well in terms of C1-distance. That is, an ERM solution for the
loss 3 (‘JAC’ models in sections 1 and 2) generalizes so that Rλ(Fnn) is small.
Definition 2 (C1 generalization). Given δ > 0, there exist E0, E1 > 0 and a function (δ, E0, E1) →
τ(δ, E0, E1) ∈N such that Ex∼µ∥F(x) −Fnn(x)∥≤E0 and Ex∼µ∥dF(x) −dFnn(x)∥≤E1 for all
m ≥τ with probability ≥1 −δ over the randomness of the training data from µm."
WHEN GENERALIZATION IMPLIES STATISTICAL ACCURACY,0.11928934010152284,"We now make an optimistic assumption on a learned model, Fnn, that satisfies the above definition
of C1 generalization. Using Hoeffding’s inequality, we know that for any δ0 > 0, with proba-
bility at least 1 −δ0 over the randomness of x, ∥F(x) −Fnn(x)∥≤E0 + (supx∈M ∥F(x) −
Fnn(x)∥)
p"
WHEN GENERALIZATION IMPLIES STATISTICAL ACCURACY,0.1218274111675127,"log(2/δ0) and ∥dF(x)−dFnn(x)∥≤E1 +(supx∈M ∥dF(x)−dFnn(x)∥)
p"
WHEN GENERALIZATION IMPLIES STATISTICAL ACCURACY,0.12436548223350254,"log(2/δ0).
Given δ > 0, let ϵ0 := 2E0 and ϵ1 := 2E1. Fixing δ0 > 0, suppose that the trained model Fnn is
such that (supx∈M ∥F(x) −Fnn(x)∥) < ϵ0/(2
p"
WHEN GENERALIZATION IMPLIES STATISTICAL ACCURACY,0.12690355329949238,"log(2/δ0)) and (supx∈M ∥dF(x) −dFnn(x)∥) ≤
ϵ1/(2
p"
WHEN GENERALIZATION IMPLIES STATISTICAL ACCURACY,0.12944162436548223,"log(2/δ0)). Taking a union bound, with probability > 1 −(δ + δ0), ∥F(x) −Fnn(x)∥≤ϵ0
and ∥dF(x) −dFnn(x)∥≤ϵ1. We enhance this inequality to obtain a stronger assumption on Fnn.
Assumption 1 (C1 strong generalization). Given δ > 0, there exist ϵ0, ϵ1 > 0 and a function
(ϵ0, ϵ1, m) →n(ϵ0, ϵ1, m) ∈N such that ∥F(F t
nn(x)) −F t+1
nn (x)∥≤ϵ0 and ∥dF(F t
nn(x)) −
dFnn(F t
nn(x))∥≤ϵ1 for all t ≤n, m ≥τ(δ, ϵ), and n →∞as m →∞, with probability ≥1 −δ
over the initial state x."
