Section,Section Appearance Order,Paragraph
WHEN GENERALIZATION IMPLIES STATISTICAL ACCURACY,0.1319796954314721,"That is, we assume that, with high probability, the trained model makes a small error at each time.
This stronger notion of generalization can be satisfied when the true model shows a smooth linear
response in its statistics [Bal14], or in practice, training is performed with points sampled at random
near the attractor, as opposed to with a spin-off time to achieve a state on the attractor. Given a
tuple, (ϵ0, ϵ1), an orbit with initial condition x that satisfies, ∥F(F t
nn(x)) −F t+1
nn (x)∥≤ϵ0 and
∥dF(F t
nn(x)) −dFnn(F t
nn(x))∥≤ϵ1 for all t ≤m will be referred to as an (ϵ0, ϵ1) orbit. That is, at
each time, the neural representation Fnn is (ϵ0, ϵ1)-close to the true map, F. Under this assumption,
we can follow the proof of the Shadowing lemma (see e.g., Ch 18 of [KKH95]) for hyperbolic maps
to show that a true orbit (of F) shadows every (ϵ0, ϵ1) orbit.
Proposition 1 (Shadowing). Let Fnn be an approximation of F that satisfies the C1 strong gen-
eralization (Assumption 1). Given any δ > 0, there exist ϵ0, ϵ1, n such that every (ϵ0, ϵ1) orbit is
δ-shadowed by an orbit of F. That is, there is a true orbit, say, {F t(x)}, corresponding to every
orbit, {Gt(x′)} such that ∥F t(x) −Gt(x′)∥≤δ, for all t ≤n."
WHEN GENERALIZATION IMPLIES STATISTICAL ACCURACY,0.13451776649746192,"See section A.1 for the proof. Let {xnn
t }t≤n be an n-length orbit of Fnn, i.e., xnn
t+1 = Fnn(xnn
t ). We
use Tn,nnM to denote the direct sum ⊕n
i=1Txnn
i M of tangent spaces along the orbit, xnn
t . The proof
follows Theorem 18.1.3 of [KKH95] to apply contraction mapping on a compact ball in Tn,nnM."
WHEN GENERALIZATION IMPLIES STATISTICAL ACCURACY,0.13705583756345177,"The above result defines, for each (ϵ0, ϵ1)-orbit, {xnn
t }t, a shadowing orbit, xsh := {F(xnn
t
+ vt)}t,
where v = ⊕tvt is the fixed point of the contraction map in the proof (section A.1). Let µsh
n (xnn
0 ) be
the empirical measure defined on the shadowing orbit corresponding to an (ϵ0, ϵ1)-orbit, {xnn
t }t, i.e.,
µsh
n (xnn
0 ) = Unif{xsh
0 , · · · , xsh
t , · · · , xsh
n−1}. A shadowing orbit is indeed an orbit of the true map F,
but, unexpectedly, it may be atypical for the physical measure, µ. That is, for an atypical shadowing
orbit, the time average, (1/n) P"
WHEN GENERALIZATION IMPLIES STATISTICAL ACCURACY,0.13959390862944163,"t≤n f(xsh
t ) does not converge to the expected value Ex∼µf(x), as
n →∞. This means that the Wasserstein distance, W 1(µsh
n (xnn
0 ), µ), does not converge to 0 as
n →∞."
WHEN GENERALIZATION IMPLIES STATISTICAL ACCURACY,0.14213197969543148,"Given an initial condition, xnn
0 , of an (ϵ0, ϵ1)-orbit, the corresponding shadowing orbit may be
typical with some probability (over the distribution of xnn
0 ), and this probability of finding typical
shadowing orbits is a property of the true dynamics, F. When µ, the physical measure of F, is highly"
WHEN GENERALIZATION IMPLIES STATISTICAL ACCURACY,0.1446700507614213,"sensitive to perturbations of F, (see [Rue09, Bal14] for surveys on linear response theory, the study
of perturbations of statistics) this probability may be small. Although the connection between the
sensitivity of statistics and the atypicality of shadowing orbits is not completely known, this can justify
the differences in the statistical accuracy of neural parameterizations with good C1 generalization
(see Definition 2). A neural model Fnn which generalizes well in the C1 sense (Definition 2) can be
thought of as a C1-smooth perturbation of the true dynamics F. If smooth perturbations of F can
cause a large change in µ, then even when the training size m →∞, and the orbit length n →∞,
W 1(µsh
n (xnn
0 ), µ), may not converge to zero, resulting in a model that does not preserve the physical
behavior of F. On the other hand, for typical shadowing, this possibility is excluded and gives us a
characterization of statistically accurate learning."
WHEN GENERALIZATION IMPLIES STATISTICAL ACCURACY,0.14720812182741116,"Theorem 1 (Statistically accurate learning). Let Fnn be a model of F that satisfies C1 strong
generalization. In addition, let Fnn and F be such that for any δ > 0, there exists an ϵ2 > 0 so that
limn→∞W 1(µsh
n (x), µ) ≤ϵ2 with probability (over the randomness of x) ≥1−δ. Then, for any δ >
0, there exists an ϵ > 0 such that limn→∞W 1(Unif{x, Fnn(x), · · · , F t
nn(x), · · · , F n
nn(x)}, µ) ≤ϵ
with probability ≥1 −δ."
WHEN GENERALIZATION IMPLIES STATISTICAL ACCURACY,0.14974619289340102,"Proof: Let µnn
n (x) := Unif{x, Fnn(x), · · · , F t
nn(x), · · · , F n−1
nn
(x)} be the empirical measure of
an n-length orbit of Fnn starting at x. Given a δ > 0, we choose (ϵ0, ϵ1) so that C1 strong
generalization is satisfied with probability ≥1 −δ/2. Thus, an initial condition x is such that
{F t
nn(x)}t≤n is an (ϵ0, ϵ1) orbit, where the tuple (ϵ0, ϵ1) is as defined in Proposition 1, with prob-
ability ≥1 −δ/2. Applying Proposition 1, we have, for any 1-Lipschitz function f : M →R,
(1/n) P"
WHEN GENERALIZATION IMPLIES STATISTICAL ACCURACY,0.15228426395939088,"t≤n |f(F t
nn(x)) −f(F t(x))| ≤(1/n) P"
WHEN GENERALIZATION IMPLIES STATISTICAL ACCURACY,0.1548223350253807,"t≤n ∥F t
nn(x)) −F t(x)∥≤δ/2. Taking a supre-
mum over f, W 1(µsh
n (x), µnn
n (x)) ≤δ/2, with probability ≥1 −δ/2. By assumption, there
exists some ϵ2 > 0 such that limn→∞W 1(µ, µsh
n (x)) < ϵ2 with probability 1 −δ/2. Hence,
limn→∞W 1(µ, µnn
n (x)) ≤limn→∞W 1(µsh
n (x), µnn
n (x)) + W 1(µ, µsh
n (x)) ≤ϵ2 + δ/2 := ϵ, with
probability > 1 −δ, using triangle inequality and taking union bound."
WHEN GENERALIZATION IMPLIES STATISTICAL ACCURACY,0.15736040609137056,"This result explains why training to minimize Jacobian-matching loss (3) can lead to statistically
accurate models, even though, long-time temporal patterns in the data are not learned explicitly by
regression for the one-time map F. Since C0 generalization (i.e., small errors in(2)) is insufficient for
learning shadowing orbits, and thus for Proposition 1 and Theorem 1 to hold, the models trained on
MSE loss 1 are not expected to learn ergodic/statistical averages with respect to µ."
WHEN GENERALIZATION IMPLIES STATISTICAL ACCURACY,0.1598984771573604,"When shadowing orbits are atypical with high probability, we observe numerically that C1 generaliza-
tion, i.e., training with Jacobian-matching loss, still does not produce statistically accurate dynamics,
in line with the above theorem. For instance, for maps with atypical shadowing described in [CW21],
we find that learned neural representations with Jacobian-matching do have good C1 generalization
(Figure 6), but do not exhibit good statistical accuracy and learn incorrect Lyapunov exponents (see
Table 5, Plucked Tent map)."
DYNAMIC GENERATIVE MODELS,0.16243654822335024,"4
Dynamic generative models"
DYNAMIC GENERATIVE MODELS,0.1649746192893401,"So far, we have focused on understanding the statistical accuracy of supervised learning of dynamical
systems. Without any minimization of distances on the space of probability measures, we proved
sufficient conditions under which regression with Jacobian-matching information can yield samples
from µ with high probability. A generative method is an unsupervised learning technique to train on
samples from a target distribution to produce more samples (provably) from the target. Naturally,
we can use several popular generative models for our target physical measure here, including score-
based methods [SE19, SSDK+20], Variational Autoencoders (VAE) [RM15] or normalizing flows
[RM15, PNR+21]. However, these methods neglect the dynamical relationships in the input samples.
In other words, from a vanilla generative model of a physical measure, we cannot also recover the
true dynamics. Thus, we focus here on Latent SDEs models from [LWCD20], which combine neural
representations of dynamics with generative models. We reinterpret them as dynamic generative
models, and analyze their ability to faithfully represent both the underlying dynamics as well as the
physical measure."
DYNAMIC GENERATIVE MODELS,0.16751269035532995,"In a dynamic generative model, we approximate F t with a stochastic map, that can written as,
Fls := fθ ◦Φt
ϕ ◦gϕ, where the subscript ls stands for “latent SDE”. Here, the function gϕ : Rd →
Rdl, with learnable parameters, ϕ, is a (possibly stochastic) embedding from the data to latent"
DYNAMIC GENERATIVE MODELS,0.1700507614213198,"space (Rdl), such that, gϕ♯µ = qϕ,0. Recall the pushforward notation (♯), i.e., if x ∼µ, then,
gϕ(x) ∼qϕ,0. The dynamical system Φt
ϕ : Rdl →Rdl acts on the latent space, and defines a
sequence of pushforward distributions Φt
ϕ♯qϕ,0 = qϕ,t. A special case of this setup is a “latent ODE”,
where Φt
ϕ is a deterministic map instead. With a stochastic latent SDE model instead, we observe, in
line with [LWCD20], that the multimodal distribution of the Lorenz ’63 attractor is reproduced better.
That is, Φt
ϕ is a solution map of a Neural SDE: dΦt
ϕ(z) = wϕ(t, Φt
ϕ(z))dt + σϕ(t, Φt
ϕ(z)) ◦dWt.
Here the drift term, wϕ, and the diffusion term, σϕ, are represented as neural networks. The
decoder fθ : Rdl →Rd is a deterministic map that defines the conditional, fθ♯qϕ,t = pθ(·|Zt).
This dynamic VAE approach has been found to be expressive for chaotic systems (see Chapters
3 and 5 of [Kid22], [KMFL20]), wherein the conditional distribution, z →qϕ,0(z|X1:m), of Z0
given X1:m := {F t(x)}t≤m is modeled as a Gaussian distribution whose learnable parameters
are also denoted by ϕ. Similarly, the conditional pθ(·|Zt) is again modeled as a Gaussian with
parameters θ. The parameters, ϕ and θ respectively, of the encoder and the decoder are trained by
maximizing the following dynamic version of the evidence lower bound (ELBO): ℓls(X1:m, (ϕ, θ)) :=
Pm
t=1 Ezt∼qϕ,t(·|X1:m)[−log pθ(xt|zt)] + KL(qϕ,0(·|X1:m)∥pZ0)], where the prior pZ0 follows a
standard Gaussian distribution in the latent dimension. For alternatives to the ELBO objective above,
such as the Wasserstein-GAN objective, we refer the reader to [Kid22]."
DYNAMIC GENERATIVE MODELS,0.17258883248730963,"We now evaluate both the learned dynamics, Fls, and the learned generative model, pθ, which
approximates µ. In Figure 11, we present the empirical distribution of a generated orbit against that of
a typical orbit of the Lorenz system (µ). We observe that the distributions match well, nevertheless the
vector field is not well-approximated. First, even though the system is deterministic, the learned Φt
ϕ
with minimum generalization error (Eℓstat) encountered in the hyperparameter search (Appendix C.8)
is not, i.e, the diffusion term σϕ is not zero. The learned stochastic map, Fls, produces an incorrect
stable LE for the Lorenz system (≈−11.8), while the leading unstable LE matches reasonably well."
DYNAMIC GENERATIVE MODELS,0.1751269035532995,"Since the map Fls, or its underlying vector field, on the latent space is not unique, we may obtain
maps that do not preserve dynamical structure or invariants, even if the generated samples from
pθ approximately capture µ. As noted in section 2, the physical measure µ is often singular, but
absolutely continuous on lower-dimensional manifolds, leading to lack of theoretical guarantees for
vanilla generative models [Pid22]. Finally, the sample complexity (and tight generalization bounds)
of generative models, the above variational optimization, are not fully understood theoretically,
especially for singular distributions (that satisfy the manifold hypothesis [BCV13]). We remark
that since the minimax rates for approximating distributions have an exponential dependence on the
dimension, exploiting the intrinsic dimension (unstable dimension) associated with the support of µ
will be key to tractable generative models for µ in high-dimensional chaotic systems. Even in the
Lorenz ’63 system, we require O(106) samples for training reasonably accurate model in Figure 11,
while the Jacobian-matching (Figure 1 column 5) produces smaller Wasserstein distances with fewer
samples (104), and a simpler regression problem as opposed to variational optimization above."
NUMERICAL EXPERIMENTS,0.17766497461928935,"5
Numerical Experiments"
NUMERICAL EXPERIMENTS,0.1802030456852792,"We conduct experiments with the MSE and JAC losses in (1) and (3) respectively on many canonical
chaotic systems: 1D tent maps, 2D Bakers map, 3D Lorenz ’63 system and the Kuramoto Sivanshinsky
equation (127 dimensional system after discretization) (Appendix C). In each system, we identify
the Neural ODE model with the lowest generalization errors R and Rλ in (2) and (4) respectively,
by an architecture and optimization hyperparameter search (Appendix B) . On these models that
generalize well, we perform tests of statistical accuracy and LE computations (as described in section
2 for the Lorenz ’63 system). Consistent with Theorem 1, although most of the considered systems
are not uniformly hyperbolic, we find that the JAC models are statistically accurate and reproduce
the LEs, while the MSE models with R comparable to Rλ are not statistically accurate. For the KS
system for instance, the MSE models even overpredict the number of positive LEs. Interestingly,
the best JAC model can learn more than half of the first 64 LEs, compared to the best MSE model
that can learn only 2 out of 64 LEs, with < 10% relative error. The Python code is available at
https://github.com/ni-sha-c/stacNODE."
RELATED WORK,0.18274111675126903,"6
Related work"
RELATED WORK,0.18527918781725888,"Neural ODEs and generalization.
Introduced as continuous-time analogues [Wei17, HR17,
CRBD18] of Residual neural networks (ResNets) [HZRS16], Neural ODEs [CRBD18, HR17] offer
a vector field parameterization that can be time-integrated with an ODE solver. Augmented Neural
ODEs [DDT19, RCD19, DA22] demonstrate improved expressivity for complex dynamics, and
some universal approximation results appear in [ZGUA20, Kid22]. Neural ODEs [CRBD18] as
normalizing flows [RM15] and for density estimation have been tackled in [GCB+19]. Training and
regularization techniques that allow handling long time series are the subject of numerous works
[RMM+20, KJD+21, FJNO20, PER23a, PER23b, PMSR21, GBD+20, MSKF21]. Our focus is dif-
ferent: we characterize when an elementary Jacobian-matching regularization serves as an inductive
bias toward learning physical representations from irregular, even chaotic data."
RELATED WORK,0.18781725888324874,"Data-driven surrogates of complex systems. The vast and growing literature in the field of physics-
informed machine learning[VAUK22, LKB22, PABT+21, HZB+21, vdGSB+20, WY21, RPK19,
WY21, KKLL21, LK22] has encouraged the adoption of physical machine learning models that
preserve physical properties, symmetries and conservation laws, and are yet applicable in scientific
problems [HKUT20, PABT+21, HZB+21, RBL22, VAUK22, vdGSB+20, YHP+23]. At the same
time, several purely data-driven methods for complex systems [CNH20, PSH+22], which do not
require an expensive high-fidelity solver, have gained attention for their impressive prediction skill
[RCVS+19, SLST17, LSGW+23] and both faster training and inference making them suitable
for optimization [BB21, RBL22, LP21, JD21] and inverse problems [HVT23, AEOV23]. Since
the fundamental regression problem we study underlies both hybrid and data-driven methods, we
provide insight into dynamics-aware generalization (e.g., reproducing ergodic behavior, Lyapunov
exponents etc) applicable to different surrogate modeling approaches. Several innovative approaches
for ensuring training stability [MMD22, SWP+24, HMBD23, JLOW24] in chaotic systems when
using recurrent architectures have been proposed recently. The failure of generalization notions based
on mean-squared error have also been noted in [SWP+24, JLOW24] and empirical strategies and
new definitions of generalization suitable of non-ergodic systems have been introduced in [GHB+24].
For ease of theoretical analysis, we do not consider these more sophisticated training approaches,
choosing instead to learn short-term dynamics which obviates the need for stabilization strategies.
Encouragingly, we observe low sample complexity of vanilla regression with Jacobian information
to learn physical measures, when compared to the generative modeling approaches (which can be
comparable to RNNs as well). A computational analysis of the Jacobian loss training compared to
generative modeling/stablized recurrent training is deferred to a future work."
RELATED WORK,0.19035532994923857,"Ergodic theory and shadowing. Hyperbolic dynamics and ergodic theory (see e.g. the textbook
[KKH95]) lay the foundation for understanding the long-time/statistical physical behavior [You02] of
complex systems. The scientific computing community has leveraged ergodic theory and shadowing
[Ano67, Bow75, Pil06] for rigorous computations that use high-fidelity numerical simulations of
chaotic systems [GL24, Wan13, Ni21] and to analyze the correctness of numerical simulations
[HYG87, CW21, Lia17, Sau05, GHYS90]. The novelty of our work lies in introducing shadowing as
the basis for generalization, thus providing new analysis tools to understand the correctness of learned
chaotic systems [LLSK+22]. An interesting direction for future work is to extend dynamics-aware
generalization bounds similar to Theorem 1 to operator learning with Sobolev norms introduced in
[LLSK+22]."
CONCLUSION,0.19289340101522842,"7
Conclusion"
CONCLUSION,0.19543147208121828,"Our dynamics-aware generalization (Theorem 1) and empirical results provide a new characterization
of statistical accuracy in models learned from dynamical data. These results open many avenues
for improving mechanistic understanding and bridging the theory-practice gap in physical neural
modeling of complex systems:"
CONCLUSION,0.19796954314720813,"Understanding learning attractors. By exposing foundational problems in the elementary and
fairly general setting of regression of a dynamical system, our analytical tools in section 3 broaden
our conceptual understanding of learning from time series data in more complicated models and
paradigms."
CONCLUSION,0.20050761421319796,"Learning dynamical representations vs. generative models. We show that physical measures
can be produced by accurate neural representations of the dynamics, which can be more data and
time-efficient compared with generative modeling for time series generated by chaotic systems."
CONCLUSION,0.20304568527918782,"Dynamics-aware learning of scientific models. Our results imply that generalization does not
imply statistical accuracy and preservation of dynamical invariants and properties such as Lyapunov
exponents, which is crucial for trustworthy ML for science. Thus, we reinforce the need to move
toward a context-aware theory of generalization, organically unifying complex dynamics with learning
theory."
CONCLUSION,0.20558375634517767,"Limitations: A limitation of the theoretical results about C1 generalization is that we need to
assume the typicality of shadowing. Empirically, the Jacobian can be expensive to estimate for
high-dimensional scientific applications. We leave the study of statistical accuracy for learning
atypical shadowing orbits, and the extension of an efficient algorithm for Jacobian information during
training as a future work."
CONCLUSION,0.20812182741116753,"Acknowledgments We are grateful to the anonymous reviewers for their useful feedback and their
suggestions of additional numerical results, which have strengthened the paper. NC acknowledges
support from the James C. Edenfield faculty fellowship provided by the College of Computing at
Georgia Tech."
REFERENCES,0.21065989847715735,References
REFERENCES,0.2131979695431472,"[AEOV23] Harbir Antil, Howard C Elman, Akwum Onwunta, and Deepanshu Verma. A deep neu-
ral network approach for parameterized pdes and bayesian inverse problems. Machine
Learning: Science and Technology, 4(3):035015, 2023."
REFERENCES,0.21573604060913706,"[Ano67] D. V. Anosov. Geodesic flows on closed riemannian manifolds of negative curvature.
Trudy Mat. Inst. Steklov., 90, 1967."
REFERENCES,0.2182741116751269,"[Bal14] Viviane Baladi. Linear response, or else. arXiv preprint arXiv:1408.2937, 2014."
REFERENCES,0.22081218274111675,"[BB21] William Bradley and Fani Boukouvala. Two-stage approach to parameter estimation of
differential equations using neural odes. Industrial & Engineering Chemistry Research,
60(45):16330–16344, 2021."
REFERENCES,0.2233502538071066,"[BCV13] Yoshua Bengio, Aaron Courville, and Pascal Vincent. Representation learning: A
review and new perspectives. IEEE transactions on pattern analysis and machine
intelligence, 35(8):1798–1828, 2013."
REFERENCES,0.22588832487309646,"[BJS24] Oscar F Bandtlow, Wolfram Just, and Julia Slipantschuk. A numerical study of rigidity
of hyperbolic splittings in simple two-dimensional maps. Nonlinearity, 37(4):045007,
mar 2024."
REFERENCES,0.22842639593908629,"[Bow75] Rufus Bowen. ω-limit sets for axiom a diffeomorphisms. Journal of differential
equations, 18(2):333–339, 1975."
REFERENCES,0.23096446700507614,"[BW14] Patrick J Blonigan and Qiqi Wang. Least squares shadowing sensitivity analysis of
a modified kuramoto–sivashinsky equation. Chaos, Solitons & Fractals, 64:16–25,
2014."
REFERENCES,0.233502538071066,"[CCC+19] Giuseppe Carleo, Ignacio Cirac, Kyle Cranmer, Laurent Daudet, Maria Schuld, Naftali
Tishby, Leslie Vogt-Maranto, and Lenka Zdeborová. Machine learning and the physical
sciences. Rev. Mod. Phys., 91:045002, Dec 2019."
REFERENCES,0.23604060913705585,"[CNH20] Ashesh Chattopadhyay, Ebrahim Nabizadeh, and Pedram Hassanzadeh.
Analog
forecasting of extreme-causing weather patterns using deep learning. Journal of
Advances in Modeling Earth Systems, 12(2):e2019MS001958, 2020."
REFERENCES,0.23857868020304568,"[CRBD18] Ricky TQ Chen, Yulia Rubanova, Jesse Bettencourt, and David K Duvenaud. Neural
ordinary differential equations. Advances in neural information processing systems,
31, 2018."
REFERENCES,0.24111675126903553,"[CW21] Nisha Chandramoorthy and Qiqi Wang. On the probability of finding nonphysical
solutions through shadowing. Journal of Computational Physics, 440:110389, 2021."
REFERENCES,0.2436548223350254,"[CW22] Nisha Chandramoorthy and Qiqi Wang. Efficient computation of linear response of
chaotic attractors with one-dimensional unstable manifolds. SIAM Journal on Applied
Dynamical Systems, 21(2):735–781, 2022."
REFERENCES,0.24619289340101522,"[CZH21] Michele Coti Zelati and Martin Hairer. A noise-induced transition in the lorenz system.
Communications in Mathematical Physics, 383:2243–2274, 2021."
REFERENCES,0.24873096446700507,"[DA22] Thai Duong and Nikolay Atanasov. Adaptive control of se (3) hamiltonian dynamics
with learned disturbance features. IEEE Control Systems Letters, 6:2773–2778, 2022."
REFERENCES,0.2512690355329949,"[DDT19] Emilien Dupont, Arnaud Doucet, and Yee Whye Teh. Augmented neural odes. Ad-
vances in neural information processing systems, 32, 2019."
REFERENCES,0.25380710659898476,"[EHL04] Gregory L Eyink, Tom WN Haine, and Daniel J Lea. Ruelle’s linear response formula,
ensemble adjoint schemes and lévy flights. Nonlinearity, 17(5):1867, 2004."
REFERENCES,0.2563451776649746,"[FJNO20] Chris Finlay, Jörn-Henrik Jacobsen, Levon Nurbekyan, and Adam Oberman. How to
train your neural ode: the world of jacobian and kinetic regularization. In International
conference on machine learning, pages 3154–3164. PMLR, 2020."
REFERENCES,0.25888324873096447,"[FO22] Alexander G Fletcher and James M Osborne. Seven challenges in the multiscale
modeling of multicellular tissues. WIREs mechanisms of disease, 14(1):e1527, 2022."
REFERENCES,0.2614213197969543,"[GBD+20] Arnab Ghosh, Harkirat Behl, Emilien Dupont, Philip Torr, and Vinay Namboodiri.
Steer: Simple temporal regularization for neural ode. Advances in Neural Information
Processing Systems, 33:14831–14843, 2020."
REFERENCES,0.2639593908629442,"[GC95] Giovanni Gallavotti and Ezechiel Godert David Cohen. Dynamical ensembles in
nonequilibrium statistical mechanics. Physical review letters, 74(14):2694, 1995."
REFERENCES,0.26649746192893403,"[GCB+19] Will Grathwohl, Ricky TQ Chen, Jesse Bettencourt, Ilya Sutskever, and David Du-
venaud. Ffjord: Free-form continuous dynamics for scalable reversible generative
models. 7th International Conference on Learning Representations, ICLR 2019, 2019."
REFERENCES,0.26903553299492383,"[GCLP13] Francesco Ginelli, Hugues Chaté, Roberto Livi, and Antonio Politi. Covariant lyapunov
vectors. Journal of Physics A: Mathematical and Theoretical, 46(25):254005, 2013."
REFERENCES,0.2715736040609137,"[GHB+24] Niclas Göring, Florian Hess, Manuel Brenner, Zahra Monfared, and Daniel Durstewitz.
Out-of-domain generalization in dynamical systems reconstruction. arXiv preprint
arXiv:2402.18377, 2024."
REFERENCES,0.27411167512690354,"[GHL20] Bernard J Geurts, Darryl D Holm, and Erwin Luesink. Lyapunov exponents of two
stochastic lorenz 63 systems. Journal of statistical physics, 179:1343–1365, 2020."
REFERENCES,0.2766497461928934,"[GHYS90] Celso Grebogi, Stephen M. Hammel, James A. Yorke, and Tim Sauer. Shadowing
of physical trajectories in chaotic dynamics: Containment and refinement. Phys. Rev.
Lett., 65:1527–1530, Sep 1990."
