Section,Section Appearance Order,Paragraph
ABSTRACT,0.0,Abstract
ABSTRACT,0.003968253968253968,"Despite their prevalence in deep-learning communities, over-parameterized models
convey high demands of computational costs for proper training. This work studies
the fine-grained, modular-level learning dynamics of over-parameterized models
to attain a more efficient and fruitful training strategy. Empirical evidence reveals
that when scaling down into network modules, such as heads in self-attention
models, we can observe varying learning patterns implicitly associated with each
module’s trainability. To describe such modular-level learning capabilities, we
introduce a novel concept dubbed modular neural tangent kernel (mNTK), and
we demonstrate that the quality of a module’s learning is tightly associated with
its mNTK’s principal eigenvalue λmax. A large λmax indicates that the module
learns features with better convergence, while those miniature ones may impact
generalization negatively. Inspired by the discovery, we propose a novel training
strategy termed Modular Adaptive Training (MAT) to update those modules with
their λmax exceeding a dynamic threshold selectively, concentrating the model
on learning common features and ignoring those superfluous ones. Unlike most
existing training schemes with a complete BP cycle across all network modules,
MAT can significantly save computations by its partially-updating strategy and
can further improve performance. Experiments show that MAT nearly halves the
computational cost of model training and outperforms the accuracy of baselines."
INTRODUCTION,0.007936507936507936,"1
Introduction"
INTRODUCTION,0.011904761904761904,"The proliferation of large-scale pre-trained models (Devlin et al., 2018; Brown et al., 2020; Doso-
vitskiy et al., 2020) demonstrates the advantages of over-parameterized models. Those models
can adequately fit the training data with their sizeable parameters far exceeding the data scale (Du
et al., 2018), and such over-parameterizations are known to be essential in model optimization and
generalization and are also crucial to their success in deep learning (Liu et al., 2022). However,
challenges remain. Over-parameterized models are expensive to train; for example, training large
language models (LLMs) such as GPT-3 (Brown et al., 2020; Zaheer et al., 2020) may take weeks to
months, even on a large collection of powerful GPUs."
INTRODUCTION,0.015873015873015872,∗Corresponding authors.
INTRODUCTION,0.01984126984126984,"Figure 1: Characteristics of training BERT on WikiText-2. Figure (a) demonstrates the joint variation
of effective rank and λmax across the attention heads. Headl
i refers to the ith attention head in the
lth layer. Figure (b-left) illustrates the idea of MAT, which governs the heads training by a dynamic
threshold. Using MAT speeds up convergence and achieves lower validation loss (b-right)."
INTRODUCTION,0.023809523809523808,"Generally, most over-parameterized models consist of various functioning modules connected layer-
wisely, e.g., heads in self-attention models like Transformer (Vaswani et al., 2017), experts in
mixture-of-experts (MoE) blocks (Shazeer et al., 2017b), or filters in convolutional neural networks
(CNN). This module-based architecture inevitably leads to a question: Has the computational
resource been spent efficiently and effectively across modules during model optimization? To this
end, we dive into the modular-level training behaviors of over-parameterized models and pursue a
more efficient and fruitful training strategy. We propose modular Neural Tangent Kernel (mNTK),
which is derived from the vanilla NTK (Jacot et al., 2018; Fort et al., 2020), as a powerful tool for
understanding the fine-grained learning dynamics of each network module. We compute mNTK as the
first-order approximation of a network module’s evolution during training, and it reflects the gradient
correlation among the training data module-wisely. The eigenspectrum of mNTK describes the
learning dynamics of a module, and its principal eigenvalue λmax indicates the degree of consistency
in the gradient direction for learning the most common features in data."
INTRODUCTION,0.027777777777777776,"To illustrate the module-level training dynamics intuitively, we employ the standard BERT (Devlin
et al., 2018) as an example and consider each attention head as a specific module. In addition to λmax,
we adopt the effective rank (Roy & Vetterli, 2007) to measure the effective dimensionality of a feature
matrix, like an attention matrix, and those metrics are computed at the end of each training epoch.
Figure 1(a) presents the trend of training dynamics of BERT, and we can observe asynchronous
learning behaviors across modules and training iterations. We explain those observations using λmax
as an indicator of trainability to measure how effectively gradient descent can optimize network
parameters. As discussed in Bowman & Montufar (2022), the network is biased to learn the top
eigenfunctions of the NTK over the entire input space, while the parameters with very low eigenvalues
barely update. In Figure 1(a), the attention head in blue marker has large λmax, meaning that it
has large consistency over data samples on feature learning and is thus apt to converge with better
trainability. Indeed, these heads contain richer information as reflected through effective rank. In
contrast, λmax of the red attention head oscillates at a low level, likely due to learning diverse features
or even noise that may be hard to converge, and thus updating it brings little benefit to training loss."
INTRODUCTION,0.031746031746031744,"Our analysis (Section 2) on trainability and generalization demonstrates that over-parameterized
models exhibit modularly and temporally varying asynchronous learning behaviors. Modules with
large mNTK principal eigenvalues learn features that are more rapidly learned, and those miniature
ones with limited impact on training loss negatively influence generalization. Such asynchronous
modularly and temporally training dynamics result in inefficient resource utilization by existing
training schemes. Motivated by these analyses, we propose a simple yet effective training method
termed Modular Adaptive Training (MAT), aiming at dynamically training partial modules to improve
training efficiency. As shown in Figure 1(b), we design a dynamic threshold (the dash-dotted line),
according to modular difference and temporal variation of mNTK λmax. MAT only back-propagates
the parameters of those modules whose λmax is larger than the threshold. This forces the network to"
INTRODUCTION,0.03571428571428571,"concentrate on learning the common features and ignore the inconsistent ones, preventing it from
fitting superfluous features or noises. This work makes the following contributions."
INTRODUCTION,0.03968253968253968,"• We empirically and theoretically reveal the associations between modular-level training
dynamics and the proposed modular Neural Tangent Kernel (mNTK)."
INTRODUCTION,0.04365079365079365,"• We propose Modular Adaptive Training (MAT) with a dynamic threshold to selectively
update modules during back-propagation to improve learning efficiency."
INTRODUCTION,0.047619047619047616,"• Experimental results verify that MAT can significantly reduce the training computation,
improve performance, and generalize well to different over-parameterized models."
ANALYSIS OF MODULAR NEURAL TANGENT KERNEL IN OVER-PARAMETERIZED MODELS,0.051587301587301584,"2
Analysis of Modular Neural Tangent Kernel in Over-Parameterized Models"
ANALYSIS OF MODULAR NEURAL TANGENT KERNEL IN OVER-PARAMETERIZED MODELS,0.05555555555555555,"In this section, we first introduce the definition of Neural Tangent Kernel (NTK) and modular
Neural Tangent Kernel (mNTK). Next, we present empirical analysis revealing the eigenspectrum
characteristics of the mNTK, including the imbalanced distribution of mNTK eigenvalues and the
modular and temporal diversity of mNTK eigenvalues during training. Finally, we provide theoretical
analysis to show that trainability of over-parameterized structured models is closely related to
the largest mNTK eigenvalues; on the other hand, learning features associated with the miniature
eigenvalues have negative impact on generalization."
ANALYSIS OF MODULAR NEURAL TANGENT KERNEL IN OVER-PARAMETERIZED MODELS,0.05952380952380952,"2.1
Modular Neural Tangent Kernel (mNTK)"
ANALYSIS OF MODULAR NEURAL TANGENT KERNEL IN OVER-PARAMETERIZED MODELS,0.06349206349206349,"Let X denote the set of n training instance, which are i.i.d. drawn from an unknown distribution D,
and let Y ∈Rnk denotes the targets. We study the network function f parameterized by θ aiming to
map the input vector X to output vector Z, termed as Z = f(X; θ) where θ ∈Rm and Z ∈Rnk.
Following the original definition of Neural Tangent Kernel (NTK) (Jacot et al., 2018; Wang et al.,
2020), we introduce modular NTK for fine-grained analysis of structured deep networks as below."
ANALYSIS OF MODULAR NEURAL TANGENT KERNEL IN OVER-PARAMETERIZED MODELS,0.06746031746031746,"Definition 1 (Modular Neural Tangent Kernel (mNTK)). Suppose model f contains L disjoint mod-
ules θ = {θ1, θ2, . . . , θL} where θl denote the parameters of lth module. We define mNTK as a
matrix by Θl(X, X) = Jθl(X)Jθl(X)⊤, where Jθl = ∇θlf(X; θl) denotes the Jacobian of the
function f at the points X with respect to the lth module’s parameters θl."
ANALYSIS OF MODULAR NEURAL TANGENT KERNEL IN OVER-PARAMETERIZED MODELS,0.07142857142857142,"Θl is a positive semi-definite real symmetric matrix and can be eigen-decomposed as Θl =
UlΛlUl⊤= Pnk
i=1 λl
iul
iul
i
⊤with nk non-negative eigenvalues λ(Θl) = {λl
1, λl
2, ..., λl
nk}. Note
that a network can be partitioned into modules in flexible ways, for example, by dividing layers
within a deep network or components of a network with inherent structures (e.g., attention heads in
Transformer or convolutional filters in a CNN). Since each module has its own mNTK, the integral
NTK of a model can be computed as the sum of mNTKs of each module (Yang & Littwin, 2021):"
ANALYSIS OF MODULAR NEURAL TANGENT KERNEL IN OVER-PARAMETERIZED MODELS,0.07539682539682539,"Θ(X, X)
(i)
= m
X"
ANALYSIS OF MODULAR NEURAL TANGENT KERNEL IN OVER-PARAMETERIZED MODELS,0.07936507936507936,"p=1
Jθp(X)Jθp(X)⊤(ii)
= L
X l=1 X"
ANALYSIS OF MODULAR NEURAL TANGENT KERNEL IN OVER-PARAMETERIZED MODELS,0.08333333333333333,"θp∈θl
Jθl(X)Jθl(X)⊤(iii)
= L
X"
ANALYSIS OF MODULAR NEURAL TANGENT KERNEL IN OVER-PARAMETERIZED MODELS,0.0873015873015873,"l=1
Θl(X, X),
(1)"
ANALYSIS OF MODULAR NEURAL TANGENT KERNEL IN OVER-PARAMETERIZED MODELS,0.09126984126984126,"where (i) decomposes the matrix multiplication into the sum of vector multiplication; (ii) gathers
addends by each module; (iii) follows the definition of mNTK."
EMPIRICAL ANALYSIS,0.09523809523809523,"2.2
Empirical Analysis"
EMPIRICAL ANALYSIS,0.0992063492063492,"In this subsection, we apply BERT to WikiText-2 for language modeling and regard each layer as a
module to analyze the properties of eigenvalue distribution of all mNTKs, as well as the modular and
temporal variation of eigenvalues during the training process."
EMPIRICAL ANALYSIS,0.10317460317460317,"The principal eigenvalue of mNTK dominates the eigenspectrum of mNTK. Figure 2(a) shows
the first 16 eigenvalues of all layer-wise mNTKs at the 10th epoch. Apparently, the eigenvalue
distribution of each layer-wise mNTK is imbalanced where there exists a single large eigenvalue
λl
1 (λ1 will be denoted by λmax hereafter) and a large number of small eigenvalues. In particular,
the largest eigenvalue often has 2 to 4 orders of magnitude larger than that of the rest eigenvalues.
These findings indicate that the principal eigenvalue of mNTK dominates the spectrum of the mNTK."
EMPIRICAL ANALYSIS,0.10714285714285714,"Figure 2: Training dynamics characterized by layer-wise mNTK of BERT trained on WikiText-2. (a):
The first 16 eigenvalues distribution of layer-wise mNTKs at the 10th epoch. (b): Variation of λmax
of layer-wise mNTKs. (c): Variation of κ of layer-wise mNTKs during the first 20 epochs."
EMPIRICAL ANALYSIS,0.1111111111111111,"The phenomenon is also indicated by Xiao et al. (2020) in terms of NTK. Furthermore, according
to the connection between NTK and mNTK (Eq. 1), the spectrum of NTK is dominated by the
principal eigenvalues of all mNTKs. Below, we utilize λmax for fine-grained optimization analysis of
over-parameterized model."
EMPIRICAL ANALYSIS,0.11507936507936507,"The variation of principal eigenvalues of mNTKs is highly asynchronous across modules.
Figure 2(b) shows the variation of λmax of all layer-wise mNTKs during the training process. It is
worth noting that the principal eigenvalues of mNTKs exhibit different trends during the training
process. Intuitively speaking, NTK (also mNTK) captures the training dynamics throughout the
training process, and its principal eigenvector corresponds to the direction of the steepest descent
in loss. Specifically, for mNTKs of shallow layers, the magnitude of λmax is large after model
initialization, and it decreases and converges fast in the early training stages. A potential explanation
is that shallow layers learn simple and common features of data samples (Yosinski et al., 2014; Zhang
et al., 2019), which contribute significantly to model convergence in the early training stages. In
contrast, for mNTK of the deep layer, the magnitude of λmax is small after initialization and gradually
increases during training. The reason is that deep layers learn complex and unique features, relying
on the stability of simple features in shallow layers, which occurs in the later training stages."
EMPIRICAL ANALYSIS,0.11904761904761904,"To analyze the training dynamics, condition number is also commonly used (Xu et al., 2021; Xiao
et al., 2020), defined as κ = λmax/λmin. Figure 2(c) shows the variation of κ for different modules
during training. We observe that the layer-wise condition number exhibits asynchronization among
different modules only in the early training stages (especially the first 10 epochs) and κ of all modules
quickly converges to the same value. This reveals that the condition number is hard to provide
sustained information for fine-grained optimization analysis, unlike the principal eigenvalue which is
capable of capturing the effective information throughout the training process."
EMPIRICAL ANALYSIS,0.12301587301587301,"The temporal variation of the principal eigenvalue of mNTK indicates the generalization ability.
In addition to the above analysis depicting the asynchronization between different modules, we
examine the temporal variation of the principal eigenvalue given a specific module and establish its
connection with the generalization ability. In detail, we train the same model using masked modeling
on half sequence length, which makes the model prone to overfitting. As shown in Figure 3(a), the
validation loss starts to increase from the 45th epoch while the training loss continually decreases.
Figure 3(b-e) present the temporal variation of the principal eigenvalue for the 3rd, 6th, 9th, and 12th
layers of the model during the training process, respectively. During the first 45th epochs, i.e., the
non-overfitting stage, the principal eigenvalues of these layers continually decrease. However, after
the 45th epoch when the model enters the overfitting stage, the principal eigenvalues converge to
excessively low values. A possible reason for overfitting is that the optimization direction of the
model starts to align with the direction of small eigenvalues, which means that the model is learning
superfluous features that are too specific or even noisy."
ANALYSIS OF TRAINABILITY AND GENERALIZATION,0.12698412698412698,"2.3
Analysis of Trainability and Generalization"
ANALYSIS OF TRAINABILITY AND GENERALIZATION,0.13095238095238096,"Using the tool of mNTK, we show that the optimization properties of over-parameterized structured
models are closely related to eigenvalues of mNTKs."
ANALYSIS OF TRAINABILITY AND GENERALIZATION,0.1349206349206349,"Suppose for any module θl, λmin(Θl) = λl
nk > 0. Let L denote the loss function and ∇θL(θ) the
gradient w.r.t parameter θ. For a step of gradient descent, loss reduction can be characterized by the"
ANALYSIS OF TRAINABILITY AND GENERALIZATION,0.1388888888888889,Figure 3: Training dynamics in the overfitting Case of 4-layer BERT trained by 64 token MLM task.
ANALYSIS OF TRAINABILITY AND GENERALIZATION,0.14285714285714285,"directional derivative of the loss function (Wang et al., 2020):"
ANALYSIS OF TRAINABILITY AND GENERALIZATION,0.14682539682539683,"∆L
(i)
= lim
ϵ→0
L(θ + ϵ∇θL(θ)) −L(θ) ϵ"
ANALYSIS OF TRAINABILITY AND GENERALIZATION,0.15079365079365079,"(ii)
≈∇θL(θ)⊤∇θL(θ)"
ANALYSIS OF TRAINABILITY AND GENERALIZATION,0.15476190476190477,"(iii)
= ∇ZL(θ)⊤(∇θf(θ)⊤∇θf(θ))∇ZL(θ)"
ANALYSIS OF TRAINABILITY AND GENERALIZATION,0.15873015873015872,"(iv)
= ∇ZL(θ)⊤( L
X"
ANALYSIS OF TRAINABILITY AND GENERALIZATION,0.1626984126984127,"l=1
Θl)∇ZL(θ)
(v)
= L
X l=1 nk
X"
ANALYSIS OF TRAINABILITY AND GENERALIZATION,0.16666666666666666,"i=1
λl
i

ul
i
⊤Y
2
, (2)"
ANALYSIS OF TRAINABILITY AND GENERALIZATION,0.17063492063492064,"where (i) follows the definition of directional derivative; (ii) follows the first-order Taylor expansion;
(iii) follows chain rule of derivative; (iv) follows Eq. 1; and (v) follows the eigen-decomposition of
mNTK under the assumption of squared error loss (Arora et al., 2019). Following the work of Arora
et al. (2019), we assume that true labels align well with top eigenvectors, i.e., (ul
i
⊤Y)2 is large for
large λl
i. Thus, the directional derivative of the loss function can be regarded as closely related to the
eigenspectrum of mNTKs."
ANALYSIS OF TRAINABILITY AND GENERALIZATION,0.1746031746031746,(1) The relation between trainability and principal eigenvalues of mNTKs.
ANALYSIS OF TRAINABILITY AND GENERALIZATION,0.17857142857142858,"Based on the first observation of empirical analysis, i.e., the spectrum of each mNTK is dominated by
the principal eigenvalues, we utilize λmax of mNTKs as the nearly equivalent proxy of the spectrum
of mNTKs. Therefore, Eq. 2 is simplified as: ∆L ≈ L
X"
ANALYSIS OF TRAINABILITY AND GENERALIZATION,0.18253968253968253,"l=1
λl
max

ul
1
⊤Y
2
.
(3)"
ANALYSIS OF TRAINABILITY AND GENERALIZATION,0.1865079365079365,"The above equation suggests that the loss decreases faster along the eigenspaces that correspond to
larger eigenvalues. Given the fact that the principal eigenvalues of mNTKs are highly asynchronous
across modules, we suggest selectively training the modules that are active with larger λl
max to
achieve efficient learning with limited computational resources."
ANALYSIS OF TRAINABILITY AND GENERALIZATION,0.19047619047619047,(2) The relation between generalization ability and eigenvalues of mNTKs.
ANALYSIS OF TRAINABILITY AND GENERALIZATION,0.19444444444444445,"Figure 4: The normalized eigen-spectrum distribu-
tion exhibits two distinct regions, termed informa-
tion space and nuisance space."
ANALYSIS OF TRAINABILITY AND GENERALIZATION,0.1984126984126984,"Figure 4 shows the eigen-spectrum distribution
of a 4-layer BERT model at the 10th epoch,
by regarding each head as a module and cal-
culating 256 eigenvalues for each head. Among
all 4×12×256 eigenvalues, the distribution of
eigen-spectrum exhibits two distinct regions: the
left region with a large number of small eigen-
values and the right region with a small number
of large eigenvalues. The two regions are widely
separated. According to Eq. 3, the eigenspaces
corresponding to miniature eigenvalues in the
left region have negligible impact on training
loss minimization, while those in the right re-
gion make dominant contributions. Following
the definition of Oymak et al. (2019), we refer
to the right region as the information space where the training error decreases rapidly, and the left
region as the nuisance space where training is slow and may cause overfitting."
ANALYSIS OF TRAINABILITY AND GENERALIZATION,0.20238095238095238,"Model training with more parameter updates tends to have longer distance to the initializations
θ0 (Hoffer et al., 2017). Based on Lemma 5.4 in Arora et al. (2019), longer distance results in
relatively larger Rademacher complexity, as R ∝∥θ −θ0∥F , and larger R results in relatively worse
generalization. As a consequence, we suggest selectively stopping the training in some modules so as
to stop the increase of the distance to the initializations in these directions. Specifically, we propose
to stop training the modules with principal eigenvalues falling into the nuisance space so as to enjoy
better generalization and efficient learning simultaneously."
ANALYSIS OF TRAINABILITY AND GENERALIZATION,0.20634920634920634,"Let’s consider the inter-module training dynamics on model generalization. During the training
process, given modules with variant principal eigenvalues, it often occurs that even though a small
number of modules still lie in the information space, the most of others already fall into the nuisance
space. The modules located in the information space, i.e., those with principal eigenvalues exceeding
the threshold, are trained to learn informative features that facilitate loss minimization. Conversely,
the modules falling into the nuisance space, i.e., those with principal eigenvalues below the threshold,
are prone to learn superfluous or even noise features, which significantly increase the Rademacher
complexity, and deteriorate their generalization ability. This analysis indicates that the existing
training scheme overlooks the asynchronization among modules, resulting in inefficient utilization of
the computational resource for loss minimization during model training."
MODULAR ADAPTIVE TRAINING,0.21031746031746032,"3
Modular Adaptive Training"
MODULAR ADAPTIVE TRAINING,0.21428571428571427,"Based on the analysis in the previous section, we advocate dynamically optimizing partial module
parameters in back propagation, termed as Modular Adaptive Training (MAT). The forward propa-
gation is computed as usual; during back propagation, MAT quantifies module parameters in terms
of modular policy and temporal policy such that only subsets of modules are updated. Below, we
present the proposed modular policy and temporal policy. Algorithm 1 summarizes the proposed
MAT algorithm."
MODULAR ADAPTIVE TRAINING,0.21825396825396826,"Modular Policy. Following the analysis that trainability and generalization of an over-parameterized
model are related to the principal eigenvalues of module parameters, we propose to only update
partial module parameters with λmax greater than a certain threshold during the model training; this
policy is termed as modular policy."
MODULAR ADAPTIVE TRAINING,0.2222222222222222,"Specifically, suppose the model parameters consist of L module parameters and each mNTK has nk
positive eigenvalues, and let λl
i denote ith eigenvalue of the mNTK computed over the parameters
θl. We define eΛ = {λl
i}nk,L
i,l=1 as the set of eigenvalues calculated over all mNTKs, and eλmax, eλmin
as the maximum and minimum value of the set eΛ, respectively. To select the appropriate modules,
we introduce a hyperparameter ratio α ∈(0, 1), thus the corresponding eigenvalue threshold λα is
computed as:"
MODULAR ADAPTIVE TRAINING,0.2261904761904762,"λα = eλmin + (eλmax −eλmin) × α.
(4)"
MODULAR ADAPTIVE TRAINING,0.23015873015873015,"According to the eigenvalue threshold λα, all modules are split into information modules and nuisance
modules as:
It = {θl|λmax(Θl
t) ≥λα}, Nt = {θl|λmax(Θl
t) < λα}.
(5)"
MODULAR ADAPTIVE TRAINING,0.23412698412698413,"As a result, the computation cost of back propagation is reduced."
MODULAR ADAPTIVE TRAINING,0.23809523809523808,"We empirically observe that α ∈(0, 1) is relatively stable over the training process for a certain model
and dataset. Therefore, α can be empirically assigned at the early stage of training after warming up,
or automatically learned by a meta network."
MODULAR ADAPTIVE TRAINING,0.24206349206349206,"Temporal Policy. The previous empirical analysis shows that during training, after the eigenvalues
of a module’s mNTK enter the nuisance region, further training this module can lead to poor
generalization. Therefore, to avoid overfitting, we terminate the training of this module according to
the temporal variation of the principal eigenvalue; we call this the temporal policy."
MODULAR ADAPTIVE TRAINING,0.24603174603174602,"For each module θl, its principal eigenvalue after warming up is recorded as the initial value
λmax(Θl
0). During each training episode t, the temporal variation of principal eigenvalue is defined
as ∆l
t = |λmax(Θl
t) −λmax(Θl
0)|. The information modules will be early stopped if the difference
in the temporal variation between two subsequent episodes relative to the initial variation is smaller"
MODULAR ADAPTIVE TRAINING,0.25,"than a pre-defined threshold β:
|∆l
t −∆l
t−1|
∆l
1
< β.
(6)"
MODULAR ADAPTIVE TRAINING,0.25396825396825395,β is empirically bounded by eigenvalue variation within the nuisance region.
RELATED WORK,0.25793650793650796,"4
Related Work"
RELATED WORK,0.2619047619047619,"Algorithm 1 Modular Adaptive Training
Require: training data {xi, yi}n
i=1, sample number S, modules
set M, modular threshold α, temporal threshold β.
1: I, N = M, ∅
2: while not converged and |I| > 0 do
3:
Compute ∇θf(x; θ) for samples {xi, yi}S
i=1
4:
eΛ = ∅
5:
for θl in M do
6:
Θl = ∇θlf(x; θ)∇θlf(x; θ)⊤"
