Section,Section Appearance Order,Paragraph
PREFERENCE PREDICTION,0.6104651162790697,"1300
1350
1400
1450
1500
1550
1600
1650
Users 1300 1350 1400 1450 1500 1550 1600 1650 1700 HPS"
PREFERENCE PREDICTION,0.6162790697674418,Spearman R=0.670
PREFERENCE PREDICTION,0.622093023255814,"Model Ratings
Fit"
PREFERENCE PREDICTION,0.627906976744186,"1300
1350
1400
1450
1500
1550
1600
1650
Users 1300 1350 1400 1450 1500 1550 1600 1650 1700"
PREFERENCE PREDICTION,0.6337209302325582,PickScore
PREFERENCE PREDICTION,0.6395348837209303,Spearman R=0.790
PREFERENCE PREDICTION,0.6453488372093024,"Model Ratings
Fit"
PREFERENCE PREDICTION,0.6511627906976745,"Figure 7: Correlation between Elo ratings of real users and Elo ratings by CLIP-H, ImageReward [18],
HPS [17], and PickScore."
MODEL EVALUATION,0.6569767441860465,"5
Model Evaluation"
MODEL EVALUATION,0.6627906976744186,"Despite significant progress in the generative capabilities of text-to-image models, the standard
and most popular prompt dataset has remained the Microsoft Common Objects in Context dataset
(MS-COCO) [9]. Similarly, the Fréchet Inception Distance (FID) [5] is still the main metric used for
model evaluation. In this section, we explain why we recommend researchers to evaluate their models
using prompts from Pick-a-Pic rather than (or at least alongside) MS-COCO, and show that when
evaluating state-of-the-art text-to-image models, PickScore is more aligned with human judgments
than other automatic evaluation metrics."
MODEL EVALUATION,0.6686046511627907,"Model Evaluation Prompts
The prompts contained in the MS-COCO dataset are captions of
photographs taken by amateur photographers, depicting objects and humans in everyday settings.
While certain captions within this dataset may pose a challenge to text-to-image models, it is evident
that the scope of interest for text-to-image users extends beyond commonplace objects and humans.
Moreover, the main use-case of image generation is arguably to generate fiction, which cannot be
captured by camera. By construction, Pick-a-Pic’s prompts are sampled from real users, and thus
better represent the natural distribution of text-to-image intents. We therefore strongly advocate
that the research community employ prompts from Pick-a-Pic when assessing the performance of
text-to-image models."
MODEL EVALUATION,0.6744186046511628,"FID
The FID metric [5] gauges the degree of resemblance between a set of generated images and a
set of authentic images, at the set level. To do so, it first embeds the real and generated images into"
MODEL EVALUATION,0.6802325581395349,"the feature space of an Inception net [15], and then estimates the mean and covariance of both sets of
images and calculates their similarity. FID is thus geared towards measuring the realism of a set of
images, but is oblivious to the prompts. In contrast, PickScore provides a per-instance score, and is
directly conditioned on the prompt. We thus hypothesize that PickScore will correlate better with
human judgements of generation quality."
MODEL EVALUATION,0.686046511627907,"To empirically test our hypothesis with the most “convenient” settings for the FID metric, we select
100 random captions from MS-COCO validation split. For each caption, we generate images from 9
different models based on the same set of prompts, and ask human experts to rank the 9 generated
images (with ties), inducing pairwise preferences. Specifically, we use Stable Diffusion 1.5, Stable
Diffusion 2.1, and Dreamlike Photoreal 2.0 combined with three different classifier-free guidance
scales (3, 6, and 9). We then repeat the labeling process (over the same images) using FID, and
PickScore instead of humans to determine preferences. Since FID does not operate on a per-example
base, when “labeling” with FID, we simply choose the model that has a lower (better) FID score on
MS-COCO."
MODEL EVALUATION,0.6918604651162791,"Figure 6 shows the correlation between model win rates induced by human rankings (horizontal) and
model win rates induced by each automatic scoring function. PickScore exhibits a stronger correlation
(0.917) with human raters on MS-COCO captions than FID (-0.900), which surprisingly, exhibits a
strong negative correlation. As FID is oblivious to the prompt, one would expect zero correlation, and
not a strong negative correlation. We hypothesize that this is related to the classifier-free guidance
scale hyperparameter – larger scales tend to produce more vivid images (which humans typically
prefer), but differ from the distribution of ground truth images in MS-COCO, yielding worse (higher)
FID scores. Figure 5 visualizes these differences by presenting pairs of images generated with the
same random seed but with different classifier-free guidance (CFG) scales."
MODEL EVALUATION,0.6976744186046512,"Other Evaluation Metrics
When comparing with evaluation metrics that do not assume a set of
ground truth images, we are able to use a more reliable evaluation procedure. In this evaluation
procedure, we consider real user preferences rather than human annotators, as well as more models
(i.e. more data points). Specifically, we take all the 14,000 collected preferences that correspond to
prompts from the Pick-a-Pic test set. This set of examples contains images generated by 45 different
models – four different backbone models, each with different guidance scales. We then use these real
user preferences to calculate Elo ratings [4] for the different models. Afterward, we repeat the process
while replacing the real user preferences with CLIP-H [7], and PickScore predictions. Similarly to
Section 4, we also compare against the concurrent work from ImageReward[18] and HPS [17]. Since
the Elo rating system is iterative by nature, we repeat the process 50 times. Each time we randomly
shuffle the order of examples, and calculate the correlation with human ratings. Finally, for each
metric, we output the mean and standard deviation of its 50 corresponding correlations. Figure 7
displays the correlation between real users’ Elo ratings with the different metrics’ rating, showing
that PickScore exhibits a stronger correlation (0.790 ± 0.054) with real users than all other automatic
metrics, namely CLIP-H (0.313 ± 0.075), ImageReward (0.492 ± 0.086), and HPS (0.670 ± 0.071)."
TEXT-TO-IMAGE RANKING,0.7034883720930233,"6
Text-to-Image Ranking"
TEXT-TO-IMAGE RANKING,0.7093023255813954,"Another possible application for scoring functions is improving the performance of generations made
by text-to-image models through ranking: generate a sample of images, and select the one with
the highest score. To test this approach, we generate one hundred images for each prompt of the
one hundred prompts we take from the Pick-a-Pic test set. We generate the images with Dreamlike
Photoreal 2.0, using a classifier-free guidance scale of 7.5, and to increase image diversity, we use 5
initial random noises and 20 different prompt templates. These templates include the null template
“[prompt]” and other templates like “breathtaking [prompt]. award-winning, professional, highly
detailed”. From each set of 100 generated images, we select the best one according to PickScore,
CLIP-H, the aesthetics score, or randomly; in addition, we randomly select one image from the null
template for control. We then ask expert human annotators to compare PickScore’s chosen image to
each of the other functions’ choices, and decide which one they prefer."
TEXT-TO-IMAGE RANKING,0.7151162790697675,"Table 2 shows that PickScore consistently selects more preferable images than the baselines. By
manually analyzing some examples, we find that PickScore typically selects images that are both
more aesthetic and better aligned with the prompt. We also measure this explicitly by using the
aesthetic scoring function instead of a human rater when comparing PickScore’s choice to CLIP-H’s,"
TEXT-TO-IMAGE RANKING,0.7209302325581395,"Table 2: Percentage of instances where humans prefer PickScore’s choice over another scoring
function’s choice when selecting one image out of 100."
TEXT-TO-IMAGE RANKING,0.7267441860465116,"Comparison
Win Rate"
TEXT-TO-IMAGE RANKING,0.7325581395348837,"PickScore vs Random Seed
+ Null Template
71.4
+ Random Template
82.0"
TEXT-TO-IMAGE RANKING,0.7383720930232558,"PickScore vs Aesthetics [14]
85.1
PickScore vs CLIP-H [7]
71.3"
TEXT-TO-IMAGE RANKING,0.7441860465116279,"“Highway to hell”  
“A private futuristic cabin on… mars…”  
Vanilla
PickScore"
TEXT-TO-IMAGE RANKING,0.75,"“A bee devouring the world”
“Silver furred Lion man hybrid…”
Vanilla
PickScore
Vanilla
PickScore
Vanilla
PickScore"
TEXT-TO-IMAGE RANKING,0.7558139534883721,"“Superman’s cropse found”  
“A cute fluffy easter bunny singing”  
“A mushroom inspired car concept”
“Car made of zebra skin”"
TEXT-TO-IMAGE RANKING,0.7616279069767442,"Figure 8: Comparing the image from the vanilla text-to-image model (left) with the image selected
by PickScore from a set of 100 generations (right)."
TEXT-TO-IMAGE RANKING,0.7674418604651163,"and find that for 68.5% of the prompts, PickScore selects an image with a higher aesthetic score.
Likewise, when comparing PickScore to the aesthetic scorer, 90.5% of PickScore’s choices have
a higher CLIP-H text-alignment score than the images chosen by the aesthetic scorer. Figure 8
visualizes the benefits of selecting images with PickScore."
RELATED WORK,0.7732558139534884,"7
Related Work"
RELATED WORK,0.7790697674418605,"Collecting and learning from human preferences is an active area of research in natural language
processing (NLP) [3, 1, 10]. However, in the domain of text-to-image generation, related research
questions have received little attention. One notable work that focuses on collecting human judgments
in text-to-image generation is the Simulacra Aesthetic Captions (SAC) dataset [11]. This dataset
contains almost 200,000 human ratings of generated images. However, unlike Pick-a-Pic which
focuses on general user preferences, and allows users to compare between generated images, the
human raters of SAC provide an absolute score for the aesthetic quality of the generated images."
RELATED WORK,0.7848837209302325,"There has been some concurrent work that involves collection and learning from human preferences
that we describe below. Lee et al. [8] consider three simple categories of challenges (count, color,
and background), enumerating through templates (e.g. “[number] dogs”) to synthetically create
prompts. Then, they instruct crowd workers to choose if a generated image is good or bad and use
the collected 30,000 examples to train a scoring function. In contrast, Pick-a-Pick allows real users to
write any prompts they choose, and provide pairwise comparisons between images that yield more
than 500,000 examples."
RELATED WORK,0.7906976744186046,"ImageReward [18] selects prompts and images from the DiffusionDB dataset [16], and collects for
them image preference ratings via crowd workers. Since they employ crowd workers that lack the
intrinsic motivation to select images that they prefer, the authors define criteria to assess the quality
of generated images and instruct crowd workers to follow these criteria when ranking images. They
use this strategy to collect 136,892 examples which originate from 8,878 prompts. Importantly, they
have not publicly released this dataset. For completeness, we tested ImageReward on the Pick-a-Pic
dataset and confirmed that PickScore outperforms it."
RELATED WORK,0.7965116279069767,"Another concurrent work from Wu et al. [17] collects a dataset of human judgments by scraping about
25,000 human ratings (which include about 100,000 images) from the Discord channel of StabilityAI.
Similarly to us, they use an objective analogous to that of InstructGPT to train a scoring function that
they name Human Preference Score (HPS). As with ImageReward, we evaluated HPS on Pick-a-Pic
and saw that PickScore achieves better performance."
RELATED WORK,0.8023255813953488,"The observed superior performance of PickScore over the concurrent work from both HPS and
ImageReward on the Pick-a-Pic dataset could be attributed to several factors. For example, differences
in implementation (e.g., model size, backbone, hyperparameters), differences in the scales of data, or
variations in the distribution of data. Notably, Pick-a-Pic is more than five times larger than the data
used to train HPS and ImageReward. Furthermore, ImageReward collects judgments from crowd
workers, which may lead to significant differences in data distribution. In contrast, HPS scrapes
ratings from the StabilityAI discord channel for real text-to-image users but may be more aligned
with this more specific distribution of text-to-image users. We leave Isolating and identifying the
specific effects of these factors for future work."
LIMITATIONS AND BROADER IMPACT,0.8081395348837209,"8
Limitations and Broader Impact"
LIMITATIONS AND BROADER IMPACT,0.813953488372093,"It is important to acknowledge that despite our efforts to ensure data quality (see section 2), some
images and prompts may contain NSFW content that could potentially bias the data, and some
users may have made judgments without due care. Moreover, the preferences of users may include
biases that may be reflected in the collected data. These limitations may affect the overall quality
and reliability of the data collected and should be taken into consideration when considering the
broader impact of the dataset. Nonetheless, we believe that the advantages of collecting data from
intrinsically-motivated users and publicly releasing it will enable the text-to-image community to
better align text-to-image models with human preferences."
CONCLUSIONS,0.8197674418604651,"9
Conclusions"
CONCLUSIONS,0.8255813953488372,"We build a web application that serves text-to-image users and (willingly) collects their preferences.
We use the collected data and present the Pick-a-Pic dataset: an open dataset of over half-a-million
examples of text-to-image prompts, generated images, and user-labeled preferences. The quantity and
quality of the data enables us to train PickScore, a state-of-the-art text-image scoring function, which
achieves superhuman performance when predicting user preferences. PickScore aligns better with
human judgements than any other publicly-available automatic metric, and together with Pick-a-Pic’s
natural distribution prompts, enables much more relevant text-to-image model evaluation than existing
evaluation standards, such as FID over MS-COCO. Finally, we demonstrate the effectiveness of using
our scoring function for selecting images in improving the quality of text-to-image models. There
are still many opportunities for building upon Pick-a-Pic and PickScore, such as RLHF and other
alignment approaches, and we are excited to see how the research community will utilize this work in
the near future."
REFERENCES,0.8313953488372093,References
REFERENCES,0.8372093023255814,"[1] Yuntao Bai, Andy Jones, Kamal Ndousse, Amanda Askell, Anna Chen, Nova DasSarma, Dawn Drain,
Stanislav Fort, Deep Ganguli, T. J. Henighan, Nicholas Joseph, Saurav Kadavath, John Kernion, Tom
Conerly, Sheer El-Showk, Nelson Elhage, Zac Hatfield-Dodds, Danny Hernandez, Tristan Hume, Scott
Johnston, Shauna Kravec, Liane Lovitt, Neel Nanda, Catherine Olsson, Dario Amodei, Tom B. Brown,
Jack Clark, Sam McCandlish, Christopher Olah, Benjamin Mann, and Jared Kaplan. Training a helpful
and harmless assistant with reinforcement learning from human feedback. ArXiv, abs/2204.05862, 2022."
REFERENCES,0.8430232558139535,"[2] Xinlei Chen, Hao Fang, Tsung-Yi Lin, Ramakrishna Vedantam, Saurabh Gupta, Piotr Dollár, and
C. Lawrence Zitnick.
Microsoft coco captions:
Data collection and evaluation server.
ArXiv,
abs/1504.00325, 2015."
REFERENCES,0.8488372093023255,"[3] Paul Francis Christiano, Jan Leike, Tom B. Brown, Miljan Martic, Shane Legg, and Dario Amodei. Deep
reinforcement learning from human preferences. ArXiv, abs/1706.03741, 2017."
REFERENCES,0.8546511627906976,"[4] Arpad E. Elo. The rating of chessplayers, past and present. 1978."
REFERENCES,0.8604651162790697,"[5] Martin Heusel, Hubert Ramsauer, Thomas Unterthiner, Bernhard Nessler, and Sepp Hochreiter. Gans
trained by a two time-scale update rule converge to a local nash equilibrium. In NIPS, 2017."
REFERENCES,0.8662790697674418,"[6] Jonathan Ho. Classifier-free diffusion guidance. ArXiv, abs/2207.12598, 2022."
REFERENCES,0.872093023255814,"[7] Gabriel Ilharco, Mitchell Wortsman, Ross Wightman, Cade Gordon, Nicholas Carlini, Rohan Taori, Achal
Dave, Vaishaal Shankar, Hongseok Namkoong, John Miller, Hannaneh Hajishirzi, Ali Farhadi, and Ludwig
Schmidt. Openclip, July 2021. If you use this software, please cite it as below."
REFERENCES,0.877906976744186,"[8] Kimin Lee, Hao Liu, Moonkyung Ryu, Olivia Watkins, Yuqing Du, Craig Boutilier, P. Abbeel, Mohammad
Ghavamzadeh, and Shixiang Shane Gu. Aligning text-to-image models using human feedback. ArXiv,
abs/2302.12192, 2023."
REFERENCES,0.8837209302325582,"[9] Tsung-Yi Lin, Michael Maire, Serge J. Belongie, James Hays, Pietro Perona, Deva Ramanan, Piotr Dollár,
and C. Lawrence Zitnick. Microsoft coco: Common objects in context. In ECCV, 2014."
REFERENCES,0.8895348837209303,"[10] Long Ouyang, Jeff Wu, Xu Jiang, Diogo Almeida, Carroll L. Wainwright, Pamela Mishkin, Chong Zhang,
Sandhini Agarwal, Katarina Slama, Alex Ray, John Schulman, Jacob Hilton, Fraser Kelton, Luke E. Miller,
Maddie Simens, Amanda Askell, Peter Welinder, Paul Francis Christiano, Jan Leike, and Ryan J. Lowe.
Training language models to follow instructions with human feedback. ArXiv, abs/2203.02155, 2022."
REFERENCES,0.8953488372093024,"[11] John David Pressman, Katherine Crowson, and Simulacra Captions Contributors. Simulacra aesthetic
captions. Technical Report Version 1.0, Stability AI, 2022.
url https://github.com/JD-P/simulacra-
aesthetic-captions ."
REFERENCES,0.9011627906976745,"[12] Alec Radford, Jong Wook Kim, Chris Hallacy, Aditya Ramesh, Gabriel Goh, Sandhini Agarwal, Girish
Sastry, Amanda Askell, Pamela Mishkin, Jack Clark, Gretchen Krueger, and Ilya Sutskever. Learning
transferable visual models from natural language supervision. In International Conference on Machine
Learning, 2021."
REFERENCES,0.9069767441860465,"[13] Robin Rombach, A. Blattmann, Dominik Lorenz, Patrick Esser, and Björn Ommer. High-resolution image
synthesis with latent diffusion models. 2022 IEEE/CVF Conference on Computer Vision and Pattern
Recognition (CVPR), pages 10674–10685, 2021."
REFERENCES,0.9127906976744186,"[14] Christoph Schuhmann, Romain Beaumont, Richard Vencu, Cade W Gordon, Ross Wightman, Mehdi
Cherti, Theo Coombes, Aarush Katta, Clayton Mullis, Mitchell Wortsman, Patrick Schramowski, Srivatsa R
Kundurthy, Katherine Crowson, Ludwig Schmidt, Robert Kaczmarczyk, and Jenia Jitsev. LAION-5b: An
open large-scale dataset for training next generation image-text models. In Thirty-sixth Conference on
Neural Information Processing Systems Datasets and Benchmarks Track, 2022."
REFERENCES,0.9186046511627907,"[15] Christian Szegedy, Vincent Vanhoucke, Sergey Ioffe, Jonathon Shlens, and Zbigniew Wojna. Rethinking
the inception architecture for computer vision. 2016 IEEE Conference on Computer Vision and Pattern
Recognition (CVPR), pages 2818–2826, 2015."
REFERENCES,0.9244186046511628,"[16] Zijie J. Wang, Evan Montoya, David Munechika, Haoyang Yang, Benjamin Hoover, and Duen Horng
Chau. Diffusiondb: A large-scale prompt gallery dataset for text-to-image generative models. ArXiv,
abs/2210.14896, 2022."
REFERENCES,0.9302325581395349,"[17] Xiaoshi Wu, Keqiang Sun, Feng Zhu, Rui Zhao, and Hongsheng Li. Better aligning text-to-image models
with human preference. ArXiv, abs/2303.14420, 2023."
REFERENCES,0.936046511627907,"[18] Jiazheng Xu, Xiao Liu, Yuchen Wu, Yuxuan Tong, Qinkai Li, Ming Ding, Jie Tang, and Yuxiao
Dong. Imagereward: Learning and evaluating human preferences for text-to-image generation. ArXiv,
abs/2304.05977, 2023."
REFERENCES,0.9418604651162791,Appendix
REFERENCES,0.9476744186046512,Comparing Pick-a-Pic Prompts with MS-COCO Captions
REFERENCES,0.9534883720930233,"To illustrate the difference between MS-COCO captions and Pick-a-Pic prompts we show prompts
from each dataset."
REFERENCES,0.9593023255813954,"Pick-a-Pic – “forest with ruins, photo”, “A panda bear as a mad scientist”, “product photo of a
sneakers”, “photo of a bicycle, detailed, 8k uhd, dslr, high quality, film grain, Fujifilm XT3”, “female
portrait photo”, “Alexander the great, cover art, colorful”, “A galactic eldritch squid towering over
the planet Earth, stars, galaxies and nebulas in the background...”, “Portrait of a giant, fluffy, ninja
teddy bear”, “insanely detailed portrait, darth vader, shiny, extremely intricate, high res, 8k, award
winning”, “Giant ice cream cone melting and creating a river through a city”."
REFERENCES,0.9651162790697675,"MS-COCO – “A man with a red helmet on a small moped on a dirt road.”, “A woman wearing
a net on her head cutting a cake.”, “there is a woman that is cutting a white cake”, “a little boy
wearing headphones and looking at a computer monitor”, “A young girl is preparing to blow out her
candle.”, “A commercial stainless kitchen with a pot of food cooking.”, “Two men that are standing
in a kitchen.”, “A man riding a bike past a train traveling along tracks.”, “The pantry door of the small
kitchen is closed.”, “A man is doing a trick on a skateboard”."
REFERENCES,0.9709302325581395,Training a Scoring Function
REFERENCES,0.9767441860465116,"We further explored an alternative loss function that is closer to CLIP’s original objective. In this loss
function, we also incorporate the remaining examples in the batch as in-batch negatives. To elaborate,
considering the notation established in section 3 and yk
1, yk
2 denoting the images corresponding to the
k-th example in the batch, we formulate ˆpk as follows:"
REFERENCES,0.9825581395348837,"ˆpk
i =
exp s(x, yi)
P"
REFERENCES,0.9883720930232558,"k
P2
j=1 exp s(x, yk
j )
(4)"
REFERENCES,0.9941860465116279,"We anticipated that this objective function would maintain the general capabilities of CLIP with
minimal loss in performance. However, our findings demonstrated that PickScore significantly
outperforms this objective function, as the latter only produced a scoring function that achieves an
accuracy of 65.2 on the Pick-a-Pic test set."
