Section,Section Appearance Order,Paragraph
ABSTRACT,0.0,Abstract
ABSTRACT,0.005813953488372093,"The ability to collect a large dataset of human preferences from text-to-image
users is usually limited to companies, making such datasets inaccessible to the
public. To address this issue, we create a web app that enables text-to-image
users to generate images and specify their preferences. Using this web app we
build Pick-a-Pic, a large, open dataset of text-to-image prompts and real users’
preferences over generated images. We leverage this dataset to train a CLIP-based
scoring function, PickScore, which exhibits superhuman performance on the task
of predicting human preferences. Then, we test PickScore’s ability to perform
model evaluation and observe that it correlates better with human rankings than
other automatic evaluation metrics. Therefore, we recommend using PickScore for
evaluating future text-to-image generation models, and using Pick-a-Pic prompts
as a more relevant dataset than MS-COCO. Finally, we demonstrate how PickScore
can enhance existing text-to-image models via ranking.1"
ABSTRACT,0.011627906976744186,“jedi duck holding a lightsaber”
ABSTRACT,0.01744186046511628,“a square green owl made of fimo”
ABSTRACT,0.023255813953488372,“Two-faced biomechanical cyborg...”
ABSTRACT,0.029069767441860465,"“insanely detailed portrait, wise man”"
ABSTRACT,0.03488372093023256,“A bird with 8 spider legs”
ABSTRACT,0.040697674418604654,“A butterfly flying above an ocean”
ABSTRACT,0.046511627906976744,"Figure 1: Images generated via our web application, showing darkened non-preferred images (left)
and preferred images (right)."
ABSTRACT,0.05232558139534884,1https://github.com/yuvalkirstain/PickScore
INTRODUCTION,0.05813953488372093,"1
Introduction"
INTRODUCTION,0.06395348837209303,"Recent advances in aligning language models with user behaviors and expectations have placed a
significant emphasis on the ability to model user preferences [10, 1, 3]. However, little attention has
been paid to this ability in the realm of text-to-image generation. This lack of attention can largely be
attributed to the absence of a large and open dataset of human preferences over state-of-the-art image
generation models."
INTRODUCTION,0.06976744186046512,"To fill this void, we create a web application that enables users to generate images using state-of-the-
art text-to-image models while specifying their preferences. With explicit consent from the users, we
collect their prompts and preferences to create Pick-a-Pic, a publicly available dataset comprising
over half-a-million examples of human preferences over model-generated images.2 Each example in
our dataset includes a prompt, two generated images, and a label indicating the preferred image, or a
tie when no image is significantly preferred over the other. Notably, Pick-a-Pic was created by real
users with a genuine interest in generating images. This interest differs from that of crowd workers
who lack the intrinsic motivation to produce creative prompts or the original intent of the prompt’s
author to judge which image better aligns with their needs."
INTRODUCTION,0.0755813953488372,"Tapping into authentic user preferences allows us to train a scoring function that estimates the user’s
satisfaction from a particular generated image given a prompt. To train such a scoring function
we finetune CLIP-H [12, 7] using human preference data and an analogous objective to that of
InstructGPT’s reward model [10]. This objective aims to maximize the probability of a preferred
image being picked over an unpreferred one, or even the probability in cases of a tie. We find that the
resulting scoring function, PickScore3, achieves superhuman performance in the task of predicting
user preferences (a 70.5% accuracy rate, compared to humans’ 68.0%), while zero-shot CLIP-H
(60.8%) and the popular aesthetics predictor [14] (56.8%) perform closer to chance (56.8%)."
INTRODUCTION,0.08139534883720931,"Equipped with a dataset for human preferences and a state-of-the-art scoring function, we propose
updating the standard protocol for evaluating text-to-image generation models. First, we suggest that
researchers evaluate their text-to-image models using prompts from Pick-a-Pic, which better represent
what humans want to generate than mundane captions, such as those found in MS-COCO [2, 9].
Second, to compare PickScore with FID, we conduct a human evaluation study and find that even
when evaluated against MS-COCO captions, PickScore exhibits a strong correlation with human
preferences (0.917), while ranking with FID yields a negative correlation (-0.900). Importantly, we
also compare PickScore with other evaluation metrics using model rankings inferred from real user
preferences. We observe that PickScore is more strongly correlated with ground truth rankings, as
determined by real users, than other evaluation metrics. Thus, we recommend using PickScore as a
more reliable evaluation metric than existing ones."
INTRODUCTION,0.0872093023255814,"Finally, we explore how PickScore can improve the quality of vanilla text-to-image models via
ranking. To accomplish this, we generate images with different initial random noises as well as
different templates (e.g. “breathtaking [prompt]. award-winning, professional, highly detailed”) to
slightly alter the user prompt. We then test the impact of selecting the top image according to different
scoring functions. Our findings indicate that human raters prefer images selected by PickScore more
than those selected by CLIP-H [7] (win rate of 71.3%), an aesthetics predictor [14] (win rate of
85.1%), and the vanilla text-to-image model (win rate of 71.4%)."
INTRODUCTION,0.09302325581395349,"In summary, the presented work addresses a gap in the field of text-to-image generation by creating a
large, open, high-quality dataset of human preferences over user-prompted model-generated images.
We demonstrate the potential of this dataset by training a scoring function, PickScore, which exhibits a
performance superior to any other publicly-available automatic scoring function, in predicting human
preferences, evaluating text-to-image models, and improving them via ranking. We encourage the
research community to adopt Pick-a-Pic and PickScore as a basis for further advances in text-to-image
modeling and incorporating human preferences into the learning process."
INTRODUCTION,0.09883720930232558,"2We recently open-sourced a new version of the Pick-a-Pic dataset that has more than one million examples.
3The model is available at https://huggingface.co/yuvalkirstain/PickScore_v1"
INTRODUCTION,0.10465116279069768,"(a)
(b)
(c)"
INTRODUCTION,0.11046511627906977,"Figure 2: How Pick-a-Pic data is collected through the app: (a) the user first writes a caption, and
receives two images; (b) the user makes a preference judgment; (c) a new image is presented instead
of the rejected image. This flow repeats itself until the user changes the prompt."
PICK-A-PIC DATASET,0.11627906976744186,"2
Pick-a-Pic Dataset"
PICK-A-PIC DATASET,0.12209302325581395,"The Pick-a-Pic dataset4 was created by logging user interactions with the Pick-a-Pic web application
for text-to-image generation. Overall, the Pick-a-Pic dataset contains over 500,000 examples and
35,000 distinct prompts. Each example contains a prompt, two generated images, and a label for
which image is preferred, or if there is a tie when no image is significantly preferred over the other.
The images in the dataset were generated by employing multiple backbone models, namely, Stable
Diffusion 2.1, Dreamlike Photoreal 2.05, and Stable Diffusion XL variants [13] while sampling
different classifier-free guidance scale values [6]. As we continue with our efforts to collect more user
interactions through the Pick-a-Pic web app and decrease the number of NSFW examples included in
the dataset, we will periodically upload new revisions of the dataset."
PICK-A-PIC DATASET,0.12790697674418605,"The Pick-a-Pic Web App
To ensure maximum accessibility for a wide range of users, the user
interface was designed with simplicity in mind. The application allows users to write creative prompts
and generate images. At each turn, the user is presented with two generated images (conditioned
on their prompt), and asked to select their preferred option or indicate a tie if they have no strong
preference. Upon selection, the rejected (non-preferred) image is replaced with a newly generated
image, and the process repeats. The user can also clear or edit the prompt at any time, and the app
will generate new images appropriately. Figure 2 illustrates the usage flow."
PICK-A-PIC DATASET,0.13372093023255813,"Real Data from Real Users
A key advantage of Pick-a-Pic is that our data is collected from real,
intrinsically-motivated users, rather than paid crowd workers. We achieve this by approaching a wide
audience through various social media channels such as Twitter, Facebook, Discord, and Reddit. At
the same time, we mitigate the risk of collecting low-quality data resulting from potential misuse
of the application by implementing several quality control measures. First, users are required to
authenticate their identity using either a Gmail or a Discord account.6 Second, we closely monitor
user activity logs and take action to ban users who generate NSFW content, use multiple instances
of the web app simultaneously, or make judgments at an unreasonably fast pace. Third, we use
a list of NSFW phrases to prevent users from generating harmful content. Last, we limit users to
1000 interactions and periodically increase the limit. These measures work in tandem to ensure the
integrity and reliability of Pick-a-Pic’s data."
PICK-A-PIC DATASET,0.13953488372093023,"Annotation Methodology
While piloting the web app, we experimented with different annotation
strategies to optimize for data quality, efficiency of collection, and user experience. Specifically, we
tested the following annotation options: (1) 4 images, no ties; (2) 2 images, no ties; (3) 2 images,"
PICK-A-PIC DATASET,0.14534883720930233,"4The dataset is available at https://huggingface.co/datasets/yuvalkirstain/pickapic_v1, and
its updated version is available at https://huggingface.co/datasets/yuvalkirstain/pickapic_v2.
5Dreamlike Photoreal 2.0 is a finetuned version of Stable Diffusion 1.5
6All users provide explicit consent to share their interactions with Pick-a-Pic’s application as part of a public
dataset. To ensure privacy, we anonymize user IDs."
PICK-A-PIC DATASET,0.1511627906976744,"3
4
5
6
7
8
9
10
11
Classifier-free Guidance Scale 0.0 0.2 0.4 0.6 0.8 1.0"
PICK-A-PIC DATASET,0.1569767441860465,Win/Tie/Lose Ratio
PICK-A-PIC DATASET,0.16279069767441862,"Win
Tie
Lose"
PICK-A-PIC DATASET,0.1686046511627907,"(a) Win rate versus classifier-free guidance scale
for Stable Diffusion XL (Alpha). 53.5% 35.2% 11.2%"
PICK-A-PIC DATASET,0.1744186046511628,"Dreamlike Photoreal 2.0
Stable Diffusion 2.1
Tie"
PICK-A-PIC DATASET,0.18023255813953487,"(b) Preference distribution when comparing Sta-
ble Diffusion 2.1 with Dreamlike Photoreal 2.0."
PICK-A-PIC DATASET,0.18604651162790697,"Figure 3: The Pick-a-Pic dataset enables us to perform model selection (a), and model evaluation (b)."
PICK-A-PIC DATASET,0.19186046511627908,"with ties. We found that the latter option (2 images, with ties) exceeds the other two in terms of user
engagement and inter-rater agreement."
PICK-A-PIC DATASET,0.19767441860465115,"Preprocessing
When processing the collected interactions, we filter prompts with NSFW phrases
and banned users. We acknowledge that there are still NSFW images and prompts, and will periodi-
cally attempt to update the dataset and reduce such occurrences. To divide the dataset into training,
validation, and testing subsets, we first sample one thousand prompts, ensuring that each prompt
was created by a unique user. Next, we randomly divide those prompts into two sets of equal size to
create the validation and test sets. We then sample exactly one example for each prompt to include in
these sets. For the training set, we include all examples that do not share a prompt with the validation
and test sets. This approach ensures that no split shares prompts with another split, and the validation
and test sets do not suffer from being non-proportionally fitted to a specific prompt or user."
PICK-A-PIC DATASET,0.20348837209302326,"Statistics
Since the creation of the Pick-a-Pic web app we have gathered 968,965 rankings which
originated from 66,798 prompts and 6,394 users. However, as the Pick-a-Pic dataset is constantly
updating, the reported experiments in this paper involve an NSFW filtered and not fully updated
version of Pick-a-Pic, that contains 583,747 training examples, and 500 validation and test examples.
The training set of this dataset contains 37,523 prompts from 4,375 distinct users."
PICK-A-PIC DATASET,0.20930232558139536,"Model Selection and Evaluation
The Pick-a-Pic dataset offers a unique opportunity for a model
selection and evaluation methodology, leveraging users’ preferences for unbiased analysis. To
illustrate this opportunity, we use the collected data and analyze the impact of changing the classifier-
free guidance scale of Stable Diffusion XL (Alpha variant) on its performance. Specifically, we
compare human preferences made when both images were generated by Stable Diffusion XL (Alpha
variant) but using different classifier-free guidance scales7. For each scale, we compute the win ratio,
representing the percentage of judgments where its use led to a preferred image. We also calculate the
corresponding tie and lose ratios for each scale, enabling a detailed analysis of which classifier-free
guidance scales are more effective. Our results are depicted in Figure 3 (a), and verify for example,
that a guidance scale of 9 usually yields preferred images when compared to a guidance scale of 3."
PICK-A-PIC DATASET,0.21511627906976744,"Furthermore, by examining user preferences between images generated by different backbone models,
we can determine which model is preferred more by users. For instance, considering judgments in
which one image was generated by Dreamlike Photoreal 2.0 and the other by Stable Diffusion 2.1, we
can evaluate which model is more performant. As shown in fig. 3 (b), users usually prefer Dreamlike
Photoreal 2.0 over Stable Diffusion 2.1. We encourage researchers to contact us and include their
text-to-image models in the Pick-a-Pic web app for the purpose of model selection and evaluation."
PICKSCORE,0.22093023255813954,"3
PickScore"
PICKSCORE,0.22674418604651161,"One valuable outcome from collecting a large, natural dataset of user preferences is that we can
use it to train a function that scores the quality of a generated image given a prompt. We train
the PickScore scoring function over Pick-a-Pic by combining a CLIP-style model with a variant of"
PICKSCORE,0.23255813953488372,7The frequency of different guidance scales is similar.
PICKSCORE,0.23837209302325582,"InstructGPT’s reward model objective [10]. PickScore is able to predict user preferences in held-out
Pick-a-Pic prompts better than any other publicly-available scoring function, surpassing even expert
human annotators (Section 4). Such a scoring function can be of value for various scenarios, such
as performing model evaluation (Section 5), increasing the quality of generated images via ranking
(Section 6), building better large-scale datasets to improve text-to-image models [14], and improving
text-to-image models through weak supervision (e.g. RLHF)."
PICKSCORE,0.2441860465116279,"Model
PickScore follows the architecture of CLIP [12]; given a prompt x and an image y, our
scoring function s computes a real number by representing x using a transformer text encoder and y
using a transformer image encoder as d-dimensional vectors, and returning their inner product:"
PICKSCORE,0.25,"s(x, y) = Etxt(x) · Eimg(y) · T
(1)"
PICKSCORE,0.2558139534883721,Where T is the learned scalar temperature parameter of CLIP.
PICKSCORE,0.2616279069767442,"Objective
The input for our objective includes a scoring function s, a prompt x, two images
y1, y2, and a preference distribution vector p, which captures the user’s preference over the two
images. Specifically, p takes a value of [1, 0] if y1 is preferred, [0, 1] if y2 is preferred, or [0.5, 0.5]
for ties. Given this input, the objective optimizes the scoring function’s parameters by minimizing
the KL-divergence between the preference p and the softmax-normalized scores of y1 and y2:"
PICKSCORE,0.26744186046511625,"ˆpi =
exp s(x, yi)
P2
j=1 exp s(x, yj)
(2)"
PICKSCORE,0.27325581395348836,Lpref =
X,0.27906976744186046,"2
X"
X,0.28488372093023256,"i=1
pi (log pi −log ˆpi)
(3)"
X,0.29069767441860467,"Since many examples can originate from the same prompt, we mitigate the risk of overfitting to a
small set of prompts by applying a weighted average when reducing the loss across examples in the
batch. Specifically, we weigh each example in the batch, with an inverse proportion to its prompt
frequency in the dataset. This objective is analogous to InstructGPT’s reward model objective [10].
We also experiment with incorporating in-batch negatives into the objective, but find that this yields a
less accurate scoring function (see Appendix)."
X,0.29651162790697677,"Training
We finetune CLIP-H [7] using our framework8 on the Pick-a-Pic training set. We train
the model for 4,000 steps, with a learning rate of 3e-6, a total batch size of 128, and a warmup period
of 500 steps, which follows a linearly decaying learning rate; the experiment is completed in less
than an hour with 8 A100 GPUs. We did not perform hyperparameter search, which might further
improve results. For model selection, we evaluate the model’s accuracy on the validation set (without
the option for a tie) in intervals of 100 steps, and keep the best-performing checkpoint."
PREFERENCE PREDICTION,0.3023255813953488,"4
Preference Prediction"
PREFERENCE PREDICTION,0.3081395348837209,"We first evaluate PickScore on the task it was trained to do: predict human preferences. We find that
PickScore outperforms all other baselines, including expert human annotators."
PREFERENCE PREDICTION,0.313953488372093,"Metric
To evaluate the ability of models to predict human preferences, we use an adapted accuracy
metric that accounts for the possibility of a tie. Our metric assigns one point to the model for
predicting the same label as the user, half a point if either label or prediction is a tie (but not both),
and zero otherwise."
PREFERENCE PREDICTION,0.31976744186046513,"Tie Threshold Selection
Utilizing the notation specified in Section 3, each model requires a tie
threshold probability t to predict a tied outcome when |ˆp1 −ˆp2| < t. To achieve this, we evaluate
each model on the validation set using various tie threshold probabilities and subsequently determine
the most optimal tie threshold for each model. For human experts, we do not perform tie selection
and explicitly allow them to select a tie."
PREFERENCE PREDICTION,0.32558139534883723,8https://github.com/yuvalkirstain/PickScore
PREFERENCE PREDICTION,0.3313953488372093,“Highway to hell”
PREFERENCE PREDICTION,0.3372093023255814,“Robot”
PREFERENCE PREDICTION,0.3430232558139535,"CLIP-H
PickScore"
PREFERENCE PREDICTION,0.3488372093023256,“… animal with fur of a great ape… ”
PREFERENCE PREDICTION,0.3546511627906977,“A demon exiting through a portal…”
PREFERENCE PREDICTION,0.36046511627906974,“…beautiful girl… field of flowers”
PREFERENCE PREDICTION,0.36627906976744184,“A cat on a propaganda poster”
PREFERENCE PREDICTION,0.37209302325581395,"CLIP-H
PickScore"
PREFERENCE PREDICTION,0.37790697674418605,"Figure 4: Disagreement between CLIP-H (left) and
PickScore (right) on the Pick-a-Pic validation set. We
add green borders around images that humans preferred."
PREFERENCE PREDICTION,0.38372093023255816,Table 1: Quantitative results on Pick-a-Pic.
PREFERENCE PREDICTION,0.38953488372093026,"0.0
0.2
0.4
0.6
0.8
1.0
Tie Threshold 0.50 0.55 0.60 0.65 0.70"
PREFERENCE PREDICTION,0.3953488372093023,Accuracy
PREFERENCE PREDICTION,0.4011627906976744,"PickScore
CLIP-H
Aesthetics
Random"
PREFERENCE PREDICTION,0.4069767441860465,"(a) Accuracy across different tie thresholds on
the Pick-a-Pic validation set"
PREFERENCE PREDICTION,0.4127906976744186,"Model
Accuracy"
PREFERENCE PREDICTION,0.4186046511627907,"Random
56.8
Human Expert
68.0"
PREFERENCE PREDICTION,0.42441860465116277,"Aesthetics [14]
56.8
CLIP-H [7]
60.8
ImageReward [18]
61.1
HPS [17]
66.7
PickScore (Ours)
70.5"
PREFERENCE PREDICTION,0.43023255813953487,(b) Performance on the Pick-a-Pic test set.
PREFERENCE PREDICTION,0.436046511627907,"Baselines
We compare our model with CLIP-H [7], an aesthetics predictor [14] built on top of
CLIP-L [12], a random classifier, and human experts.9 For completeness, we also compare our results
with models from concurrent work, namely, HPS [17] and ImageReward [18]."
PREFERENCE PREDICTION,0.4418604651162791,"Results
First, we compare the models’ performance on the validation set across different tie
thresholds. Figure 1a shows that PickScore outperforms the baselines across almost all thresholds,
and achieves the highest global score by a wide margin. After selecting the best-performing tie
threshold for each model, we use the threshold to evaluate the different models on the test set."
PREFERENCE PREDICTION,0.4476744186046512,"Table 1b shows that the aesthetics score (56.8) and CLIP-H (60.8) perform closer to a random
chance baseline (56.8), while PickScore (70.5 ± 0.142)10 achieves superhuman performance, as it
even outperforms human experts (68.0). It is important to emphasize a core difference between
real users that produce the ground truth labels and annotators used to evaluate human performance.
The users that produce the ground truth are actual text-to-image users, which have an idea (which
may be incomplete) for an image, and invent a prompt (which may lack details) with hope that
the resulting image will match their preferences. In contrast, annotators that are used to measure
human performance are oblivious to the original user’s context, idea, and motivation. Therefore,
superhuman performance on this task means that the model is able to outperform a human annotator
that is oblivious to the original user’s context, idea, and motivation. The superhuman performance of
PickScore showcases the importance of using real users as ground truth rather than expert annotators
when collecting human preferences. Moreover, the relatively modest human performance (68.0) on
the task, when compared to a random baseline (56.8), shows that predicting human preferences in
text-to-image generation is a difficult task for human annotators."
PREFERENCE PREDICTION,0.45348837209302323,"For completeness, we also include the results of concurrent work from HPS [17], which scores
66.7, and ImageReward [18], which scores 61.1; PickScore outperforms both. To further illustrate
the differences between CLIP-H and PickScore, we showcase examples of disagreement from the
Pick-a-Pic validation set in Figure 4. We notice that PickScore often chooses more aesthetically
pleasing images than CLIP-H; at times, at the cost of faithfulness to the prompt."
PREFERENCE PREDICTION,0.45930232558139533,"9Throughout this paper, we use friends and colleagues of the authors for expert human annotation.
10We train PickScore using three different random seeds and report the mean and variance."
PREFERENCE PREDICTION,0.46511627906976744,“A baby deer and a large deer are standing…”
PREFERENCE PREDICTION,0.47093023255813954,“A large bear laying down on a leather hammock.”
PREFERENCE PREDICTION,0.47674418604651164,"CFG 3
CFG 9"
PREFERENCE PREDICTION,0.48255813953488375,“The front end of a red motorcycle that is on display”
PREFERENCE PREDICTION,0.4883720930232558,“A woman with a cane and shopping bag sitting.”
PREFERENCE PREDICTION,0.4941860465116279,“An orange a white cat laying on top of luggage.”
PREFERENCE PREDICTION,0.5,“A dog is on the floor hiding under a curtain.”
PREFERENCE PREDICTION,0.5058139534883721,"CFG 3
CFG 9
Stable Diffusion 2.1
Dreamlike Photoreal 2.0"
PREFERENCE PREDICTION,0.5116279069767442,"Figure 5: Images generated using the same seed and model,
but using different classifier-free guidance (CFG) scales.
Even though high guidance scales lead to worse FID, hu-
mans usually find them more pleasing than low guidance
scales."
PREFERENCE PREDICTION,0.5174418604651163,"0.2
0.3
0.4
0.5
0.6
0.7
Human Experts 0.0 0.2 0.4 0.6 0.8 FID"
PREFERENCE PREDICTION,0.5232558139534884,Spearman R=-0.900
PREFERENCE PREDICTION,0.5290697674418605,"Model Win Ratios
Fit"
PREFERENCE PREDICTION,0.5348837209302325,"0.2
0.3
0.4
0.5
0.6
0.7
Human Experts 0.3 0.4 0.5 0.6"
PREFERENCE PREDICTION,0.5406976744186046,PickScore
PREFERENCE PREDICTION,0.5465116279069767,Spearman R=0.917
PREFERENCE PREDICTION,0.5523255813953488,"Model Win Ratios
Fit"
PREFERENCE PREDICTION,0.5581395348837209,"Figure 6: Correlation between the win
ratio of different models according to
FID and PickScore to human experts
on the MS-COCO validation set."
PREFERENCE PREDICTION,0.563953488372093,"1300
1350
1400
1450
1500
1550
1600
1650
Users 1300 1350 1400 1450 1500 1550 1600 1650 1700"
PREFERENCE PREDICTION,0.5697674418604651,CLIP-H
PREFERENCE PREDICTION,0.5755813953488372,Spearman R=0.313
PREFERENCE PREDICTION,0.5813953488372093,"Model Ratings
Fit"
PREFERENCE PREDICTION,0.5872093023255814,"1300
1350
1400
1450
1500
1550
1600
1650
Users 1400 1450 1500 1550 1600"
PREFERENCE PREDICTION,0.5930232558139535,ImageReward
PREFERENCE PREDICTION,0.5988372093023255,Spearman R=0.492
PREFERENCE PREDICTION,0.6046511627906976,"Model Ratings
Fit"
