Section,Section Appearance Order,Paragraph
ABSTRACT,0.0,Abstract
ABSTRACT,0.0033783783783783786,"Neuro-symbolic neural networks have been extensively studied to integrate sym-
bolic operations with neural networks, thereby improving systematic generalization.
Specifically, Tensor Product Representation (TPR) framework enables neural net-
works to perform differentiable symbolic operations by encoding the symbolic
structure of data within vector spaces. However, TPR-based neural networks often
struggle to decompose unseen data into structured TPR representations, undermin-
ing their symbolic operations. To address this decomposition problem, we propose
a Discrete Dictionary-based Decomposition (D3) layer designed to enhance the
decomposition capabilities of TPR-based models. D3 employs discrete, learnable
key-value dictionaries trained to capture symbolic features essential for decom-
position operations. It leverages the prior knowledge acquired during training
to generate structured TPR representations by mapping input data to pre-learned
discrete features within these dictionaries. D3 is a straightforward drop-in layer
that can be seamlessly integrated into any TPR-based model without modifications.
Our experimental results demonstrate that D3 significantly improves the system-
atic generalization of various TPR-based models while requiring fewer additional
parameters. Notably, D3 outperforms baseline models on the synthetic task that
demands the systematic decomposition of unseen combinatorial data.1"
INTRODUCTION,0.006756756756756757,"1
Introduction"
INTRODUCTION,0.010135135135135136,"Compositional generalization, aiming at understanding unseen data by combining known concepts, is
essential for neural networks to handle complex tasks [2, 13, 12, 16, 8, 6]. Tensor Product Representa-
tion (TPR) framework [33] facilitates this by embedding the symbolic structure of data within vector
spaces, providing neural networks with compositional capabilities. Within this framework, individual
objects are decomposed at the representation level into distinct symbolic components called role-filler
pairs2. The TPR framework encodes each object by taking a tensor product of its role vector and
filler vector, represented as T = filler ⊗role, and then superimposes them to represent multiple
objects within a single representation. During decoding, the TPR framework retrieves specific
fillers—essential for solving tasks—from the superimposed representation through matrix multiplica-
tion using an unbinding operator correlated to a particular role, filler = T · unbind. This retrieved
filler is then utilized in downstream tasks. Based on this property, TPR-based neural networks
have demonstrated significant generalization and applicability in fields such as associative reasoning
[28, 30], mathematical problem-solving [29], and natural language processing [9, 32, 21, 34]."
INTRODUCTION,0.013513513513513514,"1The code of D3 is publicly available at https://github.com/taewonpark/D3
2The roles and fillers depend on the task at hand. For example, in a tree structure, the role corresponds to a
position within the tree, while the filler represents the label associated with that position [34]. In associative
memory, the role is analogous to an associative key, and the filler corresponds to the associative value [28, 30]."
INTRODUCTION,0.016891891891891893,"Figure 1: Overview of D3. D3 generates structured TPR representations by mapping input data to the
nearest pre-learned symbolic features stored within discrete, learnable dictionaries. Each dictionary is
linked explicitly to specific TPR components, such as roles, filler, and unbinding operators. Notably,
D3 uses a shared dictionary configuration between the roles and unbinding operators. This figure
illustrates, for example, that role1 and unbind1 share one dictionary, while role2 and unbind2 share
another. T denotes a superimposed representation that represents multiple objects."
INTRODUCTION,0.02027027027027027,"Despite their successes, the TPR-based approaches pose a significant challenge known as a decompo-
sition problem [33, 23], which refers to the difficulty of decomposing input data into TPR components,
such as roles, fillers, and unbinding operators. Without accurate decomposition, TPR-based models
fail to represent the symbolic structure of data, causing a decline in the performance of the TPR
operations. Recently, inspired by an object-centric learning method [18], Park et al. [23] proposes an
attention-based iterative decomposition (AID) module to address this issue. AID uses competitive
attention to iteratively refine structured representations, thereby enhancing the systematic general-
ization of TPR-based models. However, it still struggles to generalize all possible combinations
of known symbols in simple synthetic tasks. This failure is likely attributable to its insufficient
mechanism for explicitly mapping input data to known symbolic features observed during training.
Therefore, the decomposition module may need an additional mechanism to store observed symbolic
features during training and utilize it to effectively decompose unseen combinatorial data of known
symbols."
INTRODUCTION,0.02364864864864865,"In another line of work, discrete representation learning has been explored to improve the efficiency,
interpretability, and generalization capabilities of neural networks [39, 14, 17, 37, 7]. This approach
involves mapping continuous input data into discrete representations by finding the nearest features
in a predefined codebook. The features within the codebook are learnable parameters, specifically
trained to capture the latent features of data during training phase [39]. Some researchers have applied
discrete representation techniques to extract specific types of representations from unstructured data
[11, 43, 44]. Other researchers have integrated discrete symbolic embeddings within the TPR
framework to improve its interpretability [21, 9]. However, these methods are designed for specific
applications, such as question-answering and summarization tasks, making them difficult to integrate
into other TPR-based models."
INTRODUCTION,0.02702702702702703,"In this work, we propose a Discrete Dictionary-based Decomposition (D3) layer for structured
representation learning within the TPR framework. D3 employs the discrete representations techniques
to utilize prior knowledge acquired during training for decomposition operations. Inspired by prior
discrete key-value architectures [14, 38], D3 consists of multiple dictionaries, each comprising
discrete, learnable key-value pairs. Unlike prior work, each dictionary of D3 is linked explicitly to
individual TPR components, such as role, filler, and unbinding operator. This design allows each
dictionary to capture and store the discrete features of its corresponding TPR components during
training. D3 acts as a drop-in layer that maps input data into pre-learned discrete features for the
decomposition of TPR components through a three-step process, as illustrated in Fig. 1. First, it
generates multiple queries from the input data, with each query utilized for different TPR components.
Next, it identifies the nearest codebook keys within each dictionary based on these queries. Finally,
D3 generates structured TPR representations by aggregating the codebook values corresponding to
these keys. Moreover, D3 can be seamlessly integrated into any TPR-based model by replacing the
TPR component generation layer without requiring further modifications."
INTRODUCTION,0.030405405405405407,Our main contributions are as follows.
INTRODUCTION,0.033783783783783786,"• We propose a novel D3 layer to tackle the decomposition problem inherent in the TPR-based
approaches. D3 leverages discrete, learnable dictionaries to enhance the decomposition capabilities
of TPR-based models. By mapping input data to pre-learned discrete features stored within the
dictionaries, D3 effectively generates structured TPR representations."
INTRODUCTION,0.037162162162162164,"• We conduct extensive experiments across various systematic generalization tasks, including syn-
thetic associative recall and text/visual question-answering tasks. Our experimental results show
that D3 significantly enhances the generalization performance of TPR-based models, demonstrat-
ing its effectiveness on systematic generalization tasks."
INTRODUCTION,0.04054054054054054,"• Our analyses show that D3 generates well-bound structured representations that are satisfactory
for the requirements of the TPR framework, utilizing the discrete, learnable dictionaries."
RELATED WORK,0.04391891891891892,"2
Related Work"
RELATED WORK,0.0472972972972973,"Decomposition Problem.
Compositional generalization in neural networks, which allows for
generalizing beyond training data, has been extensively studied [2, 13, 12, 16, 8, 6, 41]. One
important capability for achieving this is a segregation, as discussed in Greff et al. [6], which enables
the formation of meaningful representations from structured and unstructured data [3, 18]. TPR-based
neural networks also rely on this capability to generate structured representations for TPR components
such as roles, fillers, and unbinding operators. In the TPR framework, these structured representations
must satisfy specific conditions to ensure accurate encoding and decoding. First, roles need to be
linearly independent to avoid filler overlap. Second, the unbinding operator must correlate with
the corresponding roles to accurately retrieve associated fillers. Recent work [23] has shown that
existing TPR-based models often fail to generate structured representations that meet these conditions,
undermining their symbolic operations. To address this, an attention-based decomposition module
[23] has been introduced, but it still shows limited performance on synthetic tasks involving the
decomposition of unseen combinatorial data. In this work, we address the decomposition problem
within the TPR framework using a discrete dictionary-based method, advancing the research further."
RELATED WORK,0.05067567567567568,"Discrete Representation Learning.
Discrete neural representation learning has introduced a
codebook of discrete, learnable representations into neural networks [39]. During training, each
discrete representation captures underlying latent features by mapping continuous input data to the
nearest features within the codebook, which are then used for downstream tasks. Recent work on
object-centric learning has utilized discrete representations to extract specific types of features from
unstructured data, leveraging latent features learned during training [11, 43]. Some researchers
have proposed a separate key-value codebook for learning discrete representations, demonstrating
its effectiveness in systematic generalization [17] and robustness against distributional shifts [38].
Inspired by these findings, we develop a separate key-value-based discrete dictionary method to
enhance the decomposition capabilities of TPR-based models. Other researchers have introduced a
discrete symbolic embedding layer to improve the interpretability of TPR-based models, showing the
feasibility of discrete representations in the TPR framework [21, 9]. However, their methods focus on
encoding processes and specific tasks such as question-answering [21] and abstractive summarization
[9]. In contrast, our work addresses the decomposition problem in TPR-based approaches, and our
D3 method is a drop-in solution that can be easily adapted to any TPR-based model."
RELATED WORK,0.05405405405405406,"Memory Network.
Research on memory networks has focused on enhancing neural network
capacity by integrating external memory [36, 4, 5, 24, 27, 41]. Memory-augmented neural networks
store variable lengths of sequential data in this external memory and retrieve necessary information
using various addressing methods [36, 5]. These writing and reading mechanisms share many
similarities with our D3 approach. However, while memory networks store input features sequentially
in their memory states as a continuous stream, D3 updates symbolic feature information through
gradient descent into codebook parameters within dictionaries. This distinctive characteristic allows
D3 to leverage the learned discrete features to decompose unseen data after training. In another work,
Lample et al. [14] introduces a learnable key-value memory layer to improve the efficiency of the
Transformer by replacing the feed-forward layer. Unlike their memory layer, D3 employs key-value
pairs in dictionaries explicitly linked to individual TPR components, making it well-suited for the
TPR framework."
METHOD,0.057432432432432436,"3
Method"
METHOD,0.060810810810810814,"In this section, we explain how the D3 module generates structured representations of the TPR
components using discrete, learnable dictionaries. We then introduce configurations of D3 and how it
can be applied to our baseline models."
DISCRETE DICTIONARY-BASED DECOMPOSITION MODULE,0.06418918918918919,"3.1
Discrete Dictionary-based Decomposition module"
DISCRETE DICTIONARY-BASED DECOMPOSITION MODULE,0.06756756756756757,"D3 is a discrete dictionary-based drop-in layer designed to enhance the decomposition capabilities
of TPR-based approaches. At every time step, D3 decomposes input data into TPR components,
such as roles, fillers, and unbinding operators, by mapping input data to pre-learned symbolic
features within dictionaries. These dictionaries consist of discrete, learnable codebook key-value
pairs, denoted as {Dj}Ncomponent
j=1
as shown in Eq. 1. Each dictionary Dj is explicitly linked to a j-th
TPR component, allowing it to learn the symbolic features required for generating the specific TPR
component. This design also enables the generation of structured representations for different TPR
components individually and in parallel."
DISCRETE DICTIONARY-BASED DECOMPOSITION MODULE,0.07094594594594594,"Dj := {(kj
i, vj
i) | kj
i ∈RDquery, vj
i ∈RDcode}Ncode
i=1
where j = 1, ..., Ncomponent
(1)"
DISCRETE DICTIONARY-BASED DECOMPOSITION MODULE,0.07432432432432433,"where Dj denotes the discrete, learnable dictionary for the j-th TPR component, k denotes a learnable
codebook key, and v denotes a learnable codebook value. In the next paragraph, we describe how D3
generates TPR components using these dictionaries in three steps."
DISCRETE DICTIONARY-BASED DECOMPOSITION MODULE,0.0777027027027027,"Step 1: Query Generation.
At each time step t, D3 takes input data, denoted as inputt ∈RDinput,
and generates the query, denoted as queriest ∈RNcomponent×Dinput, for each j-th TPR component
using a query network, f j
query : inputt 7→queryj
t ∈RDquery. The query network can be any neural
network; in this study, we use a feed-forward network with a single layer. Additionally, we apply a
layer normalization [1] and a dropout of pdropout [35] to queryj
t."
DISCRETE DICTIONARY-BASED DECOMPOSITION MODULE,0.08108108108108109,"Step 2: Sparse Key Access.
D3 searches for the nearest keys from each dictionary, Dj, based
on the generated queryj
t. We measure the similarity using the inner product between queryj
t and
{kj
i}Ncode
i=1 . Then, D3 selects top-k codebook keys in order of largest similarity, as follows."
DISCRETE DICTIONARY-BASED DECOMPOSITION MODULE,0.08445945945945946,"Ij = Tk(queryj
t
⊤ˆk
j
i)
where ˆk
j
i = kj
i/||kj
i||2
(2)"
DISCRETE DICTIONARY-BASED DECOMPOSITION MODULE,0.08783783783783784,"where Tk denotes the top-k operator that finds the indices of k largest values, and Ij denotes the
indices of the k most similar keys within Dj. We found that applying L2 normalization to keys before
the inner product mitigates the codebook collapse problem."
DISCRETE DICTIONARY-BASED DECOMPOSITION MODULE,0.09121621621621621,"Step 3: Aggregation of Code Values.
D3 computes the normalized score for selected codebook
keys, denoted as wj
t, and aggregates codebook values corresponding to selected codebook keys with
wj
t, as follows."
DISCRETE DICTIONARY-BASED DECOMPOSITION MODULE,0.0945945945945946,"codej
t = Σi∈Iwj
t,ivj
i
where wj
t = Softmax(queryj
t
⊤ˆk
j
i))i∈Ij
(3)"
DISCRETE DICTIONARY-BASED DECOMPOSITION MODULE,0.09797297297297297,"Then, D3 maps queryj
t to a dimension of Dcode and adds this projected vector to codej
t. The summed
vectors are mapped to a dimension of Dcomponent to generate structured representations of TPR
components, as follows."
DISCRETE DICTIONARY-BASED DECOMPOSITION MODULE,0.10135135135135136,"componentj
t = codej
t + layerresidual(queryj
t) ∈RDcode
(4)"
DISCRETE DICTIONARY-BASED DECOMPOSITION MODULE,0.10472972972972973,"componentj
t = layerfinal(componentj
t) ∈RDcomponent
(5)"
DISCRETE DICTIONARY-BASED DECOMPOSITION MODULE,0.10810810810810811,"where layerresidual and layerfinal denote a feed-forward network with a single layer.
Those
componentst are then utilized for TPR operations to solve the downstream tasks."
MODULE CONFIGURATIONS,0.11148648648648649,"3.2
Module Configurations"
MODULE CONFIGURATIONS,0.11486486486486487,"In this section, we describe the configurations of D3 when applied to TPR-based models."
MODULE CONFIGURATIONS,0.11824324324324324,"Shared Dictionary between Role and Unbinding Operator.
As discussed in Section 2, roles and
unbinding operators should have correlated features for accurate TPR operations. Considering this
characteristic of the TPR framework, we share the dictionaries of roles and unbinding operators.
This shared dictionary also reduces the number of learnable parameters."
MODULE CONFIGURATIONS,0.12162162162162163,"D3 Applied to Filler.
While the TPR framework requires specific conditions for roles and unbinding
operators for accurate TPR operations, there are no such requirements for fillers. Therefore, we
explore two configurations in this study: applying D3 to generate fillers (w/ F) and not applying D3 to
generate fillers (w/o F). In the w/o F configuration, we follow the baseline models to generate the
filler representations."
MODULE CONFIGURATIONS,0.125,"3.3
Integration of D3 into Existing TPR-based Models"
MODULE CONFIGURATIONS,0.12837837837837837,"In this section, we introduce our baseline models and explain how D3 is applied to them, considering
the configurations of D3. We use three TPR-based models as our baselines: FWM [30], TPR-RNN
[28], and Linear Transformer [10]. Notably, integrating D3 into these baseline models requires only
substituting their TPR component generation layer with D3 without further modifications."
MODULE CONFIGURATIONS,0.13175675675675674,"Fast Weight Memory.
Fast Weight Memory (FWM) [30] is a TPR-based memory network designed
for understanding long sequential contexts. It proposes a single word-level TPR operation related
to the perceptron learning rule [25]. It has shown significant associative reasoning capability in
reinforcement learning and natural language processing tasks. FWM requires two types of roles
(role1 and role2) and one filler for encoding, as well as two types of unbinding operators (unbind1
and unbind2) for decoding. When D3 is integrated into FWM, it employs three dictionaries for the
shared dictionary configuration: one for the role1 and unbind1, another for the role2 and unbind2,
and the other for filler, as shown in Fig. 1."
MODULE CONFIGURATIONS,0.13513513513513514,"TPR-RNN.
TPR-RNN [28] is a sentence-level TPR-based memory network designed for basic text
question-answering tasks [42]. It incorporates various encoding operations such as writing, moving,
and backlink to process sequential data at the sentence level. These operations necessitate different
encoding components with varying dimensions, making direct connections to the decoding compo-
nents challenging. As a result, we do not apply the shared dictionary configuration to TPR-RNN;
instead, we use a shared query network without layer normalization. Furthermore, due to the differing
dimensions of the TPR components in TPR-RNN, we employ distinct layerfinal layers for each TPR
component."
MODULE CONFIGURATIONS,0.13851351351351351,"Linear Transformer.
Linear Transformer [10] linearizes the attention mechanism to improve the
computational efficiency of the Transformer [40]. Recently, Schlag et al. [31] demonstrated the
equivalence between TPR and the linear attention mechanism, indicating that the key, value, and
query in linear attention correspond to the role, filler, and unbinding operator, respectively. Building
on this work, we apply D3 to generate the query, key, and value in the Linear Transformer. Unlike
TPR-RNN and FWM, the Linear Transformer utilizes multi-head operations. Therefore, we use
distinct dictionaries for each head, with the key and query of each head sharing the same dictionary."
EXPERIMENT,0.14189189189189189,"4
Experiment"
EXPERIMENT,0.14527027027027026,"In this section, we evaluate the effectiveness of D3 across various tasks, including a synthetic task,
text/visual question-answering tasks, and a language modeling task. To assess the decomposition
capabilities, we follow the experimental settings of the AID [23], a prior work addressing the
decomposition problem in the TPR framework, and closely compare our D3 model to baseline models
and AID."
TASK,0.14864864864864866,"4.1
Task"
TASK,0.15202702702702703,"Systematic Associative Recall (SAR) task.
This task evaluates systematic generalization in mem-
orizing and recalling combinatorial data [23]. It consists of a discovery phase and an inference
phase. During the discovery phase, the model receives the combinatorial sequential items, each
combining two symbols, x ∈X and y ∈Y where X = X1 ∪X2 ∪X3 and Y = Y1 ∪Y2. The"
TASK,0.1554054054054054,"model is then required to predict an associated y when a specific x is presented. The SAR task
uses different combination settings between training and evaluation to target systematic general-
ization specifically. During training, the model learns the following combination settings: (1) X1
and Y1, (2) X2 and Y2, and (3) X3 and Y . At the evaluation, on the other hand, the model should
generalize unseen combination settings, specifically X1 and Y2. Additionally, the task includes a
hyper-parameter p =
|X3|
|X2|+|X3| where |Xi| denotes the cardinality of set Xi. By adjusting p, this task
tests the systematic generalization of models under varying levels of exposure to different symbol
combinations during training. In our study, we focus solely on the most challenging setting of the
SAR task (p = 0.0), where the subset X3 is excluded. In the SAR task, the TPR framework regards
x as the role and the unbinding operator, and y as the filler. Therefore, TPR-based models should
systematically decompose the combinatorial data into structured representations by mapping x to the
role and y to the filler during the discovery phase, and mapping x to the unbinding operator during
the inference phase to solve this task."
TASK,0.15878378378378377,"Systematic bAbI (sys-bAbI) task.
This task is a variant of the bAbI task [42] designed to evaluate
systematic generalization in text understanding and reasoning [23]. It consists of 20 distinct sub-tasks,
each comprising stories, relevant queries, and corresponding answers. The sys-bAbI task requires
the models to remember the stories and predict corresponding answers to the queries. Unlike the
original bAbI task, the sys-bAbI task evaluates the models with two aspects: (a) in-distribution (w/o
sys diff) and (b) with the systematic difference (w/ sys diff) where each sub-task includes unseen
words during training. Therefore, the models should learn task-independent text understanding to
solve the sys-bAbI task."
TASK,0.16216216216216217,"Sort-of-CLEVR task.
This task [26] evaluates compositional generalization in visual relational
reasoning. It consists of scene images, queries, and corresponding answers. This task requires
the models to understand the properties of individual objects (Unary) or the relationships between
multiple objects (Binary or Ternary) within visual scene images, and predict the correct answers to
the queries [20]. Therefore, the model should capture relationships within each object and between
objects to solve this task."
TASK,0.16554054054054054,"WikiText-103 task.
This task [19] is a language modeling dataset consisting of lengthy corpora
from Wikipedia. Although the WikiText-103 task does not directly measure the systematic general-
ization of the models, it is used to evaluate the effectiveness and applicability of D3 on a large-scale
task beyond relatively simple tasks."
EXPERIMENTAL RESULTS,0.16891891891891891,"4.2
Experimental Results"
EXPERIMENTAL RESULTS,0.17229729729729729,"In this section, we present the experimental results of the SAR task, sys-bAbI task, sort-of-CLEVR
task, and WikiText-103 task. In our experiments, we set Dquery as Dcode/2."
TPR-BASED MEMORY NETWORKS,0.17567567567567569,"4.2.1
TPR-based Memory Networks"
TPR-BASED MEMORY NETWORKS,0.17905405405405406,"Figure 2: Test accuracy curve [%] on the SAR task
for 10 seeds, with shadowed area indicating SD."
TPR-BASED MEMORY NETWORKS,0.18243243243243243,"First, we evaluate FWM with D3 on the SAR
task, which requires understanding the compo-
sition of two types of symbols, x and y. TPR-
based models are expected to solve this task
perfectly by mapping each symbol to a specific
TPR component during decomposition. How-
ever, as shown in Fig. 2, FWM and AID fail to
generalize unseen combinations of known sym-
bols. In contrast, our D3 module significantly
outperforms other baseline models, achieving
nearly 100% accuracy. This result demonstrates
that D3 effectively decomposes unseen combina-
torial data into TPR components using discrete
dictionaries."
