Section,Section Appearance Order,Paragraph
EXPERIMENTAL RESULT REPRODUCIBILITY,0.8412162162162162,"• The answer NA means that the paper does not include experiments.
• If the paper includes experiments, a No answer to this question will not be perceived
well by the reviewers: Making the paper reproducible is important, regardless of
whether the code and data are provided or not.
• If the contribution is a dataset and/or model, the authors should describe the steps taken
to make their results reproducible or verifiable.
• Depending on the contribution, reproducibility can be accomplished in various ways.
For example, if the contribution is a novel architecture, describing the architecture fully
might suffice, or if the contribution is a specific model and empirical evaluation, it may
be necessary to either make it possible for others to replicate the model with the same
dataset, or provide access to the model. In general. releasing code and data is often
one good way to accomplish this, but reproducibility can also be provided via detailed
instructions for how to replicate the results, access to a hosted model (e.g., in the case
of a large language model), releasing of a model checkpoint, or other means that are
appropriate to the research performed.
• While NeurIPS does not require releasing code, the conference does require all submis-
sions to provide some reasonable avenue for reproducibility, which may depend on the
nature of the contribution. For example
(a) If the contribution is primarily a new algorithm, the paper should make it clear how
to reproduce that algorithm.
(b) If the contribution is primarily a new model architecture, the paper should describe
the architecture clearly and fully.
(c) If the contribution is a new model (e.g., a large language model), then there should
either be a way to access this model for reproducing the results or a way to reproduce
the model (e.g., with an open-source dataset or instructions for how to construct
the dataset)."
EXPERIMENTAL RESULT REPRODUCIBILITY,0.8445945945945946,"(d) We recognize that reproducibility may be tricky in some cases, in which case
authors are welcome to describe the particular way they provide for reproducibility.
In the case of closed-source models, it may be that access to the model is limited in
some way (e.g., to registered users), but it should be possible for other researchers
to have some path to reproducing or verifying the results.
5. Open access to data and code"
EXPERIMENTAL RESULT REPRODUCIBILITY,0.847972972972973,"Question: Does the paper provide open access to the data and code, with sufficient instruc-
tions to faithfully reproduce the main experimental results, as described in supplemental
material?
Answer: [Yes]
Justification: This paper provides supplementary materials to reproduce all experimental
results of the proposed method, including source codes about our model implementation,
data processing, scripts for execution, etc.
Guidelines:"
EXPERIMENTAL RESULT REPRODUCIBILITY,0.8513513513513513,"• The answer NA means that paper does not include experiments requiring code.
• Please see the NeurIPS code and data submission guidelines (https://nips.cc/
public/guides/CodeSubmissionPolicy) for more details.
• While we encourage the release of code and data, we understand that this might not be
possible, so “No” is an acceptable answer. Papers cannot be rejected simply for not
including code, unless this is central to the contribution (e.g., for a new open-source
benchmark).
• The instructions should contain the exact command and environment needed to run to
reproduce the results. See the NeurIPS code and data submission guidelines (https:
//nips.cc/public/guides/CodeSubmissionPolicy) for more details.
• The authors should provide instructions on data access and preparation, including how
to access the raw data, preprocessed data, intermediate data, and generated data, etc.
• The authors should provide scripts to reproduce all experimental results for the new
proposed method and baselines. If only a subset of experiments are reproducible, they
should state which ones are omitted from the script and why.
• At submission time, to preserve anonymity, the authors should release anonymized
versions (if applicable).
• Providing as much information as possible in supplemental material (appended to the
paper) is recommended, but including URLs to data and code is permitted.
6. Experimental Setting/Details"
EXPERIMENTAL RESULT REPRODUCIBILITY,0.8547297297297297,"Question: Does the paper specify all the training and test details (e.g., data splits, hyper-
parameters, how they were chosen, type of optimizer, etc.) necessary to understand the
results?
Answer: [Yes]
Justification: This paper presents our experiment details and hyper-parameter settings in
Appendices A and B.
Guidelines:"
EXPERIMENTAL RESULT REPRODUCIBILITY,0.8581081081081081,"• The answer NA means that the paper does not include experiments.
• The experimental setting should be presented in the core of the paper to a level of detail
that is necessary to appreciate the results and make sense of them.
• The full details can be provided either with the code, in appendix, or as supplemental
material.
7. Experiment Statistical Significance"
EXPERIMENTAL RESULT REPRODUCIBILITY,0.8614864864864865,"Question: Does the paper report error bars suitably and correctly defined or other appropriate
information about the statistical significance of the experiments?
Answer: [Yes]"
EXPERIMENTAL RESULT REPRODUCIBILITY,0.8648648648648649,"Justification: This paper reports the mean and standard deviation values in the experimental
results conducted using fixed 10 different random seeds."
EXPERIMENTAL RESULT REPRODUCIBILITY,0.8682432432432432,Guidelines:
EXPERIMENTAL RESULT REPRODUCIBILITY,0.8716216216216216,"• The answer NA means that the paper does not include experiments.
• The authors should answer ""Yes"" if the results are accompanied by error bars, confi-
dence intervals, or statistical significance tests, at least for the experiments that support
the main claims of the paper.
• The factors of variability that the error bars are capturing should be clearly stated (for
example, train/test split, initialization, random drawing of some parameter, or overall
run with given experimental conditions).
• The method for calculating the error bars should be explained (closed form formula,
call to a library function, bootstrap, etc.)
• The assumptions made should be given (e.g., Normally distributed errors).
• It should be clear whether the error bar is the standard deviation or the standard error
of the mean.
• It is OK to report 1-sigma error bars, but one should state it. The authors should
preferably report a 2-sigma error bar than state that they have a 96% CI, if the hypothesis
of Normality of errors is not verified.
• For asymmetric distributions, the authors should be careful not to show in tables or
figures symmetric error bars that would yield results that are out of range (e.g. negative
error rates).
• If error bars are reported in tables or plots, The authors should explain in the text how
they were calculated and reference the corresponding figures or tables in the text."
EXPERIMENTS COMPUTE RESOURCES,0.875,8. Experiments Compute Resources
EXPERIMENTS COMPUTE RESOURCES,0.8783783783783784,"Question: For each experiment, does the paper provide sufficient information on the com-
puter resources (type of compute workers, memory, time of execution) needed to reproduce
the experiments?"
EXPERIMENTS COMPUTE RESOURCES,0.8817567567567568,Answer: [Yes]
EXPERIMENTS COMPUTE RESOURCES,0.8851351351351351,"Justification: This paper provides the computer resources used in our experiments and the
time it took to learn each task in Appendix A."
EXPERIMENTS COMPUTE RESOURCES,0.8885135135135135,Guidelines:
EXPERIMENTS COMPUTE RESOURCES,0.8918918918918919,"• The answer NA means that the paper does not include experiments.
• The paper should indicate the type of compute workers CPU or GPU, internal cluster,
or cloud provider, including relevant memory and storage.
• The paper should provide the amount of compute required for each of the individual
experimental runs as well as estimate the total compute.
• The paper should disclose whether the full research project required more compute
than the experiments reported in the paper (e.g., preliminary or failed experiments that
didn’t make it into the paper)."
CODE OF ETHICS,0.8952702702702703,9. Code Of Ethics
CODE OF ETHICS,0.8986486486486487,"Question: Does the research conducted in the paper conform, in every respect, with the
NeurIPS Code of Ethics https://neurips.cc/public/EthicsGuidelines?"
CODE OF ETHICS,0.902027027027027,Answer: [Yes]
CODE OF ETHICS,0.9054054054054054,Justification: The research conducted in this paper conforms to the NeurIPS Code of Ethics.
CODE OF ETHICS,0.9087837837837838,Guidelines:
CODE OF ETHICS,0.9121621621621622,"• The answer NA means that the authors have not reviewed the NeurIPS Code of Ethics.
• If the authors answer No, they should explain the special circumstances that require a
deviation from the Code of Ethics.
• The authors should make sure to preserve anonymity (e.g., if there is a special consid-
eration due to laws or regulations in their jurisdiction)."
BROADER IMPACTS,0.9155405405405406,10. Broader Impacts
BROADER IMPACTS,0.918918918918919,"Question: Does the paper discuss both potential positive societal impacts and negative
societal impacts of the work performed?"
BROADER IMPACTS,0.9222972972972973,Answer: [NA]
BROADER IMPACTS,0.9256756756756757,"Justification: The authors do not foresee a negative societal impact on the work presented in
this paper beyond the general effects of ML advancements."
BROADER IMPACTS,0.9290540540540541,Guidelines:
BROADER IMPACTS,0.9324324324324325,"• The answer NA means that there is no societal impact of the work performed.
• If the authors answer NA or No, they should explain why their work has no societal
impact or why the paper does not address societal impact.
• Examples of negative societal impacts include potential malicious or unintended uses
(e.g., disinformation, generating fake profiles, surveillance), fairness considerations
(e.g., deployment of technologies that could make decisions that unfairly impact specific
groups), privacy considerations, and security considerations.
• The conference expects that many papers will be foundational research and not tied
to particular applications, let alone deployments. However, if there is a direct path to
any negative applications, the authors should point it out. For example, it is legitimate
to point out that an improvement in the quality of generative models could be used to
generate deepfakes for disinformation. On the other hand, it is not needed to point out
that a generic algorithm for optimizing neural networks could enable people to train
models that generate Deepfakes faster.
• The authors should consider possible harms that could arise when the technology is
being used as intended and functioning correctly, harms that could arise when the
technology is being used as intended but gives incorrect results, and harms following
from (intentional or unintentional) misuse of the technology.
• If there are negative societal impacts, the authors could also discuss possible mitigation
strategies (e.g., gated release of models, providing defenses in addition to attacks,
mechanisms for monitoring misuse, mechanisms to monitor how a system learns from
feedback over time, improving the efficiency and accessibility of ML)."
SAFEGUARDS,0.9358108108108109,11. Safeguards
SAFEGUARDS,0.9391891891891891,"Question: Does the paper describe safeguards that have been put in place for responsible
release of data or models that have a high risk for misuse (e.g., pretrained language models,
image generators, or scraped datasets)?"
SAFEGUARDS,0.9425675675675675,Answer: [NA]
SAFEGUARDS,0.9459459459459459,Justification: This paper does not have a high risk for misuse.
SAFEGUARDS,0.9493243243243243,Guidelines:
SAFEGUARDS,0.9527027027027027,"• The answer NA means that the paper poses no such risks.
• Released models that have a high risk for misuse or dual-use should be released with
necessary safeguards to allow for controlled use of the model, for example by requiring
that users adhere to usage guidelines or restrictions to access the model or implementing
safety filters.
• Datasets that have been scraped from the Internet could pose safety risks. The authors
should describe how they avoided releasing unsafe images.
• We recognize that providing effective safeguards is challenging, and many papers do
not require this, but we encourage authors to take this into account and make a best
faith effort."
LICENSES FOR EXISTING ASSETS,0.956081081081081,12. Licenses for existing assets
LICENSES FOR EXISTING ASSETS,0.9594594594594594,"Question: Are the creators or original owners of assets (e.g., code, data, models), used in
the paper, properly credited and are the license and terms of use explicitly mentioned and
properly respected?"
LICENSES FOR EXISTING ASSETS,0.9628378378378378,Answer: [Yes]
LICENSES FOR EXISTING ASSETS,0.9662162162162162,"Justification: This paper cites the original paper that produced the code package or dataset,
and includes URLs in Appendix A."
LICENSES FOR EXISTING ASSETS,0.9695945945945946,Guidelines:
LICENSES FOR EXISTING ASSETS,0.972972972972973,• The answer NA means that the paper does not use existing assets.
LICENSES FOR EXISTING ASSETS,0.9763513513513513,"• The authors should cite the original paper that produced the code package or dataset.
• The authors should state which version of the asset is used and, if possible, include a
URL.
• The name of the license (e.g., CC-BY 4.0) should be included for each asset.
• For scraped data from a particular source (e.g., website), the copyright and terms of
service of that source should be provided.
• If assets are released, the license, copyright information, and terms of use in the
package should be provided. For popular datasets, paperswithcode.com/datasets
has curated licenses for some datasets. Their licensing guide can help determine the
license of a dataset.
• For existing datasets that are re-packaged, both the original license and the license of
the derived asset (if it has changed) should be provided.
• If this information is not available online, the authors are encouraged to reach out to
the asset’s creators.
13. New Assets"
LICENSES FOR EXISTING ASSETS,0.9797297297297297,"Question: Are new assets introduced in the paper well documented and is the documentation
provided alongside the assets?
Answer: [Yes]
Justification: This paper provides supplementary materials with source code, license, and
README.md files. The README.md files cite the code packages utilized in this paper
and provide all the instructions to reproduce the experimental results.
Guidelines:"
LICENSES FOR EXISTING ASSETS,0.9831081081081081,"• The answer NA means that the paper does not release new assets.
• Researchers should communicate the details of the dataset/code/model as part of their
submissions via structured templates. This includes details about training, license,
limitations, etc.
• The paper should discuss whether and how consent was obtained from people whose
asset is used.
• At submission time, remember to anonymize your assets (if applicable). You can either
create an anonymized URL or include an anonymized zip file.
14. Crowdsourcing and Research with Human Subjects"
LICENSES FOR EXISTING ASSETS,0.9864864864864865,"Question: For crowdsourcing experiments and research with human subjects, does the paper
include the full text of instructions given to participants and screenshots, if applicable, as
well as details about compensation (if any)?
Answer: [NA]
Justification: This paper does not involve crowdsourcing nor research with human subjects.
Guidelines:"
LICENSES FOR EXISTING ASSETS,0.9898648648648649,"• The answer NA means that the paper does not involve crowdsourcing nor research with
human subjects.
• Including this information in the supplemental material is fine, but if the main contribu-
tion of the paper involves human subjects, then as much detail as possible should be
included in the main paper.
• According to the NeurIPS Code of Ethics, workers involved in data collection, curation,
or other labor should be paid at least the minimum wage in the country of the data
collector.
15. Institutional Review Board (IRB) Approvals or Equivalent for Research with Human
Subjects
Question: Does the paper describe potential risks incurred by study participants, whether
such risks were disclosed to the subjects, and whether Institutional Review Board (IRB)
approvals (or an equivalent approval/review based on the requirements of your country or
institution) were obtained?
Answer: [NA]"
LICENSES FOR EXISTING ASSETS,0.9932432432432432,"Justification: This paper does not involve crowdsourcing nor research with human subjects.
Guidelines:"
LICENSES FOR EXISTING ASSETS,0.9966216216216216,"• The answer NA means that the paper does not involve crowdsourcing nor research with
human subjects.
• Depending on the country in which research is conducted, IRB approval (or equivalent)
may be required for any human subjects research. If you obtained IRB approval, you
should clearly state this in the paper.
• We recognize that the procedures for this may vary significantly between institutions
and locations, and we expect authors to adhere to the NeurIPS Code of Ethics and the
guidelines for their institution.
• For initial submissions, do not include any information that would break anonymity (if
applicable), such as the institution conducting the review."
