Section,Section Appearance Order,Paragraph
REFERENCES,0.6171171171171171,"Recognition, pages 792–802, 2023.
[42] Yinyu Nie, Xiaoguang Han, Shihui Guo, Yujian Zheng, Jian Chang, and Jian Jun Zhang.
Total3dunderstanding: Joint layout, object pose and mesh reconstruction for indoor scenes from
a single image. In Proceedings of the IEEE/CVF Conference on Computer Vision and Pattern
Recognition, pages 55–64, 2020.
[43] Takeshi Noda, Chao Chen, Xinhai Liu Weiqi Zhang and, Yu-Shen Liu, and Zhizhong Han.
MultiPull: Detailing signed distance functions by pulling multi-level queries at multi-step. In
Advances in Neural Information Processing Systems, 2024.
[44] Michael Oechsle, Songyou Peng, and Andreas Geiger. Unisurf: Unifying neural implicit
surfaces and radiance fields for multi-view reconstruction. In Proceedings of the IEEE/CVF
International Conference on Computer Vision, pages 5589–5599, 2021.
[45] Jeong Joon Park, Peter Florence, Julian Straub, Richard Newcombe, and Steven Lovegrove.
DeepSDF: Learning continuous signed distance functions for shape representation. In Proceed-
ings of the IEEE/CVF Conference on Computer Vision and Pattern Recognition, pages 165–174,
2019.
[46] Songyou Peng, Chiyu Jiang, Yiyi Liao, Michael Niemeyer, Marc Pollefeys, and Andreas Geiger.
Shape as points: A differentiable poisson solver. Advances in Neural Information Processing
Systems, 34, 2021.
[47] Alec Radford, Jong Wook Kim, Chris Hallacy, Aditya Ramesh, Gabriel Goh, Sandhini Agarwal,
Girish Sastry, Amanda Askell, Pamela Mishkin, Jack Clark, et al. Learning transferable visual
models from natural language supervision. In International conference on machine learning,
pages 8748–8763. PMLR, 2021.
[48] Colin Raffel, Noam Shazeer, Adam Roberts, Katherine Lee, Sharan Narang, Michael Matena,
Yanqi Zhou, Wei Li, and Peter J Liu. Exploring the limits of transfer learning with a unified
text-to-text transformer. The Journal of Machine Learning Research, 21(1):5485–5551, 2020.
[49] René Ranftl, Katrin Lasinger, David Hafner, Konrad Schindler, and Vladlen Koltun. Towards
robust monocular depth estimation: Mixing datasets for zero-shot cross-dataset transfer. IEEE
transactions on pattern analysis and machine intelligence, 44(3):1623–1637, 2020.
[50] René Ranftl, Katrin Lasinger, David Hafner, Konrad Schindler, and Vladlen Koltun. Towards
robust monocular depth estimation: Mixing datasets for zero-shot cross-dataset transfer. IEEE
Transactions on Pattern Analysis and Machine Intelligence, 44(3), 2022.
[51] Robin Rombach, Andreas Blattmann, Dominik Lorenz, Patrick Esser, and Björn Ommer. High-
resolution image synthesis with latent diffusion models. In Proceedings of the IEEE/CVF
conference on computer vision and pattern recognition, pages 10684–10695, 2022.
[52] Szymon Rusinkiewicz and Marc Levoy. Efficient variants of the icp algorithm. In Proceedings
third international conference on 3-D digital imaging and modeling, pages 145–152. IEEE,
2001.
[53] Radu Bogdan Rusu, Nico Blodow, and Michael Beetz. Fast point feature histograms (FPFH)
for 3D registration. In 2009 IEEE international conference on robotics and automation, pages
3212–3217. IEEE, 2009.
[54] Shuran Song, Samuel P Lichtenberg, and Jianxiong Xiao. Sun rgb-d: A rgb-d scene understand-
ing benchmark suite. In Proceedings of the IEEE conference on computer vision and pattern
recognition, pages 567–576, 2015.
[55] Julian Straub, Thomas Whelan, Lingni Ma, Yufan Chen, Erik Wijmans, Simon Green, Jakob J
Engel, Raul Mur-Artal, Carl Ren, Shobhit Verma, et al. The replica dataset: A digital replica of
indoor spaces. arXiv preprint arXiv:1906.05797, 2019.
[56] Quan Sun, Yuxin Fang, Ledell Wu, Xinlong Wang, and Yue Cao. EVA-CLIP: Improved training
techniques for clip at scale. arXiv preprint arXiv:2303.15389, 2023.
[57] Xingyuan Sun, Jiajun Wu, Xiuming Zhang, Zhoutong Zhang, Chengkai Zhang, Tianfan Xue,
Joshua B Tenenbaum, and William T Freeman. Pix3D: Dataset and methods for single-image
3d shape modeling. In Proceedings of the IEEE conference on computer vision and pattern
recognition, pages 2974–2983, 2018.
[58] Hugo Touvron, Thibaut Lavril, Gautier Izacard, Xavier Martinet, Marie-Anne Lachaux, Timo-
thée Lacroix, Baptiste Rozière, Naman Goyal, Eric Hambro, Faisal Azhar, et al. Llama: Open
and efficient foundation language models. arXiv preprint arXiv:2302.13971, 2023.
[59] Jiepeng Wang, Peng Wang, Xiaoxiao Long, Christian Theobalt, Taku Komura, Lingjie Liu, and
Wenping Wang. NeuRIS: Neural reconstruction of indoor scenes using normal priors. In 17th
European Conference on Computer Vision, pages 139–155. Springer, 2022.
[60] Peng Wang, Lingjie Liu, Yuan Liu, Christian Theobalt, Taku Komura, and Wenping Wang.
NeuS: Learning neural implicit surfaces by volume rendering for multi-view reconstruction.
Advances in Neural Information Processing Systems, 34:27171–27183, 2021."
REFERENCES,0.6216216216216216,"[61] Xin Wen, Junsheng Zhou, Yu-Shen Liu, Hua Su, Zhen Dong, and Zhizhong Han. 3D shape
reconstruction from 2D images with disentangled attribute flow. In Proceedings of the IEEE/CVF
Conference on Computer Vision and Pattern Recognition, pages 3803–3813, 2022.
[62] Runsen Xu, Xiaolong Wang, Tai Wang, Yilun Chen, Jiangmiao Pang, and Dahua Lin.
Pointllm: Empowering large language models to understand point clouds. arXiv preprint
arXiv:2308.16911, 2023.
[63] Lihe Yang, Bingyi Kang, Zilong Huang, Xiaogang Xu, Jiashi Feng, and Hengshuang Zhao.
Depth anything: Unleashing the power of large-scale unlabeled data. In Proceedings of the
IEEE/CVF Conference on Computer Vision and Pattern Recognition, pages 10371–10381, 2024.
[64] Lihe Yang, Bingyi Kang, Zilong Huang, Zhen Zhao, Xiaogang Xu, Jiashi Feng, and Hengshuang
Zhao. Depth anything v2. arXiv:2406.09414, 2024.
[65] Lior Yariv, Jiatao Gu, Yoni Kasten, and Yaron Lipman. Volume rendering of neural implicit
surfaces. Advances in Neural Information Processing Systems, 34:4805–4815, 2021.
[66] Wei Yin, Chi Zhang, Hao Chen, Zhipeng Cai, Gang Yu, Kaixuan Wang, Xiaozhi Chen, and
Chunhua Shen. Metric3D: Towards zero-shot metric 3d prediction from a single image. In
Proceedings of the IEEE/CVF International Conference on Computer Vision, pages 9043–9053,
2023.
[67] Zehao Yu, Songyou Peng, Michael Niemeyer, Torsten Sattler, and Andreas Geiger. Monosdf:
Exploring monocular geometric cues for neural implicit surface reconstruction. In Advances in
Neural Information Processing Systems.
[68] Wenyuan Zhang, Yu-Shen Liu, and Zhizhong Han. Neural signed distance function inference
through splatting 3d gaussians pulled on zero-level set. In Advances in Neural Information
Processing Systems, 2024.
[69] Wenyuan Zhang, Kanle Shi, Yu-Shen Liu, and Zhizhong Han. Learning unsigned distance
functions from multi-view images with volume rendering priors. European Conference on
Computer Vision, 2024.
[70] Wenyuan Zhang, Ruofan Xing, Yunfan Zeng, Yu-Shen Liu, Kanle Shi, and Zhizhong Han. Fast
learning radiance fields by shooting much fewer rays. IEEE Transactions on Image Processing,
2023.
[71] Xiang Zhang, Zeyuan Chen, Fangyin Wei, and Zhuowen Tu. Uni-3D: A universal model for
panoptic 3D scene reconstruction. In Proceedings of the IEEE/CVF International Conference
on Computer Vision, pages 9256–9266, 2023.
[72] Junsheng Zhou, Baorui Ma, Shujuan Li, Yu-Shen Liu, Yi Fang, and Zhizhong Han. Cap-udf:
Learning unsigned distance functions progressively from raw point clouds with consistency-
aware field optimization. IEEE Transactions on Pattern Analysis and Machine Intelligence,
2024.
[73] Junsheng Zhou, Baorui Ma, Shujuan Li, Yu-Shen Liu, and Zhizhong Han. Learning a more
continuous zero level set in unsigned distance fields through level set projection. In Proceedings
of the IEEE/CVF International Conference on Computer Vision, 2023.
[74] Junsheng Zhou, Baorui Ma, and Yu-Shen Liu. Fast learning of signed distance functions from
noisy point clouds via noise to noise mapping. IEEE transactions on pattern analysis and
machine intelligence, 2024.
[75] Junsheng Zhou, Baorui Ma, Liu Yu-Shen, Fang Yi, and Han Zhizhong. Learning consistency-
aware unsigned distance functions progressively from raw point clouds. In Advances in Neural
Information Processing Systems (NeurIPS), 2022.
[76] Junsheng Zhou, Baorui Ma, Wenyuan Zhang, Yi Fang, Yu-Shen Liu, and Zhizhong Han.
Differentiable registration of images and lidar point clouds with voxelpoint-to-pixel matching.
In Advances in Neural Information Processing Systems (NeurIPS), 2023.
[77] Junsheng Zhou, Jinsheng Wang, Baorui Ma, Yu-Shen Liu, Tiejun Huang, and Xinlong Wang.
Uni3D: Exploring Unified 3D Representation at Scale. In International Conference on Learning
Representations (ICLR), 2024.
[78] Junsheng Zhou, Xin Wen, Baorui Ma, Yu-Shen Liu, Yue Gao, Yi Fang, and Zhizhong Han. 3d-
oae: Occlusion auto-encoders for self-supervised learning on point clouds. IEEE International
Conference on Robotics and Automation (ICRA), 2024.
[79] Junsheng Zhou, Weiqi Zhang, and Yu-Shen Liu. Diffgs: Functional gaussian splatting diffusion.
In Advances in Neural Information Processing Systems (NeurIPS), 2024.
[80] Junsheng Zhou, Weiqi Zhang, Baorui Ma, Kanle Shi, Yu-Shen Liu, and Zhizhong Han. Udiff:
Generating conditional unsigned distance fields with optimal wavelet diffusion. In Proceedings
of the IEEE/CVF Conference on Computer Vision and Pattern Recognition, 2024."
REFERENCES,0.6261261261261262,Appendix
REFERENCES,0.6306306306306306,"A
More Ablation Studies and Analysis"
REFERENCES,0.6351351351351351,"A.1
Alternatives on sub-tasks."
REFERENCES,0.6396396396396397,"We explore the effectiveness of our chosen solutions in each sub-task by comparing them with the
alternatives. Specifically, we conduct ablations to replace Shap·E [26] with One-2-3-45 [32], replace
Open-CLIP [47, 23] with EVA-CLIP [56] and replace Omnidata [13] with MiDaS [50] in Tab. 4.
We visually compare Shap·E with One-2-3-45 for shape generation in Fig. 9, where the results
demonstrate that Shap·E is a more robust solution for generating 3D models from 2D instances."
REFERENCES,0.6441441441441441,"A.2
The Effect of Instance Scale"
REFERENCES,0.6486486486486487,"We further conduct ablation studies to explore the effect of the instance scales to the generation
qualities of Shap·E as described in “Enhance and Inpaint 2D instances” of Sec. 3.2 in our paper.
We provide an visual comparison of the generations with different instance scales in Fig. 10. The
results show that Shap·E is quite sensitive to the scale of instances in the images, where a too small
or too large scale will lead to inaccurate generations with unreliable geometries and appearances.
We set the scale to 6 where the Shap·E performs the best in shape generation from instance images
according to our experiences."
REFERENCES,0.6531531531531531,"A.3
The Effect of Confidence Threshold."
REFERENCES,0.6576576576576577,"We further conduct ablations to evaluate the effect of confidence threshold σ as described in “Detect
and Segment 2D instances.” of Sec.3.2 in our paper. As shown in Fig. 11, a too large σ will drop too
many instances and a too small σ struggles to filter bad instances. We choose σ = 0.4 as the suitable
confidence threshold."
REFERENCES,0.6621621621621622,"B
More Comparisons with Data-Driven Reconstruction Methods"
REFERENCES,0.6666666666666666,"We additionally compare our method with SOTA data-driven scene reconstruction works PanoRecon
[10], BUOL [9] and Uni-3D [71]. We show the visual comparisons under 3D-Front and ScanNet
datasets in Fig. 12, where our method achieves better and more visual-appealing results under both
3D-Front and ScanNet datasets. Specifically, our method significantly outperforms other methods
using real-world images in ScanNet. The reason is that all the three methods are trained under
3D-Front, and struggle to generalize on real-world images."
REFERENCES,0.6711711711711712,"We further compare deep prior assembly with ScenePrior [41] in Fig.13. As shown, our method
clearly outperforms ScenePrior in terms of the quality of scene geometries. Moreover, ScenePrior
can only reconstruct the geometry, whereas deep prior assembly is capable of recovering high-fidelity
scene appearances as well."
REFERENCES,0.6756756756756757,"C
Background Reconstruction"
REFERENCES,0.6801801801801802,"We demonstrate that deep prior assembly can also reconstruct the background geometries from the
scene images. We show two scene reconstructions with backgrounds (i.e. floor, wall) in BlendSwap
and Replica datasets in Fig. 14. The backgrounds are achieved by fitting planes to the projected"
REFERENCES,0.6846846846846847,"Ablation
CDL1-S ↓
CDL1 ↓
F-Score↑"
REFERENCES,0.6891891891891891,"One-2-3-45
0.123
0.122
67.98
EVA-CLIP
0.113
0.111
70.41
MiDaS
0.120
0.119
68.71"
REFERENCES,0.6936936936936937,"Ours
0.113
0.110
70.48"
REFERENCES,0.6981981981981982,"Table 4: Ablation studies on the sub-task al-
ternatives.
Figure 9: Ablation on shape generation alternatives."
REFERENCES,0.7027027027027027,Len = scale / 10
REFERENCES,0.7072072072072072,Len = 1
REFERENCES,0.7117117117117117,"Scale = 2
Scale = 4
Scale = 6
Scale = 8
Scale = 10
Input Image
Amended Image"
REFERENCES,0.7162162162162162,"Figure 10: The ablation study on the instance scale. We select one instance for each input image and
show the amended instance images. The generations obtained with Shap·E under different instance
scales are visualized on the right."
REFERENCES,0.7207207207207207,Figure 11: The ablation study on the confidence threshold.
REFERENCES,0.7252252252252253,"background depth points in a similar way as our pose/scale optimization algorithm. We then cull the
geometries outside of the view frustum for a clear visualization."
REFERENCES,0.7297297297297297,"D
Outdoor Scene Reconstruction"
REFERENCES,0.7342342342342343,"We further conduct experiments to evaluate deep prior assembly on complex outdoor scenes and
scene containing animals, as shown in Fig. 15. The first image comes from KITTI dataset, others are
collected from the Internet. With the help of powerful large foundation models, deep prior assembly
demonstrates superior zero-shot scene reconstruction performance in these real-world outdoor scenes."
REFERENCES,0.7387387387387387,Figure 12: Visual comparisons under 3D-Front and ScanNet dataset.
REFERENCES,0.7432432432432432,Figure 13: Visual comparisons with ScenePrior under ScanNet dataset.
REFERENCES,0.7477477477477478,Figure 14: Scene reconstructions with backgrounds.
REFERENCES,0.7522522522522522,"E
Efficiency Analysis"
REFERENCES,0.7567567567567568,"We further evaluate the efficiency of our proposed deep prior assembly by reporting the average
runtime of each sub-pipeline in our framework. The results in Tab. 5 show that reconstructing a
scene from a single image takes less than 3 minutes in total, where the inference of Grounded-SAM,
Open-CLIP and Omnidata takes only about 1 second. The most time consuming parts include the
StableDiffusion, Shap·E and the RANSAC-like pose/scale optimization. For these three parts, we
process all instances of the scene in parallel, resulting in significant time savings."
REFERENCES,0.7612612612612613,"F
Evaluation Details"
REFERENCES,0.7657657657657657,"PanoRecon. For evaluating PanoRecon [10], we adopt the official code and pretrained models for
inference and directly report the performance under 3D-Front [16] dataset by evaluating the metrics
(e.g. Chamfer Distance and F-Score) between the reconstructions and the ground truth meshes. For"
REFERENCES,0.7702702702702703,Figure 15: Outdoor scene reconstructions produced by deep prior assembly.
REFERENCES,0.7747747747747747,"G-SAM
Sta.-Diff.
Open-CLIP
Omnidata
Shap·E
RANSAC-Opti
Total"
REFERENCES,0.7792792792792793,"Time (s)
0.93
33.6
0.05
0.21
39.2
97.2
171.2"
REFERENCES,0.7837837837837838,Table 5: Runtime of each sub-pipeline on a RTX3090 GPU.
REFERENCES,0.7882882882882883,"the Replica [55] and BlendSwap [2] datasets where the scene location and orientation do not match
the 3D-Front dataset where the PanoRecon is trained, we first normalize the center of the predicted
scenes to the ground truth scenes and then register the predicted scene reconstructions to the ground
truth scenes. Specifically, we first predict an initial alignment by a global registration algorithm based
on feature matching [53] with RANSAC and then leverage ICP (Iterative Closest Point) registration
algorithm [52] to obtain the fine registration based on the initial alignment. The metrics are reported
with the registered reconstructions and the ground truth meshes."
REFERENCES,0.7927927927927928,"Total3D. We leverage the official code and the pretrained models for predicting scene reconstructions
with Total3D [42]. We evaluate Total3D under 3D-Front, Replica and BlendSwap with a similar
way as we evaluating PanoRecon to first normalize the predicted scenes and register them to the
ground truth ones before computing metrics. Total3D only predicts 3D objects and do not generate
backgrounds (e.g. wall and floor). Therefore, we further report the single-direction chamfer distance
from the generated objects to the ground truth meshes, i.e., Chamfer-L1 (S), to only evaluate the
accuracy of the generated objects. Note that Total3D can generate the scene layout which can roughly
represent the background, however, we find that Total3D generates layouts with large errors on all
the three datasets. Therefore we do not keep the layout of Total3D for evaluation."
REFERENCES,0.7972972972972973,"Mesh R-CNN. We adopt the official code and the pretrained models for predicting scene reconstruc-
tions with Mesh R-CNN [18]. We notice that Mesh R-CNN produces reconstructions with larger
scales than the predictions of other methods and the ground truths. Therefore, we first normalize both
the center and scale of the predicted scenes to the ground truth scenes and then register the predicted
scene reconstructions to the ground truth scenes with a similar way as we evaluate Total3D."
REFERENCES,0.8018018018018018,"Deep Prior Assembly. We evaluate our proposed deep prior assembly in the same way. We follow
the same settings as we evaluate other baselines to first normalize the center of the predicted scenes
to the ground truth scenes, and then register the predicted scenes to the ground truth scenes. The
background points (e.g. wall and floor) of deep prior assembly are obtained by back-projecting the
background depth maps, i.e., the areas where no instances exists."
REFERENCES,0.8063063063063063,"G
Limitation"
REFERENCES,0.8108108108108109,"One limitation of our method is that it may sometimes produce reconstructions with 3D instance
models that are not perfectly aligned with the 2D instance segmentations in the input images. For
example, the left chair generation in the last row of Fig. 8 exhibits a different color from the 2D
instance of the input image. The reason is that we use Stable-Diffusion to enhance and inpaint the 2D
instances, and then leverage Shap·E to generate 3D reconstructions. This process can introduce some
randomness in the generated textures. The randomness primarily affects the appearances, while the
geometries remain accurate. However, we justify that most reconstructions can faithfully recover the
consistent scene appearances and geometries from the input images. Another limitation of deep prior
assembly is that scene reconstructions may exhibit distortion due to inaccurate depth scale and shift.
This issue can be addressed by replacing Omnidata with recent advances in metric depth estimation
methods [63, 28]."
REFERENCES,0.8153153153153153,NeurIPS Paper Checklist
CLAIMS,0.8198198198198198,1. Claims
CLAIMS,0.8243243243243243,"Question: Do the main claims made in the abstract and introduction accurately reflect the
paper’s contributions and scope?
Answer: [Yes]
Justification: Our main claims made in the abstract and introduction accurately reflect the
paper’s contributions and scope.
Guidelines:"
CLAIMS,0.8288288288288288,"• The answer NA means that the abstract and introduction do not include the claims
made in the paper.
• The abstract and/or introduction should clearly state the claims made, including the
contributions made in the paper and important assumptions and limitations. A No or
NA answer to this question will not be perceived well by the reviewers.
• The claims made should match theoretical and experimental results, and reflect how
much the results can be expected to generalize to other settings.
• It is fine to include aspirational goals as motivation as long as it is clear that these goals
are not attained by the paper.
2. Limitations"
CLAIMS,0.8333333333333334,"Question: Does the paper discuss the limitations of the work performed by the authors?
Answer: [Yes]
Justification: We analysis the limitations of our method in Sec.H of the appendix.
Guidelines:"
CLAIMS,0.8378378378378378,"• The answer NA means that the paper has no limitation while the answer No means that
the paper has limitations, but those are not discussed in the paper.
• The authors are encouraged to create a separate ""Limitations"" section in their paper.
• The paper should point out any strong assumptions and how robust the results are to
violations of these assumptions (e.g., independence assumptions, noiseless settings,
model well-specification, asymptotic approximations only holding locally). The authors
should reflect on how these assumptions might be violated in practice and what the
implications would be.
• The authors should reflect on the scope of the claims made, e.g., if the approach was
only tested on a few datasets or with a few runs. In general, empirical results often
depend on implicit assumptions, which should be articulated.
• The authors should reflect on the factors that influence the performance of the approach.
For example, a facial recognition algorithm may perform poorly when image resolution
is low or images are taken in low lighting. Or a speech-to-text system might not be
used reliably to provide closed captions for online lectures because it fails to handle
technical jargon.
• The authors should discuss the computational efficiency of the proposed algorithms
and how they scale with dataset size.
• If applicable, the authors should discuss possible limitations of their approach to
address problems of privacy and fairness.
• While the authors might fear that complete honesty about limitations might be used by
reviewers as grounds for rejection, a worse outcome might be that reviewers discover
limitations that aren’t acknowledged in the paper. The authors should use their best
judgment and recognize that individual actions in favor of transparency play an impor-
tant role in developing norms that preserve the integrity of the community. Reviewers
will be specifically instructed to not penalize honesty concerning limitations.
3. Theory Assumptions and Proofs"
CLAIMS,0.8423423423423423,"Question: For each theoretical result, does the paper provide the full set of assumptions and
a complete (and correct) proof?
Answer: [NA]"
CLAIMS,0.8468468468468469,Justification: The paper does not include theoretical results.
CLAIMS,0.8513513513513513,Guidelines:
CLAIMS,0.8558558558558559,"• The answer NA means that the paper does not include theoretical results.
• All the theorems, formulas, and proofs in the paper should be numbered and cross-
referenced.
• All assumptions should be clearly stated or referenced in the statement of any theorems.
• The proofs can either appear in the main paper or the supplemental material, but if
they appear in the supplemental material, the authors are encouraged to provide a short
proof sketch to provide intuition.
• Inversely, any informal proof provided in the core of the paper should be complemented
by formal proofs provided in appendix or supplemental material.
• Theorems and Lemmas that the proof relies upon should be properly referenced."
EXPERIMENTAL RESULT REPRODUCIBILITY,0.8603603603603603,4. Experimental Result Reproducibility
EXPERIMENTAL RESULT REPRODUCIBILITY,0.8648648648648649,"Question: Does the paper fully disclose all the information needed to reproduce the main ex-
perimental results of the paper to the extent that it affects the main claims and/or conclusions
of the paper (regardless of whether the code and data are provided or not)?"
EXPERIMENTAL RESULT REPRODUCIBILITY,0.8693693693693694,Answer: [Yes]
EXPERIMENTAL RESULT REPRODUCIBILITY,0.8738738738738738,"Justification: We provide the detailed information in reproducing our methods in Sec.3,
Sec.4 of the main paper and the appendix. We also provide a demonstration code of our
method in the supplementary materials."
EXPERIMENTAL RESULT REPRODUCIBILITY,0.8783783783783784,Guidelines:
