Section,Section Appearance Order,Paragraph
ABSTRACT,0.0,Abstract
ABSTRACT,0.0045045045045045045,"Large language and vision models have been leading a revolution in visual comput-
ing. By greatly scaling up sizes of data and model parameters, the large models
learn deep priors which lead to remarkable performance in various tasks. In this
work, we present deep prior assembly, a novel framework that assembles diverse
deep priors from large models for scene reconstruction from single images in a
zero-shot manner. We show that this challenging task can be done without extra
knowledge but just simply generalizing one deep prior in one sub-task. To this
end, we introduce novel methods related to poses, scales, and occlusion parsing
which are keys to enable deep priors to work together in a robust way. Deep
prior assembly does not require any 3D or 2D data-driven training in the task and
demonstrates superior performance in generalizing priors to open-world scenes.
We conduct evaluations on various datasets, and report analysis, numerical and
visual comparisons with the latest methods to show our superiority. Project page:
https://junshengzhou.github.io/DeepPriorAssembly."
INTRODUCTION,0.009009009009009009,"1
Introduction"
INTRODUCTION,0.013513513513513514,"Reconstructing scenes from images is a vital task in 3D computer vision and computer graphics. It
bridges the gap between the 2D images that can be easily captured by phone cameras and the 3D
geometries of scenes for various real-world applications, e.g., autonomous driving, augmented/virtual
reality and robotics. Reconstructing scenes from multi-view images [60, 67] is well-explored to
recover 3D geometries with multi-view consistency and camera poses. However, reconstructing a
scene from a single RGB image is still challenging, which is extremely difficult due to inadequate
information. Recent works [10, 42] try to solve this task as a reconstruction problem which leverages
neural networks with an encoder-decoder architecture to draw supervisions from pairs of images and
3D ground truth geometries and layouts. Nevertheless, due to the limited amount of image-scene
pairs, these methods struggle to generalize to out-of-distribution images in open world."
INTRODUCTION,0.018018018018018018,"Large language and vision models have been extensively studied in the past few years, which
revolutionized neural language processing [58, 6], 2D/3D representation learning [15, 77] and content
generation [51, 26], etc. By greatly scaling up sizes of training samples and model parameters,
large models show brilliant capabilities and remarkable performance. However, they are limited in a
specific task, which limits their capability in high level perception tasks. Driven by the observation,
we raise an interesting question: can we assemble series of deep priors from large models, which are
experts with different modalities in different tasks, to solve an extremely challenging task that none
of them can accomplish alone?"
INTRODUCTION,0.02252252252252252,†The corresponding author is Yu-Shen Liu.
INTRODUCTION,0.02702702702702703,"Figure 1: An illustration of our work. We assemble diverse deep priors from large models with
frozen parameters for scene reconstruction from single images in a zero-shot manner."
INTRODUCTION,0.03153153153153153,"In this work, we propose deep prior assembly, a novel framework which assembles diverse deep
priors from large models for scene reconstruction from single images in a zero-shot manner. We
rethink this task from a new perspective, and decompose it into a set of sub-tasks instead of seeking
to a data-driven solution. We narrow down the responsibility of each deep prior on a sub-task that it
is good at, and introduce novel methods related to poses, scales, and occlusion parsing to enable deep
priors to work together in a robust way."
INTRODUCTION,0.036036036036036036,"Specifically, we first detect and segment the instances in the input image with Grounded-SAM
[29, 33], which is a variation of Segment-Anything Model [29]. For the segmented instances that
are often corrupted due to occlusions or of low resolution, we leverage Stable-Diffusion [51] to
enhance and inpaint images containing the segmented instances. However, the Stable-Diffusion often
produces some predictions which drift away from the input instances and do not conform to the
original appearance. To solve this issue, we introduce to use Open-CLIP [47, 23] to filter out the
bad samples and select the ones matching the input instance most. We then generate the 3D models
for each instance with Shap·E [26] using the amended instance images as input. Additionally, we
estimate the depth of the origin image with Omnidata [13] as the 3D scene geometry prior. To recover
a layout consistent to the image, we propose an approach to optimize the location, orientation and
size for each 3D instance to fit it to the estimated segmentation masks and the depths."
INTRODUCTION,0.04054054054054054,"Deep prior assembly merely generalizes deep priors and does not require additional data-driven
training for extra prior knowledge. Our evaluations on various open-world scenes show our capability
of reconstructing diverse objects and recovering plausible layout merely from a single view angle.
Our main contributions can be summarized as follows."
INTRODUCTION,0.04504504504504504,"• We propose deep prior assembly, a flexible framework that assembles diverse deep priors
from large models together for reconstructing scenes from single images in a zero-shot
manner."
INTRODUCTION,0.04954954954954955,"• We introduce a novel approach to optimizing the location, orientation and scale of instances
by matching them with both 2D and 3D supervision."
INTRODUCTION,0.05405405405405406,"• We evaluate deep prior assembly for generating diverse open-world 3D scenes, and show
our superiority over the state-of-the-art supervised methods."
RELATED WORK,0.05855855855855856,"2
Related Work"
LARGE MODELS IN DIFFERENT MODALITIES,0.06306306306306306,"2.1
Large Models in Different Modalities"
LARGE MODELS IN DIFFERENT MODALITIES,0.06756756756756757,"Recently, it has been drawing significant attention on scaling up deep models for much more
powerful representations and higher performances with different modalities (e.g. NLP, 2D vision).
Starting from NLP, recent works in scaling up pre-trained language models [6, 34, 48] have largely
revolutionized natural language processing. Some researches translates the progress from language
to 2D vision [47, 12, 3, 20, 15] and 3D vision [77] via model and data scaling."
LARGE MODELS IN DIFFERENT MODALITIES,0.07207207207207207,"Except for the large foundation models which focus on producing large-scale representations for
language, 2D images or 3D point clouds, some researches explore large models for specific tasks
(e.g. text-to-image generation [51], image segmentation [29], 3D analysis [62, 78, 76, 31, 30] and 3D
object generation [80, 61, 35, 79]) and have shown remarkable performance. Stable Diffusion trains
a large model of latent diffusion models and achieves commercially available 2D content generation"
LARGE MODELS IN DIFFERENT MODALITIES,0.07657657657657657,Grounded- SAM
LARGE MODELS IN DIFFERENT MODALITIES,0.08108108108108109,Stable-
LARGE MODELS IN DIFFERENT MODALITIES,0.08558558558558559,Diffusion ……
LARGE MODELS IN DIFFERENT MODALITIES,0.09009009009009009,Open-CLIP
LARGE MODELS IN DIFFERENT MODALITIES,0.0945945945945946,Shap.E
LARGE MODELS IN DIFFERENT MODALITIES,0.0990990990990991,Omnidata
LARGE MODELS IN DIFFERENT MODALITIES,0.1036036036036036,"Back Projection
Translation"
LARGE MODELS IN DIFFERENT MODALITIES,0.10810810810810811,Rotation
LARGE MODELS IN DIFFERENT MODALITIES,0.11261261261261261,"Scale
ℒ2DMatching"
LARGE MODELS IN DIFFERENT MODALITIES,0.11711711711711711,ℒ3DMatching
LARGE MODELS IN DIFFERENT MODALITIES,0.12162162162162163,Pose/Scale Optimization
LARGE MODELS IN DIFFERENT MODALITIES,0.12612612612612611,"Matching 
Error = 0.36"
LARGE MODELS IN DIFFERENT MODALITIES,0.13063063063063063,"Matching 
Error = 0.24"
LARGE MODELS IN DIFFERENT MODALITIES,0.13513513513513514,"Matching 
Error = 0.18 × × √ Sofa Table Table"
LARGE MODELS IN DIFFERENT MODALITIES,0.13963963963963963,"Figure 2: The overview of deep prior assembly. Given a single image of a 3D scene, we detect
the instances and segment them with Grounded-SAM. After normalizing the size and center for the
instances, we attempt to amend the quality of the instance images by enhancing and inpainting them.
Here, we take a sofa in the image for example. Leveraging the Stable-Diffusion model, we generate a
set of candidate images through image-to-image generation, with additional guidance from a text
prompt of the instance category predicted by Grounded-SAM. We then filter out the bad generation
samples with Open-CLIP by evaluating the cosine similarity between the generated instances and
original one. After that, we generate multiple 3D model proposals for this instance with Shap·E
from the Top-K generated instance images. Additionally, we estimate the depth of the origin input
image with Omnidata as a 3D geometry prior. To estimate the layout, we propose an approach to
optimize the location, orientation and scale for each 3D proposal by matching it with the estimated
segmentation masks and the depths (the ⋆for the example sofa). Finally, we choose the 3D model
proposal with minimal matching error as the final prediction of this instance, and the final scene is
generated by combining the generated 3D models for all detected instances."
LARGE MODELS IN DIFFERENT MODALITIES,0.14414414414414414,"effects. Segment Anything Model (SAM) [29] revolutionize the field of image segmentation by
training models with large-scale annotated data. Omnidata [13] trains the large depth estimation
model with various data sources for bringing robust 3D awareness to pure RGB images. In the 3D
domain, the recent works Point·E [40] and Shap·E [26] collect millions of 3D objects to train large
3D models for generating 3D geometries from rendering-style images or texts. In this work, we
aim at leveraging the powerful capabilities of the large models in different modalities and different
domains to solve a challenging task, i.e. scene generation from single images, by assembling deep
priors together."
SCENE RECONSTRUCTION FROM IMAGES,0.14864864864864866,"2.2
Scene Reconstruction from Images"
SCENE RECONSTRUCTION FROM IMAGES,0.15315315315315314,"Recovering the underlying 3D surfaces of scenes from images [60, 70, 22, 19, 41] or point clouds
[72, 75, 73, 25, 36, 74, 24, 43] is a long-standing task in 3D computer vision. Most of the previous
works focus on the multi-view reconstruction with the input dense images captured around the scene.
Classic multi-view stereo methods [1, 5, 4] mainly represent the scene by estimating depths for
dense images with feature matching. Inspired by NeRF [39] which performs volume rendering
for scene representation, a series of works [60, 44, 65, 59, 68, 69] introduce the neural implicit
surface reconstruction by learning signed distance fields [45] or occupancy fields [38] for scenes
from multi-view images. NeuRIS [59] proposes to use normal priors for indoor scene reconstruction,
and MonoSDF [67] further introduces monocular depth cues for improving scene geometries."
METHOD,0.15765765765765766,"3
Method"
METHOD,0.16216216216216217,"Overview. The overview of deep prior assembly is shown in Fig. 2. We will start from an
introduction of the task decomposition in Sec. 3.1 and then present the pipeline for solving each of
the decomposed sub-tasks using a deep prior from a specific large model in Sec. 3.2. Finally, we
introduce an optimization-based approach for layout estimation in Sec. 3.3."
TASK DECOMPOSITION,0.16666666666666666,"3.1
Task Decomposition"
TASK DECOMPOSITION,0.17117117117117117,"Revealing 3D scene geometries from a single image is an extremely challenging task duo to limited
context and supervisions. Instead of using a data-driven strategy to learn priors [42, 10], we reformu-
late this task from a new perspective. We decompose it into a set of sub-tasks, each of which can be
done using one deep prior without a need of learning extra knowledge. More specifically, we can
progressively resolve the task by:"
TASK DECOMPOSITION,0.17567567567567569,"1) First, performing detection and segmentation on the input image to acquire the segmentation
images, masks and category labels for all detected instances."
TASK DECOMPOSITION,0.18018018018018017,2) Amending instance images through enhancing and inpainting to improve the image qualities.
TASK DECOMPOSITION,0.18468468468468469,3) Generating a set of 3D model proposals for each instance from 2D segmented images.
TASK DECOMPOSITION,0.1891891891891892,"4) Estimating the layout by predicting the location, rotation, and scale for each 3D proposal to
put them to the correct position of the 3D scene."
TASK DECOMPOSITION,0.19369369369369369,"5) Producing a scene reconstruction by applying the estimated layout and shape poses with
reconstructed instances."
ASSEMBLING LARGE MODELS,0.1981981981981982,"3.2
Assembling Large Models"
ASSEMBLING LARGE MODELS,0.20270270270270271,"Inspired by the remarkable performances of recent large models, we propose to assign an expert large
model in each sub-task, which maximizes their abilities for modeling a scene in a zero-shot manner."
ASSEMBLING LARGE MODELS,0.2072072072072072,"Detect and Segment 2D instances. To reveal a scene S from a single image I, we first detect the
instances in I and separate multiple objects into single instances. In this way, we can reconstruct a
scene at shape level, which simplifies the task."
ASSEMBLING LARGE MODELS,0.21171171171171171,"Mask R-CNN vs. SAM vs. Grounded SAM. Detecting and segmenting images have been widely
explored in the past few years. Mask R-CNN [21] is widely adopted as a popular and robust backbone.
However, the performance of Mask R-CNN does not generalize well since it is only trained under a
relative small dataset. Recently, the large SAM [29] have shown promising segmentation accuracy by
scaling up parameters and using more training samples, nevertheless, it only predicts fine-grained
masks but with few semantic concepts. Thus, we adopt Grounded-SAM, which is an improved
version of SAM by introducing Grounding-DINO [33] as an open-set detector and using SAM to
jointly predict detection boxes, segmentation masks and category labels for each instance, formulated
as:
{mi, ci, di}N
i=1 = GroundedSAM(I), where di > σ
(1)"
ASSEMBLING LARGE MODELS,0.21621621621621623,"{mi, ci, di} includes the predicted mask mi, category ci and the detection confidence score di for
the i-th instance, and N is the number of instances in this scene. We only keep the predictions with
a high confidence score larger than a threshold σ. The low confident instances often contain large
occlusions or wrong category predictions."
ASSEMBLING LARGE MODELS,0.22072072072072071,"Enhance and Inpaint 2D instances. With the predicted masks {mi}N
i=1, we achieve the segmented
instance images {ti}N
i=1 by masking the original input image I. We then normalize each instance
image by centering it at the origin and normalizing its scale in {ti}N
i=1 to 0.6 of the max width
or height of I. As shown in Fig. 2, the segmented instance images often suffer from occlusions
or low-resolution of small instances. The low-quality images have a large negative impact on the
followup 3D generation. Therefore, we propose to first improve the quality of instance images by
enhancing and inpainting them with the large model Stable-Diffusion [51]."
ASSEMBLING LARGE MODELS,0.22522522522522523,"Specifically, we adopt the image-to-image generation [37] from Stable-Diffusion. We take the
instance image ti as the initialization, and add noises on it and then subsequently denoise the noise
corrupted image to increase the realism through the guidance of the text prompt description from the
predicted categories ci. We find the prompt template ‘High quality, authentic style {category}’ works
fine for most of the indoor instances. For other situations, we directly leverage the category as the
prompt. We observe that Stable-Diffusion may produce some unreliable predictions which are ‘too
creative’ and can not faithfully improve the image quality but turn it into another image, as shown in
Fig. 3. To solve this issue, we generate multiple enhanced images {ej
i}M
j=1 for each instance image ti
and filter out the bad generation samples with the approaches described next."
ASSEMBLING LARGE MODELS,0.22972972972972974,Stable-Diffusion
ASSEMBLING LARGE MODELS,0.23423423423423423,0.4455
ASSEMBLING LARGE MODELS,0.23873873873873874,0.0270
ASSEMBLING LARGE MODELS,0.24324324324324326,0.0622
ASSEMBLING LARGE MODELS,0.24774774774774774,Open-CLIP 1
ASSEMBLING LARGE MODELS,0.25225225225225223,0.1823
ASSEMBLING LARGE MODELS,0.25675675675675674,0.1509 3 2
ASSEMBLING LARGE MODELS,0.26126126126126126,"Shap.E
Shap.E"
ASSEMBLING LARGE MODELS,0.26576576576576577,0.1321
ASSEMBLING LARGE MODELS,0.2702702702702703,"Figure 3: Examples on the effect of our pipeline. For the
corrupted 2D instant segmented from the scene image, we
leverage Stable-Diffusion to produce 6 amended genera-
tions. We then adopt Open-CLIP to filter out bad samples
by judging the similarities and producing confidence scores
for the generations, and keep the Top-3 generated images.
The shape generations with Shap·E from the amended im-
ages are significantly more complete and accurate than the
one produced by the original corrupted image."
ASSEMBLING LARGE MODELS,0.2747747747747748,"Filter Out Bad Generation Samples.
To filter out the bad generation samples
produced by Stable-Diffusion and se-
lect the top K enhanced images for the
following 2D-to-3D generation, we pro-
pose to leverage the CLIP models as a
judge to determine which generated im-
ages {ej
i}M
j=1 from Stable-Diffusion can
conform to the original appearance of
the instance ti. Specifically, we adopt
the large open-sourced CLIP [47] model
Open-CLIP [23] as the implementation."
ASSEMBLING LARGE MODELS,0.27927927927927926,"We use cosine similarities {zj
i }M
j=1 be-
tween the generated instance image
{ej
i}M
j=1 and the original one ti as a met-
ric for the selection, formulated as:"
ASSEMBLING LARGE MODELS,0.28378378378378377,"zj
i =
fθ(ej
i) · fθ(ti)"
ASSEMBLING LARGE MODELS,0.2882882882882883,"∥fθ(ej
i)∥∥fθ(ti)∥
,
(2)"
ASSEMBLING LARGE MODELS,0.2927927927927928,"where fθ is the frozen image encoder
from Open-CLIP. We use the Top-K
generated instance images with the largest similarities to the original ti as the amended images.
As shown in Fig. 3, Open-CLIP successfully filters out the bad generations."
ASSEMBLING LARGE MODELS,0.2972972972972973,"Generate 3D models from 2D instances. The object-level 3D generation from single images [38, 61]
is a well-explored task in 3D computer vision, however, most previous works show limited generation
performance on open-world images. Shap·E [26] is a large model for 3D generation by training a
3D hyper diffusion model with millions of non-public 3D objects. Therefore, we leverage Shap·E to
provide the deep prior to convert 2D instance images into 3D reconstructions. By this way, we obtain
K 3D reconstruction proposals {sk
i }K
k=1 for each 2D instance ti by employing Shap·E on the top K
amended images."
RECOVERING SCENE LAYOUT,0.30180180180180183,"3.3
Recovering Scene Layout"
RECOVERING SCENE LAYOUT,0.3063063063063063,"The final step is to select the most accurate 3D model proposal ˆsi from the K candidates {sk
i }K
k=1
and put it to the right position in a 3D scene to recover the scene layout in the input image. To achieve
this, we propose a novel approach to optimize the location, orientation and size for each 3D proposal
in {sk
i }K
k=1 by matching it with the estimated segmentation mask and the estimated depth. We further
introduce a RANSAC-like solution for robust position optimizing. We select the reconstruction with
the minimum matching error as the reconstruction ˆsi of ti."
M,0.3108108108108108,"0.032 m
3.922 m"
M,0.3153153153153153,Omnidata
M,0.31981981981981983,"Direct
Back Projection"
M,0.32432432432432434,3.870 m
M,0.32882882882882886,"Back Projection
with Scale/Shift
Ground Turth"
M,0.3333333333333333,"Figure 4: Illustration of the depth transform. The es-
timated depth maps from Omnidata is not scale-aware,
resulting in scale inaccuracies and distortion in the back-
projected depth point clouds. We achieve the accurate
depth point cloud by first transforming the depth maps
with the pre-solved scale and shift before back-projecting."
M,0.33783783783783783,"Depth Estimation. For more accurate
layout estimations, we first estimate the
depth map of the input image I as a 3D
geometry prior. We leverage the large
model Omnidata [13, 27] as the depth
estimator which is trained under a col-
lected huge depth dataset [13] contain-
ing 14-million indoor, outdoor, scene-
level and object-level samples."
M,0.34234234234234234,"An issue here is that the depth D esti-
mated for the input image I with Om-
nidata is not scale-aware, which can not
be directly used as supervisions. We
solve this problem by estimating the
scale h and shift q of the predicted
depth using one pair of predicted and
real depth of a selected scene for each"
M,0.34684684684684686,"dataset. Specifically, we leverage least-squares criterion [14, 49] which has a closed-form solution
to solve the depth scale and shift by matching the pair of predicted and real depth with a specific
scene camera intrinsic parameter CK. After transforming D with the scale h and shift q, we can now
back-project D into the 3D space with camera intrinsic parameter CK, achieving a 3D scene depth
point cloud. The example in Fig. 4 shows that the depth point cloud produced using the transformed
depth maps precisely aligns with the ground truth scene. Alternatively, we can use metric depth
estimation methods [63, 66, 64, 28], which naturally handle depth scale and shift, to replace Omnidata
and lessen the reliance on ground truth depth data. The depth point cloud di for each instance ti is
further achieved by masking the back-projected 3D point cloud."
M,0.35135135135135137,"Pose/Scale Optimization. We further estimate the scale and pose of each 3D model proposal sk
i
to put them into the right position in the 3D scene. We propose to solve this problem with an
optimization-based approach on the location, rotation and size for sk
i per the mask mi from the
Grounded-SAM and the depth point cloud di from Omnidata."
M,0.35585585585585583,"We model this problem as a 7-DoF shape registration task with 3-DoF of translation (tx, ty, tz),
3-DoF of rotation (rx, ry, rz) and one DoF of object scale (v). Specifically, we first sample a point
cloud pk
i from the mesh of a 3D proposal sk
i and initialize a 7-DoF transform as a transformation
function fϕ with learnable 7-DoF parameters ϕ. We then project pk
i with fϕ to achieve the transformed
prediction ˆpk
i by:"
M,0.36036036036036034,"ˆpk
i = fϕ(pk
i ).
(3)"
M,0.36486486486486486,"We obtain ˆpk
i by optimizing the 7-Dof parameters ϕ with supervisions. With the estimated depth di,
we can draw the direct 3D matching supervision by minimizing the Chamfer Distance Loss between
the transformed ˆpk
i and the depth points di. However, merely with the 3D matching constraint, the
pose/scale optimization do not always converge stably since the predicted depth di is usually with
noises in complex scenes, which significantly affects the registration on shapes."
M,0.36936936936936937,"To resolve this issue, we get inspirations from [8] to leverage the mask information predicted by Stable-
Diffusion as an extra matching supervision in 2D space. Specifically, we project the transformed
3D point cloud ˆpk
i to the 2D space with the camera intrinsic parameters CK, resulting in a 2D point
cloud ˜pk
i . Meanwhile, we form another 2D point cloud ˜mi from the mask mi by randomly sampling
dense 2D points on the occupied region of the mask mi. We then use the 2D matching constraint
to minimize the 2D Chamfer Distance between ˜pk
i and ˜mi. We illustrate the effect of 2D Matching
constraint with an optimization example in Fig. 5. The final loss for pose/scale optimization of 3D
reconstruction sk
i is then formulated as:"
M,0.3738738738738739,"L = L3D
CD(di, ˆpk
i ) + L2D
CD(˜pk
i , ˜mi).
(4)"
M,0.3783783783783784,Without 2DMatching
M,0.38288288288288286,"Initialize
100 iters
300 iters
1000 iters
700 iters"
M,0.38738738738738737,With 2DMatching
M,0.3918918918918919,"Figure 5: Effect of the 2D Matching. An example of op-
timizing the pose and scale for a chair. We visualize the
optimization in 2D space. The red 2D points indicate the
dense 2D point cloud sampled in the mask, which is the target.
And the green 2D points donate the 2D projection of trans-
formed 3D point clouds sampled from the generated shape
of this chair instance. More robust registration is achieved
with the proposed 2D matching constraint. The total 1,000
iterations take 9.2 seconds on a single 3090 GPU."
