Section,Section Appearance Order,Paragraph
ABSTRACT,0.0,ABSTRACT
ABSTRACT,0.0032679738562091504,"Protecting the privacy of user data is crucial when training neural text generation
models, which may leak sensitive user information during generation. Differentially
private (DP) learning algorithms provide guarantees on identifying the existence of
a training sample from model outputs. PATE is a DP learning algorithm that fits
large models well, such as GPT. In this paper, we propose SeqPATE that adapts
PATE to text generation while satisfying DP. There are two key challenges in
adapting PATE to text generation: (i) obtaining sequence-level supervision for text
generation, and (ii) reducing noise required to protect the privacy given a large
output space (i.e. vocabulary size). For (i), we generate pseudo input and reduce
the sequence generation problem to the next word prediction. For (ii), we reduce
the output space with top-k and top-p selection strategy that dynamically filters the
candidate words; and we refine the teacher aggregation of PATE to avoid the low
agreement rates due to voting over the large output space. To limit the privacy loss,
we design an efficient knowledge distillation to reduce the frequency of distilling
from the private data. We apply SeqPATE to a simple text generation task (sentence
completion) and achieve 39% and 28% gains in Bleu4 on two datasets."
INTRODUCTION,0.006535947712418301,"1
INTRODUCTION"
INTRODUCTION,0.00980392156862745,"Recent work showed that sensitive user information in training corpora, such as address and name, can
be extracted from text generation models (Carlini et al., 2019; 2020). Providing privacy guarantees to
the text used to train text generation models has become a critical problem. Differential privacy (DP)
provides provable guarantees against the identification of individuals in the dataset. Deep learning
models with DP guarantees ensure the existence of a specific training sample cannot be detected."
INTRODUCTION,0.013071895424836602,"The most popular DP algorithm for deep learning is Noisy-SGD (Song et al., 2013; Bassily et al.,
2014; Abadi et al., 2016), which adds noise to the gradients. However, the advantage of NoisySGD
is weaken as the model becomes larger (Yu et al., 2020), and NoisySGD requires a per-example
gradient clip, which causes non-convergence and system overheads (Zhu et al., 2020; Bu et al., 2021).
Applying Noisy-SGD to large text generation models (e.g. GPT-2) requires additional tricks such
as memory reduction (Li et al., 2021) and advanced fine-tuning strategies (Yu et al., 2021). PATE
(Papernot et al., 2017) is a DP learning model using a teacher-student framework: a student accessing
non-sensitive data distills knowledge from the aggregated predictions of multiple teachers trained
on sensitive data. Calibrated noise is added to the aggregated predictions to satisfy DP. PATE can
handle large models since its privacy cost derives from the knowledge distillation instead of the model
parameters. PATE takes advantage of non-sensitive data which is also available in our scenario."
INTRODUCTION,0.016339869281045753,"In this paper, we propose, SeqPATE, a DP learning algorithm for text generation that exploits both
sensitive and non-sensitive data by knowledge distillation. Specifically, we adapt PATE for text
generation. The adaptation is challenging due to the sequential generation and the large output
space (i.e. vocabulary size) in text generation. Firstly, to obtain the sentence-level supervision for
text generation, directly applying PATE needs to roll out all teachers to produce a sentence (i.e. all
teachers must vote to generate a word, which is then used as the input for the next word prediction).
Running inference for a large number of teachers can be costly. Secondly, the large output space
results in (i) low agreement rate among teachers and (ii) large noise required by DP, both would
significantly hurt task performance."
INTRODUCTION,0.0196078431372549,Under review as a conference paper at ICLR 2022
INTRODUCTION,0.02287581699346405,"To avoid sequential generation, we generate pseudo data using a pre-trained language model such
that teachers only need to provide token-level supervision given the pseudo input. To handle the large
output space, we aggregate teachers’ outputs by interpolating their output distributions instead of
voting with argmax predictions. To reduce the noise scale, we propose strategies to dynamically
filter candidate words that only keep words with large probabilities. Further, we design an efficient
knowledge distillation strategy that only queries the teacher when the student has poor performance."
INTRODUCTION,0.026143790849673203,"We evaluate our method on sentence completion, a simple but representative task of text generation.
Compared to baselines including Noisy-SGD (Kerrigan et al., 2020), SeqPATE improves Bleu4 by
39% and 28% on two datasets with meaningful privacy protection 1. We observe SeqPATE works
particularly well under relatively strong privacy protection (e.g., ε ≤2) compared to Noisy-SGD. Our
contribution is threefold: (i) Our model significantly surpasses baselines and makes DP algorithm
achieve satisfactory performance on text generation; (ii) We propose several practical strategies to
enable SeqPATE to handle text generation with a sequential of classifications over larger output
spaces; (iii) We are the first to adapt PATE, an effective DP algorithm, to text generation."
PROBLEM SETUP,0.029411764705882353,"2
PROBLEM SETUP"
PROBLEM SETUP,0.032679738562091505,"Our goal is to achieve the privacy protection defined by DP in text generation: preventing attackers
from inferring whether a sample or an n-gram appears in the training set. (Formal definition in Sec. 5)"
PROBLEM SETUP,0.03594771241830065,"PATE assumes students are trained on unlabeled non-sensitive data. Similar to PATE, our setting
contains two textual datasets: 1. a private set Dpri from a corpus with sensitive information. 2. a public
set Dpub without sensitive information (e.g. incomplete or masked text spans) or data contributors
(e.g. volunteers) have no objection to publishing their data. Algorithms are required to protect the
privacy on the private set and can ignore the privacy protection on the public set. The final goal is to
do well on the private set during inference."
PROBLEM SETUP,0.0392156862745098,"Text generation is to generate a sequence of words S = {w1, w2, . . . , wl}. Our application is a
simple text generation task, sentence completion, which aims to generate the remaining part of a
sentence w1:l given its prefix p1:l′, where p1:l′ and w1:l are the abbreviation of {p1, p2, . . . , pl′} and
{w1, w2, . . . , wl} respectively. p1:l′ and w1:l compose a complete sentence. We collect some input
prefixes p1:l′ to compose the public set Dpub and the original samples (complete sentences) compose
the private set Dpri. Such a setting fits for some real-world text generation applications: in dialog
systems, the training samples from online services consist of questions and responses. The questions
from customer service staffs or service robots can be public and the response from users carrying
individual information should be private. In writing assistants where a sample has an input prompt
and an essay body, the prompt can be public but the body written by data contributors is private."
BACKGROUND ON DP AND PATE,0.042483660130718956,"3
BACKGROUND ON DP AND PATE"
BACKGROUND ON DP AND PATE,0.0457516339869281,"Differential privacy (DP) (Dwork et al., 2006; 2014) is a quantifiable definition of privacy that
provides provable guarantees on identifications of individuals in the dataset. ML algorithms with DP
guarantee ensure that each individual training sample has a degree of plausible deniability, i.e., the
trained model is just as likely as to have been trained on an alternative dataset without that sample."
BACKGROUND ON DP AND PATE,0.049019607843137254,"PATE, designed for classification tasks, takes advantage of an unlabeled public dataset Dpub and also
trains on a labeled private Dpri in a semi-supervised scenario. PATE is model-agnostic and treats
models as black-boxes. PATE (Papernot et al., 2017) achieves DP via a teacher-student framework
with M teacher models and a student model, where the student learns from the private data via
knowledge distillation through teachers. PATE consists of three parts,"
BACKGROUND ON DP AND PATE,0.05228758169934641,"• Teacher models are trained on the private set Dpri . Dpri is shuffled and divided into M disjoint
subsets, and m-th subset serves as the training set for m-th teacher model f m
ϕ ."
BACKGROUND ON DP AND PATE,0.05555555555555555,"• Teacher aggregation merges teachers’ outputs. After teachers’ training, each teacher f m
ϕ conducts
the prediction (classification) on student’s training set Dpub. To satisfy DP, PATE aggregates M"
BACKGROUND ON DP AND PATE,0.058823529411764705,"1We choose ε = 2. DP with ε ∈[0.1, 5] is regarded as a meaningful protection (Triastcyn & Faltings, 2020)."
BACKGROUND ON DP AND PATE,0.06209150326797386,Under review as a conference paper at ICLR 2022
BACKGROUND ON DP AND PATE,0.06535947712418301,Cats    sit       on      the    mats GPT
BACKGROUND ON DP AND PATE,0.06862745098039216,Private Data
BACKGROUND ON DP AND PATE,0.0718954248366013,+Noise
BACKGROUND ON DP AND PATE,0.07516339869281045,Teacher3
BACKGROUND ON DP AND PATE,0.0784313725490196,Teacher2
BACKGROUND ON DP AND PATE,0.08169934640522876,Teacher1
BACKGROUND ON DP AND PATE,0.08496732026143791,Student
BACKGROUND ON DP AND PATE,0.08823529411764706,Public data
BACKGROUND ON DP AND PATE,0.0915032679738562,NLL loss
BACKGROUND ON DP AND PATE,0.09477124183006536,"Data1
Data2
Data3"
BACKGROUND ON DP AND PATE,0.09803921568627451,Cats    sit       on     the
BACKGROUND ON DP AND PATE,0.10130718954248366,Cats    sit       on     the
BACKGROUND ON DP AND PATE,0.10457516339869281,Cats    sit       on     the
BACKGROUND ON DP AND PATE,0.10784313725490197,"Top-K / Top-P 
   Selection"
BACKGROUND ON DP AND PATE,0.1111111111111111,|Vocabulary|
BACKGROUND ON DP AND PATE,0.11437908496732026,"Sit     0.42
Sat    0.33    
Lay    0.10
Are    0.08
       ...
Alaia  1e-6 
Ruth   1e-8 Top-K"
BACKGROUND ON DP AND PATE,0.11764705882352941,Aggregate
BACKGROUND ON DP AND PATE,0.12091503267973856,Teacher Inference
BACKGROUND ON DP AND PATE,0.12418300653594772,sit       on     the    mats
BACKGROUND ON DP AND PATE,0.12745098039215685,"Selection For Efficient 
Knowledge Distillation (KD)"
BACKGROUND ON DP AND PATE,0.13071895424836602,"Teacher3
Teacher2
Teacher1"
BACKGROUND ON DP AND PATE,0.13398692810457516,Cats  sit
BACKGROUND ON DP AND PATE,0.13725490196078433,Cats  sit  on  the  mats
BACKGROUND ON DP AND PATE,0.14052287581699346,Prefix word
BACKGROUND ON DP AND PATE,0.1437908496732026,Pseudo word
BACKGROUND ON DP AND PATE,0.14705882352941177,Satisfied (no need KD)
BACKGROUND ON DP AND PATE,0.1503267973856209,Not satisfied (need KD)
BACKGROUND ON DP AND PATE,0.15359477124183007,Teacher Training
BACKGROUND ON DP AND PATE,0.1568627450980392,Student Training
BACKGROUND ON DP AND PATE,0.16013071895424835,Output word distribution
BACKGROUND ON DP AND PATE,0.16339869281045752,Output distributions of student words
BACKGROUND ON DP AND PATE,0.16666666666666666,Ground truth for student
BACKGROUND ON DP AND PATE,0.16993464052287582,"Figure 1: Overview of SeqPATE. SeqPATE trains teachers on the private data; it conducts student
training and teacher inference on pseudo sentences generated by GPT based on the public data. The
student is supervised by the aggregation of teacher output distributions and benefits from efficient
knowledge distillation (pink block) and top-k / top-p selection (white block in the top right corner)."
BACKGROUND ON DP AND PATE,0.17320261437908496,"teachers’ by voting with their top-1 predictions. PATE adds noise to aggregated teacher outputs so
that attackers cannot access the exact outputs to infer original information in samples.
• A student model fθ is trained on the public set Dpub and distills knowledge from private set (via the
teachers) without accessing the private samples. In this way, the sensitive information in the private
set is preserved even if the student’s architecture and parameters are public or reverse-engineered
by an adversary. We publish only the student model for prediction."
APPROACH,0.17647058823529413,"4
APPROACH"
APPROACH,0.17973856209150327,"Fig. 1 shows an overview of the SeqPATE. Given the public prefix (e.g., “Cats sit”), we first obtain
pseudo inputs by generating the remaining part of the whole sentence (e.g., “Cats sit on the mats”)
using a pre-trained language model (Sec. 4.1). The teachers’ output distributions are then averaged
to provide word-level supervision on the whole sentence (Sec. 4.2). To reduce the noise over large
output space and limit the privacy loss, we propose top-k / top-p selection to dynamically filter the
unimportant candidates and propose efficient knowledge distillation to reduce the number of teacher
queries (Sec. 4.3). Our training algorithm is shown in Appendix A."
STUDENT MODEL,0.1830065359477124,"4.1
STUDENT MODEL"
STUDENT MODEL,0.18627450980392157,"Conventional text generation models generate words in a sentence step-by-step and left-to-right.
Naively applying PATE to the above paradigm requires all the teachers to be roll out to obtain
supervision at every step, where all the teachers aggregate to generate a word at each step and the
word acts as the next input for all teachers. This means we should conduct all teachers’ inferences
simultaneously and interdependently, which is costly in both computation (involving hundreds of
teachers) and privacy costs."
STUDENT MODEL,0.1895424836601307,"Hence, in SeqPATE, we employ GPT to generate pseudo sentences and conduct teacher inference
and student training on the pseudo sentences. Firstly, given a prefix in Dpub, we employ the public
released pre-trained GPT to conduct the inference to complete a pseudo sentence. All the generated
pseudo sentences compose the student’s training set, denoted as ˜Dpub. Secondly, we conduct teacher
inference and student training on the sample S = {w1, w2, . . . , w|S|} from ˜Dpub. At the i-th step,
for the training of conventional text generations, the student learns to generate a word ˆwi given its
previous words w1:i−1. At the i-th step, our teachers conduct the inference to generate ˆwi given the
input w1:i−1 from the sample S. Then, each teacher provides its output for aggregation. All teachers
share the same input with the student so that the outputs of teachers and student are aligned and
comparable."
STUDENT MODEL,0.19281045751633988,Under review as a conference paper at ICLR 2022
TEACHER AGGREGATION,0.19607843137254902,"4.2
TEACHER AGGREGATION"
TEACHER AGGREGATION,0.19934640522875818,"The original PATE aggregates teacher results by taking the majority vote of the predicted labels from
all the teachers. However, this aggregation strategy does not fit for the large output space in text
generation. This is because the number of votes for each candidate may be very low and it would
result in low agreement. For example, multiple candidates may tie for the top-1 prediction."
TEACHER AGGREGATION,0.20261437908496732,"Therefore, inspired by (Hinton et al., 2015; Chen et al., 2020), we aggregate M teachers’ results by
averaging their output distributions, where each teacher model is trained on one of the disjoint subsets
divided from the private set Dpri. At the i-th step on teacher inference, the m-th teacher model f m
ϕ
predicts a word ˆwi with a probability pm
ϕ ( ˆwi). Then, our model aggregates all teachers’ probabilities"
TEACHER AGGREGATION,0.20588235294117646,"by averaging pϕ( ˆwi) =
1
M
PM
m=1 pm
ϕ ( ˆwi). Like most DP methods, our model adds noises so that the
privacy impact can be analyzed and bounded. Different from PATE that adds noise to vote numbers,
we add noise to the aggregation of teachers’ output distributions. Following (Papernot et al., 2018),
we apply the Gaussian mechanism which adds i.i.d. N(0, σ2) to each coordinate, where σ controls
the strength of privacy protection (more details in Sec. 5)."
SUPERVISION ON THE STUDENT MODEL,0.20915032679738563,"4.3
SUPERVISION ON THE STUDENT MODEL"
SUPERVISION ON THE STUDENT MODEL,0.21241830065359477,"Reducing output space via top-k or top-p selection.
Recall that the teacher output is a distribution
over all words in the vocabulary, and the noise must be added to each coordinate to satisfy DP. To
reduce the output dimension (hence the amount of noise), we only assign the probability mass to a
subset of candidates Wi. For all teachers and the student, we assign zero probability mass to any
candidates not in Wi and re-normalize distribution as shown in Eq. 1, where g(·) is the normalizing
function. This operation means the words not in Wi will never occur in student’s training and teachers’
supervision, so those words do not need noise to provide protection."
SUPERVISION ON THE STUDENT MODEL,0.21568627450980393,"g(p( ˆwi | w1:i−1)) = 

 
"
SUPERVISION ON THE STUDENT MODEL,0.21895424836601307,"p( ˆwi | w1:i−1)
P"
SUPERVISION ON THE STUDENT MODEL,0.2222222222222222,"w∈Wi p(w | w1:i−1)
if ˆwi ∈Wi"
SUPERVISION ON THE STUDENT MODEL,0.22549019607843138,"0
otherwise. (1)"
SUPERVISION ON THE STUDENT MODEL,0.22875816993464052,"We determine the subset Wi by two selection strategies: top-k and top-p. In the top-k selection, at
i-th step, we select the top-k candidates according to the probabilities generated by the student model.
Further, inspired by nucleus sampling (Holtzman et al., 2019), we propose a top-p selection that
chooses the minimum k where the cumulative probability of the top-k words is larger than a constant
close to 1 (e.g. 0.95) such that the candidate set covers a large proportion of the distribution. We note
that the candidate selection is based on the student’s output on public or already released input, thus
not affecting the privacy guarantee. This choice improves the privacy-utility tradeoff by adaptively
allocating the available privacy budgets to release the information more relevant to the task."
SUPERVISION ON THE STUDENT MODEL,0.23202614379084968,"Efficient knowledge distillation.
Reducing the number of querying teachers results in better privacy
protection. Therefore, we acquire teacher supervision only when the student has poor performance.
Concretely, we measure student’s performance on each token by comparing its output distribution
with the ground truth token (from ˜Dpub). Let rwi be the rank of the ground truth token wi in the
student’s predicted distribution, (i.e. the number of tokens with higher or equal probability). The
student model acquires the teachers’ supervision only if rwi is larger than a certain threshold rc. We
note that the selection of tokens relies only on the student and is independent of the teachers, thus the
selection does not cause additional privacy loss."
SUPERVISION ON THE STUDENT MODEL,0.23529411764705882,"Training objectives.
Different from the semi-supervised setting in PATE, our student model is
supervised by both teachers’ aggregation and labels from the pseudo public set ˜Dpub, since text
generation corpora are naturally labeled, unlike in classification tasks. Even if the pseudo set ˜Dpub
provides only pseudo samples, the labels from those samples are also useful given that the number of
querying teachers is limited due to privacy concerns. The student’s loss function consists of two parts
as shown in Eq. 2,"
SUPERVISION ON THE STUDENT MODEL,0.238562091503268,Under review as a conference paper at ICLR 2022
SUPERVISION ON THE STUDENT MODEL,0.24183006535947713,"• LKL
i
shows teachers’ supervisions. The student learns from teachers by minimizing KL divergence
between the student output distribution pθ and the merged teacher output distributions pϕ."
SUPERVISION ON THE STUDENT MODEL,0.24509803921568626,"• LNLL
i
shows the supervisions from the pseudo public set ˜Dpub generated by GPT. As conventional
language models, our student model is trained by negative log-likelihood (NLL) loss on ˜Dpub. The
words wi in the training sample is naturally the label for the student fθ(w1:i−1) at the i-th step."
SUPERVISION ON THE STUDENT MODEL,0.24836601307189543,"LKL
i
=
KL  g( 1 M ( M
X"
SUPERVISION ON THE STUDENT MODEL,0.25163398692810457,"m=1
pm
ϕ (· | w1:i−1) + N(0, σ2))) ∥pθ(· | w1:i−1) ! ,"
SUPERVISION ON THE STUDENT MODEL,0.2549019607843137,"LNLL
i
=
−log pθ(wi | w1:i−1),
L =
X"
SUPERVISION ON THE STUDENT MODEL,0.2581699346405229,"S∈˜
Dpub |S|
X"
SUPERVISION ON THE STUDENT MODEL,0.26143790849673204,"i=1
(LNLL
i
+ λLKL
i ).
(2)"
SUPERVISION ON THE STUDENT MODEL,0.2647058823529412,"where Li is loss at i-th step, |S| denotes the length of sentence S, and λ balances the two terms.
Meanwhile, the noise scale σ is discussed in Sec. 5. g(·) is the re-normalization function used in
Eq. 1 that re-normalizes the aggregated probabilities on the selected top-k or top-p words with noise 2.
According to the efficient knowledge distillation strategy, at each step, the loss Li is the combination
of LNLL
i
and LKL
i
if the student needs teachers’ supervision; otherwise, Li = LNLL
i
."
PRIVACY ANALYSIS,0.2679738562091503,"5
PRIVACY ANALYSIS"
PRELIMINARY OF DIFFERENTIAL PRIVACY,0.27124183006535946,"5.1
PRELIMINARY OF DIFFERENTIAL PRIVACY"
PRELIMINARY OF DIFFERENTIAL PRIVACY,0.27450980392156865,"Let D, D′ denote two neighboring datasets which differ at only one individual.
Definition 1 (Differential privacy). For ε > 0 and δ ≥0, a randomized algorithm M : X n →Y is
(ε, δ)-differentially private if for any neighboring datasets D ∼D′ and any S ⊆Y,"
PRELIMINARY OF DIFFERENTIAL PRIVACY,0.2777777777777778,Pr[M(D) ∈S] ≤eε · Pr[M(D′) ∈S] + δ
PRELIMINARY OF DIFFERENTIAL PRIVACY,0.28104575163398693,"The definition ensures that it is information-theoretically impossible for an adversary to infer whether
the input dataset is D or D′ even with arbitrary side information. The definition is also future proof
thanks to its closure to post-processing.
Lemma 2 (Post-processing). If M obeys (ε, δ)-DP, then for any function f, f ◦M is also (ε, δ)-DP."
PRELIMINARY OF DIFFERENTIAL PRIVACY,0.28431372549019607,One notable property of DP is that it automatically protects the privacy of groups of multiple units.
PRELIMINARY OF DIFFERENTIAL PRIVACY,0.2875816993464052,"Lemma 3 (Group privacy). An (ε, δ)-DP mechanism M on individuals is (kε, ekε−1"
PRELIMINARY OF DIFFERENTIAL PRIVACY,0.2908496732026144,"eε−1 δ)-DP on
groups of size k for all integers k ≥1.
Lemma 4 (Analytical Gaussian mechanism (Balle & Wang, 2018)). For a numeric query f : X n →
Rd over a dataset D, the randomized algorithm that outputs f(D) + Z where Z ∼N(0, σ2Id)
satisfies (ε, δ(ε))-DP for all ε ≥0 and δ(ε) = Φ( ∆"
PRELIMINARY OF DIFFERENTIAL PRIVACY,0.29411764705882354,2σ −εσ
PRELIMINARY OF DIFFERENTIAL PRIVACY,0.2973856209150327,∆) −eεΦ(−∆
PRELIMINARY OF DIFFERENTIAL PRIVACY,0.3006535947712418,2σ −εσ
PRELIMINARY OF DIFFERENTIAL PRIVACY,0.30392156862745096,"∆). where ∆:= ∆(f)
2
=
maxD∼D′ ∥f(D) −f(D′)∥2 is the global L2 sensitivity of f and Φ is the CDF function of N(0, 1)."
PRELIMINARY OF DIFFERENTIAL PRIVACY,0.30718954248366015,"The above is the (ε, δ)-DP of a single Gaussian mechanism, and the following lemma shows that we
can use the same result for an adaptive composition of a sequence of Gaussian mechanisms.
Lemma 5 (Composition of Gaussian mechanisms (Dong et al., 2019)). The adaptive composition of a
sequence of Gaussian mechanisms with a noise level σ1, σ2, . . . and global L2 sensitivity ∆1, ∆2, . . .
satisfies (ε, δ(ε))-DP for all ε ≥0 and δ(ε) ≤δM(ε) where M is a Gaussian mechanism with noise
multiplier σ/∆=
 P"
PRELIMINARY OF DIFFERENTIAL PRIVACY,0.3104575163398693,i(∆i/σi)2−1/2.
PRELIMINARY OF DIFFERENTIAL PRIVACY,0.3137254901960784,"Specifically, the adaptive composition of a k identical Gaussian mechanism with noise multiplier σ
satisfies the same privacy guarantee of that of a single Gaussian mechanism with a noise multiplier
σ/
√"
PRELIMINARY OF DIFFERENTIAL PRIVACY,0.31699346405228757,"k. By fixing k and ε, we can calibrate the noise by choosing an appropriate σ in our algorithm."
PRELIMINARY OF DIFFERENTIAL PRIVACY,0.3202614379084967,"2Mathematically, the input of the g(·) may be negative and we re-normalize it to 0. Practically, we observed
being negative is extremely rare since the M is very big (2000) and the first term dominates the input of g(·)"
PRELIMINARY OF DIFFERENTIAL PRIVACY,0.3235294117647059,Under review as a conference paper at ICLR 2022
DIFFERENTIAL PRIVACY AT THE SAMPLE LEVEL,0.32679738562091504,"5.2
DIFFERENTIAL PRIVACY AT THE SAMPLE LEVEL"
DIFFERENTIAL PRIVACY AT THE SAMPLE LEVEL,0.3300653594771242,"Recall that we partition the private dataset to M disjoint subsets, and train a teacher model on each
subset. Let vector xi ∈R|V| denote the probability distribution predicted by the i-th teacher model
for a specific word, where |V| is the vocabulary size. The function f(D) := PM
i=1 xi is the sum of
the probability distributions predicted over all teachers. Since the dataset is disjoint and also has no
repeating sample, changing one sample will only affect one teacher model. For neighboring datasets
D, D′, let j denote the index of different teacher models, i.e., xj ∈D and x′
j ∈D′ are different.
Then, the sensitivity ∆in Lemma 4 & 5 is (Detailed deduction in Appendix B),"
