Section,Section Appearance Order,Paragraph
ABSTRACT,0.0,ABSTRACT
ABSTRACT,0.0038314176245210726,"Recent efforts in interpretable deep learning models have shown that concept-
based explanation methods achieve competitive accuracy with standard end-to-
end models and enable reasoning and intervention about extracted high-level
visual concepts from images, e.g., identifying the wing color and beak length
for bird-species classiﬁcation. However, these concept bottleneck models rely
on a domain expert providing a necessary and sufﬁcient set of concepts–which
is intractable for complex tasks such as video classiﬁcation. For complex tasks,
the labels and the relationship between visual elements span many frames, e.g.,
identifying a bird ﬂying or catching prey–necessitating concepts with various levels
of abstraction. To this end, we present CODEX, an automatic Concept Discovery
and Extraction module that rigorously composes a necessary and sufﬁcient set
of concept abstractions for concept-based video classiﬁcation. CoDEx identiﬁes
a rich set of complex concept abstractions from natural language explanations
of videos–obviating the need to predeﬁne the amorphous set of concepts. To
demonstrate our method’s viability, we construct two new public datasets that
combine existing complex video classiﬁcation datasets with short, crowd-sourced
natural language explanations for their labels. Our method elicits inherent complex
concept abstractions in natural language to generalize concept-bottleneck methods
to complex tasks."
INTRODUCTION,0.007662835249042145,"1
INTRODUCTION"
INTRODUCTION,0.011494252873563218,"Deep neural networks (DNNs) provide unparalleled performance when applied to application domains,
including video classiﬁcation and activity recognition. However, the inherent black-box nature of the
DNNs inhibits the ability to explain the output decisions of a model. While opaque decision-making
may be sufﬁcient for certain tasks, several critical and sensitive applications force model developers
to face a dilemma between selecting the best-performing solution or one that is inherently explainable.
For example, in the healthcare domain (Yeung et al. (2019)), a life-or-death diagnosis compels the use
of the best performing model, yet accepting an automated prediction without justiﬁcation is wholly
insufﬁcient. Ideally, one could take advantage of the power of deep learning while still providing a
sufﬁcient understanding of why a model is making a particular decision, especially if the situation
demands trust in a decision that can have severe impacts."
INTRODUCTION,0.01532567049808429,"To address the need for model interpretability, researchers have sought to enable model intervention
by leveraging concept bottleneck-based explanations. Unlike post hoc explanation methods–where
techniques are used to extract an explanation for a given input for an inference by a trained black-box
model (Chakraborty et al. (2017); Jeyakumar et al. (2020)), concept bottleneck models are inherently
interpretable and take a human reasoning-inspired approach to explaining a model inference based
on an underlying set of concepts that deﬁne the decisions within an application. Thus far, prior
works have focused on concept-based explanation models for image (Kumar et al. (2009); Koh et al.
(2020)) and text classiﬁcation (Murty et al. (2020)). However, the concepts are assumed to be given a
priori by a domain expert–a process that may not result in a necessary and sufﬁcient set of concepts.
For instance, for bird species identiﬁcation, an expert may provide two redundant concepts that are
possibly correlated, such as wing color and beak color. More critically, prior works have considered
simple concepts with the same level of abstraction, e.g., visual elements present in a single image. For
more complex tasks such as video activity classiﬁcation, a label may span multiple frames. Thus, the
composing set of concepts will have various levels of abstraction representing relationships of various"
INTRODUCTION,0.019157088122605363,Under review as a conference paper at ICLR 2022
INTRODUCTION,0.022988505747126436,"visual elements spanning multiple frames, e.g., a bird ﬂapping its wings. Unlike the prior works, we
aim to exploit the complex abstractions inherent in natural language explanations to conceptualize
such complex events."
INTRODUCTION,0.02681992337164751,"Research Questions. In summary, this paper seeks to answer the following research questions:"
INTRODUCTION,0.03065134099616858,"• How can a machine automatically elicit the inherent complex concepts from natural language
to construct a necessary and sufﬁcient set of concepts for video classiﬁcation tasks?"
INTRODUCTION,0.034482758620689655,"• Given that a machine can extract such concepts, are they informative and meaningful enough
to be detected in videos by DNNs for downstream prediction tasks?"
INTRODUCTION,0.038314176245210725,"• Are the machine extracted concepts perceived by humans as good explanations for the
correct classiﬁcations?"
INTRODUCTION,0.0421455938697318,"Approach. This paper introduces an automatic concept extraction module for concept bottleneck-
based video classiﬁcation. The bottleneck architecture equips a standard video classiﬁcation model
with an intermediate concept prediction layer that identiﬁes concepts spanning multiple video frames.
To compose the concepts that will be predicted by the model, we propose a natural language processing
(NLP) based automatic Concept Discovery and Extraction module, CODEX, to extract a rich set of
concepts from natural language explanations of a video classiﬁcation. NLP tools are leveraged to
elicit inherent complex concept abstractions in natural language. CODEX identiﬁes and groups short
textual fragments relating to events, thereby capturing the complex concepts from videos. Thus, we
amortize the effort required to deﬁne and label the necessary and sufﬁcient set of concepts. Moreover,
we employ an attention mechanism to highlight and quantify which concepts are most important for
a given decision."
INTRODUCTION,0.04597701149425287,"To demonstrate the efﬁcacy of our approach, we construct two new datasets–MLB V2E (Video to
Explanations) for baseball activity classiﬁcation and MSR-V2E for video category classiﬁcation–
that combine complex video classiﬁcation datasets with short, crowd-sourced natural language
explanations for their corresponding labels. We ﬁrst compare our model against the existing standard
end-to-end deep-learning methods for video classiﬁcation and show that our architecture provides
additional beneﬁts of an inherently interpretable model with a marginal impact on performance (less
than 0.3% accuracy loss on classiﬁcation tasks). A subsequent user study showed that the extracted
concepts were perceived by humans as good explanations for the classiﬁcation on both the MLB-V2E
and MSR-V2E datasets."
INTRODUCTION,0.04980842911877394,Contributions. We summarize our contributions as follows.
INTRODUCTION,0.05363984674329502,"• We propose CoDEx, a concept discovery and extraction module that leverages NLP tech-
niques to automatically extract complex concept abstractions from crowd-sourced, natural
language explanations for a given video and label–obviating the need to manually deﬁne a
necessary and sufﬁcient set of concepts."
INTRODUCTION,0.05747126436781609,"• We evaluate our approach on complex video classiﬁcation datasets and show that our
model attains high concept accuracies while maintaining competitive task performance with
standard end-to-end video classiﬁcation models."
INTRODUCTION,0.06130268199233716,"• We also augment the concept-based explanation architecture to include an attention mech-
anism that highlights the importance of each concept for a given decision. We show that
users prefer our concept extraction method over baseline methods to explain a given label."
INTRODUCTION,0.06513409961685823,"• We construct two new public datasets, MLB-V2E and MSR-V2E, that combine complex
video classiﬁcation datasets with short, crowd-sourced natural language explanations and
labels."
RELATED WORK,0.06896551724137931,"2
RELATED WORK"
RELATED WORK,0.07279693486590039,"There is a wide array of works in explainable deep learning for various applications. This work
focuses on the concepts-based explanations for video classiﬁcation, and this section provides an
overview of the existing literature for overlapping domains.
Concept-Based Explanations for Images and Text. A number of existing works consider concept-
bottleneck architectures where models are trained to interact with high-level concepts. Generally, the"
RELATED WORK,0.07662835249042145,Under review as a conference paper at ICLR 2022
RELATED WORK,0.08045977011494253,"Explanation
Corpus ( Ɛ )"
RELATED WORK,0.0842911877394636,Concept Matrix ( C )
RELATED WORK,0.08812260536398467,CoDEx Module
RELATED WORK,0.09195402298850575,Concept Bottleneck Model
RELATED WORK,0.09578544061302682,Model Outputs
RELATED WORK,0.09961685823754789,"Figure 1: The overall pipeline showing the automatic concept extraction framework from natural
language explanations and the concept bottleneck classiﬁcation model training framework."
RELATED WORK,0.10344827586206896,"approaches are multi-task architectures, where the model ﬁrst identiﬁes a human-understandable set
of concepts and then reasons about the identiﬁed concepts. Until now, the applications have been
limited to static image and text applications. Koh et al. (2020) used pre-labeled concepts provided
by the dataset to train a model that predicts the concepts, which is then used to predict the ﬁnal
classiﬁcation. However, the caveat is that the concepts had to be manually provided. Ghorbani et al.
(2019) and Yeh et al. (2020) proposed approaches that automatically extract groups of pixels from
the input image that represent meaningful concepts for the prediction. They were designed largely
for image classiﬁcation and extract concepts directly from the dataset. Kim et al. (2018) propose a
post-hoc explanation method that returns the importance of user-deﬁned concepts for a classiﬁcation.
In the mentioned works, the concepts have been limited to simple concepts and are not suited for
complex tasks such as video classiﬁcation where we have complex concepts that may span multiple
frames with various levels of abstraction.
Explanations for Video Classiﬁcation Other approaches have been considered to explain video
classiﬁcation and activity recognition. Chattopadhay et al. (2018) applied GradCAM and GradCAM++
to video classiﬁcation, where for each frame, the important region of the frame to the model is
highlighted as a heatmap. Hiley et al. (2020) extract both spatial and temporal explanations from
input videos by highlighting the relevant pixels. However, these are post-hoc techniques that focus on
explaining black-box models, whereas our approach enables concept-bottleneck methods for video
classiﬁcation that are intended to be inherently interpretable and intervenable.
Video Captioning. In recent years, there is a large number of works (Pan et al. (2017); Gao et al.
(2017); Wang et al. (2018); Yan et al. (2019); Zhou et al. (2018); Chen & Jiang (2021); Yu et al.
(2017)) on video captioning. While they also employ natural language techniques, these works are
tangential to generating text explanations for classiﬁcations, since they are merely describing the
video. Our model provides an explanation justifying the classiﬁcation of the video. Similarly, the
associated datasets such as MSR-VTT (Xu et al. (2016)) only have videos with ground truth captions
that only describe the video without the context of a classiﬁcation–which often results in concepts
that do not pertain to a classiﬁcation.
Semantic Concept Video Classiﬁcation. The closest works to this paper is the body of work in
semantic concept video classiﬁcation (Fan et al. (2004; 2007)), where the concepts are deﬁned as
salient objects that are visually distinguishable video components. The concepts in these works are
simple objects detected in the videos and are not complex enough to capture the semantics of events
that happen over multiple frames of the videos. These works typically used traditional SVM-based
video classiﬁers. Assari et al. (2014) represent a video category based on the co-occurrences of the
semantic concepts and classify based on the co-occurrences, but their method requires a predeﬁned
set of concepts. Thus, we now present the methodology behind our automatic concept extraction for
concept bottleneck video classiﬁcation."
CONCEPT DISCOVERY AND BOTTLENECK VIDEO CLASSIFICATION,0.10727969348659004,"3
CONCEPT DISCOVERY AND BOTTLENECK VIDEO CLASSIFICATION"
CONCEPT DISCOVERY AND BOTTLENECK VIDEO CLASSIFICATION,0.1111111111111111,"This work introduces CoDEx, an automatic concept extraction method from natural language ex-
planations for concept-based video classiﬁcation. Figure 1 depicts the overall concept-bottleneck
pipeline, composed of CoDEx and the concept bottleneck model. CoDEx extracts a set of concepts"
CONCEPT DISCOVERY AND BOTTLENECK VIDEO CLASSIFICATION,0.11494252873563218,Under review as a conference paper at ICLR 2022
CONCEPT DISCOVERY AND BOTTLENECK VIDEO CLASSIFICATION,0.11877394636015326,"from natural language explanations that will comprise the bottleneck layer for the video classiﬁcation
model. We ﬁrst formalize the overall problem and then provide the methodology for both modules."
CONCEPT DISCOVERY AND BOTTLENECK VIDEO CLASSIFICATION,0.12260536398467432,"Problem Formalization. We assume that we have a training dataset {(xn, ln)}N
n=1 = D of videos
xn with a label ln ∈L, where L is a predeﬁned set of possible class labels for the video. Each
video is represented as a sequence of frames f ∈F where F is the set of video frames. Thus video
xn = ⟨fn0, fn1, . . . , fnT ⟩, where fnt represents frame t of video n. For each video xn, we form a
label-explanation pair (ln, en), where en is a (short) natural language document explaining the given
label ln. If multiple annotators contribute to an explanation for video-label pair, (xn, ln) , then these
are concatenated to form en. The full set of pairs E = {(ln, en)}N
n=1 is the explanation corpus. Thus,
the design goals are:"
CONCEPT DISCOVERY AND BOTTLENECK VIDEO CLASSIFICATION,0.12643678160919541,"• Concept Discovery and Extraction (CODEX) Module: Given the explanation corpus,
ﬁrst produce an N × K concept matrix, C, where the (n, k)th element is 1 if the nth
explanation contains discovered concept k and 0 otherwise. We call the nth row cn, the
concept vector for video xn. K is the total number of discovered concepts."
CONCEPT DISCOVERY AND BOTTLENECK VIDEO CLASSIFICATION,0.13026819923371646,"• Concept Bottleneck Model: Given a concept matrix, C, the second goal is to train a
concept bottleneck model such that for a given video xi, we predict a concept vector ci–
which indicates the presence or absence of concepts and their importance scores. The model
then makes use of ci to make the ﬁnal video classiﬁcation."
CONCEPT DISCOVERY AND BOTTLENECK VIDEO CLASSIFICATION,0.13409961685823754,"label, ln
explanation, en"
CONCEPT DISCOVERY AND BOTTLENECK VIDEO CLASSIFICATION,0.13793103448275862,"strike
The batter did not swing. The ball was in the strike zone."
CONCEPT DISCOVERY AND BOTTLENECK VIDEO CLASSIFICATION,0.1417624521072797,"foul
The batter hit the ball into the stands and it landed in foul territory."
CONCEPT DISCOVERY AND BOTTLENECK VIDEO CLASSIFICATION,0.14559386973180077,"ball
The hitter didn’t swing. The ball was outside the strike zone."
CONCEPT DISCOVERY AND BOTTLENECK VIDEO CLASSIFICATION,0.14942528735632185,"none
The video did not load."
CONCEPT DISCOVERY AND BOTTLENECK VIDEO CLASSIFICATION,0.1532567049808429,"out
the batter hit the ball and it was caught by the fielder"
CONCEPT DISCOVERY AND BOTTLENECK VIDEO CLASSIFICATION,0.15708812260536398,"label, ln
concepts, cn"
CONCEPT DISCOVERY AND BOTTLENECK VIDEO CLASSIFICATION,0.16091954022988506,"strike
{the batter did not swing, the ball was in the strike zone}"
CONCEPT DISCOVERY AND BOTTLENECK VIDEO CLASSIFICATION,0.16475095785440613,"foul
{the batter hit the ball, it landed in foul territory}"
CONCEPT DISCOVERY AND BOTTLENECK VIDEO CLASSIFICATION,0.1685823754789272,"ball
{the batter did not swing, the ball was outside the strike zone}"
CONCEPT DISCOVERY AND BOTTLENECK VIDEO CLASSIFICATION,0.1724137931034483,"out
{the batter hit the ball, it was caught by the fielder}"
CONCEPT DISCOVERY AND BOTTLENECK VIDEO CLASSIFICATION,0.17624521072796934,"Grouped concepts
Completed concepts
Text Pruned concepts
Text Removed text"
CONCEPT DISCOVERY AND BOTTLENECK VIDEO CLASSIFICATION,0.18007662835249041,Explanation Corpus Ɛ
CONCEPT DISCOVERY AND BOTTLENECK VIDEO CLASSIFICATION,0.1839080459770115,Extracted Concepts
CONCEPT DISCOVERY AND BOTTLENECK VIDEO CLASSIFICATION,0.18773946360153257,"Figure 2: Running example for all six stages of the discovery pipeline module. The left table is
the explanation corpus, with highlighted fragments to be modiﬁed. The right table contains the
discovered concepts. The detailed step-by-step modiﬁcations are provided in Appendix A.1."
CONCEPT DISCOVERY AND BOTTLENECK VIDEO CLASSIFICATION,0.19157088122605365,"3.1
CODEX: CONCEPT DISCOVERY AND EXTRACTION MODULE"
CONCEPT DISCOVERY AND BOTTLENECK VIDEO CLASSIFICATION,0.19540229885057472,"We now describe CoDEx, that extracts concepts from the explanation corpus, E. The automatic
extraction of the signiﬁcant concepts is done in 6 steps, as outlined in Fig. 1. These are: cleaning,
extraction, grouping, completion, pruning, and vectorization, which produce the ﬁnal concept
matrix, C. Each of these steps are described below and illustrated with an example corpus depicted
in Figure 2."
CONCEPT DISCOVERY AND BOTTLENECK VIDEO CLASSIFICATION,0.19923371647509577,"Cleaning. We remove explanations associated with corrupted or unlabeled videos from the explana-
tion corpus. In Figure 2, this phase would remove the fourth row with the ""none"" label."
CONCEPT DISCOVERY AND BOTTLENECK VIDEO CLASSIFICATION,0.20306513409961685,"Extraction. The objective of this phase is to identify sentence constituents relevant to explaining the
label. These text fragments, short sequences of words that appear in the document, are referred to
as raw concepts. To achieve this, the cleaned explanation corpus is tokenized then passed through
a pretrained constituency parser to recursively decompose the sentences. At each level of the
constituency hierarchy, the text fragments are evaluated to determine whether they constitute a
candidate raw concept. The rules for candidate raw concepts include the inclusion and exclusion
rules below and follow the widely adopted Universal POS tag naming convention for token types
(Petrov et al. (2012)). Every constituency parsed phrase that satisﬁes one of the two inclusion rules
and not the exclusion rule is considered a candidate concept."
CONCEPT DISCOVERY AND BOTTLENECK VIDEO CLASSIFICATION,0.20689655172413793,"rule name
rule
Inclusion 1.
noun/pronoun →auxillary (optional) →particle (optional) →verb (optional)
Inclusion 2.
noun/pronoun →auxiliary whose lemma is ‘be’ →any token
Exclusion
subordinating conjunction"
CONCEPT DISCOVERY AND BOTTLENECK VIDEO CLASSIFICATION,0.210727969348659,Table 1: Inclusion and exclusion rules for candidate concepts.
CONCEPT DISCOVERY AND BOTTLENECK VIDEO CLASSIFICATION,0.21455938697318008,Under review as a conference paper at ICLR 2022
CONCEPT DISCOVERY AND BOTTLENECK VIDEO CLASSIFICATION,0.21839080459770116,"After the extraction process is completed, we have a set of raw concepts, eK, and each video is
associated with a subset of these raw concepts. An example of extracted raw concepts, eK, can be
found in Appendix A.1."
CONCEPT DISCOVERY AND BOTTLENECK VIDEO CLASSIFICATION,0.2222222222222222,"Completion. There are instances where the pretrained constituency parser will split sentences
midway through a text fragment in one sentence that was kept whole in another. For instance, in
Figure 2, the constituency parser splits the explanation for ""foul"" such that ""the batter hit the ball"" is
incorrectly excluded from the raw concepts. To ensure that those concepts are captured, we perform
a substring lookup of each raw concept through all documents of the explanation corpus and count an
explanation as containing a raw concept if it contains the corresponding raw concept as a substring.
This does not change the number of raw concepts identiﬁed but increases their frequency counts."
CONCEPT DISCOVERY AND BOTTLENECK VIDEO CLASSIFICATION,0.2260536398467433,"Grouping (similar raw concepts). When identical text fragments are identiﬁed in different expla-
nations, they are counted directly as the same raw concept. However, we would ideally like to
treat superﬁcially different concepts as the same if they essentially carry the same meaning, e.g.,
Figure 2 highlights two different raw concepts that carry the same meaning and hence can be grouped.
For this, we use agglomerative clustering (Müllner (2011)) approach that measures the degree of
difference between pairs of raw concepts and groups them together if they are similar enough. Our key
contribution here is the distance metric used in clustering which is a novel measure of meta-distance
between raw concepts. This measures the difference between concepts based on two aspects of the
raw concepts: their linguistic difference and their difference in terms of the label categories with
which they are associated."
CONCEPT DISCOVERY AND BOTTLENECK VIDEO CLASSIFICATION,0.22988505747126436,"We deﬁne meta-metric, d, as combining a linguistic distance, dtext (capturing linguistic difference) as
well as a meta-metric, dlabel (capturing the difference in the labels associated with each raw concept).
More formally, for two raw concepts κi, κj ∈eK our distance is linear combination:"
CONCEPT DISCOVERY AND BOTTLENECK VIDEO CLASSIFICATION,0.23371647509578544,"d(κi, κj) = dtext(vi, vj) + λdlabel(ni, nj)
(1)"
CONCEPT DISCOVERY AND BOTTLENECK VIDEO CLASSIFICATION,0.23754789272030652,"where vi is a sentence embedding for the text fragment of concept κi (e.g., based on the BERT
model Devlin et al. (2019)), dtext is a standard distance measure between vectors (e.g., cosine distance),
dlabel is a meta-distance which aims to capture the similarity between two label count vectors, and
λ is a hyperparameter controlling the relative importance between textual and label distance. The
inclusion of a label distance helps to distinguish between concepts that are superﬁcially linguistically
very simlar, but have very distinct meanings within the domain of interest. For instance, without the
dlabel, the concepts “the ball passed inside the strike zone” and “the ball passed outside the strike
zone” will be grouped together though they are very different concepts as they have a very small
dtext. We provide a more formal deﬁnition of the meta-metric dlabel more formally and provide some
intuition behind its construction in Appendix A.3. We also exclude concept groups which occur very
rarely in the explanation corpus, with frequency less than some small threshold, t."
CONCEPT DISCOVERY AND BOTTLENECK VIDEO CLASSIFICATION,0.2413793103448276,"Pruning. Here, we seek a compact subset of concepts that, together, capture a high degree of
information about the label while maintaining interpretability. More formally, after grouping, we
have a set of raw concepts eK = {κ1, . . . , κJ}, and we seek some subset of maximally informative
concepts K⋆= {κj1 . . . , κjK} ⊆eK."
CONCEPT DISCOVERY AND BOTTLENECK VIDEO CLASSIFICATION,0.24521072796934865,"To see what is meant by maximally informative, consider a randomly selected entry in the explanation
corpus (l, e). We deﬁne a binary random variable, Cj for each raw concept κj, and for any concept
set K = {κj1, . . . , κjK}, random vector CK = [C1, . . . , CK], such that Cj = 1 if κj ∈e and 0
otherwise. Y is the random variable which takes label l. We wish to choose the smallest subset of
concepts such that the mutual information (MI)1 between chosen concepts, K, and label, Y , given by
I(Y ; CK), is greater than a threshold fraction, γ < 1 of the MI between the label and the complete
concept vector, I(Y ; C e
K). That is to say we wish to ﬁnd K which satisﬁes:"
CONCEPT DISCOVERY AND BOTTLENECK VIDEO CLASSIFICATION,0.24904214559386972,"I(Y ; CK) ≥γI(Y ; C e
K)
(2)"
CONCEPT DISCOVERY AND BOTTLENECK VIDEO CLASSIFICATION,0.25287356321839083,"and where there is no subset K′ ⊆eK with |K′| < |K| which also satisﬁes Equation equation 2. In
practice, this is infeasible as the problem is combinatorial. However, we note that f(K) = I(Y ; CK)
is a monotone submodular set function of eK. Given this, if we recursively construct a set of size K,
by greedily adding single concepts that most improve the MI, the resulting set will be at least 1 −1 e"
CONCEPT DISCOVERY AND BOTTLENECK VIDEO CLASSIFICATION,0.2567049808429119,1We use the standard deﬁnition of mutual information (MI) for discrete random variables (MacKay (2003)).
CONCEPT DISCOVERY AND BOTTLENECK VIDEO CLASSIFICATION,0.26053639846743293,Under review as a conference paper at ICLR 2022
CONCEPT DISCOVERY AND BOTTLENECK VIDEO CLASSIFICATION,0.26436781609195403,"as good as the most informative set of size K (Nemhauser et al. (1978)). Therefore, we guarantee a
highly-informative set K⋆by iteratively adding concepts to those previously selected, greedy with
respect to the MI, until we have a set that satisﬁes Equation 2."
