Section,Section Appearance Order,Paragraph
ABSTRACT,0.0,ABSTRACT
ABSTRACT,0.001072961373390558,"Machine learning (ML) robustness and generalization are fundamentally corre-
lated: they essentially concern about data distribution shift under adversarial and
natural settings, respectively. Thus, it is critical to uncover their underlying con-
nections to tackle one based on the other. On one hand, recent studies show that
more robust (adversarially trained) models are more generalizable to other do-
mains. On the other hand, there lacks of theoretical understanding of such phe-
nomenon, and it is not clear whether there are counterexamples. In this paper, we
aim to provide sufﬁcient conditions for this phenomenon considering different fac-
tors that could affect both, such as norm of the last layer, Jacobian norm, and data
augmentations (DA). In particular, we propose a general theoretical framework
indicating factors that can be reformed as a function class regularization process,
which could lead to improvements of domain generalization. Our analysis, for the
ﬁrst time, shows that “robustness” is actually not the causation for domain gener-
alization; rather, robustness induced by adversarial training is a by-product of such
function class regularization. We then discuss in details about different properties
of DA and we prove that under certain conditions, DA can be viewed as regular-
ization and therefore improve generalization. We conduct extensive experiments
to verify our theoretical ﬁndings and show several counterexamples where robust-
ness and generalization are negatively correlated when the sufﬁcient conditions
are not satisﬁed."
INTRODUCTION,0.002145922746781116,"1
INTRODUCTION"
INTRODUCTION,0.003218884120171674,"Domain generalization (or transferability) is the task of training machine learning models with
data from one or more source domains that can be adapted to a target domain, often via low-
cost ﬁne-tuning.
Thus, domain generalization refers to approaches designed to address the
natural data distribution shift problem (Muandet et al., 2013; Rosenfeld et al., 2021). A wide array of
approaches have been proposed to address domain transferability, including ﬁne-tuning the last layer
of DNNs (Huang et al., 2018), invariant feature optimization (Muandet et al., 2013), efﬁcient model
selection for ﬁne-tuning (You et al., 2019), and optimal transport based domain adaptation (Courty
et al., 2016). Improving domain generalization has emerged as an important task in the machine
learning community: for instance, it is among the key technologies to enable an autonomous driving
vehicle trained in city scenarios to make correct decisions in the countryside as well."
INTRODUCTION,0.004291845493562232,"On
the
other
hand,
robust
machine
learning
aims
to
tackle
the
problem
of
adversarial data distribution shift.
Both empirical and certiﬁed robust learning approaches
have been proposed, such as empirical adversarial training (Madry et al., 2018) and certiﬁed
defenses based on deterministic and probabilistic approaches (Cohen et al., 2019)."
INTRODUCTION,0.00536480686695279,"As domain transferability and robust machine learning tackle different kinds of data distribution
shifts, this work seeks to uncover their underlying connections and tradeoffs. For instance, recent
studies suggest that adversarially robust models are more domain transferable (Salman et al., 2020),
which, in turn, provides new insights on improving domain generalization. However, a theoretical
analysis of their relationship is still lacking, and it is unclear whether such positive correlations al-"
INTRODUCTION,0.006437768240343348,Under review as a conference paper at ICLR 2022
INTRODUCTION,0.0075107296137339056,(c) Last-Layer norm
INTRODUCTION,0.008583690987124463,"Adversarially robust models may
not transfer better"
INTRODUCTION,0.009656652360515022,Sufficient conditions for domain transferability
INTRODUCTION,0.01072961373390558,"(b) Jacobian norm
(a) Data augmentations"
INTRODUCTION,0.011802575107296138,"Source
Domain
Feature Extractor
Last Layer"
INTRODUCTION,0.012875536480686695,"(a)
(b)
(c) …"
INTRODUCTION,0.013948497854077254,Figure 1: Illustration of robustness and domain transferability in different conditions.
INTRODUCTION,0.015021459227467811,"ways hold. In this paper, we take the ﬁrst steps towards formally analyzing the relationship between
model robustness and domain transferability to answer the following questions: What are sufﬁcient
conditions for domain transferability? Is model robustness the cause of domain transferability? Can
robustness and domain transferability be negatively correlated?"
INTRODUCTION,0.016094420600858368,"To answer the above questions and uncover the underlying relationship between robustness and
domain transferability, we propose a general theoretical framework that characterizes sufﬁcient con-
ditions for domain transferability from the view of function class regularization. Our analysis shows
that if the function class of feature extractors is more regularized, the model based on a feature
extractor trained from the function class, composed with a ﬁne-tuned last layer, can be more trans-
ferable. Formally, we prove that there is a monotone relation between the regularization strength
and a tight upper bound on the relative domain transfer loss."
INTRODUCTION,0.017167381974248927,"Under the proposed framework, we analyze several common factors for model training, including
the Jacobian norm, the last layer norm, data augmentation, and adversarial training as shown in
Fig. 1. In particular, controlling the Jacobian norm and last layer norm can be viewed as function-
class regularization, thus can be analyzed in our framework. We also analyze how other common
regularization operations can be mapped to function class regularization. For instance, we consider
noise-dependent and independent data augmentation procedures based on feature average and loss
average aggregation algorithms."
INTRODUCTION,0.018240343347639486,"We conduct extensive experiments on ImageNet (CIFAR-10 as target domain) and CIFAR-10
(SVHN as target domain) based on different models to verify our analysis. We show that regulariza-
tion can control domain transferability, and robustness and domain transferability can be negatively
correlated, which are counter-examples against Salman et al. (2020). Taken together, this indicates
that robustness is not a cause of transferability."
INTRODUCTION,0.019313304721030045,"Technical Contributions. We aim to uncover the underlying relationship between robustness and
domain transferability and lay out the sufﬁcient conditions for transferability from the view of reg-
ularization. We make both theoretical and empirical contributions."
INTRODUCTION,0.0203862660944206,"• We propose a theoretical framework to analyze the sufﬁcient conditions for domain transferability
from the view of function class regularization. We provably show that stronger regularization
on the feature extractor implies a decreased tight upper bound on the relative transferability loss;
while model robustness could be arbitrary."
INTRODUCTION,0.02145922746781116,"• We prove the tightness of our transferability upper bound, and provide the generalization bound
of the relative transferability loss from the view of regularization."
INTRODUCTION,0.022532188841201718,"• We analyze several factors such as different data augmentations (e.g., rotation and Gaussian) under
the framework, and show how they can be mapped to function class regularization and therefore
affect transferability."
INTRODUCTION,0.023605150214592276,"• We conduct extensive experiments on different datasets and model architectures to verify our theo-
retical claims. We also show several counterexamples that indicate signiﬁcant negative correlation
between robustness and the relative domain transferability."
RELATED WORK,0.02467811158798283,"2
RELATED WORK"
RELATED WORK,0.02575107296137339,"Domain Transferability has been analyzed in different settings. Muandet et al. present a gener-
alization bound for classiﬁcation task based on the properties of the assumed prior over training
environments. Rosenfeld et al. model domain transferability/generalization as an online game and
show that generalizing beyond the convex hull of training environments is NP-hard, and Zhang et al.
provides a generalization bound for distributions with sufﬁciently small H-divergence. Given the"
RELATED WORK,0.02682403433476395,Under review as a conference paper at ICLR 2022
RELATED WORK,0.027896995708154508,"complexity of domain transferability analysis, recent empirical studies show that adversarially ro-
bust models transfer better (Salman et al., 2020). In this paper, we aim to relax the assumptions and
focus on understanding the domain transferability from the view of regularization and theoretically
show whether “robustness” is indeed a causation for transferability or not."
RELATED WORK,0.028969957081545063,"Model Robustness is an important topic given recent diverse adversarial attacks (Goodfellow et al.,
2014; Carlini & Wagner, 2017). These attacks may be launched without access to model param-
eters (Tu et al., 2019) or even with the model predicted label alone (Chen et al., 2020). Different
approaches have been proposed to improve model robustness against adversarial attack. Adversar-
ial training has been shown to be effective empirically (Madry et al., 2018; Zhang et al., 2019a;
Miyato et al., 2018). Some studies have shown that robustness is property related to other model
characteristics, such as transferability and invertibility (Engstrom et al., 2019)."
SUFFICIENT CONDITIONS FOR DOMAIN TRANSFERABILITY,0.030042918454935622,"3
SUFFICIENT CONDITIONS FOR DOMAIN TRANSFERABILITY"
SUFFICIENT CONDITIONS FOR DOMAIN TRANSFERABILITY,0.03111587982832618,"In this section, we theoretically analyze the problem of domain transferability from the view of
regularization and discuss some sufﬁcient conditions for good transferability. All of the proofs are
provided in Section A in the appendix."
SUFFICIENT CONDITIONS FOR DOMAIN TRANSFERABILITY,0.032188841201716736,"Notations. We denote the input space as X; the feature space as Z and the output space as Y. Let
the ﬁne-tuning function class be g ∈G. Given a feature extractor f : X →Z and a ﬁne-tuning
function g : Z →Y, the full model is g ◦f : X →Y. We denote PX×Y as the set of distributions
on X × Y. The loss function is denoted by ℓ: Y × Y →R+, and the population loss based on data
distribution D ∈PX×Y and a model g ◦f is deﬁned as"
SUFFICIENT CONDITIONS FOR DOMAIN TRANSFERABILITY,0.033261802575107295,"ℓD(g ◦f) := E(x,y)∼D[ℓ(g ◦f(x), y)]."
SUFFICIENT CONDITIONS FOR DOMAIN TRANSFERABILITY,0.034334763948497854,"Before diving into the details, we ﬁrst provide the following example to illustrate why one might
investigate domain transferability from the view of regularization."
SUFFICIENT CONDITIONS FOR DOMAIN TRANSFERABILITY,0.03540772532188841,"3.1
EXAMPLE: ROBUSTNESS AND TRANSFERABILITY ARE INDEPENDENT"
SUFFICIENT CONDITIONS FOR DOMAIN TRANSFERABILITY,0.03648068669527897,"In this subsection, we construct a simple example where domain transferability depends on regular-
ization, yet domain transferability and robustness are independent. Moreover, this example serves
as motivation to consider domain transferability from the view of regularization."
SUFFICIENT CONDITIONS FOR DOMAIN TRANSFERABILITY,0.03755364806866953,"Given the source and target distributions DS, DT ∈PX×Y, we denote their marginal distributions
on the input space X as DX
S and DX
T , respectively. We consider the case that X ⊂Rm being a
low-dimensional manifold in Rm, and Y = Rd. Given an input x ∈X, the ground truth target for
the source domain is yS(x) generated by a function yS : Rm →Rd. Similarly, we deﬁne yT for
the target domain. In this example, for simplicity, we neglect the ﬁne-tuning process but directly
consider learning a function f : Rm →Rd with a norm ∥· ∥on Rd. For the source domain we have
the population loss:"
SUFFICIENT CONDITIONS FOR DOMAIN TRANSFERABILITY,0.03862660944206009,"ℓDS(f) = Ex∼DX
S [∥f(x) −yS(x)∥]."
SUFFICIENT CONDITIONS FOR DOMAIN TRANSFERABILITY,0.03969957081545064,"A distribution D ∈PX on the input space X, deﬁnes a norm of a function f : Rm →Rd as"
SUFFICIENT CONDITIONS FOR DOMAIN TRANSFERABILITY,0.0407725321888412,"∥f∥D := Ex∼D[∥f(x)∥],"
SUFFICIENT CONDITIONS FOR DOMAIN TRANSFERABILITY,0.04184549356223176,"where we view two functions f1, f2 as the same if ∥f1 −f2∥D = 0. Therefore, we can deﬁne the
source domain loss ℓDS(f) = ∥f −yS∥DX
S and the target domain loss ℓDT (f) = ∥f −yT ∥DX
T ."
SUFFICIENT CONDITIONS FOR DOMAIN TRANSFERABILITY,0.04291845493562232,"For the sake of illustration, we consider the simple case where the input distributions DX
S , DX
T are
the same, and hence we denote D = DX
S = DX
T . Note that yS and yT are different."
SUFFICIENT CONDITIONS FOR DOMAIN TRANSFERABILITY,0.043991416309012876,"Denoting a function space F = {f : Rm →Rd | ∥f∥D < ∞}, we assume that yS, yT ∈F and we
can compare f, yS, yT in the same space. Therefore, given c > 0 as a regularization parameter, the
domain transferability problem can be deﬁned as:"
SUFFICIENT CONDITIONS FOR DOMAIN TRANSFERABILITY,0.045064377682403435,"Learning a source model:
f DS
c
∈arg min
f∈F
ℓDS(f),
s.t. ∥f∥D ≤c;
(1)"
SUFFICIENT CONDITIONS FOR DOMAIN TRANSFERABILITY,0.046137339055793994,"Testing on a target domain:
ℓDT (f DS
c
),"
SUFFICIENT CONDITIONS FOR DOMAIN TRANSFERABILITY,0.04721030042918455,Under review as a conference paper at ICLR 2022
SUFFICIENT CONDITIONS FOR DOMAIN TRANSFERABILITY,0.048283261802575105,"where the minimizer f DS
c
:= yS min{1,
c
∥yS∥D }, the source domain loss is ℓDS(f) = ∥f −yS∥D,
and the target domain loss is ℓDT (f) = ∥f −yT ∥D. We prove in Proposition 3.1 that f DS
c
is indeed
a minimizer of (1) and provide an intuitive illustration in Figure 2."
SUFFICIENT CONDITIONS FOR DOMAIN TRANSFERABILITY,0.04935622317596566,"We show that the robustness can be independent to domain transferability as follows. Consider the
adversarial robustness of f DS
c
on an input x ∈X (e.g., maxδ:∥δ∥2≤ϵ ℓ(f DS
c
(x + δ), yS(x))). Since
the transferred loss ℓDT (f DS
c
) only evaluates f DS
c
on X which is a low-dimensional manifold in
Rm, an adversarial perturbation δ ∈Rm could make x + δ ∈Rm\X when the loss function is
sufﬁciently big outside the manifold X. Therefore, the robustness could be arbitrarily bad without
changing the value of ℓDT (f DS
c
), i.e., the performance of the source model on the target domain."
SUFFICIENT CONDITIONS FOR DOMAIN TRANSFERABILITY,0.05042918454935622,"As we can see, the robustness is independent to domain transferability in this example. On the
contrary, if we change the perspective to consider the the regularization parameter c, we have the
following interesting ﬁnding. An illustration of the ﬁnding is shown in Figure 2, and a more formal
statement is provided in Proposition 3.1. ℱ"
SUFFICIENT CONDITIONS FOR DOMAIN TRANSFERABILITY,0.05150214592274678,"||𝑓||𝒟≤𝑐 𝑓𝑐 𝒟𝑆 𝑦𝑆
𝑦𝑇 0 𝑐"
SUFFICIENT CONDITIONS FOR DOMAIN TRANSFERABILITY,0.05257510729613734,ℓ𝒟𝑆(𝑓𝑐
SUFFICIENT CONDITIONS FOR DOMAIN TRANSFERABILITY,0.0536480686695279,"𝒟𝑆)
ℓ𝒟𝑇(𝑓𝑐 𝒟𝑆)"
SUFFICIENT CONDITIONS FOR DOMAIN TRANSFERABILITY,0.05472103004291846,Source Training Function Class Size 𝑐
SUFFICIENT CONDITIONS FOR DOMAIN TRANSFERABILITY,0.055793991416309016,Source Loss = ℓ𝒟𝑆(𝑓𝑐 𝒟𝑆)
SUFFICIENT CONDITIONS FOR DOMAIN TRANSFERABILITY,0.05686695278969957,Transferred Loss = ℓ𝒟𝑇(𝑓𝑐
SUFFICIENT CONDITIONS FOR DOMAIN TRANSFERABILITY,0.05793991416309013,"𝒟𝑆)
Relative Domain 
Transferability Loss = 
ℓ𝒟𝑇(𝑓𝑐"
SUFFICIENT CONDITIONS FOR DOMAIN TRANSFERABILITY,0.059012875536480686,𝒟𝑆) −ℓ𝒟𝑆(𝑓𝑐
SUFFICIENT CONDITIONS FOR DOMAIN TRANSFERABILITY,0.060085836909871244,"𝒟𝑆)
Different 𝑐"
SUFFICIENT CONDITIONS FOR DOMAIN TRANSFERABILITY,0.0611587982832618,"Figure 2: The left ﬁgure illustrates the example in the function space F given a regularization parameter c.
The right ﬁgure shows the relations between domain transferability and the c. In this example, the weaker the
regularization effect (greater c) is, the greater the relative domain transferability loss (violet arrow becomes)."
SUFFICIENT CONDITIONS FOR DOMAIN TRANSFERABILITY,0.06223175965665236,"Proposition 3.1. Given the problem deﬁned above, f DS
c
is a minimizer of equation 1. If c ≥c′ ≥0,
then the relative domain transferability loss ℓDT (f DS
c
) −ℓDS(f DS
c
) ≥ℓDT (f DS
c′ ) −ℓDS(f DS
c′ )."
SUFFICIENT CONDITIONS FOR DOMAIN TRANSFERABILITY,0.06330472103004292,"We can see that robustness is not sufﬁcient to characterize domain transferability. However, there is
a monotone relation between the regularization strength and the relative transferability loss, where
adversarial robustness could be arbitrary. Similar behavior is also observed in our experiments, as
we will discuss in Section 4. Naturally, these ﬁndings motivate the study of the connections between
the regularization of the training process and domain transferability in general, as we consider next."
UPPER BOUND OF THE RELATIVE DOMAIN TRANSFERABILITY,0.06437768240343347,"3.2
UPPER BOUND OF THE RELATIVE DOMAIN TRANSFERABILITY"
UPPER BOUND OF THE RELATIVE DOMAIN TRANSFERABILITY,0.06545064377682404,"In this subsection, we consider the general transferability problem with ﬁne-tuning. We prove that
there is a monotone relationship between the regularization strength and relative domain transfer-
ability loss. We also present a tight upper bound on the relative domain transferability loss. Denote
the training algorithm as A that takes a data distribution D and outputs a feature extractor f D
A ∈FA
chosen from a function class FA and a ﬁne-tuning function gD
A ∈G. Next we formally deﬁne
relative domain transferability.
Deﬁnition 1 (Relative Domain Transferability Loss). Given the training algorithm A and a pair of
distributions DS, DT ∈PX×Y, the relative domain transferability loss between DS, DT is deﬁned
to be the difference of ﬁne-tuned losses, i.e.,"
UPPER BOUND OF THE RELATIVE DOMAIN TRANSFERABILITY,0.06652360515021459,"τ(A; DS, DT ) := inf
g∈G ℓDT (g ◦f DS
A ) −ℓDS(gDS
A
◦f DS
A )."
UPPER BOUND OF THE RELATIVE DOMAIN TRANSFERABILITY,0.06759656652360516,"Note that the training algorithm A is not required to be optimal, i.e., it could be the case that
ℓDS(gDS
A
◦f DS
A ) > infg∈G,f∈FA ℓDS(g ◦f). As we can see, the smaller τ(A; DS, DT ) is, the
better the model’s relative performance becomes on the target domain."
UPPER BOUND OF THE RELATIVE DOMAIN TRANSFERABILITY,0.06866952789699571,"Another perspective of Deﬁnition 1 is that infg∈G ℓDT (g◦f DS
A ) = ℓDS(gDS
A ◦f DS
A )+τ(A; DS, DT ).
From this perspective, the transferred loss is the source loss plus an additional term to be upper
bounded by a certain distance metric between the source and target distributions – as is common
in the literature of domain adaptation (e.g., Ben-David et al. (2007); Zhao et al. (2019)). The key
question of the “distance metric” remains unanswered. To this end, we propose the following."
UPPER BOUND OF THE RELATIVE DOMAIN TRANSFERABILITY,0.06974248927038626,Under review as a conference paper at ICLR 2022
UPPER BOUND OF THE RELATIVE DOMAIN TRANSFERABILITY,0.07081545064377683,"Deﬁnition 2 ((G, F)-pseudometric). Given a ﬁne-tuning function class G, a feature extractor func-
tion class F and distributions DS, DT ∈PX×Y, the (G, F)-pseudometric between DS, DT is
dG,F(DS, DT ) := sup
f∈F
| inf
g∈G ℓDS(g ◦f) −inf
g∈G ℓDT (g ◦f)|."
UPPER BOUND OF THE RELATIVE DOMAIN TRANSFERABILITY,0.07188841201716738,"Since the ﬁne-tuning function class is usually simple and ﬁxed, we will use dF as an abbreviation in
the context where G is clear."
UPPER BOUND OF THE RELATIVE DOMAIN TRANSFERABILITY,0.07296137339055794,"It can be easily veriﬁed that dG,F is a pseudometric that measures the distance between two distri-
butions, as shown in the following proposition.
Proposition 3.2. dG,F(·, ·) : PX×Y × PX×Y →R+ satisﬁes the following properties; (Symme-
try) dG,F(DS, DT ) = dG,F(DT , DS); (Triangle Inequality) ∀D′ ∈PX×Y : dG,F(DS, DT ) ≤
dG,F(DS, D′) + dG,F(D′, DT ); (Weak Zero Property) ∀D ∈PX×Y : dG,F(D, D) = 0."
UPPER BOUND OF THE RELATIVE DOMAIN TRANSFERABILITY,0.0740343347639485,"In this section, we consider a ﬁxed ﬁne-tuning function class G and feature extractor function class
FA given by the training algorithm A. Thus, we denote dG,F as dFA for the remainder of the paper.
With the deﬁnition of dFA, we can derive the following result.
Theorem 3.1. Given a training algorithm A, for ∀DS, DT ∈PX×Y we have
τ(A; DS, DT ) ≤dFA(DS, DT ),"
UPPER BOUND OF THE RELATIVE DOMAIN TRANSFERABILITY,0.07510729613733906,"or equivalently,
inf
g∈G ℓDT (g ◦f DS
A ) ≤ℓDS(gDS
A
◦f DS
A ) + dFA(DS, DT )."
UPPER BOUND OF THE RELATIVE DOMAIN TRANSFERABILITY,0.07618025751072961,"Interpretation: As we can see, the above theorem provides sufﬁcient conditions for good domain
transferability. There is a monotone relation between the regularization strength and dFA(DS, DT ),
i.e., the upper bound on the relative domain transferability loss τ(A; DS, DT ). More explicitly, if
a training algorithm A′ has FA′ ⊆FA, then dFA′(DS, DT ) ≤dFA(DS, DT ). Moreover, small
dFA(DS, DT ) implies good relative domain transferability. From this perspective, we can see that
we need both small dFA(DS, DT ) and small source loss ℓDS(gDS
A
◦f DS
A ) to guarantee good ab-
solute domain transferability. Note that there is a possible trade-off, i.e., with FA being smaller,
dFA(DS, DT ) decreases but possibly ℓDS(gDS
A
◦f DS
A ) increases due to the limited power of FA.
On the other hand, there may not be such trade-off if DS and DT are close enough such that
dFA(DS, DT ) is small."
UPPER BOUND OF THE RELATIVE DOMAIN TRANSFERABILITY,0.07725321888412018,"To make the upper bound more meaningful, we need to study the tightness of it.
Theorem 3.2. Given any source distribution DS ∈PX×Rd, any ﬁne-tuning function class G where
G includes the zero function, and any training algorithm A, denote"
UPPER BOUND OF THE RELATIVE DOMAIN TRANSFERABILITY,0.07832618025751073,"ϵ := ℓDS(gDS
A
◦f DS
A ) −
inf
g∈G,f∈FA ℓDS(g ◦f)."
UPPER BOUND OF THE RELATIVE DOMAIN TRANSFERABILITY,0.07939914163090128,"We assume some properties of the loss function ℓ: Rd × Rd →R+: it is differentiable and strictly
convex w.r.t. its ﬁrst argument; ℓ(y, y) = 0 for any y ∈Rd; and limr→∞infy:∥y∥2=r ℓ(⃗0, y) = ∞,
where ⃗0 is the zero vector. Then, for any distribution DX on X, there exist some distributions
DT ∈PX×Rd with its marginal on X being DX such that
τ(A; DS, DT ) ≤dFA(DS, DT ) ≤τ(A; DS, DT ) + ϵ,
or equivalently dFA(DS, DT ) −ϵ ≤τ(A; DS, DT ) ≤dFA(DS, DT )."
UPPER BOUND OF THE RELATIVE DOMAIN TRANSFERABILITY,0.08047210300429185,"Interpretation: In the above theorem, we show that given any A, DS, and the marginal DX , there
exists some conditional distributions of y|x such that by composing it with the given DX we have
a distribution DT to make the bound in Theorem 3.1 ϵ-tight. Note that ϵ is the difference between
the source loss and the its inﬁmum, i.e., with a good enough algorithm A, the ϵ could be arbitrarily
small."
GENERALIZATION UPPER BOUND OF THE RELATIVE DOMAIN TRANSFERABILITY,0.0815450643776824,"3.3
GENERALIZATION UPPER BOUND OF THE RELATIVE DOMAIN TRANSFERABILITY"
GENERALIZATION UPPER BOUND OF THE RELATIVE DOMAIN TRANSFERABILITY,0.08261802575107297,"Here we investigate the proposed theory on relative transferability with ﬁnite samples. For a distri-
bution D ∈PX×Y, we denote its empirical distribution with n samples as bDn. That being said,"
GENERALIZATION UPPER BOUND OF THE RELATIVE DOMAIN TRANSFERABILITY,0.08369098712446352,"ℓb
Dn(g ◦f) = E(x,y)∼b
Dn[ℓ(g ◦f(x), y)] = 1 n n
X"
GENERALIZATION UPPER BOUND OF THE RELATIVE DOMAIN TRANSFERABILITY,0.08476394849785408,"i=1
ℓ(g ◦f(xi), yi),"
GENERALIZATION UPPER BOUND OF THE RELATIVE DOMAIN TRANSFERABILITY,0.08583690987124463,Under review as a conference paper at ICLR 2022
GENERALIZATION UPPER BOUND OF THE RELATIVE DOMAIN TRANSFERABILITY,0.08690987124463519,"where (xi, yi) are i.i.d. samples from D. Therefore, given two distributions DS, DT ∈PX×Y, the
empirical (G, F)-pseudometric between them is dG,F( bDn
S, bDn
T )."
GENERALIZATION UPPER BOUND OF THE RELATIVE DOMAIN TRANSFERABILITY,0.08798283261802575,"Note that dG,F is not only a pseudometric of distributions, but also a complexity measure, and we
will ﬁrst connect it with the Rademacher complexity.
Deﬁnition 3 (Empirical Rademacher Complexity (Bartlett & Mendelson, 2002; Koltchinskii,
2001)). Denote the loss function class induced by G, F as"
GENERALIZATION UPPER BOUND OF THE RELATIVE DOMAIN TRANSFERABILITY,0.0890557939914163,"LG,F := {hg,f : X × Y →R+ | g ∈G, f ∈F},
where hg,f(x, y) := ℓ(g ◦f(x), y)."
GENERALIZATION UPPER BOUND OF THE RELATIVE DOMAIN TRANSFERABILITY,0.09012875536480687,"Given an empirical distribution bDn (i.e., n data samples), the Rademacher complexity of it is"
GENERALIZATION UPPER BOUND OF THE RELATIVE DOMAIN TRANSFERABILITY,0.09120171673819742,"Rad b
Dn(LG,F) := 1 nEξ """
