Section,Section Appearance Order,Paragraph
ABSTRACT,0.0,ABSTRACT
ABSTRACT,0.001652892561983471,"Gray-box hyperparameter optimization techniques have recently emerged as a
promising direction for tuning Deep Learning methods.
However, the multi-
budget search mechanisms of existing prior works can suffer from the poor cor-
relation among the performances of hyperparameter conﬁgurations at different
budgets. As a remedy, we introduce DYHPO, a method that learns to dynami-
cally decide which conﬁguration to try next, and for what budget. Our technique
is a modiﬁcation to the classical Bayesian optimization for a gray-box setup. Con-
cretely, we propose a new surrogate for Gaussian Processes that embeds the learn-
ing curve dynamics and a new acquisition function that incorporates multi-budget
information. We demonstrate the signiﬁcant superiority of DYHPO against state-
of-the-art hyperparameter optimization baselines through large-scale experiments
comprising 50 datasets (Tabular, Image, NLP) and diverse neural networks (MLP,
CNN/NAS, RNN)."
INTRODUCTION,0.003305785123966942,"1
INTRODUCTION"
INTRODUCTION,0.0049586776859504135,"Hyperparameter Optimization (HPO) is arguably an acute open challenge for Deep Learning (DL),
especially considering the crucial impact HPO has on achieving state-of-the-art empirical results.
Unfortunately, HPO for DL is a relatively under-explored ﬁeld and most DL researchers still op-
timize their hyperparameters via obscure trial-and-error practices. On the other hand, traditional
Bayesian Optimization HPO methods (Snoek et al., 2012; Bergstra et al., 2011) are not directly
applicable to deep networks, due to the infeasibility of evaluating a large number of hyperparam-
eter conﬁgurations. In order to scale HPO for DL, three main directions of research have been
recently explored. (i) Online HPO methods search for hyperparameters during the optimization pro-
cess via meta-level controllers (Chen et al., 2017; Parker-Holder et al., 2020), however, this online
adaptation can not accommodate all hyperparameters (e.g. related to architectural changes). (ii)
Gradient-based HPO techniques, on the other hand, compute the derivative of the validation loss
w.r.t. hyperparameters by reversing the training update steps (Maclaurin et al., 2015; Franceschi
et al., 2017; Lorraine et al., 2020), however, the reversion is not directly applicable to all cases (e.g.
dropout rate). The last direction, (iii) Gray-box HPO techniques discard sub-optimal conﬁgurations
after evaluating them on lower budgets (e.g. after few epochs) (Li et al., 2017; Falkner et al., 2018)."
INTRODUCTION,0.006611570247933884,"In contrast to the online and gradient-based alternatives, gray-box approaches can be deployed in
an off-the-shelf manner to all types of hyperparameters and architectures. The gray-box concept is
based on the intuition that a poorly-performing hyperparameter conﬁguration can be identiﬁed and
terminated by inspecting the validation loss of the ﬁrst few epochs, instead of waiting for the full
convergence. The most prominent gray-box algorithm is Hyperband (Li et al., 2017), which runs
random conﬁgurations at different budgets (e.g. different number of epochs) and successively halves
these conﬁgurations by keeping only the top performers. Follow-up works, such as BOHB (Falkner
et al., 2018) or DEHB (Awad et al., 2021), replace the random sampling of Hyperband with more
intelligent sampling based on Bayesian optimization or differentiable evolution."
INTRODUCTION,0.008264462809917356,"Despite their great practical potential, existing gray-box methods suffer from a major issue. The
low-budget (few epochs) performances are not always a good indicator for the full-budget (full
convergence) performances. For example, a properly regularized network converges slower in the
ﬁrst few epochs, however, typically performs better than a non-regularized variant after the full
convergence. In other words, there is a poor rank correlation of the conﬁgurations’ performances"
INTRODUCTION,0.009917355371900827,Under review as a conference paper at ICLR 2022
INTRODUCTION,0.011570247933884297,"at different budgets. As a remedy, we introduce DYHPO, a gray-box method that dynamically
decides how many conﬁgurations to try and how much budget to spend on each conﬁguration."
INTRODUCTION,0.013223140495867768,"DYHPO is a Bayesian Optimization (BO) approach based on Gaussian Processes (GP), that extends
and adapts BO to the multi-budget (a.k.a. multi-ﬁdelity) case. In this perspective, we propose a
deep kernel GP that captures the learning dynamics (learning curve until the evaluated budget). As
a result, we train a kernel capable of capturing the similarity of a pair of hyperparameter conﬁg-
urations, even if the pair’s conﬁgurations are evaluated at different budgets (technically, different
learning curve lengths). Furthermore, we extend Expected Improvement (Jones et al., 1998) to the
multi-budget case, by introducing a new mechanism for the incumbent conﬁguration of a budget."
INTRODUCTION,0.01487603305785124,"The joint effect of modeling a GP kernel across budgets together with a dedicated acquisition func-
tion leads to DYHPO achieving a statistically signiﬁcant empirical gain against state-of-the-art
gray-box baselines (Falkner et al., 2018; Awad et al., 2021), including prior work on multi-budget
GPs (Kandasamy et al., 2017; Metz et al., 2020). We demonstrate the performance of DYHPO in
three diverse popular types of deep learning architectures (MLP, CNN/NAS, RNN) and 50 datasets
of three diverse modalities (tabular, image, natural language processing). We believe our method is
a step forward towards making HPO for DL practical and feasible. Overall, our contributions can be
summarized as follows:"
INTRODUCTION,0.01652892561983471,"• We introduce a novel Bayesian surrogate model that is based on a Gaussian Process with
a deep kernel. This surrogate model predicts the validation score of a machine learning
model based on the hyperparameter conﬁguration and the learning curve."
INTRODUCTION,0.01818181818181818,"• We derive a simple yet robust way to combine this surrogate model with Bayesian opti-
mization, reusing most of the existing components currently used in traditional Bayesian
optimization methods."
INTRODUCTION,0.019834710743801654,"• Finally, we demonstrate the efﬁciency of our method for hyperparameter optimization and
neural architecture search tasks compared to the current state-of-the-art methods. As an
overarching goal, we believe our method is an important step towards scaling HPO for DL."
MOTIVATION,0.021487603305785124,"2
MOTIVATION"
MOTIVATION,0.023140495867768594,"As mentioned earlier, a major source of sub-optimality for the current gray-box techniques (Li et al.,
2017; Falkner et al., 2018; Awad et al., 2021) is the poor rank correlation of performances at low and
high budgets, which is endemic to the successive halving mechanism. In essence, prior methods mis-
takenly discard good hyper-parameter conﬁgurations by myopically relying only on the early per-
formance after few epochs. In contrast, our method ﬁxes the endemic poor correlation of successive
halving, by learning to decide which conﬁguration to continue optimizing for one more time-budget
step (e.g. one more epoch). In that perspective, our strategy resembles Freeze-Thaw (Swersky
et al., 2014), however, differs in ﬁtting deep kernel GP surrogates with learning curves and a special
multi-budget acquisition. DYHPO never discards a conﬁguration as all options remain latent until
the acquisition selects the most promising one and allocates one more budget unit of optimization."
MOTIVATION,0.024793388429752067,"We illustrate the differences between our strategy and successive halving with the experiment of
Figure 1, where we showcase the HPO progress of three different methods on the ”Helena” dataset
from the LCBench benchmark (Zimmer et al., 2021). Random search is an example of a black-box
approach that trains each candidate until completion without considering the intermediate scores.
Hyperband (Li et al., 2017) is a gray-box approach that statically pre-allocates the budget for a set
of candidates (Hyperband bracket) according to a predeﬁned policy. Finally, DYHPO dynamically
adapts the allocation of budgets for conﬁgurations after every HPO step."
MOTIVATION,0.026446280991735537,"The plots in the top row of Figure 1 show the learning curves of multiple neural networks trained
with different hyperparameter conﬁgurations. The darker the color of a learning curve, the later
the model corresponding to the learning curve was trained during the optimization process. In an
optimal scenario, there should be no learning curve of darker color trained for a very long time if
there is already a learning curve of lighter color with higher accuracy. Since black-box functions
do not consider intermediate responses, this trend is not observed for random search. This is also
not the case for gray-box methods such as Hyperband, because it is possible that no conﬁguration
selected for a Hyperband bracket is outperforming the current best conﬁguration. Since at least one"
MOTIVATION,0.02809917355371901,Under review as a conference paper at ICLR 2022 0.0 0.1 0.2
MOTIVATION,0.02975206611570248,Accuracy
MOTIVATION,0.03140495867768595,Random Search
MOTIVATION,0.03305785123966942,(Black-Box)
MOTIVATION,0.03471074380165289,"Hyperband
(Gray-Box)"
MOTIVATION,0.03636363636363636,"DyHPO
(Gray-Box)"
MOTIVATION,0.03801652892561983,"0
20
40
Number of Epochs 0 5 10 15"
MOTIVATION,0.03966942148760331,Temporal Order
MOTIVATION,0.04132231404958678,"0
20
40
Number of Epochs 0 25 50 75"
MOTIVATION,0.04297520661157025,"0
20
40
Number of Epochs 0 25 50 75"
MOTIVATION,0.04462809917355372,"Figure 1: Top row: Learning curves observed during the search. The darker the learning curve, the
later it was evaluated during the search. Bottom row: y-axis shows a sequence of learning curve
evaluations (bottom to top). The color indicates accuracy. The darker red the higher the accuracy."
MOTIVATION,0.04628099173553719,"of the bracket candidates must be fully trained according to the predeﬁned policy, we observe this
suboptimal behavior in Figure 1. This motivates our idea of dynamically deciding when we want to
continue training a conﬁguration based on the intermediate response. Clearly, DYHPO invests only
a small budget into conﬁgurations that show little promise as indicated by the intermediate scores."
RELATED WORK ON GRAY-BOX HPO,0.047933884297520664,"3
RELATED WORK ON GRAY-BOX HPO"
RELATED WORK ON GRAY-BOX HPO,0.049586776859504134,"Multi-Fidelity Bayesian Optimization.
Bayesian optimization is a black-box function optimiza-
tion framework that has been successfully applied in optimizing hyperparameter and neural archi-
tectures alike (Snoek et al., 2012; Kandasamy et al., 2018; Bergstra et al., 2011). To further improve
Bayesian optimization, several works propose low-ﬁdelity data approximations of hyperparameter
conﬁgurations. Low-ﬁdelity approximations of hyperparameter conﬁgurations can be obtained by
training on a subset of the data (Swersky et al., 2013; Klein et al., 2017) or terminating training
early (Swersky et al., 2014). Several methods extend Bayesian optimization to multi-ﬁdelity data
by engineering new kernels suited for this problem (Swersky et al., 2013; 2014; Poloczek et al.,
2017). Kandasamy et al. (2016) extends GP-UCB (Srinivas et al., 2010) to the multi-ﬁdelity setting
by learning one Gaussian Process (GP) with a standard kernel for each ﬁdelity. Their later work
improves upon this method by learning one GP for all ﬁdelities that enables the use of continuous
ﬁdelities (Kandasamy et al., 2017). The work by Takeno et al. (2020) follows a similar idea but pro-
poses to use an acquisition function based on information gain instead of UCB. While most of the
works rely on GPs to model the surrogate function, Li et al. (2020) use a Bayesian neural network
that models the complex relationship between ﬁdelities with stacked neural networks, one for each
ﬁdelity."
RELATED WORK ON GRAY-BOX HPO,0.0512396694214876,"Multi-Fidelity Bandits.
Hyperband (Li et al., 2017) is a bandits-based multi-ﬁdelity method for
hyperparameter optimization, that due to its simplicity and strong performance, enjoys great pop-
ularity. The algorithm selects hyperparameter conﬁgurations at random and uses successive halv-
ing (Jamieson & Talwalkar, 2016) with different settings to early-stop less promising training runs.
Several improvements have been proposed to Hyperband with the aim to replace the random sam-
pling of hyperparameter conﬁgurations with a more guided approach (Bertrand et al., 2017; Wang
et al., 2018; Wistuba, 2017). BOHB (Falkner et al., 2018) uses TPE (Bergstra et al., 2011) and builds
a surrogate model for every ﬁdelity adhering to a ﬁxed-ﬁdelity selection scheme. DEHB (Awad
et al., 2021) samples candidates using differential evolution which handles discrete and large hyper-
parameter search spaces better than BOHB."
RELATED WORK ON GRAY-BOX HPO,0.05289256198347107,Under review as a conference paper at ICLR 2022
RELATED WORK ON GRAY-BOX HPO,0.05454545454545454,"Deep Kernel Learning with Bayesian Optimization.
We are among the ﬁrst to use deep kernel
learning with Bayesian optimization and to the best of our knowledge the ﬁrst to use it for multi-
ﬁdelity Bayesian optimization. Rai et al. (2016) consider the use of a deep kernel instead of a
manually designed kernel in the context of standard Bayesian optimization, but, limit their exper-
imentation to synthetic data and do not consider its use for hyperparameter optimization. Perrone
et al. (2018); Wistuba & Grabocka (2021) use a pre-trained deep kernel to warm start Bayesian op-
timization with meta-data from previous optimizations. These approaches are multi-task or transfer
learning methods that require the availability of meta-data from related tasks."
RELATED WORK ON GRAY-BOX HPO,0.05619834710743802,"In contrast to prior work, we propose the ﬁrst deep kernel GP for multi-ﬁdelity HPO that is able
to capture the learning dynamics across ﬁdelities/budgets, combined with an acquisition function
that is tailored for the gray-box setup. Furthermore, our work represents an important step towards
scaling HPO for Deep Learning (DL), by demonstrating a statistically signiﬁcant reduction in terms
of HPO time on a series of DL network architectures and a large set of diverse datasets."
PRELIMINARIES,0.05785123966942149,"4
PRELIMINARIES"
PRELIMINARIES,0.05950413223140496,"Black-Box Optimization.
As mentioned earlier, the problem of optimizing hyperparameters can
be modeled as a black-box optimization problem. The objective is to maximize the response func-
tion f : X →R that returns the validation score for training a machine learning model with a
hyperparameter conﬁguration x ∈X. In practice, this observation is noisy such that we observe in
fact yi = f(xi) + ε where ε ∼N(0, σ2
n)."
PRELIMINARIES,0.06115702479338843,"Gray-Box Optimization.
Since many machine learning algorithms allow to measure at various ﬁ-
delities, a relaxation of the black-box to the gray-box optimization problem is in many cases logical
and allows for signiﬁcantly faster optimization. The gray-box setting allows us to query conﬁgu-
rations with a budget smaller than the maximum budget B. Thus, we can query from the response
function f : X × N →R where fi,j = f(xi, j) is the response after spending a budget of j on
conﬁguration xi. As before, these observations are noisy and we observe yi,j = f(xi, j) + εj
where εj ∼N(0, σ2
j,n). Please note, we assume that the budget required to query fi,j+b after
querying fi,j is only b. While this is not necessarily the case for all problems, the models we
consider are learned incrementally. Furthermore, we are able to make use of the learning curve
Yi,j−1 = (yi,1, . . . , yi,j−1) when predicting fi,j."
PRELIMINARIES,0.0628099173553719,"Bayesian Optimization (BO).
BO is a general framework for solving black-box optimization
problems and is very popular for optimizing hyperparameters. It has two ingredients, i.e. a surrogate
model and an acquisition function. The surrogate is a probabilistic model which approximates the
black-box function using the available information of function evaluations. The acquisition function
returns the expected utility for a conﬁguration given the surrogate model’s prediction. The BO
framework executes the following steps sequentially. First, the surrogate model is trained on the
available information about the black-box function, denoted as the history of evaluations D. Then,
the conﬁguration with the highest expected utility xi is evaluated and yi is observed. The tuple
(xi, yi) is added to D and the process is repeated until the HPO budget is exhausted. A common
choice for the surrogate model are Gaussian Processes (Rasmussen & Williams, 2006), a popular
choice for the acquisition function is expected improvement (Jones et al., 1998)."
PRELIMINARIES,0.06446280991735537,"Gaussian Processes (GP).
GPs are probabilistic machine learning models. Given a training data
set D = {(xi, yi)|i = 1, . . . , n} with n data points, the Gaussian Process assumption is that yi is a
random variable and the joint distribution of all yi is assumed to be multivariate Gaussian distributed
as:
y ∼N (m (X) , k (X, X))
(1)
Furthermore, f∗for test instances x∗are jointly Gaussian with y as:

y
f∗"
PRELIMINARIES,0.06611570247933884,"
∼N

m (X, x∗) ,
 Kn
K∗
KT
∗
K∗∗"
PRELIMINARIES,0.06776859504132231,"
.
(2)"
PRELIMINARIES,0.06942148760330578,"The mean function m is often set to 0 and its covariance function k depends on parameters θ. For
notational convenience, we use:"
PRELIMINARIES,0.07107438016528926,"Kn = k (X, X|θ) + σ2
nI, K∗= k (X, X∗|θ) , K∗∗= k (X∗, X∗|θ)
(3)"
PRELIMINARIES,0.07272727272727272,Under review as a conference paper at ICLR 2022
PRELIMINARIES,0.0743801652892562,"to deﬁne the kernel matrix. We can derive the posterior predictive distribution with mean and co-
variance as follows:"
PRELIMINARIES,0.07603305785123966,"E [f∗|X, y, X∗] = KT
∗K−1
n y, cov [f∗|X, X∗] = K∗∗−KT
∗K−1
n K∗
(4)"
PRELIMINARIES,0.07768595041322314,"Often, the kernel function is manually engineered, one popular example is the squared exponential
kernel. However, in this work, we make use of the idea of deep kernel learning (Wilson et al., 2016).
The idea is to model the kernel as a neural network ϕ and learn the best kernel transformation as:"
PRELIMINARIES,0.07933884297520662,"kdeep(x, x′|θ, w) = k(ϕ(x, w), ϕ(x′, w)|θ).
(5)"
PRELIMINARIES,0.08099173553719008,"As we will see later, this allows us to use convolutional operations as part of our kernel."
DYNAMIC MULTI-FIDELITY HYPERPARAMETER OPTIMIZATION,0.08264462809917356,"5
DYNAMIC MULTI-FIDELITY HYPERPARAMETER OPTIMIZATION"
DYNAMIC MULTI-FIDELITY HYPERPARAMETER OPTIMIZATION,0.08429752066115702,"In this section, we will describe DYHPO, our proposed method for hyperparameter optimization in
the gray-box setting. At ﬁrst, we will describe the surrogate model which is a Gaussian Process with
a deep convolutional kernel. Then, we describe a variation of the popular expected improvement
acquisition function (Jones et al., 1998), modiﬁed to consider multiple ﬁdelities, and conclude with
the ﬁnal algorithm."
MULTI-FIDELITY SURROGATE WITH DEEP CONVOLUTIONAL KERNEL,0.0859504132231405,"5.1
MULTI-FIDELITY SURROGATE WITH DEEP CONVOLUTIONAL KERNEL"
MULTI-FIDELITY SURROGATE WITH DEEP CONVOLUTIONAL KERNEL,0.08760330578512397,"We propose to use a Gaussian Process surrogate model that infers the value of fi,j based on the
hyperparameter conﬁguration xi, the budget j as well as the past learning curve Yi,j−1. For this
purpose, we use a deep kernel which is deﬁned as"
MULTI-FIDELITY SURROGATE WITH DEEP CONVOLUTIONAL KERNEL,0.08925619834710743,"kdeep((xi, Yi,j−1, j), (xi′, Yi′,j′−1, j′)) = k(ϕ(xi, Yi,j−1, j), ϕ(xi′, Yi′,j′−1, j′))
(6)"
MULTI-FIDELITY SURROGATE WITH DEEP CONVOLUTIONAL KERNEL,0.09090909090909091,"We use a squared exponential kernel for k and the neural network ϕ is composed of linear and
convolutional layers as shown in Figure 2. We normalize the budget j to a range between 0 and 1
by dividing it by the maximum budget B. Afterward, it is concatenated with the hyperparameter
conﬁguration xi and fed to a linear layer. xi j"
MULTI-FIDELITY SURROGATE WITH DEEP CONVOLUTIONAL KERNEL,0.09256198347107437,"Yi,j−1 · 1 B P P P"
MULTI-FIDELITY SURROGATE WITH DEEP CONVOLUTIONAL KERNEL,0.09421487603305785,"Convolution
max P P P"
MULTI-FIDELITY SURROGATE WITH DEEP CONVOLUTIONAL KERNEL,0.09586776859504133,Figure 2: The feature extractor ϕ used in our deep kernel.
MULTI-FIDELITY SURROGATE WITH DEEP CONVOLUTIONAL KERNEL,0.09752066115702479,"The learning curve Yi,j−1 is trans-
formed by a one-dimensional convo-
lution followed by a global max pool-
ing layer.
Finally, both representa-
tions are fed to another linear layer.
Its output will be the input to the ker-
nel function k.
Both, the kernel k
and the neural network ϕ consist of
trainable parameters θ and w, respec-
tively. We ﬁnd their optimal values
by computing the maximum likeli-
hood estimates as:"
MULTI-FIDELITY SURROGATE WITH DEEP CONVOLUTIONAL KERNEL,0.09917355371900827,"ˆθ, ˆw = arg max
θ,w
p(y|X, Y, θ, w) = arg max
θ,w"
MULTI-FIDELITY SURROGATE WITH DEEP CONVOLUTIONAL KERNEL,0.10082644628099173,"Z
p(y|X, Y, θ, w)p(f|X, Y, θ, w)df"
MULTI-FIDELITY SURROGATE WITH DEEP CONVOLUTIONAL KERNEL,0.1024793388429752,"∝arg min
θ,w
yTK−1
n y + log |Kn|
(7)"
MULTI-FIDELITY SURROGATE WITH DEEP CONVOLUTIONAL KERNEL,0.10413223140495868,"In order to solve this optimization problem, we use gradient descent and Adam (Kingma & Ba,
2015) with a learning rate of 0.1. Given the maximum likelihood estimates, we can approximate the
predictive posterior as formalized in Equation 8, and ultimately compute the mean and covariance
of this Gaussian using Equation 4."
MULTI-FIDELITY SURROGATE WITH DEEP CONVOLUTIONAL KERNEL,0.10578512396694215,"p (fi,j|xi, Yi,j−1, j, D) ≈p

fi,j|xi, Yi,j−1, j, D, ˆθ, ˆw

(8)"
MULTI-FIDELITY SURROGATE WITH DEEP CONVOLUTIONAL KERNEL,0.10743801652892562,Under review as a conference paper at ICLR 2022
MULTI-FIDELITY EXPECTED IMPROVEMENT,0.10909090909090909,"5.2
MULTI-FIDELITY EXPECTED IMPROVEMENT"
MULTI-FIDELITY EXPECTED IMPROVEMENT,0.11074380165289256,"Expected improvement (Jones et al., 1998) is a commonly used acquisition function for the black-
box setting and is deﬁned as:"
MULTI-FIDELITY EXPECTED IMPROVEMENT,0.11239669421487604,"EI(x|D) = E [max {f(x) −ymax, 0}] ,
(9)"
MULTI-FIDELITY EXPECTED IMPROVEMENT,0.1140495867768595,where ymax is the largest observed value of f. We propose a multi-ﬁdelity version of it as:
MULTI-FIDELITY EXPECTED IMPROVEMENT,0.11570247933884298,"EIMF(x, j|D) = E

max

f(x, j) −ymax
j
, 0
	
,
(10)"
MULTI-FIDELITY EXPECTED IMPROVEMENT,0.11735537190082644,where:
MULTI-FIDELITY EXPECTED IMPROVEMENT,0.11900826446280992,"ymax
j
=
max {y | ((x, ·, j), y) ∈D}
∃x ∈X : ((x, ·, j), y) ∈D
max {y | (·, y) ∈D}
otherwise
(11)"
MULTI-FIDELITY EXPECTED IMPROVEMENT,0.1206611570247934,"Simply put, ymax
j
is the largest observed value of f for a budget of j if it exists already, otherwise, it
is the largest observed value for any budget. If there is only one possible budget, the multi-ﬁdelity
expected improvement is identical to expected improvement."
THE DYHPO ALGORITHM,0.12231404958677686,"5.3
THE DYHPO ALGORITHM"
THE DYHPO ALGORITHM,0.12396694214876033,Algorithm 1: DYHPO Algorithm
THE DYHPO ALGORITHM,0.1256198347107438,"1: while not converged do
2:
xi ←arg maxx∈X EIMF (x, j) (Section 5.2)
3:
Observe yi,j.
4:
D ←D ∪{((xi, Yi,j−1, j), yi,j)}
5:
Update the surrogate model on D. (Section 5.1)
6: return xi with largest yi,j."
THE DYHPO ALGORITHM,0.12727272727272726,"The DYHPO algorithm looks very
similar to many black-box Bayesian
optimization algorithms as shown in
Algorithm 1. The big difference is that
at each step we dynamically decide
which candidate conﬁguration to train
for a small additional budget. Possi-
ble candidates are previously uncon-
sidered conﬁgurations as well as con-
ﬁgurations that did not reach the max-
imum budget.
In Line 2, the most
promising candidate is chosen using the acquisition function introduced in Section 5.2 and the sur-
rogate model’s predictions. It is important to highlight that we do not maximize the acquisition
function along the budget dimensionality. Instead, we set j such that it is by exactly one higher than
the budget used to evaluate xi before. If xi has not been evaluated for any budget yet, j is set to 1.
This ensures that we explore conﬁgurations by slowly increasing the budget. After having selected
the candidate and the corresponding budget, the function f is evaluated and we observe yi,j (Line
3). This additional data point is added to D in Line 4. Then in Line 5, the surrogate model is updated
according to the training scheme described in Section 5.1."
EXPERIMENTS,0.12892561983471074,"6
EXPERIMENTS"
