Section,Section Appearance Order,Paragraph
ABSTRACT,0.0,ABSTRACT
ABSTRACT,0.004830917874396135,"Information retrieval is an important component in natural language processing, for
knowledge intensive tasks such as question answering and fact checking. Recently,
information retrieval has seen the emergence of dense retrievers, based on neural
networks, as an alternative to classical sparse methods based on term-frequency.
These models have obtained state-of-the-art results on datasets and tasks where
large training sets are available. However, they do not transfer well to new domains
or applications with no training data, and are often outperformed by term-frequency
methods such as BM25 which are not supervised. Thus, a natural question is
whether it is possible to train dense retrievers without supervision. In this work,
we explore the limits of contrastive learning as a way to train unsupervised dense
retrievers, and show that it leads to strong retrieval performance. More precisely,
we show on the BEIR benchmark that our model outperforms BM25 on 8 out of 14
datasets. Furthermore, when a few thousands examples are available, we show that
ﬁne-tuning our model on these leads to strong improvements compared to BM25.
Finally, when used as pre-training before ﬁne-tuning on the MS MARCO dataset,
our technique obtains state-of-the-art results on the BEIR benchmark."
INTRODUCTION,0.00966183574879227,"1
INTRODUCTION"
INTRODUCTION,0.014492753623188406,"Document retrieval is the task of ﬁnding relevant documents in a large collection to answer spe-
ciﬁc queries. This is an important task by itself and a core component of many natural language
processing (NLP) problems, such as open domain question answering (Chen et al., 2017) or fact
checking (Thorne et al., 2018). Traditionally, retrieval systems, or retrievers, leverage lexical similari-
ties to match queries and documents, using, for instance, TF-IDF or BM25 weighting (Robertson
& Zaragoza, 2009). These approaches, based on exact matches between tokens of the queries and
documents, suffer from the lexical gap and do not generalize well (Berger et al., 2000). By contrast,
approaches based on neural networks allow learning beyond lexical similarities, resulting in state-of-
the-art performance on question answering benchmarks, such as MS-MARCO (Nguyen et al., 2016)
or NaturalQuestion (Kwiatkowski et al., 2019)."
INTRODUCTION,0.01932367149758454,"As training neural networks requires large amount of data, their strong retrieval results were possible
for domains and applications where large training datasets are available. In the case of retrieval,
creating these datasets requires manually matching queries to the relevant documents in the collection.
This is hardly possible when the collection contains millions or billions of element, resulting in many
scenarios where only a few in-domain examples, if any, are available. A potential solution is to train
a dense retriever on a large retrieval dataset such as MS MARCO, and then apply it to new domains,
a setting refered to as zero-shot. Unfortunately, in this setting dense retrievers are often outperformed
by classical methods based on term-frequency, which do not require supervision (Thakur et al., 2021)."
INTRODUCTION,0.024154589371980676,"Thus, a natural alternative to transfer learning is unsupervised learning, which raises the following
question: is it possible to train dense retrievers without supervision, and match the performance of
BM25? Training dense retrievers without supervision can be achieved by using a pretext task that
approximates retrieval. Given a document, one can generate a synthetic query and then train the
network to retrieve the original document, among many others, given the query. The inverse Cloze
task (ICT), proposed by Lee et al. (2019) to pre-train retrievers, uses a given sentence as query and
predict the context surrounding it. While showing promising results as pre-training (Chang et al.,
2020; Sachan et al., 2021a), this approach still lags behind BM25 when used as a zero-shot retriever."
INTRODUCTION,0.028985507246376812,Under review as a conference paper at ICLR 2022
INTRODUCTION,0.033816425120772944,"ICT is strongly related to contrastive learning (Wu et al., 2018), which has been widely applied in
computer vision (Chen et al., 2020; He et al., 2020). In particular, computer vision models trained
with the latest contrastive learning methods lead to features well suited to retrieval (Caron et al.,
2021). In this work, we thus propose to revisit how well contrastive learning performs to train dense
retrievers without supervision. We want to investigate how much the recent developments from
computer vision, such as MoCo, can improve dense retrievers. Here, our goal is not to develop new
techniques, but to determine how far we can go by pushing existing methods to their limits."
INTRODUCTION,0.03864734299516908,"In this paper, we thus make the following contributions. First, we show that contrastive learning
can lead to strong unsupervised retrievers: our model achieves Recall@100 results competitive with
BM25 on most of the BEIR benchmark. Second, in a few-shot setting, we show that our model
beneﬁts from few training examples, and obtains better results than transfering models from large
datasets such as MS MARCO. Third, when used as a pre-training method before ﬁne-tuning on
MS MARCO, our technique leads to state-of-the-art retrieval performance on the BEIR benchmark.
Finally, we perform ablations to motivate our design choices, and show that cropping works better
than the inverse Cloze task."
RELATED WORK,0.043478260869565216,"2
RELATED WORK"
RELATED WORK,0.04830917874396135,"In this section, we brieﬂy review relevant work in information retrieval, and application of machine
learning to this problem. This is not an exhaustive review, and we refer the reader to Manning et al.
(2008), Mitra et al. (2018) and Lin et al. (2020) for a more complete introduction to the ﬁeld."
RELATED WORK,0.05314009661835749,"Term-frequency based information retrieval.
Historically, in information retrieval, documents
and queries are represented as sparse vectors where each element of the vectors corresponds to a term
of the vocabulary. Different weighing schemes have been proposed, to determine how important a
particular term is to a document in a large dataset. One of the most used weighing scheme is known
as TF-IDF, and is based on inverse document frequency, or term speciﬁcity (Jones, 1972). BM25,
which is still widely used today, extends TF-IDF (Robertson et al., 1995). A well known limitation of
these approaches is that they rely on exact match to retrieve documents. This lead to the introduction
of latent semantic analysis (Deerwester et al., 1990), in which documents are represented as low
dimensional dense vectors."
RELATED WORK,0.057971014492753624,"Neural network based information retrieval.
Following the successful application of deep learn-
ing methods to natural language processing, neural networks techniques were introduced for informa-
tion retrieval. Huang et al. (2013) proposed a deep bag-of-words model, in which representations of
queries and documents are computed independently. A relevance score is then obtained by taking
the dot product between representations, and the model is trained end-to-end on click data from a
search engine. This method was later reﬁned by replacing the bag-of-words model by convolutional
neural networks (Shen et al., 2014) or recurrent neural network (Palangi et al., 2016). A limitation
of bi-encoders is that queries and documents are represented by a single vector, preventing the
model to capture ﬁne-grained interactions between terms. Nogueira & Cho (2019) thus introduced a
cross-encoder model, based on a pre-trained BERT model (Devlin et al., 2019), which jointly encodes
queries and documents. The application of a strong pre-trained model, as well as the cross-encoder
architecture, lead to important improvement on the MS-MARCO benchmark (Bajaj et al., 2016)."
RELATED WORK,0.06280193236714976,"The methods described in the previous paragraph were applied to re-rank documents, which were
retrieved with a traditional IR system such as BM25. Gillick et al. (2018) ﬁrst studied whether
continuous retrievers, based on bi-encoder neural models, could be viable alternative to re-ranking.
In the context of question answering, Karpukhin et al. (2020) introduced a dense passage retriever
(DPR) based on the bi-encoder architecture. This model is initialized with a BERT network, and
trained discriminatively using pairs of queries and relevant documents, with hard negatives from
BM25. Xiong et al. (2020) further extended this work by mining hard negatives with the model
itself during optimization, and trained on the MS-MARCO dataset. Once a collection of documents,
such as Wikipedia articles, is encoded, retrieval is performed with a fast k-nearest neighbors library
such as FAISS Johnson et al. (2019). To alleviate the limitations of bi-encoders, Humeau et al.
(2019) introduces the poly-encoder architecture, where documents are encoded by multiple vectors.
Similarly, Khattab et al. (2020) proposes the ColBERT model, which keeps a vector representation
for each term of the queries and documents. To make the retrieval tractable, the term-level function"
RELATED WORK,0.06763285024154589,Under review as a conference paper at ICLR 2022
RELATED WORK,0.07246376811594203,"is approximated to ﬁrst retrieve an initial set of candidates, which are then re-ranked with the true
score. In the context of question answering, knowledge distillation has been used to train retrievers,
either using the attention scores of the reader of the downstream task as synthetic labels (Izacard &
Grave, 2021), or the relevance score from a cross encoder (Yang & Seo, 2020). Luan et al. (2020)
compares, theoretically and empirically, the performance of sparse and dense retrievers, including bi-,
cross- and poly-encoders. Dense retrievers, such as DPR, can lead to indices that weigh close to
100 GB when encoding document collections such as Wikipedia. Izacard et al. (2020) shows how to
compress such indices, with limited impact on performance, making them more practical to use."
RELATED WORK,0.07729468599033816,"Self-supervised learning for NLP.
Following the success of word2vec (Mikolov et al., 2013), many
self-supervised techniques have been proposed to learn representation of text. Here, we brieﬂy review
the ones that are most related to our approach: sentence level models and contrastive techniques.
Jernite et al. (2017) introduced different objective function to learn sentence representations, including
next sentence prediction and binary order prediction. These objectives were later used in pre-trained
models based on transformers, such as BERT (Devlin et al., 2019) and AlBERT (Lan et al., 2019). In
the context of retrieval, Lee et al. (2019) introduced the inverse cloze task (ICT), whose purpose is
to predict the context surrounding a span of text. Guu et al. (2020) integrated a bi-encoder retriever
model in a BERT pre-training scheme. The retrieved documents are used as additional context in the
BERT task, and the whole system is trained end-to-end in an unsupervised way. Similarly, Lewis et al.
(2020) proposed to jointly learn a retriever and a generative seq2seq model, using self-supervised
training. Chang et al. (2020) compares different pre-training tasks for retrieval, including the inverse
cloze task. Constrastive learning was introduced in computer vision by Wu et al. (2018), followed
by several modiﬁcations to improve the training (He et al., 2020; Chen et al., 2020; Caron et al.,
2020). In the context of natural language processing, Fang et al. (2020) proposed to apply MoCo
where positive pairs of sentences are obtained using back-translation. Different works augmented
the masked language modeling objective with a contrastive loss (Giorgi et al., 2020; Wu et al., 2020;
Meng et al., 2021). Finally, SBERT (Reimers & Gurevych, 2019) uses a siamese network similar to
contrastive learning to learn a BERT-like model that is adapted to matching sentence embeddings.
Their formulation is similar to our work but requires aligned pairs of sentences to form positive pairs
while we propose to use data augmentation to leverage large unaligned textual corpora. Concurrent to
this work, Gao & Callan (2021) have also shown the potential of contrastive learning for information
retrieval; building on the same observation that both tasks share a similar structure."
METHOD,0.0821256038647343,"3
METHOD"
METHOD,0.08695652173913043,"In this section, we describe how to train a dense retriever with no supervision. We review the model
architecture and then describe contrastive learning - a key component of its training."
METHOD,0.09178743961352658,"The objective of a retriever is to ﬁnd relevant documents in a large collection for a given query.
Thus, the retriever takes as input the set of documents and the query and outputs a relevance score
for each document. A standard approach is to encode each query–document pair with a neural
network (Nogueira & Cho, 2019). This procedure requires re-encoding every document for any
new query and hence does not scale to large collections of documents. Instead, we propose to use
a bi-encoder architecture, where documents and queries are encoded independently (Huang et al.,
2013; Karpukhin et al., 2020). One can compute the relevance score by taking the dot product (or
cosine similarity) between the document’s representation and the representation of the query. More
precisely, given a pair of query q and document d, we encode each of them independently using
the same model, fθ, parametrized by θ. The relevance score s(q, d) is then the dot product of the
resulting representations:"
METHOD,0.0966183574879227,"s(q, d) = ⟨fθ(q), fθ(d)⟩."
METHOD,0.10144927536231885,"In practice, we use a transformer network for fθ to embed both queries and documents. The
representation fθ(q) (resp. fθ(d)) for a query (resp. document) is obtained by averaging the hidden
representations of the last layer. Following previous work on dense retrieval with neural networks, we
use the BERT base uncased architecture and refer the reader to Devlin et al. (2019) for more details."
METHOD,0.10628019323671498,Under review as a conference paper at ICLR 2022
UNSUPERVISED TRAINING ON UNALIGNED DOCUMENTS,0.1111111111111111,"3.1
UNSUPERVISED TRAINING ON UNALIGNED DOCUMENTS"
UNSUPERVISED TRAINING ON UNALIGNED DOCUMENTS,0.11594202898550725,"In this section, we describe our unsupervised training pipeline. We brieﬂy review the loss function
traditionally used in contrastive learning. We then discuss obtaining positive pairs from a single text
document, a critical ingredient for this training paradigm."
CONTRASTIVE LEARNING,0.12077294685990338,"3.1.1
CONTRASTIVE LEARNING"
CONTRASTIVE LEARNING,0.12560386473429952,"Contrastive learning is an approach that relies on the fact that every document is, in some way, unique.
This signal is the only information available in the absence of manual supervision. The resulting
algorithm learns by discriminating between documents, using a contrastive loss (Wu et al., 2018).
This loss compares either positive (from the same document) or negative (from different documents)
pairs of document representations. More formally, given a positive pair of representations (q, k+)
and a set of negative pairs (q, ki)i=0..K, the contrastive InfoNCE loss is deﬁned as:"
CONTRASTIVE LEARNING,0.13043478260869565,"L(q, k+) =
exp(s(q, k+)/τ)
PK
i=0 exp(s(q, ki)/τ)
,"
CONTRASTIVE LEARNING,0.13526570048309178,"where τ is a temperature parameter. This loss encourages the relevance score of similar examples to
be high and that of dissimilar examples to be low. Another interpretation of this loss function is the
following: given the query representation q, the goal is to recover, or retrieve, the representation k+
corresponding to the positive document, among all the negatives ki. In the following, we refer to the
left-hand side representations in the score s as queries and the right-hand side representations as keys."
BUILDING POSITIVE PAIRS FROM A SINGLE DOCUMENT,0.14009661835748793,"3.1.2
BUILDING POSITIVE PAIRS FROM A SINGLE DOCUMENT"
BUILDING POSITIVE PAIRS FROM A SINGLE DOCUMENT,0.14492753623188406,"A crucial element of contrastive learning is how to build positive pairs from a single input. In
computer vision, this step relies on applying two independent data augmentations to the same image,
resulting in two “views” that form a positive pair (Wu et al., 2018; Chen et al., 2020). While we
consider similar independent text transformation, we also explore dependent transformations designed
to reduce the correlation between views."
BUILDING POSITIVE PAIRS FROM A SINGLE DOCUMENT,0.1497584541062802,"Inverse Cloze Task
is a data augmentation that generates two mutually exclusive views of a
document, introduced in the context of retrieval by Lee et al. (2019). The idea is to take a span of
tokens to form one view, and its complementary to form the other view. More precisely, given a
sequence of text (w1, ..., wn), ICT samples a span a, b, where 1 ≤a < b ≤n, uses the tokens of the
span as the query and the rest of the tokens as the document (or key). In the original implementation
by Lee et al. (2019) the span corresponds to a sentence, and is kept in the document 10% of the time
to encourage lexical matching."
BUILDING POSITIVE PAIRS FROM A SINGLE DOCUMENT,0.15458937198067632,"Independent cropping
is a common independent data augmentation used for images where views
are generated independently by cropping the input. In the context of text, cropping is equivalent to
sampling a span of tokens. This strategy thus samples independently two spans from a document to
form a positive pair. As opposed to the inverse Cloze task, in cropping both views of the example
correspond to contiguous subsequence of the original data. A second difference between cropping
and ICT is the fact that the task is symmetric: both the queries and documents follow the same
distribution. Independent cropping can also lead to overlap between the two views of the data, hence
encouraging the network to learn exact matches between the query and document, in a way that is
similar to lexical matching methods like BM25. In practice, we can either ﬁx the length of the span
for the query and the key, or sample them."
BUILDING POSITIVE PAIRS FROM A SINGLE DOCUMENT,0.15942028985507245,"Additional data augmentation.
Finally, we also consider additional data augmentations such as
random word deletion, random word replacement or random word masking. We use these perturbation
in addition to random cropping."
BUILDING LARGE SET OF NEGATIVE PAIRS,0.1642512077294686,"3.1.3
BUILDING LARGE SET OF NEGATIVE PAIRS"
BUILDING LARGE SET OF NEGATIVE PAIRS,0.16908212560386474,"An important aspect of contrastive learning is to maintain a large set of negative pairs. Most standard
frameworks differ from how the negatives are handled, and we brieﬂy describe two of them, SimCLR
and MoCo, that we use in this work."
BUILDING LARGE SET OF NEGATIVE PAIRS,0.17391304347826086,Under review as a conference paper at ICLR 2022
BUILDING LARGE SET OF NEGATIVE PAIRS,0.178743961352657,"Negative pairs within a batch.
A ﬁrst solution, called SimCLR (Chen et al., 2020), is to generate
the negative pairs by using the other examples from the same batch: each example in a batch is
transformed twice to generate positive pairs, and we generate negative pairs by using the views
from the other examples in the batch. In that case, the gradient is back-propagated through the
representations of both the queries and the keys. A downside of this approach is that it requires
extremely large batch sizes to work well. This technique was also considered when using ICT to
pre-train retrievers by Lee et al. (2019)."
BUILDING LARGE SET OF NEGATIVE PAIRS,0.18357487922705315,"Negative pairs across batches.
An alternative approach is to store representations from previous
batches in a queue and use them as negative examples in the loss (Wu et al., 2018). This allows for
smaller batch size but slightly changes the loss by making it asymmetric between “queries” (one of
the view generated from the elements of the current batch), and “keys” (the other generated views, as
well as the elements stored in the queue). Gradient is only backpropagated through the “queries”,
and the representation of the “keys” are considered as ﬁxed. In practice, the features stored in the
queue from previous batches comes form previous iterations of the network. This leads to a drop of
performance when the network rapidly changes during training. Instead, He et al. (2020) proposed to
generate representations of keys from a second network that is updated more slowly. This approach,
called MoCo, considers two networks: one for the keys, parametrized by θk, and one of the query,
parametrized by θq. The parameters of the query network are updated with backpropagation and
stochastic gradient descent, like in SimCLR, while the parameters of the key network, or Momentum
encoder, is updated from the parameters of the query network by using a exponential moving average:"
BUILDING LARGE SET OF NEGATIVE PAIRS,0.18840579710144928,"θk ←mθk + (1 −m)θq,"
BUILDING LARGE SET OF NEGATIVE PAIRS,0.1932367149758454,"where m is the momentum parameter that takes its value in [0, 1]."
EXPERIMENTS,0.19806763285024154,"4
EXPERIMENTS"
EXPERIMENTS,0.2028985507246377,"In this section, we empirically evaluate contrastive learning as a way to train dense retrievers. First,
we compare our best models to the state-of-the-art on competitive retrieval benchmarks for both
zero-shot and few-shot retrieval. Then, we provide an ablation study to motivate the technical choices
leading to our best retriever, shedding some light on the important ingredients of our approach. We
give technical details about our models in Appendix A."
BEIR BENCHMARK,0.20772946859903382,"4.1
BEIR BENCHMARK"
BEIR BENCHMARK,0.21256038647342995,"The BEIR benchmark, introduced by Thakur et al. (2021), contains 18 retrieval datasets with a focus
on diversity. Each dataset is made of a set of queries, the corresponding relevant documents and a
large collection of documents to retrieve from. These datasets correspond to nine different retrieval
tasks, such as fact checking, question answering, entity retrieval or citation prediction. Moreover, the
benchmark covers a large number of domains, such as Wikipedia, news articles, scientiﬁc publications
or social media posts. Finally, there is also diversity in terms of documents and queries length, with
queries ranging from 3 to 190 words and documents from 11 to 630 words.
Most datasets from
the BEIR benchmark do not contain a training set, and the focus of the benchmark is zero-shot
retrieval. However, most machine learning based retrievers are still trained on supervised data, such
as the large scale retrieval dataset MS-MARCO (Bajaj et al., 2016). Following standard practice, we
report two metrics on this benchmark, the nDGC@10 and the Recall@100. These two metrics are
complementary and both important: nDCG focuses on the ranking of the top 10 retrieved documents,
and is good at evaluating documents returned to human, for example in a search engine. On the other
hand, the Recall@100 is relevant to evaluate retrievers that are included in marchine learning systems,
such as question answering. Indeed, such models can process hundreds of documents, and ignore the
ranking of these documents (Izacard & Grave, 2020)."
BASELINES,0.21739130434782608,"4.2
BASELINES"
BASELINES,0.2222222222222222,"First, we compare our approach to the BM25 ranking function, which does not require any training
data. However, the relevance of individual terms depends on the inverse document frequency, which
is computed over each document collection independently. In that sense, the ranking function used
in the BM25 baseline is adapted to each dataset on which retrieval is performed. We also compare"
BASELINES,0.22705314009661837,Under review as a conference paper at ICLR 2022
BASELINES,0.2318840579710145,"BM25
ColBERT
SPARTA
docT5Query
DPR
ANCE
GenQ
TAS-B
Ours"
BASELINES,0.23671497584541062,"TREC-COVID
65.6
67.7
53.8
71.3
33.2
65.4
61.9
48.1
61.0
NFCorpus
32.5
30.5
30.1
32.8
18.9
23.7
31.9
31.9
33.2
NQ
32.9
52.4
39.8
39.9
47.4
44.6
35.8
46.3
50.2
HotpotQA
60.3
59.3
49.2
58.0
39.1
45.6
53.4
58.4
64.5
FiQA
23.6
31.7
19.8
29.1
11.2
29.5
30.8
30.0
28.8
ArguAna
31.5
23.3
27.9
34.9
17.5
41.5
49.3
42.9
46.0
Tóuche-2020
36.7
20.2
17.5
34.7
13.1
24.0
18.2
16.2
25.9
Quora
78.9
85.4
63.0
80.2
24.8
85.2
83.0
83.5
85.4
CQADupStack
29.9
35.0
25.7
32.5
15.3
29.6
34.7
31.4
32.2
DBPedia
31.3
39.2
31.4
33.1
26.3
28.1
32.8
38.4
38.8
Scidocs
15.8
14.5
12.6
16.2
7.7
12.2
14.3
14.9
16.0
Fever
75.3
77.1
59.6
71.4
56.2
66.9
66.9
70.0
77.7
Climate-FEVER
21.3
18.4
8.2
20.1
14.8
19.8
17.5
22.8
23.4
SciFact
66.5
67.1
58.2
67.5
31.8
50.7
64.4
64.3
68.1"
BASELINES,0.24154589371980675,"Average
43.0
44.4
35.5
44.4
25.5
40.5
42.5
42.8
46.5
Best on
1
5
0
2
0
0
1
0
6"
BASELINES,0.2463768115942029,"Table 1: BEIR Benchmark. We report nDCG@10 on the test sets of the datasets from the BEIR
benchmark for bi-encoder methods without re-ranker. We also report the average (“Average”) and
number of datasets where a method is the best (“Best on”) over the entire BEIR benchmark (excluding
three datasets because of their licence). We evaluate retrievers after pre-training on unsupervised data
with our contrastive learning and ﬁnetuning on MS-MARCO (“Ours”). Bold is the best overall."
