Section,Section Appearance Order,Paragraph
ABSTRACT,0.0,ABSTRACT
ABSTRACT,0.006944444444444444,"The non-robustness of neural network policies to adversarial examples poses a
challenge for deep reinforcement learning. One natural approach to mitigate the
impact of adversarial examples is to develop methods to detect when a given input
is adversarial. In this work we introduce a novel approach for detecting adversarial
examples that is computationally efﬁcient, is agnostic to the method used to gen-
erate adversarial examples, and theoretically well-motivated. Our method is based
on a measure of the local curvature of the neural network policy, which we show
differs between adversarial and clean examples. We empirically demonstrate the
effectiveness of our method in the Atari environment against a large set of state-of-
the-art algorithms for generating adversarial examples. Furthermore, we exhibit
the effectiveness of our detection algorithm with the presence of multiple strong
detection-aware adversaries."
INTRODUCTION,0.013888888888888888,"1
INTRODUCTION"
INTRODUCTION,0.020833333333333332,"Since Mnih et al. (2015) showed that deep neural networks can be used to parameterize reinforce-
ment learning policies, there has been substantial growth in new algorithms and applications for
deep reinforcement learning. While this progress has resulted in a variety of new capabilities for
reinforcement learning agents, it has at the same time introduced new challenges due to the non-
robustness of DNNs to imperceptible adversarial perturbations originally discovered by Szegedy
et al. (2014). In particular, Huang et al. (2017); Kos & Song (2017) showed that the non-robustness
of DNNs to adversarial perturbations extends to the deep reinforcement learning domain, where ap-
plications such as self-driving cars or automatic ﬁnancial trading cannot tolerate such a vulnerability."
INTRODUCTION,0.027777777777777776,"In the setting of image classiﬁcation there has been signiﬁcant effort to make DNNs robust to ad-
versarial perturbations Goodfellow et al. (2015); Madry et al. (2018). At the same time, there is a
line of work focused on showing the inevitability of adversarial examples and the intrinsic difﬁculty
of learning robust classiﬁers Dohmatob (2019); Mahloujifar et al. (2019); Gourdeau et al. (2019).
Given that it may not be possible to make DNNs completely robust to adversarial examples, a natu-
ral objective is to instead attempt to detect the presence of adversarial examples Pang et al. (2018);
Yang et al. (2020); Cintas et al. (2020). Additional work has shown that many adversarial defense
and detection methods fail in the white-box setting where the adversary is aware of both the trained
model and the method used to detect examples Athalye et al. (2018); Carlini & Wagner (2017b)."
INTRODUCTION,0.034722222222222224,"In this paper we propose a novel detection method for adversarial examples in deep reinforcement
learning. This is the ﬁrst method for detecting adversarial examples in this setting, where compu-
tational efﬁciency is paramount since the method must be applied in real-time to every state en-
countered by the agent. Our approach relies on differences in the curvature of the neural policy in
the neighborhood of an adversarial example when compared to a natural example. At a high level
our method is based on the intuition that while natural examples have neighborhoods determined
by an optimization procedure intended to learn a policy that works well across all states, each ad-
versarial example is the output of some local optimization in the neighborhood of one particular
state. Our proposed method is computationally efﬁcient, requiring only one gradient computation
and two policy evaluations, requires no training that depends on the adversarial attack method, and"
INTRODUCTION,0.041666666666666664,Under review as a conference paper at ICLR 2022
INTRODUCTION,0.04861111111111111,"is theoretically well-founded. In summary, we focus on detection of adversarial examples and make
the following contributions:"
INTRODUCTION,0.05555555555555555,"• Our paper is the ﬁrst to focus on detection of adversarial examples in the deep reinforcement
learning domain.
• We propose a novel method, Detection of Adversaries with Taylor Approximation (DATA),
to detect adversarial examples based on the local curvature of the neural network policy.
DATA is computationally efﬁcient, independent of the method used to generate the adver-
sarial example, and theoretically justiﬁed.
• We conduct experiments in various games of the Arcade Learning Environment that
demonstrate the effectiveness of DATA in detecting examples generated by several state-
of-the-art adversarial attack methods.
• Furthermore, we demonstrate the effectiveness of DATA in the white-box setting where the
adversary is aware of the detection method used."
RELATED WORK AND BACKGROUND,0.0625,"2
RELATED WORK AND BACKGROUND"
RELATED WORK AND BACKGROUND,0.06944444444444445,"Deep Reinforcement Learning: In this paper we focus on discrete action set Markov Decision
Processes (MDPs) which are given by a continuous set of states S, a discrete set of actions A, a
transition probability function P : S × A × S →R, and a reward function r : S × A →R. A
policy π : S →P(A) assigns a probability distribution on actions π(·|s) to each state s. In deep
reinforcement learning the policy π is parameterized by a deep neural network."
RELATED WORK AND BACKGROUND,0.0763888888888889,"Adversarial Examples: Goodfellow et al. (2015) introduced the fast gradient method (FGM) for
producing adversarial examples for image classiﬁcation. The method is based on taking the gradient
of the training cost function J(x, y) with respect to the input image, and bounding the perturbation
by ϵ where x is the input image and y is the output label. Later, an iterative version of FGM called
I-FGM was proposed by Kurakin et al. (2016). This is also often referred to as Projected Gradient
Descent (PGD) as in Madry et al. (2018) where the I-FGM update is"
RELATED WORK AND BACKGROUND,0.08333333333333333,"xN+1
adv
= clipϵ(xN
adv + αsign(∇xJ(xN
adv, y))).
(1)"
RELATED WORK AND BACKGROUND,0.09027777777777778,"where x0
adv = x. Dong et al. (2018) further modiﬁed I-FGM by introducing a momentum term
in the update, yielding a method called MI-FGSM. Korkmaz (2020) later proposed a Nesterov-
momentum based approach for the deep reinforcement learning domain. The DeepFool method of
Moosavi-Dezfooli et al. (2016) is an alternative approach to those based on FGSM. DeepFool per-
forms iterative projection to the closest separating hyperplane between classes. Another alternative
approach proposed by Carlini & Wagner (2017a) is based on ﬁnding a minimal perturbation that
achieves a different target class label. The approach is based on minimizing the loss"
RELATED WORK AND BACKGROUND,0.09722222222222222,"min
sadv∈S c · J(sadv) +
sadv −s


(2)"
RELATED WORK AND BACKGROUND,0.10416666666666667,"where s is the clean input, sadv is the adversarial example, and J(s) is a modiﬁed version of the cost
function used to train the network. Chen et al. (2018) proposed a variant of the Carlini & Wagner
(2017a) formulation that adds an ℓ1-regularization term to produce sparser adversarial examples,"
RELATED WORK AND BACKGROUND,0.1111111111111111,"min
sadv∈S c · J(sadv) + λ
sadv −s

+ λ
sadv −s


(3)"
RELATED WORK AND BACKGROUND,0.11805555555555555,"Adversarial Deep Reinforcement Learning: The adversarial problem initially has been investi-
gated by Huang et al. (2017) and Kos & Song (2017) concurrently. In this work the authors show
that perturbations computed via FGSM result in extreme performance loss on the learnt policy. Lin
et al. (2017) and Sun et al. (2020) focused on timing strategies in the adversarial formulation and uti-
lized the Carlini & Wagner (2017a) method to produce the perturbations. While there is a reasonable
body of work focused on ﬁnding efﬁcient and effective adversarial perturbations, a substantial body
of work focused on building agents robust to these perturbations. Mandlekar et al. (2017) proposed
to utilize FGSM perturbations during training time to obtain more robust agents. Pinto et al. (2017)
modeled the adversarial interaction as a zero sum game and proposed a joint training strategy to
increase robustness in continuous action space setting. Recently, Gleave et al. (2020) considered an"
RELATED WORK AND BACKGROUND,0.125,Under review as a conference paper at ICLR 2022
RELATED WORK AND BACKGROUND,0.13194444444444445,"adversary who is allowed to take natural actions in a given environment instead of ℓp-norm bounded
perturbations and modeled the adversarial relationship as a zero sum Markov game. However, re-
cent concerns have been raised about adversarial training methods by Korkmaz (2021). In this paper
the authors show that the state-of-the-art adversarial training techniques introduce a new set of non-
robust features. Thus, with the rising concerns on robustness of recent proposed adversarial training
techniques our work aims to solve the adversarial problem from a different perspective by detecting
adversarial perturbations."
RELATED WORK AND BACKGROUND,0.1388888888888889,"Detection of Adversarial Examples: There has been a long line of work on detection of adver-
sarial examples for image classiﬁcation. Metzen et al. (2017) proposed augmenting standard neural
network image classiﬁers with a sub-network trained speciﬁcally to detect adversarial examples.
However, this method has a cost of separately training a binary classiﬁer to be able to detect the
adversarial examples. Pang et al. (2018) proposed a modiﬁed neural network training strategy that is
combined with a test-time thresholding method to distinguish adversarial from clean examples with
additional training cost. Yang et al. (2020) studied detection of adversarial examples via feature
attribution, utilizing the Leave-One-Out (LOO) attribution method proposed by Li et al. (2016). The
LOO method is based on erasing each pixel of the image and observing how the output of the neural
network changes, and so requires a number of neural network classiﬁer evaluations equal to the res-
olution of the input image. Finally, Roth et al. (2019) suggest a statistical test based on measuring
the average change in the odds ratio between classes under random perturbations. Evaluation of the
neural classiﬁer at hundreds of randomly perturbed samples are required in order for this method
to get sufﬁciently accurate estimates of the average change in order to detect adversarial examples.
In contrast to prior methods, our detection method does not require modifying the training of the
neural network, does not require any training speciﬁc to the attack method used, and uses only two
neural network function evaluations and one gradient computation."
RELATED WORK AND BACKGROUND,0.14583333333333334,"3
DETECTION OF ADVERSARIES WITH TAYLOR APPROXIMATION (DATA)"
RELATED WORK AND BACKGROUND,0.1527777777777778,"In this section we give the high-level motivation for and formal description of our detection method.
We begin by introducing necessary notation and deﬁnitions. We denote an original clean state by ¯s
and an adversarially perturbed state by sadv.
Deﬁnition 3.1. The cost of a state, J(s, τ), is deﬁned as the cross entropy loss between the policy
π(a|s) of the agent, and a target distribution on actions τ(a)."
RELATED WORK AND BACKGROUND,0.1597222222222222,"J(s, τ) = −
X"
RELATED WORK AND BACKGROUND,0.16666666666666666,"a
τ(a) log(π(a|s))
(4)"
RELATED WORK AND BACKGROUND,0.1736111111111111,"Deﬁnition 3.2. The argmax policy, π∗(a|s), is deﬁned as the distribution which puts all probability
mass on the highest weight action of π(a|s)."
RELATED WORK AND BACKGROUND,0.18055555555555555,"π∗(a|s) = 1(a = arg max
a′
π(a′|s))
(5)"
RELATED WORK AND BACKGROUND,0.1875,We use the following notation for the gradient and Hessian with respect to states s:
RELATED WORK AND BACKGROUND,0.19444444444444445,"∇sJ(s0, τ0) = ∇sJ(s, τ)|s=s0,τ=τ0
∇2
sJ(s0, τ0) = ∇2
sJ(s, τ)|s=s0,τ=τ0"
FIRST-ORDER DETECTION OF ADVERSARIES WITH TAYLOR APPROXIMATION,0.2013888888888889,"3.1
FIRST-ORDER DETECTION OF ADVERSARIES WITH TAYLOR APPROXIMATION
(FO-DATA)"
FIRST-ORDER DETECTION OF ADVERSARIES WITH TAYLOR APPROXIMATION,0.20833333333333334,"As a naive baseline we ﬁrst describe a detection method based on estimating how much the cost
function J(s, τ) varies under small perturbations. Prior work on detection of adversarial examples
Roth et al. (2019); Hu et al. (2019) has shown that the behavior of DNN classiﬁers under small,
random perturbations is different at clean versus adversarial examples. Therefore, a natural baseline
detection method is: given an input state s0 sample a small random perturbation η ∼N(0, ϵI) and
compute,
K(s0, η) = J(s0 + η, π∗(·|s0)) −J(s0, π∗(·|s0)).
(6)
The ﬁrst-order detection method proceeds by ﬁrst estimating the mean and the variance of K over
a clean run of the agent in the environment. Next a threshold t is chosen so that a desired false
positive rate (FPR) is achieved (i.e. some desired fraction of the states in the clean run lie more"
FIRST-ORDER DETECTION OF ADVERSARIES WITH TAYLOR APPROXIMATION,0.2152777777777778,Under review as a conference paper at ICLR 2022
FIRST-ORDER DETECTION OF ADVERSARIES WITH TAYLOR APPROXIMATION,0.2222222222222222,"than t standard deviations from the mean). Finally, at test time a state encountered by the agent is
classiﬁed as adversarial if it is at least t standard deviations away from the mean. Otherwise the
state is classiﬁed as clean. As a ﬁrst attempt, the ﬁrst-order method can be naturally interpreted
as a ﬁnite-difference approximation to the magnitude of the gradient at s0. If we assume that the
ﬁrst-order Taylor approximation of J is accurate in a ball of radius r > ϵ centered at s0, then"
FIRST-ORDER DETECTION OF ADVERSARIES WITH TAYLOR APPROXIMATION,0.22916666666666666,"J(s0 + η, π∗(·|s0)) ≈J(s0, π∗(·|s0)) + ∇sJ(s0, π∗(·|s0)) · η."
FIRST-ORDER DETECTION OF ADVERSARIES WITH TAYLOR APPROXIMATION,0.2361111111111111,"Therefore,
K(s0, η) ≈∇sJ(s0, π∗(·|s0)) · η.
(7)
Thus, for η ∼N(0, ϵI) the test statistic K(s0, η) is approximately distributed as a Gaussian with
mean 0 and variance ϵ2∥∇sJ(s0, π∗(·|s0))∥2. Under this interpretation one would expect the test
statistics for clean and adversarial states to have the same mean with potentially different standard
deviations, possibly making it hard to distinguish clean from adversarial. However, this is not what
we observe empirically, and in fact the ﬁrst-order method does a decent job of detecting adversarial
examples. The method works because, in fact, the mean of K(¯s, η) for clean examples ¯s is rea-
sonably well separated from the mean of K(sadv, η) for adversarial examples sadv. The empirical
performance of the ﬁrst-order method thus indicates that the assumption of accuracy for the ﬁrst-
order Taylor approximation of J does not hold in practice. This leads naturally to the consideration
of information on the second derivatives of J in order to detect adversarial examples."
SECOND-ORDER DETECTION OF ADVERSARIES WITH TAYLOR APPROXIMATION,0.24305555555555555,"3.2
SECOND-ORDER DETECTION OF ADVERSARIES WITH TAYLOR APPROXIMATION
(SO-DATA)"
SECOND-ORDER DETECTION OF ADVERSARIES WITH TAYLOR APPROXIMATION,0.25,"The second-order detection method is based on measuring the local curvature of the cost function
J(s, τ). The method exploits the fact that J(s, τ) will have larger negative curvature at a clean
example as compared to an adversarial example. In particular, the high level theoretical motiva-
tion for this approach is that adversarial examples are the output of a local optimization procedure
which attempts to ﬁnd a nearby perturbed state sadv with a low value for the cost J(sadv, τ) for some
τ ̸= π∗(·|¯s). A direction of large negative curvature for J(sadv, τ) indicates that a very small pertur-
bation along this direction could dramatically decrease the cost function. Therefore, such points are
likely to be unstable for local optimization procedures attempting to minimize the cost function in a
small neighborhood. On the other hand, the curvature of J(s, τ) at a clean state ¯s is determined by
the overall algorithm used to train the deep reinforcement learning agent. This algorithm optimizes
the parameters of the neural network policy while considering all states visited during training, and
thus is not likely to be heavily overﬁt to the state ¯s. In particular, we expect larger negative curva-
ture at ¯s than at an adversarial example sadv. We make the connection between negative curvature
and instability for local optimization formal in Section 3.3. Based on the above discussion, a natural
choice of metric for distinguishing adversarial versus clean examples is the most negative eigenvalue
of the Hessian λmin
 
∇2
sJ(s0, π∗(·|s0)

. While this is the most natural measurement of curvature, it
requires computing the eigenvalues of a matrix whose number of entries are quadratic in the input
dimension. Since the input is very high-dimensional, and we would like to perform this computa-
tion in real-time for every state visited by the agent, computing the value λmin is computationally
prohibitive. Instead we approximate this value by measuring the curvature along a direction which
is correlated with the negative eigenvectors of the Hessian. Given this direction, the value that we
measure is the accuracy of the ﬁrst order Taylor approximation of the cost of the given state J(s, τ).
We denote the ﬁrst order Taylor approximation at the state s0 in direction η by"
SECOND-ORDER DETECTION OF ADVERSARIES WITH TAYLOR APPROXIMATION,0.2569444444444444,"˜J(s0, η) = J(s0, π∗(·|s0)) + ∇sJ(s0, π∗(·|s0)) · η."
SECOND-ORDER DETECTION OF ADVERSARIES WITH TAYLOR APPROXIMATION,0.2638888888888889,The metric we will use to detect adversarial examples is the ﬁnite-difference approximation
SECOND-ORDER DETECTION OF ADVERSARIES WITH TAYLOR APPROXIMATION,0.2708333333333333,"L(s0, η) = J(s0 + η, π∗(·|s0)) −˜J(s0, η).
(8)"
SECOND-ORDER DETECTION OF ADVERSARIES WITH TAYLOR APPROXIMATION,0.2777777777777778,"To see formally that Equation (8) gives an approximation of the most negative eigenvector of the
Hessian, we will assume that the cost function J(s, τ) is well approximated by its second-order
Taylor approximation at the point s0 i.e."
SECOND-ORDER DETECTION OF ADVERSARIES WITH TAYLOR APPROXIMATION,0.2847222222222222,"J(s0 + η, π∗(·|s0)) ≈J(s0, π∗(·|s0)) + ∇sJ(s0, π∗(·|s0)) · η + η⊤∇2
sJ(s0, π∗(·|s0))η
(9)"
SECOND-ORDER DETECTION OF ADVERSARIES WITH TAYLOR APPROXIMATION,0.2916666666666667,for a small enough perturbation η. Substituting the above formula into Equation (8) yields
SECOND-ORDER DETECTION OF ADVERSARIES WITH TAYLOR APPROXIMATION,0.2986111111111111,"L(s0, η) ≈η⊤∇2
sJ(s0, π∗(·|s0))η
(10)"
SECOND-ORDER DETECTION OF ADVERSARIES WITH TAYLOR APPROXIMATION,0.3055555555555556,Under review as a conference paper at ICLR 2022
SECOND-ORDER DETECTION OF ADVERSARIES WITH TAYLOR APPROXIMATION,0.3125,Algorithm 1: SO-DATA
SECOND-ORDER DETECTION OF ADVERSARIES WITH TAYLOR APPROXIMATION,0.3194444444444444,"Input: Mean ¯L and variance σ2(L) from clean run. Detection threshold t > 0. Parameter ϵ > 0.
for states si visited by agent do"
SECOND-ORDER DETECTION OF ADVERSARIES WITH TAYLOR APPROXIMATION,0.3263888888888889,"ηi = ϵsign(∇sJ(si, π∗(·|si)))"
SECOND-ORDER DETECTION OF ADVERSARIES WITH TAYLOR APPROXIMATION,0.3333333333333333,"∥∇sJ(si, π∗(·|si))∥2
˜J(si, ηi) = J(si, π∗(·|si)) + ∇sJ(si, π∗(·|si)) · ηi
L(si, ηi) = J(si + ηi, π∗(·|si)) −˜J(si, ηi)
if |L(si, ηi) −¯L| > t · σ(L) then"
SECOND-ORDER DETECTION OF ADVERSARIES WITH TAYLOR APPROXIMATION,0.3402777777777778,"Label state si as an adversarial example
end if
end for"
SECOND-ORDER DETECTION OF ADVERSARIES WITH TAYLOR APPROXIMATION,0.3472222222222222,"The above quadratic form is minimized when η lies in the same direction as the most negative
eigenvector of the Hessian, in which case"
SECOND-ORDER DETECTION OF ADVERSARIES WITH TAYLOR APPROXIMATION,0.3541666666666667,"L(s0, η) ≈λmin
 
∇2
sJ(s0, π∗(·|s0))

∥η∥2
2
(11)"
SECOND-ORDER DETECTION OF ADVERSARIES WITH TAYLOR APPROXIMATION,0.3611111111111111,"We choose the sign of the gradient direction for measuring the accuracy of the ﬁrst order Taylor
approximation. To motivate this choice note that −∇sJ(s, τ) is locally the direction of steepest
decrease for the cost function. If the gradient direction additionally has negative curvature of large
magnitude, then small perturbations along this direction will result in even more rapid decrease in
the cost function value than predicted by the ﬁrst-order gradient approximation. Note that this can
be true even if the gradient itself has small magnitude, as long as the negative curvature is large
enough. Thus, by the discussion at the beginning of Section 3.2, adversarial examples are likely to
have relatively smaller magnitude negative curvature in the gradient direction than clean examples.
Formally, for ϵ > 0 we set"
SECOND-ORDER DETECTION OF ADVERSARIES WITH TAYLOR APPROXIMATION,0.3680555555555556,"η(s0) = ϵsign (∇sJ(s0, π∗(·|s0)))"
SECOND-ORDER DETECTION OF ADVERSARIES WITH TAYLOR APPROXIMATION,0.375,"∥∇sJ(s0, π∗(·|s0))∥2
.
(12)"
SECOND-ORDER DETECTION OF ADVERSARIES WITH TAYLOR APPROXIMATION,0.3819444444444444,"To calibrate the detection method we record the mean ¯L = Es[L(s, η(s))] and variance σ2(L) =
Vars[L(s, η(s))] of our proposed test statistic over states from a clean run of the policy in the MDP.
Then at test time we set a threshold t > 0, and for each state si visited by the agent test if"
SECOND-ORDER DETECTION OF ADVERSARIES WITH TAYLOR APPROXIMATION,0.3888888888888889,"|L(si, η(si)) −¯L| > tσ(L).
(13)"
SECOND-ORDER DETECTION OF ADVERSARIES WITH TAYLOR APPROXIMATION,0.3958333333333333,"If the threshold of t standard deviations is exceeded we classify the state si as adversarial, and
otherwise classify it as clean. Pseudo-code for the second order method is given in Algorithm 1."
NEGATIVE CURVATURE AND INSTABILITY OF LOCAL OPTIMIZATION,0.4027777777777778,"3.3
NEGATIVE CURVATURE AND INSTABILITY OF LOCAL OPTIMIZATION"
NEGATIVE CURVATURE AND INSTABILITY OF LOCAL OPTIMIZATION,0.4097222222222222,"In this section we formalize the connection between negative curvature and instability for local
optimization procedures that motivated our deﬁnition of L(s, η). Given a state s0 and a target dis-
tribution τ ̸= π∗(·|s0), we assume the adversary is trying to ﬁnd a state sadv minimizing J(sadv, τ)
among all states close to s0 by some metric. Formally, let Ds0(s) ≥0 be a convex function of s that
should be thought of as measuring distance to s0. One standard choice for the distance function is
Ds0(s) = ∥s −s0∥p
p. We model the adversary as minimizing the loss"
NEGATIVE CURVATURE AND INSTABILITY OF LOCAL OPTIMIZATION,0.4166666666666667,"f(s) = J(s, τ) + Ds0(s).
(14)"
NEGATIVE CURVATURE AND INSTABILITY OF LOCAL OPTIMIZATION,0.4236111111111111,"In particular, we make the following assumption:
Assumption 3.1. The adversarial state sadv is a local minimum of f(s)."
NEGATIVE CURVATURE AND INSTABILITY OF LOCAL OPTIMIZATION,0.4305555555555556,"Of course this assumption is violated in practice since different adversarial attack methods optimize
objective functions other than f, and do not necessarily always converge to a local minimum. Nev-
ertheless the assumption allows us to make formal qualitative predictions about the behavior of the
second-order detection method that correspond well with empirical results across a broad variety of
adversarial attacks. We now state our main result lower bounding the curvature of J(sadv, τ).
Proposition 3.1. For c > 0 assume that the maximum eigenvalue of the Hessian ∇2
sDs0(s) is
bounded by c. If s∗is a local minimum of f(s) then λmin(∇2
sJ(s∗, τ)) ≥−c"
NEGATIVE CURVATURE AND INSTABILITY OF LOCAL OPTIMIZATION,0.4375,Under review as a conference paper at ICLR 2022
NEGATIVE CURVATURE AND INSTABILITY OF LOCAL OPTIMIZATION,0.4444444444444444,"Figure 1: L(s) for our proposed method SO-DATA vs visited states with corresponding TPR values
for the following attack methods: FGSM, MI-FGSM, Nesterov, DeepFool, Carlini&Wagner, Elastic
Net Method. TPR values shown in the upper right box of the ﬁgure when FPR is equal to 0.01."
NEGATIVE CURVATURE AND INSTABILITY OF LOCAL OPTIMIZATION,0.4513888888888889,"Proof. Let v be the eigenvector of ∇2
sJ(s∗, τ) corresponding to the minimum eigenvalue. At a local
minimum s∗of f(s) the Hessian ∇2
sf(s∗) must be positive semi-deﬁnite. Therefore,"
NEGATIVE CURVATURE AND INSTABILITY OF LOCAL OPTIMIZATION,0.4583333333333333,"0 ≤v⊤∇2
sf(s∗)v = v⊤∇2
sJ(s∗, τ)v + v⊤∇2
sDs0(s∗)v"
NEGATIVE CURVATURE AND INSTABILITY OF LOCAL OPTIMIZATION,0.4652777777777778,"≤λmin(∇2
sJ(s∗, τ)) + c"
NEGATIVE CURVATURE AND INSTABILITY OF LOCAL OPTIMIZATION,0.4722222222222222,Rearranging the above inequality completes the proof.
