Section,Section Appearance Order,Paragraph
REFERENCES,0.9930555555555556,"Puyudi Yang, Jianbo Chen, Cho-Jui Hsieh, Jane-Ling Wang, and Michael I. Jordan. ML-LOO:
detecting adversarial examples with feature attribution. In The Thirty-Fourth AAAI Conference
on Artiﬁcial Intelligence, AAAI 2020, The Thirty-Second Innovative Applications of Artiﬁcial
Intelligence Conference, IAAI 2020, The Tenth AAAI Symposium on Educational Advances in
Artiﬁcial Intelligence, EAAI 2020, New York, NY, USA, February 7-12, 2020, pp. 6639–6647.
AAAI Press, 2020."
