Section,Section Appearance Order,Paragraph
ABSTRACT,0.0,ABSTRACT
ABSTRACT,0.0024509803921568627,"3D snapshot microscopy enables fast volumetric imaging by capturing a 3D volume
in a single 2D camera image and performing computational reconstruction. Fast
volumetric imaging has a variety of biological applications such as whole brain
imaging of rapid neural activity in larval zebraﬁsh. The optimal microscope design
for this optical 3D-to-2D encoding is both sample- and task-dependent, with no
general solution known. Deep learning based decoders can be combined with a
differentiable simulation of an optical encoder for end-to-end optimization of both
the deep learning decoder and optical encoder. This technique has been used to
engineer local optical encoders for other problems such as depth estimation, 3D
particle localization, and lensless photography. However, 3D snapshot microscopy
is known to require a highly non-local optical encoder which existing UNet-based
decoders are not able to engineer. We show that a neural network architecture
based on global kernel Fourier convolutional neural networks can efﬁciently decode
information from multiple depths in a volume, globally encoded across a 3D
snapshot image. We show in simulation that our proposed networks succeed
in engineering and reconstructing optical encoders for 3D snapshot microscopy
where the existing state-of-the-art UNet architecture fails. We also show that our
networks outperform the state-of-the-art learned reconstruction algorithms for a
computational photography dataset collected on a prototype lensless camera which
also uses a highly non-local optical encoding."
INTRODUCTION,0.004901960784313725,"1
INTRODUCTION"
INTRODUCTION,0.007352941176470588,"Volumetric imaging has been a valuable technique for measuring neural activity at single neuron
resolution across the brain [2, 22, 36]. We are particularly motivated by the problem of imaging neu-
ronal activity across the whole brain of transparent model organisms such as larval zebraﬁsh (Danio
rerio) at higher volume rates, to enable richer studies of neural dynamics and signal propagation.
Existing approaches to whole-brain imaging involve sequential acquisition of stacks of 2D images
[2], typically resulting in 0.5Hz - 2Hz volume capture rates, limited by the number of 2D depth plane
acquisitions. However, since neural activity occurs at orders of magnitude faster timescales, faster
volume imaging rates can provide understanding of neural computations with signiﬁcantly more
detail."
INTRODUCTION,0.00980392156862745,"3D snapshot microscopy techniques can signiﬁcantly speed up the imaging of a 3D sample volume
using non-local optical encodings to combine information corresponding to different depth planes in
the volume into a single 2D image, allowing for fast volume acquisition at the frame rate of the camera
sensor followed by computational decoding to reconstruct the 3D volume [5, 3, 4, 7, 13, 16, 18, 17,
20, 27, 26, 30, 38, 37, 33]. The optimal optical design for a 3D snapshot microscope is unknown in
general [5], and likely depends on the speciﬁc sample structure. Newly developed programmable
microscopes with up to 106 free parameters, e.g. pixels on a spatial light modulator (SLM), enable
the implementation of a rich space of microscope encodings, and present the possibility of direct
optimization of snapshot microscope parameters speciﬁcally for particular classes of samples and
imaging tasks."
INTRODUCTION,0.012254901960784314,"Deep learning-based decoders combined with differentiable simulations of optical encoders have
enabled end-to-end optimization of both the deep learning decoder and the optical encoder. This end-
to-end optical engineering approach has recently been applied to depth from defocus [6, 10, 14, 35],
lensless photography [13], or particle localization microscopy [23]. However, all such applications"
INTRODUCTION,0.014705882352941176,Under review as a conference paper at ICLR 2022
INTRODUCTION,0.01715686274509804,"either use far fewer optical parameters or operate on relatively compact or local encodings due to
small ﬁlters in their deep networks [6, 23, 35, 10, 14, 34, 13]. There are two barriers to optimizing
more parameters and producing global versus local encodings: (1) the typical convolutional networks
with small ﬁlters used by previous methods for computational reconstruction have a prior to decode
locally, and therefore limit optical designs to local encodings, unlike the global PSFs used in snapshot
microscopy and (2) the optimization of optical parameters involves backpropagation through both
the deep learning reconstruction and a differentiable optical simulation, which is more expensive
computationally for non-local optical encodings. We focus on two computational optics problems
that demonstrate a superior deep network architecture that can successfully reconstruct from images
encoded by non-local optical encoders and with orders of magnitude more optical parameters than
previously attempted. To address the computational burden of simulating and optimizing non-local
encoders, we also developed a parallel, multi-GPU optical simulation framework."
INTRODUCTION,0.0196078431372549,"Problem statement We deﬁne an optical encoder as Mφ parameterized by φ and a computational
decoder as Rθ parameterized by θ. We wish to develop a reconstruction network architecture for
decoding non-local encodings in 2D images c produced by Mφ and also to enable the end-to-end
optimization of φ to produce non-local encodings. We’ll consider two concrete applications: (1)
3D snapshot microscopy using an SLM-based programmable microscope (Figure 1A), where we
wish to optimize both the reconstruction network Rθ and the optical encoding Mφ based on the
SLM parameters in order to image 3D samples v and reconstruct 3D volumes ˆv, and (2) lensless
photography (Figure 4), where we wish to optimize only the reconstruction network Rθ to produce
images of natural scenes imaged by a lensless camera M implementing a ﬁxed optical encoding."
OUR CONTRIBUTIONS,0.022058823529411766,"1.1
OUR CONTRIBUTIONS"
OUR CONTRIBUTIONS,0.024509803921568627,"1. We developed a large-scale, parallel, multi-GPU differentiable wave optics simulation of a
programmable microscope, based on a 4f optical model with a phase mask (φ) implemented
using a spatial light modulator (SLM), described further in Appendix A.1. SLMs φ can
have over 106 optimizable parameters.
2. We collected a large dataset of high resolution 3D confocal volumes of zebraﬁsh larvae
for the purpose of end-to-end sample-speciﬁc optimization of the parameters of the pro-
grammable 3D snapshot microscope.
3. We introduce an efﬁcient new reconstruction network architecture for decoding from non-
local optical encoders using very large global convolutions implemented via Fourier convo-
lutions.
4. We show that our networks outperform the state-of-the-art deep networks for both volume
reconstruction and microscope parameter optimization, and for image reconstruction from
lensless photography [20].
5. Our method enables, for the ﬁrst time, direct end-to-end optimization of highly non-local
optical encoders in the space of SLM pixels with over 106 parameters. In simulation, we
demonstrate the potential for signiﬁcant improvements in imaging resulting from sample-
speciﬁc engineering of optical encoders."
PRIOR WORK,0.02696078431372549,"1.2
PRIOR WORK"
PRIOR WORK,0.029411764705882353,"Neural network architectures for computational imaging have all used convolution layers with small
ﬁlters. End-to-end optimization of optical encoders have largely been performed with UNet-based
architectures [6, 10, 14, 35, 13], with one method using ResNet-based architectures [23]. Such
optimization has always led to local optical encodings. End-to-end optimization has never been
attempted for large-ﬁeld of view 3D snapshot microscopy due to the difﬁculty of simulating and
reconstructing from non-local encoders. However, small ﬁlter convolutional deep networks have been
used in a non-end-to-end manner to reconstruct volumes from 3D snapshot microscopes designed
using microlens arrays [33, 34]. For photography and MRI, using deep learning combined with
unrolling iterations of traditional deconvolution algorithms provides the beneﬁts of fast amortized
inference and higher quality reconstructions due to learning of structural priors [8, 9, 20, 34]."
PRIOR WORK,0.031862745098039214,"In our work, we demonstrate that convolution layers with large ﬁlters implemented efﬁciently in the
Fourier domain enable the end-to-end learning of highly non-local optical encoders for 3D snapshot
microscopy. Large convolution ﬁlters have been shown to be helpful for other computer vision"
PRIOR WORK,0.03431372549019608,Under review as a conference paper at ICLR 2022
PRIOR WORK,0.03676470588235294,"applications such as semantic segmentation and salient object detection [25, 21], and the Fourier
domain parameterization of small ﬁlters has been described previously [28]."
PRIOR WORK,0.0392156862745098,"A pioneering strategy in 3D snapshot microscopy has been light ﬁeld microscopy [16], which employs
a microlens array at the microscope’s image plane to create subimages encoding both amplitude and
phase of light [16, 1]. A variety of microlens-array-based light ﬁeld microscopes have been used
to perform whole-brain imaging [16, 27, 37, 36, 30, 26, 7, 12, 38]. [38] optimizes the placement
of microlenses, but not in an end-to-end manner. Despite variation in design, microlens-based
microscopes have, to various degrees, three main limitations that can be improved: 1) blocking or
scattering of light between microlenses, causing light inefﬁciency, 2) not making use of all pixels on
the camera to encode a 3D sample, leading to inefﬁcient compression and suboptimal reconstructions
ˆv, and 3) a ﬁxed optical encoding scheme."
PRIOR WORK,0.041666666666666664,"An alternative to using microlenses is to implement a coded detection strategy using a phase mask or
diffuser to spread light broadly across the camera sensor [3, 4, 5, 13, 17, 18, 38]. The designed phase
masks can be implemented either by manufacturing a custom optical element or using a programmable
SLM [10, 14, 35, 13, 38, 23]. Using a programmable element allows different microscope parameters
to be used for different samples."
METHODS,0.04411764705882353,"2
METHODS"
D SNAPSHOT MICROSCOPY,0.04656862745098039,3D snapshot microscopy
D SNAPSHOT MICROSCOPY,0.049019607843137254,FourierNet
D SNAPSHOT MICROSCOPY,0.051470588235294115,FourierUNet
D RECONSTRUCTION,0.05392156862745098,"3D reconstruction
3D sample"
D IMAGE,0.056372549019607844,2D image
D IMAGE,0.058823529411764705,"upsample 2×
and concatenate conv"
D IMAGE,0.061274509803921566,crop ½×
D IMAGE,0.06372549019607843,"reconstruction network
(computational decoder)
programmable microscope
(optical encoder)"
D IMAGE,0.0661764705882353,phase mask convs convs convs
D IMAGE,0.06862745098039216,"conv
convs"
D IMAGE,0.07107843137254902,Fourier convolution
D IMAGE,0.07352941176470588,multiscale Fourier convolution
D IMAGE,0.07598039215686274,"upsample 2×
and concatenate
crop ½×"
D IMAGE,0.0784313725490196,"Figure 1: Overview of our problem setup and our proposed network architectures. Top row (A)
shows the problem of 3D snapshot microscopy, where we computationally reconstruct a 3D sample
from a 2D image. Middle row (B) shows our proposed FourierNet architecture, which includes a
Fourier convolution layer that enables efﬁcient computation of global features. Bottom row (C)
shows an extension of our proposed architecture, the FourierUNet, which mimics the multiscale
feature extraction of a standard UNet efﬁciently and with global features using a multiscale Fourier
convolution."
D IMAGE,0.08088235294117647,"We show our network architecture and an overview of autoencoder training both the microscope
parameters φ and reconstruction network parameters θ in Figure 1A. The programmable microscope
is simulated by a differentiable implementation of a wave-optics model of light propagation. We
have selected a programmable microscope design based on pupil-plane phase modulation with a
programmable spatial light modulator, for which imaging is well-approximated by a computationally-
efﬁcient convolution [11]. A detailed description of our simulation is provided in Appendix A.1. For
lensless photography, there is no optical simulation because the images have been collected on a real
camera."
D IMAGE,0.08333333333333333,Under review as a conference paper at ICLR 2022
"FOURIERNET AND FOURIERUNET ARCHITECTURES FOR RECONSTRUCTION FROM
OPTICAL ENCODERS",0.0857843137254902,"2.1
FOURIERNET AND FOURIERUNET ARCHITECTURES FOR RECONSTRUCTION FROM
OPTICAL ENCODERS"
"FOURIERNET AND FOURIERUNET ARCHITECTURES FOR RECONSTRUCTION FROM
OPTICAL ENCODERS",0.08823529411764706,"Because images created by optical encoders can potentially encode signals from the incoming light
ﬁeld to any location in the camera image in a non-local manner, it is essential that a reconstruction
network have global context. Existing multi-scale architectures such as the UNet [29] can achieve
global context, but at the expense of many computation layers with small convolution kernels which
we believe have a local information bias which is inappropriate for computational optics. In this paper,
we introduce relatively shallow architectures for computational imaging, which rely on convolution
layers with very large ﬁlters, implemented efﬁciently in the Fourier domain [28]."
"FOURIERNET AND FOURIERUNET ARCHITECTURES FOR RECONSTRUCTION FROM
OPTICAL ENCODERS",0.09068627450980392,"FourierNet We propose a simple three layer convolutional network architecture with very large
global convolutions at the very ﬁrst layer, followed by two standard local convolutional layers (Figure
1B). We deﬁne a global convolution as a convolution with kernel size equal to the input image. Such
a convolution achieves global context in a single step but is computationally expensive. Global
convolutions are implemented more efﬁciently in the Fourier domain, yielding a speed up of two
orders of magnitude. Due to the use of Fourier convolutions to enable global context, we call our
architecture FourierNet. In contrast to a typical UNet which can contain many tens of convolution
layers, the FourierNet is only three layers deep, which requires backpropagation through fewer layers
compared to a typical UNet with the same receptive ﬁeld."
"FOURIERNET AND FOURIERUNET ARCHITECTURES FOR RECONSTRUCTION FROM
OPTICAL ENCODERS",0.09313725490196079,"FourierUNet We also propose a multi-scale variant of the FourierNet by bringing together elements
of the multi-scale UNet and the single-scale FourierNet. Here, we take advantage of the fact that
down-sampling in image space corresponds to a simple cropping operation in the Fourier domain,
resulting in a band-limited computation of a feature map. We efﬁciently implement multi-scale global
Fourier convolutions (Figure 1C) to replace the encoding/“analysis” pathway of a UNet. We then
use the standard decoding/“synthesis” pathway of the UNet to combine the multi-scale features into
a single 3D volume reconstruction (Appendix A.3, A.4). Thus we can study whether multi-scale
features or global context is more important for decoding non-local optical encoders."
"FOURIERNET AND FOURIERUNET ARCHITECTURES FOR RECONSTRUCTION FROM
OPTICAL ENCODERS",0.09558823529411764,"Fourier domain convolutions It is well-known that large kernel convolutions can be implemented
more efﬁciently in the Fourier domain [24, 19, 32]. A naive implementation of global convolution
requires O(N 2) operations, where N is number of pixels in both the image and the kernel. An
alternative global convolution implementation is to Fourier transform the input x and convolution
kernel w, perform element-wise multiplication in Fourier space, and ﬁnally inverse Fourier transform,
requiring only O(N log N) operations [19, 32]. Following [28], we store and optimize the weights in
Fourier space W. This over-parameterization costs 8× the memory of an equivalent real valued large
ﬁlter but saves the computational cost of Fourier transforming the real-valued weights (Appendix
A.3). Thus a Fourier convolution is deﬁned:
Re{F−1 {W ⊙F {x}}}
(1)
For image and kernel sizes of 256 × 256 pixels, our implementation leads to nearly 500× speedup:
standard PyTorch convolution takes 2860ms, while Fourier convolution takes 5.92ms on a TITAN X."
"FOURIERNET AND FOURIERUNET ARCHITECTURES FOR RECONSTRUCTION FROM
OPTICAL ENCODERS",0.09803921568627451,"Multi-scale Fourier domain convolutions It is well-known [24] that downsampling corresponds
to cropping in the Fourier domain. Thus the Fourier convolution can be extended to efﬁciently
produce multi-scale feature representations in one step (Figure 1C). We deﬁne our multi-scale Fourier
convolution as 
Re{F−1 {W1 ⊙crop1 [c]}}, . . . , Re{F−1 {Wn ⊙cropn [c]}}
	
(2)
where subscript denotes scale level (higher subscript indicates lower spatial scale/more cropping in
Fourier space) and we precompute c := F {c} once."
"PHYSICS-BASED AUTOENCODER FOR SIMULTANEOUS ENGINEERING OF MICROSCOPE
ENCODER AND RECONSTRUCTION NETWORK DECODER",0.10049019607843138,"2.2
PHYSICS-BASED AUTOENCODER FOR SIMULTANEOUS ENGINEERING OF MICROSCOPE
ENCODER AND RECONSTRUCTION NETWORK DECODER"
"PHYSICS-BASED AUTOENCODER FOR SIMULTANEOUS ENGINEERING OF MICROSCOPE
ENCODER AND RECONSTRUCTION NETWORK DECODER",0.10294117647058823,"We describe the imaging process as the following transformation from the 3D light intensity volume
of the sample v to the 2D image formed on the camera c:
µc = Mφ(v)
(3)
c = max ([µc + √µcϵ] , 0), ϵ ∼N(0, 1)
(4)
where Mφ denotes the microscope parameterized by a 2D phase mask, φ. This phase mask φ
describes the 3D-to-2D encoding of this microscope model completely. A Poisson distribution"
"PHYSICS-BASED AUTOENCODER FOR SIMULTANEOUS ENGINEERING OF MICROSCOPE
ENCODER AND RECONSTRUCTION NETWORK DECODER",0.1053921568627451,Under review as a conference paper at ICLR 2022
"PHYSICS-BASED AUTOENCODER FOR SIMULTANEOUS ENGINEERING OF MICROSCOPE
ENCODER AND RECONSTRUCTION NETWORK DECODER",0.10784313725490197,"with mean rate µc describes the physics of photon detection at the camera, but sampling from this
distribution is not differentiable. We approximate the noise distribution with a rectiﬁed Gaussian.
We include details on Mφ in Appendix A.1 [11]. Jointly training reconstruction networks and
microscope parameters involves image simulation, reconstruction, then gradient backpropagation to
update the reconstruction network and microscope parameters. Details on parallelization, planewise
reconstruction networks, and planewise sparse gradients are provided in Appendix A.2."
"PHYSICS-BASED AUTOENCODER FOR SIMULTANEOUS ENGINEERING OF MICROSCOPE
ENCODER AND RECONSTRUCTION NETWORK DECODER",0.11029411764705882,"Our loss function computes the normalized mean squared error (MSE) LHNMSE between the high
pass ﬁltered sample and reconstruction weighted by the normalized MSE LNMSE between the original
sample and reconstruction (to include low frequency content in the objective). Formally, our loss
function L(v, ˆv) is deﬁned:"
"PHYSICS-BASED AUTOENCODER FOR SIMULTANEOUS ENGINEERING OF MICROSCOPE
ENCODER AND RECONSTRUCTION NETWORK DECODER",0.11274509803921569,"L(v, ˆv) = LHNMSE(v, ˆv) + βLNMSE(v, ˆv)
(5)"
"PHYSICS-BASED AUTOENCODER FOR SIMULTANEOUS ENGINEERING OF MICROSCOPE
ENCODER AND RECONSTRUCTION NETWORK DECODER",0.11519607843137254,"LHNMSE(v, ˆv) = E

(H(v) −H(ˆv))2"
"PHYSICS-BASED AUTOENCODER FOR SIMULTANEOUS ENGINEERING OF MICROSCOPE
ENCODER AND RECONSTRUCTION NETWORK DECODER",0.11764705882352941,"E(H(v)2)
, LNMSE(v, ˆv) = E

(v −ˆv)2"
"PHYSICS-BASED AUTOENCODER FOR SIMULTANEOUS ENGINEERING OF MICROSCOPE
ENCODER AND RECONSTRUCTION NETWORK DECODER",0.12009803921568628,"E(v2)
(6)"
"PHYSICS-BASED AUTOENCODER FOR SIMULTANEOUS ENGINEERING OF MICROSCOPE
ENCODER AND RECONSTRUCTION NETWORK DECODER",0.12254901960784313,"where H(·) denotes high pass ﬁltering and E(·) denotes computing the mean. Both loss terms are
normalized as shown to reduce variance in L, which can otherwise take on large magnitude values
and cause training instability. For our experiments, we set the weight β for the LNMSE term to 0.1."
RESULTS,0.125,"3
RESULTS"
RESULTS,0.12745098039215685,"Larval Zebraﬁsh Dataset High resolution volumes of transgenic larval zebraﬁsh whole brains
expressing nuclear-restricted GCaMP6 calcium indicator in all neurons were imaged using a confocal
microscope. These images are representative of brain-wide activity imaging. We train on 58 different
zebraﬁsh volumes (which we augment heavily) and test on 10 held-out volumes. For all experiments,
we downsample the high resolution confocal data to (1.0 µm z, 1.625 µm y, 1.625 µm x). We created
4 datasets from these data called Type A, B, C, and D corresponding to imaging different ﬁelds of
view. Full speciﬁcations for these datasets are in Table 4 (Appendix A.2). For Figure 2, we restrict
the ﬁeld of view to (200 µm z, 416 µm y, 416 µm x) with a tall cylinder cutout of diameter 193 µm
and height 200 µm and image with 256 × 256 pixels on the simulated camera sensor. We call this
setting Type D. Figure 3 and Table 2 show our larger experiments with 512 × 512 simulated camera
pixels, with a ﬁeld of view of (250 µm z, 832 µm y, 832 µm x) and sample types Type A, Type B,
and Type C."
RESULTS,0.12990196078431374,"DiffuserCam Lensless Mirﬂickr Dataset We also test reconstruction performance on experimental
computational photography data1 from [20] (Figure 4). This is a dataset constructed by displaying
RGB color natural images from the MIRFlickr dataset on a monitor and then capturing diffused
images by the DiffuserCam lensless camera. The dataset contains 24,000 pairs of DiffuserCam and
ground truth images. The goal of the dataset is to learn to reconstruct the ground truth images from
the diffused images. As in [20], we train on 23,000 paired diffused and ground truth images, and test
on 999 held-out pairs of images."
FOURIERNETS OUTPERFORM UNETS FOR ENGINEERING NON-LOCAL OPTICAL ENCODERS,0.1323529411764706,"3.1
FOURIERNETS OUTPERFORM UNETS FOR ENGINEERING NON-LOCAL OPTICAL ENCODERS"
FOURIERNETS OUTPERFORM UNETS FOR ENGINEERING NON-LOCAL OPTICAL ENCODERS,0.13480392156862744,"Table 1: Quality of reconstructed volumes after optimizing microscope parameters to image sample
Type D on 256 × 256 pixel camera (mean ± s.e.m., n = 10)"
FOURIERNETS OUTPERFORM UNETS FOR ENGINEERING NON-LOCAL OPTICAL ENCODERS,0.13725490196078433,"Microscope
Reconstruction
LHNMSE ↓
MS-SSIM ↑
PSNR ↑
Time ↓(s)"
FOURIERNETS OUTPERFORM UNETS FOR ENGINEERING NON-LOCAL OPTICAL ENCODERS,0.13970588235294118,"FourierNet2D
FourierNet3D
0.6409 ± 0.0213
0.955 ± 0.004
34.78 ± 0.88
0.71
FourierNet2D
FourierUNet3D
0.6325 ± 0.0222
0.956 ± 0.003
34.74 ± 0.83
1.37
FourierNet2D
UNet3D
0.7659 ± 0.0130
0.922 ± 0.008
30.06 ± 0.93
3.68
UNet2D
UNet3D
0.7120 ± 0.0160
0.913 ± 0.009
29.17 ± 1.13
3.68"
FOURIERNETS OUTPERFORM UNETS FOR ENGINEERING NON-LOCAL OPTICAL ENCODERS,0.14215686274509803,"We compare optimizing microscope parameters φ with two neural networks: 1) using our FourierNet
with 2D convolutions (FourierNet2D) and 2) using a vanilla UNet with 2D convolutions (UNet2D)."
FOURIERNETS OUTPERFORM UNETS FOR ENGINEERING NON-LOCAL OPTICAL ENCODERS,0.14460784313725492,1Publicly available: https://waller-lab.github.io/LenslessLearning/dataset.html
FOURIERNETS OUTPERFORM UNETS FOR ENGINEERING NON-LOCAL OPTICAL ENCODERS,0.14705882352941177,"Under review as a conference paper at ICLR 2022 x
y z
x x
y 50 μm"
FOURIERNETS OUTPERFORM UNETS FOR ENGINEERING NON-LOCAL OPTICAL ENCODERS,0.14950980392156862,100 μm
FOURIERNETS OUTPERFORM UNETS FOR ENGINEERING NON-LOCAL OPTICAL ENCODERS,0.15196078431372548,FourierNet
FOURIERNETS OUTPERFORM UNETS FOR ENGINEERING NON-LOCAL OPTICAL ENCODERS,0.15441176470588236,ground truth UNet z y x
FOURIERNETS OUTPERFORM UNETS FOR ENGINEERING NON-LOCAL OPTICAL ENCODERS,0.1568627450980392,xy max projection
FOURIERNETS OUTPERFORM UNETS FOR ENGINEERING NON-LOCAL OPTICAL ENCODERS,0.15931372549019607,xz max projection
FOURIERNETS OUTPERFORM UNETS FOR ENGINEERING NON-LOCAL OPTICAL ENCODERS,0.16176470588235295,xy max projection
S,0.1642156862745098,3.00 s
S,0.16666666666666666,"0.01 s
0.01 s"
S,0.16911764705882354,light propagation
S,0.1715686274509804,"simulated camera image
reconstructed volume"
S,0.17401960784313725,"Figure 2: Comparing simulated camera images and reconstructions of a Type D volume captured
using our FourierNet (middle) versus UNet (right) microscopes. Top row shows simulated 256 × 256
pixel camera images; bottom right of camera image shows approximate acquisition time (given a
reasonable number of simulated photons per pixel, i.e. SNR).Ground truth has no corresponding
camera image, because the 3D volume is imaged directly via confocal microscopy (acquisition time
in xy view). Colored arrows in left column show projection axis for each row. White arrows show
individual neurons clearly visible for FourierNet, but not for UNet."
