Section,Section Appearance Order,Paragraph
ABSTRACT,0.0,ABSTRACT
ABSTRACT,0.002777777777777778,"Continual learning agents should incrementally learn a sequence of tasks while
satisfying two main desiderata: accumulating on previous knowledge without for-
getting and transferring previous relevant knowledge to help in future learning.
Existing research largely focuses on alleviating the catastrophic forgetting prob-
lem. There, an agent is altered to prevent forgetting based solely on previous tasks.
This hinders the balance between preventing forgetting and maximizing the for-
ward transfer. In response to this, we investigate the stability-plasticity dilemma
to determine which model components are eligible to be reused, added, ﬁxed, or
updated to achieve this balance. We address the class incremental learning sce-
nario where the agent is prone to ambiguities between old and new classes. With
our proposed Knowledge-Aware contiNual learner (KAN) 1, we demonstrate that
considering the semantic similarity between old and new classes helps in achiev-
ing this balance. We show that being aware of existing knowledge helps in: (1)
increasing the forward transfer from similar knowledge, (2) reducing the required
capacity by leveraging existing knowledge, (3) protecting dissimilar knowledge,
and (4) increasing robustness to the class order in the sequence. We evaluated se-
quences of similar tasks, dissimilar tasks, and a mix of both constructed from the
two commonly used benchmarks for class-incremental learning; CIFAR-10 and
CIFAR-100."
INTRODUCTION,0.005555555555555556,"1
INTRODUCTION"
INTRODUCTION,0.008333333333333333,"Continual learning (CL) aims to build intelligent agents based on deep neural networks that can
learn a sequence of tasks, use previous knowledge in future learning, and accumulate on it without
forgetting. The main challenge in this paradigm is the stability-plasticity dilemma (Mermillod et al.,
2013). Optimizing all model weights on a new task, highest plasticity, causes catastrophic forgetting
of previous tasks (McCloskey & Cohen, 1989). While ﬁxing all weights, highest stability, hinders
learning new tasks. Finding the right balance between stability and plasticity is challenging. This
sharpens the community’s focus on the forgetting problem. The excessive focus on one aspect im-
pedes building agents that balance between mitigating forgetting and exploiting relevant knowledge
in future learning while considering the capacity constraints (D´ıaz-Rodr´ıguez et al., 2018)."
INTRODUCTION,0.011111111111111112,"Task-speciﬁc components methods (Section 2) address the stability-plasticity dilemma by allocating
different connections for each task. The newly added connections for a new task are ﬂexible to learn
while the connections of previously learned tasks are ﬁxed. Despite that these methods are quite
successful in mitigating forgetting, some limitations remain to be tackled to achieve the balance
between the above-mentioned CL desiderata. First, new components (connections/neurons) are
allocated in each layer for every new task. However, the new components might capture knowledge
that already exists in the learned components of previous similar tasks. In this case, adding new
components would be redundant and resource inefﬁcient. Second, the topology of the new task
is allocated using the unimportant components of previous tasks. The design choice of the new
topology is made to protect previous knowledge but does not take into consideration the usefulness
of this topology for the current task. This limits the forward transfer of useful knowledge for the
new task and its speed of learning. Further discussions of these limitations are in Appendix A."
THE CODE WILL BE MADE PUBLICLY AVAILABLE AFTER THE PUBLICATION OF THIS PAPER AND NOW CAN BE FOUND IN THE,0.013888888888888888,"1The code will be made publicly available after the publication of this paper and now can be found in the
supplementary material in the system."
THE CODE WILL BE MADE PUBLICLY AVAILABLE AFTER THE PUBLICATION OF THIS PAPER AND NOW CAN BE FOUND IN THE,0.016666666666666666,Under review as a conference paper at ICLR 2022
THE CODE WILL BE MADE PUBLICLY AVAILABLE AFTER THE PUBLICATION OF THIS PAPER AND NOW CAN BE FOUND IN THE,0.019444444444444445,"In response to these limitations, we study the core of the stability-plasticity dilemma in the CL
paradigm. In particular, we address the following question: Which components are eligible to be
reused, added, updated, or ﬁxed when a CL agent faces a new task to achieve the balance be-
tween the CL desiderata? With our proposed Knowledge-Aware contiuNal learner (KAN), we ﬁnd
that considering the semantic similarity between old and new classes is crucial in addressing this
question. With the awareness of existing knowledge, the CL agent could identify similar previous
knowledge that could be reusable in learning a new task (forward transfer) and add the necessary
components only to capture the speciﬁc knowledge that cannot be explained with the existing knowl-
edge (resource efﬁciency). Moreover, the agent could protect the dissimilar previous knowledge and
limit its transfer to the new task (mitigating forgetting)."
THE CODE WILL BE MADE PUBLICLY AVAILABLE AFTER THE PUBLICATION OF THIS PAPER AND NOW CAN BE FOUND IN THE,0.022222222222222223,"To the best of our knowledge, the recent work, CAT (Ke et al., 2020), is the only one that attempted
to consider the task similarities to balance between forward transfer and mitigating forgetting. CAT
was proposed for the task-Incremental Learning (task-IL) scenario, where each task is a separate
classiﬁcation problem. In this work, we aim to tackle the more challenging class-Incremental Learn-
ing (class-IL) scenario where a uniﬁed classiﬁer is used for all seen classes. The inaccessibility of
the task identity at inference in the latter scenario arises the following challenges: (1) ambiguities
between old and new tasks which affect the balance between maintaining forgetting and forward
transfer. (2) Inability to select the corresponding components to a task at inference; all the existing
components in the model are involved in making predictions. To fully analyze the stability-plasticity
dilemma in class-IL, given the aforementioned challenges, we focus on the rehearsal-free strategy
(Section 2) in which there is no reliance on past data to address forgetting and a ﬁxed-capacity
model is used. We also report the performance of the model in Task-IL to further demonstrate the
challenges in class-IL. Our contributions are:"
THE CODE WILL BE MADE PUBLICLY AVAILABLE AFTER THE PUBLICATION OF THIS PAPER AND NOW CAN BE FOUND IN THE,0.025,"• We demonstrate that considering the semantic relation between old and new classes is cru-
cial in addressing the stability-plasticity dilemma and the balance between CL desiderata."
THE CODE WILL BE MADE PUBLICLY AVAILABLE AFTER THE PUBLICATION OF THIS PAPER AND NOW CAN BE FOUND IN THE,0.027777777777777776,"• We show that considering both previous and current tasks in allocating the initial topology
of a new task allows for: selective transfer for the relevant (similar) knowledge, protecting
the irrelevant (dissimilar) knowledge, and identifying the reusable previous components to
avoid allocating unnecessary resources."
THE CODE WILL BE MADE PUBLICLY AVAILABLE AFTER THE PUBLICATION OF THIS PAPER AND NOW CAN BE FOUND IN THE,0.030555555555555555,"• We demonstrate that the standard softmax-classiﬁcation layer is a source of constituting the
ambiguities between old and new tasks in class-IL. We study different setups for the output
layer which signiﬁcantly improve the performance of rehearsal-free methods. Our analyses
reveal the limitations of the softmax in class-IL and shed light on the necessity of paying
more attention to these limitations to narrow the gap between class-IL and task-IL."
THE CODE WILL BE MADE PUBLICLY AVAILABLE AFTER THE PUBLICATION OF THIS PAPER AND NOW CAN BE FOUND IN THE,0.03333333333333333,"• We propose Knowledge-Aware coNtinual leaner (KAN); a resource-efﬁcient task-speciﬁc
components method to explain these ﬁndings."
RELATED WORK,0.03611111111111111,"2
RELATED WORK"
RELATED WORK,0.03888888888888889,We divide the CL methods into two main categories: Rehearsal-free and Rehearsal-based methods.
RELATED WORK,0.041666666666666664,"Rehearsal-free methods. In this category, previous data is inaccessible during future learning.
There are two strategies to address forgetting. (1) Task-speciﬁc components. Speciﬁc components
are assigned to each task. The components of previous tasks are stable during future learning. While
the components that have not been allocated to any task are ﬂexible for future learning. These meth-
ods either extend the model size when facing a new task (Rusu et al., 2016; Yoon et al., 2018) or uses
a ﬁxed-capacity and each task is trained either using sparse sub-network within the model (Mallya
& Lazebnik, 2018; Mallya et al., 2018; Yoon et al., 2019). These methods are limited to task-IL
as they require the task identity to specify the components of each task at inference. Recently, few
methods have been proposed for class-IL using ﬁxed-capacity model. SupSup (Wortsman et al.,
2020) learns a mask for each task over randomly initialized ﬁxed network. FSLL (Mazumder et al.,
2021) addressed the few-shot lifelong learning setup. It relies on the availability of large data for
the ﬁrst task to train a dense model. Then, few unimportant parameters are used to learn each task.
SpaceNet (Sokar et al., 2021c) learns sparse sub-network for each task from scratch using dynamic
sparse training (Mocanu et al., 2018; Hoeﬂer et al., 2021) where the weights and the sparse topol-
ogy are optimized simultaneously. (2) Regularization-based. A ﬁxed-capacity model is used and"
RELATED WORK,0.044444444444444446,Under review as a conference paper at ICLR 2022
RELATED WORK,0.04722222222222222,"all parameters are involved in optimizing each task. Forgetting is addressed either by constraining
changes in the important weights of previous tasks (Zenke et al., 2017; Kirkpatrick et al., 2017;
Aljundi et al., 2018) or via distillation loss (Li & Hoiem, 2017; Dhar et al., 2019). Previous stud-
ies (Kemker et al., 2018; Hsu et al., 2018; Farquhar & Gal, 2019; van de Ven & Tolias, 2018) showed
the big performance gap of most of these methods between class-IL and task-IL."
RELATED WORK,0.05,"Rehearsal-based methods. In this category, forgetting is addressed by replaying: (1) a subset of
old samples (Rebufﬁet al., 2017; Lopez-Paz & Ranzato, 2017; Riemer et al., 2018; Chaudhry et al.,
2018), (2) pseudo-samples from a generative model (Mocanu et al., 2016; Shin et al., 2017; Sokar
et al., 2021a), or (3) generative high-level features (Liu et al., 2020; van de Ven et al., 2020). They
use a classiﬁcation model and buffer to store old samples or a generative model to generate them."
RELATED WORK,0.05277777777777778,"Other related studies. Recent work by (Ramasesh et al., 2020) evaluates forgetting in hidden
representations in Task-IL and shows how semantic similarities inﬂuence it. They showed that
higher layers are more prone to forgetting and intermediate similarity results in maximal forgetting.
SAM (Sokar et al., 2021b) studies the importance of selective transfer in dense networks by meta-
training (Finn et al., 2017) a self-attention mechanism (Hu et al., 2018). CAT (Ke et al., 2020)
addresses the relation between task similarities and forward/backward transfer in task-IL where
they rely on the task identity to ﬁnd the previous similar knowledge in dense networks. In (Chen
et al., 2020), the lottery ticket hypothesis (Frankle & Carbin, 2018) is studied for the CL paradigm."
PRELIMINARIES,0.05555555555555555,"3
PRELIMINARIES"
PROBLEM FORMULATION,0.058333333333333334,"3.1
PROBLEM FORMULATION"
PROBLEM FORMULATION,0.06111111111111111,"We consider the problem of learning a sequence of T tasks. Each task brings a new set of C classes.
Each task t has its own dataset Dt = {Dt
c}|C
c=1, where Dt
c is the data of class c in task t. Once we
have trained task t, its data is discarded. The goal is to sequentially learn the model f t with a uniﬁed
classiﬁer that can map any input to its corresponding target for all seen classes up to time step t."
REHEARSAL-FREE STRATEGY,0.06388888888888888,"3.2
REHEARSAL-FREE STRATEGY"
REHEARSAL-FREE STRATEGY,0.06666666666666667,"In this work, we focus to analyze how the model components should be altered for each task in
task-speciﬁc components methods. In addition, we compare the behavior of these methods against
regularization-based methods which use all model components for each task."
SPACENET,0.06944444444444445,"3.2.1
SPACENET"
SPACENET,0.07222222222222222,"We analyze the recent task-speciﬁc components method, SpaceNet (Sokar et al., 2021c). The mo-
tivations for choosing SpaceNet are: (1) unlike most task-speciﬁc component methods, it does not
rely on task identity; making it applicable for class-IL. (2) Instead of relying on a pre-trained model,
it trains sparse subnetworks from scratch. These are favorable for real-world applications in which
we cannot assume the availability of task identity at inference and large datasets for pretraining. To
the best of our knowledge, it is only existing work that fulﬁlls these objectives."
SPACENET,0.075,"The main idea of SpaceNet is to learn sparse representation for each task to reduce the interference
between tasks. SpaceNet consists of three main steps. (1) Sparse connections allocation: sparse
sub-network W t
l is randomly allocated for each task t in each layer l between subset of the unim-
portant neurons hsel
l−1 and hsel
l
; where hsel
l
are randomly selected from the free neurons hfree
l
that
have not been reserved for any previous task. (2) Dynamic sparse training: the sparse weights and
topology are optimized through “drop-and-grow” cycles to produce sparse representation. (3) Neu-
ron reservation: after learning, a fraction of the most important neurons for the current task hspec
l
are ﬁxed and removed from the free list of neurons hfree
l
. The full details are provided in Appendix
I. SpaceNet considers only previous tasks during the allocation of new connections for the new tasks
and randomly allocates a new sub-network between the free neurons for each task. In this work,
we propose novel criteria which consider both past and current tasks in allocation and allow reusing
some of the past components instead of allocating new ones."
SPACENET,0.07777777777777778,Under review as a conference paper at ICLR 2022
SPACENET,0.08055555555555556,"Task 2
(dog,truck) dog truck"
SPACENET,0.08333333333333333,Model after training Task 1 car cat
SPACENET,0.08611111111111111,(1) Detect similar knowledge car cat
SPACENET,0.08888888888888889,(2) Connections allocation car cat
SPACENET,0.09166666666666666,"lreuse
Reserved Free Fixed"
SPACENET,0.09444444444444444,"Task 2
connections"
SPACENET,0.09722222222222222,Candidate
SPACENET,0.1,"for dog
Candidate"
SPACENET,0.10277777777777777,for truck
SPACENET,0.10555555555555556,"Figure 1: An overview of our proposed method KAN. The most left panel shows the network after
training on Task 1. When the model faces Task 2, KAN reuses the existing similar knowledge up
to layer lreuse and adds new components in the subsequent layers. For l ≥lreuse, (1) the candidate
similar neurons for each new class are detected. (2) New sparse connections are allocated between
the candidate neurons and free neurons in layer l −1 and the free neurons in layer l ."
SPACENET,0.10833333333333334,"4
PROPOSED KNOWLEDGE-AWARE CONTINUAL LEARNER (KAN)"
SPACENET,0.1111111111111111,"In this work, we aim to study how the model components should be altered, when a CL agent
faces a new task, to balance between the CL desiderata (i.e. forward transfer, reducing forgetting,
and resource efﬁciency). To address this goal, we propose Knowledge-Aware contiNual learner
(KAN), a new task-speciﬁc components model that exploits the semantic similarity between old and
new classes in altering a CL model. The novel contributions of KAN are: (1) the allocation of a
new topology considers both previous and current tasks; (2) reusing some of the existing learned
components from previous similar tasks instead of allocating new components in each layer."
SPACENET,0.11388888888888889,"Figure 1 shows an overview of KAN. When the agent faces a new task t, new connections are al-
located for this task. The new connections are trained with stochastic gradient descent (SGD). All
previous connections are ﬁxed. Instead of allocating new connections in each layer, KAN starts allo-
cation from layer lreuse ∈[1, L −1] which is a hyper-parameter that controls the trade-off between
allocating new components and reusing old components based on existing knowledge. L is the num-
ber of layers. The topology from layer l1 up to but excluding layer lreuse remains unchanged. In
KAN, we operate on the class level instead of tasks for connections allocation. Starting from lreuse
onwards, KAN allocates new connections for each new class. This requires two steps."
SPACENET,0.11666666666666667,"The ﬁrst step is the detection of similar knowledge. Typically, some of the previously learned
classes are similar to the new classes and some are dissimilar. Classes that have semantic similarity
are most likely to share similar representation (Appendix A; Figures 5b and 6). For each new class
c, KAN ﬁnds the candidate neurons hc cand
l
in each layer l, ∀l ≥lreuse, that could contain relevant
representation learned by a previous similar class. To achieve this, we feed the data of class c, Dt
c,
on the trained model at time step t −1, f t−1, and calculate the average activation ac
l in each layer l.
We estimate the relevance by the activation value. The higher the activation is, the more relevant is
the neuron (i.e. the neurons that ﬁre are the most important to the current class). We select a fraction
selc cand
l
of the most relevant neurons to be the candidate neurons hc cand
l
for class c. Please note
that by exploiting the representation learned in the candidate neurons hc cand
lreuse in layer lreuse, we are
reusing previous learned components connected to these neurons in preceding layers (l < llreuse).
Therefore, these components are stable but reusable."
SPACENET,0.11944444444444445,"The second step is to exploit the relevant candidate neurons in each layer l, ∀l ≥lreuse, in allo-
cating the new connections for each new class c. Adding new connections in layer l between the
candidate neurons hc cand
l−1
and hc cand
l
could maximize the forward transfer from previous knowl-
edge. However, this would lead to forgetting previously similar knowledge as the representation
learned by the important neurons for previous classes would be updated. To solve this dilemma, we
allow reusing the candidate neurons by allocating new connections out of these neurons. However,
we do not allow new connections to be added into the important neurons for previous tasks hspec
l
(fully ﬁlled circles in Figure 1). In addition, we block the gradient ﬂow through all important neu-"
SPACENET,0.12222222222222222,Under review as a conference paper at ICLR 2022
SPACENET,0.125,Algorithm 1 KAN Connections Allocation
SPACENET,0.12777777777777777,"1: Require: selt
l, selc cand
l−1
, lreuse, sparsity level ϵl
2: for each class c in task t do
▷Get candidate neurons in each layer for each new class
3:
ac
l ←forward pass Dt
c on f t−1"
SPACENET,0.13055555555555556,"4:
eac
l ←sortDescending (ac
l )
5:
hc cand
l
←select the ﬁrst selc cand
l
from eac
l
6: end for each
7: (hsel
l−1, hsel
l
) ←randomly select selt
l−l and selt
l neurons from hfree
l−1 and hfree
l
8: for each class c in task t do
9:
for l ←lreuse to L −1 do
10:
halloc
l−1 ←{hsel
l−1 ∪hc cand
l−1
}
11:
halloc
l
←hsel
l
12:
randomly allocate parameters W c
l with sparsity ϵl between halloc
l−1 and halloc
l
13:
Wl ←Wl ∪W c
l
14:
end for each
15: end for each"
SPACENET,0.13333333333333333,"rons for previous tasks hspec
l
, even if it is a candidate neuron for the current class, to protect previous
knowledge. Thus, hspec
l
is used to mask the gradient gl through the neurons in layer l as follows:
gl = gl ⊗(1 −hspec
l
), where hspec
l
is a one-hot encoding vector in which the entities contain value
of one represent an important neuron in layer l. This allows us not to forget the previously learned
knowledge while performing selective transfer for the useful knowledge. Let halloc
l−1 and halloc
l
be the
list of neurons for allocating new sparse connections W c
l for class c in layer l with a sparsity level
ϵl
C ; where ϵl is a hyper-parameter that controls the number of sparse connections for each task and
C is the total number of classes. The neurons used for allocation are selected as follows:"
SPACENET,0.1361111111111111,"halloc
l−1 = {hcand
l−1 ∪hsel
l−1}
and
halloc
l
= hsel
l
,
where
hsel
i
∈hfree
i
∀i = {l, l −1},
(1)"
SPACENET,0.1388888888888889,"where hsel
i
is a subset, selt
l, of the free neurons in layer i that are not reserved for any previous task.
Since the important neurons for the dissimilar classes are not involved in the topology allocation, we
are protecting their knowledge. Thus, the selective transfer in KAN addresses the forward transfer
while maintaining previous similar and dissimilar knowledge. Full details are in Algorithm 1."
SPACENET,0.14166666666666666,"After allocating the topology for task t, we follow steps 2 and 3 of SpaceNet, dynamic sparse
training and neuron reservation, to train the task and ﬁx its important neurons hspec
l
afterwards
(Section 3.2.1)."
EXPERIMENTS AND RESULTS,0.14444444444444443,"5
EXPERIMENTS AND RESULTS"
EXPERIMENTS AND RESULTS,0.14722222222222223,"We now use KAN to investigate how the model should deal with sequences of similar, dissimilar
tasks, or a mix of both to achieve the balance between the competing CL desiderata. We compare
against other rehearsal-free methods. We analyze the accuracy, forward and backward transfer,
model capacity, and class-order sensitivity. Each experiment is repeated 5 times with different seeds."
DATASETS AND BASELINES,0.15,"5.1
DATASETS AND BASELINES"
DATASETS AND BASELINES,0.1527777777777778,"Datasets.
We construct sequences with varying similarities from the standard benchmarks for
class-IL, CIFAR-10 and CIFAR-100 (Zenke et al., 2017), by altering the original class or-
der.
From CIFAR-10, we construct two-tasks and ﬁve-tasks sequences.
For the two-tasks se-
quences, we construct: (1) Similar sequence (sim seq 2Tasks): Task1{car,cat}, Task2{dog,truck},
where the two tasks share semantic similarity.
(2) Dissimilar sequence (dissim seq 2Tasks):
Task1{car,truck}, Task2{cat,dog}, where the semantic similarity is limited.
For the ﬁve-tasks
sequence (sim seq 5Tasks:), we arranged the 10 classes of CIFAR-10 in the following or-
der:{car,cat,horse,truck,dog,deer,airplane,bird,ship,truck}. Each task consists of two consecutive
classes. With this order, we study the case where there is past knowledge that has common se-
mantic similarity with the new task. From CIFAR-100, we construct a longer sequence of 8 tasks
(sim seq 8Tasks). Each task contain two classes coming from two different categories and each
two consecutive tasks shares semantic similarity. The classes has the following order: {apples,girl,
orange,boy,mouse,bicycle,rabbit,motocycle,bee,lion,butterﬂy,tiger,bottle,couch,chair,cans}."
DATASETS AND BASELINES,0.15555555555555556,Under review as a conference paper at ICLR 2022
DATASETS AND BASELINES,0.15833333333333333,Table 1: Forward transfer. Test accuracy [%] of Task 2 in two cases: similar and dissimilar tasks.
DATASETS AND BASELINES,0.16111111111111112,"Strategy
Method
sim seq 2Tasks
dissim seq 2Tasks
# Parameters allocated
Use whole capacity
SI creg = 0.1
98.19 ± 0.240
76.05 ± 3.95
1×(884576)
Use whole capacity
SI creg = 0.01
98.30 ± 0.127
81.91 ± 1.60
1×(884576)
Use one sub-network
Scratch
97.73 ± 0.008
80.21 ± 0.02
(0.065 ×)
Add new sub-network per task
SpaceNet
98.17 ± 0.002
81.27 ± 0.02
(0.131 ×)
Reuse relevant knowledge
KAN (ours) lreuse = L −1
96.29 ± 0.006
66.17 ± 0.02
(0.065 ×)
Reuse random knowledge
Random reuse lreuse = L −1
95.43 ± 0.002
64.60 ± 0.01
(0.065 ×)"
DATASETS AND BASELINES,0.1638888888888889,"Architecture. We followed the architecture used by (Zenke et al., 2017; Sokar et al., 2021c) for a
direct comparison. It also allows us to study the challenging case where the available capacity is
limited. It consists of 4 convolutional layers (32-32-64-64 feature maps) and 2 feed-forward layers
(512-N neurons), where N is the number of classes. More details are in Appendix B."
