Section,Section Appearance Order,Paragraph
REFERENCES,0.603448275862069,"Sungsoo Ahn, Junsu Kim, Hankook Lee, and Jinwoo Shin. Guiding deep molecular optimization
with genetic exploration. arXiv preprint arXiv:2007.04897, 2020."
REFERENCES,0.6120689655172413,"Rim Assouel, Mohamed Ahmed, Marwin H Segler, Amir Saffari, and Yoshua Bengio.
De-
factor: Differentiable edge factorization-based probabilistic graph generation.
arXiv preprint
arXiv:1811.09766, 2018."
REFERENCES,0.6206896551724138,"Guy W Bemis and Mark A Murcko. The properties of known drugs. 1. molecular frameworks.
Journal of medicinal chemistry, 39(15):2887–2893, 1996."
REFERENCES,0.6293103448275862,"J´er´emy Besnard, Gian Filippo Ruda, Vincent Setola, Keren Abecassis, Ramona M Rodriguiz, Xi-
Ping Huang, Suzanne Norval, Maria F Sassano, Antony I Shin, Lauren A Webster, et al. Auto-
mated design of ligands to polypharmacological proﬁles. Nature, 492(7428):215–220, 2012."
REFERENCES,0.6379310344827587,"Carlos A Coello Coello. Treating constraints as objectives for single-objective evolutionary opti-
mization. Engineering Optimization+ A35, 32(3):275–308, 2000."
REFERENCES,0.646551724137931,"R Cooray, V Gupta, and C Suphioglu. Current aspects of the endocannabinoid system and targeted
thc and cbd phytocannabinoids as potential therapeutics for parkinson’s and alzheimer’s diseases:
a review. Molecular Neurobiology, 57(11):4878–4890, 2020."
REFERENCES,0.6551724137931034,Under review as a conference paper at ICLR 2022
REFERENCES,0.6637931034482759,"Andrew Dalke. Deepsmiles: An adaptation of smiles for use in machine-learning of chemical struc-
tures. 2018."
REFERENCES,0.6724137931034483,"Andrew Dalke, Jerome Hert, and Christian Kramer. mmpdb: An open-source matched molecular
pair platform for large multiproperty data sets. Journal of chemical information and modeling, 58
(5):902–910, 2018."
REFERENCES,0.6810344827586207,"David Duvenaud, Dougal Maclaurin, Jorge Aguilera-Iparraguirre, Rafael G´omez-Bombarelli, Tim-
othy Hirzel, Al´an Aspuru-Guzik, and Ryan P Adams. Convolutional networks on graphs for
learning molecular ﬁngerprints. arXiv preprint arXiv:1509.09292, 2015."
REFERENCES,0.6896551724137931,"Peter Ertl and Ansgar Schuffenhauer.
Estimation of synthetic accessibility score of drug-like
molecules based on molecular complexity and fragment contributions. Journal of cheminfor-
matics, 1(1):1–11, 2009."
REFERENCES,0.6982758620689655,"Evan N Feinberg, Debnil Sur, Zhenqin Wu, Brooke E Husic, Huanghao Mai, Yang Li, Saisai Sun,
Jianyi Yang, Bharath Ramsundar, and Vijay S Pande. Potentialnet for molecular property predic-
tion. ACS central science, 4(11):1520–1530, 2018."
REFERENCES,0.7068965517241379,"Roger Fletcher. Practical methods of optimization. John Wiley & Sons, 2013."
REFERENCES,0.7155172413793104,"Janine George and Geoffroy Hautier. Chemist versus machine: Traditional knowledge versus ma-
chine learning techniques. Trends in Chemistry, 2020."
REFERENCES,0.7241379310344828,"Justin Gilmer, Samuel S Schoenholz, Patrick F Riley, Oriol Vinyals, and George E Dahl. Neural
message passing for quantum chemistry. In International conference on machine learning, pp.
1263–1272. PMLR, 2017."
REFERENCES,0.7327586206896551,"Robert C. Glen and AWR Payne. A genetic algorithm for the automated generation of molecules
within constraints. Journal of Computer-Aided Molecular Design, 9(2):181–202, 1995."
REFERENCES,0.7413793103448276,"Rafael G´omez-Bombarelli, Jennifer N Wei, David Duvenaud, Jos´e Miguel Hern´andez-Lobato,
Benjam´ın S´anchez-Lengeling, Dennis Sheberla, Jorge Aguilera-Iparraguirre, Timothy D Hirzel,
Ryan P Adams, and Al´an Aspuru-Guzik. Automatic chemical design using a data-driven contin-
uous representation of molecules. ACS central science, 4(2):268–276, 2018."
REFERENCES,0.75,"O˘guzhan Hasanc¸ebi and Fuat Erbatur. Evaluation of crossover techniques in genetic algorithm based
optimum structural design. Computers & Structures, 78(1-3):435–448, 2000."
REFERENCES,0.7586206896551724,"Emilie S Henault, Maria H Rasmussen, and Jan H Jensen. Chemical space exploration: how genetic
algorithms ﬁnd the needle in the haystack. PeerJ Physical Chemistry, 2:e11, 2020."
REFERENCES,0.7672413793103449,"John H Holland. Genetic algorithms. Scientiﬁc american, 267(1):66–73, 1992."
REFERENCES,0.7758620689655172,"Ye Hu, Dagmar Stumpfe, and Jurgen Bajorath. Computational exploration of molecular scaffolds in
medicinal chemistry: Miniperspective. Journal of medicinal chemistry, 59(9):4062–4076, 2016."
REFERENCES,0.7844827586206896,"John J Irwin, Teague Sterling, Michael M Mysinger, Erin S Bolstad, and Ryan G Coleman. Zinc:
a free tool to discover chemistry for biology. Journal of chemical information and modeling, 52
(7):1757–1768, 2012."
REFERENCES,0.7931034482758621,"Jan H Jensen. A graph-based genetic algorithm and generative model/monte carlo tree search for
the exploration of chemical space. Chemical science, 10(12):3567–3572, 2019."
REFERENCES,0.8017241379310345,"Xia Jiang, Ziwen Zhang, Jiawei Zuo, Chengyao Wu, Liang Zha, Yingying Xu, Sheng Wang, Jingbo
Shi, Xin-Hua Liu, Jing Zhang, et al. Novel cannabidiol- carbamate hybrids as selective buche in-
hibitors: Docking-based fragment reassembly for the development of potential therapeutic agents
against alzheimer’s disease. European Journal of Medicinal Chemistry, 223:113735, 2021."
REFERENCES,0.8103448275862069,"GG Jin and JS Ha. Genetic algorithms as optimisation tools and their applications. Journal of the
Korean Society of Marine Engineering, 21(2):108–116, 1997."
REFERENCES,0.8189655172413793,"Wengong Jin, Regina Barzilay, and Tommi Jaakkola.
Junction tree variational autoencoder for
molecular graph generation. In International Conference on Machine Learning, pp. 2323–2332.
PMLR, 2018a."
REFERENCES,0.8275862068965517,Under review as a conference paper at ICLR 2022
REFERENCES,0.8362068965517241,"Wengong Jin, Kevin Yang, Regina Barzilay, and Tommi Jaakkola. Learning multimodal graph-to-
graph translation for molecular optimization. arXiv preprint arXiv:1812.01070, 2018b."
REFERENCES,0.8448275862068966,"Mario Krenn, Florian H¨ase, AkshatKumar Nigam, Pascal Friederich, and Alan Aspuru-Guzik. Self-
referencing embedded strings (selﬁes): A 100% robust molecular string representation. Machine
Learning: Science and Technology, 1(4):045024, 2020."
REFERENCES,0.853448275862069,"Yongbeom Kwon and Juyong Lee. Molﬁnder: an evolutionary algorithm for the global optimization
of molecular properties and the extensive exploration of chemical space using smiles. Journal of
cheminformatics, 13(1):1–14, 2021."
REFERENCES,0.8620689655172413,"Maxime Langevin, Herv´e Minoux, Maximilien Levesque, and Marc Bianciotto.
Scaffold-
constrained molecular generation. Journal of Chemical Information and Modeling, 2020."
REFERENCES,0.8706896551724138,"Riccardo Leardi. Genetic algorithms in chemometrics and chemistry: a review. Journal of Chemo-
metrics: A Journal of the Chemometrics Society, 15(7):559–569, 2001."
REFERENCES,0.8793103448275862,"Jaechang Lim, Sang-Yeon Hwang, Seokhyun Moon, Seungsu Kim, and Woo Youn Kim. Scaffold-
based molecular design with a graph generative model. Chemical Science, 11(4):1153–1164,
2020."
REFERENCES,0.8879310344827587,"AkshatKumar Nigam, Pascal Friederich, Mario Krenn, and Al´an Aspuru-Guzik. Augmenting ge-
netic algorithms with deep neural networks for exploring the chemical space. arXiv preprint
arXiv:1909.11655, 2019."
REFERENCES,0.896551724137931,"AkshatKumar Nigam, Robert Pollice, and Alan Aspuru-Guzik.
Janus: Parallel tempered ge-
netic algorithm guided by deep neural networks for inverse molecular design. arXiv preprint
arXiv:2106.04011, 2021a."
REFERENCES,0.9051724137931034,"AkshatKumar Nigam, Robert Pollice, Mario Krenn, Gabriel dos Passos Gomes, and Alan Aspuru-
Guzik.
Beyond generative models: superfast traversal, optimization, novelty, exploration and
discovery (stoned) algorithm for molecules using selﬁes. Chemical science, 2021b."
REFERENCES,0.9137931034482759,"Pavel Polishchuk. Crem: chemically reasonable mutations framework for structure generation. Jour-
nal of Cheminformatics, 12(1):1–18, 2020."
REFERENCES,0.9224137931034483,"Benjamin Sanchez-Lengeling and Al´an Aspuru-Guzik. Inverse molecular design using machine
learning: Generative models for matter engineering. Science, 361(6400):360–365, 2018."
REFERENCES,0.9310344827586207,"Quentin Vanhaelen, Yen-Chu Lin, and Alex Zhavoronkov. The advent of generative chemistry. ACS
Medicinal Chemistry Letters, 11(8):1496–1505, 2020."
REFERENCES,0.9396551724137931,"Sangameswar Venkatraman and Gary G Yen. A generic framework for constrained optimization
using genetic algorithms. IEEE Transactions on Evolutionary Computation, 9(4):424–435, 2005."
REFERENCES,0.9482758620689655,"David Weininger. Smiles, a chemical language and information system. 1. introduction to method-
ology and encoding rules. Journal of chemical information and computer sciences, 28(1):31–36,
1988."
REFERENCES,0.9568965517241379,"Kevin Yang, Kyle Swanson, Wengong Jin, Connor Coley, Philipp Eiden, Hua Gao, Angel Guzman-
Perez, Timothy Hopper, Brian Kelley, Miriam Mathea, et al. Analyzing learned molecular repre-
sentations for property prediction. Journal of chemical information and modeling, 59(8):3370–
3388, 2019."
REFERENCES,0.9655172413793104,"¨Ozg¨ur Yeniay.
Penalty function methods for constrained optimization with genetic algorithms.
Mathematical and computational Applications, 10(1):45–56, 2005."
REFERENCES,0.9741379310344828,"Naruki Yoshikawa, Kei Terayama, Masato Sumita, Teruki Homma, Kenta Oono, and Koji Tsuda.
Population-based de novo molecule generation, using grammatical evolution. Chemistry Letters,
47(11):1431–1434, 2018."
REFERENCES,0.9827586206896551,"Jiaxuan You, Bowen Liu, Rex Ying, Vijay Pande, and Jure Leskovec. Graph convolutional policy
network for goal-directed molecular graph generation. arXiv preprint arXiv:1806.02473, 2018."
REFERENCES,0.9913793103448276,"Hongyu Zhao and Justin Dietrich. Privileged scaffolds in lead generation. Expert opinion on drug
discovery, 10(7):781–790, 2015."
