Section,Section Appearance Order,Paragraph
ABSTRACT,0.0,ABSTRACT
ABSTRACT,0.0029585798816568047,"We propose a novel and general framework (i.e., SABAL) that formulates batch
active learning as a sparse approximation problem. SABAL aims to ﬁnd a weighted
subset from the unlabeled data pool such that the corresponding training loss func-
tion approximates its full data pool counterpart. We realize the general framework
as a sparsity-constrained discontinuous optimization problem that explicitly bal-
ances uncertainty and representation for large-scale applications, for which we
propose both greedy and iterative hard thresholding schemes. The proposed method
can adapt to various settings, including both Bayesian and non-Bayesian neural
networks. Numerical experiments show that that SABAL achieves state-of-the-art
performance across different settings with lower computational complexity."
INTRODUCTION,0.005917159763313609,"1
INTRODUCTION"
INTRODUCTION,0.008875739644970414,"Over the last decade, deep neural networks have achieved promising results in various learning tasks.
However, obtaining labels for a complex training dataset can be challenging in practice, as the data
annotation is usually a time-consuming process that may require professional knowledge in certain
applications such as in medicine (Hoi et al., 2006; Shen et al., 2021). Active Learning (AL) (Settles,
2009) is commonly employed to mitigate the problem of scarce labeled data – enabling efﬁcient
model training with limited annotation costs. Given a partially labeled dataset, active learning ideally
selects data samples that are the best for learning. Speciﬁcally, it aims to iteratively query the most
helpful data to ask an oracle (human annotator) to annotate. The queried data samples can be added
back to the labeled data pool, and the model is updated. This process is repeated until the model has
achieved the desired performance. Intelligently identifying the most valuable data for annotation,
also known as the query strategy, is the key problem in active learning."
INTRODUCTION,0.011834319526627219,"A common strategy is to take the prediction uncertainty or data representation as the metric for
data query. This uncertainty-based approach (Settles, 2009; Tong & Koller, 2001; Gal et al., 2017;
Beluch et al., 2018) works by querying samples with high uncertainty, but often results in selecting
correlated and redundant data samples in each batch (Kirsch et al., 2019; Ducoffe & Precioso, 2018).
Representation-based approaches (Sener & Savarese, 2017; Yang & Loog, 2019) aim to select a subset
of data that represents the whole unlabeled dataset, but tend to be computationally expensive and
sensitive to batch sizes (Ash et al., 2019; Shui et al., 2020). More recently, several hybrid approaches
that try to take both uncertainty and representation into consideration have shown advantages (Ash
et al., 2019; Shui et al., 2020; Sinha et al., 2019). This paper takes this hybrid view towards an active
learning framework that balances the trade-off between uncertainty and representation."
INTRODUCTION,0.014792899408284023,"Besides hybrid approaches, deep Bayesian active learning has also gained attention due to recent
advances in Bayesian deep learning. Several Bayesian approaches (Gal et al., 2017; Kirsch et al.,
2019) leverage model uncertainty measurements (Gal & Ghahramani, 2015; 2016) determined by
Bayesian neural networks, while other works (Pinsler et al., 2019) leverage progress in Bayesian
Coreset problems (Zhang et al., 2021; Huggins et al., 2016; Campbell & Broderick, 2019). However,
as most existing Bayesian approaches are explicitly designed for Bayesian neural networks, another
goal of this paper is to propose a general method for both Bayesian and non-Bayesian models."
INTRODUCTION,0.01775147928994083,"For deep models, it is reasonable to query a large batch of data simultaneously to reduce model
update frequency. The batch selection approach is known as batch active learning. Taking an
optimization perspective, ﬁnding the best batch is NP-hard in general. Two common approaches
for such combinatorial problems are the greedy and clustering approaches. Greedy algorithms"
INTRODUCTION,0.020710059171597635,Under review as a conference paper at ICLR 2022
INTRODUCTION,0.023668639053254437,"select one data sample in sequence until the batch budget is exhausted (Kirsch et al., 2019; Bıyık
et al., 2019; Chen & Krause, 2013). Here, speciﬁc conditions of the acquisition function such
as submodularity (Nemhauser et al., 1978) are required to guarantee a good optimization result.
Clustering algorithms regard cluster centers as their queried batch (Sener & Savarese, 2017; Ash
et al., 2019), but can be computationally expensive. To our knowledge, except for Pinsler et al.
(2019) that focus on the Bayesian models, so far active learning has rarely been studied from a sparse
approximation perspective. This is despite the ubiquity of sparse approximation in signal processing
for tasks such as dictionary learning (Aharon et al., 2006) and compressed sensing (Donoho, 2006)
due to its performance for discovering a sparse representation while avoiding redundant information.
Here we employ sparse approximation methods for batch active learning tasks."
INTRODUCTION,0.026627218934911243,"Our main contributions are summarized in the following. We propose a novel and ﬂexible Sparse
Approximation-based Batch Active Learning framework, i.e., SABAL. We show how SABAL
generalizes batch active learning as a sparse approximation problem and can adapt to different
settings and models. The central intuition of SABAL is ﬁnding a weighted subset from the unlabeled
data pool so that its corresponding training loss approximates the full-set loss function in a function
space. We realize the SABAL framework as an efﬁcient ﬁnite-dimensional optimization problem:
First, we derive an upper bound to balance the trade-off between uncertainty and representation in a
principled way. Second, we approximate the loss functions using ﬁnite-dimensional approximation.
This results in a sparsity-constrained discontinuous optimization problem, for which we propose
several efﬁcient optimization algorithms. We demonstrate the advantages of SABAL in experiments
for both Bayesian and non-Bayesian batch active learning settings."
INTRODUCTION,0.029585798816568046,"The structure of this manuscript is as follows. In Section 2, we formulate the general framework of
SABAL, and in Section 3, we realize the framework into a ﬁnite-dimensional discontinuous sparse
optimization problem. To solve the resulting optimization problem, we propose two optimization
algorithms in Section 4. Related work are discussed in Section 5 and Appendix Section B. Results of
our experiments are presented in section 6, and all proofs are provided in Appendix Section C."
BATCH ACTIVE LEARNING AS SPARSE APPROXIMATION,0.03254437869822485,"2
BATCH ACTIVE LEARNING AS SPARSE APPROXIMATION"
BATCH ACTIVE LEARNING AS SPARSE APPROXIMATION,0.03550295857988166,"This section introduces the preliminaries and the general formulation of batch active learning as a
sparse approximation problem."
BATCH ACTIVE LEARNING AS SPARSE APPROXIMATION,0.038461538461538464,"Preliminaries
Vectors are denoted as bold lower case letters, e.g., w ∈Rn. The l0 pseudo-
norm of a vector w is denoted as ∥w∥0, i.e., the number of non-zero elements of w. We denote
R+ := [0, +∞). Distributions are denoted in script, e.g., P, and a random variable is denoted by
tilde, e.g., ˜y ∼P. We denote sets in calligraphy or in uppercase Greek alphabet (e.g., D, Θ), and
additionally we denote [n] := {1, 2, . . . , n}. In supervised learning, given a labeled training dataset
Dl := {(xi, yi)}nl
i=1, where we denote their domain to be x ∈X and y ∈Y, the empirical goal is to
minimize a loss function Ll(θ) := P"
BATCH ACTIVE LEARNING AS SPARSE APPROXIMATION,0.04142011834319527,"(xi,yi)∈Dl ℓ(xi, yi; θ) formed by the training dataset, where
θ ∈Θ ⊂Rm is the parameter of the model and ℓis a loss function evaluated on individual pairs
of data. Without loss of generality, we assume Θ ⊂Rm is compact and ℓ(x, y; ·) : Θ →R is in a
normed space (L(Θ, R), ∥· ∥†) for all x, y. We further assume the constant function f : Θ →1 is
included in L(Θ, R). The “†” in the norm ∥· ∥† : L(Θ, R) →R+, representing its deﬁnition is a
placeholder that will be discussed later."
BATCH ACTIVE LEARNING AS SPARSE APPROXIMATION,0.04437869822485207,"Batch Active Learning
Besides the labeled dataset Dl, there is an unlabeled dataset Du :=
{xj}nu
j=1 where the labels are unknown but could be acquired at a high cost through human labeling.
Combining two datasets, the ideal loss function to minimize w.r.t. θ is
P"
BATCH ACTIVE LEARNING AS SPARSE APPROXIMATION,0.047337278106508875,"(xi,yi)∈Dl ℓ(xi, yi; θ) + P"
BATCH ACTIVE LEARNING AS SPARSE APPROXIMATION,0.05029585798816568,"xj∈Du ℓ(xj, y⋆
j ; θ),
(1)"
BATCH ACTIVE LEARNING AS SPARSE APPROXIMATION,0.05325443786982249,"where y⋆
j is the unknown true label corresponding to the data xj. Since acquiring true labels could
be costly, we have to impose a budget b (b < nu) on the number of label acquisitions. Therefore, the
batch active learning problem is to ﬁnd a subset S ⊂Du such that we can obtain a good model by
optimizing the following loss function w.r.t. θ,
P"
BATCH ACTIVE LEARNING AS SPARSE APPROXIMATION,0.05621301775147929,"(xi,yi)∈Dl ℓ(xi, yi; θ) + P"
BATCH ACTIVE LEARNING AS SPARSE APPROXIMATION,0.05917159763313609,"xj∈S ℓ(xj, y⋆
j ; θ),
where |S| = b.
(2)"
BATCH ACTIVE LEARNING AS SPARSE APPROXIMATION,0.0621301775147929,Under review as a conference paper at ICLR 2022
BATCH ACTIVE LEARNING AS SPARSE APPROXIMATION,0.0650887573964497,"Generalized Batch Active Learning
We start our method by generalizing the classical formulation
(equation 2) by considering an importance weight for each unlabeled data. That is, we aim to ﬁnd
a sparse non-negative vector w ∈Rnu
+ such that we can obtain a good model by optimizing the
following loss function w.r.t. θ:
P"
BATCH ACTIVE LEARNING AS SPARSE APPROXIMATION,0.06804733727810651,"(xi,yi)∈Dl ℓ(xi, yi; θ) + P"
BATCH ACTIVE LEARNING AS SPARSE APPROXIMATION,0.07100591715976332,"xj∈Du wjℓ(xj, y⋆
j ; θ),
where ∥w∥0 = b.
(3)"
BATCH ACTIVE LEARNING AS SPARSE APPROXIMATION,0.07396449704142012,"A key question now is—what is the criterion for a good w? Comparing the ideal loss function
(equation 1) and the sparse importance weighted loss (equation 3), the only difference is their
unlabeled data loss functions. Therefore, a straight-forward informal criterion for a good importance
weight w is that the two unlabeled data loss functions are close to each other, i.e.,"
BATCH ACTIVE LEARNING AS SPARSE APPROXIMATION,0.07692307692307693,"L⋆
w(θ) := 1 b X"
BATCH ACTIVE LEARNING AS SPARSE APPROXIMATION,0.07988165680473373,"xj∈Du
wjℓ(xj, y⋆
j ; θ)
≈
L⋆(θ) := 1 nu X"
BATCH ACTIVE LEARNING AS SPARSE APPROXIMATION,0.08284023668639054,"xj∈Du
ℓ(xj, y⋆
j ; θ)."
BATCH ACTIVE LEARNING AS SPARSE APPROXIMATION,0.08579881656804733,"However, as the true labels are unknown, we cannot compute L⋆
w and L⋆. Luckily, we can have
an estimator for the true labels, i.e., estimation based on the labeled data p(˜yj | xj, Dl) or an
approximation of it. Denote P(xj) as an estimated distribution, so ˜yj ∼P(xj), then the informal
criterion for a good importance weight w then becomes"
BATCH ACTIVE LEARNING AS SPARSE APPROXIMATION,0.08875739644970414,˜Lw(θ) := 1 b X
BATCH ACTIVE LEARNING AS SPARSE APPROXIMATION,0.09171597633136094,"xj∈Du
wjℓ(xj, ˜yj; θ)
≈
˜L(θ) := 1 nu X"
BATCH ACTIVE LEARNING AS SPARSE APPROXIMATION,0.09467455621301775,"xj∈Du
ℓ(xj, ˜yj; θ).
(4)"
BATCH ACTIVE LEARNING AS SPARSE APPROXIMATION,0.09763313609467456,"Thus, we are one step closer to evaluating the quality of a weighted selection. The next question is
how to measure the difference between ˜L and ˜Lw."
BATCH ACTIVE LEARNING AS SPARSE APPROXIMATION,0.10059171597633136,"Difference Between Two Loss Functions
Given the two loss functions ˜L, ˜Lw ∈L(Θ, R), where
L(Θ, R) is equipped with the norm ∥· ∥†, a straight-forward measurement of the difference between
them is ∥˜L −˜Lw∥†. However, observing that the optimization of a loss function is shift-invariant, the
difference between two loss functions should also be shift-invariant. For example, for ∀L ∈L(Θ, R)
we have arg minθ∈Θ(L(θ) + c) = arg minθ∈Θ L(θ) for ∀c ∈R, implying that L + c should be
treated the same as L. Therefore, to account for the shift-invariance, we deﬁne q : L(Θ, R) →R+ as"
BATCH ACTIVE LEARNING AS SPARSE APPROXIMATION,0.10355029585798817,"q(L) := inf
c∈R ∥L + c∥†,
∀L ∈L(Θ, R).
(5)"
BATCH ACTIVE LEARNING AS SPARSE APPROXIMATION,0.10650887573964497,"Note that we abuse the notation a bit, i.e., the c in L + c should be the constant function that maps
every θ ∈Θ to c. The above deﬁnition has some nice properties that make it a good difference
measurement of two loss functions, as proved in proposition C.1 in the appendix. In particular, q(·)
satisﬁes the triangle inequality, and q(L + c) = q(L) for any constant c. Therefore, we can formulate
the generalized batch active learning problem as the following sparse approximation problem."
BATCH ACTIVE LEARNING AS SPARSE APPROXIMATION,0.10946745562130178,"Problem 1 (Sparse Approximation-based Batch Active Learning). Given the shift-invariant seminorm
q induced by the norm ∥· ∥† (equation 5), and a label estimation distribution P, the generalized
batch active learning problem (equation 4) is formally deﬁned as"
BATCH ACTIVE LEARNING AS SPARSE APPROXIMATION,0.11242603550295859,"arg min
w∈Rnu
+
EP[q(˜L −˜Lw)]
s.t.
∥w∥0 = b,
(6)"
BATCH ACTIVE LEARNING AS SPARSE APPROXIMATION,0.11538461538461539,where EP stands for the expectation over ˜yj ∼P(xj) for ∀j ∈[nu].
BATCH ACTIVE LEARNING AS SPARSE APPROXIMATION,0.11834319526627218,"Problem 1 (SABAL) offers a general framework for batch active learning and can be applied with
various settings, i.e., both the norm ∥· ∥† and the individual loss function ℓcan be chosen based on
speciﬁc problems and applications. In the next section, we introduce two practical realizations of
equation 6 for Bayesian and non-Bayesian active learning respectively."
SPARSE APPROXIMATION AS FINITE-DIMENSIONAL OPTIMIZATION,0.12130177514792899,"3
SPARSE APPROXIMATION AS FINITE-DIMENSIONAL OPTIMIZATION"
SPARSE APPROXIMATION AS FINITE-DIMENSIONAL OPTIMIZATION,0.1242603550295858,"In this section, we transform the sparse approximation problem (equation 6) into a ﬁnite-dimensional
sparse optimization problem. First, we address an issue regarding the sampling of EP. Then, we
discuss some concrete choices of P and ∥· ∥† that lead to a ﬁnite-dimensional sparse optimization."
SPARSE APPROXIMATION AS FINITE-DIMENSIONAL OPTIMIZATION,0.12721893491124261,Under review as a conference paper at ICLR 2022
SPARSE APPROXIMATION AS FINITE-DIMENSIONAL OPTIMIZATION,0.1301775147928994,"Addressing the Sampling Issue
In equation 6, the expectation EP is taken over the product
space of (˜y1, . . . , ˜ynu) and each sample has to be remembered for future optimization, which can
be intractable for large datasets. However, it has an upper bound where the complexity of the
optimization is independent of the number of samples from P. First, by the triangle inequality
EP[q(˜L −˜Lw)] = EP[q(˜L −EP[˜L] + EP[˜L] −EP[˜Lw] + EP[˜Lw] −˜Lw)]"
SPARSE APPROXIMATION AS FINITE-DIMENSIONAL OPTIMIZATION,0.13313609467455623,"≤EP[q(˜L −EP[˜L])] + EP[q(˜Lw −EP[˜Lw])]
|
{z
}
(i): variance"
SPARSE APPROXIMATION AS FINITE-DIMENSIONAL OPTIMIZATION,0.13609467455621302,"+ q(EP[˜L] −EP[˜Lw])
|
{z
}
(ii): approximation bias . (7)"
SPARSE APPROXIMATION AS FINITE-DIMENSIONAL OPTIMIZATION,0.1390532544378698,"We can see that it offers a trade-off between bias and variance, where the bias term is immediately
tractable by expanding ˜L, ˜Lw:
(ii) = q(EP[ 1 nu
P"
SPARSE APPROXIMATION AS FINITE-DIMENSIONAL OPTIMIZATION,0.14201183431952663,"xj∈Du ℓ(xj, ˜yj; ·)] −EP[ 1 b
P"
SPARSE APPROXIMATION AS FINITE-DIMENSIONAL OPTIMIZATION,0.14497041420118342,"xj∈Du wjℓ(xj, ˜yj; ·)])"
SPARSE APPROXIMATION AS FINITE-DIMENSIONAL OPTIMIZATION,0.14792899408284024,= q(( 1
SPARSE APPROXIMATION AS FINITE-DIMENSIONAL OPTIMIZATION,0.15088757396449703,"nu
P
xj∈Du EP(xj)[ℓ(xj, ˜yj; ·)]) −( 1"
SPARSE APPROXIMATION AS FINITE-DIMENSIONAL OPTIMIZATION,0.15384615384615385,"b
P
xj∈Du wjEP(xj)[ℓ(xj, ˜yj; ·)])).
(8)"
SPARSE APPROXIMATION AS FINITE-DIMENSIONAL OPTIMIZATION,0.15680473372781065,"It remains to address the variance term (i). Recall that the more accurate P is, the more accurate our
approximation is. Given the decision wj > 0, if the label of xj is acquired, i.e., the oracle (human
annotator) will offer us its true label y⋆
j , and the labeling distribution would be improved. That being
said, the distribution of ˜yj given xj and wj > 0 will be concentrated on its true label y⋆
j , i.e.,"
SPARSE APPROXIMATION AS FINITE-DIMENSIONAL OPTIMIZATION,0.15976331360946747,˜yj ∼Pw(xj) :=
SPARSE APPROXIMATION AS FINITE-DIMENSIONAL OPTIMIZATION,0.16272189349112426,"(
P(xj)
if wj = 0
δy⋆
j
if wj > 0 ,
where w ∈Rnu
+
(9)"
SPARSE APPROXIMATION AS FINITE-DIMENSIONAL OPTIMIZATION,0.16568047337278108,"where δy⋆
j denotes the distribution that ˜yj can only be y⋆
j . However, the improved distribution Pw
is not known before the acquisition of the true labels y⋆
j for wj > 0. Fortunately, although Pw(xj)
is not known, it is known that the corresponding variance for ˜yj would be zero no matter what its
label is. Applying this trick, we show in the following proposition that the term (i) with the improved
label distribution Pw has an upper bound that does not require to know the true labels.
Proposition 3.1. Let w ∈Rnu
+ and ∥w∥0 = b, by replacing the P by the improved estimation
distribution Pw (equation 9) into (i) in equation 7, we have"
SPARSE APPROXIMATION AS FINITE-DIMENSIONAL OPTIMIZATION,0.16863905325443787,"EPw[q(˜L −EPw[˜L])] + EPw[q(˜Lw −EPw[˜Lw])] ≤
X"
SPARSE APPROXIMATION AS FINITE-DIMENSIONAL OPTIMIZATION,0.17159763313609466,"xj∈Du
1(wj = 0) · σj,
(10)"
SPARSE APPROXIMATION AS FINITE-DIMENSIONAL OPTIMIZATION,0.17455621301775148,"where σj :=
1
nu EP(xj)[q(ℓ(xj, ˜yj; ·) −EP(xj)[ℓ(xj, ˜yj; ·)])] is the individual variance, and 1(·)
is the indicator function."
SPARSE APPROXIMATION AS FINITE-DIMENSIONAL OPTIMIZATION,0.17751479289940827,"Therefore, combining equation 8 and equation 10, we have a more tractable form of the sparse
approximation, i.e.,"
SPARSE APPROXIMATION AS FINITE-DIMENSIONAL OPTIMIZATION,0.1804733727810651,"arg min
w∈Rnu
+
q(EP[˜L] −EP[˜Lw]) +
X"
SPARSE APPROXIMATION AS FINITE-DIMENSIONAL OPTIMIZATION,0.1834319526627219,"xj∈Du
1(wj = 0) · σj
s.t.
∥w∥0 = b,
(11)"
SPARSE APPROXIMATION AS FINITE-DIMENSIONAL OPTIMIZATION,0.1863905325443787,"Intuitively, such decomposition of bias and variance naturally provides metrics of uncertainty and
representation for active learning, where the variance itself is a metric of uncertainty, meanwhile the
bias term measures how well a subset of selected data can represent the whole unlabeled data. Now,
it remains to specify the choice of ∥· ∥†, i.e., the norm that induces q (equation 5)."
SPARSE APPROXIMATION AS FINITE-DIMENSIONAL OPTIMIZATION,0.1893491124260355,"Formulation of the Finite-Dimensional Optimization
We consider two concrete choices of the
∥· ∥† for Bayesian and non-Bayesian settings respectively."
SPARSE APPROXIMATION AS FINITE-DIMENSIONAL OPTIMIZATION,0.19230769230769232,"1. In the Bayesian setting, we can easily sample θi ∼π := p(θ | Dl) from the posterior. Utilizing
the posterior, we make the norm ∥· ∥† more concrete by considering the L2(π)-norm, i.e.,
∥L∥2
π = Eθ∼π[L(θ)2]. Accordingly,
q(L)2 = inf
c∈R ∥L + c∥2
π = inf
c∈R Eθ∼π[(L(θ) + c)2] = Eθ∼π[(L(θ) −Eθ∼π[L(θ)])2].
(12)"
SPARSE APPROXIMATION AS FINITE-DIMENSIONAL OPTIMIZATION,0.1952662721893491,"The posterior π tells us where and how to evaluate the “magnitude” of L. Noting that equation 12
is in the form of an expectation, we can draw m samples θi ∼π to approximate it. Denote
g :=
1
√m[. . . , (L(θi) −¯L), . . . ]⊤
i=1...m ∈Rm where ¯L := 1"
SPARSE APPROXIMATION AS FINITE-DIMENSIONAL OPTIMIZATION,0.19822485207100593,"m
Pm
i=1 L(θi). equation 12 becomes"
SPARSE APPROXIMATION AS FINITE-DIMENSIONAL OPTIMIZATION,0.20118343195266272,"q(L)2 ≈
1
m m
X"
SPARSE APPROXIMATION AS FINITE-DIMENSIONAL OPTIMIZATION,0.20414201183431951,"i=1
(L(θi) −¯L)2 = ∥g∥2
2,
(13)"
SPARSE APPROXIMATION AS FINITE-DIMENSIONAL OPTIMIZATION,0.20710059171597633,where ∥g∥2 is simply the Euclidean norm of the m-dimensional vector g.
SPARSE APPROXIMATION AS FINITE-DIMENSIONAL OPTIMIZATION,0.21005917159763313,Under review as a conference paper at ICLR 2022
SPARSE APPROXIMATION AS FINITE-DIMENSIONAL OPTIMIZATION,0.21301775147928995,"2. In the non-Bayesian setting, we evaluate the loss function in a local “window” based on the current
model. We consider the ∥· ∥∞-norm over a Euclidean ball Br(θ0) of radius r centered at the
current model parameter θ0, i.e., ∥L∥∞= maxθ∈Br(θ0) |L(θ)|. Moreover, in the Euclidean ball
we approximate L(θ) ≈L(θ0) + ∇L(θ0)⊤(θ −θ0). Therefore, we have"
SPARSE APPROXIMATION AS FINITE-DIMENSIONAL OPTIMIZATION,0.21597633136094674,"q(L) = inf
c∈R ∥L + c∥∞= inf
c∈R
max
θ∈Br(θ0) |L(θ) + c|"
SPARSE APPROXIMATION AS FINITE-DIMENSIONAL OPTIMIZATION,0.21893491124260356,"≈inf
c∈R
max
θ∈Br(θ0) |L(θ0) + ∇L(θ0)⊤(θ −θ0) + c| = r∥∇L(θ0)∥2.
(14)"
SPARSE APPROXIMATION AS FINITE-DIMENSIONAL OPTIMIZATION,0.22189349112426035,Note that ∥∇L(θ0)∥2 is the Euclidean norm of the gradient vector ∇L(θ0) ∈Rm.
SPARSE APPROXIMATION AS FINITE-DIMENSIONAL OPTIMIZATION,0.22485207100591717,"To estimate the label distribution, P(xj) = p(˜yj | xj, Dl) can be directly applied on Bayesian
models by estimating the predictive model posterior. For non-Bayesian models, one could utilize
the calibrated model prediction (Guo et al., 2017) as the label distribution. Finally, plugging either
of the two approximations of q(L) into equation 11, and squaring all of the terms for the ease of
optimization, we can formulate the sparse approximation problem as the following ﬁnite-dimensional
optimization problem, where α > 0 offers a trade-off between bias and variance."
SPARSE APPROXIMATION AS FINITE-DIMENSIONAL OPTIMIZATION,0.22781065088757396,"arg min
w∈Rnu
+
∥v −Φw∥2
2 + α
X"
SPARSE APPROXIMATION AS FINITE-DIMENSIONAL OPTIMIZATION,0.23076923076923078,"xj∈Du
1(wj = 0) · σ2
j
s.t.
∥w∥0 = b,
(15)"
SPARSE APPROXIMATION AS FINITE-DIMENSIONAL OPTIMIZATION,0.23372781065088757,"where we denote v ∈Rm, Φ ∈Rm×nu and σj as"
SPARSE APPROXIMATION AS FINITE-DIMENSIONAL OPTIMIZATION,0.23668639053254437,"v := 1 nu nu
X"
SPARSE APPROXIMATION AS FINITE-DIMENSIONAL OPTIMIZATION,0.23964497041420119,"j=1
EP(xj)[gj(˜yj)],
Φ := 1"
SPARSE APPROXIMATION AS FINITE-DIMENSIONAL OPTIMIZATION,0.24260355029585798,"b (EP(x1)[g1(˜y1)], . . . , EP(xnu)[gnu(˜ynu)]),"
SPARSE APPROXIMATION AS FINITE-DIMENSIONAL OPTIMIZATION,0.2455621301775148,σj = 1
SPARSE APPROXIMATION AS FINITE-DIMENSIONAL OPTIMIZATION,0.2485207100591716,"nu
EP(xj)[∥gj(˜yj) −EP(xj)[gj(˜yj)]∥2],"
SPARSE APPROXIMATION AS FINITE-DIMENSIONAL OPTIMIZATION,0.2514792899408284,"gj(˜yj) :=
[. . . , (ℓ(xj, ˜yj; θi) −¯ℓ), . . . ]⊤
i=1...m,
¯ℓ:= 1"
SPARSE APPROXIMATION AS FINITE-DIMENSIONAL OPTIMIZATION,0.25443786982248523,"m
Pm
i=1 ℓ(xj, ˜yj; θi)
if use (13)
∇ℓ(xj, ˜yj; θ0)
if use (14).
(16)"
SPARSE APPROXIMATION AS FINITE-DIMENSIONAL OPTIMIZATION,0.257396449704142,"In practice, it is often the case that the number of parameters is less than the number of samples,
i.e., m < nu, even for over-parameterized neural networks where the gradient of the last layer is
commonly used to represent the full-model gradient (Katharopoulos & Fleuret, 2018; Ash et al.,
2019). Therefore, if the batch size is big, i.e., b > m, the approximation bias ∥v −Φw∥2
2 may be
under-determined with inﬁnitely many w to make v = Φw, and the optimization (equation 15)
may be ”overﬁtted”. To make our method more stable, we include a ℓ2 regularizer β∥w −1∥2
2 with
β > 0. Finally, since wj ≥0, minimizing α P"
SPARSE APPROXIMATION AS FINITE-DIMENSIONAL OPTIMIZATION,0.2603550295857988,"xj∈Du 1(wj = 0) · σ2
j is equivalent to minimizing
−α P"
SPARSE APPROXIMATION AS FINITE-DIMENSIONAL OPTIMIZATION,0.26331360946745563,"xj∈Du 1(wj > 0) · σ2
j . Consequently, we have the following optimization problem."
SPARSE APPROXIMATION AS FINITE-DIMENSIONAL OPTIMIZATION,0.26627218934911245,"Problem 2 (Sparse Approximation as Finite-dimensional Optimization). The ﬁnite-dimensional
optimization for generalized batch active learning is"
SPARSE APPROXIMATION AS FINITE-DIMENSIONAL OPTIMIZATION,0.2692307692307692,"arg min
w∈Rnu
+
∥v −Φw∥2
2 −α
X"
SPARSE APPROXIMATION AS FINITE-DIMENSIONAL OPTIMIZATION,0.27218934911242604,"xj∈Du
1(wj > 0) · σ2
j + β∥w −1∥2
2
s.t.
∥w∥0 = b.
(17)"
