Section,Section Appearance Order,Paragraph
ABSTRACT,0.0,ABSTRACT
ABSTRACT,0.0023148148148148147,"We study the problem of self-supervised structured representation learning using
autoencoders for downstream tasks such as generative modeling. Unlike most
methods which rely on matching an arbitrary, relatively unstructured, prior dis-
tribution for sampling, we propose a sampling technique that relies solely on the
independence of latent variables, thereby avoiding the trade-off between recon-
struction quality and generative performance inherent to VAEs. We design a novel
autoencoder architecture capable of learning a structured representation without
the need for aggressive regularization. Our structural decoders learn a hierarchy of
latent variables, akin to structural causal models, thereby ordering the information
without any additional regularization. We demonstrate how these models learn a
representation that improves results in a variety of downstream tasks including gen-
eration, disentanglement, and extrapolation using several challenging and natural
image datasets."
INTRODUCTION,0.004629629629629629,"1
INTRODUCTION"
INTRODUCTION,0.006944444444444444,"Deep learning has achieved strong results on a plethora of challenging tasks. However, performing
well on a highly speciﬁc dataset is usually insufﬁcient to satisfactorily solve real-world problems (Tan
et al., 2018; Zhuang et al., 2019). This has lead to a particular interest in consistently learning more
structured representations with useful properties to help with a variety of downstream tasks (Bengio
et al., 2013; Tschannen et al., 2018; Bengio et al., 2017; Tschannen et al., 2018; Radhakrishnan
et al., 2018). Here, deep learning provides a ﬂexible paradigm to train complex architectures based
on autoencoders (Ballard, 1987; Lange and Riedmiller, 2010) which are typically latent variable
models, thus allowing us to embed powerful inductive biases into the models to further structure
the representations. However, it is still largely an open question as to what kinds of structure in a
representation are the most effective for generative modeling and how to learn such structures without
supervision (Locatello et al., 2018; Khrulkov et al., 2021; Shu et al., 2019; Chen et al., 2020; Nie
et al., 2020; Mathieu et al., 2019; Vaswani et al., 2017; Kwon and Ye, 2021). One direction that may
contribute to an answer is causal modeling, as it focuses on the underlying (causal) mechanisms that
generate the observations, instead of relying on (possibly spurious) correlations (Pearl, 2009; Peters
et al., 2017; Sch¨olkopf, 2019; Louizos et al., 2017; Mitrovic et al., 2020; Shen et al., 2020)."
INTRODUCTION,0.009259259259259259,"With the versatility of deep learning on one hand, and the conceptual insights of causality on the
other, our contributions herein include:"
INTRODUCTION,0.011574074074074073,"• We propose an architecture called the Structural Autoencoder (SAE), where the struc-
tural decoder emulates a general acyclic structural causal model to learn a hierarchical
representation that can separate and order the underlying factors of variation in the data."
INTRODUCTION,0.013888888888888888,"• We provide a sampling method that can be used for any autoencoder-based generative models
which does not use an explicit regularization objective and instead relies on independence in
the latent space."
INTRODUCTION,0.016203703703703703,"• We investigate how well the encoder and decoder are able to extrapolate upon seeing novel
samples."
INTRODUCTION,0.018518518518518517,We release our code at *anonymized*.
INTRODUCTION,0.020833333333333332,Under review as a conference paper at ICLR 2022
RELATED WORK,0.023148148148148147,"1.1
RELATED WORK"
RELATED WORK,0.02546296296296296,"The most popular autoencoder based method is the Variational Autoencoder (VAE) (Kingma and
Welling, 2013a) and the closely related βVAE (Higgins et al., 2017). These methods focus on
matching the distribution in the latent space to a known prior distribution by regularizing the
reconstruction training objective (Locatello et al., 2020a; Zhou et al., 2020). Although this structure
is convenient for generative modeling and even tends to disentangle the latent space to some extent, it
comes at the cost of somewhat blurry images due to posterior collapse and holes in the latent space
(Locatello et al., 2018; Higgins et al., 2017; Burgess et al., 2018; Kim and Mnih, 2018; St¨uhmer et al.,
2020)."
RELATED WORK,0.027777777777777776,"To mitigate the double-edged nature of VAEs, less aggressive regularization techniques have been
proposed such as the Wasserstein Autoencoder (WAE), which focuses on the aggregate posterior (Tol-
stikhin et al., 2018). Unfortunately, WAEs generally fail to produce a particularly meaningful or
disentangled latent space (Rubenstein et al., 2018), unless weak supervision is available (Han et al.,
2021)."
RELATED WORK,0.03009259259259259,"A more structured alternative is the Variational Ladder autoencoder (VLAE) (Zhao et al., 2017) which
separates the latent space into separate chunks each of which is processed at different levels of the
encoder and decoder (called ”rungs”). Our proposed architecture takes inspiration from the VLAEs
but crucially we do not use the variational regularization, and instead use a sampling method based on
hybridization (Besserve et al., 2018). We also infuse the information from the latent variables using
Str-Tfm layers (see section 2.2) which are based on the Ada-IN layers from Style-GANs (Karras et al.,
2019), which signiﬁcantly improves on the ladder rungs. Lastly, unlike the VLAEs, the SAEs use a
simple feed-forward CNN encoder (like all the other unstructured models), which simpliﬁes analysis
without signiﬁcantly impacting the ability to structure the representation (see further discussion in
section 4.2)."
METHODS,0.032407407407407406,"2
METHODS"
CAUSAL REPRESENTATION LEARNING,0.034722222222222224,"2.1
CAUSAL REPRESENTATION LEARNING"
CAUSAL REPRESENTATION LEARNING,0.037037037037037035,"Graphical causal modeling represents the relationship between random variables Si using a directed
acyclic graph (DAG) whose edges indicate direct causation and structural equations of the form"
CAUSAL REPRESENTATION LEARNING,0.03935185185185185,"Si := fi(PAi, Ui),
(i = 1, . . . , D),
(1)"
CAUSAL REPRESENTATION LEARNING,0.041666666666666664,"encoding the dependence of variable Si on its parents PAi in the graph and on an unexplained noise
variable Ui. The noises U1, . . . , UD are assumed to be jointly independent. The DAG along with
the mechanisms (1) is referred to as a Structural Causal Model (SCM) (Pearl, 2009). Any joint
distribution of the Si can be expressed as an SCM using suitable fi and Ui. However, the SCM
entails additional assumptions regarding how statistical dependencies between the Si are generated
by mechanisms (1), such that changes due to interventions can be modelled as well (e.g., by setting
some Ui or Si to constants)."
CAUSAL REPRESENTATION LEARNING,0.04398148148148148,"Real-world observations are often not structured into meaningful causal variables and mechanisms
to begin with. E.g., images are high-dimensional, and it is hard to learn objects and their causal
relationships from data (Lopez-Paz et al., 2017). One may thus attempt to learn a representation
consisting of causal variables or disentangled “factors” which are statistically independent (Higgins
et al., 2017). However, in an SCM it is not the Si that should be statistically independent, but the
Ui. For this reason, our representations will comprise the Ui as latent variables, driving causal
mechanisms via learned functions fi (1). This embeds an SCM into a larger model whose inputs and
outputs may be high-dimensional and unstructured (e.g., images) (Suter et al., 2018a; Sch¨olkopf,
2019)."
CAUSAL REPRESENTATION LEARNING,0.046296296296296294,"Given (high-dimensional) X = (X1, . . . , Xd), our goal is to learn a low-dimensional representation
U = (U1, . . . , UD) (D ≪d) using an encoder Rd →RD, and model the generative process
(including the SCM) that produced X from the inferred latent variables using a decoder RD →Rd.
If the causal graph of the true generative process were known, the topology of the decoder could
be ﬁxed accordingly. However, in the fully unsupervised setting, the generator must be capable
of modeling a general SCM, so our architecture speciﬁes a causal ordering (while learning what"
CAUSAL REPRESENTATION LEARNING,0.04861111111111111,Under review as a conference paper at ICLR 2022
CAUSAL REPRESENTATION LEARNING,0.05092592592592592,"information to embed in the speciﬁed ordering), while the edges between parents and children
in the SCM are learned implicitly in the computation layers. Speciﬁcally, the learned generative
process, a.k.a. decoder, produces a reconstruction ˆX of X by feeding each of the Ui into subsequent
computation layers. Here, the root node S1 in the DAG only depends on U1, while later Si depend
on their noise Ui and potentially their parents Sj(j < i). Thus the depth in the network corresponds
to a causal ordering (see Supplement for further discussion)."
STRUCTURAL DECODERS,0.05324074074074074,"2.2
STRUCTURAL DECODERS"
STRUCTURAL DECODERS,0.05555555555555555,Bilinear Upsampling
STRUCTURAL DECODERS,0.05787037037037037,Convolution
STRUCTURAL DECODERS,0.06018518518518518,"Vector Split
Fully-connected"
STRUCTURAL DECODERS,0.0625,Static Features
STRUCTURAL DECODERS,0.06481481481481481,"Figure 1:
The Structural Decoder reconstructs
(or generates) a sample from a latent vector U by
ﬁrst splitting U into D variables each of which
transforms the image features after the convolu-
tion block l of the model using the corresponding
Str-Tfm layer (green box where each pixel vhw
l
is transformed by layer speciﬁc αi and βi which
are extracted from the latent variable Ui by a two-
hidden-layer network MLPi)."
STRUCTURAL DECODERS,0.06712962962962964,"This model architecture is implemented by
the structural decoder, using D Structural-
Transform (Str-Tfm) layers placed evenly in be-
tween the convolution blocks. From the cor-
responding latent variable Ui, the ith Str-Tfm
layer estimates a scale αi and bias βi which are
then used to pixelwise transform the intermedi-
ate features of the lth layer vl (as seen in Fig-
ure 1) much like in Ada-IN (Karras et al., 2019)
except without the preceding normalization."
STRUCTURAL DECODERS,0.06944444444444445,"Each Str-Tfm layer thus acts like an fi in (1) by
integrating the information from a latent variable
Ui to transform the features PAi from earlier
layers. This variable decoder depth for each of
the latent variables biases high-level non-linear
information towards the earlier (and thereby
deeper) latent variables, while the model capac-
ity is reduced for the later variables so they can
only capture relatively low-level linear features
with respect to the data space. Meanwhile, the
random initialization of the MLPs in the Str-Tfm
layers produce more distinct activations with re-
spect to each of the latent variables than if they are all transformed linearly by same dense layers.
This architectural asymmetry between latent variables thereby encourages statistical independence
and induces a relatively intuitive hierarchical structure of the latent space."
STRUCTURAL DECODERS,0.07175925925925926,"In theory, without some form of supervision or side information, the learned latent variables are not
guaranteed to disentangle the true factors of variation, much less that the learned SCM matches the
true one (Locatello et al., 2020b). Instead, all we are guaranteed from training on observational data
is that the model is optimized to reproduce the same observational distribution as the true generative
process. However, for datasets with independent factors of variation, the independent latent variables
may align with the true factors, thus disentangling the factors in the representation. Regardless of
disentanglement, independence between latent variables also enables principled interventions on
individual variables for generating new samples, using hybrid sampling, which is akin to intervening
on the learned SCM for generative modeling."
HYBRID SAMPLING,0.07407407407407407,"2.3
HYBRID SAMPLING"
HYBRID SAMPLING,0.0763888888888889,"For generative modeling, it is necessary to sample novel latent vectors that are transformed into
(synthetic) observations using the decoder. Usually, this is done by regularizing the training objective
so the posterior matches some simple prior (e.g. the standard normal). However, in practice,
regularization techniques can fail to match the prior perfectly and actually exacerbate the information
bottleneck, leading to blurry samples from holes in the learned latent distribution and unused latent
dimensions due to posterior collapse (Dai and Wipf, 2019; St¨uhmer et al., 2020; Lucas et al., 2019;
Hoffman and Johnson, 2016). Instead of trying to match some prior distribution in the latent space,
we suggest an alternative sampling method that eliminates the need for any regularization of the loss.
Inspired by Besserve et al. (2018), we refer to it as hybrid sampling: the model stores a ﬁnite set of N
(= 128 in our case) latent vectors, selected uniformly at random from the training set. To generate a
new latent vector ˜U, a value for each of the D latent variables ˜Ui is selected independently from the N"
HYBRID SAMPLING,0.0787037037037037,Under review as a conference paper at ICLR 2022
HYBRID SAMPLING,0.08101851851851852,"stored latent vectors {U (j)}N
j=1 uniformly at random, such that: ˜Ui ←U (j)
i
where j ∼{1, ..., N}
This allows the model to generate N D distinct latent vectors, and since we assume D ≪d, N
can easily be increased up to the full training set size without signiﬁcant memory costs. Note that
hybrid sampling is directly applicable to any learned representation as it does not affect training at all,
however the ﬁdelity of generated samples will diminish if there are strong correlations between latent
dimensions. Consequently, the goal is to achieve maximal independence between latent variables
without compromising on the ﬁdelity of the decoder (i.e. reconstruction error)."
HYBRID SAMPLING,0.08333333333333333,"Hybrid sampling implicitly relies on the statistical independence of the latent variables since resam-
pling the marginal of the aggregate posterior independently breaks any existing correlations. Not
only does this align well with the objectives of unsupervised disentanglement methods, but it is also
consistent with the causal perspective of the latent variables as independent noises Ui driving an
SCM."
EXPERIMENTS,0.08564814814814815,"3
EXPERIMENTS"
EXPERIMENTS,0.08796296296296297,"We train the proposed architectures and baselines on two smaller disentanglement benchmarking
datasets (where d = 64 × 64 × 3 and the true factors are independent): 3D-Shapes (Burgess and Kim,
2018) and the three variants (”toy”, ”sim”, and ”real”) of the MPI3D Disentanglement dataset (Gondal
et al., 2019), as well as two larger more realistic datasets (where d = 128 × 128 × 3): Celeb-A (Liu
et al., 2015) and the Robot Finger Dataset (RFD) (Dittadi et al., 2020)."
EXPERIMENTS,0.09027777777777778,"After training our models on a standard 70-10-20 (train-val-test) split of the datasets we evaluate
the quality of the reconstructions based on the reconstruction loss (using binary cross entropy loss,
same as the optimization objective) and the Fr´echet Inception Distance (FID) (Heusel et al., 2017) as
in Williams et al. (2020). The FID is able to capture higher level visual features and can be used to
directly compare the reconstructed and generated sample quality, while the binary cross entropy is a
purely pixelwise comparison."
EXPERIMENTS,0.09259259259259259,"Next we compare the performance of the hybrid sampling method to the prior based sampling. Unlike
the prior based sampling, which only makes sense for the models that use regularization (VLAE,
VAE, βVAE, and WAE), the hybrid sampling method can be applied to any latent variable model.
Finally we take a closer look at the learned representations to understand how the model architecture
affects the induced structure and possibly disentanglement."
MODELS,0.09490740740740741,"3.1
MODELS"
MODELS,0.09722222222222222,"All models use the same CNN backbone for both the encoder and decoder with the same number
of convolution layers and ﬁlters, each of which is followed by group normalization and a MISH
nonlinearity (Misra, 2019), where the encoder uses max-pooling to down-sample the extracted
features and the decoder uses bilinear up-sampling to up-sample features (see the appendix for
details). For the smaller datasets, the encoder and decoder have 12 convolution layers each with 64
ﬁlters, the latent space has 12 dimensions in total, and the models are trained for 100k iterations,
while for CelebA each the encoder/decoder has 16 convolution layers each with twice as many ﬁlters,
the latent space is 32 dimensional in total, and the models are trained for 200k iterations. For the RFD
dataset, the settings are the same as for CelebA, except that there are 256 channels per convolution
layer."
MODELS,0.09953703703703703,"We compare four kinds of autoencoder architectures. The ﬁrst type is our Structural Autoencoders
(SAE) which use a conventional encoder and a structural decoder with the latent space split evenly
into 2, 3, 4, 6, or 12 variables for the smaller datasets and 16 variables for the larger ones correspond-
ing to the labels SAE-2, SAE-3, SAE-4, SAE-6, SAE-12 and SAE-16 respectively. The simplest
”baseline” architecture uses the traditional ”hourglass” architecture, in addition to a variety of differ-
ent regularization methods: (1) unregularized autoencoders (”AE”), (2) Wasserstein-autoencoders
(”WAE”) (Tolstikhin et al., 2018), (3) VAEs (Kingma and Welling, 2013b), and a βVAE (Higgins
et al., 2017) (with the experimentally determined best setting of β = 2). The next baseline architec-
ture is called ”AdaAE” (and referred to as ”Adaptive” as it is identical to the SAE models except
that all latent variables are passed to each of the Str-Tfm layers, so the architecture is effectively the
same as using Ada-IN layers (Karras et al., 2019). For the purposes of hybrid sampling, each latent
dimension of these less structured baselines is treated as a separate latent variable."
MODELS,0.10185185185185185,Under review as a conference paper at ICLR 2022
MODELS,0.10416666666666667,"The ﬁnal type of architecture we investigate is the Variational Ladder Autoencoder (Zhao et al.,
2017) which also uses a structured architecture to learn a hierarchical representation, but unlike
our Structural Autoencoders, VLAEs also use the variational regularization and use an encoder
architecture that roughly mirrors the decoder. Another subtle, but signiﬁcant difference between the
SAE and VLAE architecture is that the ladder rungs in the VLAE decoder concatenate the features
from the latent variable of the corresponding rung in the encoder, instead of using the variable to
scale and shift the convolution features directly. Just like for the SAE models, we include variants of
the VLAEs with 2, 3, 4, 6, 12, and 16 rungs."
EXTRAPOLATION,0.10648148148148148,"3.2
EXTRAPOLATION"
EXTRAPOLATION,0.1087962962962963,"While the encoder and decoder are generally optimized jointly, the tight coupling combined with the
inherent asymmetry in the respective learning tasks begs the question which of the two is the weaker
link when it comes to generalization. To this end, we investigate to what extent the encoder vs the
decoder can extrapolate to novel observations."
EXTRAPOLATION,0.1111111111111111,"First, both the encoder and decoder are trained jointly on a subset of 3D-Shapes where only three
distinct shapes exist (instead of four, as the ball is missing) for 80k iterations. Then either the encoder
only, the decoder only, or both are trained for another 20k iterations on the full 3D-Shapes training
dataset. The reconstruction error for samples not seen during any part of training is compared for each
of the variants and each of the architectures to identify how well the encoder extrapolates compared
to the decoder."
RESULTS,0.11342592592592593,"4
RESULTS"
RESULTS,0.11574074074074074,SAE-12
RESULTS,0.11805555555555555,AdaAE-12 SAE-4 SAE-3 SAE-2
RESULTS,0.12037037037037036,VLAE-4 AE SAE-6
RESULTS,0.12268518518518519,VLAE-3
RESULTS,0.125,VLAE-6
RESULTS,0.12731481481481483,VLAE-12 VAE WAE
RESULTS,0.12962962962962962,VLAE-2 VAE 0 10 20 30 40 50
RESULTS,0.13194444444444445,Reconstruction FID Score
D-SHAPES RECONSTRUCTION QUALITY,0.13425925925925927,3D-Shapes Reconstruction Quality
D-SHAPES RECONSTRUCTION QUALITY,0.13657407407407407,Architecture
D-SHAPES RECONSTRUCTION QUALITY,0.1388888888888889,"Structural
Baseline
Adaptive
Ladder"
D-SHAPES RECONSTRUCTION QUALITY,0.1412037037037037,(a) 3D-Shapes
D-SHAPES RECONSTRUCTION QUALITY,0.14351851851851852,SAE-12 SAE-4 SAE-3
D-SHAPES RECONSTRUCTION QUALITY,0.14583333333333334,AdaAE-12 SAE-6 WAE SAE-2 AE
D-SHAPES RECONSTRUCTION QUALITY,0.14814814814814814,VLAE-6
D-SHAPES RECONSTRUCTION QUALITY,0.15046296296296297,VLAE-4
D-SHAPES RECONSTRUCTION QUALITY,0.1527777777777778,VLAE-12
D-SHAPES RECONSTRUCTION QUALITY,0.1550925925925926,VLAE-2
D-SHAPES RECONSTRUCTION QUALITY,0.1574074074074074,VLAE-3 VAE VAE 0 10 20 30 40 50
D-SHAPES RECONSTRUCTION QUALITY,0.1597222222222222,Reconstruction FID Score
D-SHAPES RECONSTRUCTION QUALITY,0.16203703703703703,MPI3D Toy Reconstruction Quality
D-SHAPES RECONSTRUCTION QUALITY,0.16435185185185186,Architecture
D-SHAPES RECONSTRUCTION QUALITY,0.16666666666666666,"Structural
Baseline
Adaptive
Ladder"
D-SHAPES RECONSTRUCTION QUALITY,0.16898148148148148,Architecture
D-SHAPES RECONSTRUCTION QUALITY,0.1712962962962963,"Structural
Baseline
Adaptive
Ladder"
D-SHAPES RECONSTRUCTION QUALITY,0.1736111111111111,(b) MPI3D Toy
D-SHAPES RECONSTRUCTION QUALITY,0.17592592592592593,AdaAE-12 SAE-6
D-SHAPES RECONSTRUCTION QUALITY,0.17824074074074073,SAE-12 SAE-4 SAE-3 SAE-2 WAE AE
D-SHAPES RECONSTRUCTION QUALITY,0.18055555555555555,VLAE-12
D-SHAPES RECONSTRUCTION QUALITY,0.18287037037037038,VLAE-4
D-SHAPES RECONSTRUCTION QUALITY,0.18518518518518517,VLAE-3
D-SHAPES RECONSTRUCTION QUALITY,0.1875,VLAE-6
D-SHAPES RECONSTRUCTION QUALITY,0.18981481481481483,VLAE-2 VAE VAE 0 10 20 30 40 50 60 70
D-SHAPES RECONSTRUCTION QUALITY,0.19212962962962962,Reconstruction FID Score
D-SHAPES RECONSTRUCTION QUALITY,0.19444444444444445,MPI3D Real Reconstruction Quality
D-SHAPES RECONSTRUCTION QUALITY,0.19675925925925927,Architecture
D-SHAPES RECONSTRUCTION QUALITY,0.19907407407407407,"Structural
Baseline
Adaptive
Ladder"
D-SHAPES RECONSTRUCTION QUALITY,0.2013888888888889,Architecture
D-SHAPES RECONSTRUCTION QUALITY,0.2037037037037037,"Structural
Baseline
Adaptive
Ladder"
D-SHAPES RECONSTRUCTION QUALITY,0.20601851851851852,(c) MPI3D Real
D-SHAPES RECONSTRUCTION QUALITY,0.20833333333333334,AdaAE-16
D-SHAPES RECONSTRUCTION QUALITY,0.21064814814814814,SAE-16 VAE
D-SHAPES RECONSTRUCTION QUALITY,0.21296296296296297,VLAE-16 VAE AE 80 90 100 110 120 130 140 150
D-SHAPES RECONSTRUCTION QUALITY,0.2152777777777778,Reconstruction FID Score
D-SHAPES RECONSTRUCTION QUALITY,0.2175925925925926,CelebA Reconstruction Quality
D-SHAPES RECONSTRUCTION QUALITY,0.2199074074074074,(d) Celeb-A
D-SHAPES RECONSTRUCTION QUALITY,0.2222222222222222,SAE-16
D-SHAPES RECONSTRUCTION QUALITY,0.22453703703703703,AdaAE-16 AE WAE VAE VAE 0 10 20 30 40 50
D-SHAPES RECONSTRUCTION QUALITY,0.22685185185185186,Reconstruction FID Score
D-SHAPES RECONSTRUCTION QUALITY,0.22916666666666666,RFD Reconstruction Quality
D-SHAPES RECONSTRUCTION QUALITY,0.23148148148148148,Architecture
D-SHAPES RECONSTRUCTION QUALITY,0.2337962962962963,"Structural
Baseline
Adaptive
Ladder"
D-SHAPES RECONSTRUCTION QUALITY,0.2361111111111111,VLAE-16
D-SHAPES RECONSTRUCTION QUALITY,0.23842592592592593,(e) RFD
D-SHAPES RECONSTRUCTION QUALITY,0.24074074074074073,"Figure 2: Results on the reconstruction quality for all models and datasets. The ”Baseline” models
correspond to traditional ”hourglass” CNN architectures, while the ”Structural” models use our novel
architectures to further structure the learned representation."
D-SHAPES RECONSTRUCTION QUALITY,0.24305555555555555,"In terms of reconstruction quality, the structural autoencoder architecture consistently outperforms
the baselines (seen in ﬁgure 2). As expected, unregularized methods like the SAE, AdaAE, and AE
tend to have signiﬁcantly better reconstruction quality. However, the structured architectures SAE
and VLAE show improved results compared to their unstructured counterparts."
D-SHAPES RECONSTRUCTION QUALITY,0.24537037037037038,Under review as a conference paper at ICLR 2022 SAE-3
D-SHAPES RECONSTRUCTION QUALITY,0.24768518518518517,SAE-12 SAE-2 SAE-4 SAE-6
D-SHAPES RECONSTRUCTION QUALITY,0.25,VLAE-12
D-SHAPES RECONSTRUCTION QUALITY,0.2523148148148148,VLAE-3
D-SHAPES RECONSTRUCTION QUALITY,0.25462962962962965,VLAE-2
D-SHAPES RECONSTRUCTION QUALITY,0.2569444444444444,VLAE-6
D-SHAPES RECONSTRUCTION QUALITY,0.25925925925925924,VLAE-4 VAE
D-SHAPES RECONSTRUCTION QUALITY,0.26157407407407407,VLAE-3
D-SHAPES RECONSTRUCTION QUALITY,0.2638888888888889,VLAE-12
D-SHAPES RECONSTRUCTION QUALITY,0.2662037037037037,VLAE-4
D-SHAPES RECONSTRUCTION QUALITY,0.26851851851851855,VLAE-2 AE
D-SHAPES RECONSTRUCTION QUALITY,0.2708333333333333,VLAE-6 VAE VAE
D-SHAPES RECONSTRUCTION QUALITY,0.27314814814814814,AdaAE-12 VAE WAE WAE 0 10 20 30 40 50 60 70 80
D-SHAPES RECONSTRUCTION QUALITY,0.27546296296296297,FID Score
D-SHAPES GENERATED SAMPLES,0.2777777777777778,3D-Shapes Generated Samples
D-SHAPES GENERATED SAMPLES,0.2800925925925926,Sampling Method
