Section,Section Appearance Order,Paragraph
ABSTRACT,0.0,ABSTRACT
ABSTRACT,0.0027548209366391185,"Deep neural networks often exhibit poor performance on data that is unlikely under
the train-time data distribution, for instance data affected by corruptions. Previous
works demonstrate that test-time adaptation to data shift, for instance using entropy
minimization, effectively improves performance on such shifted distributions. This
paper focuses on the fully test-time adaptation setting, where only unlabeled data
from the target distribution is required. This allows adapting arbitrary pretrained
networks. Speciﬁcally, we propose a novel loss that improves test-time adaptation
by addressing both premature convergence and instability of entropy minimization.
This is achieved by replacing the entropy by a non-saturating surrogate and adding
a diversity regularizer based on batch-wise entropy maximization that prevents
convergence to trivial collapsed solutions. Moreover, we propose to prepend
an input transformation module to the network that can partially undo test-time
distribution shifts. Surprisingly, this preprocessing can be learned solely using the
fully test-time adaptation loss in an end-to-end fashion without any target domain
labels or source domain data. We show that our approach outperforms previous
work in improving the robustness of publicly available pretrained image classiﬁers
to common corruptions on such challenging benchmarks as ImageNet-C."
INTRODUCTION,0.005509641873278237,"1
INTRODUCTION"
INTRODUCTION,0.008264462809917356,"Deep neural networks achieve impressive performance on test data, which has the same distribution
as the training data. Nevertheless, they often exhibit a large performance drop on test (target) data
which differs from training (source) data; this effect is known as data shift (Quionero-Candela et al.,
2009) and can be caused for instance by image corruptions. There exist different methods to improve
the robustness of the model during training (Geirhos et al., 2019; Hendrycks et al., 2019; Tzeng
et al., 2017). However, generalization to different data shifts is limited since it is infeasible to include
sufﬁciently many augmentations during training to cover the excessively wide range of potential data
shifts (Mintun et al., 2021a). Alternatively, in order to generalize to the data shift at hand, the model
can be adapted during test-time. Unsupervised domain adaptation methods such as Vu et al. (2019)
use both source and target data to improve the model performance during test-time. In general source
data might not be available during inference time, e.g., due to legal constraints (privacy or proﬁt).
Therefore we focus on the fully test-time adaptation setting (Wang et al., 2020): model is adapted to
the target data during test time given only the arbitrarily pretrained model parameters and unlabeled
target data that share the same label space as source data. We extend the work of Wang et al. (2020)
by introducing a novel loss function, using a diversity regularizer, and prepending a parametrized
input transformation module to the network. We show that our approach outperform previous works
and make pretrained models robust against common corruptions on image classiﬁcation benchmarks
as ImageNet-C (Hendrycks & Dietterich, 2019) and ImageNet-R (Hendrycks et al., 2020)."
INTRODUCTION,0.011019283746556474,"Sun et al. (2020) investigate test-time adaptation using a self-supervision task. Wang et al. (2020) and
Liang et al. (2020) use the entropy minimization loss that uses maximization of prediction conﬁdence
as self-supervision signal during test-time adaptation. Wang et al. (2020) has shown that such loss
performs better adaptation than a proxy task (Sun et al., 2020). When using entropy minimization,
however, high conﬁdence predictions do not contribute to the loss signiﬁcantly anymore and thus
provide little self-supervision. This is a drawback since high-conﬁdence samples provide the most"
INTRODUCTION,0.013774104683195593,Under review as a conference paper at ICLR 2022
INTRODUCTION,0.01652892561983471,"trustworthy self-supervision. We mitigate this by introducing two novel loss functions that ensure
that gradients of samples with high conﬁdence predictions do not vanish and learning based on
self-supervision from these samples continues. Our losses do not focus on minimizing entropy but
on minimizing the negative log likelihood ratio between classes; the two variants differ in using
either soft or hard pseudo-labels. In contrast to entropy minimization, the proposed loss functions
provide non-saturating gradients, even when there are high conﬁdent predictions. Figure 1 provides
illustration of the losses and the resulting gradients. Using these new loss functions, we are able to
improve the network performance under data shifts in both online and ofﬂine adaptation settings."
INTRODUCTION,0.01928374655647383,"In general, self-supervision by conﬁdence maximization can lead to collapsed trivial solutions, which
make the network to predict only a single or a set of classes independent of the input. To overcome
this issue a diversity regularizer (Liang et al., 2020; Wu et al., 2020) can be used, that acts on a
batch of samples. It encourages the network to make diverse class predictions on different samples.
We extend the regularizer by including a moving average, in order to include the history of the
previous batches and show that this stabilizes the adaptation of the network to unlabeled test samples.
Furthermore we also introduce a parametrized input transformation module, which we prepend to
the network. The module is trained in a fully test-time adaptation manner using the proposed loss
function, and without using source data or target labels. It aims to partially undo the data shift at hand
and helps to further improve the performance on image classiﬁcation benchmark with corruptions."
INTRODUCTION,0.02203856749311295,"Since our method does not change the training process, it allows to use any pretrained models. This
is beneﬁcial because any good performing pretrained network can be readily reused, e.g., a network
trained on some proprietary data not available to the public. We show, that our method signiﬁcantly
improves performance of different pretrained models that are trained on clean ImageNet data."
INTRODUCTION,0.024793388429752067,"In summary our main contributions are as follows: we propose non-saturating losses based on the
negative log likelihood ratio, such that gradients from high conﬁdence predictions still contribute to
test-time adaptation. We extend diversity regularizer to its moving average to include the history of
previous batch samples to prevent the model collapsing to trivial solutions. We also introduce an input
transformation module, which partially undoes the data shift at hand. We show that the performance
of different pretrained models can be signiﬁcantly improved on ImageNet-C and ImageNet-R."
RELATED WORK,0.027548209366391185,"2
RELATED WORK"
RELATED WORK,0.030303030303030304,"Common image corruptions are potentially stochastic image transformations motivated by real-
world effects that can be used for evaluating a model’s robustness. One such benchmark, ImageNet-
C (Hendrycks & Dietterich, 2019), contains simulated corruptions such as noise, blur, weather
effects, and digital image transformations. Additionally, Hendrycks et al. (2020) proposed three data
sets containing real-world distribution shifts, including Imagenet-R. Most proposals for improving
robustness involve special training protocols, requiring time and additional resources. This includes
data augmentation like Gaussian noise (Ford et al., 2019; Lopes et al., 2019; Hendrycks et al.,
2020), CutMix (Yun et al., 2019), AugMix (Hendrycks et al., 2019), training on stylized images
(Geirhos et al., 2019; Kamann et al., 2020) or against adversarial noise distributions (Rusak et al.,
2020a). Mintun et al. (2021b) pointed out that many improvements on ImageNet-C are due to data
augmentations which are too similar to the test corruptions, that is: overﬁtting to ImageNet-C occurs.
Thus, the model might be less robust to corruptions not included in the test set of ImageNet-C."
RELATED WORK,0.03305785123966942,"Unsupervised domain adaptation methods train a joint model of source and target domain by cross-
domain losses to ﬁnd more general and robust features, e. g. optimize feature alignment (Quiñonero-
Candela et al., 2008; Sun et al., 2017) between domains, adversarial invariance (Ganin & Lempitsky,
2015; Tzeng et al., 2017; Ganin et al., 2016; Hoffman et al., 2018), shared proxy tasks (Sun et al.,
2019) or adapt entropy minimization via an adversarial loss (Vu et al., 2019). While these approaches
are effective, they require explicit access to source and target data at the same time, which may not
always be feasible. Our approach works with any pretrained model and only needs target data."
RELATED WORK,0.03581267217630854,"Test-time adaptation is a setting, when training (source) data is unavailable at test-time. It is related
to source free adaptation, where several works use generative models, alter training (Kundu et al.,
2020; Li et al., 2020b; Kurmi et al., 2021; Yeh et al., 2021) and require several thousand epochs to
adapt to the target data (Li et al., 2020b; Yeh et al., 2021). Besides, there is another line of work
(Sun et al., 2020; Schneider et al., 2020; Nado et al., 2021; Benz et al., 2021; Wang et al., 2020) that"
RELATED WORK,0.03856749311294766,Under review as a conference paper at ICLR 2022
RELATED WORK,0.04132231404958678,"interpret the common corruptions as data shift and aim to improve the model robustness against these
corruptions with efﬁcient test-time adaptation strategy to facilitate online adaptation. such settings
spare the cost of additional computational overhead. Our work also falls in this line of research and
aims to adapt the model to common corruptions efﬁciently with both online and ofﬂine adaptation."
RELATED WORK,0.0440771349862259,"Sun et al. (2020) update feature extractor parameters at test-time via a self-supervised proxy task
(predicting image rotations). However, Sun et al. (2020) alter the training procedure by including
the proxy loss into the optimization objective as well, hence arbitrary pretrained models cannot be
used directly for test-time adaptation. Inspired by the domain adaptation strategies (Maria Carlucci
et al., 2017; Li et al., 2016), several works (Schneider et al., 2020; Nado et al., 2021; Benz et al.,
2021) replace the estimates of Batch Normalization (BN) activation statistics with the statistics of the
corrupted test images. Fully test time adaptation, studied by Wang et al. (2020) (TENT) uses entropy
minimization to update the channel-wise afﬁne parameters of BN layers on corrupted data along
with the batch statistics estimates. SHOT (Liang et al., 2020) also uses entropy minimization and a
diversity regularizer to avoid collapsed solutions. SHOT modiﬁes the model from the standard setting
by adopting weight normalization at the fully connected classiﬁer layer during training to facilitate
their pseudo labeling technique. Hence, SHOT is not readily applicable to arbitrary pretrained models."
RELATED WORK,0.046831955922865015,"We show that pure entropy minimization (Wang et al., 2020; Liang et al., 2020) as well as alternatives
such as max square loss (Chen et al., 2019) and Charbonnier penalty (Yang & Soatto, 2020) results in
vanishing gradients for high conﬁdence predictions, thus inhibiting learning. Our work addresses
this issue by proposing a novel non-saturating loss, that provides non-vanishing gradients for high
conﬁdence predictions. We show that our proposed loss function improves the network performance
through test-time adaptation. In particular, performance on corruptions of higher severity improves
signiﬁcantly. Furthermore, we add and extend the diversity regularizer (Liang et al., 2020; Wu et al.,
2020) to avoid collapse to trivial, high conﬁdence solutions. Existing diversity regularizers (Liang
et al., 2020; Wu et al., 2020) act on a batch of samples, hence the number of classes has to be smaller
than the batch size. We mitigate this problem by extending the regularizer to a moving average
version. Li et al. (2020a) also use a moving average to estimate the entropy of the unconditional
class distribution but source data is used to estimate the gradient of the entropy. In contrast, our work
does not need access to the source data since the gradient is estimated using only target data. Prior
work Tzeng et al. (2017); Rusak et al. (2020b); Talebi & Milanfar (2021) transformed inputs by an
additional module to overcome domain shift, obtain robust models, and also to learn to resize. In our
work, we prepend an input transformation module to the model, but in contrast to former works, this
module is trained purely at test-time to partially undo the data shift at hand to aid the adaptation."
METHOD,0.049586776859504134,"3
METHOD"
METHOD,0.05234159779614325,"We propose a novel method for fully test-time adaption. We assume that a neural network fθ with
parameters θ is available that was trained on data from some distribution D, as well a set of (unlabeled)
samples X ∼D′ from a target distribution D′ ̸= D (importantly, no samples from D are required).
We frame fully test-time adaption as a two-step process: (i) Generate a novel network gφ based on fθ,
where φ denotes the parameters that are adapted. A simple variant for this is g = f and φ ⊆θ Wang
et al. (2020). However, we propose a more expressive and ﬂexible variant in Section 3.1. (ii) Adapt
the parameters φ of g on X using an unsupervised loss function L. We propose two novel losses Lslr
and Lhlr in Section 3.2 that have non-vanishing gradients for high-conﬁdence self-supervision."
INPUT TRANSFORMATION,0.05509641873278237,"3.1
INPUT TRANSFORMATION"
INPUT TRANSFORMATION,0.05785123966942149,"We propose to deﬁne the adaptable model as g = f ◦d. That is: we preprend a trainable network
d to f. The motivation for the additional component d is to increase expressivity of g such that
it can learn to (partially) undo the domain shift D →D′. Speciﬁcally, we choose d(x) = γ ·
[τx + (1 −τ)rψ(x)] + β, where τ ∈R, (β, γ) ∈Rnin with nin being the number of input channels,
rψ being a network with identical input and output shape, and · denoting elementwise multiplication.
Speciﬁcally, β and γ implement a channel-wise afﬁne transformation and τ implements a convex
combination of unchanged input and the transformed input rψ(x). By choosing τ = 1, γ = 1, β = 0,
we ensure d(x) = x and thus g = f at initialization. In principle, rψ can be chosen arbitrarily. Here,
we choose rψ as a simple stack of 3 × 3 convolutions, group normalization, and ReLUs (refer Sec.
A.2 for details). However, exploring other choices would be an interesting avenue for future work."
INPUT TRANSFORMATION,0.06060606060606061,Under review as a conference paper at ICLR 2022
INPUT TRANSFORMATION,0.06336088154269973,"Importantly, while the motivation for d is to learn to partially undo a domain shift D →D′, we train
d end-to-end in the fully test-time adaptation setting on data X ∼D′, without any access to samples
from the source domain D, based on the losses proposed in Section 3.2. The modulation parameters
of gφ are φ = (β, γ, τ, ψ, θ′), where θ′ ⊆θ. That is, we adapt only a subset of the parameters θ of the
pretrained network f. We largely follow Wang et al. (2020) in adapting only the afﬁne parameters of
normalization layers in f while keeping parameters of convolutional kernels unchanged. Additionally,
batch normalization statistics (if any) are adapted to the target distribution."
INPUT TRANSFORMATION,0.06611570247933884,"Note that the proposed method is applicable to any pretrained network that contains normalization
layers with a channel-wise afﬁne transformation. For networks with no afﬁne transformation layers,
one can add such layers into f that are initialized to identity as part of model augmentation."
ADAPTATION OBJECTIVE,0.06887052341597796,"3.2
ADAPTATION OBJECTIVE"
ADAPTATION OBJECTIVE,0.07162534435261708,"We propose a loss function L = Ldiv + δLconf for fully test-time network adaptation that consists of
two components: (i) a term Ldiv that encourages predictions of the network over the adaptation dataset
X that match a target distribution pD′(y). This can help avoiding test-time adaptation collapsing to
too narrow distributions such as always predicting the same or very few classes. If pD′(y) is (close to)
uniform, it acts as a diversity regularizer. (ii) A term Lconf that encourages high conﬁdence prediction
on individual datapoints. We note that test-time entropy minimization (TENT) (Wang et al., 2020)
ﬁts into this framework by choosing Ldiv = 0 and Lconf as the entropy."
CLASS DISTRIBUTION MATCHING LDIV,0.0743801652892562,"3.2.1
CLASS DISTRIBUTION MATCHING Ldiv"
CLASS DISTRIBUTION MATCHING LDIV,0.07713498622589532,"Assuming knowledge of the class distribution pD′(y) on the target domain D′, we propose to add a
term to the loss that encourages the empirical distribution of (soft) predictions of gφ on X to match
this distribution. Speciﬁcally, let ˆpgφ(y) be an estimate of the distribution of (soft) predictions of
gφ. We use the Kullback-Leibler divergence Ldiv = DKL(ˆpgφ(y)|| pD′(y)) as loss term. In some
applications information about the target class distribution is available, e.g. in medical data it might
be known that there is a large class imbalance. In general this information is not available, and
here we assume a uniform distribution of pD′(y), which corresponds to maximizing the entropy
H(ˆpgφ(y)). Similar assumption has been made in SHOT to circumvent the collapsed solutions."
CLASS DISTRIBUTION MATCHING LDIV,0.07988980716253444,"Since the estimate ˆpgφ(y) depends on φ, which is continuously adapted, it needs to be re-estimated
on a per-batch level. Since re-estimating ˆpgφ(y) from scratch would be computational expensive, we
propose to use a running estimate that tracks the changes of φ as follows: let pt−1(y) be the estimate
at iteration t −1 and pemp
t
= 1"
CLASS DISTRIBUTION MATCHING LDIV,0.08264462809917356,"n
Pn
k=1 ˆy(k), where ˆy(k) are the predictions (conﬁdences) of gφ on a
mini-batch of n inputs x(k) ∼X. We update the running estimate via pt(y) = κ·sg(pt−1(y))+(1−
κ) · pemp
t
, where sg refers stop-gradient. The loss becomes Ldiv = DKL(pt(y)|| pD′(y)) accordingly.
Unlike Li et al. (2020a), our approach only requires target but no source data to estimate the gradient."
CONFIDENCE MAXIMIZATION LCONF,0.08539944903581267,"3.2.2
CONFIDENCE MAXIMIZATION Lconf"
CONFIDENCE MAXIMIZATION LCONF,0.0881542699724518,"We motivate our choice of Lconf step-by-step from the (unavailable) supervised cross-entropy loss:
for this, let ˆy = gφ(x) be the predictions (conﬁdences) of model gφ and H(ˆy, yr) = −P"
CONFIDENCE MAXIMIZATION LCONF,0.09090909090909091,"c yr
c log ˆyc
be the cross-entropy between prediction ˆy and some reference yr. Let the last layer of g be a softmax
activation layer softmax. That is ˆy = softmax(o), where o are the network’s logits. We can rewrite
the cross-entropy in terms of the logits o and a one-hot reference yr as follows: H(softmax(o), yr)
= −ocr + log Pncl
i=1 eoi where cr is the index of the 1 in yr and ncl is the number of classes."
CONFIDENCE MAXIMIZATION LCONF,0.09366391184573003,"When labels being available for the target domain (which we do not assume) in the form of a one-hot
encoded reference yt for data xt, one could use the supervised cross-entropy loss by setting yr = yt
and using Lsup(ˆy, yr) = H(ˆy, yr) = H(ˆy, yt). Since fully test-time adaptation assumes no label
information, supervised cross-entropy loss is not applicable and other options for yr need to be used."
CONFIDENCE MAXIMIZATION LCONF,0.09641873278236915,"One option is (hard) pseudo-labels. That is, one deﬁnes the reference yr based on the network predic-
tions ˆy via yr = onehot(ˆy), where onehot creates a one-hot reference with the 1 corresponding to
the class with maximal conﬁdence in ˆy. This results in Lpl(ˆy) = H(ˆy, onehot(ˆy)) = −log ˆyc∗, with
c∗= arg max ˆy. One disadvantage with this loss is that the (hard) pseudo-labels ignore uncertainty
in the network predictions during self-supervision. This results in large gradient magnitudes with"
CONFIDENCE MAXIMIZATION LCONF,0.09917355371900827,Under review as a conference paper at ICLR 2022
CONFIDENCE MAXIMIZATION LCONF,0.10192837465564739,"0.0
0.2
0.4
0.6
0.8
1.0
Conﬁdence y1 −1.0 −0.8 −0.6 −0.4 −0.2 0.0"
CONFIDENCE MAXIMIZATION LCONF,0.1046831955922865,Loss L
CONFIDENCE MAXIMIZATION LCONF,0.10743801652892562,Loss L
CONFIDENCE MAXIMIZATION LCONF,0.11019283746556474,"Hard Likelihood Ratio
Soft Likelihood Ratio
Entropy
Hard Pseudolabels"
CONFIDENCE MAXIMIZATION LCONF,0.11294765840220386,"0.0
0.2
0.4
0.6
0.8
1.0
Conﬁdence y1 −0.4 −0.2 0.0 0.2 0.4"
CONFIDENCE MAXIMIZATION LCONF,0.11570247933884298,"Logit Gradient ∂L
∂o1"
CONFIDENCE MAXIMIZATION LCONF,0.1184573002754821,"Figure 1: Illustration of different losses for conﬁdence maximization. Losses (left, shifted such that
maxima of all losses are at 0) and the resulting gradients with respect to the ﬁrst logit (right) as a
function of the ﬁrst classes conﬁdence are shown for the case of a binary classiﬁcation problem.
Both entropy and hard pseudo-labels have vanishing gradients for high conﬁdence predictions*.
Accordingly, both have maximum gradient amplitude for low-conﬁdence self-supervision, with
this effect being stronger for the hard pseudo-labels. Hard Likelihood Ratio has constant gradient
amplitude for any conﬁdence and thus takes into account low- and high-conﬁdence self-supervision
equally. Soft Likelihood Ratio also shows non-vanishing (albeit non-maximum) gradients for high-
conﬁdence self-supervision and additionally produces small gradient amplitudes from low-conﬁdence
self-supervision. Since the likelihood ratio-based losses are unbounded, the design of the model
needs to ensure that logits cannot grow unbounded. *ResNet50 has a median prediction conﬁdence of
0.929 on the ImageNet validation data and hence we consider a conﬁdence of ≤0.8 as low and ≥0.95 as high."
CONFIDENCE MAXIMIZATION LCONF,0.12121212121212122,respect to the logits | ∂Lpl
CONFIDENCE MAXIMIZATION LCONF,0.12396694214876033,"∂oc∗| being generated on data where the network has low conﬁdence (see Figure
1). This is undesirable since it corresponds to the network being affected most by data points where
the network’s self-supervision is least reliable1."
CONFIDENCE MAXIMIZATION LCONF,0.12672176308539945,"An alternative is to use soft pseudo-labels, that is yr = ˆy. This takes uncertainty in network
predictions into account during self-labelling and results in the entropy minimization loss of TENT
(Wang et al., 2020): Lent(ˆy) = H(ˆy, ˆy) = H(ˆy) = −P"
CONFIDENCE MAXIMIZATION LCONF,0.12947658402203857,"c ˆyc log ˆyc. However, also for the entropy
the logits’ gradient magnitude | ∂Lent"
CONFIDENCE MAXIMIZATION LCONF,0.1322314049586777,"∂o | goes to 0 when one of the entries in ˆy goes to 1 (see Figure
1). For a binary classiﬁcation task, for instance, the maximal logits’ gradient amplitude is obtained
for ˆy ≈(0.82, 0.18). This implies that during later stages of test-time adaptation where many
predictions typically already have high conﬁdence (signiﬁcantly above 0.82), gradients are dominated
by datapoints with relative low conﬁdence in self-supervision."
CONFIDENCE MAXIMIZATION LCONF,0.1349862258953168,"While both hard and soft pseudo-labels are clearly motivated, they are not optimal in conjunction
with a gradient-based optimizer since the self-supervision from low conﬁdence predictions dominates
(at least during later stages of training). We address this issue by proposing two losses that increase
the gradient amplitude from high conﬁdence predictions. We argue that this leads to stronger self-
supervision (better gradient direction when averaged over the batch) than from the entropy loss (see
also Sec. A.1 for an illustrative example supporting this claim) . The two losses are analogous to Lpl
and Lent, but are not based on the cross-entropy H but on the negative log likelihood ratios:"
CONFIDENCE MAXIMIZATION LCONF,0.13774104683195593,"R(ˆy, yr) = −
X"
CONFIDENCE MAXIMIZATION LCONF,0.14049586776859505,"c
yr
c log
ˆyc
P
i̸=c ˆyi
= −
X"
CONFIDENCE MAXIMIZATION LCONF,0.14325068870523416,"c
yr
c(log ˆyc −log
X"
CONFIDENCE MAXIMIZATION LCONF,0.14600550964187328,"i̸=c
ˆyi) = H(ˆy, yr) +
X"
CONFIDENCE MAXIMIZATION LCONF,0.1487603305785124,"c
yr
c log
X"
CONFIDENCE MAXIMIZATION LCONF,0.15151515151515152,"i̸=c
ˆyi"
CONFIDENCE MAXIMIZATION LCONF,0.15426997245179064,"Note that while the entropy H is lower bounded by 0, R can get arbitrary small if yr
c →1 and the
sum P"
CONFIDENCE MAXIMIZATION LCONF,0.15702479338842976,i̸=c ˆyi →0 and thus log P
CONFIDENCE MAXIMIZATION LCONF,0.15977961432506887,"i̸=c ˆyi →−∞. This property will induce non-vanishing gradients
for high conﬁdence predictions."
CONFIDENCE MAXIMIZATION LCONF,0.162534435261708,"The ﬁrst loss we consider is the hard likelihood ratio loss that is deﬁned similarly to the hard
pseudo-labels loss Lpl:"
CONFIDENCE MAXIMIZATION LCONF,0.1652892561983471,"Lhlr(ˆy) = R(ˆy, onehot(ˆy)) = −log(
ˆyc∗
P
i̸=c∗ˆyi
)
= −log(
eoc∗
P
i̸=c∗eoi ) = −oc∗+ log
X"
CONFIDENCE MAXIMIZATION LCONF,0.16804407713498623,"i̸=c∗
eoi,"
