Section,Section Appearance Order,Paragraph
REFERENCES,0.6610878661087866,"Murat Kocaoglu, Christopher Snyder, Alexandros G Dimakis, and Sriram Vishwanath. Causal-
gan: Learning causal implicit generative models with adversarial training.
arXiv preprint
arXiv:1709.02023, 2017."
REFERENCES,0.6652719665271967,"Pavel Korshunov and S´ebastien Marcel. Deepfakes: a new threat to face recognition? assessment
and detection. arXiv preprint arXiv:1812.08685, 2018."
REFERENCES,0.6694560669456067,"Zachary C Lipton and Subarna Tripathi. Precise recovery of latent vectors from generative adver-
sarial networks. arXiv preprint arXiv:1702.04782, 2017."
REFERENCES,0.6736401673640168,"Francesco Locatello, Stefan Bauer, Mario Lucic, Gunnar Raetsch, Sylvain Gelly, Bernhard
Sch¨olkopf, and Olivier Bachem. Challenging common assumptions in the unsupervised learning
of disentangled representations. In international conference on machine learning, pp. 4114–4124.
PMLR, 2019."
REFERENCES,0.6778242677824268,"David Lopez-Paz and Maxime Oquab.
Revisiting classiﬁer two-sample tests.
arXiv preprint
arXiv:1610.06545, 2016."
REFERENCES,0.6820083682008368,"Christos Louizos, Uri Shalit, Joris Mooij, David Sontag, Richard Zemel, and Max Welling. Causal
effect inference with deep latent-variable models. arXiv preprint arXiv:1705.08821, 2017."
REFERENCES,0.6861924686192469,"Jersey Neyman. Sur les applications de la th´eorie des probabilit´es aux experiences agricoles: Essai
des principes. Roczniki Nauk Rolniczych, 10:1–51, 1923."
REFERENCES,0.6903765690376569,"George Papamakarios, Theo Pavlakou, and Iain Murray. Masked autoregressive ﬂow for density
estimation. arXiv preprint arXiv:1705.07057, 2017."
REFERENCES,0.694560669456067,"Nick Pawlowski, Daniel C Castro, and Ben Glocker. Deep structural causal models for tractable
counterfactual inference. arXiv preprint arXiv:2006.06485, 2020."
REFERENCES,0.698744769874477,"Judea Pearl. Causality. Cambridge university press, 2009."
REFERENCES,0.702928870292887,"Vikram V Ramaswamy, Sunnie SY Kim, and Olga Russakovsky. Fair attribute classiﬁcation through
latent space de-biasing. In Proceedings of the IEEE/CVF Conference on Computer Vision and
Pattern Recognition, pp. 9301–9310, 2021."
REFERENCES,0.7071129707112971,"Danilo Jimenez Rezende and Shakir Mohamed. Variational inference with normalizing ﬂows. In
Proceedings of the 32nd international conference on Machine learning. ACM, 2015."
REFERENCES,0.7112970711297071,"Elad Richardson, Yuval Alaluf, Or Patashnik, Yotam Nitzan, Yaniv Azar, Stav Shapiro, and Daniel
Cohen-Or. Encoding in style: a stylegan encoder for image-to-image translation. In Proceedings
of the IEEE/CVF Conference on Computer Vision and Pattern Recognition, pp. 2287–2296, 2021."
REFERENCES,0.7154811715481172,"Donald B Rubin. Estimating causal effects of treatments in randomized and nonrandomized studies.
Journal of educational Psychology, 66(5):688, 1974."
REFERENCES,0.7196652719665272,"Donald B Rubin. Bayesian inference for causal effects: The role of randomization. The Annals of
statistics, pp. 34–58, 1978."
REFERENCES,0.7238493723849372,"Donald B Rubin. Causal inference using potential outcomes: Design, modeling, decisions. Journal
of the American Statistical Association, 100(469):322–331, 2005."
REFERENCES,0.7280334728033473,Under review as a conference paper at ICLR 2022
REFERENCES,0.7322175732217573,"Shiori Sagawa, Pang Wei Koh, Tatsunori B Hashimoto, and Percy Liang. Distributionally robust
neural networks for group shifts: On the importance of regularization for worst-case generaliza-
tion. arXiv preprint arXiv:1911.08731, 2019."
REFERENCES,0.7364016736401674,"Benjamin Sanchez-Lengeling and Al´an Aspuru-Guzik. Inverse molecular design using machine
learning: Generative models for matter engineering. Science, 361(6400):360–365, 2018."
REFERENCES,0.7405857740585774,"Prasanna Sattigeri, Samuel C Hoffman, Vijil Chenthamarakshan, and Kush R Varshney. Fairness
gan. arXiv preprint arXiv:1805.09910, 2018."
REFERENCES,0.7447698744769874,"Axel Sauer and Andreas Geiger.
Counterfactual generative networks.
arXiv preprint
arXiv:2101.06046, 2021."
REFERENCES,0.7489539748953975,"Bernhard Sch¨olkopf, Francesco Locatello, Stefan Bauer, Nan Rosemary Ke, Nal Kalchbrenner,
Anirudh Goyal, and Yoshua Bengio.
Toward causal representation learning.
Proceedings of
the IEEE, 109(5):612–634, 2021."
REFERENCES,0.7531380753138075,"Emily Sheng, Kai-Wei Chang, Premkumar Natarajan, and Nanyun Peng. The woman worked as a
babysitter: On biases in language generation. arXiv preprint arXiv:1909.01326, 2019."
REFERENCES,0.7573221757322176,"Shohei Shimizu, Patrik O Hoyer, Aapo Hyv¨arinen, Antti Kerminen, and Michael Jordan. A linear
non-gaussian acyclic model for causal discovery. Journal of Machine Learning Research, 7(10),
2006."
REFERENCES,0.7615062761506276,"Yang Song, Chenlin Meng, and Stefano Ermon. Mintnet: Building invertible neural networks with
masked convolutions. arXiv preprint arXiv:1907.07945, 2019."
REFERENCES,0.7656903765690377,"Raphael Suter, Djordje Miladinovic, Bernhard Sch¨olkopf, and Stefan Bauer. Robustly disentangled
causal mechanisms: Validating deep representations for interventional robustness. In Interna-
tional Conference on Machine Learning, pp. 6056–6065. PMLR, 2019."
REFERENCES,0.7698744769874477,"Dustin Tran and David M Blei. Implicit causal models for genome-wide association studies. arXiv
preprint arXiv:1710.10742, 2017."
REFERENCES,0.7740585774058577,"Yixin Wang and David M Blei. The blessings of multiple causes. Journal of the American Statistical
Association, 114(528):1574–1596, 2019."
REFERENCES,0.7782426778242678,"Depeng Xu, Shuhan Yuan, Lu Zhang, and Xintao Wu. Fairgan: Fairness-aware generative adver-
sarial networks. In 2018 IEEE International Conference on Big Data (Big Data), pp. 570–575.
IEEE, 2018."
REFERENCES,0.7824267782426778,"Mengyue Yang, Furui Liu, Zhitang Chen, Xinwei Shen, Jianye Hao, and Jun Wang. Causalvae:
disentangled representation learning via neural structural causal models. In Proceedings of the
IEEE/CVF Conference on Computer Vision and Pattern Recognition, pp. 9593–9602, 2021."
REFERENCES,0.7866108786610879,"Jinsung Yoon, James Jordon, and Mihaela Van Der Schaar. Ganite: Estimation of individualized
treatment effects using generative adversarial nets. In International Conference on Learning Rep-
resentations, 2018."
REFERENCES,0.7907949790794979,"Kun Zhang, Bernhard Sch¨olkopf, Peter Spirtes, and Clark Glymour.
Learning causality and
causality-related learning: some recent progress. National science review, 5(1):26–29, 2018."
REFERENCES,0.7949790794979079,Under review as a conference paper at ICLR 2022
REFERENCES,0.799163179916318,"A
EXTENDING AVERAGE TREATMENT EFFECTS TO GENERATIVE MODELS"
REFERENCES,0.803347280334728,"For average treatment effects, we are interested in computing"
REFERENCES,0.8075313807531381,τ = Ei [Ymc=1(i) −Ymc=0(i)] .
REFERENCES,0.8117154811715481,"There are two important distinctions between the use of GATE in CAGE and a traditional ATE
computation:"
REFERENCES,0.8158995815899581,"• First, as we are interrogating a generative model, we can observe both Ymc=1(i) and
Ymc=0(i). This is a signiﬁcant difference to standard ATE calculations, which can only
observe one outcome.
• Second, we are interested in understanding implicit causal structure in the generator, G,
the expectation over samples from the prior of G as opposed to over samples from an
observational dataset. This is an important distinction as it disambiguates the causal struc-
ture present in an observation dataset, which is the focus of traditional causal discovery
methodology, with any causal structure implicit within the generator, which is our primary
concern."
REFERENCES,0.8200836820083682,"For unbiased estimation of ATE (a causal quantity) via statistical quantities, it is standard to assume
unconfoundedness, positivity, and SUTVA. For the use of GATE in CAGE, we implicitly make
further assumptions such as:"
REFERENCES,0.8242677824267782,"1. Counterfactual parameterization: The latent space of a generator, G, must be linearly
separable with respect to the attributes of interest. This assumption is required as CAGE
parameterizes the assignment of counterfactual treatments as linear manipulations over the
latent space of a generator. We note that such an assumption has been shown to hold in
practice for deep generative models (Denton et al., 2019; Ramaswamy et al., 2021).
2. Complete support of the generator: The generator, G, can generate high quality samples
over the entire support of its latent space, Z. This assumption is required to guarantee that
linear manipulations over the latent space of a generator continue to produce high quality
images, such that our resulting conclusions are not the result of e.g., image artefacts.
3. Sufﬁciently expressive and accurate classiﬁers: CAGE is premised on the use of proba-
bilistic classiﬁers in order to quantify the presence/absence of an effect variable on coun-
terfactual examples and thus compute treatment effects as speciﬁed in equations (5-6). We
require accurate and calibrated classiﬁers (ideally, Bayes optimal) for computing GATE."
REFERENCES,0.8284518828451883,"B
MODEL DETAILS"
REFERENCES,0.8326359832635983,"For our experiments, whenever possible, we used the default settings found in the original papers of
all chosen models. In particular, we used the default settings for both Mintnet (Song et al., 2019) and
StyleGAN2 (Karras et al., 2020) which were pretrained on MNIST and FlickrFacesHQ respectively.
For Mintnet we ﬁnetuned on a MorphoMnist dataset for 250 epochs using the Adam optimizer
with default settings. Similarly, we also ﬁnetuned StyleGAN2 on CelebAHQ for 2000 iterations
using 10% of CelebAHQ. Our synthetic experiments on the other required us to train a Masked
AutoRegressive Flow (Papamakarios et al., 2017) that consisted of 10 layers with 4 blocks per layer.
The Masked AutoRegressive Flow was trained for 5000 iterations using 5000 data samples."
REFERENCES,0.8368200836820083,"For data-augmentation we train a ResNet50 classiﬁer from scratch using weight decay of 1e −3 as
well as the default hyperparams for group DRO suggested in Sagawa et al. (2019). We also search
over α in the range of 1 −20 while perorming early stopping using the worst subgroup validation
accuracy. Note that the worst subgroup need not be blonde males throughout the entire optimization
procedure."
REFERENCES,0.8410041841004184,A NOTE ON BASELINE METHODS FOR CELEBHQ
REFERENCES,0.8451882845188284,"We compared CAGE to well-established causal discovery algorithms when looking to infer structure
over a deep generative model, G. As noted in §4.2, the causal discovery baselines considered
operate over the class probabilities output by probabilistic classiﬁers trained as §3.3. We note that
while it would be possible to learn causal structure using baseline methods, such as LiNGAM, over"
REFERENCES,0.8493723849372385,Under review as a conference paper at ICLR 2022
REFERENCES,0.8535564853556485,"the metadata (e.g., hair color and gender), this would not necesarly provide any insights into the
causal structure implicit within the generator, G. For this reason, we instead focus on applying
causal discovery methods over the output of proxy classiﬁers."
REFERENCES,0.8577405857740585,"C
ADDITIONAL BASELINE EXPERIMENTS"
REFERENCES,0.8619246861924686,"In this section we perform a series of ablation studies that stress test our framework CAGE under
various experimental settings."
REFERENCES,0.8661087866108786,"Hard vs. Soft. As we have access to ground truth labels it is tempting to consider whether using
hard labels as opposed to the classiﬁers probability is better suited to computing our ∆τ metric.
In the table below we repeat our causal discovery experiment over CelebAHQ. As observed, all
baselines provide unreliable estimates to the causal relationship between variables when compared
to the main table which is computed using soft labels. Finally, we found it useful to assign soft
labels provided by the classiﬁers used in the ATE computations for all augmented images during
group DRO training."
REFERENCES,0.8702928870292888,"Method
ANM
DAGs with No Tears
LinGAM"
REFERENCES,0.8744769874476988,"Gender, Mustache
⊥
−→
⊥
Gender, Bald
⊥
⊥
⊥
Gender, Goatee
⊥
⊥
⊥
Gender, Rosy Cheeks
⊥
←−
⊥
Age, Bald
⊥
←−
−→
Pointy Nose, Brown Hair
⊥
←−
−→
Gender, Smiling
⊥
⊥
⊥"
REFERENCES,0.8786610878661087,"Baselines without using CounterFactuals. We now turn to the use of Counterfactuals when com-
puting our baseline scores. Speciﬁcally, we attempt causal discovery purely using observation data
and labels with both hard and soft labels, which is in contrast to the main paper which considered
baselines which had access to classiﬁer probabilities on counterfactual data. The table below shows
this result of this ablation."
REFERENCES,0.8828451882845189,"Method
ANM
DAGs with No Tears
LinGAM"
REFERENCES,0.8870292887029289,"Gender, Mustache
−→
−→
⊥
Gender, Bald
−→
−→
⊥
Gender, Goatee
←−
−→
⊥
Gender, Rosy Cheeks
←−
−→
⊥
Age, Bald
⊥
−→
⊥
Pointy Nose, Brown Hair
⊥
←−
⊥
Gender, Smiling
−→
−→
−→"
REFERENCES,0.891213389121339,"D
ADDITIONAL GENERATED SAMPLES"
REFERENCES,0.895397489539749,"We now provide additional qualitiative examples of the generated counterfactuals on the same set
of DAG’s as considered in the main text. In the ﬁrst row of all settings we generate counterfactu-
als by manipulating the ﬁrst attribute variable (e.g. Gender) while the second row corresponds to
counterfactuals where the second attribute is manipulated. The third row can either be the ﬁrst or
second attribute depending on context. We note that the generated samples may expose unintended
biases that may be present in CelebAHQ and can be learned by the generator. While CAGE does not
introduce any new sources of biases it should be noted that generating counterfactuals in this manner
can further exacerbate these initially hidden biases. As a result, CAGE can serve as an important
aid in empirically illuminating important ethical concerns that should be taken into account for any
purposeful uses of generative models."
REFERENCES,0.899581589958159,Under review as a conference paper at ICLR 2022
REFERENCES,0.9037656903765691,"Gender, Mustache."
REFERENCES,0.9079497907949791,"We consider generating samples by either manipulating the mustache attribute (top two rows) and
then manipulating gender. As we can see, when the Gender is male we are able to semantically
preserve the gender as we increase the presence of mustache (top row). Similarly, we ﬁnd that
when the gender is female we are still able to semantically preserve the (subjective) gender as we
manipulate the mustache attribute (middle row). Finally, in the third row we change the gender of
from female to male and notice that although the mustache attribute was not explicitly manipulated
it appears as we manipulate gender more aggressively to male (bottom row). These results suggests
that the generative models learned causal relationship is that gender causes mustache."
REFERENCES,0.9121338912133892,Under review as a conference paper at ICLR 2022
REFERENCES,0.9163179916317992,"Gender, Goatee."
REFERENCES,0.9205020920502092,"We consider generating samples by either manipulating the goatee attribute (top two rows) and
manipulating gender. In the ﬁrst row we see that manipulating the goatee attribute leads to a visual
and subjective change the samples perceived gender (top row). Similarly, we ﬁnd that when the
gender is already male increasing the presence of a goatee does not reverse the gender to female as
expected (middle row). Finally, in the third row we change the gender of from female to male and
notice that there is no increase in goatee in the generated samples. These results suggests that the
generative models learned causal relationship is that gender is independent of goatee."
REFERENCES,0.9246861924686193,Under review as a conference paper at ICLR 2022
REFERENCES,0.9288702928870293,"Gender, Smiling."
REFERENCES,0.9330543933054394,"We consider generating samples by either manipulating the smiling attribute (top two rows) and
manipulating gender. In the ﬁrst two rows we see that increasing the smiling attribute does not
cause a (subjective) change the samples perceived gender. Conversely, in the last row manipulating a
samples gender from female to male preserves the smiling attribute (or lack thereof) in the generated
samples. These results suggests that the generative models learned causal relationship is that gender
is independent of smiling."
REFERENCES,0.9372384937238494,Under review as a conference paper at ICLR 2022
REFERENCES,0.9414225941422594,"Age, Bald."
REFERENCES,0.9456066945606695,"We consider generating samples by either manipulating the baldness attribute (top two rows) and
then manipulating age (last row). In the ﬁrst two row we see that increasing the baldness attribute
does considerably change the age of the generated sample. On the other hand, in the last row we
increase the age of the candidate and observe that while the baldness attribute increases it is not
the extent as samples found in the ﬁrst two rows. These results suggests that the generative models
learned causal relationship, in contrast to our biological prior, is that baldness is the cause of age."
REFERENCES,0.9497907949790795,Under review as a conference paper at ICLR 2022
REFERENCES,0.9539748953974896,"Pointy Nose, Brown Hair."
REFERENCES,0.9581589958158996,"We consider generating samples by either manipulating the pointy nose attribute (top two rows) and
manipulating brown hair. In the ﬁrst two rows we see that increasing the pointy nose attribute does
cause a change in the samples hair color from dark brown to more blonde. Conversely, in the last
row manipulating a samples hair color to be more brown does not appear to signiﬁcantly change the
pointy nose attribute in the generated samples. These results suggests that the generative models
learned causal relationship is that pointy nose causes brown hair."
REFERENCES,0.9623430962343096,Under review as a conference paper at ICLR 2022
REFERENCES,0.9665271966527197,"Gender, Rosy Cheeks."
REFERENCES,0.9707112970711297,"We consider generating samples by either manipulating the rosy cheek attribute (top two rows) and
manipulating gender. In the ﬁrst two rows we see that increasing the rosy cheek attribute does not
cause a change in the samples (subjective) gender—i.e. both females and males retain their gender
as we increase their rosy cheeks. On the other hand, in the last row manipulating a samples gender
from female to male appears to slighltly decrease the rosy cheek attribute in the generated samples.
These results suggests that the generative models learned causal relationship is that gender causes
rosy cheeks."
REFERENCES,0.9748953974895398,Under review as a conference paper at ICLR 2022
REFERENCES,0.9790794979079498,"Gender, Blonde Hair."
REFERENCES,0.9832635983263598,"We consider generating samples by either manipulating the blonde hair attribute (top two rows) and
manipulating gender. As observed in the ﬁrst two rows increasing the blondeness of a samples hair
does not change the perceived gender from female to male. In sharp contrast, the last row we see
that manipulating the gender from male to female leads to the samples hair color changing towards
being more blonde. These results suggests that the generative models learned causal relationship is
that gender causes blonde hair."
REFERENCES,0.9874476987447699,Under review as a conference paper at ICLR 2022
REFERENCES,0.9916317991631799,"E
MMD DISTANCE BETWEEN CONDITIONAL AND COUNTERFACTUAL
DISTRIBUTIONS"
REFERENCES,0.99581589958159,"In this appendix we plot the Maximum Mean Discrepancy distance between the conditional distri-
bution on the latent space of an attribute and the counterfactual distribution realized through our
CAGE framework. Speciﬁcally, we plot the MMD distance as a function of the interpolant strength
α and we observe that the two distributions grow further apart the further we interpolate past the
linear classiﬁers hyperplane as expected."
