Section,Section Appearance Order,Paragraph
ABSTRACT,0.0,ABSTRACT
ABSTRACT,0.0041841004184100415,"Deep generative models excel at generating complex, high-dimensional data, often
exhibiting impressive generalization beyond the training distribution. The learn-
ing principle for these models is however purely based on statistical objectives and
it is unclear to what extent such models have internalized the causal relationships
present in the training data, if at all. With increasing real-world deployments,
such a causal understanding of generative models is essential for interpreting and
controlling their use in high-stake applications that require synthetic data genera-
tion. We propose CAGE, a framework for inferring the cause-effect relationships
governing deep generative models. CAGE employs careful geometrical manipula-
tions within the latent space of a generative model for generating counterfactuals
and estimating unit-level generative causal effects. CAGE does not require any
modiﬁcations to the training procedure and can be used with any existing pre-
trained latent variable model. Moreover, the pretraining can be completely unsu-
pervised and does not require any treatment or outcome labels. Empirically, we
demonstrate the use of CAGE for: (a) inferring cause-effect relationships within a
deep generative model trained on both synthetic and high resolution images, and
(b) guiding data augmentations for robust classiﬁcation where CAGE achieves
improvements over current default approaches on image datasets."
INTRODUCTION,0.008368200836820083,"1
INTRODUCTION"
INTRODUCTION,0.012552301255230125,"Causal models play a fundamental role in analyzing real-world datasets, as many of the questions
underlying scientiﬁc research require reasoning beyond simply associations (Pearl, 2009; Rubin,
2005). Fundamentally, a causal model characterizes the generative process of the observed data via
establishing cause-effect relationships between attributes; for example, a disease causes a symptom
effect (and not vice versa). Consequently, a causal analysis is concerned with data generated and
collected in the real world via natural processes and biological agents (Glymour et al., 2019)."
INTRODUCTION,0.016736401673640166,"In contrast, a major series of advancements in machine learning in the last decade concerns deep
generative models that are learned via statistical objectives to artiﬁcially generate high-dimensional
data.
The widespread use of these models across the artiﬁcial intelligence spectrum, from vi-
sion (Karras et al., 2020) and language (Brown et al., 2020) to scientiﬁc discovery (Sanchez-
Lengeling & Aspuru-Guzik, 2018) and decision making (Chen et al., 2021), raises an important
question: What are the causal mechanisms governing a deep generative model? With a statistical
training objective, it is unclear to what extent (if any) the causal relationships from the observed
dataset are retained within a generative model and consequently, the outputs expected from the
model under interventions and counterfactuals. In addition to controlling and interpreting these
black-box models, such a ﬁne-grained understanding can be paramount for formally characterizing
their biases and generalization capabilities prior to high-stake deployments."
INTRODUCTION,0.02092050209205021,"Present Work. We propose CAGE, a framework for inferring implicit cause-effect relationships in
the latent space of deep generative models. Our framework builds off the potential outcomes frame-
work of Neyman-Rubin causal model (Neyman, 1923; Rubin, 1974) and deﬁnes a new notion of
generative average treatment effects (GATE). A fundamental problem of causal inference is that, by
construction, we cannot observe the potential outcomes under all treatments (Holland, 1986) i.e., at
any given time, any individual can be assigned only one treatment (a.k.a. the factual) but not both.
However, when studying treatment effects for deep generative models, CAGE exploits the genera-
tive nature of such models to overcome this challenge and explicitly generate the counterfactual. In"
INTRODUCTION,0.02510460251046025,Under review as a conference paper at ICLR 2022
INTRODUCTION,0.029288702928870293,"Figure 1: Counterfactual generation of Blonde Males using a deep generative model (Karras et al.,
2020). CAGE infers the implicit causal structure as Gender →Blonde Hair. Top: The left panel
contains the original image of a blond female, other panels display counterfactual samples where
gender (treatment) is changed to male. Bottom: Equivalent visualizations starting from a non-
blond male (left panel) and counterfactually changing hair color (treatment) to blond. Generating
counterfactual samples that respect the implicit causal structure yields subjectively better samples."
INTRODUCTION,0.03347280334728033,"particular, our approach utilizes probabilistic classiﬁers for characterizing the axis of variations for
relevant attributes in the latent space of a deep generative model. Given the axis for the treatment
attribute classiﬁer, we develop a geometric manipulation scheme for simulating the assignment of
speciﬁc treatments (in particular, the counterfactual) to an individual. Thereafter, we use an out-
come attribute classiﬁer to quantify the difference in outcomes for the factual and counterfactual
generations and thus, estimate GATE. We refer to our overall framework for causal probing of deep
generative models as CAGE. Figure 1 shows illustrative samples generated from our approach."
INTRODUCTION,0.03765690376569038,"While there is a body of existing work on enforcing a causal structure on deep generative models
e.g., (Kocaoglu et al., 2017; Yang et al., 2021; Suter et al., 2019) or using generative models as tools
to aid causal inference e.g., (Louizos et al., 2017; Yoon et al., 2018; Sauer & Geiger, 2021), our
work stands out in extracting the causal structure inherent in existing generative models. As such,
CAGE applies readily to any pretrained latent variable model, without any changes to their training
procedure that can introduce any undesirable trade-offs in learning (Locatello et al., 2019)."
INTRODUCTION,0.04184100418410042,"We further leverage the treatment effects estimated via CAGE to deﬁne a natural measure of causal
direction over a pair of variables associated with a deep generative model. Our score is simply
deﬁned as the difference in magnitudes of GATE when considering each variable as a treatment.
The intuition behind such a score is that the ATE when considering the effect as a treatment should
be approximately zero. In contrast, we expect the magnitude of the ATE when considering the cause
as a treatment to be large. We study the consistency of the inferred causal directions for two high-
dimensional image datasets, MorphoMNIST (Pawlowski et al., 2020) and CelebaHQ (Karras et al.,
2017), with known or biologically guessed prior cause-effect relationships."
INTRODUCTION,0.04602510460251046,"Finally, we use these inferred causal directions to guide counterfactual generation for data augmen-
tations. Data augmentations from generative models are immensely useful for dealing with class
and subgroup imbalance (Ramaswamy et al., 2021; Xu et al., 2018; Sattigeri et al., 2018). We show
that augmentations generated by respecting the causal directions inferred via CAGE improve clas-
siﬁcation accuracy by over 2.7% over the baseline and 11.7% over the anti causal direction on the
CelebaHQ dataset for the worst subgroup in the challenging group DRO task. Our main contribu-
tions are summarized as follows:"
INTRODUCTION,0.0502092050209205,"1. We introduce the notion of generative average treatment effects (GATE) for probing cause-
effect relationships in the latent space of deep generative models."
INTRODUCTION,0.05439330543933055,"2. We propose CAGE, a GATE estimation framework for deep generative models based on
latent counterfactual manipulations."
INTRODUCTION,0.058577405857740586,"3. Finally, as a practical application, we use the ATEs to infer causal direction over pairs of
attributes within deep generative models and employ CAGE for generating counterfactual
data augmentations with an application to distributionally robust optimization."
INTRODUCTION,0.06276150627615062,Under review as a conference paper at ICLR 2022
BACKGROUND AND PRELIMINARIES,0.06694560669456066,"2
BACKGROUND AND PRELIMINARIES"
THE POTENTIAL OUTCOMES FRAMEWORK,0.07112970711297072,"2.1
THE POTENTIAL OUTCOMES FRAMEWORK"
THE POTENTIAL OUTCOMES FRAMEWORK,0.07531380753138076,"We brieﬂy overview the potential outcomes framework of Neyman (1923) and Rubin (1974), upon
which we base our proposed method in the next section. In its simplest form, this framework con-
siders the causal effect of assigning a binary treatment, T ∈{0, 1}. Such a framework posits the
existence of potential outcomes for the ith individual both whilst receiving treatment, YT =1(i), and
when treatment is withheld, YT =0(i). The causal effect for a given individual, i, is deﬁned as the
difference in these potential outcomes."
THE POTENTIAL OUTCOMES FRAMEWORK,0.0794979079497908,"The “fundamental problem of causal inference” is that whilst we may posit the existence of both
potential outcomes, YT =1(i) and YT =0(i), we only ever observe the outcome under one treatment
(Holland, 1986). For this reason, causal inference is often performed at the population level, by
considering quantities such as the average treatment effect (ATE):"
THE POTENTIAL OUTCOMES FRAMEWORK,0.08368200836820083,"τ = Ei [YT =1(i) −YT =0(i)] .
(1)"
THE POTENTIAL OUTCOMES FRAMEWORK,0.08786610878661087,"Equation (1) is the expected difference in potential outcomes of individuals receiving treatment
T = 1 and T = 0. Under standard assumptions of unconfoundedness, positivity, and stable unit
treatment value assumption, the ATE is identiﬁable and can be estimated by a statistical estimate of
the associational difference in expectations (Rubin, 1978)."
DEEP LATENT VARIABLE GENERATIVE MODELS,0.09205020920502092,"2.2
DEEP LATENT VARIABLE GENERATIVE MODELS"
DEEP LATENT VARIABLE GENERATIVE MODELS,0.09623430962343096,"The goal of generative modeling is to learn an underlying data distribution given a training dataset.
For high-dimensional data, this can be done effectively via deep neural networks by learning a
mapping G from unobserved factors of variation Z (i.e., latent variables) to observed variables
X (e.g., raw pixels). The mapping G is parameterized using deep neural networks, and can be
learned via a variety of training objectives, such as adversarial training (e.g., generative adversarial
networks (GAN; Goodfellow et al. (2014)), exact maximum likelihood estimation (e.g., Normalizing
Flows (Dinh et al., 2017)), and variational Bayes (e.g., Variational Autoencoders (VAE; Kingma &
Welling (2013); Rezende & Mohamed (2015)). For our current work, we can use any such latent
variable generative model. Our experiments will exhibit this generality by considering state-of-the-
art ﬂows (Papamakarios et al., 2017; Song et al., 2019) and GANs (Karras et al., 2020)."
DEEP LATENT VARIABLE GENERATIVE MODELS,0.100418410041841,"In addition to G (i.e., the decoder), we will assume the existence of an encoder ENC : X →Z
that can map any observed datapoint to its latent vector representation. For instance, for ﬂows, the
encoder is given by the inverse of the generator mapping, ENC = G−1. For VAEs, the encoder is the
variational posterior distribution trained alongside G. For GANs, either the encoder can be trained
during training (e.g., Donahue et al. (2016); Dumoulin et al. (2016)), after training (e.g., Richardson
et al. (2021)), or implicitly learned by backpropogating through G to ﬁnd a latent vector z ∈Z
that best represents a target input x, as measured via a reconstruction loss (e.g., Lipton & Tripathi
(2017); Bora et al. (2017)) or a pretrained domain classiﬁer (e.g., (Karras et al., 2020))."
ESTIMATING CAUSAL EFFECTS IN DEEP GENERATIVE MODELS,0.10460251046025104,"3
ESTIMATING CAUSAL EFFECTS IN DEEP GENERATIVE MODELS"
ESTIMATING CAUSAL EFFECTS IN DEEP GENERATIVE MODELS,0.1087866108786611,"Our goal is to interrogate a deep generative model with a view to better understanding which—if
any—causal associations have been implicitly encoded. We therefore look to answer the question:"
ESTIMATING CAUSAL EFFECTS IN DEEP GENERATIVE MODELS,0.11297071129707113,"In the context of a generator, G, does considering the counterfactual over a given “causal”
attribute (e.g., gender) lead to signiﬁcant changes in a “effect” attribute (e.g., hair color)?"
ESTIMATING CAUSAL EFFECTS IN DEEP GENERATIVE MODELS,0.11715481171548117,"Formally, we assume whitebox access to a pretrained latent variable deep generative model
G : Z →X.
In addition, we further assume a ﬁnite dataset of n annotated observations,
D = Sn
i=1{xD(i), m1(i), m2(i)}. Here, the examples {xD(1) . . . , xD(N)} are drawn from the
model’s training distribution and we annotate each example xD(i) with binary metadata for two
variables m1(i) ∈{0, 1} and m2(i) ∈{0, 1}. These two annotated variables can be drawn from
a larger unobserved (w.r.t. G) causal process. For example, xD(i) could correspond to a high-
dimensional image and m1(i) and m2(i) could be any two attributes of the image, such as gender
expression and hair color in Figure 1. Apriori, we do not know which of the two variables (if any)
is cause or effect but through D and G, we seek to identify the nature of their relationship within G."
ESTIMATING CAUSAL EFFECTS IN DEEP GENERATIVE MODELS,0.12133891213389121,Under review as a conference paper at ICLR 2022
ESTIMATING CAUSAL EFFECTS IN DEEP GENERATIVE MODELS,0.12552301255230125,"We note that any causal conclusions obtained under our proposed framework only reﬂect implicit
properties of a generator G, as opposed to properties of the data on which the generator was trained.
That is to say, it is perfectly permitted, for G to have learned a causal relationship that is inconsistent
with the observational data used for training. As we shall see in §4, shedding light on the implicit
causal relationship learned by G is abundantly useful for pinpointing shortcomings in the model
and informing best practices for counterfactual generations. As a result, this work—by design—
is in sharp contrast with the majority of causal inference literature that focuses on identifying the
generative mechanisms of a ﬁxed dataset as opposed to our focus on the generative model itself."
OVERVIEW OF THE CAGE FRAMEWORK,0.1297071129707113,"3.1
OVERVIEW OF THE CAGE FRAMEWORK"
OVERVIEW OF THE CAGE FRAMEWORK,0.13389121338912133,"For answering the above question, we propose to extend the potential outcomes framework described
in §2.1 to accommodate latent variable deep generative models. Our approach is premised on com-
puting a generative average treatment effect for a candidate causal attribute, mc, on a given effect
attribute, me, for a given generator, G. Unlike traditional approaches to treatment effect estimation,
the key observation in CAGE is that we can simulate the counterfactuals under a given treatment.
We refer to our overall framework for causal probing of generative models as CAGE."
OVERVIEW OF THE CAGE FRAMEWORK,0.13807531380753138,"For example, in order to investigate the cause-effect relationship between gender and hair color, let
us initially arbitrarily assign gender to be the treatment m1 = mc (cause) and hair color to be the
outcome m2 = me (effect). We note this choice is arbitrary and the overall algorithm will also con-
sider the reverse assignment (i.e., m1 = me and m2 = mc) and if needed, also reveal independence
between the variables. Then we may simulate the effects of treatment assignments by manipulating
the gender attribute in the latent space and measuring the corresponding change in outcomes. We
next discuss our strategies for counterfactual manipulation and outcome quantiﬁcation."
SIMULATING TREATMENTS VIA LATENT COUNTERFACTUAL MANIPULATIONS,0.14225941422594143,"3.2
SIMULATING TREATMENTS VIA LATENT COUNTERFACTUAL MANIPULATIONS z(i)"
SIMULATING TREATMENTS VIA LATENT COUNTERFACTUAL MANIPULATIONS,0.14644351464435146,z(i; do(mc = 1))
SIMULATING TREATMENTS VIA LATENT COUNTERFACTUAL MANIPULATIONS,0.1506276150627615,"mc = 0
mc = 1"
SIMULATING TREATMENTS VIA LATENT COUNTERFACTUAL MANIPULATIONS,0.15481171548117154,me = 1
SIMULATING TREATMENTS VIA LATENT COUNTERFACTUAL MANIPULATIONS,0.1589958158995816,"me = 0
me = 0 α hc he"
SIMULATING TREATMENTS VIA LATENT COUNTERFACTUAL MANIPULATIONS,0.16317991631799164,"Treatment
Hyperplane"
SIMULATING TREATMENTS VIA LATENT COUNTERFACTUAL MANIPULATIONS,0.16736401673640167,Outcome Hyperplane
SIMULATING TREATMENTS VIA LATENT COUNTERFACTUAL MANIPULATIONS,0.17154811715481172,"Figure 2: Counterfactual Manipulation in the La-
tent Space of Generative Models in CAGE."
SIMULATING TREATMENTS VIA LATENT COUNTERFACTUAL MANIPULATIONS,0.17573221757322174,"In order to simulate the assignment of counter-
factuals, we follow a three-step procedure."
SIMULATING TREATMENTS VIA LATENT COUNTERFACTUAL MANIPULATIONS,0.1799163179916318,"Step 1: Our ﬁrst step is to train a latent space
classiﬁer for the attributes using D.
Here,
we use the encoder to ﬁrst project every in-
put xD(i) in D to its latent encoding zD(i) =
ENC(xD(i)).
1
Given the latent encodings
zD(i) and their annotations for mc and me at-
tributes, we train a (probabilistic) linear classi-
ﬁer, φc : Z →[0, 1], to discriminate between
binary causal attribute values given latent repre-
sentations. Concretely, by restricting ourselves
to linear classiﬁers we obtain a unit hyperplane
that encodes the classiﬁcation boundary. We
use hc to denote the normal vector to the hy-
perplane for attribute mc."
SIMULATING TREATMENTS VIA LATENT COUNTERFACTUAL MANIPULATIONS,0.18410041841004185,"Step 2: Since we are interested in casual dis-
covery for the generative model, in the sec-
ond step, we use G to create a dataset of annotated examples by sampling k latent vectors
Z = Sk
i=1{z(i)} from the prior of the generative model. Let X = Sk
i=1{x(i) = G(z(i))} denote
the corresponding generations. Since sampling latents from the prior generative model are typically
inexpensive, our dataset size can be fairly large. For each generated example x(i) ∈X, we obtain
its factual treatment by simply using the latent space classiﬁer as mc(i) = 1[φc(z(i)) > 0]."
SIMULATING TREATMENTS VIA LATENT COUNTERFACTUAL MANIPULATIONS,0.18828451882845187,"Step 3: For a given generated sample, x(i) ∈X, assume without loss of generality, that mc = 0 is
the factual treatment obtained via Step 2. We can derive analogous expressions for factual treatments
mc = 1, but we skip those for brevity. Finally, we deﬁne the counterfactual latent with respect to
setting the treatment attribute mc = 1 as using the do operator as:"
SIMULATING TREATMENTS VIA LATENT COUNTERFACTUAL MANIPULATIONS,0.19246861924686193,z(i; do(mc = 1)) = z(i) + αhc
SIMULATING TREATMENTS VIA LATENT COUNTERFACTUAL MANIPULATIONS,0.19665271966527198,"1For stochastic encoders such as in VAEs, we consider the mean of the encoding distribution."
SIMULATING TREATMENTS VIA LATENT COUNTERFACTUAL MANIPULATIONS,0.200836820083682,Under review as a conference paper at ICLR 2022
SIMULATING TREATMENTS VIA LATENT COUNTERFACTUAL MANIPULATIONS,0.20502092050209206,"where α ∈R+ is a positive scalar that controls the extent to which we manipulate. Equation (3.2)
corresponds to moving linearly along the hyperplane normal, hc, which encodes attribute mc for
simulating the counterfactual. Such an approach is premised on the assumption that Z is linearly
separable with respect to a semantically meaningful latent attribute, which was ﬁrst observed and
empirically validated for GANs (Denton et al., 2019). A counterfactual sample can subsequently be
obtained by simply pushing forward the counterfactual latent through G:"
SIMULATING TREATMENTS VIA LATENT COUNTERFACTUAL MANIPULATIONS,0.20920502092050208,"x(i; do(mc = 1)) = G(z(i; do(mc = 1))).
(2)"
SIMULATING TREATMENTS VIA LATENT COUNTERFACTUAL MANIPULATIONS,0.21338912133891214,Figure 2 shows an illustration of our counterfactual manipulation strategy.
QUANTIFYING TREATMENT EFFECTS VIA PROXY CLASSIFIERS,0.2175732217573222,"3.3
QUANTIFYING TREATMENT EFFECTS VIA PROXY CLASSIFIERS"
QUANTIFYING TREATMENT EFFECTS VIA PROXY CLASSIFIERS,0.2217573221757322,"Equations (3.2-2) deﬁne the geometric manipulations required to obtain interventional samples
x(i; do(mc = 1)) from a generative model, G. However, in order to estimate treatment effects,
we require an estimate of the presence or absence of the effect attribute, me, for the counterfactuals.
To this end, we propose the use of binary classiﬁers trained to detect the presence of an effect vari-
able. These classiﬁers can be trained directly in the latent space and serve to measure the effect of
intervening on the treatment attribute mc for an individual x(i) be quantiﬁed as:"
QUANTIFYING TREATMENT EFFECTS VIA PROXY CLASSIFIERS,0.22594142259414227,"me(i; do(mc = 1)) = φe (z(i; do(mc = 1))) .
(3)"
QUANTIFYING TREATMENT EFFECTS VIA PROXY CLASSIFIERS,0.2301255230125523,"Alternatively, we can train another probabilistic classiﬁer ψe : X →[0, 1] that classiﬁes the coun-
terfactual generations in Equation (2). In this manner, we can then quantify the effect of intervening
on the treatment attribute mc for an individual x(i) as:"
QUANTIFYING TREATMENT EFFECTS VIA PROXY CLASSIFIERS,0.23430962343096234,"me(i; do(mc = 1)) = ψe (x(i; do(mc = 1))) .
(4)"
QUANTIFYING TREATMENT EFFECTS VIA PROXY CLASSIFIERS,0.2384937238493724,"For simplicity, we use latent space classiﬁers for quantifying treatment effects, as in Equation (3).
We can deﬁne the generative individual treatment effect (GITE) estimate τGITE as:"
QUANTIFYING TREATMENT EFFECTS VIA PROXY CLASSIFIERS,0.24267782426778242,"τGITE(mc →me) = me(i; do(mc = 1)) −me(i; do(mc = 0)).
(5)"
QUANTIFYING TREATMENT EFFECTS VIA PROXY CLASSIFIERS,0.24686192468619247,"Taking an expectation over the generated examples, we get an estimate for the generative average
treatment effect (GATE) of mc on me as:"
QUANTIFYING TREATMENT EFFECTS VIA PROXY CLASSIFIERS,0.2510460251046025,"τGATE(mc →me) = Ei [me(i; do(mc = 1)) −me(i; do(mc = 0))]
(6)"
QUANTIFYING TREATMENT EFFECTS VIA PROXY CLASSIFIERS,0.25523012552301255,"As we can see from Equation (6), the correctness of our estimate relies on a number of assumptions.
In addition to standard assumptions from causality (unconfoundedness, positivity, SUTVA), the
quality of the generative model and classiﬁers play an important role. For the generative model, we
designed our counterfactual manipulation scheme assuming that the latent space is linearly separable
in the attributes of interest. Further, implicit in our framework is the assumption that the generative
model can generalize outside the training set to include the support of the counterfactual distribution.
On the use of classiﬁers, we need accurate and calibrated classiﬁers (ideally, Bayes optimal) for both
manipulating latent vectors and quantifying treatment effects. While it is impossible to test in—full
veracity— the above assumptions on real-world distributions, there is signiﬁcant empirical evidence
in the last few years that suggest that modern deep generative models and classiﬁers can indeed
satisfy the above requirements for many practical usecases (Denton et al., 2019; Brown et al., 2020).
The theoretical properties and these necessary assumptions of CAGE are further discussed in §A."
QUANTIFYING TREATMENT EFFECTS VIA PROXY CLASSIFIERS,0.2594142259414226,"∆τ as a measure of causal direction.
Finally, we note that the preceding sections have focused
on the challenge of quantifying if a variable, mc, has a causal effect on second variable, me. This
assumes knowledge of the causal ordering over variables and maybe considered a special case of the
more general causal discovery problem. As such, we can extend our approach to deﬁne a measure
of causal direction over any pair of variables by considering the difference in absolute generative
ATE scores when either variable is considered as the treatment:"
QUANTIFYING TREATMENT EFFECTS VIA PROXY CLASSIFIERS,0.26359832635983266,"∆τ =| τGATE(mc →me) | −| τGATE(me →mc) |
(7)"
QUANTIFYING TREATMENT EFFECTS VIA PROXY CLASSIFIERS,0.26778242677824265,"The ∆τ score determines the magnitude of the difference in outcomes when either attribute is pre-
scribed as the treatment. Intuitively, when using the true causal attribute, according to G, as the"
QUANTIFYING TREATMENT EFFECTS VIA PROXY CLASSIFIERS,0.2719665271966527,Under review as a conference paper at ICLR 2022
QUANTIFYING TREATMENT EFFECTS VIA PROXY CLASSIFIERS,0.27615062761506276,"4
2
0
2
4 4 2 0 2 4 6"
QUANTIFYING TREATMENT EFFECTS VIA PROXY CLASSIFIERS,0.2803347280334728,"Samples colored by causal attribute, mc"
QUANTIFYING TREATMENT EFFECTS VIA PROXY CLASSIFIERS,0.28451882845188287,Samples with causal attribute mc(i) = 1
QUANTIFYING TREATMENT EFFECTS VIA PROXY CLASSIFIERS,0.28870292887029286,Samples with causal attribute mc(i) = 0
QUANTIFYING TREATMENT EFFECTS VIA PROXY CLASSIFIERS,0.2928870292887029,"0.020
0.015
0.010
0.005
0.000
0.005
0.010
0.015
0.020
Estimated ATE 0 20 40 60 80 100 120"
QUANTIFYING TREATMENT EFFECTS VIA PROXY CLASSIFIERS,0.29707112970711297,"Estimated ATE scores (
= 1)"
QUANTIFYING TREATMENT EFFECTS VIA PROXY CLASSIFIERS,0.301255230125523,"ATE score
ATE under null, H0"
QUANTIFYING TREATMENT EFFECTS VIA PROXY CLASSIFIERS,0.3054393305439331,p-value: 0.0
QUANTIFYING TREATMENT EFFECTS VIA PROXY CLASSIFIERS,0.30962343096234307,"1
2
3
4
5
6
7
8
9
10 11 12 13 14 15 16 17 18 19 20 0.025 0.030 0.035 0.040 0.045"
