Section,Section Appearance Order,Paragraph
ABSTRACT,0.0,ABSTRACT
ABSTRACT,0.0027472527472527475,"Deep neural networks can approximate functions on different types of data, from
images to graphs, with varied underlying structure. This underlying structure can
be viewed as the geometry of the data manifold. By extending recent advances
in the theoretical understanding of neural networks, we study how a randomly
initialized neural network with piecewise linear activation splits the data manifold
into regions where the neural network behaves as a linear function. We derive
bounds on the number of linear regions and the distance to boundaries of these
linear regions on the data manifold. This leads to insights into the expressivity
of randomly initialized deep neural networks on non-Euclidean data sets. We
empirically corroborate our theoretical results using a toy supervised learning
problem. Our experiments demonstrate that number of linear regions varies across
manifolds and how our results hold upon changing neural network architectures.
We further demonstrate how the complexity of linear regions changes on the low
dimensional manifold of images as training progresses, using the MetFaces dataset."
INTRODUCTION,0.005494505494505495,"1
INTRODUCTION"
INTRODUCTION,0.008241758241758242,"The capacity of Deep Neural Networks (DNNs) to approximate arbitrary functions given sufﬁcient
training data in the supervised learning setting is well known (Cybenko, 1989; Hornik et al., 1989;
Anthony & Bartlett, 1999). Several different theoretical approaches have emerged that study the
effectiveness and pitfalls of deep learning. These studies vary in their treatment of neural networks
and the aspects they study range from convergence (Allen-Zhu et al., 2019; Goodfellow & Vinyals,
2015), generalization (Kawaguchi et al., 2017; Zhang et al., 2017; Jacot et al., 2018; Sagun et al.,
2018), function complexity (Montúfar et al., 2014; Mhaskar & Poggio, 2016), adversarial attacks
(Szegedy et al., 2014; Goodfellow et al., 2015) to representation capacity (Arpit et al., 2017). Some
recent theories have also been shown to closely match empirical observations (Poole et al., 2016;
Hanin & Rolnick, 2019b; Kunin et al., 2020)."
INTRODUCTION,0.01098901098901099,"One approach for studying DNNs is to examine how the underlying structure, or geometry, of the
data interacts with learning dynamics. The manifold hypothesis states that high-dimensional real
world data typically lies on a low dimensional manifold (Tenenbaum, 1997; Carlsson et al., 2007;
Fefferman et al., 2013). Studies have shown that DNNs are highly effective in deciphering this
underlying structure by learning intermediate latent representations (Poole et al., 2016). The ability
of DNNs to “ﬂatten” complex data manifolds, using composition of seemingly simple piece-wise
linear functions, appears to be unique (Brahma et al., 2016; Hauser & Ray, 2017)."
INTRODUCTION,0.013736263736263736,"DNNs with piecewise linear activations, such as ReLU (Nair & Hinton, 2010), divide the input space
into linear regions, wherein the DNN behaves as a linear function (Montúfar et al., 2014). The density
of these linear regions serves as a proxy for the DNN’s ability to interpolate a complex data landscape
and has been the subject of detailed studies (Montúfar et al., 2014; Telgarsky, 2015; Serra et al.,
2018; Raghu et al., 2017). The work by Hanin & Rolnick (2019a) on this topic stands out because
they derive bounds on the average number of linear regions, as opposed to worst case bounds, and
verify the tightness of these bounds empirically for deep ReLU networks. Hanin & Rolnick (2019a)
conjecture that the number of linear regions correlates to the expressive power of randomly initialized
DNNs with piecewise linear activations. However, they assume that the data is uniformly sampled
from the Euclidean space Rd, for some d. By combining the manifold hypothesis with insights from
Hanin & Rolnick (2019a), we are able to go further in estimating the the number of linear regions"
INTRODUCTION,0.016483516483516484,Under review as a conference paper at ICLR 2022
INTRODUCTION,0.019230769230769232,"and the average distance from linear boundaries. We derive bounds on how the geometry of the data
manifold affects the aforementioned quantities."
INTRODUCTION,0.02197802197802198,"To corroborate our theoretical bounds with empirical results, we design a toy problem where the
input data is sampled from two distinct manifolds that can be represented in a closed form. We
count the exact number of linear regions on these two manifolds that a randomly initialized neural
network splits them into. We also observe the average distance to the boundaries of linear regions.
We demonstrate how the number of linear regions varies for two distinct manifolds in our setting.
These results show that the number of linear regions on the manifold do not grow exponentially with
the dimension of input data. Our experiments do not provide estimates for theoretical constants, as
is the case in deep learning theory, but demonstrate that the number of linear regions change as a
consequence of these constants. We also study high dimensional data that lies on low dimensional
manifolds with unknown structure and how the number of linear regions vary on and off this manifold,
which is a more realistic setting. To achieve this we present experiments performed on the manifold
of natural images. We sample data from the image manifold using a generative adversarial network
(GAN) (Goodfellow et al., 2014) trained on the curated images of paintings. Speciﬁcally, we generate
images using the pre-trained StyleGAN (Karras et al., 2019; 2020b) trained on the curated MetFaces
dataset (Karras et al., 2020a). We also assign random labels to the images in the dataset and train a
deep ReLU network in a supervised manner, a scenario in which it would overﬁt (Zhang et al., 2017).
We generate curves on the image manifold of faces, using StyleGAN, and show how overﬁtting is
reﬂected in the density of linear regions of the aforementioned deep ReLU network."
PRELIMINARIES AND BACKGROUND,0.024725274725274724,"2
PRELIMINARIES AND BACKGROUND"
PRELIMINARIES AND BACKGROUND,0.027472527472527472,"Our goal is to understand how the underlying structure of real world data matters for deep learning.
We ﬁrst provide the mathematical background required to model this underlying structure as the
geometry of data. We then provide a summary of previous work on understanding the approximation
capacity of deep ReLU networks via the complexity of linear regions. For the details on how our
work ﬁts into the theory of DNNs we refer the reader to Appendix C."
DATA MANIFOLD AND DEFINITIONS,0.03021978021978022,"2.1
DATA MANIFOLD AND DEFINITIONS"
DATA MANIFOLD AND DEFINITIONS,0.03296703296703297,"We use the example of the MetFaces dataset (Karras et al., 2020a) to illustrate how data lies on a low
dimensional manifold. The images in the dataset are 1028 × 1028 × 3 dimensional. By contrast,
the number of realistic dimensions along which they vary are limited, e.g. painting style, artist, size
and shape of the nose, jaw and eyes, background, clothing style; in fact, very few 1028 × 1028 × 3
dimensional images correspond to realistic faces. We illustrate how this affects the possible variations
in the data in Figure 1."
DATA MANIFOLD AND DEFINITIONS,0.03571428571428571,"A manifold formalises the notion of limited variations in high dimensional data. One can imagine
that there exists an unknown function f : X →Y from a low dimensional space of variations, to a
high dimensional space of the actual data points. Such a function f : X →Y , from one open subset
X ⊂Rm, to another open subset Y ⊂Rk, is a diffeomorphism if f is bijective, and both f and f −1
are differentiable, also referred to as smooth. Therefore, a manifold is deﬁned as follows."
DATA MANIFOLD AND DEFINITIONS,0.038461538461538464,"Deﬁnition 2.1. Let k, m ∈N0. A subset M ⊂Rk is called a smooth m-dimensional submanifold
of Rk (or m-manifold in Rk) iff every point x ∈M has an open neighborhood U ⊂Rk such that
U ∩M is diffeomorphic to an open subset Ω⊂Rm. A diffeomorphism (i.e. differentiable mapping),"
DATA MANIFOLD AND DEFINITIONS,0.04120879120879121,f : U ∩M →Ω
DATA MANIFOLD AND DEFINITIONS,0.04395604395604396,"is called a coordinate chart of M and the inverse,"
DATA MANIFOLD AND DEFINITIONS,0.046703296703296704,h := f −1 : Ω→U ∩M
DATA MANIFOLD AND DEFINITIONS,0.04945054945054945,is called a smooth parametrization of U ∩M.
DATA MANIFOLD AND DEFINITIONS,0.0521978021978022,"For the MetFaces dataset example, suppose there are 10 dimensions along which the images vary.
Further assume that each variation can take a value continuously in some interval of R. Then the
smooth parametrization would map f : Ω∩R10 →M ∩R1028×1028×3. This parametrization and its
inverse are unknown in general, and computationally very difﬁcult to estimate in practice."
DATA MANIFOLD AND DEFINITIONS,0.054945054945054944,Under review as a conference paper at ICLR 2022
DATA MANIFOLD AND DEFINITIONS,0.057692307692307696,"Figure 1: A visualization of how the 2D surface, here represented by a 2-torus, is embedded in a
larger input space, R3. Suppose each point corresponds to an image of the face on this 2-torus. We
can chart two curves: one straight line cutting across the 3D space and another curve that stays on the
torus. The images corresponding to the points on the torus will have a smoother variation in style and
shape whereas there will be images corresponding to points on the straight line that do not belong to
the class of pictures of faces."
DATA MANIFOLD AND DEFINITIONS,0.06043956043956044,"There are similarities in how geometric elements are deﬁned for manifolds and Euclidean spaces. A
smooth curve, on a manifold M, γ : I →M is deﬁned from an interval I to the manifold M as a
function that is differentiable for all t ∈I, just as is done for Euclidean spaces. The shortest such
curve between two points on a manifold is no longer a straight line, but is instead a geodesic. One
recurring geometric element, which is unique to manifolds and stems from the deﬁnition of smooth
curves, is that of a tangent space, deﬁned as follows.
Deﬁnition 2.2. Let M be an m-manifold in Rk and x ∈M be a ﬁxed point. A vector v ∈Rk is called
a tangent vector of M at x if there exists a smooth curve γ : I →M such that γ(0) = x, ˙γ(0) = v
where ˙γ(t) is the derivative of γ at t. The set"
DATA MANIFOLD AND DEFINITIONS,0.06318681318681318,"TxM := {˙γ(0)|γ : R →M is smoothγ(0) = x},"
DATA MANIFOLD AND DEFINITIONS,0.06593406593406594,of tangent vectors of M at x is called the tangent space of M at x.
DATA MANIFOLD AND DEFINITIONS,0.06868131868131869,"In simpler terms, the plane tangent to the manifold M at point x is called the tangent space and
denoted by by TxM. Consider the upper half of a 2-sphere, S2 ⊂R3, which is a 2-manifold in R3.
The tangent space at a ﬁxed point x ∈S2 is the 2D plane perpendicular to the vector x and tangential
to the surface of the sphere that contains the point x. We refer to these concepts in the text that
follows. For additional background on manifolds we refer the reader to Appendix B."
LINEAR REGIONS OF DEEP RELU NETWORKS,0.07142857142857142,"2.2
LINEAR REGIONS OF DEEP RELU NETWORKS"
LINEAR REGIONS OF DEEP RELU NETWORKS,0.07417582417582418,"We consider a neural network, F, which is a composition of activation functions. Inputs at each layer
are multiplied by a matrix, referred to as the weight matrix, with an additional bias vector that is
added to this product. We limit our study to ReLU activation function (Nair & Hinton, 2010), which
is piece-wise linear and one of the most popular activation functions being applied to various learning
tasks on different types of data like text, images, signals etc. We further consider DNNs that map
inputs, of dimension nin, to scalar values, i.e. values in R. Therefore, F : Rnin →R is deﬁned as,"
LINEAR REGIONS OF DEEP RELU NETWORKS,0.07692307692307693,"F(x) = WLσ(BL−1 + WL−1σ(...σ(B1 + W1x))),
(1)"
LINEAR REGIONS OF DEEP RELU NETWORKS,0.07967032967032966,"where Wl ∈Mnl×nl−1 is the weight matrix for the lth hidden layer, nl is the number of neurons in
the lth hidden layer, Bl ∈Rnl is the vector of biases for the lth hidden layer, n0 = nin and σ : R →R"
LINEAR REGIONS OF DEEP RELU NETWORKS,0.08241758241758242,Under review as a conference paper at ICLR 2022
LINEAR REGIONS OF DEEP RELU NETWORKS,0.08516483516483517,"is the activation function. For a neuron z in the lth layer we denote the pre-activation of this neuron,
for given input x ∈Rnin, as zl(x). For a neuron z in the layer l we have"
LINEAR REGIONS OF DEEP RELU NETWORKS,0.08791208791208792,"z(x) = Wl−1,zσ(...σ(B1 + W1,zx)),"
LINEAR REGIONS OF DEEP RELU NETWORKS,0.09065934065934066,"for l > 1 (for the base case l = 1 we have z(x) = W1,zx) where Wl−1,z is the row of weights, in the
weight matrix of the lth layer, Wl, corresponding to the neuron z. We use Wz to denote the weight
vector for brevity, omitting the layer index l in the subscript. We also use bz to denote the bias term
for the neuron z."
LINEAR REGIONS OF DEEP RELU NETWORKS,0.09340659340659341,"Neural networks with piecewise linear activations are piecewise linear on the input space (Montúfar
et al., 2014). Suppose for some ﬁxed y ∈Rnin as x →y if we have z(x) →−bz then we observe a
discontinuity in the gradient ∇xσ(bz + Wzz(x)) at y. Intuitively, this is because x is approaching
the boundary of the linear region of the function deﬁned by the output of z. Therefore, the boundary
of linear regions, for a feed forward neural network F, is deﬁned as:"
LINEAR REGIONS OF DEEP RELU NETWORKS,0.09615384615384616,BF = {x|∇F(x) is not continuous at x}.
LINEAR REGIONS OF DEEP RELU NETWORKS,0.0989010989010989,"Hanin & Rolnick (2019a) argue that an important generalization for the approximation capacity
of a neural network F is the (nin −1)−dimensional volume density of linear regions deﬁned as
volnin−1(BF ∩K)/volnin(K), for a bounded set K ⊂Rnin. This quantity serves as a proxy for
density of linear regions and therefore the expressive capacity of DNNs. Intuitively, higher density of
linear boundaries means higher capacity of the DNN to approximate complex non-linear functions.
The quantity is applied to lower bound the distance between a point x ∈K and the set BF , which is"
LINEAR REGIONS OF DEEP RELU NETWORKS,0.10164835164835165,"distance(x, BF ) =
min
neurons z |z(x) −bz|/||∇z(x)||,"
LINEAR REGIONS OF DEEP RELU NETWORKS,0.1043956043956044,"which measures the sensitivity over neurons at a given input. The above quantity measures how “far”
the input is from ﬂipping any neuron from inactive to active or vice-versa."
LINEAR REGIONS OF DEEP RELU NETWORKS,0.10714285714285714,"Informally, Hanin & Rolnick (2019a) provide two main results for a randomly initialized DNN F,
with a reasonable initialisation. Firstly, they show that"
LINEAR REGIONS OF DEEP RELU NETWORKS,0.10989010989010989,"E
hvolnin−1(BF ∩K)"
LINEAR REGIONS OF DEEP RELU NETWORKS,0.11263736263736264,volnin(K)
LINEAR REGIONS OF DEEP RELU NETWORKS,0.11538461538461539,"i
≈#{ neurons},"
LINEAR REGIONS OF DEEP RELU NETWORKS,0.11813186813186813,"meaning the density of linear regions is bound above and below by some constant times the number
of neurons. Secondly, for x ∈[0, 1]nin,"
LINEAR REGIONS OF DEEP RELU NETWORKS,0.12087912087912088,"E
h
distance(x, BF )
i
≥C#{ neurons}−1,"
LINEAR REGIONS OF DEEP RELU NETWORKS,0.12362637362637363,"where C > 0 depends on the distribution of biases and weights, in addition to other factors. Meaning
that the distance to the nearest boundary is bounded above and below by a constant times the inverse
of the number of neurons. These results stand in contrast to earlier worst case bounds that are
exponential in the number of neurons. Hanin & Rolnick (2019a) also verify these results empirically
to note that the constants lie in the vicinity of 1 throughout training."
LINEAR REGIONS ON THE DATA MANIFOLD,0.12637362637362637,"3
LINEAR REGIONS ON THE DATA MANIFOLD"
LINEAR REGIONS ON THE DATA MANIFOLD,0.12912087912087913,"One important assumption in the results presented by Hanin & Rolnick (2019a) is that the input, x,
lies in a compact set K ⊂Rnin and that volnin(K) is greater than 0. Also, the theorem pertaining to
the lower bound on average distance of x to linear boundaries the input assumes the input uniformly
distributed in [0, 1]nin. As noted earlier, high-dimensional real world datasets, like images, lie on low
dimensional manifolds, therefore both these assumptions are false in practice. Therefore, we study
the case where the data lies on some m−dimensional submanifold of Rnin, i.e. M ⊂Rnin where
m ≪nin. We illustrate how this additional constraint effects the study of linear regions in Figure 2."
LINEAR REGIONS ON THE DATA MANIFOLD,0.13186813186813187,"As introduced by Hanin & Rolnick (2019a), we denote the “(nin −k)−dimensional piece” of
BF as BF,k. More precisely, BF,0 = ∅and BF,k is recursively deﬁned to be the set of points
x ∈BF \ {BF,0 ∪... ∪BF,k−1} with the added condition that in a neighbourhood of x the set BF,k
coincides with hyperplane of dimension nin −k. In our setting, where the data lies on a manifold M,
we deﬁne B′
F,k as BF,k ∩M, and note that dim(B′
F,k) = m −k (Appendix E Proposition 6). For"
LINEAR REGIONS ON THE DATA MANIFOLD,0.1346153846153846,Under review as a conference paper at ICLR 2022
LINEAR REGIONS ON THE DATA MANIFOLD,0.13736263736263737,"Figure 2: A circle is an example of a 1D manifold in a 2D Euclidean space. The effective number of
linear regions on the manifold, the upper half of the circle, are the number of linear regions on the
arc from −π to π. In the diagram above, each color in the 2D space corresponds to a linear region.
When the upper half of the circle is ﬂattened into a 1D space we obtain a line. Each color on the line
corresponds to a linear region of the 2D space."
LINEAR REGIONS ON THE DATA MANIFOLD,0.1401098901098901,"example, the transverse intersection (see Deﬁnition E.1) of a plane in 3D with the 2D manifold S2
is a 1D curve in S2 and therefore has dimension 1. Therefore, B′
F,k is a submanifold of dimension
3 −2 = 1. This imposes the restriction k ≤m, for the intersection BF,k ∩M to have a well deﬁned
volume."
LINEAR REGIONS ON THE DATA MANIFOLD,0.14285714285714285,"We ﬁrst note that the deﬁnition of the determinant of the Jacobian, for a collection of neurons
z1, ..., zk, is different in the case when the data lies on a manifold M as opposed to in a compact set
of dimension nin in Rnin. Since the determinant of the Jacobian is the quantity we utilise in our proofs
and theorems repeatedly we will use the term Jacobian to refer to it for succinctness. Intuitively,
this follows from the Jacobian of a function being deﬁned differently in the ambient space Rnin as
opposed to the manifold M. In case of the former it is the volume of the paralellepiped determined
by the vectors corresponding to the directions with steepest ascent along each one of the nin axes. In
case of the latter it is more complex and deﬁned below. Let Hm be the m−dimensional Hausdorff
measure (we refer the reader to the Appendix B for background on Hausdorff measure). The Jacobian
of a function on manifold M, as deﬁned by Krantz & Parks (2008) (Chapter 5), is as follows
Deﬁnition 3.1. The (determinant of) Jacobian of a function H : M →Rk, where k ≤dim(M) =
m, is deﬁned as"
LINEAR REGIONS ON THE DATA MANIFOLD,0.14560439560439561,"JM
k,H(x) = sup
nHk(DMH(P)) Hk(P)"
LINEAR REGIONS ON THE DATA MANIFOLD,0.14835164835164835,"P is a k-dimensional parallelepiped contained in TxM.
o
,"
LINEAR REGIONS ON THE DATA MANIFOLD,0.1510989010989011,"where DM : TxM →Rk is the differential map (see Appendix B) and we use DMH(P) to denote
the mapping of the set P in TxM, which is a parallelepiped, to Rk. The supremum is taken over all
parallelepipeds P."
LINEAR REGIONS ON THE DATA MANIFOLD,0.15384615384615385,"We also say that neurons z1, ..., zk are good at x if there exists a path of neurons from z to the output
in the computational graph of F so that each neuron is activated along the path. Our three main
results that hold under the assumptions listed in Appendix A, each of which extend and improve upon
the theoretical results by Hanin & Rolnick (2019a), are:
Theorem 1. Given F a feed-forward ReLU network with input dimension nin, output dimension 1,
and random weights and biases. Then for any bounded measurable submanifold M ⊂Rnin and any
k = 1, ...., m the average (m −k)−dimensional volume of BF,k inside M,"
LINEAR REGIONS ON THE DATA MANIFOLD,0.1565934065934066,"E[volm−k(BF,k ∩M)] =
X"
LINEAR REGIONS ON THE DATA MANIFOLD,0.15934065934065933,"distinct neurons z1,...,zk in F Z"
LINEAR REGIONS ON THE DATA MANIFOLD,0.1620879120879121,"M
E[Yz1,...,zk]dvolm(x),
(2)"
LINEAR REGIONS ON THE DATA MANIFOLD,0.16483516483516483,"where Yz1,...,zk is JM
m,Hk(x)ρb1,...,bk(z1(x), ..., zk(x)), times the indicator function of the event that
zj is good at x for each j = 1, ..., k. Here the function ρbz1,...,bzk is the density of the joint distribution
of the biases bz1, ..., bzk."
LINEAR REGIONS ON THE DATA MANIFOLD,0.16758241758241757,Under review as a conference paper at ICLR 2022
LINEAR REGIONS ON THE DATA MANIFOLD,0.17032967032967034,"This change in the formula, from Theorem 3 by Hanin & Rolnick (2019a), is a result of the fact that
z(x) has a different direction of steepest ascent when it is restricted to the data manifold M, for any j.
The proof is presented in Appendix E. Formula 2 also makes explicit the fact that the data manifold
has dimension m ≤nin and therefore the m−k-dimensional volume is a more representative measure
of the linear boundaries. Equipped with Theorem 1, we provide a result for the density of linear
regions on manifold M.
Theorem 2. For data sampled uniformly from a compact and measurable m dimensional manifold
M we have the following result for all k ≤m:"
LINEAR REGIONS ON THE DATA MANIFOLD,0.17307692307692307,"volm−k(BF,k ∩M)"
LINEAR REGIONS ON THE DATA MANIFOLD,0.17582417582417584,"volm(M)
≤

# neurons
k"
LINEAR REGIONS ON THE DATA MANIFOLD,0.17857142857142858,"
(2CgradCbiasCM)k,"
LINEAR REGIONS ON THE DATA MANIFOLD,0.1813186813186813,"where Cgrad depends on ||∇z(x)|| and the DNN’s architecture, CM depends on the geometry of M,
and Cbias on the distribution of biases ρb."
LINEAR REGIONS ON THE DATA MANIFOLD,0.18406593406593408,"The constant CM is the supremum over the matrix norm of projection matrices onto the tangent space,
TxM, at any point x ∈M. For the Euclidean space CM is always equal to 1 and therefore the term
does not appear in the work by Hanin & Rolnick (2019a), but we cannot say the same for our setting.
We refer the reader to Appendix F for the proof, further details, and interpretation. Finally, under
that added assumptions that the diameter of the manifold M is ﬁnite and M has polynomial volume
growth we provide a lower bound on the average distance to the linear boundary for points on the
manifold and how it depends on the geometry and dimensionality of the manifold.
Theorem 3. For any point, x, chosen randomly from M, we have:"
LINEAR REGIONS ON THE DATA MANIFOLD,0.18681318681318682,"E[distanceM(x, BF ∩M)] ≥
CM,κ
CgradCbiasCM#neurons"
LINEAR REGIONS ON THE DATA MANIFOLD,0.18956043956043955,"where CM,κ depends on the scalar curvature and dimensionality of the manifold M. The function
distanceM is the distance on the manifold M."
LINEAR REGIONS ON THE DATA MANIFOLD,0.19230769230769232,"This result gives us intuition on how the density of linear regions around a point depends on the
geometry of the manifold. Note that the constant CM is the same as in Theorem 2. Another difference
to note is that we derive a lower bound on the geodesic distance on the manifold M and not the
Euclidean distance in Rk as done by Hanin & Rolnick (2019a). This distance better captures the
distance between data points on a manifold while incorporating the underlying structure. In other
words, this distance can be understood as how much a data point should change to reach a linear
boundary while ensuring that all the individual points on the curve, tracing this change, are “valid”
data points. We provide proof for the above theorem in Appendix G. For background on curvature of
manifolds and a proof sketch we refer the reader to the Appendices B and D, respectively."
INTUITION FOR THEORETICAL RESULTS,0.19505494505494506,"3.1
INTUITION FOR THEORETICAL RESULTS"
