Section,Section Appearance Order,Paragraph
INTUITION FOR THEORETICAL RESULTS,0.1978021978021978,"One of the key ingredients of the proofs by Hanin & Rolnick (2019a) is the co-area formula.1 The
co-area formula is applied to get a closed form representation of the k−dimensional volume of
the region where any set of k neurons, z1, z2, ..., zk is “good” in terms of the expectation over the
Jacobian, in the Euclidean space. Instead of the co-area formula we use the smooth co-area formula, 2
to get a closed form representation of the m −k−dimensional volume of the region intersected with
manifold, M, in terms of the Jacobian deﬁned on a manifold (Deﬁnition 3.1). The key difference
between the two formulas is that in the smooth co-area formula the Jacobian (of a function from
the manifold M) is “restricted” to the tangent plane. While the determinant of the vanilla Jacobian
measures the distortion of volume around a point in Euclidean space the determinant of the Jacobian
deﬁned as above (Deﬁnition 3.1) measures the distortion of volume on the manifold instead for the
function with the same domain, the function that is 1 if the set of neurons are good and 0 otherwise."
INTUITION FOR THEORETICAL RESULTS,0.20054945054945056,"The value of the determinant as deﬁned in 3.1 has the same volume as the projection of the paral-
lelepiped deﬁned by the gradients ∇z(x) onto the tangent space (see Proposition 8). This introduces
the constant CM, deﬁned above. Essentially, the constant captures how the magnitude of the gra-
dients, ∇z(x), are modiﬁed upon being projected to the tangent plane. Certain manifolds “shrink”"
INTUITION FOR THEORETICAL RESULTS,0.2032967032967033,"1https://en.wikipedia.org/wiki/Coarea_formula
2https://en.wikipedia.org/wiki/Smooth_coarea_formula"
INTUITION FOR THEORETICAL RESULTS,0.20604395604395603,Under review as a conference paper at ICLR 2022
INTUITION FOR THEORETICAL RESULTS,0.2087912087912088,"(a)
(b)"
INTUITION FOR THEORETICAL RESULTS,0.21153846153846154,"Figure 3: The tractrix (a) and circle (b) are plotted in grey on the x-y plane, which are the 1D input
data manifolds. The target function is in blue, on the z-axis, and periodic in nature."
INTUITION FOR THEORETICAL RESULTS,0.21428571428571427,"vectors upon projection to the tangent plane more than others, on an average, which is a function of
their geometry. We illustrate of how two distinct manifolds “shrink” the gradients differently upon
projection to the tangent plane and it is reﬂected in the number of linear regions on the manifolds
(see Figure 11 in the appendix). We provide intuition for the curvature of a manifold in Appendix B,
due to space constraints, which is used in the lower bound for the average distance in Theorem 3."
EXPERIMENTS,0.21703296703296704,"4
EXPERIMENTS"
SUPERVISED LEARNING ON TOY DATASET,0.21978021978021978,"4.1
SUPERVISED LEARNING ON TOY DATASET"
SUPERVISED LEARNING ON TOY DATASET,0.22252747252747251,"To empirically corroborate our theoretical results, we calculate the number of linear regions and
average distance to the linear boundary, bounds for which are presented in the theorems above, on a
regression task for two different manifolds. To achieve this we deﬁne two similar regression tasks
where the data is sampled from two different manifolds with different geometries. We parameterize
the ﬁrst task, a unit circle without its north and south poles, by ψcircle : (−π, π) →R2 where
ψcircle(θ) = (cos θ, sin θ) and θ is the angle made by the vector from the origin to the point with
respect to the x-axis. We set the target function for regression task to be a periodic function in θ.
The target is deﬁned as z(θ) = a sin(νθ) where a is the amplitude and ν is the frequency (Figure 3).
DNNs have difﬁculty learning periodic functions (Ziyin et al., 2020). The motivation behind this is to
present the DNN with a challenging task where it has to learn the underlying structure of the data.
Moreover the DNN will have to split the circle into linear regions. For the second regression task, a
tractrix is parametrized by ψtractrix : R1 →R2 where ψtractrix(y) = (t −tanh t, sech t) (see Figure 3).
We assign a target function z(t) = a sin(νt). For the purposes of our study we restrict the domain of
ψtractrix to (−3, 3). This allows us to observe effects of varying data geometry across the manifolds."
SUPERVISED LEARNING ON TOY DATASET,0.22527472527472528,"The results, averaged over 20 runs, are presented in Figures 4 and 5. We note that CM is smaller
for Sphere (based on Figure 4) and the curvature is positive whilst CM is larger for tractrix and the
curvature is negative. Both of these constants (curvature and CM) contribute to the lower bound
in Theorem 3. Similarly, we show results of number of linear regions divided by the number of
neurons upon changing architectures, consequently the number of neurons, for the two manifolds
in Figure 8, averaged over 30 runs. Note that this experiment observes the effect of CM × Cgrad,
since changing the architecture also changes Cgrad. Although this variation in Cgrad is quite low in
magnitude as observed empirically by Hanin & Rolnick (2019a). The empirical observations are
consistent with our theoretical results. We observe that the number of linear regions starts off close to
#neurons and remains close throughout the training process for both the manifolds. This supports
our theoretical results (Theorem 2) that the constant CM, which is distinct across the two manifolds,
affects the number of linear regions throughout training. The tractrix has a higher value of CM and
that is reﬂected in the results. This is due to different “shrinking” of vectors upon being projected to
the tangent space as discussed in Section 3.1."
SUPERVISED LEARNING ON TOY DATASET,0.22802197802197802,Under review as a conference paper at ICLR 2022
SUPERVISED LEARNING ON TOY DATASET,0.23076923076923078,"Figure 4: Graph of number of linear regions for
tractrix (blue) and sphere (orange). The shaded
regions represent one standard deviation. Note
that the number of neurons is 26 and the number
of linear regions is comparable but different for
both the manifolds."
SUPERVISED LEARNING ON TOY DATASET,0.23351648351648352,"Figure 5: Graph of distance to linear regions for
tractrix (blue) and sphere (orange). The distances
are normalized by the maximum distance on the
range, for both tractrix and sphere. The shaded
regions represent one standard deviation."
SUPERVISED LEARNING ON TOY DATASET,0.23626373626373626,"Figure 6: We observe that as the dimension nin is
increased, while keeping the manifold dimension
constant, the number of linear regions remains
proportional to number of neurons (26)."
SUPERVISED LEARNING ON TOY DATASET,0.23901098901098902,"Figure 7: We observe that as the dimension nin is
increased, while keeping the manifold dimension
constant, the average distance varies very little."
SUPERVISED LEARNING ON TOY DATASET,0.24175824175824176,"Figure 8: The effects of changing the architecture
on the number of linear regions. We observe that
the value of CM effects the number of linear re-
gions proportionally. The number of hidden units
for three layer networks are in the legend along
with the data manifold."
SUPERVISED LEARNING ON TOY DATASET,0.2445054945054945,"Figure 9: We observe that the log density of num-
ber of linear regions is lower on the manifold
(blue) as compared to off the manifold (green).
As training progresses, in contrast to previous
examples with generalization, the log density de-
creases."
SUPERVISED LEARNING ON TOY DATASET,0.24725274725274726,Under review as a conference paper at ICLR 2022
VARYING NIN,0.25,"4.2
VARYING nIN"
VARYING NIN,0.25274725274725274,"To empirically corroborate the results of Theorems 2 and 3 we vary the dimension nin while keeping
m constant. We achieve this by counting the number of linear regions and the average distance to
boundary region on the 1D circle as we vary the input dimension in steps of 5. We draw samples of 1D
circles in Rnin by randomly choosing two perpendicular basis vectors. We then train a neural network
with the same architecture as in the previous section on the periodic target function (a sin(νθ)) as
deﬁned above. The results in Figure 6 shows that the quantities stay proportional to #neurons, and
do not vary as nin is increased, as predicted by our theoretical results. This stands in contrast to the
results by Hanin & Rolnick (2019a) where the upper and lower bounds both grow exponentially with
nin for the number of linear regions in a compact set of Rnin. We provide implementation details in
Appendix H."
VARYING NIN,0.2554945054945055,"4.3
METFACES: HIGH DIMENSIONAL DATASET"
VARYING NIN,0.25824175824175827,"Our goal with this experiment is to study how overﬁtting relates to the number of linear regions of
deep ReLU networks, in addition to observing the density of linear regions for very high dimensional
image data that lies on a low dimensional manifold. To discover latent low dimensional underlying
structure of data we employ a GAN. Adversarial training of GANs can be effectively applied to learn
a mapping from a low dimensional latent space to high dimensional data (Goodfellow et al., 2014).
The generator is a neural network that maps g : Rk →Rnin. Recently, Karras et al. (2019) introduced
a new generator, StyleGAN, that interpolates better, meaning that it can disentangle the factors of
variation in the dataset. As a follow up, Karras et al. (2020a) train the StyleGAN in a data efﬁcient
manner on the MetFaces dataset. We train a deep ReLU network on the MetFaces dataset with
random labels (chosen from 0, 1) with cross entropy loss. As noted by Zhang et al. (2017), training
with random labels can lead to the DNN memorizing the entire dataset with poor generalization.
Further implementation details are in Appendix I."
VARYING NIN,0.260989010989011,"We compare the log density of number of linear regions on a curve on the manifold with a straight line
off the manifold (see Figure 9). This leads to two observations: 1) the density of the linear regions
decreases as training progresses, in case of overﬁtting, which is in contrast to the scenario without
overﬁtting (Hanin & Rolnick, 2019a) and it ties the pathological behavior of deep ReLU networks to
density of linear regions, 2) the density of linear regions is signiﬁcantly lower on the data manifold
and devising methods to “concentrate” these linear regions on the manifold is a promising research
direction. That could lead to increased expressivity for the same number of parameters."
DISCUSSION AND FUTURE WORK,0.26373626373626374,"5
DISCUSSION AND FUTURE WORK"
DISCUSSION AND FUTURE WORK,0.2664835164835165,"There is signiﬁcant amounts of work in both supervised and unsupervised learning settings for
non-Euclidean data (Bronstein et al., 2017). Despite these empirical results most theoretical analysis
remains agnostic to data geometry, with a few prominent exceptions (Cloninger & Klock, 2020;
Shaham et al., 2015; Chen et al., 2019; Schmidt-Hieber, 2019). We incorporate the idea of data
geometry into measuring the effective approximation capacity of DNNs. We derive average bounds
on the number of linear regions and distance from the linear boundary under the added assumption
that the data is sampled from a low dimensional manifold. Our experimental results corroborate our
theoretical results. We also present insights into overﬁtting in high dimensional datasets where the
data lies on a low dimensional manifold. Estimating the geometry, dimensionality and curvature, of
these image manifolds accurately is a problem that remains largely unsolved (Brehmer & Cranmer,
2020; Perraul-Joncas & Meila, 2013), which limits our inferences on high dimensional dataset to
observations that guide future research. We note that proving a lower bound on the number of linear
regions, as done by Hanin & Rolnick (2019a), for the manifold setting remains open. Our work opens
up avenues for further research that combines model geometry and data geometry and can lead to
empirical research geared towards developing DNN architectures for high dimensional datasets that
lie on a low dimensional manifold."
DISCUSSION AND FUTURE WORK,0.2692307692307692,Under review as a conference paper at ICLR 2022
REPRODUCIBILITY STATEMENT,0.27197802197802196,"6
REPRODUCIBILITY STATEMENT"
REPRODUCIBILITY STATEMENT,0.27472527472527475,"We offer the following details for all the experiments we have performed: hyperparameters, sample
sizes, GPU-hours, CPU-hours, code, neural network architectures, python libraries, input sizes, and
external code bases. We also provide the code with instructions on running it in the readme.txt
in the exp/ folder of the supplementary material. Speciﬁcally, for Sections 4.1 and 4.2 the imple-
mentation details are in Appendix H, Section 4.3 in Appendix I. We also provide additional details
for running the StyleGan2 code and its license in Appendix J."
REFERENCES,0.2774725274725275,REFERENCES
REFERENCES,0.2802197802197802,"Zeyuan Allen-Zhu, Y. Li, and Zhao Song.
A convergence theory for deep learning via over-
parameterization. ArXiv, abs/1811.03962, 2019."
REFERENCES,0.28296703296703296,M. Anthony and P. Bartlett. Neural network learning - theoretical foundations. 1999.
REFERENCES,0.2857142857142857,"Sanjeev Arora, Rong Ge, Behnam Neyshabur, and Yi Zhang. Stronger generalization bounds for
deep nets via a compression approach. ArXiv, abs/1802.05296, 2018."
REFERENCES,0.28846153846153844,"Sanjeev Arora, Nadav Cohen, Noah Golowich, and Wei Hu. A convergence analysis of gradient
descent for deep linear neural networks. ArXiv, abs/1810.02281, 2019a."
REFERENCES,0.29120879120879123,"Sanjeev Arora, Nadav Cohen, Wei Hu, and Yuping Luo. Implicit regularization in deep matrix
factorization. In NeurIPS, 2019b."
REFERENCES,0.29395604395604397,"D. Arpit, Stanislaw Jastrzebski, Nicolas Ballas, David Krueger, Emmanuel Bengio, Maxinder S.
Kanwal, Tegan Maharaj, Asja Fischer, Aaron C. Courville, Yoshua Bengio, and S. Lacoste-Julien.
A closer look at memorization in deep networks. ArXiv, abs/1706.05394, 2017."
REFERENCES,0.2967032967032967,"Peter L. Bartlett, Vitaly Maiorov, and Ron Meir. Almost linear vc-dimension bounds for piecewise
polynomial networks. Neural Computation, 10:2159–2173, 1998."
REFERENCES,0.29945054945054944,"P. P. Brahma, Dapeng Oliver Wu, and Y. She. Why deep learning works: A manifold disentanglement
perspective. IEEE Transactions on Neural Networks and Learning Systems, 27:1997–2008, 2016."
REFERENCES,0.3021978021978022,"Johann Brehmer and Kyle Cranmer. Flows for simultaneous manifold learning and density estimation.
ArXiv, abs/2003.13913, 2020."
REFERENCES,0.30494505494505497,"M. Bronstein, Joan Bruna, Y. LeCun, Arthur Szlam, and P. Vandergheynst. Geometric deep learning:
Going beyond euclidean data. IEEE Signal Processing Magazine, 34:18–42, 2017."
REFERENCES,0.3076923076923077,"Michael M. Bronstein, Joan Bruna, Taco Cohen, and Petar Velivckovi’c. Geometric deep learning:
Grids, groups, graphs, geodesics, and gauges. ArXiv, abs/2104.13478, 2021."
REFERENCES,0.31043956043956045,"Sam Buchanan, Dar Gilboa, and John Wright. Deep networks and the multiple manifold problem.
ArXiv, abs/2008.11245, 2021."
REFERENCES,0.3131868131868132,"G. Carlsson, T. Ishkhanov, V. D. Silva, and A. Zomorodian. On the local behavior of spaces of natural
images. International Journal of Computer Vision, 76:1–12, 2007."
REFERENCES,0.3159340659340659,"Minshuo Chen, Haoming Jiang, Wenjing Liao, and Tuo Zhao. Efﬁcient approximation of deep relu
networks for functions on low dimensional manifolds. ArXiv, abs/1908.01842, 2019."
REFERENCES,0.31868131868131866,"Alexander Cloninger and Timo Klock. Relu nets adapt to intrinsic dimensionality beyond the target
domain. ArXiv, abs/2008.02545, 2020."
REFERENCES,0.32142857142857145,"G. Cybenko. Approximation by superpositions of a sigmoidal function. Mathematics of Control,
Signals and Systems, 2:303–314, 1989."
REFERENCES,0.3241758241758242,"Simon Shaolei Du, Wei Hu, and J. Lee. Algorithmic regularization in learning deep homogeneous
models: Layers are automatically balanced. In NeurIPS, 2018."
REFERENCES,0.3269230769230769,"C. Fefferman, S. Mitter, and Hariharan Narayanan. Testing the manifold hypothesis. arXiv: Statistics
Theory, 2013."
REFERENCES,0.32967032967032966,Under review as a conference paper at ICLR 2022
REFERENCES,0.3324175824175824,"Octavian-Eugen Ganea, Gary Bécigneul, and Thomas Hofmann. Hyperbolic neural networks. ArXiv,
abs/1805.09112, 2018."
REFERENCES,0.33516483516483514,"Sebastian Goldt, Marc Mézard, Florent Krzakala, and Lenka Zdeborová. Modelling the inﬂuence of
data structure on learning in neural networks. ArXiv, abs/1909.11500, 2020."
REFERENCES,0.33791208791208793,"I. Goodfellow, Jean Pouget-Abadie, Mehdi Mirza, Bing Xu, David Warde-Farley, S. Ozair, Aaron C.
Courville, and Yoshua Bengio. Generative adversarial nets. In NIPS, 2014."
REFERENCES,0.34065934065934067,"Ian J. Goodfellow and Oriol Vinyals. Qualitatively characterizing neural network optimization
problems. CoRR, abs/1412.6544, 2015."
REFERENCES,0.3434065934065934,"Ian J. Goodfellow, Jonathon Shlens, and Christian Szegedy. Explaining and harnessing adversarial
examples. CoRR, abs/1412.6572, 2015."
REFERENCES,0.34615384615384615,"Alfred Gray. The volume of a small geodesic ball of a riemannian manifold. Michigan Mathematical
Journal, 20:329–344, 1974."
REFERENCES,0.3489010989010989,"Victor Guillemin and Alan Pollack. Differential Topology. Prentice-Hall, 1974."
REFERENCES,0.3516483516483517,"B. Hanin and M. Nica. Products of many large random matrices and gradients in deep neural networks.
Communications in Mathematical Physics, 376:287–322, 2018."
REFERENCES,0.3543956043956044,"B. Hanin and D. Rolnick. Complexity of linear regions in deep networks. ArXiv, abs/1901.09021,
2019a."
REFERENCES,0.35714285714285715,"B. Hanin and D. Rolnick. Deep relu networks have surprisingly few activation patterns. In NeurIPS,
2019b."
REFERENCES,0.3598901098901099,"Boris Hanin. Universal function approximation by deep neural nets with bounded width and relu
activations. ArXiv, abs/1708.02691, 2019."
REFERENCES,0.3626373626373626,"Boris Hanin and Mihai Nica. Finite depth and width corrections to the neural tangent kernel. ArXiv,
abs/1909.05989, 2020."
REFERENCES,0.36538461538461536,"M. Hauser and A. Ray. Principles of riemannian geometry in neural networks. In NIPS, 2017."
REFERENCES,0.36813186813186816,"Mikael Henaff, Joan Bruna, and Yann LeCun. Deep convolutional networks on graph-structured data.
ArXiv, abs/1506.05163, 2015."
REFERENCES,0.3708791208791209,"K. Hornik, M. Stinchcombe, and H. White. Multilayer feedforward networks are universal approxi-
mators. Neural Networks, 2:359–366, 1989."
REFERENCES,0.37362637362637363,"Arthur Jacot, F. Gabriel, and C. Hongler. Neural tangent kernel: Convergence and generalization in
neural networks. In NeurIPS, 2018."
REFERENCES,0.37637362637362637,"Tero Karras, S. Laine, and Timo Aila. A style-based generator architecture for generative adversarial
networks. 2019 IEEE/CVF Conference on Computer Vision and Pattern Recognition (CVPR), pp.
4396–4405, 2019."
REFERENCES,0.3791208791208791,"Tero Karras, Miika Aittala, Janne Hellsten, S. Laine, J. Lehtinen, and Timo Aila. Training generative
adversarial networks with limited data. ArXiv, abs/2006.06676, 2020a."
REFERENCES,0.38186813186813184,"Tero Karras, S. Laine, Miika Aittala, Janne Hellsten, J. Lehtinen, and Timo Aila. Analyzing and
improving the image quality of stylegan. 2020 IEEE/CVF Conference on Computer Vision and
Pattern Recognition (CVPR), pp. 8107–8116, 2020b."
REFERENCES,0.38461538461538464,"Kenji Kawaguchi, L. Kaelbling, and Yoshua Bengio. Generalization in deep learning. ArXiv,
abs/1710.05468, 2017."
REFERENCES,0.3873626373626374,"Diederik P. Kingma and Jimmy Ba.
Adam: A method for stochastic optimization.
CoRR,
abs/1412.6980, 2015."
REFERENCES,0.3901098901098901,"Thomas Kipf and Max Welling. Semi-supervised classiﬁcation with graph convolutional networks.
ArXiv, abs/1609.02907, 2017."
REFERENCES,0.39285714285714285,Under review as a conference paper at ICLR 2022
REFERENCES,0.3956043956043956,"Dieter Kraft. A software package for sequential quadratic programming. Tech. Rep. DFVLR-FB
88-28, DLR German Aerospace Center — Institute for Flight Mechanics, 1988."
REFERENCES,0.3983516483516483,S. Krantz and Harold R. Parks. Geometric integration theory. 2008.
REFERENCES,0.4010989010989011,"Daniel Kunin, Javier Sagastuy-Breña, S. Ganguli, Daniel L. K. Yamins, and H. Tanaka. Neu-
ral mechanics: Symmetry and broken conservation laws in deep learning dynamics. ArXiv,
abs/2012.04728, 2020."
REFERENCES,0.40384615384615385,"Jaehoon Lee, Lechao Xiao, Samuel S. Schoenholz, Yasaman Bahri, Roman Novak, Jascha Sohl-
Dickstein, and Jascha Sohl-Dickstein. Wide neural networks of any depth evolve as linear models
under gradient descent. ArXiv, abs/1902.06720, 2019."
REFERENCES,0.4065934065934066,"Tengyuan Liang, Tomaso A. Poggio, Alexander Rakhlin, and James Stokes. Fisher-rao metric,
geometry, and complexity of neural networks. ArXiv, abs/1711.01530, 2019."
REFERENCES,0.40934065934065933,"L. Loveridge. Physical and geometric interpretations of the riemann tensor, ricci tensor, and scalar
curvature. 2004."
REFERENCES,0.41208791208791207,"H. Mhaskar and T. Poggio. Deep vs. shallow networks : An approximation theory perspective. ArXiv,
abs/1608.03287, 2016."
REFERENCES,0.41483516483516486,"Federico Monti, D. Boscaini, Jonathan Masci, Emanuele Rodolà, Jan Svoboda, and Michael M.
Bronstein. Geometric deep learning on graphs and manifolds using mixture model cnns. 2017
IEEE Conference on Computer Vision and Pattern Recognition (CVPR), pp. 5425–5434, 2017."
REFERENCES,0.4175824175824176,"Guido Montúfar, Razvan Pascanu, Kyunghyun Cho, and Yoshua Bengio. On the number of linear
regions of deep neural networks. In NIPS, 2014."
REFERENCES,0.42032967032967034,"V. Nair and Geoffrey E. Hinton. Rectiﬁed linear units improve restricted boltzmann machines. In
ICML, 2010."
REFERENCES,0.4230769230769231,"Behnam Neyshabur, Srinadh Bhojanapalli, David A. McAllester, and Nathan Srebro. A pac-bayesian
approach to spectrally-normalized margin bounds for neural networks. ArXiv, abs/1707.09564,
2018."
REFERENCES,0.4258241758241758,"Jonas Paccolat, Leonardo Petrini, Mario Geiger, Kevin Tyloo, and Matthieu Wyart. Geometric
compression of invariant manifolds in neural networks. Journal of Statistical Mechanics: Theory
and Experiment, 2021, 2020."
REFERENCES,0.42857142857142855,"Dominique Perraul-Joncas and Marina Meila. Non-linear dimensionality reduction: Riemannian
metric estimation and the problem of geometric discovery. arXiv: Machine Learning, 2013."
REFERENCES,0.43131868131868134,"Ben Poole, S. Lahiri, M. Raghu, Jascha Sohl-Dickstein, and S. Ganguli. Exponential expressivity in
deep neural networks through transient chaos. ArXiv, abs/1606.05340, 2016."
REFERENCES,0.4340659340659341,"C. Qi, Hao Su, Kaichun Mo, and Leonidas J. Guibas. Pointnet: Deep learning on point sets for
3d classiﬁcation and segmentation. 2017 IEEE Conference on Computer Vision and Pattern
Recognition (CVPR), pp. 77–85, 2017."
REFERENCES,0.4368131868131868,"M. Raghu, Ben Poole, J. Kleinberg, S. Ganguli, and Jascha Sohl-Dickstein. On the expressive power
of deep neural networks. ArXiv, abs/1606.05336, 2017."
REFERENCES,0.43956043956043955,"Nasim Rahaman, Aristide Baratin, Devansh Arpit, Felix Dräxler, Min Lin, Fred A. Hamprecht,
Yoshua Bengio, and Aaron C. Courville. On the spectral bias of neural networks. In ICML, 2019."
REFERENCES,0.4423076923076923,"Joel W. Robbin, Uw Madison, and Dietmar A. Salamon. INTRODUCTION TO DIFFERENTIAL
GEOMETRY. Preprint, 2011."
REFERENCES,0.44505494505494503,"Levent Sagun, Utku Evci, V. U. Güney, Yann Dauphin, and L. Bottou. Empirical analysis of the
hessian of over-parametrized neural networks. ArXiv, abs/1706.04454, 2018."
REFERENCES,0.4478021978021978,"Andrew M. Saxe, James L. McClelland, and Surya Ganguli. Exact solutions to the nonlinear dynamics
of learning in deep linear neural networks. CoRR, abs/1312.6120, 2014."
REFERENCES,0.45054945054945056,Under review as a conference paper at ICLR 2022
REFERENCES,0.4532967032967033,"Johannes Schmidt-Hieber. Deep relu network approximation of functions on a manifold. ArXiv,
abs/1908.00695, 2019."
REFERENCES,0.45604395604395603,"Thiago Serra, Christian Tjandraatmadja, and S. Ramalingam. Bounding and counting linear regions
of deep neural networks. In ICML, 2018."
REFERENCES,0.45879120879120877,"Uri Shaham, Alexander Cloninger, and Ronald R. Coifman. Provable approximation properties for
deep neural networks. ArXiv, abs/1509.07385, 2015."
REFERENCES,0.46153846153846156,"Samuel L. Smith and Quoc V. Le. A bayesian perspective on generalization and stochastic gradient
descent. ArXiv, abs/1710.06451, 2018."
REFERENCES,0.4642857142857143,"Weijie J. Su, Stephen P. Boyd, and Emmanuel J. Candès. A differential equation for modeling
nesterov’s accelerated gradient method: Theory and insights. In J. Mach. Learn. Res., 2016."
REFERENCES,0.46703296703296704,"Christian Szegedy, W. Zaremba, Ilya Sutskever, Joan Bruna, D. Erhan, Ian J. Goodfellow, and
R. Fergus. Intriguing properties of neural networks. CoRR, abs/1312.6199, 2014."
REFERENCES,0.4697802197802198,"Matus Telgarsky. Representation beneﬁts of deep feedforward networks. ArXiv, abs/1509.08101,
2015."
REFERENCES,0.4725274725274725,"Joshua B. Tenenbaum. Mapping a manifold of perceptual observations. In NIPS, 1997."
REFERENCES,0.47527472527472525,Z. Wan. Geometric interpretations of curvature. 2016.
